,date,title,content
0,2015/04/30,國泰房地產指數調查 Q1 3大指標萎縮 房市「相當冷清」,國泰建設今(30)日發布第1季國泰全國房地產指數調查，全台房市持續呈現「盤整觀望」結構，主要反映在推案量、銷售率與成交量的萎縮，本季新推個案數共224件，年減逾20%，推案戶數計有11907戶，年減25%，個案總可銷金額為2058億元更較去年同期大減近35%。國泰建設指出，第1季由於大巨蛋、桃園航空城、台灣塔等各地區原定重大建設開發案，陸續出現可能停止或變更的衝擊，再加上房地合一實價課稅政策規劃前後出現先輕後重的改變，導致市場悲觀預期不易改變。整體而言，第1季市況屬於「相當冷清」結構，六大都會區的成交量均減少，議價空間均擴大。就各地區來看，第1季台北市無論單價高低，多數個案銷售狀況均不理想，主因台北市除了房價過高，購屋者卻步成為後續發展的具體困境。新北市價格與成交量的同步下修，市場反轉程度為各地區最明顯，市場累積餘屋問題是重大隱憂。桃竹地區由於航空城話題鬆動，以及長期累積餘屋，成為最大問題；台中市房市從上季的穩定擴張重新回到量縮趨勢，後續價格能否再獲支撐需密切注意。台南市房市仍處長期相對高檔位置，惟本季的價跌是否會影響後市的交易量，是短期應重視的方向；而高雄市已從穩定轉為保守，偏低的銷售率與持續高檔的推案量，成為後市發展壓力。
1,2015/04/30,宸鴻Q2落底、本業損平或小賺 Q3逐季揚,F-TPK宸鴻()今(30)日召開法人說明會，第1季出現虧損，每股虧損3.06元，第2季進入電子業傳統淡季，雖有Apple Watch訂單穩定出貨的加持，但預期營收仍將較首季下滑，宸鴻強調，第2季將是今年谷底，本業力拚損平或是小幅獲利，第3季在新品上市推升下營運增溫，可望呈現逐季上揚的趨勢。蘋果Apple Watch在4月下旬上市開賣，引來美國、中國等市場消費者訂購熱潮，法人相當關注Apple Watch對宸鴻業績的挹注，宸鴻今日指出，穿戴式裝置產品出貨符合預期，將是第2季營收的重要支撐。宸鴻指出，第2季進入電子業傳統淡季，預估將是今年谷底，手機及平板出貨仍將是下滑的情況，穿戴式裝置正常出貨，在產品組合優化加上成本控制效益顯現，預估第2季營收季減約15-20%，營業利益可以損平甚至是小幅獲利。宸鴻說，6月開始2家新手機客戶及新產品陸續出貨，將推升營運走出谷底，下半年表現較上半年優，可望從第3季起逐季走揚，保守估計上下半年營收比重為4:6。宸鴻公布第1季自結營運成果，合併營收289.5億元，季減26.9%，年增8.8%，主要受季節性因素、工作天數減少及平板電腦需求較疲弱影響等因素影響，營業毛利率為6.5%，營業利益0.9億元，營業利益率0.3%，本業小幅獲利，但因業外損失增加，且認列火災損失約12億元，稅後淨損10.14億元，稅後稀釋每股虧損3.06元。
2,2015/04/30,板橋大遠百創「運動專區」可免費使用健身器材,因應休閒運動越來越受到國人重視的趨勢，遠百()旗下板橋大遠百開啟新形態購物體驗，於8樓規畫「Fitness Center」I運動專區，成為百貨全新概念店，總合近百坪的面積讓消費者選擇最多、優惠最讚，可望藉此吸引更多家庭全客層。板橋大遠百在原有的7樓保健運動專區，再集結BH、Reebok、TAKASIMA高島、JOHNSON喬山、「J&H晶璽」AiBi五大品牌健身器材於 8樓規畫出「Fitness Center」I運動專區，成為百貨全新概念的購物區塊，以總合近百坪的面積稱霸雙北。「Fitness Center」I運動館內除了展示和販售，再加入「健康體適能館」概念，擺置多台電動跑步機、飛輪健身車、按摩椅、美腿機等健康器材，不管是想跑步還是踩健身車，都讓來客可不限時間的使用健身器材，考量到運動後流汗會口渴，現場還免費提供的礦泉水與紙手帕，讓消費者除了逛街購物，還能有健身運動的新選擇。
3,2015/04/30,三喜臨門 信義房屋囊括品牌、服務及CSR三冠王,房仲龍頭信義房屋，4月三喜臨門一口氣囊括品牌、服務及CSR三冠王，榮獲《遠見雜誌》企業社會責任獎「CSR大調查-服務與金融組」和「公益推動組」雙首獎、《天下雜誌》「金牌服務大賞房屋仲介類第一名」以及《30雜誌》「Young 世代品牌大調查最常使用&最想擁有品牌」雙料冠軍。信義房屋總經理薛健平表示，未來將持續朝世界級服務業的永續目標前進。信義房屋獲第十一屆《遠見雜誌》「CSR年度大調查」與「公益推動組」雙首獎，與台達電子並列本屆最大贏家。評審指出，信義房屋從內部最高層推動CSR工作，更從日常營運落實社會企業責任理念；另一方面，信義房屋自2004年起推出以人為本的「社區一家計畫」，鼓勵全台民眾主動關心及參與社區事務，10年吸引全台6671個社區提案，協助1271個社區圓夢，因此得以從60家企業脫穎而出，榮獲「公益推動組」首獎殊榮，這也是房仲業首度勇奪遠見CSR雙首獎。 其次，《天下雜誌》針對21個行業進行「2015金牌服務業調查」，信義房屋也榮獲房屋仲介類第1名。《天下雜誌》指出，信義房屋在各大指標幾乎皆居房仲之冠，面對房市冷清的挑戰，厚實根基特別能展現成效，除對主力族群的服務不斷精細外，更重要的關鍵就是抓住年輕人的心，推出「數位宅妝」APP、經營6個不同的粉絲專頁等，成功抓住宅男、鄉民及婉君的味口。由《30雜誌》主辦的「Young世代品牌大調查」，信義房屋則以貼近年輕人的創新品牌策略及服務，成為25歲-44歲Young世代房仲類別「最愛使用品牌」及「最想擁有品牌」雙料冠軍。信義房屋提出「數位宅妝」透過數位軟體模擬展現居家裝潢設計，讓年輕人一秒鐘預見家的樣貌；而「集氣30 天 菜鳥開大絕」徵才計畫則徹底翻轉傳統雇傭關係，提供30天工作鑑賞期及轉職金的創新做法，深獲年輕人肯定，顯示信義房屋讓年輕人看到未來更多的可能性，大幅提升Young世代對於品牌的認同感。
4,2015/04/30,**台股集中市場30日信用交易融券張數345376張較29日+ 10735張,**台股集中市場30日信用交易融券張數345376張較29日+ 10735張
5,2015/04/30,◆投信連續3日賣超個股,投信連續3日賣超個股1.投信連續賣超3日的股票(3474)華亞科、 (2002)中鋼  、 (2409)友達  、 (2344)華邦電、 (2492)華新科2.投信連續賣超2日的股票(3474)華亞科、 (2409)友達  、 (2344)華邦電、 (2610)華航  、 (2368)金像電3.投信當日(30)賣超的股票(3474)華亞科、 (2368)金像電、 (2610)華航  、 (1708)東鹼  、 (2409)友達
6,2015/04/30,◆投信連續3日買超個股,投信連續3日買超個股1.投信連續買超3日的股票(3481)群創  、 (2883)開發金、 (006205)FB上証、 (2882)國泰金、 (2634)漢翔2.投信連續買超2日的股票　(3481)群創  、 (2883)開發金、 (006205)FB上証、 (2401)凌陽  、 (2634)漢翔3.投信當日(30)買超的股票(3481)群創  、 (2883)開發金、 (2401)凌陽  、 (006205)FB上証、 (2344)華邦電
7,2015/04/30,◆外資連續5日賣超個股,外資連續5日賣超個股1.外資連續賣超5日的股票(2356)英業達、 (2903)遠百  、 (00632R)T50反1、 (1402)遠東新、 (3231)緯創2.外資連續賣超4日的股票(2903)遠百  、 (2356)英業達、 (00632R)T50反1、 (3231)緯創  、 (1216)統一3.外資連續賣超3日的股票(2409)友達  、 (3231)緯創  、 (2903)遠百  、 (2356)英業達、 (1216)統一4.外資連續賣超2日的股票(2409)友達  、 (3231)緯創  、 (2356)英業達、 (3474)華亞科、 (2903)遠百5.外資當日(30)賣超的股票(2409)友達  、 (2330)台積電、 (3231)緯創  、 (3481)群創  、 (3474)華亞科
8,2015/04/30,◆外資連續5日買超個股,外資連續5日買超個股1.外資連續買超5日的股票(2885)元大金、 (2891)中信金、 (2883)開發金、 (2884)玉山金、 (2330)台積電2.外資連續買超4日的股票(2885)元大金、 (2883)開發金、 (2884)玉山金、 (2891)中信金、 (2330)台積電3.外資連續買超3日的股票(2885)元大金、 (2884)玉山金、 (2303)聯電  、 (2883)開發金、 (2891)中信金4.外資連續買超2日的股票(2885)元大金、 (2884)玉山金、 (2303)聯電  、 (2886)兆豐金、 (2891)中信金5.外資當日(30)買超的股票(2885)元大金、 (2884)玉山金、 (2303)聯電  、 (2890)永豐金、 (2324)仁寶
9,2015/04/30,華邦電Q2展望保守 蘋果、三星、微軟訂單可望拉抬業績,華邦電()今(30)日召開法人說明會，公布第1季合併財務報告，首季合併營收97.24億元，季增2%，每股盈餘0.27元，由於目前手機市場新機效應未彰顯，電視需求也不如預期，對第2季保守看待；外傳吃下蘋果Macbook Pro訂單，加上打進三星S6供應鏈，及可望切入微軟供應鏈，法人預期將成為拉抬業績的重要動能。華邦電含新唐等子公司第1季合併營收97.24億元；營業毛利率為32%，較去年第4季營業毛利率31%增加1個百分點，稅後純益約10.37億元，每股盈餘0.27元，較去年第4季每股盈餘0.28元略減，淡季業績表現穩定。華邦電表示，就記憶體事業群部份來看，第1季利基型記憶體(Specialty DRAM)營收占整體季營收52%，較前一季減少1%，營收略幅下滑主因為PC需求減緩；行動記憶體(Mobile DRAM)占整體季營收13%，營收較前一季增加12%，成長動能來自優化產品與客戶組合的綜效。另外，快閃記憶體(Flash Memory)占整體季營收35%，市場價格競爭狀況已減緩，營收和毛利率表現和前一季持平。1Gb code storage Flash產品占快閃記憶體營收比重則由前一季2%提升至4%。華邦電預估，今年手機產品年增率13%，與去年成長持平；PC加上平板產品市場預估將下滑2%，比去年年增2%弱；TV產品市場成長預估約3%，與去年成長持平；至於DRAM市場，預期下半年將有支撐，主要受惠於下半年新款iPhones將增加1G的規格。華邦電強調，利基型DRAM今年仍然穩定，Nor Flash產品市場也有提升規格的趨勢，加上物聯網等應用的需求成長，有助華邦電的營運；華邦電表示，去年資本支出130億元，月產能增加近1萬片，今年產能逐步開出，第3季將達每月4.4萬片。法人看好來自蘋果、三星、及第2季可望切入的微軟Surface Pro 4等訂單的挹注，可望進一步拉抬業績，在NOR Flash市占提升，車用記憶體需求強勁下，今年營收成長可望超過1成。
10,2015/04/30,政翔1個月飆漲1.2倍！櫃買發新聞示警,政翔()4月短短一個月，股價從30.7元狂飆至69.6元，漲幅高達1.2倍！櫃買中心雖已2度對政翔列入「關禁閉」人工管制撮合，並採全額交割處置，但政翔還是持續狂飆。櫃買中心再度以「高規格」對待政翔，主動發佈新聞，重申政翔本益比為負值、股價淨值比達4.81，加上董事持股不足達3個月以上，政翔已被列入「公開資訊觀測站」財務重點專區，提醒投資人注意交易風險！櫃買中心指出，政翔因價格異常波動，為保護投資人權益並提醒注意交易風險，公告自104年4月13日起採取預收款券及管制撮合時間之處置措施，惟政翔價格仍呈現異常波動，自104年4月16日起至4月29日經再次處置。但政翔股價價還是異常上漲，因此再度列為公布注意交易資訊。櫃買中心表示，政翔104年2月及3月自結每股盈餘各為0.03元及0.1元，且本益比為負值、股價淨值比達4.81；同時因董事持股不足達3個月以上，政翔已被列入「公開資訊觀測站」財務重點專區，警示投資人。櫃買中心呼籲投資人買賣政翔股票，應隨時注意該公司在「公開資訊觀測站」發布之公告及重大訊息，且參酌財務業務基本面資料審慎為之，並注意交易風險。
11,2015/04/30,力成Q2營收估增5-10% 毛利率也向上 營收逐月走揚,IC封測力成()今(30)日舉行法說會，展望第2季，總經理洪嘉鍮表示，第2季營收可望逐月成長，單季營收增幅可望達5-10%，而第3季預期也可較第2季好，在毛利率方面，第2季毛利率可望持續改善，第3季力拚拉升到20%。洪嘉鍮表示，第2季營收與獲利都會持續改善，董事長蔡篤恭給的營運目標也是提升毛利率，就月營收走勢而言，4、5、6月營收可望逐月上揚，其中行動記憶體需求仍穩健向上，商品型與消費型的DRAM需求則持續放緩。FLASH方面，洪嘉鍮指出，智慧型手機需求穩定，高階手機需求向上，但低階則相對走平，不過行動記憶體的容量變大，對封測需求也增加；SSD(固態硬碟)方面，第1季需求比較緩和，但第2季出貨量也回溫，看好第3季出貨可望持續上揚。邏輯IC方面，第2季表現相對平淡，其中超豐部分預期與第1季持平，力成的部分以高階為主，新客戶拉貨也遞延，不過已過客戶認證，因此第3季就會貢獻營收，第3、4季預期會向上增溫。在新產能包含覆晶封裝(Flip Chip)與Bumping(凸塊)方面，洪嘉鍮表示，已經耕耘經營4-5年，是未來成長動能，近期也興建新產能，部分已通過客戶認證，預期第3、4季營收貢獻度明顯增加。董事長蔡篤恭表示，第1季力成營運基期低，因此第2季營收成長幅度佳，估中位數的增幅，法人看好有5-10%，第3季預期會持續成長，毛利率方面，第2季預期會較第1季改善，第3季可望更好，洪嘉鍮則看好可望上看2成水準。
12,2015/04/30,勞動節前夕送大禮！彰銀加薪4.68% 超越歷年水準,"彰銀()去(2014)年獲利亮眼，盈餘大幅成長，為激勵員工士氣，今(30)日董事會決議通過全面調高員工午餐費及辦理年度調薪，平均加薪幅度達4.68%，超越歷年調薪水準。彰銀連續5年獲利超過100億，董事長張明道之前表示，未來百億盈餘不再是「目標」而是「底限」。彰銀為積極響應政府呼籲企業加薪的政策，本次將員工午餐費調高至2,400元，同時也辦理年度調薪，調薪方式除固定加薪，確保基層員工生活水準外，另為激勵績效優異員工及落實獎酬差異化，再依據員工個人績效表現給予不同比率調薪，績效優異的員工含午餐費總計加薪幅度可達6%~7%，生效日溯自4月1日起。彰銀表示，該行在去年獲得證交所列入「臺灣高薪100指數」之成分股，顯示該行在「員工平均薪酬」、「淨利」、「每股淨值」及「員工總薪酬」等多項量化標準均獲肯定。本次該行響應政府政策，在勞動節前夕再宣布全面加薪利多，足見其照顧員工，落實企業社會責任之決心。彰銀表示，員工是企業最重要的資產，為留住優秀人才，保持薪資及人才市場競爭力，本次提高午餐費及給予較高幅度之年度調薪，期盼能夠激勵員工士氣，再創亮麗佳績。彰銀強調，去年底董事改選後，在財政部經營團隊董事長張明道、總經理施建安之帶領下，公司治理完善和諧，勞資關係趨於穩定，員工信心及士氣大增，對於公司發展前景看好，業績更不斷成長。彰銀也表示，歡迎主動積極、具高度服務熱忱及追求自我成長與挑戰的金融同業人士，一起加入彰銀幸福企業的行列，為百年老店注入新活力，共創更高價值。"
13,2015/04/30,又是匯損！勤誠首季EPS 0.73元 Q2業績拚增2成,伺服器機殼廠勤誠()公布首季財報，首季因工作天數減少以及產業淡季，首季合併營收10.15億元，較上季減少18.4%，年增率4.86%，但毛利率28.8%，略優於上季的28.17%，不過與去同期相較，卻下滑了4個百分點。但勤誠首季也受到匯損拖累，首季匯損達880萬元，稅後淨利8758萬元，季減23.8%，年減35.6%，每股稅後盈餘僅0.73元，低於法人預期。由於第2季大陸白牌伺服器需求升溫，客戶加速釋出訂單，勤誠原本就以大陸白牌伺服器客戶為業績主力，因此第2季業績升溫可期，法人看好勤誠第2季合併營收將有機會衝過12億元，較首季成長2成。不過法人也指出，白牌伺服器毛利率較低，如勤誠第2季白牌營收比重攀高，反而需留意毛利率的變化。法人原本對於勤誠今年的獲利表現，看好將有賺進半個股本實力，不過首季EPS僅0.73元，恐也將面臨法人下修今年獲利預估。
14,2015/04/30,國壽、大陸中壽及陸家嘴國壽合作「雙向理賠」,國泰金()旗下國泰人壽今(30)日宣布，日前通過與大陸中國人壽簽訂「相互委託辦理保險理賠服務契約」及陸家嘴國泰人壽委託國泰人壽協助辦理理賠服務契約，未來無論國泰人壽、陸家嘴國泰人壽、大陸中國人壽保戶往來兩岸發生保險事故時，都可以直接向當地合作保險公司服務櫃檯提出理賠申請。國泰人壽表示，繼去年(2014)年通過委託陸家嘴國泰人壽協助辦理理賠服務及今年初(1/20)獲金管會核准，成為台灣「首家」取得主管機關許可與大陸保險業簽訂合作契約的壽險業者後，為擴大兩岸理賠服務範圍，國泰人壽日前通過與大陸中國人壽簽訂「相互委託辦理保險理賠服務契約」及陸家嘴國泰人壽委託國泰人壽協助辦理理賠服務契約，未來無論國泰人壽、陸家嘴國泰人壽、大陸中國人壽保戶往來兩岸發生保險事故時，都可以直接向當地合作保險公司服務櫃檯提出理賠申請，不必等回台灣或大陸後才能提出理賠申請，讓兩岸保戶可以更快速獲得所需的理賠給付及提供當地就近緊急醫療院所住院諮詢援助等協助。國壽表示，國泰人壽與大陸中國人壽分別是台灣與大陸地區最大的人壽保險公司，雙方的合作將可串連兩岸最緊密的服務網絡。國泰人壽保戶無論是旅遊或出差，只要在大陸地區發生保險事故，均可在大陸中國人壽各地服務櫃檯申辦理賠，或撥打國泰人壽海外急難救助專線+886-2-55595110 按2聯繫，就可以取得旅遊支援或緊急醫療協助及醫療費用墊付等服務。如果大陸中國人壽的保戶來台遇到保險事故，以日前復興航空墜河事件，30餘位大陸旅客受難，其中15位旅客是大陸中國人壽承保的團體，國泰人壽第一時間派員主動關懷、慰問受難保戶及其家屬，並即時提供大陸旅客有關保險理賠諮詢與服務。國泰人壽林昭廷副總表示，國泰人壽與大陸中國人壽的服務據點數量分別居台灣及大陸保險業界之冠，服務網絡遍布城市及鄉鎮，雙方基於保戶服務相互攜手合作，均可以善用彼此地利優勢，在第一時間提供彼此保戶最便利、迅速的理賠服務。以大陸中國人壽為例，除了在台灣民眾最常經商、旅遊的城市如北京、上海、天津、廈門等36個城市都設有省分公司之外，遠到哈爾濱、新疆、海南島、甚至西藏都設有服務據點，國泰人壽保戶如果在大陸地區發生保險事故，可以在大陸中國人壽將近3000個服務中心取得即時的協助，如果遇到重大事故，大陸中國人壽也將主動關懷、慰問保戶，並協助國泰人壽保戶申請、取得與保險理賠有關的文件。推動兩岸理賠服務，可望提高被保險人的風險照護，國泰人壽秉持「創新服務、追求卓越」精神，持續開發多元便利的服務管道，透過三家保險公司在台灣及大陸地區綿密的服務據點，讓兩岸保戶能在當地便利的提出理賠申請，突破以往回到國內才能申請理賠的限制，節省許多寶貴的時間，且迅速的獲得理賠給付，對於兩岸民眾往來交流將更有保障。
15,2015/04/30,富鼎投顧盤後-震盪壓回是為了走的更遠,◆盤勢分析美國由於第一季經濟成長疲弱，GDP季增年率初值僅0.2％，遠低於市場預期的1％。而投資人仍憂慮聯準會可能過早升息，美股三大指數昨晚收黑。終場周三下跌74.61點，收於18035.53點，跌幅0.4％。標普500指數下跌7.91點，收於2106.85點，跌幅0.4％。指數下跌31.78點，收於5023.64點，跌幅0.6％。以聯準會周三公布的會後聲明，坦承首季經濟成長表現疲弱，但認為只是受到暫時性因素影響，未對升息時間作進一步暗示，意即不排除在未來數月提升短期利率的可能性。不過，市場已開始預期至少9月才升息的可能性增加，使美股跌勢獲得抑制。升息預期之時間點也符合我們半年前之預期，至於美股看法我們認為還是震盪箱型區間格局，這樣的趨勢仍會存在一段時間！台股今日持續向下修正，權值股靠鴻海撐盤，台積電、台塑化、聯發科等個股則休息在盤下震盪，聯發科跌幅更逾1%，高價股大立光、漢微科也疲軟維持盤下震盪，拖累指數早盤一度翻黑，午盤前多頭奮起，傳產汽車、營建股帶頭衝，支撐指數收斂跌幅重回平盤價位附近，9800點附近震盪小跌。台股今日再度面臨修正壓力，權值股普遍表現平淡，其中鴻海、台化力守平盤以上，不過台積電、台塑化、南亞、國泰金與聯發科則都在盤下走跌，聯發科跌幅更逾1%以上，壓抑大盤走勢。相對傳產股，電子股表現平淡，僅靠零星類股撐盤，整體而言，台股今日持續面臨修正壓力，權值股表現平淡，指數也向下走弱，盤中在傳產股力拱下，收斂跌幅接近平盤價位，上櫃市場則維持紅盤小漲格局，表現相對大盤強勢，法人認為，指數仍在多頭格局，短線國際股市走勢持穩，仍有上攻機會。富鼎投顧
16,2015/04/30,華信投顧-國際股市全軍覆沒,◆盤勢分析週四歐美股市全面收黑，德國股市更是重挫3％。歐美股市的下跌，相當程度的衝擊了今天的亞洲股市，除了中國股市還能漲跌互見外，其他主要股市幾乎全面重挫。國際股市的疲弱，對於本就信心不足的台灣股市，當然造成相當沈重的壓力，這也就是為什麼，台灣股市全天都維持在平盤附近呈現狹幅盤整走勢，但是最後一盤卻急殺而下，使得大盤連續第三天收黑的主要原因。今天外資買超金額銳減，以及出現殺尾盤的走勢，最主要的原因，應該在於國際股市今天幾乎全軍覆沒。雖然和指數，看起來還沒出現波段回檔危機，但是之前領導歐洲股市飆漲的德國股市，卻已經跌破代表中期多空分界點的季線，而且頭部型態已經成形；指數的K線型態和德國股市差不多。韓國股市已經連跌5天，雖然還沒破壞上升結構，但若下週繼續收黑，就須提防作頭的可能。至於年初走勢最強勁的東南亞股市，都已經紛紛出現作頭跡象。此外，近日的回檔，不但已經跌破季線，而且短期頭部已經成形，萬一持續回檔，就須提防在蹺蹺板效應下，繼續升值的可能。五月份需要注意的事項包括：五月底將進入繳稅旺季；全台灣將啟動限水限電措施；5/15前所有上市櫃公司都將公布財報；美國聯準會的利率決策、國際股市走向；6/1將實施的擴大漲跌停板限制。以上種種因素，對五月份國際以及台灣股市的走向，多少都具有某種程度的影響力，也將是五月份的觀察重點。如果下週一早盤就快速回檔下探10日線，則拉尾盤留下影線、甚至收紅的可能性將是相當高的。但若繼續收黑，恐怕就不是中小黑可以打發的，而且短期內恐將仍有繼續下跌的空間。近期在操作上，除非出現明確的轉強轉弱訊號，否則暫勿輕易出手。李永年分析師★ 此研究報告著作權屬華信證券投資顧問(股)公司，切勿盜用或翻印，否則追究責任，決不寬貸 ★ 所有資料僅供參考，本公司不負盈虧責任，洽02-2392-3988理財專員
