,date,title,content
982,2015/04/20,半導體產業協會年會4/21登場 聚焦半導體全球競爭優勢,台灣半導體產業年度盛事2015台灣半導體產業協會(TSIA)年會將正式展開，半導體協會指出，今年主題是加強台灣半導體產業之全球競爭優勢，會中邀請台積電()共同執行長魏哲家與英特爾()副總裁王文漢發表專題演講，魏哲家將闡述半導體的影響與貢獻，王文漢則將分析創造美好未來，智能無處不在之觀點。半導體產業協會指出，今年年會主題聚焦「如何加強台灣半導體產業之全球競爭優勢」，會中安排世界級產研界之領袖演講，邀請台積電總經理暨共同執行長魏哲家擔任專題演講貴賓，闡述「半導體的影響與貢獻」。而邁向物聯網IoT時代，主辦單位也邀請英特爾副總裁暨實驗室執行總監王文漢由美來台演講，主題是「Inventing a Better Future: Intelligence Everywhere (創造一個更美好的未來：智能無處不在)」，將介紹設備越來越小，數據卻越來越大，當計算功能付諸到電子裝置中，所帶來的智能體驗。今年年會也將舉辦一場「強化台灣半導體產學之世界競爭力」高峰論壇，由TSIA理事長暨鈺創科技董事長盧超群博士，以及TSIA監事長暨鉅晶董事長蔡國智共同主持，邀請科技部部長徐爵民、台灣玉山科技協會理事長暨中磊電子暨怡和創投董事長王伯元、奈米國家型科技計畫總主持人暨交通大學講座教授暨前交大校長吳重雨、台灣併購與私募股權協會理事長暨眾達國際法律事務所主持律師黃日燦、聯發科副總經理張垂弘、TSIA理監事會顧問葉瑞斌、TSIA常務理事暨華邦電總經理詹東義、欣銓董事長暨旺宏電子總經理盧志遠、TSIA常務理事暨聯電執行長顏博文，透過產官學研商各界代表針對「強化台灣半導體產學之世界競爭力」主題進行交流，將與台下600多位參與者互動。為鼓勵國內博士研究生及博士後研究員積極從事半導體之學術研究、發明或致力投入產業合作，設立「 TSIA半導體獎」，第二屆「TSIA博士研究生半導體獎」獎項，由台大、交大、成大、清大獲獎，將由南亞科總經理高啟全、日月光資深副總洪松井、及矽品副總馬光華等人頒發。
983,2015/04/20,3月外銷訂單年增1.3% 資訊通信產品年增超過1成最多,經濟部今(20)日公布3月外銷訂單384.3億美元，較去年同期增加4.9億美元或增1.3%，按計算增4.8%；第1季外銷訂單共1073.6億美元，季減少252.9億美元或減19.1%，但較去年同期增加26.0億美元或增2.5%。經濟部指出，3月主要訂單貨品類別包括資訊通信、電子和機械產品接單年增率均呈正成長，又以資訊通信產品年增率達12.9%表現最佳。其中，資訊通信產品3月外銷訂單為106.0億美元，月增32.8%，年增12.9%，成長最為明顯，主因部分國際品牌大廠手持行動裝置需求續增，帶動組裝代工和相關產業供應鏈訂單增加，又以接自美國增6.6億美元、歐洲增4.9億美元較多；第1季較去年同期增13.6%。電子產品3月外銷訂單為94.3億美元，月增22.7%，年增1.5%，主因先進製程晶圓代工、封測、DRAM等需求續增所致，以接自美國增4.4億美元、歐洲增2.5億美元較多，惟日本減3.2億美元；第1季較上年同期增5.3%。而精密儀器產品3月外銷訂單25.8億美元，月增28.9%，年減9.6%，則因中國大陸產能陸續開出，面板競爭激烈價格下跌，加上部分觸控面板廠商接單減少所致，以中國大陸及香港接單減1.8億美元較多；第1季年減5.9%。從主要訂單地區來看，經濟部指出，美國及歐洲訂單均較去年同期正成長。其中，美國訂單99.1億美元，月增 25.3%，年增16.7%，而歐洲訂單73.8億美元，月增23.7%，年增9.1%，為連續20個月正成長不過，中國大陸及香港訂單96.9億美元，月增37.4%，年減3.8%，以化學品減少2.0億美元或減22.3%較多；第1季較去年同期衰退2.5%。另一方面，東協六國43.4億美元、日本訂單26.0億美元，均較去年同期分別衰退5.4%、22.8%，成為歐美之外，接單衰退的主要地區。
984,2015/04/20,三月份外銷訂單 月增率達28.6%,經濟部統計處今天(4/20)公布三月份外銷訂單統計，金額為三百八十四點三億美元，較上個月增加八十五點四億美元，月增率達百分之二十八點六。而今年第一季外銷訂單金額為一千零七十三點六億美元，年增率百分之二點五。統計處指出，三月份外銷訂單較二月大幅成長，除了農曆春節因素之外，資訊通信產品因部分國際手持行動裝置大廠需求增加，帶動組裝代工及相關產品供應鏈，年增率達百分之十二點九。展望未來，統計處表示，預估全球手持行動裝置成長將趨緩，個人電腦及平板電腦需求不足，加上國際競爭激烈，短期恐減緩資訊通信電子產品接單，預估四月份整體外銷訂單金額，會較三月份略減。
985,2015/04/20,亞洲投顧盤後,"◆盤勢分析歐美股市普遍跌幅都在1%以上，想當然爾今天台股必定有壓，不過我們上週說到，現階段必須要把指數和結構分開來看，指數的後勢老師認為不用多談，因為一定在升息與不升息之間上上下下，到底要在高檔整理多久，沒人說得準，且今日大盤下跌外資又反手買進期指多單，未平倉水位空又變成多，所以外資都在忽多忽空的情況下，太鑽研指數的意義並不太。結構來看，目前要操作的話，仍是以中小型利基股為主，且要嚴設停損，上週我們舉了2383台光電的例子，說明不是有漲就是娘，需要搭配整體的技術走勢，週二大漲，結果漲一天跌了三天，漲的都跌掉了，由此來看，月線跌破基本上不是要轉弱就是要進入整理，這類的我們不建議操作，但換個方向思考，站回月線且先前已整理一段是不是可以進場，我們之前介紹過的的華泰，看來是個不錯的選擇。今天我們手中的個股，幾乎都不管大盤，普遍能維持紅盤，早盤跌幅稍大的漢翔，午盤後竟也神奇的由黑翻紅，可見選股其實很重要，接下來就看大盤反彈時個股是否能借勢拉高，安全能加碼時，我們會請大家加碼，待訊即可。作者:亞洲投顧 謝宗霖 分析師以上資料僅供參考,投資時應審慎評估"
986,2015/04/20,3月外銷訂單年增1.3%；首季年增2.5%,"MoneyDJ新聞 2015-04-20  記者 新聞中心 報導經濟部統計處於今(20)日公布3月外銷訂單數據，3月外銷訂單384.3億美元，月增28.6％，經季節調整後增1.9％；如與去年同期相較，則年增1.3％，按計算增4.8％。累計今年第一季外銷訂單1,073.6億美元，季減19.1％、年增2.5％。以3月主要外銷訂單貨品類別來看，包括資訊通信、電子及機械產品接單年增率均呈正成長，尤以資訊通信產品年增率達12.9%表現最佳。資訊通信產品當月外銷訂單106億美元，月增32.8%、年增12.9%，主因部分國際品牌大廠手持行動裝置需求續增，帶動組裝代工及相關產業供應鏈訂單增加所致，其中，以接自美國增6.6億美元、歐洲增4.9億美元較多；累計資訊通信產品今年第一季外銷訂單年增13.6%。從外銷訂單動向指數來看，統計處指出，3月外銷訂單月增28.6%、年增1.3%；其中，電子產品因先進製程晶圓代工、封測、DRAM等需求續增，惟接自日本訂單明顯減少35.2%，致其僅年增1.5%；精密儀器則因中國大陸產能陸續開出，面板競爭激烈價格下跌，加上部分觸控面板廠商接單減少，以致年減9.6%；在傳統產業接單上，以機械年增9.8%表現較佳，而塑橡膠製品及化學品續受國際油價低檔影響，接單分別下滑9.1%及9.0%；基本金屬製品受全球鋼鐵產能過剩，鋼價下跌影響，年減5.9%。展望未來，統計處分析，由於全球手持行動裝置成長趨緩，個人電腦及平板電腦之需求不足，加上國際競爭激烈，短期恐減緩資訊通信及電子產品的接單成長動能，惟穿戴裝置、物聯網之新興應用，亦有助驅動下一波商機；傳統接單貨品除機械穩定成長外，受到油價低檔盤旋及國際鋼價下跌影響，塑化製品、基本金屬及油品接單，短期內仍顯疲弱。 統計處指出，據外銷訂單受查廠商對4月接單看法，預期本月接單將較3月增加之廠商家數占25.5%，持平者占57.1%，而減少者占17.4%，致以家數計算之動向指數為54.1；若以接單金額計算之動向指數則為47.9，預期4月整體外銷訂單金額將較3月略減；觀察我國接單前三大主要貨品之廠商對4月接單看法，電子產品以接單金額計算之動向指數為52.5，預期接單可望增加；資訊通信產品、精密儀器以接單金額計算之動向指數分別為44.2及45.8，接單可能減少。"
987,2015/04/20,鉅亨晚報 2015年4月20日,■ 馬英九總統即將於5月20日就任7周年，行政院要求各部會以「7年來，台灣更幸福了」為主軸，透過各管道宣傳政績，財政部長張盛和今(20)日在立法院財委會表示，7年來政府做了不少事情，不要只是一句「人民無感」，就把政府踩在腳底下，這對民眾也沒有好處。■ 台灣今(20)日上午9時42分發生地震，台北市震度3級，證交所表示，電腦及網路系統經檢查一切正常。台灣今日上午發生有感地震，震央在花蓮東方外海76.2公里處，深度17.5公里，全台都感到搖晃，宜蘭、新北市震度4級，台北市、花蓮、南投等震度3級。■ 中國國家主席「習近平」今天啟程訪問巴基斯坦，預計將宣布對巴基斯坦投資460億美元。這次訪問是「習近平」今年首次出訪，焦點將集中在推動「中巴經濟走廊」建設，可從新疆西部一路通到巴基斯坦西南部、濱臨「阿拉伯海」的港口「瓜達爾」。■ 台北股市股王大立光()今天挾鉅量攻高，盤中並以2980元天價改寫台股新紀錄，股價並以上漲125元或4.45%以2935元作收也創收盤新高，其成交量1725張為今年1月23日以來新高，而個股今天成交值今天達49.94億元也為4月20日台股個股成交的首位。■ 中國人民銀行昨(19)日無預警宣布今日起調降金融機構存款準備率4碼(1個百分點)，外界擔心中國下一步可能降息，財政部長張盛和今天於財委會示警，投資，未來有可能降息，國人要注意兩個地方，一是利息不會那麼高，二是若貶值的話，本息都會損失。■ 中國人民銀行昨(19)日無預警公告，自今(20)日起下調各類存款類金融機構存款準備金率1個百分點，為金融海嘯以來最大降幅，元大寶華綜合經濟研究院對此指出，未來人行將持續以偏向寬鬆的貨幣政策支撐經濟走勢，惟仍有2項因素，可能影響人行寬鬆貨幣政策效果，包括股市對經濟產生資金排擠效應、未來數月國際資金可能持續外流且幅度加劇，稀釋寬鬆政策效果。■ 今日，中國上交所市場成交金額超過1萬億，現有show2003行情檔案中指數成交金額欄位顯示為全“9”數字，交易及個股行情不受影響，均正常顯示。■ 中國證監會週五宣佈將限制融資券以控管上海股市過熱的走勢，人民銀行卻又於週末宣佈調降存款準備金率(RRR)。相互矛盾的政策究竟是想推升股市還是壓抑股市？北京此舉可能令市場分析師嗅到豁出去了的氣氛。■ (接下頁)[NT:PAGE=$]■ 台灣3月外銷訂單年率上升1.3%，預測值上升0.6%，前值下降2.7%■ 韓國3月PPI年率下降3.7%，前值下降3.6%■ 紐西蘭第一季度CPI季率下降0.3%，前值下降0.2%，預期值下降0.2%。年率上升0.1%，前值上升0.8%，預期值上升0.2%■ 加拿大3月核心CPI年率增長2.4%，預期增長2.1%，前值增長2.1%■ 加拿大3月CPI年率增長1.2%，預期增長1.0%，前值增長1.0%■ 美國3月未季調CPI年率下降0.1%，預期持平，前值持平■ 美國4月密歇根大學消費者信心指數初值95.9，預期94.0，前值93.0■台灣 20 日收盤下跌18.08 點或0.19 % 報 9552.85 點，成交金額860.24億元。■台股 20 日三大法人集中市場賣超8.97億，外資賣超1.96億，投信賣超6.39億，自營商自行買賣賣超1.00億，自營商避險買超0.39億。■日經225指數 20 日收盤下跌18.39點或0.09%，報19634.49點，開盤19501.00點。■韓國Kospi指數 20 日上漲3.21點或0.15%，報2146.71點，開盤2126.55點。■澳洲S&P/ASX 200指數 20 日收盤下跌44.770點或0.76%，報5833.10點，開盤5877.90點。■上證指 20 日收盤下跌70.22點或 1.64%，收盤報 4217.08點，成交金額超過1兆（系統無法顯示）。 深成指數收盤下跌277.74點或 1.96%，收盤報 13871.60點，成交金額6549.69億元。■香港 20 日收盤跌2.02%，跌558.19點，報27094.93點；國企指數跌2.93%，跌425.33點，報14111.34點；紅籌指數跌2.82%，跌150.87點，報5207.37點。大市全天成交2110.05億港元。■台北匯市 20 日收盤，兌美元報31.102元兌1美元，升值 6 分，成交量7.30億美元。
988,2015/04/20,工研院VLSI研討會4/27登場 國內外大廠與會 聚焦物聯網趨勢,在經濟部技術處支持下，由工研院主辦、引領半導體產業發展趨勢的第22屆「國際超大型積體電路技術研討會」(VLSI)，今年將在4月27日登場，物聯網(IoT)仍是焦點，大會邀請聯發科()、台積電()、聯電()、明導國際(Mentor)、IBM、ARM、應材(Applied Material)、意法半導體(STM)、瑞薩(Renesas)等國內外一線廠商，分享國際最新半導體元件與製程、晶片設計趨勢以及系統整合的設計與應用。物聯網是當前熱門話題之一，應用涵蓋範圍廣泛，包括智慧城市、智慧居家、車聯網等，皆成為下一波消費電子成長領域，為半導體供應商提供更多成長空間。工研院指出，大會安排3場共6位大師級演講，今年首度邀請到明導總裁暨執行長Walden C. Rhines發表演講，主題聚焦在「邁向物聯網時代的成本挑戰」，將在會中分析預測未來10年半導體設計和生產成本如何變革，以給予晶片設計者作為因應。另外大會也邀請德商博世(Bosch Sensortec)大中華區業務總監謝秉育，針對跨裝置下的物聯網演進為題發表演說。此外，瑞薩核心技術事業部總經理Tadaaki Yamauchi將發表「在智慧社會下嵌入式非揮發性記憶體的展望」演講，隨著3C裝置持續朝往智慧系統發展，嵌入式記憶體發展依舊前景可期。安森美半導體(ON Semiconductor)技術長Hans Stork演講則將聚焦於「電源和感測半導體如何應用於車用裝置」；而Ericsson集團Carl Engblom將從系統整合角度來探討2.5D/3D晶片的未來驅動成長展望與面臨挑戰時的優缺點分析；另外哈佛大學教授David M. Brooks將分享無人機的電路和系統設計。隨著各式智慧型電子產品的需求及應用不斷快速躍進發展，晶片設計及製程技術需與時俱進，針對物聯網、晶圓代工、非揮發性記憶體等相關技術產業發展現況與未來趨勢也是今年研討會關注焦點。此外研討會也安排2場半導體製程及設計相關的聯合議程(Joint Session)，包括台積電、聯電、聯發科、ARM、GLOBALFOUNDRIES等多位專家，針對前瞻技術的開發、應用、挑戰以及產業的發展，發表專題演講。
989,2015/04/20,露天拍賣第三方支付付款破5500萬件 年成長8倍！,網家()旗下露天市集今(20)日宣布，目前露天全站可使用支付連付款物件數已經突破5500萬件，與去年同期相較，一年內大幅增加3000萬件商品，而買家使用支付連付款的交易訂單年成長更超過800%。露天表示，自2012年3月開始導入PChomePay支付連後，賣家積極開通服務，目前露天全站可使用支付連付款物件數已經突破5500萬件，從商品類別分析買家使用PChomePay支付連的特性，最明顯就是交易類別全面普及化，以往使用第三方支付的訂單較集中在電腦3C、手機、家電等較高單價的商品。露天強調，第三方支付為微型電子商務產業帶來更便利安全的金流模式，買賣家使用第三方支付服務的廣度與跟深度並行成長，帶動交易規模與能量快速放大。
990,2015/04/20,華航推母親節限定班機飛日北高松,看準母親節周邊商機龐大，華航()也搭上話題推出前所未有的「壽如高松」母親節限定班機和3天2夜專屬行程，母親節限定班機將於5月8日從桃園機場飛往日本高松機場，158個座位限量銷售，明(21)日中午12點在華航網站開賣。本次母親節限定班機產品為機票、行程、住宿套票銷售，採網路訂購，3天2夜商務艙成人套票25999元、兒童24999元、或經濟艙成人套票19999元、兒童18999元(以上皆未稅價)。華航表示，繼2015幸福曙光班機獲得熱烈回響後，這次再創新推出母親節限定班機，使用波音737-800執飛，空服員將為旅客送上特製松花堂珠寶盒造型餐點，使用台灣在地食材研發低卡無負擔的健康舒活料理，代表長壽的香菇菊揚、富含營養的鮭魚卵、以及日式風味的梅細麵，搭配養顏美容聖品「燕窩」，讓媽咪們打開便當就有驚喜。同時，機上將舉辦高空抽獎活動，送給幸運旅客飯店SPA體驗券、華航金卡會籍、免費哩程等多項好禮。行程方面由華航和日本香川縣政府合作規劃，3天2夜早去晚回，將帶領旅客深度遊覽各個著名景點，包括日本三大美麗溪谷之一的「寒霞溪」、電影魔女宅急便拍攝地「小豆島橄欖公園」、日本人一生一定要去參拜一次的「金刀比羅宮」、法國米其林旅遊書列為三星景點的「栗林公園」等，所到之處也會有限定贈品作為紀念。另外，華航精心設計獨家活動，如體驗製作烏龍麵、參觀高松地區特有的勇心酒造，並安排GalaDinner浴衣派對，讓媽媽們欣賞當地傳統舞蹈表演同樂，現場還有摸彩送機票的驚喜。
991,2015/04/20,日盛投顧：台股最好狀況將是震盪整理,1. 上週五美股重挫，使得週一台股開低，惟中國週日突然宣佈降準四碼，亞股表現相對強勢，台股開低幅度亦有限，盤中回到平盤附近整理，惟欠缺追價買盤，各類股變化不大，終場指數小跌18.08點，跌幅0.19%，收在9552.85，成交金額萎縮至863.52億元。2. 觀察台股技術面，3月下旬連續下跌後，將近一個月來整理區間在9503-9664，指數僅有161點波動，量能在這段期間呈現只要是大量K線普遍收黑、上攻時量能普遍不足，台股在量價結構不利於多頭，且短期5、10、20日均線在9600附近糾結下彎的壓力，近期指數最好狀況將是震盪整理，下檔持續走揚的季線將是第一道防線〈目前位置約在9530附近〉，一旦防線失守，下檔支撐區將下調至去年12/30高點9338、今年2/2低點9352的型態支撐區〈約在9350附近〉，預期台股將難脫整理格局，盤面僅能個別族群或個股表現。觀察台股籌碼面，外資-1.96億元、投信-6.40億元、自營商-0.61億元，三大法人合計賣超8.97億元。電子壓力仍重 金融、非金電為盤面焦點1. 觀察台股盤面結構，電子-0.20%、金融+0.06%、非金電-0.27%，3月下旬以來電子股持續是盤面最弱勢的區塊，在1Q季報陸續公佈之際，以及2Q電子業業績普遍有疑慮的影響下，整體股價仍是偏弱；金融股緩步挺堅走勢不變，重要個股皆維持強勢整理，操作上質優股逢回至短期均線仍可留意；非金電雖然回測20日均線，但整體強度優於電子，且短中期趨勢仍偏多，操作上仍是多頭重心，塑膠二線SM、加工絲、成衣、風電、水資源、自行車與汽車相關較值得留意。
992,2015/04/20,群益期貨台股期權盤後－大立光發威大漲 台股撐住季線,◆盤勢分析台股受到歐美股市上周五表現不佳的影響而開低，不過碰觸到季線以及區間下緣之後隨即反彈，成交量還縮減八百多億，K棒上形成一個具有上下影線的紡錘線，而現貨K棒影線部分又更長，表示多空交戰激烈，不過權值股稍強，下方支撐頗強。外資今天的期貨部位僅在一千口以內，可以說是幾乎沒有，這麼小的部位並沒有太大的參考性。在5月份選擇權籌碼中，整體賣權OI大於買權OI的口數擴增至九千多口，仍屬中性偏多的結構。台股今天算是下跌的局面，不過賣權OI增加的速度較快，主要是開低後略有止跌狀，下方支撐具有效用。總合以上，目前的型態架構走出一個三角形的收斂型態，能夠突破才容易走出方向，因此觀察何時突破下降壓力線會是關鍵，而權值股的表現一樣影響盤勢相當深，能夠突破區間上緣才有機會往目標價位邁進。
993,2015/04/20,永豐期貨台指選擇權盤後－股王發光朝三千金邁進   指數季線短撐,◆盤勢分析期貨走勢週一下跌21點收在9561點。價差方面，正價差至8.15點，電子期正價差至0.78點，金融期轉為逆價差至0.45點，摩台期逆價差0.46點。由籌碼面來觀察，三大法人於現貨市場賣超8.97億元；而在淨部位方面，三大法人空單加碼1019口，淨部位空單增至5430口，其中外資空單回補1202口，淨部位轉為多單570口，自營則是空單加碼2033口，淨空單增至2974口；另外十大交易人中的特定法人，全月份空單減碼2344口，淨空單降至354口，法人留倉部位迅速多空易位，顯示法人與大額交易人對台股後市已轉趨中性偏空的預期。行情走勢方面，週末大陸官方大玩棒子與蘿蔔戲法，一手加大監管一手大力降準使得全球股市大洗三溫暖。週一早盤以下跌52點開出，而現貨開盤後出現劇烈震盪洗盤，但盤中陸股創高帶動台股收斂跌勢，尾盤僅以下跌21點作收。技術面觀察，週一大盤開低走高以帶上下影線小紅K守穩季線，但成交量能縮小至863億水準，短線盤勢二度回測季線支撐有守。而以日線型態來看，目前指數上檔受制9600點之上多重均線反壓，下檔季線上揚至9525點，近期多空在9600點上下交戰激烈，近期盤勢有多空表態的機會，操作上建議以低買高賣區間操作為宜並請嚴設停損。選擇權分析選擇權從成交量來觀察，5月份買權集中在9800點，賣權集中在9500點。未平倉量部份，買權大量區集中在9900點，而賣權大量區集中在9200點。全月份未平倉量put/call ratio由1.05升至1.06，再度回到中性值1之上，顯示選擇權籌碼面轉呈中性格局發展。5月買權平均隱含波動率由9.78%升至9.99%，賣權平均隱含波動率由10.95%升至11.60%，短線盤勢震盪劇烈，建議積極者持續以買進跨式策略進場佈局因應。台灣50、寶滬深、FB上証、元上證、FH滬深等五檔ETF期貨交易量，以FB上証4530口最熱門。
994,2015/04/20,富鼎投顧盤後－國際因素交錯讓台股繼續盤整,◆盤勢分析希臘債務危機再起、美國公布3月CPI續升市場擔心FED又要提前升息，引發德國、美股全面重挫，加上中國證監會17日盤後出手發布7項對券商承作「兩融」（融資、融券）業務管控降溫動作，本周陸股補跌壓力重，全球股市修正壓力大。上周五美股終場跌279.47點，指數跌75.98點，指數跌23.81點，指數跌10點。由於中國證監會擔憂引發市場波動與系統性風險，發布包括券商做「兩融」（融資、融券）業務不得展開場外配資、傘型信託等措施，消息一出，新加坡交易的A股期貨-新華富時A50指數跌幅一度擴大至6％，目前我們對於國際股市後市看法沒有太大改變。持續高檔震盪之狀況應該是比較合理的結果！歐美股上週五重挫，陸股因人行意外調降存款準備率4碼，抵消利空衝擊，台股今日雖籠罩在利空陰影，但今天確開低走高，盤中跌破季線9520點後發揮支撐力量彈回。上週五的歐美股表現不好。美股四大指數重挫，因美國總統歐巴馬呼籲希臘必須啟動改革，引發市場對希臘債務違約新的疑慮。終場下跌279點，德國股市更下跌310點。台股受利空影響，今天開低走低，盤中最低跌到9508.57點，瀕臨9500點大關，但隨後彈回到季線9520點之上。法人表示，由於外資賣超動作延續，融資籌碼漸趨凌亂與融券回補高峰已過，加上電子業第2季展望偏淡，美超級財報週獲利展望不佳，且上週五美歐股聯袂重挫利空襲來，歐債希臘問題又起，陸股訊息一空一多，台股還是區間震盪，區間仍是9450-9700震盪。
