,date,title,content
722,2014/12/09,鉅亨早報 2014年12月9日,"■ 行政院長毛治國今(8)日主持上任後首次行政院會，為了挽救敗選之後的民心，他要求新內閣的官員「換個腦袋思考政策」，同時必須要與網路世界建立橋樑，而政策規劃也要確認民意走向，並堅守社會正義、確保環境永續。 ■ 近日不分藍綠呼籲讓前總統陳水扁保外就醫，行政院至今態度不明確，新任閣揆毛治國今(8)日僅表示「政府施政要考量人道原則」，法務部長羅瑩雪則同步表示，陳水扁可以提抗告或重新申請保外就醫。■ 陷入食安風暴的的頂新集團5日簽約將以251億元售出其持有的台北國際金融大樓(台北101)37.1%股權全數售予馬來西亞IOI集團，頂新集團今天指出，對於台北101的經營發展應以台灣利益為優先考量的立場，實與政府及全民一致。■ 勝華(2384-TW)今(8)日公告指出，中國大陸子公司東莞萬士達、聯勝(中國)、聯建(中國)已自12月5日停工，並資遣員工；這是繼台灣廠集中生產及資遣員工之後，大陸廠區也在入不敷出下決定停工，預估資遣人數約萬餘人；在大陸廠停工後，僅剩台灣及越南廠維持運作。■ 台灣出口連10紅！財政部今(8)日公布11月海關進出口貿易統計，電子產品市況暢旺，帶動11月出口266.8億美元，年增率3.7%，財政部統計處處長葉滿足表示，中國大陸春節前備貨需求來臨，12月出口有望持續正成長，全年出口成長率目標可望達成主計總處預測的3.01%。■ 近期國際油價跌跌不休，外界要求經濟部與台電要調降電價，對此，行政院長毛治國今(8)日表示，電價裡面有很重要的因素是油價，油價最近有大幅度下降，他提醒經濟部，油價有大幅調整，必須反映在電價。■ 國際油價跌跌不休，有分析指出每桶恐怕跌至30至40美元，對此，台塑化()總經理曹明今(8)日做出預估，國際油價會在60美元附近穩定住，這已經接近底線。■ 封測大廠日月光(2311-TW)今(8)日公布11月營收，達252.5億元，較10月下滑4.8%，較去年同期成長14.9%，封測事業營收為144.7億元，月減5.1%，年增16.7%，包含合併營收與封測事業營收都較10月最高記錄下滑，不過仍創下單月歷史第三高紀錄。■ 筆電代工緯創()今(8)日公布11月營收，達563.6億元，月減2.4%，年增14.27%，其中筆電出貨持平，智慧裝置出貨則小幅成長，支撐11月營收穩健，緯創表示，12月營收預期會下滑，其中筆電出貨修正，非筆電僅智慧裝置出貨持平，其餘也預估在持平水準附近。■ 光寶科技()11月全球合併母子公司營收為199.87億元，月增及年增率皆為2%；在終端市場需求穩定帶動下，各核心產品持續呈現穩定成長；累計前11月全球合併母子公司營收為2102.2億元，年成長9%。(接下頁)[NT:PAGE=$]■國際清算銀行(BIS)在季度報告中警告，新興市場的企業近年以美元大舉發債，美匯走強將加重這些企業的債務負擔，並損害它們的信用額度，對新興市場造成嚴重衝擊。■全球第一款電視遊戲機的發明者貝爾於上周六逝世，享年92歲。他發明的家用電視遊戲機「奧德賽」(Odyssey)於1972年面世，自此電視機不再只用來看電視，電視遊戲亦成為幾十年來，科學家及工程師鑽研提升電腦速度、記憶容量及畫質的一大動力來源。■中國昨日出爐的進出口數據令人大跌眼鏡，表現遠遜預期，顯示經濟仍欠動力。中國海關公布11月進口總值1571.86億美元，跌6.7%；出口2116.6億元，按年升幅由10月份的11.6%顯著回落至4.7%；貿易順差更擴大至544.74億美元，按年升61.4%，創歷史新高。■中國最新出口數據和採購經理指數（PMI）均遠遜預期，加上美元持續強勢，令昨創4個月新低，不過星展和渣打（2888）預期長遠不會貶值。■一年一度的中央經濟工作會議於今日在北京召開，此次會議不僅是2015年經濟政策的「定調會」，還將是全面深化改革第二年的首場改革動員會。2015年被視為全面深化改革的「關鍵之年」，此次會議上，中央料會向各地方諸侯、各部委高官進行明年改革的總動員，國企、財稅、金融、社保、土地、司法等一系列改革方案有望明年落地實施。而為加快改革步伐，明年中央可能將治理的重拳打向「不作為」，以此強化行政推力、提高行政效率。■美國在中東對抗極端伊斯蘭組織ISIS之際，小布殊時代中情局（CIA）在海外秘密監獄嚴刑逼供再成焦點。參議院情報委員會耗資4000萬美元、歷時5年撰寫的酷刑報告摘要最快今天公開。■中國空軍首度公開將日本空軍列為假想敵。廣州軍區近日出動逾百架精銳戰機，展開大規模空戰演習，央視畫面曝光解放軍機師手持日本F2戰機模型模擬演練。F2戰機是日本仿製美國F16戰機的改進型。這是中國空軍首度公開曝光假想敵目標及對抗戰機。軍事專家表示，做法應是從外交和政治上考慮，而非純軍事上考慮，震懾日本意味濃厚。■《華爾街日報》昨天引述消息人士說，中國大型商業銀行正向人行施加壓力，要求降低存款準備金率。報內銀面對存款下降的問題，令到銀行不能放貸，危及經濟增長。報道引述一位四大行的高級官員，指已向人行表達必須降準備金率，才能維持借貸。現時內地存款準備金率高達20％。■日本政府即將於本月十日起正式實施《特定秘密保護法》。共同社獲得政府文件，發現內閣情報調查室（內調）認為擁有海外學習或工作經歷的人，泄密可能性較高，認為海外經歷「將成為對外國產生特別感情的契機」、「容易受到來自外國的拉攏和打動」。有專家抨擊，在全球化時代，這是種不合時宜的錯誤想法。■日本副首相兼財務大臣麻生太郎曾招惹舌禍，這幾天為眾議院選舉自民黨籍候選人拉票時又再失言，指安倍經濟學確實有成效，沒賺到大錢的公司不是很倒楣，就是老闆無能。■周日抵達紐約的英國威廉王子，周一暫別身懷六甲的夫人凱特，轉赴華盛頓出席世界銀行會議，發表一篇以非法野生物交易為主題的演說。根據預先發表的演講節錄，他會公開譴責一些現時仍容許象牙和犀牛角合法買賣的國家，包括中國。外交人士擔心演說內容可能開罪北京，甚至會令威廉明年初的訪華行程蒙上陰影。■美國《時代》（Time）雜誌年度風雲人物網上投票結果於周一揭曉，印度總理莫迪名列榜首，壓倒在美國掀起反種族歧視浪潮的密蘇里州弗格森鎮示威者和香港學民思潮召集人黃之鋒。■美國各地針對白人警員對黑人濫用致命武力的示威浪潮仍未平息，加州伯克利的示威連續第二晚演變成警民衝突，有暴徒企圖焚燒警車，又向警員投擲汽油彈及爆炸物，一名示威者嘗試阻止暴徒搶掠商店時反被打傷。防暴警察出動煙霧彈和催淚氣體驅散，目擊者及當地媒體則稱警方曾動用橡膠子彈鎮壓。■國際糖價目前處於多年低位，但美國本地糖價卻持續攀升，截至上周五美國3月份期糖價高達23.98美分，較國際期糖價格高出近9美仙。造成這一現象主要是由於美國商務部以保護本土甘蔗種植業為名，限制來自墨西哥的進口，但美國糖果生產商卻擔心成本不斷增加，損害競爭力。■為進一步促進本地港元債券市場發展，香港金管局昨日宣布兩項措施，包括優化在「外匯基金票據及債券計劃」及「香港政府債券計劃」下發行的債券年期，以及推出香港政府債券貼現機制。■大陸首批滬港通基金於12月9日正式發行，分別是南方恒指ETF、華夏滬港通恒生ETF和華夏滬港通恒生ETF聯接三隻基金。與滬港通50萬元門檻相較，該批基金認購門檻僅1000元，即使是A股市場中的中小投資者也可參與。■渣打（2888）預期明年全球經濟表現將好過今年，來年全球經濟將增長3.4%，比今年預測的2.9%有所改善，明年通脹壓力維持偏在2.5%的偏低水平。■渣打香港對2015年的匯價走勢樂觀，預期明年底有望破六算。張氏解釋，因油價持續走弱對亞洲貨幣有影響，雖然美元維持強勢，但在中國較強的貿易順差及美國明年9月加息的預期下，預期年初維持平穩，至明年底美元兌有機會破六。■兩大重磅新股本周對壘，北京汽車（1958）搶先於今日招股，集資最多121億元，一手入場費4949元。該公司旗下自主品牌分部去年經營虧損逾27億元，管理層表示，隨着自主品牌達到產能規模，相信可降低成本縮減虧損。雖然昨日是路演首日，但國際配售中午已傳超購。■有望成為今年集資王的大連萬達商業地產昨日進行路演，大連萬達調低IPO規模至297.6億元，較市場預期的60億美元（468億港元）為少，但集資額仍然拋離對手中廣核（1816）（集資245.3億元）及港燈（2638）（集資241.7億元）。分析師認為，大連萬達商業地產將集資金額縮減三分之一，主要是想吸引憂慮萬達龐大債務的投資者。■匯率一跌再跌，每百兌港元近日曾跌破6.4算，見近年來新低。不少港人因而計劃到日本旅遊，本港旅行社紛紛表示，今年聖誕檔期日本團幾乎爆滿，部分只剩少量名額。但礙於機票和日本酒店價格不斷上升，令旅行團成本增加，今年聖誕期間日本團團費與去年相若，料農曆新年日本團費會有上升趨勢。另外，由於遊日大熱，亦令其他東南亞地區的報團情況受到影響，韓國及台灣等熱門旅行團均錄得輕微跌幅。■澳門行政長官崔世安周日表示，政府早已預期澳門的經濟會進入調整期，因此調整明年度每月博彩收益預期，由今年預期每月300億澳門元收益，降低至預期275億澳門元。以此計算，降幅為8.33%。濠賭股昨日繼續受壓，銀娛（0027）及金沙（1928）兩隻藍籌分別跌2.6%及3.04%。■金銀業貿易場理事長張德熙昨日在一個論壇上指出，在油價回落、美國停止買債，以及瑞士公投否決回購等負面因素打擊下，相信短期內金價會再次下挫，農曆年前甚至下跌至1,100美元以下，但相信其後會反彈，因為目前的開採等成本價，平均維持800美元至900美元，相信售價若低於1,100美元，整體供應將減少。他又希望，貿易場在前海設立保稅倉，助本港交易市場進入內地。■新疆烏魯木齊市中級人民法院昨日依法對烏魯木齊火車南站「4．30」暴恐案和公園北街文化宮早市「5．22」暴恐案作出一審宣判。「4．30」暴恐案被告人艾合麥提．熱西提、「5．22」暴恐案被告人阿卜力孜．達伍提等共8人被判死刑，另有5人被判死緩，4人獲無期和有期徒刑。■由全球網民投票選出的「新七大奇迹城市」結果出爐，菲律賓北部古城維甘古城在一千二百個城市中脫穎而出，與另一亞洲城市馬來西亞首都吉隆坡一同入列。■早前英國國會外交事務委員會聲言要到香港「調查」《中英聯合聲明》的落實情況，嚴重干預中國內政。本港律師團體中澳法學交流基金會計劃去信聯合國秘書長潘基文作出投訴，要求聯合國調查英國國會及英國政府是否違反聯合國憲章中有關「不能干涉別國事務」的條款。基金會執委會主席馬恩國更狠批，英國國會的行為本身已同時涉嫌違反英國當地的法律。■美國11月諮商會就業趨勢指數123.24，前值123.09■美國10月就業市場狀況指數(LMCI)修正為+3.9，初值為+4.0■ 瑞士11月消費者物價指數月率實際值：持平；前值：持平。年率實際值：-0.1%；前值：持平。■ 瑞士10月實際零售銷售年率實際值：+0.3%；前值：+0.3%。■ 法國11月商業景氣指數97，預期值96，前值96 。■ 德國10月季調後工業產出月率實際值：+0.2%；前值：+1.4%。年率實際值：+0.8%；前值：-0.1%。■ 區12月Sentix投資者信心指數-2.5，預期值-10.5，前值-11.9■日本11月M3貨幣供應年率上升2.9%，前值上升2.6%■台灣11月出口年率上升3.7%，預測值上升3.47%，前值上升0.7%■台灣11月進口年率上升5.1%，預測值上升2.6%，前值下降1.4%■ 中國11月出口年率4.7%，預期值8.1%，前值11.6%。■ 中國11月進口年率-6.7%，預期值3.9%，前值4.6%。■ 中國11月貿易帳544.7億美元，預期值440億美元，前值454.1億美元。■ 日本第三季度實際GDP季率修正值-0.5%，預期值-0.1%，前值-0.4% 。年化季率實際值：-1.9%；前值：-1.6%。■ 日本10月季調後經常帳月率實際值：+128.5%；前值：+216.8% 。年率實際值：-20.5%；前值：-40.8% 。■工業平均指數收低106.31點或0.59%至17852.48點■Nasdaq指數收低40.07點或0.84%至4740.69點■指數收低15.06點或0.73%至2060.31點■指數收低10.12點或1.44%至693.00點■德國 DAX-30指數收低72.13點或0.72%至10014.99點■英國 FTSE 100指數收低70.69點或1.05%至6672.15點■法國 CAC 40指數收低44.00點或1.00%至4375.48點■台灣 8 日收盤下跌 19.28 點或 0.21%，報 9187.29 點，成交量 918.65 億。■台股 8 日三大法人集中市場賣超45.76億，其中外資賣超34.81億，投信賣超5.89億，自營商賣超5.05億。■日經225指數 8 日收盤上漲 15.19 點或 0.08%，報 17935.64 點。■韓國Kospi指數 8 日收盤下跌 7.67 點或 0.39%，報 1978.95 點。■澳洲S&P/ASX 200指數 8 日收盤上漲 37.36 點或 0.7%，報 5372.70 點。■上海綜合指數 8 日收盤上漲 82.61 點或 2.81%，報 3020.26 點。■香港 8 日收盤上漲 45.03 點或 0.19%，報 24047.67 點。■COMEX 收跌17.30美元，收於每盎司1190.40美元■NYMEX 原油期貨收跌0.97美元，至每桶65.84美元■ICE 倫敦 布倫特原油期貨收跌0.57美元，至每桶69.07美元■CBOT 玉米期貨上漲5.25美分，報每英斗3.9500美元■CBOT 小麥期貨上漲4.25美分，報每英斗5.9400美元■CBOT 黃豆期貨上漲25.50美分，報每英斗10.3600美元■ 8 日收盤，兌美元報31.285元兌1美元，貶值9.3分，成交量6.23億美元。■ 8 日收報 6.1727 元兌 1 美元，貶值 225 點。■美元/報31.2850，升0.0930或0.30%■美元/報6.1733，升0.0238或0.39%■報89.3790，升0.0450或0.05%■美元/報121.0400，貶0.3650或0.30%■/美元報1.2261，貶0.0021或0.17%■/美元報1.5618，升0.0039或0.25%■美元/報0.9806，升0.0018或0.18%"
723,2014/12/09,新光證券盤前分析,"◆盤勢分析收9187.29點，下跌19.28點或0.2%，成交額925.76億元。OTC指數收137.576點，上漲0.61點或0.45%，成交額281.39億元。美國再創歷史新高，激勵開盤跳空開高來到9,265點，上漲51點。台股盤中因受到留任的財政部長張盛和主張大戶條款宜調不宜廢影響，使得盤勢陷入膠著、買盤觀望，一度失守9200點。終場下跌19.28點，以9187.29點作收。綜觀盤面，電子股方面，大立光、可成等蘋概股雖然11月業績續創新高，但有外資高喊「收割」，讓蘋概股臉綠，也讓電子指數無力回天，被壓抑在盤下，中小型電子股中，包括網通等，搭上副閣揆張善政概念股，設備、零組件、車用等族群也各自表現。電子指數仍下跌0.52%。金融股方面，由富邦金撐盤，漲幅逾1%，8日召開股東會的彰銀，也全場力守紅盤，兆豐金雖然跌幅逾1%，但其他官股行庫表態力撐，讓金融指數上漲0.16%。傳產股方面，整體傳產族群表現相對抗跌，生技股漲幅逾2%表現最佳，汽車、化工漲幅逾1%，僅有塑膠類股跌幅逾0.7%，其餘跌幅都在0.5%以內。台股到12月底前可望守月線向上攻高，9000點關卡有支撐，整體線型持續偏多的態勢不變，本週海協會會長陳德銘將訪台，兩岸貨貿也將重啟技術商談，政策面上題材仍偏多，加上大戶條款鬆綁有望，預估大盤仍不看淡。"
724,2014/12/09,日盛投顧盤前分析,"◆盤勢分析1.國際原油價格創 2009 年七月以來新低紀錄，每桶接近 63 美元, 週一美股在能源類股重挫拖累下全面下跌作收，跌幅介於0.59至1.44％，麥當勞受上個月份全球銷售減少 2.2%影響，股價下跌 3.84%，而蘋果股價則下跌2.26%，美股四大指數中長期趨勢偏多，短期高檔震盪。2.由以下三個面向檢驗台股方向及強弱：（1）.  量能： 5日均量大於20日均量，且20日均量持續上揚，量能增溫對多方有利。（2）.  均線：支撐為月線至半年線，壓力為9289點（9/19高點）附近。（3）.  技術指標： RSI及KD開口閉合，但5日RSI及9日K值仍大於50，短線震盪偏多。3.觀盤重點：美股下跌，觀察台股指數是否能守穩在半年線之上，成交量能否保持在20日均量之上，盤面焦點股可留意長線趨勢（4G、物聯網及穿戴式裝置、電動車、蘋果概念股、工業自動化、節能）、生技、金融、營建、貶值受惠股（自行車、觀光）、低油價受惠股（運輸、汽車）、年底作帳股（集團、法人）、10月營收佳的2357華碩及2385群光等。4.中央銀行總裁彭淮南表示，美國量化寬鬆（QE）退場後，預計明年升息，美元需求會增加、價格上漲，匯率就會隨之變動。他並預期，美國QE已結束，由於最新經濟數據表現不錯，升息時間可能會比明年中再早一點。彭淮南之前研判美國升息時間應該落在明年6、7月間。至於台灣是否具有升息的環境，央行的說法是，今年前11月消費者物價指數（CPI）年增率為1.26%，目前台灣銀行1年期定存利率為1.37%，實質利率為0.11%；實質利率為正數，代表央行暫無升息急迫性。後續觀察美國升息時點是否如彭總裁所預言提前。5.年底旺季來臨，我出口「連十紅」達陣。財政部公布最新進出口統計，11月出口達266.8億美元，年成長3.7％。官員表示，在電子產品市況熱絡帶動下，將推升全年出口上看3,146.3億美元，可望再創新高。後續觀察11月整體上市櫃公司營收年成長幅度。6.彰銀董事改選，2887台新金只拿下三分之一董事席次、未能過半。台新金表示，依法彰銀將不再是台新金的子公司，台新金將在本（12）月認列約148億元的投資損失。假設未來台新金出售彰銀持股，每股售價高逾18元，多出的價差部分，將可認列迴轉利益、貢獻台新金的損益。台新金今年前十月稅後純益138.6億元、累計每股稅後純益（EPS）為1.51元，台新金認列投資損失後，全年稅後純益從原本估計賺逾160億元，變成賺不到20億元，每股EPS不到0.22元。台新金認列148億元的投資損失屬一次性，屬短空長多。7.2357華碩11月集團合併營收為489.45億元，月增5.10％、年減0.72％，品牌營收則為453.55億元，月增5.14％、年減0.29％。12月雖進入產業淡季，但手機需求仍有撐，預估華碩第4季品牌營收將達1,250億元，創分家以來新高。後續觀察華碩手機獲利是否持續提升。8.2385群光11月自結合併營收創下單月歷史新高，首度突破80億元，達81.2億元，較去年同期成長近一成，月增6%。累計前11月合併營收達717.3億元。穿戴裝置為年底聖誕節及新年送禮大熱門的禮品選項，帶動群光電子物聯網產品在11月維持活躍的成長動能。群光電子11月份雲端產品月成長已突破30%。後續觀察穿戴式佔群光的獲利比重趨勢是否向上。"
725,2014/12/09,台股盤前─毛內閣了無新意 條款不廢大戶難回籠 今測9160點,毛內閣昨(8)日上路，儘管宣示將調降電價照顧民生，但股市關切的「大戶條款」、「房地合一」等重大稅案，在敗選的壓力之下依舊鐵板一塊。外資對電子股逢高調節，內資意興闌珊、大戶不敢回籠，加上美股今(9)晨下跌，9160點成為台股今日的短線關鍵，恐回測月線9100點。在敗選壓力之下，必須滿足社會要求公平正義的期待，毛內閣昨天正式上路，對於股市關切的大戶條款卻傾向「宜修不宜廢」，房地合一稅案若是立委喊稅太重，也可以「分段改革」。整體政策的風向球看來，新內閣將是「江規毛隨」、換湯不換藥，大戶不敢回籠，對於刺激台股的量能回流，恐怕誘因有限。與台股連動緊密的美股，今晨由於中國、日本的經濟數據疲弱，能源股、科技股走跌。大跌106.31或0.59%，以17852.48作收。標準普爾指數下挫15.06或0.73%，收2060.31；科技股指數下跌40.06或0.84%，收4740.69。無獨有偶，供應過剩的國際油價跌跌不休，今晨又以下挫逾4%的跌幅創下5年來新低，塑化類股族群挫著等。今晨，紐約西德州中級原油明年元月交割價重挫2.79美元，每桶收63.05美元；倫敦北海布倫特原油元月交割價下滑2.88美元，每桶收66.19美元。政策面無明顯利多，美股今晨又下跌，台股恐怕陷入震盪。分析師王信傑認為，今天的大盤9160為短線關鍵，若無法守住則有機會慢慢盤跌回測月線9100上下，短線轉強點為9250點。另從技術面來看，元大投顧指出，半年線仍力守未被跌破，10日均線也即將與半年線交叉，且近期外資期貨OI大都以多單留倉為主，短線發球權仍由多方掌控，但選擇權12 月的未平倉量集中在9300點至9500點，都超過5萬口，可見上檔壓力也頗大。 台股短期內依舊面臨賣壓，在操作建議上，日盛投顧指出，長線趨勢可留意4G、物聯網及穿戴式裝置、電動車、蘋果概念股、工業自動化、節能，以及生技、金融、營建、貶值受惠股（自行車、觀光）、低油價受惠股（運輸、汽車）、年底作帳股（集團、法人）、10月營收佳的個股。
726,2014/12/09,富鼎投顧盤前分析,◆盤勢分析1.之前說明電子業第四季快一點的是10月營收見高，通常第四季營收最高峰在11月，之後就慢慢下滑轉入淡季。8日蘋果股領跌是受外資喊出「收割蘋果股、快樂過耶誕」所影響。蘋果股是業績最好的族群之一被喊空也代表外資看法轉向的現象。尤其目前外資持有市值比重逾38％處於1999年來新高，外資買盤力量是否轉變?就像台股成交量能不能維持熱絡?這些關係市場大盤短中期的方向，籌碼及量能決定台股未來。2.外在大環境二大變數持續加速，一是持續重貶破121兌一美元。二是原油價格持續下探。雖然重貶有受惠股如明基材、奇美材等。原油續跌有華航、長榮航等航空股受惠。我要強調的不是短線受惠族群，而是、原油大幅變動，嚴重破壞匯率及商品市場的價格穩定性，這會讓市場原有的需求往後延，觀望看看會不會有更低價格再進場。一旦市場出現整體性的買盤需求延後，我研判會加速如歐洲、日本等最怕通縮現象加速產生，進一步衝擊股市金融市場的現況！絕對不要輕忽、原油帶來的負面影響。3.市場很期待下周大戶條款的審議能夠鬆綁，真正讓台股大戶回來成交量持續滾動起來，對投資人、企業甚至政府稅收能達到三贏最好結果!大戶條款只是影響台股的重要因素之一，最重要的還是公司要持續獲利成長，投資人對未來有信心才有錢途。控盤手法有先反應大戶條款的預期利多，反需提防拉高不漲的調節出貨手法。馬明河 分析師
