,date,title,content
358,2014/12/12,鉅亨早報 2014年12月12日,"■ 彰銀()最大法人股東台新金()這次在彰銀董事改選大敗給公股，台新金表示「9年前台新被騙，9年後台新被搶」，台新金財務長林維俊今(11)日上午會同委任律師陳彥希赴監察院陳情，狀告財政部違反2005年公函，質疑財政部涉及違法、瀆職等問題，要求監察院調查。■ 證交所統計，根據國內上市公司公告11月營收顯示，11月整體上市公司營收總計達2.5兆元，較去年同期成長1177億元，成長4.79%，成長產業是半導體、其他電子與觀光業，衰退產業則是油電燃氣、水泥與塑膠工業。■ 金點設計獎今年與TEDxTaipei合作舉行論壇，和碩()董事長童子賢應邀發表演講，他表示，面對產業競爭，中央主流戰場常常爭得頭破血流，但此時邊陲地帶往往可尋找更多靈感創意與活力，儘管短期邊陲地帶的產品未必會進入量產或是核心，不但是在創新的過程中學到的技能與經驗，會是面對競爭很好的本錢，也很有機會進入中央成為市場主流，如蘋果就是最好的例子，。■ 蘋果智慧手表Apple Watch預計明年春天上市，預計將掀起新一波的穿戴裝置熱潮，明年新品陸續在國外科技網站上流傳的宏達電()先前曾強調不會在穿戴裝置上缺席，外電報導指出，宏達電研發的最新穿戴裝置可望在明年1月美國消費性電子展(CES)亮相；雖然宏達電一貫不回應，但今日股價強漲，終場收在148元，創半年多來新高。■ 台達電()公布11月合併營收為167.97億元，較上月成長2%，主要是蘋果Power Choke訂單滿載，台達電旗下乾坤持續趕工交貨。法人指出，台達電10月、11月營收累計已達332.92億元，雖然12月有盤點影響，但只要單月營收維持在160億元水準，台達電第4季營收仍可達490億元，為單季歷史次高記錄。■ 9合一選後第9個交易日，9000關保衛戰第2度登場，雖然今天盤中約有10分鐘失守9000點，但鴻家軍搭配股王力撐，穩住多頭陣腳，讓收盤時下跌19.09點，以9013.07點作收，成交值急縮至786.3億元。外資今天持續賣超38.38億元，依舊不捧郭董場，再砍鴻海1.7萬張，所幸空軍收斂，淨空單降溫至2600多口。投信賣超7.4億元，自營商買超4.84億元，三大法人共賣超40.94億元。■ 《Daily Sabah》周三 (10日) 報導，以「末日博士」一名享譽國際的魯比尼 (Nouriel Roubini) 與旗下員工發表報告指出，中國 2016 年經濟成長將遠不如預期，美國則將化身為明 (2015) 年驅策全球成長的主要動力。■ 美國股市名嘴 Laszlo Birinyi 週三 (10 日) 表示，油價大跌正是市場一直等待出現的「黑天鵝」事件。「近期股市發展，是過去 2、3 年甚至 5 年大家一直談論、現在卻沒人提及的事件…這就是黑天鵝──一個完全無法預料的事件」。■ 曾準確預測出今年美國公債殖利率會重摔的基金經理人 Jeffrey Gundlach 週二 (9 日) 預言，美國 明年有可能跌至 1%，追隨歐洲國家公債利率的水準。■ 石油輸出國家組織週三下修2015年全球原油需求至12年最低，加上沙烏地阿拉伯堅持不減產，拖累紐約原油價格週三重挫。油價續跌已在OPEC成員國中造成嫌隙，伊朗與沙烏地阿拉伯明顯放話攻擊彼此。(接下頁)[NT:PAGE=$]■受石油輸出國組織(OPEC)調低明年原油需求預測至11年新低的消息影響，國際油價前日再跌至5年低位，布蘭特期油最低見每桶63.56美元，亦拖累美股前日跌超過200點。油價下跌令投資者擔心全球經濟前景，不僅衝擊能源類股份，金融股等同樣受壓，貴金屬和企業債等資產全線告跌，資金瘋狂流入美債避險，整個金融市場均受影響，形成「油市黑天鵝」。有基金經理對大市悲觀，認為新年前難以見底。■國際油價今年來累計大跌40%，逼近每桶60美元邊緣，創逾5年新低。能源專家警告，2010年初至今，能源生產商趁低息環境共發行了逾4萬億元巨額債券，隨着油價步入熊市，垃圾級別石油債孳息急升，更有些孳息已升至9.5厘的5年新高，油商發平息債集資的日子不再，面對發債困難，石油債泡沫恐隨時爆破。■國際油價自6月以來急挫44%，令不少依靠石油收入的國家經濟大受衝擊，首當其衝的俄羅斯在昨日議息後，大幅加息1厘，以期支撐匯率近期屢創新低的盧布；另一產油大國挪威則減息0.25厘來支持經濟。至於加拿大央行，雖然警告油價暴跌的打擊，但維持超低的1厘息口不變。■外資及基金界仍看好A股後市，「新興市場之父」麥樸思認為，A股牛市才剛開始，他更在趁大市調整之機大手筆「買買買」。法國興業銀行亦看好A股表現，預料明年升幅可達35%。■臨近年底，市場流動性出現偏緊，人民銀行亦開始放寬商業銀行信貸規限，以增加市場流動性。有消息指，央行要求全年新增信貸控制在10兆元以內，最近已大幅調整合意貸款規模；各家銀行開始加大放款力度。消息人士透露，人民銀行周三已通過國家開發銀行向銀行間市場注資4000億元。■由總部設於香港的中資企業承建的尼加拉瓜運河10日後動工之際，反對者周三（10日）趁「國際人權日」首次進軍首都馬那瓜，部分人高呼「中國人滾蛋」。尼加拉瓜運河規模將遠超目前唯一連接大西洋和太平洋的巴拿馬運河，政府強調新運河會有助改善疲弱經濟，但有民眾質疑運河只是中國套取利益的幌子，普羅百姓未得益前，自己的農地已遭不公平沒收。■部署明年經濟工作重點的中央經濟工作會議昨日在北京閉幕，相較於去年會議公報，對來年經濟工作的首要目標由「堅持穩中求進」，今年變成「努力保持經濟穩定增長」。對此，專家表示，今年新出現的趨勢性變化是經濟速度持續下降，會議將穩增長作為重要目標，旨在制止經濟下降的速度，扭轉經濟形勢。■全球最大型「個人對個人」(peer to peer，簡稱P2P)網上借貸平台Lending Club，昨日在紐約掛牌上市，由於市場反應熱烈，公司兩度提高招股價，最終以每股15美元定價，總集資額8.7億美元，令這家創業僅8年的新興企業市值高達54億美元。昨日開市1小時後，股價已升至22.9美元，較招股價高53%，令Lending Club市值較招股價增加近4.6億美元)。■社交網站facebook旗下照片分享平台Instagram昨日宣布，用戶人數突破3億大關，同時表示會為認證名人帳戶推出新系統，讓粉絲確保該帳戶屬於其本人，而非偽冒者。■傳拍賣網站eBay或於明年初裁減至少3,000名員工，約相當於整體人手的10%，據報主要集中在核心市集部門，相信是為分拆旗下網上付款系統PayPal作準備。■傳IMF將於明年年尾對特別提款權(SDR)一籃子貨幣的構成，進行五年一次的複核，屆時有可能首次將納入貨幣籃子當中。消息傳出後，即期一度止跌回升，惟下午再現跌勢，收跌0.22%，報6.1889。■由於匿稱為「Google稅」的西班牙知識產權法將於明年一月一日生效，搜尋引擎巨擘Google周四宣布將於下周二終止西班牙的Google新聞服務，避免西班牙出版商的出版內容在西班牙Google新聞網頁出現而要付費，這是Google首次在全球終止新聞服務。■伊斯蘭激進武裝組織伊斯蘭國（IS）今年八月播出處決美國四十歲記者福利（James Foley）的短片後，現又想將他的無頭屍賣給他的父母或美國政府，索價一百萬美元，交易地點設在與土耳其接壤的敍利亞邊境，並聲稱會預先向對方提供DNA樣本。■俄羅斯總統普京昨日旋風式訪問印度，與印度總理莫迪舉行會談，兩人討論到能源、核能、貿易、機器製造和軍事技術等領域的合作問題。分析指，美歐制裁和近日油價急挫打擊俄羅斯經濟，普京正為俄國天然資源尋找新的出口市場，印度不僅是俄羅斯自冷戰以來的長期盟友，亦符合普京當前「向東看」的大方向。■國際油價跌勢不止，美國能源企業備受衝擊。不少企業盈利大跌，被迫開始減少鑽探、裁員和削減開支，希望渡過難關。根據Drillinginfo的數據顯示，美國主要產油區北達科他州及得州的石油鑽探項目開始減少，位於南得州的全國第二大活躍產油區「鷹灘頁岩礦區」，鑽台數量由今年7月高峰期的210台，降至近期的190台。美國上月批出的鑽探許可較10月份大跌36%。■瑞典手機製造商愛立信入稟印度德里高等法院，控告中國手機製造商小米在印度出售的手機，侵犯8項愛立信手機技術專利。法院周一頒布禁令，暫時禁止小米向印度出口及銷售涉嫌侵權的手機型號，直至明年2月5日下次聆訊為止。■市場消息指，中國證監會下周將外派檢查組，檢查各家券商融資業務是否合規，部分券商或因放高槓桿受到處罰。業內人士認為，這是對券商融資業務的一次清理整頓。分析師指出，目前融資融券餘額市值比例在合理範圍內，且券商槓桿率亦處於較低水平，因此券商融資業務總體來看風險不大，料券商股回調幅度不大。■國際油價近期不斷回落，昨日更急跌至2009年以來的逾5年新低，油價跌，石油股亦受累下跌，「三桶油」中海油（883），中石油（857）及中石化（386）股價齊齊跌逾1%。另一邊廂的航空股就借油價創近年新低而「翻生」，東航（670）、國航（753）和南航（1055）昨日股價齊齊創一年新高，其中東航更急彈逾8%，收報4.05元，創一年新高。■中國平安（2318）早前宣布在香港定向配售5.94億股，擬集資約368.3億元，市傳阿里創辦人馬雲及騰訊（700）主席馬化騰齊齊接貨。平保執行董事兼副總經理李源祥昨日對有關傳言不置可否，並指因客戶規模較大，長期與中國企業作業務探討，強調這些合作非常正常，未來將根據發展需要，與「大型知名企業」共同開拓綫上綫下業務；「三馬」合作已呼之欲出。■熱爆的中廣核電力（1816）上市後，新股市場頓時失去焦點。集資百億的北京汽車（1958）和貴為今年集資王的萬達商業地產（3699）齊坐冷板凳，北汽更慘遭抽飛；資金反而追捧已經上市的中廣核電力，掛牌翌日再升逾9%，昨收3.62元，已較招股價漲30%。■受官員落馬傳聞拖累，佳兆業（1638）郭英成兄弟「退場」，第二大股東生命人壽「坐正」。佳兆業（1638）管理層大執位，繼前晚宣布主席郭英成辭任公司一切職務，昨日又表示其弟郭英智不再擔任執董，公司管理權移交第二大股東生命人壽。佳兆業股價昨急挫逾10%，收報2.08元，創一年新低。■惠譽國際發表報告指出，維持內地人壽展望為穩定，獲評級壽險公司有抵抗力市場地位，以及充足的資本和外部融資能力，將繼續支持他們穩定的信用狀況。持續盈利的波動性和同質產品之間的激烈競爭是關鍵等級的限制。■一個國際科研小組前日發表研究報告，估算全球海洋表面漂浮超過5萬億件大小不一的塑膠垃圾，總重量接近27萬噸，足以裝滿逾3.85萬輛垃圾車。■佔領運動歷時75日後，警方昨全面清理金鐘夏愨道一帶佔領區，原本的帳篷、藝術品和留守者等，一日之間全部消失。整個清場行動約13.5小時，行動中247人被捕，包括學聯秘書長周永康及15名泛民立法會議員，他們被控非法集會、阻差辦公等，至截稿前仍未被釋放。[NT:PAGE=$]■ 瑞士央行：將瑞士2016年通脹率從0.5%下調至0.3%■ 瑞士央行：將瑞士2015年通脹率從0.2%下調至負0.1%■ 瑞士第四季度央行基準利率，預期值0-0.25%，前值0-0.25%■ 意大利10月季調後工業產出年率下降3%，月率下降0.1%■ 法國11月消費者物價指數(月率)實際值：-0.2%；前值：持平。(年率)實際值：+0.3%；前值：+0.5%■ 德國11月CPI月率終值0%，預期值0%，前值0%。調和消費者物價指數終值(年率)實際值：+0.5%；前值：+0.5%■ 韓國12月央行公佈利率決定2.00%，預期值2.00%，前值2.00%■ 澳大利亞11月季調後失業率6.3%，預期值6.3%，前值6.2%■ 澳大利亞11月季調後就業參與率64.7%，預期值64.6%，前值64.6%■台灣 11 日收盤下跌 19.09 點或 0.21%，報 9013.07 點，成交量 786.30 億。■台股 11 日三大法人集中市場賣超40.94億，其中外資賣超38.38億，投信賣超7.45億，自營商賣超2.57億，自營商避險買超7.42億。■日經225指數 11 日收盤下跌 156.0 點或 0.9%，報 17257.00 點。■韓國Kospi指數 11 日收盤下跌 28.97 點或 1.49%，報 1916.59 點。■澳洲S&P/ASX 200指數 11 日收盤下跌 29.70 點或 0.57%，報 5207.40 點。■上海綜合指數 11 日收盤下跌 14.26 點或 0.49%，報 2925.74 點。■香港 11 日收盤下跌 211.98 點或 0.9%，報 23312.54 點。■ 11 日收盤，兌美元報31.262元兌1美元，貶值0.2分，成交量7.02億美元。■ 11 日收報 6.1886 元兌 1 美元，貶值 118 點。■美元/報31.2620，升0.0020或0.01%■美元/報6.1880，升0.0117或0.19%■報88.6520，升0.3810或0.43%■美元/報119.2050，升1.3930或1.18%■/美元報1.2381，貶0.0066或0.53%■/美元報1.5676，貶0.0037或0.24%■美元/報0.9703，升0.0041或0.42%■美元/報1.1528，升0.0047或0.41%■/美元報0.8264，貶0.0053或0.64%"
359,2014/12/12,華南期貨台股期指盤前分析,"◆盤勢分析1. 國際股市:明年全球對OPEC原油的需求將低於預期，因消費增長趨疲，且受美國頁岩油開采熱潮影響，顯示2015年供應將進一步過剩下條明年原油需求，國際股市也在原油大跌預期經濟疲弱下重挫。2. 貨:在今日因美股收低下開低，開盤失守9000點大關，不過指數在權值股拉抬下期貨盤一度翻紅至9048點，不過9000有撐，盤勢有止跌的味道，終場收盤於9010點，下跌36點。3. 期貨選擇權:12月買權未平倉量最大量在履約價9300點的71295口，賣權未平倉量最大量在履約價8700點的68165口。4. :現貨指數今日呈現盤整的態勢，交投清淡，並無太大激情，終場現貨收盤於9013.07點，下跌19點，今日量能788億，為量縮小跌的態勢。(1)技術面:現貨指數從日線來看，跌破半年線(120MA)位置，向下整理的機會增加，且以長線來說仍呈現空方勢，操作上建議在持有現股的同時，買進價位兩檔履約價的賣權避險，以保護現股的部位。(2)籌碼面:[1]現貨部份三大法人今日合計賣超40億元，其中外資賣超38億元。[2]期貨部份外資今日多單增加4074口，總共為淨空單 2632口，外資淨多部位大幅增加，將增加大盤反彈的力道。(3)消息面: 金管會主委曾銘宗9日表示，會請相關單位比較亞洲股市的開盤及收盤時間，了解交易時間是否影響台股競爭力及投資人交易意願，中長期可研議是否有延長交易時間的必要性。(4)短中長期均線位置: 五日線(5MA):9113,十日線(10MA):9130,月線(20MA):9084,半年線(120MA):9165,年線(240MA):8971。"
360,2014/12/12,統一期貨台股期指盤前－年線顯支撐，台股守穩9000點關卡,"◆盤勢分析週三美國股市重挫，週四日經指數與韓國股市跌幅也不輕，受國際股市下跌的影響，早盤震盪走跌回測年線，所幸盤中支撐買盤進駐盤勢逐漸回穩，多方也趁勢緩步拉回至平盤附近，雖然尾盤仍見小幅壓力，但下檔支撐穩健，短期跌勢有機會稍微和緩，電子多空拉鋸開低緩步收斂跌幅，但技術面短線空方略占優勢，趨勢暫以保守看待，金融在政策面利空傳出轉圜空間的激勵下也隨著大盤收斂跌幅，但整體趨勢仍未見多空明顯表態情況，非金電跌勢相對較重，所幸盤勢並未出現激烈失控情況，短期趨勢偏向中性；下跌36點，逆價差3.07點，電子期下跌1.15點，正價差0.05點，金融期下跌4點，逆價差0.27點。下跌正價差轉為逆價差，市場趨勢偏向保守。未平倉部位分析，自營商淨多單減少2,075口，淨多單部位3,460口；投信淨多單增加29口，淨多單部位155口；外資淨空單減少4,074口，淨空單部位2,632口；外資賣超現股38.38億元，期貨淨空單減少，看法中性偏空。技術面觀察，在美國股市高檔重挫的影響下跳空開低，早盤賣壓沉重一度回測年線支撐，所幸跌深接低買盤進駐拉抬指數回到平盤附近，盤中觀望氣氛逐漸濃厚，盤勢轉為狹幅區間震盪，尾盤雖然再度出現小幅震盪，但終場台股仍成功守穩9000點關卡作收，而成交量萎縮為786億元。外資現貨賣超，期貨淨空單減少，在亞股中相對抗跌，年均線支撐穩健，短期趨勢可能偏向區間震盪。◆選擇權分析多空就選擇權籌碼觀察，賣權/買權未平倉比由1.05上升為1.06，仍為中性偏多格局。在最大未平倉量序列部份，買權維持為9300點，賣權維持為8700點，外資選擇權淨空單部位約3萬口。"
361,2014/12/12,統一證券盤前－短線拉回無礙偏多行情，佈局績優題材類股,◆盤勢分析【昨日盤勢】：歐美股市下挫，拖累昨日台股表現，開盤下跌13點開出後，雖然試圖再度站上均線糾結的壓力區9150位置，但盤中傳出大戶條款延審，市場信心動搖，賣壓再度湧現，八大類股全線臉綠，一度下殺至9015點才止穩，隨後盤勢回穩整理直至盤尾。觀察盤面類股表現，電子、傳產、金融三大族群全軍覆沒，分別下挫1.06%、0.99%與1.22%；電子次族群跌勢集中光電與電腦股，分別下挫1.47%與1.45%；傳產次族群如生技、鋼鐵、紡織、金融，也分別下挫1.42%、1.41%、1.23%與1.22%。終場重挫96點或1.06%，以9032作收，月線再度失守，成交量放大為920億元。【資金動向】：三大法人合計賣超152.69億元。其中外資賣超113.41億元，投信賣超12.74億元，自營商賣超26.54億元。外資買超前五大為華邦電、宏碁、長榮航、寶滬深、鴻準；賣超前五大為鴻海、國泰金、中信金、台積電、永豐金。投信買超前五大為華航、長榮航、兆赫、聯電、仁寶；賣超前五大為友達、兆豐金、群創、嘉聯益、日月光。資券變化方面，融資增8.5億元，融資餘額為2012億元，融?減2.84萬張，融券餘額為49.6萬張。【今日盤勢分析】： 台股雖連日來指數走低，失守10日線及月線，外資買盤縮手，權值股股價亦連日下滑，大盤指數欲振乏力；但考量下列因素，後市仍不看淡。首先，美國經濟持續復甦，非農就業人口指標優於預期，加上傳統銷售旺季來臨，拉貨需求上升，加上美元持續升值，可望帶動我國外銷廠商的營收表現。其次，台股過去十年來，12月月線上漲機率高達九成，今年仍可看到集團以及法人作帳股表現相對亮眼，台股回檔之際，逢低進場佈局勝率高。其三，就技術面觀察，台股月均線仍呈現多頭排列，加上12月至目前為止，量能明顯放大，資金水位提升，預計12月17日大戶條款重審，放寬限制機會大，資金動能可望進一步提升。建議選股方面，(1)過去12月作帳行情明顯的個股，例如3474華亞科，上漲機率87.5%，平均漲幅19.9%，2408南亞科，上漲機率80%，平均漲幅19.8%，2329華泰，上漲機率80%，平均幅度17.3%等個股。(2)汽車零組件族群相關個股如胡連、怡利電、F-貿聯、F-廣華。還有政策面利多族群為生技及營建類股。(3)旺季來臨的遊戲、紡織、航運以及年底法人作帳集團股等皆可注意。【投資策略】：外資連日賣超，向來受外資青睞的前20大權值股中，昨日僅華亞科以及宏達電逆勢上漲，其餘皆全數下跌，權值股走弱，加上大戶條款延審，使大盤短線受到壓抑。但觀察美國景氣復甦，加上陸股、港股持續維持高檔，加上台股基本面佳，年底作帳行情仍可期待，預期指數近日拉回修正後，向上仍有期待空間，建議逢低佈局抗跌績優股，11月營收佳的個股，年底作帳行情個股以及旺季來臨的汽車零組件，受惠於油價下跌的航運類股等。
362,2014/12/12,大昌投顧盤前分析,◆盤勢分析1.大盤昨日走勢仍然不佳，早盤以小低盤開出之後，壓力持續沉重，指數一路走低跌破月線，一直到9000點關前才見到有買盤進場撐盤，整體跌幅相當沉重，而目前下方距離季線及年線僅約60點左右距離，若這些指標族群走勢仍未能有所起色，則跌破的機率仍是相當大，且昨晚美股跌幅沉重，對今日開盤也將帶來不利影響，因此操作上需更加注意風險，不過昨日又恢復以中大型股為跌幅主力，中小型股走勢相對緩和，是目前較可留意的族群，目前選股上仍以基本面為主，可留意營運情形及展望較佳之個股族群，昨日11月營收公布完畢，一些表現不錯符合市場預期的個股族群，仍可持續留意，不過一些股價位於高檔，或已反彈過一段，卻缺乏繼續上漲動能者，就須注意風險。今日預期區間：8940-9080點。2.在各類股題材部分，電子類股昨日整體走勢仍未見起色，也跌破了月線及半年線，雖然盤中可見有低接買盤進場，不過後續最好能儘速站回半年線之上，盤勢才可回穩；昨日指標股、權值股等走勢仍不佳，主要在於近期外資於現貨部位轉為調節方，因此不易有較大行情，也讓指數缺少上漲動能，後續操作上，仍以中小型股為主，但仍以買黑賣紅原則，不宜過度追高。昨日大多數族群都呈現回檔走勢，僅光纖、DRAM等少數族群較為穩健，光纖族群我們已提過，後續展望仍佳，可持續留意，而DRAM族群短線上也可能有反彈走勢，不過明年DRAM族群整體供需應仍維持平穩格局，不易出現缺貨大漲走勢，因此不宜過度追高；另外，面板族群昨日走勢不佳，不過展望明年供需情形也應維持平穩，因此若出現急跌走勢則可留意。電子類股另外如晶圓代工、封測、工業電腦、網通、設備廠，也是展望不錯的族群，可於此波整理過後分批做中長線布局，以及年底消費旺季相關的消費性電子供應鏈，如蘋果概念股、NB、PCB、電池、砷化鎵等族群，也都可留意，不過短線上可能震盪較為劇烈，需更加注意風險。3.在傳產類股部分，昨日在包括權值股在內的多數個股走勢也仍屬弱勢，前幾日走勢較佳的汽車零組件、生技等族群也呈現回檔走勢，盤面缺乏指標族群帶領，整體表現不佳，短線上由於題材較少，不易有較佳走勢，後續仍以中長線布局為主，除了剛剛提到的生技及汽車零組件族群之外，另外如航空、海運、成衣、百貨、水泥等，也可留意。在金融類股部分，昨日雖然部分中小型銀行股走勢不錯，不過由於主要指標股走勢仍是不佳，使得金融類股整體跌幅又是三大類股中最多，短線上不易有較佳走勢，後續題材主要仍在年底兩岸金融三會的題材，不過操作上以中長線布局為主，可留意獲利、展望不錯之個股，如富邦金、中信金、國泰金等較佳。
