,date,title,content
0,2014/12/16,金控、子公司間共同行銷 個資使用設緊箍咒,金控法修法前，金控旗下子公司取得的客戶個資包含姓名、電話、身份證字號，出生年月日等，在獲客戶同意後，可作為金控旗下其他子公司行銷使用，但金控法修法後，金控子公司獲客戶同意後，作為共同行銷的個資只限「姓名」及「地址」。金管會表示，除經客戶同意者外，金控子公司間共同行銷的個資不得含有客戶姓名或地址以外的其他資料。金管會還限制，金控與客戶的往來契約，應訂定讓客戶選擇是否同意提供姓名或地址以外的其他資料作為行銷使用的欄位及簽名處，另為保留金融機構實務執行的彈性，該往來契約內應列名運用資料的子公司名稱部分，刪除「供客戶勾選」的規定，並增訂金控因其組織異動，而增減子公司時，應於金控及其子公司網站公告。金管會強調，金控子公司接獲客戶通知停止使用其資料，原則應「立即停止」所有子公司交互使用其資料，惟如客戶明確表示僅停止部分子公司交互使用其資料時，得依客戶通知的意旨辦理。
1,2014/12/16,部分證券商自有資本適足比率門檻 金管會放寬,為提升證券商之資金運用效率，增加證券商競爭力，金管會今(16)日宣布，放寬部分證券商自有資本適足比率門檻之規定。金管會研議修正證券商辦理證券業務借貸款項管理辦法、證券商辦理有價證券借貸管理辦法、證券商辦理客戶委託保管及運用其款項管理辦法、證券商辦理有價證券買賣融資融券管理辦法、證券商辦理財富管理業務應注意事項等規定及相關函令，將於近期發布施行。修正重點如下：一、放寬證券商申辦相關證券業務之自有資本適足比率要求：將證券商申辦證券業務借貸款項、有價證券借貸、客戶委託保管及運用其款項、有價證券買賣融資融券、財富管理、客戶委託辦理應付交割款項投資貨幣市場之行紀、運用客戶買賣有價證券結餘款項之代理、自行買賣外國有價證券及從事外國衍生性金融商品避險交易、擔任創始機構、擔任華僑及外國人投資證券管理辦法第17條規定之保管機構等之自有資本適足比率調降至150%。另對有特殊需要之證券商，得專案核准放寬其轉投資各事業之自有資本適足比率規定。二、放寬證券商辦理證券業務借貸款項規定：參酌證券商辦理有價證券買賣融資融券融通期限、擔保品範圍、最高融資限額之調整，一致放寬相關規定。三、其他：證券商辦理財富管理業務，明定涉及全權委託投資業務之委託人指定營運範圍或方法之集合管理運用業務種類，亦應設置專責單位等相關規定；復考量該業務種類之申請方式，是送中華民國信託商業同業公會審查後轉報金管會核准，因此配合修正證券商總公司以信託方式辦理財富管理業務之申請程序。
2,2014/12/16,抓到違法「皮包客」！外資巴克萊遭重罰1200萬元 創業界最高,"外資巴克萊銀行台北分行因協助未在台設立據點的香港關係企業「巴克萊亞洲資本公司」，以非法「皮包客」在台銷售海外金融商品，被金管會重罰1200萬元，罰鍰金額更創業界受罰最高，同時，禁止該行一年內申請新種業務，即金融進口替代業務一年內都不能申請。金管會表示，巴克萊銀行台北分行自100年起至103年5月，長期提供營業場所及設備，協助未經核准在臺設立據點的香港關係企業巴克萊亞洲資本公司(Barclays Capital Asia Limited)人員於我國境內銷售結構型及固定收益商品，銷售對象包含銀行、保險、證券以及投信等金融機構，交易件數有數百筆之多，此「皮包客」的違法行為，經核該行未確實執行內部控制制度，已違反銀行法以及金管會函令。巴克萊銀行台北分行還於2010年到2011年中，代籌備中的「台灣巴克萊資本證券公司」聘僱工作人員並支付薪資，影響分行獲利達4,768萬元，且代墊款項也未獲償還，無法確保台北分行財務資訊的可靠性。金管會表示，上述二項違反事由，除共計罰鍰1200萬元，為銀行業最高罰鍰外，巴克萊銀行台北分行還被罰禁止一年內申請新種業務，並要求該行陸姓總經理離職。"
3,2014/12/16,信用卡紅利點數 一年作廢價值高達20億元,國內36家發卡銀行，有17家信用卡的紅利點數期限只有2年，民眾消費累積的點數必須在期限內兌換，否則到期馬上歸零，隨著年底將至，約有價值20億元的紅利點數恐白白作廢。金管會表示，紅利點數為發卡行額外提供給卡友的服務，發卡行一定要提前告知，若要變更契約內容，更必須提前60天告知。據金管會最新統計，累計前10月信用卡簽帳金額達1.71兆，全年可望突破2兆，若以回饋率千分之3計算，今年發卡行發出的紅利點數價值高達60億元。不過，隨著景氣回升、消費力道增加，卡友刷得多，紅利點數累積也跟著水漲船高，但是卡友卻常常沒兌換，信用卡紅利點數一年作廢價值約20億元。金管會表示，紅利點數是銀行提供給持卡者的贈品，銀行會跟商品業者簽約以提供兌換紅利的各種贈品，不過，紅利點數設了截止日期，金管會有要求點數到期前要提醒持卡者，且一定要書面或者電子郵件充份告知持卡人紅利點數的使用範圍、條件和期間，要充份告知，如果有變更要前提60天告知。
4,2014/12/16,俄羅斯股匯風暴 金管會：國銀曝險307億元,油價直直落，重創俄羅斯經濟，盧布大舉崩跌，金管會今(16)日統計，台灣本國銀行對俄羅斯的曝險僅有307億元，曝險部位比率低，俄羅斯風暴對國銀影響不大。受到原油價格重挫之衝擊，同為產油國的俄羅斯爆發股匯雙跌，為了力阻盧布遽貶，俄羅斯央行今天閃電升息，平息市場恐慌。俄羅斯的股匯風暴也引發金管會關注，金管會統計，本國銀行對俄羅斯的曝險為307億元，銀行授信的部分178億元、投資為129億元，本國銀行對俄羅斯的曝險影響不大。金管會表示，目前狀況還在控制中，金管會持續觀察，銀行對於單一金融機構、國家等是否有集中度比較高問題。
5,2014/12/16,瑞銀：明年油價恐見3字頭 但將迅速反彈 優先布局3大題材,張繼文認為油價明年就會觸底，到時候再介入能源、俄羅斯基金。(鉅亨網記者許庭瑜攝)國際油價跌跌不休，對此瑞銀投信投資部主管張繼文認為，2015年油價還可能再探低，且達到2008年金融海嘯的水準每桶30美元，不過隨即油價將會大幅反彈，預估可望回升至70-80美元。而在油價走低的情況下，可以優先布局3大題材，包括航空運輸、美國消費，以及亞洲股市。張繼文指出，雖然油價今年來已經下修近5成，不過仍然有往下跌的空間，最低也可能會來到3字頭，只是在這樣的環境下，勢必有許多產油公司將面臨倒閉、減產的危機，因此油價將會快速回升至平衡，2015年油價仍上看80美元。而在低油價投資題材上，航空運輸類股因為成本降低會率先受惠，另外美國消費也可能受此刺激，並且帶動美股走勢，最後則是亞洲石油進口國，根據資料顯示，油價每跌10%，亞洲各國GDP就可望年成長0.15%-0.5%。至於能源股部分，短期還是要盡量避開，同時美國高收益債券中也有許多能源債券，因此也將會受到拖累。不過由於預估明年油價觸底後將會快速反彈，所以張繼文認為，當油價出現3字頭後，將可以開始布局能源基金或者俄羅斯基金。另外瑞銀財富管理投資總監辦公室則提出，目前應該降低對低油價更為敏感的高風險債券部位配置，即美國高收益債券和以美元計價的新興市場主權債券。但由於對全球經濟看法仍正面，因此利用近期市場走跌機會，加碼瑞士股票和短存續期的美國投資級債券。
6,2014/12/16,蕭英鈞：加速東洋邁向年營收10億美元級！國際購併結盟都是選項,東洋董事長蕭英鈞：加速國際化 邁向年營收10億美元級！(鉅亨網記者胡薏文攝)東洋()新任董事長蕭英鈞今天表示，經過半年的整頓，東洋第3季開始重回獲利軌道，第3季單季獲利已超越上半年，第4季光是本業獲利也可望超越第3季。而東洋也加速朝向國際化目標前進，而要成為國際化藥廠，年營收至少是10億美元，甚至20億美元規模也太小，東洋除了加速擴充海外市場外，包括國際購併、國際深度策略結盟也都是目前評估中的選項！蕭英鈞為東洋原始創辦股東之一，今年6月起接下東洋董事長職務，蕭英鈞表示，東洋是台灣生技界領導企業，他注重的是成長率、本業，必須維持良好的純益率，對公司、員工、股東都有責任。經過近半年的調整，東洋重回獲利軌道，第3季單季淨利為9500多萬元，超越上半年的7000多萬元水準，對於第4季的表現，也樂觀看待，光是本業獲利將可超越第3季，業外部分，還有出售近2000張智擎()的獲利貢獻。蕭英鈞指出，他將努力讓東洋加速邁向國際化，其中在新學名藥部分，每年將取得2到3種新藥藥證上市，例如明年即有肺癌、腎臟癌新藥上市，同時在海外據點方面，每年也將擴充2-3個國家，明年預定新增的海外據點為韓國、菲律賓、越南，後年將往東歐或中南美洲佈局。蕭英鈞表示，至於國際化部分，台灣藥品市場僅佔全球0.4%，因此勢必得朝向國際化，東洋並不預設立場，採開放態度與國際大廠合作，包括購併，或類似美時()模式，與國際大廠深度結盟等，都是評估的選項，目前也已有數個案子正在交換意見中。目前東洋目前在越南10張以上藥證，泰國原廠開發藥也有4張，菲律賓藥證超過10張，其中還有部分為獨家銷售，擁有與原廠開發商相同資格，蕭英鈞表示，東洋的產品深度夠，且在微脂體、微球等技術方面，都是已進入實際應用領域，未來在海外市場擴充、高障礙製劑等2方面，將同步成長，未來幾年讓2者比重相近。
7,2014/12/16,張忠謀：油電價格下跌應回饋民眾 增加消費,近期國內的油價跌至2字頭，台電今年大賺，對此，台積電() ()董事長張忠謀認為，油電價格下跌應回饋民眾，增加消費。張忠謀今天參加工研院院士會議，主題為「台灣產業結構轉型的策略與作法」，會後對於近期的油電價格，發表上述看法。他以上一期「經濟學人」刊物的內容指出，全球油價下跌可以促進消費，估計全球GDP會上升0.3%。張忠謀認為，錢到了口袋是好事，油電價跌，讓民眾手中有多餘的錢可以增加消費。
8,2014/12/16,◆投信連續3日賣超個股,投信連續3日賣超個股1.投信連續賣超3日的股票(2891)中信金、 (2317)鴻海  、 (2409)友達  、 (2311)日月光、 (3189)景碩2.投信連續賣超2日的股票(2409)友達  、 (2317)鴻海  、 (2311)日月光、 (2891)中信金、 (2883)開發金3.投信當日(16)賣超的股票(2891)中信金、 (2311)日月光、 (2317)鴻海  、 (2474)可成  、 (2883)開發金
9,2014/12/16,◆投信連續3日買超個股,投信連續3日買超個股1.投信連續買超3日的股票(2603)長榮  、 (2609)陽明  、 (00632R)T50反1、 (2303)聯電  、 (1460)宏遠2.投信連續買超2日的股票　(2603)長榮  、 (2609)陽明  、 (00632R)T50反1、 (2303)聯電  、 (1460)宏遠3.投信當日(16)買超的股票(2603)長榮  、 (00632R)T50反1、 (2303)聯電  、 (3474)華亞科、 (1460)宏遠
10,2014/12/16,◆外資連續5日賣超個股,外資連續5日賣超個股1.外資連續賣超5日的股票(2317)鴻海  、 (2887)台新金、 (2882)國泰金、 (2891)中信金、 (2890)永豐金2.外資連續賣超4日的股票(2317)鴻海  、 (2887)台新金、 (2882)國泰金、 (2330)台積電、 (2891)中信金3.外資連續賣超3日的股票(2317)鴻海  、 (2887)台新金、 (2883)開發金、 (2330)台積電、 (2890)永豐金4.外資連續賣超2日的股票(2317)鴻海  、 (2887)台新金、 (2883)開發金、 (2330)台積電、 (2890)永豐金5.外資當日(16)賣超的股票(2317)鴻海  、 (2883)開發金、 (2887)台新金、 (2890)永豐金、 (2303)聯電
11,2014/12/16,◆外資連續5日買超個股,外資連續5日買超個股1.外資連續買超5日的股票(3481)群創  、 (2409)友達  、 (2354)鴻準  、 (3061)璨圓  、 (0061)寶滬深2.外資連續買超4日的股票(2409)友達  、 (3481)群創  、 (3061)璨圓  、 (2354)鴻準  、 (0061)寶滬深3.外資連續買超3日的股票(2409)友達  、 (3481)群創  、 (3061)璨圓  、 (2311)日月光、 (2325)矽品4.外資連續買超2日的股票(2409)友達  、 (2311)日月光、 (3061)璨圓  、 (3481)群創  、 (2325)矽品5.外資當日(16)買超的股票(3481)群創  、 (2409)友達  、 (3061)璨圓  、 (2311)日月光、 (2325)矽品
12,2014/12/16,價格戰暫歇 12月NAND合約價緩跌 明年Q1延續走跌趨勢,TrendForce旗下記憶體儲存事業處DRAMeXchange研究顯示，美系廠商在季底財報結算壓力過後，不再採取積極價格戰，原廠間戰火稍緩，加上模組廠庫存充足大多傾向月底再進行採購談判，12月上旬交易氣氛冷清，NAND Flash合約價呈現持平或僅微幅下跌0-2%；資深研究經理陳玠瑋預期，NAND Flash合約價格走跌趨勢將延續到明年第1季。DRAMeXchange指出，模組廠預期NAND Flash合約價價格跌勢將持續，在手中庫存充足下，大多傾向月底再進行採購談判，以爭取更優惠的價格，因此12月上旬交易氣氛冷清。陳玠瑋表示，在歐美聖誕節備貨動能正式結束後，受到季節性因素影響，預期明年第1季全球智慧型手機、平板電腦與PC的銷售量，都會較上季衰退1成以上的幅度，造成系統OEM端客戶對eMMC、eMCP與SSD等訂單需求持續疲軟。陳玠瑋說，為了減輕產能去化壓力，NAND Flash供應商對通路端模組客戶的供貨料也將增加，但在記憶卡與隨身碟疲弱的銷售情況無法改善下，模組廠傾向採取保守的採購策略，以規避庫存跌價風險。陳玠瑋指出，受到OEM與通路端客戶整體需求明顯下滑影響，預期NAND Flash合約價格走跌的趨勢將延續到明年第1季。
13,2014/12/16,張忠謀：爭取當地訂單 台積電將赴陸設小部分28奈米產能,工研院今(16)日舉行院士會議，關於中國大陸積極扶植半導體業，台積電()董事長張忠謀今(16)日表示，中國政府以市場為壓力點，要求不在中國土地上生產的產品，就不能在當地販售，為因應這個問題，台積電也打算赴陸建置小部分的產能，粗估是N-2世代(28奈米)，以避免因沒有生產基地，而無法爭取當地訂單的窘境，他也坦言，台積電不去，三星也會去，不過他強調目前仍在初期規劃的階段，細節並未完全確定。張忠謀表示，中國大陸以其市場為壓力點，政策要求若產品未在中國大陸生產製造，則不能在當地販售，台灣面對這樣的壓力各有因應方式，而台積電為掌握後續訂單機會，也必須啟動赴陸建置產能的計畫。他強調，台積電不過去，三星也會過去，三星已在中國西安建置記憶體產能，下一步可能就是建邏輯產能，若台積電沒有登陸，可能會因此失去原本既有的客戶，將其拱手讓給三星。不過張忠謀強調，台灣還是台積電的主要生產基地，赴陸設廠比重將會非常低，估不到1成比重，且製程會是N-2(最先進後面2個世代)，也就是28奈米，他強調，目前中國晶圓代工廠中芯製程在N-3(40奈米)，台積電設28奈米製程產能，就已足夠滿足需求。他也認為，中國大陸的客戶目前並無很大的先進製程需求，估28奈米就可支應未來5-8年的市場所需。
14,2014/12/16,外資大賣近百億  內資同步站賣方,受到國際市場影響，今天外資賣超動作加大，減碼上市股超過98億；內資小進小出，投信賣超8億、自營商賣超1千多萬，動作都不大。合計三大法人今天在集中市場賣超106.57億，明天結算，美國正值聯準會會議期間，國內有大戶條款的修訂，是否牽動外資動向值得密切關注。（張佳琪報導）台股在九千點附近浮浮沈沈，成交量退縮反應投資人觀望的心情。外資近來操作轉趨謹慎，十六號加大賣超動作大賣98.39億，狂賣鴻海超過4萬張是賣超第一大，聯電和台積電也各被賣超2萬多張分別是賣超第二大、第三大，這幾檔個股似乎提早出現外資年底提帳的跡象。連續被賣超多日的重量級金控股，仍是壓力未減，台新金、中信金、開發金都被外資再賣1萬多張，外資同步減碼元大金和台灣五十各6千多張。不過，外資對面板二虎的操作依舊正向，買超群創6千多張、友達5千多張是買超前兩名，也支撐兩檔股價全力抗跌。投信賣超8億元，中信金排名賣超第一大，賣超3千多張，其次是鴻海、日月光、可成，賣超張數各1千多張。其他賣超股有開發金、台積電、陽明等等。自營商進出動作很小，觀望內外各項不確定因素的釐清。短線除了美股和美國聯準會的動向必須留意，國內大戶條款的修訂以及結算也值得關注。由於外資陸續開始放耶誕假期，預期近期外資操作會變小。
15,2014/12/16,張忠謀：台灣產業有機會轉型 應該鼓勵創業,"2014年工研院院士會議。(圖：工研院提供)台灣面臨產業轉型升級的關鍵階段，台積電() ()董事長張忠謀今(16)日指出，大企業轉型升級不易，要換很多腦袋、僱用很多人才，但是台灣轉型是有機會的，做法應該鼓勵創業。會議由智融集團董事長施振榮召開並主持，出席的院士還包括：台達電()創辦人暨榮譽董事長鄭崇華、華碩電腦()董事長施崇棠、長春石化董事長兼總經理林書鴻、晶元光電()董事長李秉傑、廣達()董事長林百里、榮剛()董事長陳興時等企業家，以及中央研究院院士林耕華。出席的政府官員，包括政務委員杜紫軍、經濟部部長鄧振中、經濟部技術處處長林全能，以及工研院董事長蔡清彥、院長徐爵民。張忠謀指出，大企業轉型升級不易，因為轉型過程要換很多腦袋、僱用很多人才，因此難度很高。但是張忠謀認為，台灣轉型是有機會的，做法應該鼓勵創業，以數以千計萬計的數量產生很多新創公司，例如10年當中產生1萬個新公司，當中也許只有5百家公司成功成為大企業，但就有足夠能量讓台灣產業成功轉型升級。智融集團董事長施振榮認為，國家獎勵新創公司需要新機制，因此需要跨部會的國家型計畫，應該由業界主導展開跨部會合作計畫，包括科技部、經濟部、衛福部、金管會一起來做。蔡清彥表示，工研院積極推動新創事業，3年多來已新創成立30家公司，已看到創業的環境改變，過去新創公司的資金募集相當困難，工研院今年成立的14家新創公司中，募資狀況相較過去好轉，其中就有10家創投，3家銀行，以及6家天使創投的投資。蔡清彥進一步呼籲在場的產業大老，可以擔任新創公司的Mentor（導師），多多扶植新創公司。工研院院士會議中，院士認為關鍵核心能力是產業轉型升級的突破點：(1) 關鍵核心能力(Key Enabling Competence, KEC)是很好設計思維的系統性思考，使用者價值，技術突破及商業模式3個要素需同步跨領域推進，並與使用者不斷互動、修正，來突破OEM、ODM的產業結構。(2)  Human Value與美感是台灣要強化的突破點。(3) 工研院要能面對消費者，並與業界同步發展全球化的思維。(4) 要發展最終的客戶及市場驗證，協助創新技術產業化。"
16,2014/12/16,兩岸企業家台北峰會閉幕 促成31項合作 提出9點倡議,為期2天的「2014兩岸企業家台北峰會」今(16)日閉幕，共簽署31項合作協議或意向書，中小企業和文創產業占其中24項，並提出9點共同倡議。2015峰會預計明年下半年在南京紫金山召開，主軸依舊延續中小企業、青年創業。上述的24項合作協議或意向書，有9項與中小企業相關，15項則是文創產業，包括上海自由貿易試驗區設立台灣商品中心合作意向書。此外，生技與健康照護產業合作方面，在兩岸的「藥品審評合作」、「藥物臨床試驗合作」、「推動合資合作醫療機構發展」的面向達成共識。至於9點共同倡議，分別是：(1) 加強產業政策對話，共創合作雙贏格局；(2) 構築合作平台和通路，促進中小企業成長及創新；(3) 支持優先推動兩岸經濟合作架構協議（ECFA），促進兩岸雙向投資；(4) 推進兩岸金融合作，支持經濟發展。(5) 提供有力政策扶持，促進文創交流合作；(6) 著眼產業發展趨勢，深化資訊產業合作；(7) 擴大能源石化合作，加強機械設備交流；(8) 促進生技醫療合作，服務兩岸民眾健康；(9) 關注青年和基層民眾需求，善盡企業社會責任。兩岸企業家峰會台灣方面理事長蕭萬長表示，2013年峰會成立時，組成7個產業合作推動小組，其中宏觀經濟、中小及成長型企業、文化創意和生技與健康照護，都是以中小企業為骨幹。他說，如何讓中小企業受惠，將是今後著力的重點，也希望作法能更貼近民意。雖不會馬上見效，但未來會產生效果。峰會今天同時宣布，「2015兩岸企業家峰會」預計明年下半年在南京紫金山召開，主軸依舊以中小企業、青年創業相關領域為主。
17,2014/12/16,SAP以Run Simple策略 協助85度C、SPEY布局全球市場,全球企業管理軟體領導供應商SAP(思愛普)秉持「RunSimple」的全新策略，2014年除在金融、科技產業成功締造佳績，更積極佈局台灣零售行業有成，成功協助85度C、欣葉集團與SPEY等零售品牌建立強大競爭優勢、提高服務價值，從台灣接軌、立足全球市場。因此賴佳怡希望可以協助台灣零售業架構業務主體，整合多種銷售型態，以企業內外巨量數據精實企業營運、洞察市場趨勢，建立網路時代的競爭優勢。目前很榮幸在此關鍵產業贏得多家指標客戶認可，包括國際知名品牌85度C、連鎖中餐廳欣葉、英商哈維特釀酒集團SPEY等客戶。SAP2014年發布「RunSimple」策略，希望協助在企業創新的同時，減少因技術帶來的複雜性，使企業業務流程得以簡化。2014年上半年SAP雲端運算業務收入創下新高，與去年同期相比，SAP的BusinessSuiteonHANA在第三季更創下三位數成長。此外，SAP大中華區在軟體及軟體相關服務也表現強勁，在科技、機械製造、民生消費品、零售、金融服務和媒體等關鍵產業贏得多家指標客戶。SAP零售管理解決方案可整合物流與金流、業務與管理以及經營與決策，從而提升台灣零售業競爭力、走向國際市場。身為台灣食品零售業的龍頭企業，85度C選擇了SAP整合從中央工廠到店面POS系統一條龍的資訊，更全面導入其遍及台灣、中國、美國、澳洲營運系統。85度C資訊部協理郭明華指出，採用SAPERP後，85度C中國地區每個月的食材耗損率大幅降低。此外，中國地區的總帳結算時間也因為導入SAP之後，有效縮短了工作日程。展望2015年，賴佳怡提強調，SAP在進一步深化雲端產品的創新及發展，協助如金融保險、消費品製造與零售流通業和高科技等產業客戶，提升管理能力、競爭力和獲利的同時，將會聚焦台灣中小企業，以就地部署On-Premise方式，建構以HANA平台為核心的雲端服務，使台灣企業無論規模大小，均能透過SAP的單一整合式平台，在雲端管理所有業務流程，更透過SAP的全球最佳實務，傳承企業經營智慧、經營全球市場。
