,date,title,content
0,2019/12/31,半導體助攻 台股全年大漲23% 總市值達36.4兆元,今 (31) 日台股 2019 年最後一個交易日雖收黑封關，但今年在半導體族群強漲推升下，大盤仍有 23% 以上漲幅，帶動上市股票總市值大增 7.95 兆元，達 36.41 兆元，法人認為，目前外資仍在休假，自營商主導的內資買盤將左右盤勢表現。台股今天受美股拉回、權值股王疲弱與年底獲利了結賣壓湧現，儘管有官股行庫進場買超 20.8 億元，但終究難敵賣壓攻勢，終場指數下跌失守「萬二」關卡。根據證交所資料，今年台股收在 11997.14 點較去年底的 9727.41 點大漲 2269.73 點，全年漲幅高達 23.33%。今年大盤高點落在 12 月 18 日收在 12122.45 點，低點落在 1 月 4 日當天收在 9382.51 點；集中市場全年累計成交金額共 29.56 兆元，較去 32.16 兆元減少約 3.1 兆元。此外，外資與陸資全年總買超金額共 8.16 兆元、總賣超金額共 7.91 兆元，外資全年買超約 2441 億元。
1,2019/12/31,〈台幣強升〉鴻海避險助減輕匯損壓力 本業營收、獲利恐仍受影響,12 月以來強升，組裝大廠鴻海 () 雖然透過避險，減輕業外匯損壓力，但法人分析，12 月營收及第 4 季獲利，還是可能因此受到影響。今日在資金匯回、熱錢湧入下，盤中一度升破 30 元，最高來到 1 美元兌 29.965 元，收盤上漲 0.29 角，來到 30.106 元；若以第 4 季來看，單季強升 9.36 角或 3.02%。法人分析，鴻海產品多採計價，恐因匯兌因素，導致 12 月營收減少，另一方面，兌、及兌第 4 季同步升值，也恐影響鴻海生產成本及獲利。法人指出，鴻海雖然近期配合客戶調整全球產能布局，不過目前生產重心依舊在中國，工資採發放，但產品以美元計價，走升，恐使營運成本上升，對營益率產生影響，而升值，則恐導致鴻海手上大量美元現金部位有匯損壓力。除鴻海外，多數台代工廠營運也都會受到匯損干擾，尤其是短期內升值幅度明顯，代工廠恐不及避險，造成不少匯損，不過業者指出，先前升值幅度明顯，因此各家多有不少避險操作經驗，預料相關損失金額將較過往動輒數十億元、甚至到百億元，將明顯降低。
2,2019/12/31,鈺太12月出貨旺 全年營收年增將逾25% 創歷史新高,MEMS 麥克風廠鈺太 () 受惠筆電、TWS(真無線藍芽耳機) 拉貨續強，加上智能聲控電視高階 DMIC 出貨挹注，法人估，鈺太 12 月營收可望維持高檔，約 1.28 億元，全年營收近 14 億元，年增逾 25%，創下歷史新高。鈺太第 4 季開始供應高毛利產品 DMIC 給智能語音電視客戶，出貨量約 70-80 萬顆，加上 AMIC 成本管控得當，法人估，鈺太本季毛利率可望優上季，上看 3 字頭。鈺太今年 MEMS 麥克風出貨超過 2 億顆，其中，AMIC 達 1.2 億顆，持平去年，高毛利產品 DMIC 則受惠筆電市占率提升，達 0.9 億顆，年增近 3 成。展望明年，鈺太認為，DMIC 在筆電的市占率將從今年的 30% 提升至 40%，加上 DMIC 用在智能聲控電視的出貨量將挑戰千萬顆，雙引擎發動下，營收、獲利可望同步成長。
3,2019/12/31,歡度農曆年  和泰車、六角、百和  先嗨再說,"新年開春，2019 年末內資搶進台股年終行情，帶動大盤交易量連日放大，為 2019 年封關添好兆頭。投資人不妨跟隨投信、自營商、主力及代表散戶的融資四大內資年底緊抱股，搶賺新年行情，台股近期內資交投升溫，年終外資休假之際，交易量仍達千億元水準，也促使指數大盤頂住外資賣超，持續在 12,000 點上方高檔盤旋。展望 2020 年，萬寶週刊陳子榕分析師指出，除了大熱門的 5G、蘋果、半導體等題材，關注一些更貼近生活的類股，也許也會有意外的收穫。2019 年在日本大流行的台灣珍珠奶茶，獲得日本餐飲指南「咕嘟媽咪總研」評選為最能反映今年世態的「年度美食」。珍奶日前才獲流行雜誌「日經 TREND」評選為年度熱門商品第二名，2019 年在日本至少熱銷二億杯。六角國際 () 在 2019 年提出的「APEC 亞太拓展計劃」策略再下一城，六角國際 12 月 25 日宣布與日本「玉」拉麵集團旗下 Good Standard 公司簽約，擴大日本市場規模。六角表示，此次雙方正式授權「日出茶太 Chatime」品牌代理權，拓展日本福岡珍珠奶茶市場，目標瞄準 2020 東京奧運期間將開設日本第 50 家門市。六角公告 11 月合併營收 4.22 億元，年增率 31.11％，打破傳統手搖飲產業淡季慣性，累計 1～11 月營收 45.25 億元，年增 30.08％，投信也積極佈局，連日大單買超，結合 2020 東奧商機，後市看好。東京奧運商機持續發酵，運動衣品銷售帶動紡織類股持續成長，國際運動品牌廠 NIKE 最新財報，較 2018 年同期成長 13％，優於市場預期，其中鞋類、服飾成長動能強勁，法人看好供應鏈將同步沾光，百和 ()、儒鴻 () 業績可望繳出亮眼成績單。其中，百和除了通過 Nike 梭織緹花網布合格供應商認證，為本業挹注新成長動能，再加上大陸無錫建案持續交屋入帳，預估集團 2020 年營收、獲利可望優於 2019 年表現。百和公布 2019 年前 11 個月合併損益，累計稅後淨利 14.22 億元、年增 19.9％，前 11 個月 EPS 4.78 元，已賺贏 2018 年全年的 4.57 元。萬寶週刊陳子榕分析師指出，新的一年到來，也有不少消費者考慮換新車，2019 年 TOYOTA 和 LEXUS 全球銷售亮眼，台灣總代理和泰車 () 也跟著受惠。統計 LEXUS、TOYOTA 雙品牌於 11 月共銷售 1 萬 3,781 台，主要受惠雙神車 Altis 及 RAV4 車款表現亮眼，全面拉高國內市占率達 33.9％，其中 11 月 Altis 賣出 2902 台，RAV4 銷售更達到 3531 台。和泰車 2019 年在新車銷量大幅成長下，第三季稅後淨利 33.01 億元、年增 37.83％；前三季稅後淨利 88.51 億元、年增 15.52％，EPS 達到 16.20 元，改寫同期新高紀錄，第四季銷售可期，預估全年獲利輕鬆站上 20 元。更多萬寶週刊陳子榕分析師觀點 點我看更多 陳子榕 LINE 粉絲團搜尋 ID【@marbo777】本公司與所推介分析之個別有價證券無不當之財務利益關係 以往之績效不保證未來獲利投資人應獨立判斷  審慎評估並自負投資風險"
4,2019/12/31,海外資金匯回專法 財長看好明年匯回金額可達1300億元,財政部長蘇建榮表示，海外資金專法上路滿周年後，預估屆時申請匯回金額至少可達 1300 億元，如有一半資金投入投資再配合申請貸款，預期可帶動實質投資達 4000~5000 億元，並進一步提振內需市場。海外資金專法今 (2020) 年 8 月 15 日上路後，根據賦稅署統計，截至 12 月 30 日止共有 161 件申請，申請匯回金額共 459.17 億元，目前已有 143 件、440 億元資金獲核准，至於實際匯回則有 83 件、金額約 304 億元。蘇建榮分析，預估明年 8 月專法上路滿一年後申請匯回金額達到 1300 億元沒問題，與先前財政部對於匯回資金的低推估相當。蘇建榮進一步指出，海外資金匯回專法 7 月三讀通過時曾附帶決議，將在專法實施滿期滿一年內，由財政部報請行政院核定「受控海外企業 (CFC)」實施日期，對此財政部也將在明年將規劃 CFC 實施方法，並對業者進行輔導。蘇建榮去 (2018) 年 7 月升任財政部長，回顧今年施政成績，他認為最有感的成績包括實質減債、公股銀行簽訂團體協約與辦理持股信託等三大政績。在實質減債部分，中央政府總預算在睽違 10 年後，去年起連續兩年不必舉債還能持續還債。其中去年還債 792 億元、今年還債金額增加至 885 億元，即便有特別預算舉債 430 億元，但仍低於總還債金額 885 億元，換算實質減債金額 455 億元。在公股銀行團體協約部分，包括台銀、土銀、輸銀等 9 家公股銀全都重新簽署團體協約讓勞工保障進一步升級，至於員工持股信託部分，包括合庫、彰銀、一銀、台企銀與兆豐銀也先後辦理員工持股信託，由員工自提部分金額投資股票或儲蓄，行方再相對提撥方式，保障員工退休後生活也有實質加薪之效。
5,2019/12/31,〈武漢爆不明肺炎〉疾管署：即日起直航入境班機登機檢疫,由於中國武漢傳出多起不明原因肺炎病例，疾管署今 (31) 日表示，除了啟動邊境檢疫應變措施，並加強入境旅客發燒篩檢，即日起針對從武漢直航入境班機進行登機檢疫。疾管署指出，已向中國疾控中心及世界衛生組織 (WHO) IHR 窗口確認疫情訊息，近期當地發現 27 例肺炎病例，7 例病情危重，均已進行隔離治療，有 2 例病情好轉。根據中國媒體指出，該肺炎臨床表現主要為發燒，少數病人呼吸困難，呈雙肺浸潤性病灶，大部分病例為武漢市江漢區華南海鮮城經營戶，尚未發現明顯人傳人現象及醫護人員感染。中方表示，若有進一步消息，將會及時通報我方。為因應中國武漢的肺炎流行疫情，防範病例自境外移入，疾管署表示，台灣已依標準作業程序啟動邊境檢疫應變措施，即日起，將針對自中國武漢直航入境的班機進行登機檢疫，除主動評估旅客健康情形外，也在班機上向旅客宣導相關預防措施。疾管署強調，會持續監視武漢的疫情動態，並視疫情狀況調整防治作為，由於目前當地疫情尚未明朗，籲請民眾接獲來源不明或未經證實的疫情資訊，勿隨意散播、轉傳。疾管署呼籲，冬季除了是流感流行季節外，也是肺炎好發的時期，提醒民眾務必做好個人手部衛生及咳嗽禮節，儘量避免出入人潮擁擠、空氣不流通的公共場所；近期如曾前往中國武漢地區的民眾，返國 10 天內若有發燒或急性呼吸道症狀，應主動通報。
6,2019/12/31,〈台幣強升〉工具機廠營運承壓 Q4獲利恐遭侵蝕,今 (31) 日早盤快速升破 30 元整數大關，升值壓力重，雖然近來工具機產業訂單已出現回溫，但由於產業外銷比重高，近期強勢，強升不利出口，工具機廠商本季獲利恐遭侵蝕，營運有壓。工具機產業以出口為主，升值對台廠營運造成壓力，機械業大老先前紛紛疾呼，盼政府能適度貶值，以利出口。機械工業同業公會理事長柯拔希就認為，台廠除產品外銷承受關稅壓力，匯率優勢也不如南韓，在關稅與匯率雙重因素夾擊下，再強的競爭力也會流失，導致產業外移，而各國都以貶值保護企業，呼籲央行跟著全球潮流走。不過，上銀集團 () 總裁卓永財則認為，匯率貶值對出口有利，但不認為越貶越好，貨幣還是要維持中性，且升貶需看台廠競爭對手，如韓國、中國貨幣表現，若及相繼貶值，也應該走貶，但要適度貶值，幅度至少不要差太多。近來受惠美中貿易談判達成第一階段協議，加上工具機產業歷經近一年庫存去化，市場需求開始出現回溫跡象，也推升工具機廠出貨動能，然而，近期表現強勢，將影響工具機廠本季營運表現，侵蝕獲利空間。今日早盤快速升破 30 元整數大關，但收盤前一小時明顯收斂，終場兌一美元僅收升 2.9 分至 30.106 元，力守 30 元防線。今年以來，第 3 季底起外資不斷匯入，使升值壓力加重，但央行堅守動態穩定態度，全年僅升值 2.04%。
7,2019/12/31,好會刷！前11月簽帳金額2.93兆元 超越去年全年也創同期新高,台灣人消費力道不容小覷，金管會統計，前 11 月簽帳金額共 2.93 兆元，比去年同期年增幅增加 1 成，也超越去年全年，全年簽帳金額突破 3 兆元毫無懸念，統計金額也將站上歷年同期新高。金管會今 (31) 日公布最新信用卡業務資訊，前 11 月簽帳金額累計共 2.93 兆元，提前超越去年全年 2.88 兆元，比起去年前 11 月簽帳金額年成長 1 成；此外，累計發卡量共 697 萬張，同步刷新歷史紀錄。銀行局官員表示，今年簽帳金額刷新歷史紀錄，有三大原因：一、國銀發卡量增加與促刷行銷變多，二、可刷卡通路增加，包括公務機關繳費平台、小額支付都可用信用卡支付，三、第三方支付 APP 行銷活動多，都是推升簽帳金額成長的原因。以單月簽帳金額來看，11 月整體簽帳金額共 2616 億元，較前月減少 196 億元、月減 7%，銀行局副局長黃光熙解釋，11 月簽帳金額較 10 月減少主要是 10 月有雙十連假、百貨公司週年慶帶動所致。發卡量部分，台北富邦銀行靠著 J 卡、MOMO 聯名卡帶動單月發行卡量衝上 13 萬張，擠掉玉山銀榮登單月發卡王寶座。在電子票證部分，11 月總流通卡量共 1.24 萬張，較前月增加 168 萬張；消費金額共 70.7 億元，較前月減少 4.9 億元。
8,2019/12/31,系統電11月稅後虧損2980萬元 前11月每股虧1.57元,系統電 () 今 (31) 日公告 11 月自結稅後淨損 2980 萬元、每股淨損 0.2 元；累計前 11 月稅後淨損 2.37 億元，每股淨損 1.57 元。系統電 11 月營收 9547.7 萬元，月增 5.8%、持平去年同期；稅後淨損 2980 萬元、每股淨損 0.2 元，虧損較前月縮小、但較去年同期擴大。累計系統電 10-11 月營收 1.86 億元，年增 3.6%，稅後淨損 5850 萬元，每股淨損 0.39 元。若加計前 3 季營收 7 億元、稅後淨損 1.78 億元、每股淨損 1.18 元，系統電前 11 月營收 8.86 億元、年減 35.8%，稅後淨損 2.37 億元，每股淨損 1.57 元。系統電股價近期飆漲，今日衝上亮燈漲停 17.85 元，近 5 個交易日飆漲近 2 成、月漲 130.6%、第 4 季來看更是大漲 175.5%，也被主觀機關要求公告自結損益。
9,2019/12/31,大立光1/9法說會 聚焦新客戶、產能配置與新技術等三大重點,大立光 () 將在 2020 年 1 月 9 日召開法說會，除第 4 季獲利外，法人將關注三大重點，包含第 1 季進入蘋果手機銷售淡季，大立光非蘋陣營新客戶開發進度，同時，手機多鏡頭設計成主流，推升鏡頭需求大增，大立光新產能與既有產能的調配，還有 8P 與 3D 感測鏡頭等新科技進度，都是法說重點。就大立光第 4 季獲利來看，10 月及 11 月營收連續因蘋果手機需求增加帶動，衝上 66.26 億元、66.56 億元新高，證券分析師張陳浩估計，大立光 12 月營收應可在 66 億元水準，第 4 季營收上看 200 億元創新高，毛利率將達 70% ，扣除匯損，大立光第 4 季每股純益將達 68-70 元也創新高。加上前 3 季每股純益 150.37 元，大立光今年每股純益將達 220 元，改寫 2017 年大立光創下的 193.65 元歷史紀錄。不過，升值走勢下，近 3 個月來對美元升值達 3.46%，對大立光營收、毛利率都造成不利影響。證券分析師黃漢成指出，第 1 季進入蘋果手機銷售淡季，市場將聚焦大立光非蘋新客戶開發進度，同時，手機多鏡頭設計成主流，推升鏡頭需求大增，大立光新產能進展也是關注焦點。去年大立光在台中精密機械園區完工的二廠，依客戶訂單需求不斷移入設備及產能，可利用空間將在今年底填滿，大立光新購入的 4 處土地及廠房中，已有一處現有廠房已用於擴充產能，其餘 3 處可建廠土地，即使立即投入興建，最快開出新產能也將在 2023 年後。因此，黃漢成表示，大立光目前遭遇競爭對手玉晶光 () 大力建置新產能的競爭，除改善現有製程及良率，是否有其他方法開出新產能，將是市場關注焦點。新產品上，雖然大立光 7P 鏡頭已開始出貨，但黃漢成表示，包括水滴型鏡頭設計、8P 鏡頭、3D 感測鏡頭、潛望式鏡頭，甚至市場一再傳言的新科技「黑鏡頭」開發、銷售進度，也是市場及法人關注焦點。
10,2019/12/31,〈武漢爆不明肺炎〉台醫材、疫苗廠備戰 現有產能估可滿足需求,中國武漢出現多起不明原因肺炎，市場擔憂 2003 年台灣 SARS、H1N1 夢魘恐重演，當年病情蔓延造成口罩、體溫計等醫材供不應求，對此，醫材廠豪展 () 指出，目前產能相較 2002 年大幅提升，可供應國內外需求，另外疫苗廠國光生 () 已研發出相關疫苗，只需進行臨床試驗。中國廣東 2002 年爆「非典型肺炎」，出現逾 5000 例感染案例，隔年疫情也蔓延至台灣，並奪走百條人命。當年，政府為預防 SARS 疫情延燒，量體溫更成全民運動，其中台灣主要供應商豪展，短短幾個月體溫計出貨量倍數成長，2009 年又再爆發 H1N1，業績更扶搖直上，毛利率突破 30%，稅後純益 5800 萬元，每股純益 2.31 元，並挾氣勢在 2011 年掛牌。豪展表示，疫情爆發時，僅台灣一個廠房生產產品，不過現今規模、技術已大幅提升，若再有相關肺炎疫情蔓延，中國、台灣產能都可應付需求。國光生也指出，由於疫苗開發時程，從萃取基因、分析到量產時程相當長，2002-2003 年 SARS 爆發，尚無疫苗可施打，不過 2009 年中國爆發 H1N1，疫苗研發技術已成熟，國光生當年提供政府 1000 萬祭疫苗，營收貢獻約 20 億元。國光生表示，目前已開發相關抗肺炎疫苗，不過仍待政府審查進入臨床試驗階段，若未來有需求，將配合政府加快臨床進度，並上市、量產。
11,2019/12/31,金管會公布媲美星港財管方案 估可替台股注入2兆資金活水,金管會今 (31) 日公布「財富管理新方案」，預計將開放資格符合外資可用外幣為擔保辦理資金流通、外幣投資型保單全委帳戶可投資台股，估新財管方案實施後，可為台股市場注入 2 兆元資金活水。金管會趕在 2019 年最後一天公布「媲美星港財富管理方案」，主要從三大策略著手共計 19 項措施，包括高資產客戶財富管理、開放多元化金融商品與投資管道、拓展金融業務範疇。金管會官員表示，19 項財富管理方案措施大多可在明年 6 月底前陸續上路，但部分業務考量涉及匯率，像是放寬外幣投資型保單全權委託投資帳戶可投資台股基金、開放 OSU 辦理不限用途借貸等，屬央行管轄範疇，因此還需與央行再討論，上路執行確切時程未定。根據剛出爐 19 項細則方案，有 15 項包括放寬信託可受託投資外國債券、銀行發行外幣金融債券連結標的與利率條款限制等，預計明年上半年上路。但像是放寬外幣投資型保單全委託投資帳戶可投資投信發行台股基金、開放 OSU 辦理不限用途借貸等，則需與央行溝通。高資產客戶部分，金管會擬定的「銀行辦理高資產客戶適用的金融商品及服務管理辦法」草案 8 大項目，預計明年 3 月底前開放，屆時銀行可透過信託或兼營方式，讓高資產客戶投資境外結構型債券。同時，金管會也同步開放金融機構可投資相關理財商品，包括符合資格的外資可用外幣現金為擔保跟券商辦理資金融通，但要注意的是，授信餘額不可超過券商淨值 4 倍。根據金管會統計，截至今年 11 月底止，外幣投資型保單全委帳戶約 6536 億元，目前共有 14 家券商辦理證券業務借貸款項，合計總淨值約 3530 億元，以此估算，新財管方案上路後，約可為台股挹注 2 兆多元資金活水。
12,2019/12/31,誠美材代理總座任期屆滿 總座仍由何昭陽兼任,偏光板廠誠美材 () 今 (29) 日公告表示，代理總經理羅來煌任期屆滿，總經理仍由董事長何昭陽兼任，並無異動。誠美材獨董陳彥松等人日前函文稱依公司法第 203 條之 1 第 2 項規定，請求董事長儘速召集董事會，通過總經理委任案、討論重要轉投資公司昆山奇美董監事重新指派案，但因最終未獲過半數董事附議，故不召開董事會。今年初誠美材才爆經營權之爭，4 月全面改選董事，重新選任董事及獨董，由何昭陽擔任董事長兼任總經理，並指派羅來煌為代理總經理，任期至今年底為止，才讓公司經營權之爭暫時落幕。此外，誠美材重要轉投資公司昆山奇美近日才爆發控制權受影響一事，日前誠美材更放棄增資昆山奇美，持股比例遭到稀釋，雖仍持有 38.4% 持股，但已喪失控制權，昆山奇美也重新選任董事，新任董事長由黃源擔任，副董事長則由何昭陽擔任。
13,2019/12/31,封關日外資大賣94億元創1個月來單日最多 元月行情添雜音,2019 年台股封關日未能守住「萬二」，指數今 (31) 日開平走低，終場收全日最低 11997.14 點，跌點 56.23 點，三大法人在集中市場賣超達 95.9 億元，其中，外資賣超多達 94.3 億元，創 1 個月來單日賣超最多。法人提醒，外資籌碼略見偏空，今日除了現貨擴大買超，期貨淨多單也減碼 1248 口至 36910 口，元月行情添雜音，有待觀察其在總統大選前的布局態度，預料將會大致決定元月行情走勢。三大法人今日合計賣超 95.9 億元，已是連 2 日賣超，並創 11 月 30 日來單日最大賣超，其中，外資賣超 94.3 億元，自營商賣超 2.61 億元，僅投信買超 1 億元。觀察外資賣超前 10 大標以金控股為主，依序為元大滬深 300 正 2 達 1.2 萬張，中石化、台積電遭賣 7000 張上下，元大金、開發金均超過 5500 張，中信金和大同均達 4800 張，玉山金、永豐金和國產則在 4000 張上下。不過，從外資買超的標的來看，顯示具業績題材的電子股後市走勢仍受外資看好，前 10 大買超標的依序為友達 3000 張，台郡 2800 張，系統電和燿華在 2500 張上下，元大台灣 50 反 1、元大 S&P 原油正 2 均逾 1500 張，玉晶光、欣興、華通和嘉聯益均超過 1100 張。投信方面，買超前 10 大標的為奇鋐逾 1500 張，美時超過千張，宇峻、健策和群創均逾 600 張，鈺齊 - KY、元大滬深 300 正 2、華新科和精元均在 500 張以上，鈺太也近 500 張。而投信賣超前 10 大標的分別為欣興近 2000 張，緯創、旺宏和鴻海均逾 1000 張，華通超過 800 張，健和興和京元電子在 700 張上下，晶電、美律和同欣電均超過 500 張。法人指出，大盤盤整整理後，以跌破 5 日線、10 日線封關，短線修正壓力轉強，不過，月線持續翻揚仍作為下檔有利支撐，有待觀察年後外資歸隊後是否補量重啟新一波多頭行情。
14,2019/12/31,愛奇藝轉播台北跨年晚會爆爭議 必應：已經華視同意,台北 2020 跨年晚會傳出網路轉播權爭議，晚會共同得標者必應創造 ()，傳出未與華視協議，就將網路轉播權授權愛奇藝平臺，對此，必應發布聲明表示，授權愛奇藝平臺一事，華視、北市府觀傳局與必應三方，已於 10 月 24 日工作會議決議通過，並經各方代表簽名佐證，且華視並未就會議記錄提出任何異議。「台北最 High 新年城 - 2020 跨年晚會」日前在記者會上宣布，將於華視主頻 HD 及 Astro TV、DATV 海外播出，網路平台則將由台北旅遊網 FB、愛奇藝獨家播出。今年台北跨年晚會由台北市政府、必應創造與華視三方，共有跨年活動轉播權，不過，華視昨 (30) 日表示，必應創造逕自向台北市政府請求專屬授權，再將網路轉播權轉售愛奇藝，華視曾多次提出異議，也曾向愛奇藝發函抗議。對此，必應今日回應，今年台北市跨年活動網路轉播平臺由愛奇藝專屬一事，已於今年 8 月開始接觸洽談，並與華視溝通、傳達相關合作權利義務，包含期望贊助內容等，最終在台北市政府觀光傳播局、公司以及華視三方，於 10 月 24 日第 7 次工作會議決議通過，並經各方代表簽名佐證。必應指出，該次會議紀錄已由台北市政府觀光傳播局，分別寄送本公司及華視，且華視並未就該次會議紀錄提出任何異議，足可證明華視已肯認會議內容。必應強調，基於前述事實，公司今年 11 月 5 日發函請台北市政府同意，將本活動網路播出平臺專屬授權本公司後，再由本公司專屬授權予愛奇藝，目的為擴大活動曝光，並吸引網路閱聽人需求，而北市府觀傳局已於 11 月 28 日覆函本公司，並副知華視，同意授權本公司轉授權愛奇藝在網路平臺播出跨年活動，顯見網路平臺專屬授權愛奇藝一事，早經華視明知並同意。必應創造今年主標取得 2020 年臺北市跨年晚會承辦權，為首次跨年晚會由非電視台取得承辦權，董事長周佑洋先前表示，取得承辦權是一種肯定，會落實開創「跨界」新面貌的承諾，製作前所未見的北市跨年晚會。
