,date,title,content
468,2021/09/09,下半年面板跌勢擴大 研調估面板廠仍可維持獲利,面板產業景氣反轉，研調機構 DSCC 看壞電視面板拉貨動能，最新出具報告指出，8、9 月面板價格將持續回落，再下修年底價格預測，估將低於去年底，但仍高於面板廠成本，預期全年面板廠都可維持穩定獲利。DSCC 表示，面板價格近一年強漲，連帶美國等終端市場電視價格上漲，導致消費者買氣縮手，且經過一年來零組件缺料、物流問題，品牌及零售商庫存在近期也逐步改善，新興國家方面，需求仍因整體經濟受限 COVID-19 疫情而放緩。DSCC 分析，32-55 吋電視面板價格已在今年 6 月達到高峰，65-75 吋電視價格同樣在 7 月觸頂，8 月各尺寸面板全面走跌，其中 32 吋跌幅最大達約 15%，整體面板平均跌幅則達 9.4%，預期 9 月整體面板價格跌幅仍有 8.6%。DSCC 進一步表示，雖然 8、9 月電視面板價格大幅下跌，但 32 吋電視面板價格仍較去年 5 月低點高出 1 倍以上。展望下半年，DSCC 預期，32 吋電視面板價格在今年 6-12 月跌幅將達 42%，75 吋電視面板價格跌幅則落在約 20%，跌幅均較前次預期擴大，也將使各尺寸電視面板單位價格再次出現反轉，預期年底 75 吋面板單位價格將較 32 吋面板高出約 10%。DSCC 表示，面板產業過去一年受限玻璃、DDIC 短缺，加上疫情帶動需求，讓面板價格出現歷史性上漲，各大面板廠也在第二季實現強勁獲利，雖然面板價格在第三季反轉向下，但價格仍遠高於面板成本，縱使第四季面板價格續跌，也看好面板廠今年全年將保持獲利水準。
469,2021/09/09,後疫時代數位轉型大爆發 中壽助業務員創高峰,疫情改變民眾生活型態，中國人壽 () 長期投入數位轉型，更透過科技賦能，吸引許多業務精英加入中壽，1-7 月業務員淨增加人數與增加年成長率，為壽險公司第一。中壽展現創新能力，以客戶為中心積極優化各項流程與服務，將這波疫情危機化為轉機，online + offline 虛實整合，包括領先業界推出遠距刷臉投保，提供客戶、業務同仁同享科技帶來的便利，在串接數位工具的創新保險場景中，助業務同仁再創高峰。中壽更透過科技賦能，吸引許多業務精英加入中壽，1-7 月業務員淨增加人數與增加年成長率，為壽險公司第一，且整體新人年齡層下降、收入增加，登錄人數連續三年持續攀升，成為新進業務員值得信賴的首選雇主。中壽自 2018 年啟動業務通路轉型，投入豐厚資源全方位支持業務同仁，在全體同仁協同合作下，積極展現創新能力，獨家發展的 i-Agent 數位工具透過敏捷式開發，建構出完整的數位圈，助業務同仁「訓」與「練」同時並進。中壽所擘劃的「大．人．生」數位藍圖，即積極運用「大」數據加值服務、「人」工智慧應用及「生」態圈串聯，從行銷推廣到組織發展完整串接，優化保險體驗，讓保險服務永續推進。「以客戶為中心」是中壽發展數位工具的信念。在行銷面，中壽從客戶接觸與管理、商品知識、保單締約到售後服務，運用多元數位工具，提供客戶更即時、客製的暖心服務。為了帶給客戶更流暢的保險體驗，也推出遊戲化工具協助業務同仁創造主動接觸客戶的機會，更了解客戶需求，當確認客戶的保障需求及投保意願後，只要一鍵就能列出建議商品，讓服務無縫銜接。組織發展面，中壽開發獨特的大數據動物選才模型加上四「新」方案，打破一般新進業務員適應困難的痛點。動物選才以大數據資料庫，透過性向測驗，幫助新進業務同仁更了解自我先天優勢，輔以後天量身訂作的培育計畫，助業務新人在壽險事業上站穩腳步。中壽適才適所的培育加上新課程、新輔導、新晉升及新工具的四「新」方案，幫助業務同仁提高定著，快速晉升，也幫助主管育才更有方法、更快速。數位轉型是企業邁入下一個世代的關鍵因素，疫情再加速了數位化進程。中壽長期推動業務通路轉型，持續創新金融服務，數位創新作為也榮獲保險業亞洲獎「年度數位創新獎」、《財資雜誌》「最佳生物辨識類數位獎」等國際肯定。中壽將持續提供更完善和不間斷的優質服務，無論線上、線下皆能滿足客戶所需，成為值得信賴的保險公司。
470,2021/09/09,〈五倍券來了〉10/8開放領用 數位9/22起綁定 國內電商也可用,行政院長蘇貞昌今 (9) 日親自主持「振興方案記者會」，正式宣布五倍券上路時程，若透過超商預購，紙本券最快 10 月 8 日可以領用，數位方式綁定則從本月 22 日起開放，10 月 8 日開始消費，除了實體店家、攤商可使用外，國內電商也納入範圍。蘇揆表示，近期雖然發生長榮機師感染、幼兒園群聚事件，但已有一段時間新增病例是個位數，面對病毒入侵衝擊內需產業 (服務業)，政府要規劃如何照顧員工生計及振興經濟。蘇揆說明，紙本五倍券為一套十張，包含三張 1000 元、兩張 500 元、五張 200 元，預約時間分為兩部分，超商 9 月 25 日開始預約，10 月 8 日開始領用；郵局領取則是從 10 月 4 日起預約，10 月 12 日起領用。數位綁定部分則是 9 月 22 日起上路，10 月 8 日起消費。民眾使用五倍券期限至明年 4 月底截止，商家兌領期限為明年 6 月底截止，有統一編號的業者，可至指定金融機構兌領；無統一編號者可委託商圈組織、夜市管委會等兌領；在職業工會加保的自營業者，可至八大公股行庫兌領。蘇貞昌表示，五倍券使用範圍為全國實體店家、攤商，原本計劃排除部分國內電商，但電商業者釋出誠意，承諾設專區挺在地商家、小農，免上架費、降低抽成、減免廣告費與服務費，因此，他會請經濟部盯好，確認業者遵守承諾，僅排除境外電商。蘇貞昌說，只要在明年 4 月 30 日前出生、領有健保卡的國人，以及有永久居留的外籍人士，都可領取。
471,2021/09/09,百容電子8月營收衝上2.04億元 本季將創高,百容 () 受惠電子零組件銷售挹注，8 月營收突破 2 億元，以 2.04 億元續創新高，已連續 2 個月改寫新高，9 月營收仍正向發展，法人預估第三季營收將以 6 億元創新高。百容 8 月營收 2.04 億元，月增 4.05%，年增 49.66%；累計 2021 年前 8 月營收 13.95 億元，年增 21.25%。百容 7 月營收 1.97 億元改寫新高，8 月中以來，出貨運輸效率優於預期，營收也超越預期，估 9 月營收有 1.9 億元以上。百容電子零組件生產線完成遷廠安徽滁州，生產動線流暢，加上出貨客戶端順暢，推升營收走強。百容持續增購半導體導線架沖壓機台，因應不斷提升的需求，台灣廠新增 2 台生產設備產能，預計 9 月量產，新增產能開出之後，預估增加產能 10%，加上百容逐步解決先前導線架銅原材料短缺的問題，將顯著挹注 9 月營收。至於百容中國江蘇蘇州相城導線架廠的新增產能計畫，受設備進駐時程影響，新增 4 部設備要到明年第一季後進駐，並開出新增產能。百容半導體導線架產品去年營收比重 37%，今年以來成長到 43%，目前生產仍供不應求，百容主管指出，未來幾年半導體應用產品將成營運主軸，江蘇蘇州相城廠成為重要生產據點。百容 2021 年上半年稅後純益 1.19 億元，年增 28.81%，每股純益 1.09 元。
472,2021/09/09,〈劉揚偉談半導體〉電動車正為第三代半導體鋪路 台產官學應深化合作搶進國際,鴻海 () 董事長劉揚偉今 (9) 日表示，電動車正在為第三代半導體鋪路，台廠把握此趨勢開拓進入國際市場的新渠道至關重要，有必要深化產業界、學術界以及政府之間的關係。鴻海研究院今日與 SEMI Taiwan 共同舉辦「NExT Forum」線上論壇，以「Compound Semiconductor in E - Vehicle」為主題，探討化合物、車用半導體的創新應用與技術發展。劉揚偉致詞時表示，鴻海研究院每季度召開一次技術論壇，針對前瞻技術進行討論，藉由此次論壇，將進一步加強第三代半導體對全球電動車發展的影響。劉揚偉表示，第三代半導體如碳化矽 (SiC) 等材料，將推動整個電動車充電設計以及基礎設施的創新技術不斷前進；而鴻海買下旺宏 6 吋廠，象徵具備製造第三代半導體的能力，尤其是碳化矽，是非常重要的里程碑。
473,2021/09/09,傳日盛金員工安置計畫比照大眾銀 工會：與富邦金簽有保密協議,外傳日盛金 ()、銀工會對於爭取合併員工安置計畫，將比照大眾銀併入元大金的三年選擇權，對此，日盛金控暨其子公司企業工會聲明，團體協約內容未有實質進展，與富邦金控 () 協商會議皆有保密原則，並譴責有心人士對外表述不當言論。日盛金控暨其子公司企業工會表示，與富邦金控代表自 7 月 2 日會前會雙方首次會面，7 月 23 日第一次正式協商，一直到 9 月 7 日第三次協商，加上會前會共計四次協商，前後歷經近 50 日協商時程，團體協約內容卻未有實質進展，工會對此深表遺憾，但工會仍恪遵雙方協議，在團體協約條文未定案前，雙方皆不對外透露有關會議之相關內容的保密協議。日盛金控暨其子公司企業工會進一步指出，現階段所有權益的項目都未有進一步進展，但相信富邦金是台灣企業標竿，會秉持誠信原則與社會責任，重視集團形象，善待並照顧原日盛所有員工會。工會聲明，與富邦金控協商會議皆有保密原則，日盛金控暨其子公司企業工會將格遵雙方協議，不會針對未有達成共識的項目提出任何評論，亦對有心人對外表述不當言論將予以譴責。
474,2021/09/09,〈台股盤中〉晶圓雙雄回神+五倍券將上路 黑翻紅漲點擴大,由於美股回跌、連帶亞股回檔偏弱整理，台股今 (9) 日早盤也受拖累，一度跌近 150 點，但在台積電翻紅和聯電的走強帶動下，開盤一小時後翻紅，盤中又隨著行政院正式宣布五倍券將於 10 月上路，激勵大盤漲點緩步擴大至 50 點左右，高低點差距近 200 點，預估成交值則縮至 2600 億元左右。從大型權值股來看，亞德客 - KY 漲超過 8% 最強勢，而台積電早盤一度跌逾 1%，隨後緩步收斂跌勢翻紅，聯電再度轉強，漲幅 3% 左右，南電、日月光投控、聯詠和國巨均漲逾 2%，不過，部分仍遭壓在盤下，矽力 - KY、萬海跌逾 2%，和泰車、台塑、台泥和陽明均跌 1.5% 之上。從細族群來看，石英元件相關業者表現不俗，希華、加高和晶技均漲逾 3%。南電也轉強下，載板族群中，易華電漲逾 3.5%，同欣電漲逾 2.5%。被動元件族群也有買盤進場，越峰、立敦和蜜望實均漲超過半根停板，台嘉碩漲近半根停板，九豪漲 3%，國巨、興勤、鈞寶和奇力新等鈞漲逾 2%。反觀昨日強勢股防疫族群今日轉弱，恆大和新麗跌 5%，康那香跌超過 3%。元大投顧認為，台股自 8 月下旬以來，若以波段最低點起算，最多一度反彈將近 1400 點，幾乎已經把這波跌勢完全收復，但本波漲點多是由權值個股所貢獻，內資仍持續調節小型電子股，在大盤量能表現低迷之際，台股欠缺主流，操作難度持續上升。統一投顧則指出，昨日市場傳出國內 Delta 疫情增溫，造成台股下跌，接連跌破周線和季線，市場持股信心不足、偏好短線進出， 加上目前科技產業第四季雜音頻傳，產品報價鬆動，且整體供應鏈失衡問題短期難解，預期在月線和季線區間震盪整理。
475,2021/09/09,八方雲集掛牌首日 蜜月行情緩步加溫,連鎖餐飲集團八方雲集 () 於今 (9) 日以每股承銷價 155 元掛牌上市，早盤以 162.5 元開出，最高一度來到 172 元，漲幅逾 1 成，盤中在 166 元附近震盪，投資人抽中一張約現賺 1 萬元，在大盤偏弱整理之際，穩步展開蜜月行情。八方雲集日前順利完成競價拍賣和公開申購作業，競拍超額認購達 3.9 倍，最低得標價格每股 162.1 元，最高得標價格 202 元，各得標單價格和數量加權平均價格為 165.53 元。而公開申購張數為 1320 張，合格件數達 287119 件，申購倍數高達 217.5 倍，參與市場的資金超過 445 億元，中籤率僅 0.45%。展望後市，八方雲集表示，未來將擴建廠房、生產線，增加產品品項以提升門店營收，既有品牌梁社漢排骨是近期展店主要動能，目前全台近 120 家，預計年底將達 150 家，力拚 5 年內達 500 家門店規模。而主力品牌八方雲集全台已超過 1000 家，接下來將深入新市鎮展店，並對既有店改裝升級。同時，八方預計規畫年底前開出新型態丹堤咖啡和全新蔬食品牌。為因應台灣多品牌發展及海外市場的拓展，八方雲集近期擴大徵才，除餐飲從業人員，並祭出月薪 5 萬元起跳的營運幹部職缺。八方雲集前 7 月合併營收 33.52 億元，年增 16.28%，惟上半年則受到原物料價格上揚影響，稅後純益 2.83 億元，年減 5.69%，每股純益 4.71 元。
476,2021/09/09,群益權證小教室：認識權證五檔報價及未報價可能情況解析,歡迎來到群益權證小教室！「權證」是很適合小資族的投資工具，有機會透過小額資金創造更多收入，今天要教大家透過權民最大網來認識「權證報價」！權證的五檔報價資訊，會揭示於權證資料的「條件及概況」。若以台積電群益 13 購 01 (038602-TW) 的 9/8（三）盤中資料為例，頁面可以看到「權證五檔」及「標的五檔」，分別呈現出這檔權證以及其連結標的－台積電 () 五檔的買價 / 賣價及掛單量。其中，「權證五檔」資訊對於權證投資人較為重要，一般來說，權證發行券商有負責造市的義務，必須持續提供委買、委賣價格與張數報價，以維持權證的流通性，讓投資人可以成功買到或賣出權證。觀察上圖的權證五檔報價，可看到該權證有積極的造市價格，最佳一檔委買、委賣價無價差，且買賣單量皆為 499。但是在以下的情況下，權證還是可能會沒有報價：1. 股市九點剛開盤 5 分鐘內，多數股票的價格還未明朗，因此一般會建議投資人在 09:05 後再查看權證造市價格。2. 權證連結標的暫停交易、遭到處置限制、撮合時間拉長或是遇到股價漲跌停。以認購權證來說，股價漲停時券商無法買進股票避險，所以無法掛出委賣單，此時盤面上看到的委賣單量幾乎都是由其他投資人所掛，在當下追價買進權證可能會買到偏貴的價格。3. 如果權證的剩餘天期極短，或權證經過註銷後 (查詢方式如下圖) 導致發行商的權證庫存不足，也可能只掛出委買單，而無委賣的價格及單量。4. 如果權證的理論價值低於 0.01 元 (含)，表示這檔權證已經沒有履約價值，一般來說發行券商就不會再提供委買報價，理論價值也可以透過權證計算機來試算 (如下圖)。如果對於「權證計算機」的使用還不太熟悉，可以複習一下之前這篇「隱含波動率」的文章內容唷！延伸閱讀連結：希望今天的介紹有助於大家更了解權證報價資訊，看好心儀的權證就可以透過 進行下單！
477,2021/09/09,【鉅亨-盤前掃瞄】技術面,【鉅亨-盤前掃瞄】技術面1. 5日均線 17406.27 點，10日均線 17366.90 點，20日均線 17077.06 點，60日均線 17398.00 點，120日均線 17090.43 點，240日均線 15715.92 點。2. 6日 RSI 為 32.10，12日 RSI 為 69.40。3. 20日乖離率為 1.13，60日乖離率 -0.73。
478,2021/09/09,外資近5日賣超個股,1. 外資累計賣超 5 日的股票台新金 ()、大同 ()、富邦金 ()、華邦電 ()、華泰 ()2. 外資累計賣超 4 日的股票大同 ()、富邦金 ()、聯電 ()、鴻海 ()、台新金 ()3. 外資累計賣超 3 日的股票聯電 ()、富邦金 ()、大同 ()、華泰 ()、鴻海 ()4. 外資累計賣超 2 日的股票聯電 ()、群創 ()、中鋼 ()、友達 ()、富邦金 ()5. 外資當日 (08) 賣超的股票聯電 ()、台新金 ()、旺宏 ()、長榮 ()、富邦金 ()
479,2021/09/09,【鉅亨-盤前掃瞄】基本面,【鉅亨-盤前掃瞄】基本面1. 9 月 8 日以 27.75 兌 1 美元作收，收盤升 7 分。2. 集中市場 8 日外資賣超 -10.76 億元，投信賣超 -4.35 億元，自營商賣超 -70.41 億元。 3. 集中市場 8 日融資餘額較前 1 日減少 -22.1 億元，成為 2630 億元，融券餘額較前 1 日增加 4439 張，成為 516931 張。
480,2021/09/09,外資近5日買超個股,1. 外資累計買超 5 日的股票台積電 ()、國泰智能電動車 ()、中鋼 ()、華南金 ()、國泰金 ()2. 外資累計買超 4 日的股票台積電 ()、國泰智能電動車 ()、群創 ()、中鋼 ()、華南金 ()3. 外資累計買超 3 日的股票國泰智能電動車 ()、群創 ()、中鋼 ()、台積電 ()、陽明 ()4. 外資累計買超 2 日的股票國泰智能電動車 ()、中信金 ()、長榮 ()、華南金 ()、陽明 ()5. 外資當日 (08) 買超的股票臺企銀 ()、中信金 ()、光磊 ()、元大金 ()、群創 ()
481,2021/09/09,外資近3日賣超個股,1. 外資累計賣超 3 日的股票聯電 ()、富邦金 ()、大同 ()、華泰 ()、鴻海 ()2. 外資累計賣超 2 日的股票聯電 ()、群創 ()、中鋼 ()、友達 ()、富邦金 ()3. 外資當日 (08) 賣超的股票聯電 ()、台新金 ()、旺宏 ()、長榮 ()、富邦金 ()
482,2021/09/09,外資近3日買超個股,1. 外資累計買超 3 日的股票國泰智能電動車 ()、群創 ()、中鋼 ()、台積電 ()、陽明 ()2. 外資累計買超 2 日的股票國泰智能電動車 ()、中信金 ()、長榮 ()、華南金 ()、陽明 ()3. 外資當日 (08) 買超的股票臺企銀 ()、中信金 ()、光磊 ()、元大金 ()、群創 ()
483,2021/09/09,投信近5日賣超個股,1. 投信累計賣超 5 日的股票華航 ()、新唐 ()、強茂 ()、長榮 ()、群創 ()2. 投信累計賣超 4 日的股票新唐 ()、華航 ()、強茂 ()、長榮 ()、億光 ()3. 投信累計賣超 3 日的股票新唐 ()、華航 ()、強茂 ()、南茂 ()、長榮 ()4. 投信累計賣超 2 日的股票新唐 ()、南茂 ()、金像電 ()、同欣電 ()、欣興 ()5. 投信當日 (08) 賣超的股票新唐 ()、欣興 ()、同欣電 ()、南茂 ()、南電 ()
484,2021/09/09,投信近5日買超個股,1. 投信累計買超 5 日的股票聯電 ()、中鋼 ()、景碩 ()、偉詮電 ()、國泰金 ()2. 投信累計買超 4 日的股票聯電 ()、中鋼 ()、景碩 ()、國泰金 ()、富邦金 ()3. 投信累計買超 3 日的股票中鋼 ()、聯電 ()、國泰金 ()、友達 ()、富邦金 ()4. 投信累計買超 2 日的股票中鋼 ()、友達 ()、國泰金 ()、聯電 ()、富邦金 ()5. 投信當日 (08) 買超的股票中鋼 ()、友達 ()、國泰金 ()、聯電 ()、智原 ()
485,2021/09/09,投信近3日賣超個股,1. 投信累計賣超 3 日的股票新唐 ()、華航 ()、強茂 ()、南茂 ()、長榮 ()2. 投信累計賣超 2 日的股票新唐 ()、南茂 ()、金像電 ()、同欣電 ()、欣興 ()3. 投信當日 (08) 賣超的股票新唐 ()、欣興 ()、同欣電 ()、南茂 ()、南電 ()
486,2021/09/09,投信近3日買超個股,1. 投信累計買超 3 日的股票中鋼 ()、聯電 ()、國泰金 ()、友達 ()、富邦金 ()2. 投信累計買超 2 日的股票中鋼 ()、友達 ()、國泰金 ()、聯電 ()、富邦金 ()3. 投信當日 (08) 買超的股票中鋼 ()、友達 ()、國泰金 ()、聯電 ()、智原 ()
487,2021/09/09,〈台股盤前〉Delta病毒入社區 下檔看月線、半年線支撐,台股昨 (8) 日盤中一度大跌 261 點，終場收在 17270.49 點，下跌 158.38 點，季線失守，三大法人同步賣超，美股四大指數今晨全數收黑，加上 Delta 病毒已進入社區，台股恐持續震盪劇烈，下檔看月線、半年線支撐。市場擔憂後續若疫情擴大，將不排除升級到三級警戒，三大法人昨日同步站在賣方，合計賣超 86.03 億元，除外資結束連 3 買，轉為調節 10.9 億元，投信也賣超 4.76 億元，但自營商賣壓最重，大砍 70.4 億元。今日觀盤重點，台股 ADR 收盤挫跌，半導體類股跌幅達 2-3%，台積電收盤下跌逾 2%，較台北交易股票溢價率為 9.23%。聯電 ADR 更是跌超過 3%，是否拖累晶圓雙雄現貨股價表現值得關注。此外，全球晶片供應吃緊，掀起跨國擴產競賽，美國半導體龍頭英特爾為了應戰，打算豪擲 800 億 (950 億美元) 在歐洲建置兩座新廠，擴充在當地的晶片產能。聯電表示，市場雖出現部分雜音，但目前晶圓代工產能仍供不應求。面板價格連續大漲 13 個月後，電視面板 8 月下旬跌幅擴大，友達 8 月營收微減、彩晶下滑 9%，9 月上旬電視面板價格仍續跌，面板景氣的反轉，預期友達、群創、彩晶今年度獲利高峰已過，但第三季仍可賺錢，須留意反映到面板族群的股價走勢。整體來說，短線市場受 Delta 病毒衝擊，台股昨日跌破季線後，月線 17084 點將是台股多空對峙的重要關鍵，下檔先看月線、半年線支撐，但隨著蘋果新機發表倒數，年底前的感恩節、耶誕節假期消費力道仍然可期，從蘋果股價近期創高已可嗅出市場的氣氛，只要疫情獲得控制，後市仍不看淡。
488,2021/09/09,盤前財經大事搶先讀2021年09月09日,美國上週初領失業金人數中國 8 月 CPI、PPI新股掛牌：八方雲集除權息：統一、凌華、世芯 - KY、聯上等美國聯準會（Fed）在周三（8 日）發布的經濟褐皮書中表示，7 月初至 8 月，美國經濟成長略微放緩，主因是 Delta 病毒促使疫情升溫，導致民眾外出用餐、旅遊活動減少。據中國乘聯會周三 (8 日) 公布數據，特斯拉 () 在中國生產的汽車本土銷量上月反彈，較 7 月份成長了近 50%。中國中央宣傳部、國家新聞出版署有關負責人周三 (8 日) 約談騰訊、網易等遊戲企業和平台。網易美股盤前迅速轉跌，跌幅一度擴大至 4%。台股 8 月月線雖如願收紅，但隨著國際股市震盪、當沖新制上路，使得散戶熱情降溫，包括成交量周轉率、當沖與交易戶數同步下滑，其中當沖雖仍占成交值比重 4 成以上，但已降至 45.29%。貨櫃航商長榮 () 昨 (8) 日公布 8 月合併營收，衝上 500.22 億元，月增 9.03%，年增 164.79%，並寫下單月營收衝破 500 億元的新里程碑，累計前 8 月合併營收 2858.2 億元，年增 131.72%。長榮指出，由於整體海運運價上漲，帶動收入增加。面板大廠友達 () 昨 (8) 日公布 8 月營收，雖然整體出貨較上月回升，但受面板價格回落影響，營收連兩個月微幅下滑，8 月營收達約 327.1 億元，月減 1.9%，但仍連四個月站穩 300 億元大關，年增 34.86%，續攀近七年同期新高，累計前 8 月營收 2446.52 億元，年增 48.87%。晶圓代工廠聯電 () 董事長洪嘉聰昨 (8) 日獲頒獲頒國立清華大學名譽工學博士，洪嘉聰表示，聯電 1985 年剛上市時，市值約 11 億元，現已來到 8000 多億元，是當時的 700 多倍，今年營收可望超過 2000 億元。共同總經理簡山傑則表示，產能仍供不應求，正在跟客戶談明年訂單、甚至更長期的合作。
