,date,title,content
738,2021/09/05,台積電營收、國巨股臨會、8月出口統計 本周大事預告,台積電本周五將公告 8 月營收，市場預期，隨著蘋果 5 奈米強化版晶片開始放量，台積電營收將較 7 月回升，國巨周二召開股臨會，討論與奇力新的換股合併案，財政部也在同日公布 8 月出口統計數值，受惠各產品出口續旺，年增幅將達 2 成以上，寫下連 14 紅，以下是本周大事預告：台積電 7 月由於 6 月比較基期高，加上蘋果 iPhone 晶片處於生產交替期，營收較 6 月減少高達 16%，不過，隨著蘋果 5 奈米強化版的 A15 新晶片開始放量，市場看好，台積電 8、9 月營收將回溫。台積電第三季營收估達 146-149 億美元，以 1 美元兌換 27.9 元計算，第三季營收估 4073.4-4157.1 億元，扣除 7 月營收，8、9 月平均單月營收須達 1414 億元。被動元件大廠國巨與旗下奇力新預計本周二舉辦股臨會，會中討論換股合併案，可望順利通過，預計雙方股份轉換完畢後，奇力新將貢獻「新國巨」15% 的營收，獲利也可望成長 10%。財政部周二公布 8 月進出口統計數值，由於去年 8 月隨著各國陸續解封、華為禁令等因素影響，單月出口值首度攀升至 300 億美元，在基期墊高下，外界預估，今年 8 月出口值 374-388 億美元，年增幅約 20-25%，較上月增幅收斂。鴻海本周將與 SEMI(國際半導體產業協會) 共同舉辦「NExT Forum」論壇，並以「Compound Semiconductor in E–Vehicle」為題，邀請英飛凌、意法半導體、台積電、穩懋，共同剖析化合物、車用半導體的創新應用與技術發展。瑞信周二舉辦第 22 屆亞洲科技論壇，自明日開跑，且今年因應疫情變化，改為線上舉辦，並邀請台灣重量級科技大廠，包括台積電、聯電、聯發科等，可望在會中釋出最新產業展望。
739,2021/09/05,〈台股風向球〉資金面轉強 晶圓雙雄帶動電子股買盤擴散,台股上周再度反彈 306.99 點，一口氣收復短均線，隨著上周五美國公布 8 月非農就業數據遠低於市場預期，造成美元下跌，法人認為，有利台股資金行情轉強，加上晶圓雙雄正獲外資強力進場布局，可望連動電子股買盤逐漸擴散。從上周籌碼面來看，外資在集中市場買超達 767 億元，自營商買超 111 億元，僅投信小幅賣超 14.68 億元。其中，外資買超前 10 大標的主要是晶圓雙雄和金控股，尤其買超聯電達 22.78 萬張最多，合計達 148.7 億元，對台積電也買超 8.36 萬張，合計為 510.5 億元。上周五美國公布非農數據令市場大失所望，儘管可能會改變市場對聯準會 QE 退場時間的預期，有利短線資金行情回穩，但美股周五僅漲跌互見，華爾街分析，反映新冠變種病毒對美國今夏經濟復甦產生負面影響，訊息是多空拉鋸。法人認為，對台股而言，資金面可望因此升溫，尤其蘋果新機推出在即，以及台股季線位置收復後有利技術面轉強，中期行情仍可期，預料本周落後補漲的電子股可望成為新一波短多主流。不過，永豐投顧提醒，大盤周 K 連 2 紅，多方訊號強烈，但近期市場屢出現訊號陷阱，基於 17600 點以上套牢籌碼眾多的疑慮，建議本周不追價，鎖定績優電子股逢低承接。永豐投顧認為，市場短線訊號不容易連續，照市場訊號操作容易陷入短線套牢，雖本周多頭可能再攻高，卻也容易出現套牢陷阱，若觀察去年台積電、今年長榮等大趨勢股，初期都是忽明忽暗，後期才出現大幅飆升的態勢，建議投資人對下半年趨勢股抱持長線耐心。
740,2021/09/05,中美晶轉投資台特化 特殊氣體產品已獲英特爾認證,中美晶 () 轉投資半導體特殊氣體廠台特化，除打入晶圓代工龍頭台積電 () 供應鏈外，產品也已獲英特爾 ()、三星認證，隨著上半年營運穩定獲利，在大客戶拉貨動能升溫下，今、明年獲利持續看增。台特化成立於 2013 年，供應半導體先進製程中沈積矽化合物薄膜所需的矽乙烷及矽丙烷，為繼美商 Voltaix 及日商三井化學後，全球第三家高純度矽乙烷及第二家高純度矽丙烷供應商，也是台灣唯一生產矽乙烷及矽丙烷的廠商。台特化成軍短短 6 年，就在 2019 年打入台積電供應鏈，且首年就獲選優良供應商，技術實力堅強；而除台積電外，台特化矽乙烷也通過英特爾、三星認證。台特化目前矽乙烷年產能 40 噸、矽丙烷年產能 4 噸，去年營運已損平，今年上半年隨著 7 奈米貢獻度大增，出貨量大幅成長。去年全年雖仍虧損 9300 萬元，但今年第一季獲利達 5334 萬元，上半年累計獲利更已達 1.21 億元，成為中美晶旗下另一個小金雞。除 7 奈米外，台特化也已陸續通過半導體大廠 5 奈米認證，隨著大客戶產能拉升、需求持續增加，未來營運成長可期，目前也正積極進行 IPO 準備。中美晶旗下各子公司營運表現漸入佳境，除半導體矽晶圓子公司環球晶 () 營運持續穩健成長外，朋程 ()、宏捷科 () 及台特化等，近年營運都陸續傳捷報。
741,2021/09/05,配息大躍進 外資搶除息行情 金融ETF股東數連7周增加,根據公開資訊觀測站資料顯示，今 (2021) 年台灣整體金融業合計將發放 2157 億元現金股利，較去年成長 7.53%，優渥的現金股利促使外資買盤大舉進駐金融股，就連元大 MSCI 金融 ETF() 因為一次網羅多檔頂尖金融股，成為存股族最愛，股東人數已連 7 周增加。根據公開資訊觀測站資料顯示，金融業今年預計發放股利總額排行榜第一名與第二名的國泰金與富邦金預計各自發放超過 300 億元股息，第三名與第四名的兆豐金與中信金將分別發放超過 200 億元股息，第五名到第七名的元大金、第一金與合庫金也分別發放超過 100 億元股息，龐大現金股利也讓金融股成為外資與存股族追捧焦點。8 月底開始，外資買盤大舉回籠金融股，讓一向穩健的金融股變飆股，統計近 5 日外資買超排行，包括國泰金、新光金、中信金、華南金、永豐金、開發金、兆豐金、第一金、富邦金等通通榜上有名。隨著聯準會縮表預期提升，金融股吸引力大增，元大投信 ETF 研究團隊表示，營運穩健且身為特許行業的金融股不只深受台灣投資人喜愛，外資法人近年也大力加碼，其中管理逾 1.2 兆美元的挪威央行主權基金加碼力道特別驚人，從各公司財報可以看出該主權基金已成為國內 11 家金融股的前十大股東，凸顯價格位階較低兼具優秀股利率的台灣金融股逐漸成為外資布局重點。台灣金融業長期經營穩健，近年受惠財富管理業務快速茁壯，且海外投資大幅貢獻獲利，同時台股交易熱絡，整體產業獲利連年成長，推升股價表現一路向上，帶動 MSCI 台灣金融指數今年以來報酬率達 29.37%，大勝台灣加權股價指數的 19.24%。元大投信 ETF 研究團隊表示台灣金融股仍具價值優勢，根據彭博資料顯示 MSCI 台灣金融指數本益比僅約 9~10 倍，相較 MSCI 全球金融指數約 12 倍還要更便宜。不過投資金融股並不容易，金融股財報相較其他企業來說更顯複雜，資產負債表解讀方式也非常不一樣，且保險、證券、銀行等金融機構商業模式迥異，需要相當產業研究經驗方能從中挑選績優股，元大投信 ETF 研究團隊建議，投資人可以透過金融 ETF 搭上股息「特快車」。
742,2021/09/05,考量藥物發展空間 合一暫停新冠新藥臨床試驗,合一 () 考量國際藥廠羅氏 (Roche) 開發的治療新冠肺炎藥物 Tocilizumab，已取得美國 FDA 緊急使用授權 (EUA) ，並被台灣衛福部納入公費用藥，合一旗下治療嚴重新冠肺炎患者新藥 FB704A，未來發展空間有限，決定暫停二期臨床試驗。合一針對新冠疫情開發出兩項新藥，一項為治療嚴重嗜中性球氣喘新藥 FB704A，是自行開發的 Anti-IL6 全人單株抗體新藥，另一項則是從病毒不易突變的基因區域設計出的新藥 SNS812。合一看好，新冠患者會受到體內病毒引起細胞激素風暴，變成重症病患，其中，IL6/IL6R 為造成細胞激素風暴的關鍵因子之一，而新藥 FB704A 可抑制 IL6，避免重症惡化。不過，國際藥廠羅氏已上市的藥物 Tocilizumab(Anti-IL6R)，可抑制新冠感染者過度免疫反應產生細胞激素風暴，改善嚴重肺炎致死率，已取得美國 FDA EUA 及被納入台灣公費用藥。合一新冠新藥 FB704A 雖然已獲准美國 FDA 許可執行二期臨床試驗，目標治療全球尚無有效藥物的嚴重嗜中性球氣喘，但考量該新藥需再投入大量資源，且發展與羅氏藥廠相同適應症藥物差異不大，因此決定暫停試驗。合一提到，雖然 FB704A 暫停臨床試驗，但會將研發重心擺在另一新冠新藥 SNS812 上，SNS812 是與中天上海合作開發的抗新冠病毒核酸新藥，已完成 6 次攻毒動物試驗，目前尚進行後續關鍵分析中。據合一規劃，雖然 SNS812 試驗過程限制多，加上穩定性不高，若新藥可確認抗病毒效果，預計今年完成臨床前試驗、明年進行人體試驗。另外，合一旗下新藥速必一 (ON101)，其國際多中心糖尿病足部傷口潰瘍(DFU) 治療三期臨床試驗，相關臨床數據與藥物作用機制，已獲得美國醫學會雜誌 JAMA 出版發行之 JAMA Network Open 期刊採用於 9 月 3 日出刊。JAMA Network Open 透過線上公開方式提供學術性科學資訊，為 Science Citation Index(SCI) 醫學領域開放性期刊中，影響力最高的期刊，網站流量一年超過 840 萬人次，文章閱覽與下載數超過 1560 萬。合一表示，速必一國際多中心三期臨床試驗在不同困難傷口完全癒合之次族群分析，具療效顯著性、一致性及穩健性，並獲得台灣新藥藥證、美國 FDA 快速審查認定，中國正受理藥證審查，透過網路公開，更可增加國際 DFU 專業醫護人士了解速必一療效與作用機制，增強全球知名度。
743,2021/09/05,台灣中油：明(6)日起汽油價格調漲0.2元 柴油價格調降0.1元,台灣中油公司公告，自明（6）日凌晨零時起汽油價格調漲 0.2 元、柴油價格調降 0.1 元，參考零售價格分別為 92 無鉛汽油每公升 28.2 元、95 無鉛汽油每公升 29.7 元、98 無鉛汽油每公升 31.7 元、超級柴油每公升 25.5 元。中油表示，本週因颶風艾達影響墨西哥灣區海上鑽油平台與沿岸煉油廠作業，該區原油供應與煉油需求同步下降，導致國際油價上漲。本週浮動油價調整原則之調價指標 7D3B 週均價上漲 1.79 美元，新臺幣兌美元匯率升值 0.192 美元，國內油價依公式計算漲幅為 1.49%，汽、柴油每公升原應各調漲 0.2 元及 0.6 元，為維持價格需低於亞洲鄰近國家 (日、韓、港、星) 之限制，柴油吸收 0.7 元，汽油實際價格每公升調漲 0.2 元、柴油調降 0.1 元。中油稱，累計 110 年至 8 月底止，共已調整吸收 53.35 億元。
744,2021/09/05,大立光8月營收40.12億元 月增5% 9月出貨續回升,光學元件廠大立光 () 仍受手機零組件缺料干擾，今 (5) 日公布 8 月營收小幅回升到 40.12 億元，月增 5.49%，爲 7 個月來新高，年減 20.29%，前 8 月營收 297.45 億元，年減 16.28%，大立光預估，9 月營收將持續回升。大立光 8 月營收較去年同期下滑，在於手機產業仍有部分零組件缺料，雖然部分客戶對手機鏡頭的升級態度積極，但部分客戶在市場價格競爭的壓力下，採用較低規格手機鏡頭，影響大立光 8 月營收表現。大立光 8 月出貨以 1000 萬畫素產品為多數，1000 萬畫素以上鏡頭占比 40-50 %，800 萬畫素鏡頭產品占比 0- 10%，2000 萬畫素以上產品占比 10-20%，其他產品占比在 30-40%。就大立光今年各季營收走勢來看，證券分析師黃漢成指出，第二季營收 101.13 億元，是大立光 2021 年營收最低的一季，但第三季營收回升速度仍緩慢。外資報告也指出，市場原先預估今年第三季 iPhone 新機出貨將放量、Android 手機鏡頭明年上半年將升級到更高解析度或更大尺寸感測器，可望成為大立光成長動能，不過目前看來，由於同業競爭及鏡頭規格升級放緩，大立光營運仍有壓。大立光 2021 年第二季稅後純益 29.59 億元，每股純益 22.07 元；上半年稅後純益為 82.75 億元，年減 29.33%，每股純益 61.69 元。
745,2021/09/04,〈熱門股〉外資連八買力挺 聯電衝破70元續寫21年來新高價,晶圓代工廠聯電 () 受惠漲價題材激勵，在資金回流電子權值股下，外資連日敲進，本周股價強彈，周五 (3 日) 飆漲 9.37%，衝破 70 元關卡，續寫 21 年來新高價，股價周漲幅達 13.45%。聯電周五晚間宣布，將與封測廠頎邦 () 進行換股交易，聯電與子公司宏誠創投將共同持有頎邦約 9.09% 股權，相當於斥資約 54 億元，成頎邦最大單一股東，頎邦則持股聯電 0.62%。反映消息面，聯電 ADR 開高震盪走高，大漲超過 6% 作收，市場關注周一台股表現。三大法人近八個交易日持續買進聯電，共大買超過 38.9 萬張，其中光是外資就大舉買超 32.8 萬張。外資更預期，晶圓代工成熟製程報價漲勢還沒完，明年至少還會再漲 6%，樂觀情境漲幅上看 11-13%，將大幅挹注台積電 ()、聯電和世界先進 () 營運動能。
746,2021/09/04,〈熱門股〉精剛展望穩健樂觀 股價奔漲停周漲12.9%,台鋼集團旗下合金材料廠精剛 () 轉型搶攻航太、造船零組件商機，加上歐美疫情趨緩，公司對全年業績展望抱持穩健樂觀，本周股價攻勢再起，周五攻上漲停 17.05 元，周漲 12.9%。精剛受惠 COVID-19 疫情漸緩，包含造船業之各項重工業及基礎建設的需求逐漸強勁，帶動高階原材料需求增溫。精剛內部也將今年定位在轉型年，以非鐵產品鎳、鈦為聚焦，從鈦合金圓棒產品擴展至鎳基超合金與特殊合金產品，並透過集團認證資源，加速跨入生醫、能源、航太等高階產業產品市場商機。
747,2021/09/04,日月光高雄廠提升產能 年底前擬再招募2000名員工,半導體市場熱絡，日月光投控 () 持續擴大布局、提升產能規模，對人才需求也不斷增加，高雄廠預計至 2021 年底將再招募逾 2000 名人才。日月光今日 (4) 舉辦大型徵才活動，以設備工程師、儲備幹部、生產助理員為主，歡迎年輕世代，以及受疫情影響的從業人員，不用成為北漂族，也能在南部找到好工作。近年由於新冠肺炎影響，遠端工作、遠距教學成為新常態，帶動筆記型電腦、通信網路、高效能運算應用市場強勁成長，而 5G、物聯網、車用電子等新興領域的快速發展，拉抬半導體產業逆勢成長，訂單持續暢旺。日月光指出，高雄是全台重要的半導體先進製程聚落，為了讓半導體更加平易近人，高雄廠以產業領頭羊之姿，舉辦系列導覽，解鎖產業面的趨勢脈動，以及 5G、車用與封測廠的關聯性；接著從日月光的發展沿革，到求職者關注的職場安全、健康衛教體驗，並以 AR 擴增實境，說明工廠水回收的奧秘。日月光藉由生活化的講解，讓求職者瞭解產業關鍵項目，不僅獲取專業知識，更可減少在面試現場等候的緊張感，達到企業與員工的雙贏。針對生產助理員，高雄廠除了假日徵才外，也在 K10 廠區開放平日隨到隨談，同時以巷口咖啡店的概念，主動布局鳳山、西子灣咖啡廳等據點，便於求職者的交通往返之外，更以軟性的空間提供求職者好的面談體驗，在心情放鬆的狀況下，也能有較佳的表現。另一方面，台灣人口負成長，以及疫情導致移工無法入境的兩大因素，更加促動日月光持續接軌校園、向下扎根，以完善的育才方案，穩定公司人力需求。日月光今年配合青年就業領航計畫，規劃符合高職生的職涯發展，攜手國教署、教育局，向校園招攬即戰力人才，不僅提供學生職業試探的機會，更協助在學青年兼顧課業與實務訓練，讓學位、技能、就業一步到位。面對全球市場強勁的需求，日月光積極透過產學合作，培養更多即戰力人才；以同仁的角度，從身心靈各面向出發，推動有感的健康職場促進服務，打造良好的就業環境；並以數位轉形的布局，提升員工個人產值與工作價值層次，創造更好的就業機會，有效留住人才，與光世代一起引領「封」潮、「測」動世界！
