,date,title,content
235,2021/09/13,達成共治共識 泰豐經營權之爭提前落幕 南港將拿過半董事席次,泰豐 () 由大股東南港 () 發起的股東臨時會 10 月 15 日將登場，並全面改選董事，今 (13) 日為董事提名截止日；外界原預期，經營權之爭將在改選後落幕，不過，雙方近期已達成共治共識，南港提名 6 席董事席次、泰豐提名 3 席，南港將順利拿下泰豐經營權。泰豐 8 月 31 日召開股東會，與南港互相提出解任對方董事與獨立董事，其中，泰豐提案解除南港代表人趙國帥的董事職務並未通過，南港提出的解任 3 名獨董則全數通過，被視為經營權之爭前哨戰。由於南港握有絕對股權優勢，市場原預期，泰豐經營權將在股東臨時會後易主。不過，據悉，南港名譽董事長林學圃與泰豐董事長馬述健，日前在股東會後會面商談，在委託書大王張永祥的穿針引線下，雙方為公司穩定經營，達成共識。泰豐董事、南港副董事長趙國帥表示，雙方在張永祥穿針引線下，達成共治共識，在今日董事提名名單最後一天截止日前決定，雙方將依照約定，提名董事名單送交審核。至於備受外界矚目的泰豐中壢廠土地案，趙國帥則說，將會由新任董事會決定。泰豐此次股東臨時會將全面改選 6 席董事、3 席獨董，據雙方約定，南港將提名 4 席董事、2 席獨立董事，泰豐則提名 2 席董事、1 席獨立董事。
236,2021/09/13,三大法人轉賣觀望 外資拋貨電子股轉進非電族群,台股今 (13) 日終場下跌 28.26 點，收在 17446.31 點，成交值續萎縮至 2526.96 億元，呈現量縮狹幅整理格局，三大法人在集中市場轉為小賣 39.54 億元，觀望氣氛濃厚，其中，外資買盤多集中在非電族群，並積極賣超大型電子股，對盤面造成壓抑力道。三大法人今日轉為賣超 39.54 億元，其中，外資小幅賣超 32.77 億元，自營商賣超 8 億元，僅投信買超 1.24 億元，為連 3 日小買。其中，外資賣超前 10 大標的依序為聯電 3.28 萬張，群創 1 萬張，金像電近 1 萬張，長榮 8600 張，鴻海和世界均逾 6000 張，漢磊 5000 張，兆豐金和台達電均逾 4000 張，晶豪科近 4000 張。而外資買超前 10 大標的分別有中鋼近 7.9 萬張，開發金、新光金均逾 1.5 萬張，期街口布蘭特正 2 和台泥均超過 1 萬張，華南金約 9600 張，威健、燁輝和友達均逾 8000 張，中工 7300 張。投信方面，買超前 10 大標的有中鋼 5000 張、富邦金 4600 餘張，國泰金近 3800 張，台泥逾 1600 張，台塑和漢磊 1300 張上下，智原近 1000 張，晶宏近 800 張，中美晶和光洋科在 600 張上下。投信賣超前 10 大標的依序為金像電、新唐均超過 3000 張，台玻 2000 張，華通 1700 餘張，中鴻近 1500 張，台郡 1300 張，宏捷科 1100 張，萬潤、佳世達在 900 張上下，超豐近 800 張。由於美國 8 月生產者物價指數年增幅 8.3%，創 2010 年 11 月以來最大漲幅，法人認為，市場等待 9 月下旬的 FOMC 會議是否釋出縮減購債的訊息，觀望氣氛濃厚；同時，國內中秋假期將至，在連假前指數空間有限。元大投顧則表示，上市櫃公司 8 月營收公告完畢後，市場焦點將再轉到第三季季報數字的驗證，選股勢必趨於謹慎。
237,2021/09/13,〈長佳智能展望〉與AWS、微軟成策略夥伴 搶進國際醫療保健市場,數位醫療研發公司長佳智能 (6841-TE) 除了打造數位醫療大數據資料庫外，也與國際軟體大廠 AWS、微軟合作成為策略夥伴，長佳智能借助軟體大廠的國際通路，拓展國際市場，AWS 與微軟則看準長佳智能龐大的醫療大數據分析技術，共同搶進醫療保健領域。董事長陳明豐表示，公司擅長各項 AI 模型開發，將大數據資料庫與軟體、醫材結合，相較其他醫療軟體產品，旗下醫療 AI 軟體醫材仍需經過 FDA 等主管機關審查，因此研發門檻相對高。長佳智能因專注在醫療 AI 軟體醫材開發，成為 AWS 與微軟的醫療網路合作夥伴。發言人徐國偉提到，在數位醫療浪潮下，雲端已成為資通訊趨勢，AWS 與微軟在全球雲端市場市佔率超過 6 成，公司將借助兩家大廠，搶進國際市場。徐國偉說，兩家業者持續擴大雲端市場，尤其針對醫療保健領域非常積極，其中，AWS 已介紹多家國際藥廠與醫療保健經銷商客戶給長佳智能，打造雙贏的商業模式，不過雙方需要長時間合作，營運才會逐步發酵。另外，長佳智能也建立醫療 AI 模型，並在亞馬遜的雲端平台上開發醫療 AI 應用市集，讓使用者在雲端快速執行病徵判讀。
238,2021/09/13,〈科學園區營運成果〉全年營業額估達3.4兆元創新高 中科、南科拚破兆元,科學園區上半年營業額創新高，展望下半年，科技部產學司司長許增如今 (13) 日表示，在半導體、車用電子、5G 等應用帶動下，今年三大科學園區營業額可望續創新高，估達 3.4 兆元、年增 15.12%，其中，中科、南科在半導體產業助攻下，今年將挑戰兆元大關。竹科預估今年營業額將衝上 1.5 兆元大關，年增幅達約 20.9%，中科、南科也上修今年全年展望，分別估營業額將達約 9954 億元、9900 億元，年增幅則落在 6.34%、16.78%，也將同步挑戰兆元大關。半導體產業仍是三大園區主要貢獻業別，其中，晶圓代工龍頭台積電 () 上半年對竹科、中科、南科園區營業額比重，分別達 17%、42.27%、55%，整體貢獻仍達約 4 成，其中，中科表示，台積電 7 奈米、10 奈米等成熟製程持續滿載，竹科則看好未來 2 奈米製程落腳後，台積電對園區營運貢獻將進一步提升。針對台積電近期傳出將進駐高雄，科技部長吳政忠回應，不清楚相關狀況，但強調政府會全力協助廠商在地投資，並認為台灣擁有完整半導體產業鏈，未來 10-30 年將可掌握晶片優勢。吳政忠進一步指出，未來台灣可將半導體優勢延伸至其他產業，包含大健康產業 、AI 人工智慧、物聯網、汽車電子、5G/6G，甚至太空星鏈計畫等，都是未來潛在商機。行政院日前也召開科技會報，吳政忠也轉述會中各界關注 2050 年無碳產業 (Carbon Free) 發展，未來將透過政府、民間、產業等多方合作，目前正由國發會召集各部研議相關措施，並舉例科技部專注發展固碳技術、經濟部則負責減碳規劃等。另一方面，針對屏東、嘉義科學園區進度，科技部表示，皆已完成可行性評估，預定在今年 10 月進行籌設計畫，明年進行土地變更、環評等工作，力拚兩座科學園區在 2023 年開始動工。
239,2021/09/13,總太擬發3.1萬張現增股籌資 支應工程款,"上市建商總太 () 今年在台中市有多個建案相繼入帳，加上還有水㓓經貿園區兩建案，對今年及 2022 年的業績展望審慎樂觀看待，董事會今 (13) 日決議，發行現增股 3.1 萬張進行籌資，支應工程款所需。總太現金增資籌資案，爲今年以來建商少見的籌資方式。總太目前手中個案銷售已近完銷，其中台中北屯區「總太 2020」總銷 60.5 億元，銷售率達 99%；北屯區「共好 MELODY」總銷金額 22 億元，銷售率 95%，預計 2022 年完工；北屯區「總太聚作」總銷 67 億元，銷售率 98%，預計 2022 年完工。此外，總太的台中南屯區「女王萬歲」總銷 10.1 億元，目前銷售率 94%，預計 2023 年完工；北屯區「心之所向」總銷金額達 155 億元，目前銷售率 52%，預計 2025 年完工。總太地產近幾年來在台中市積極獵地，目前水湳經貿園區、北屯機捷特區共有四筆土地庫存，建地總面積合計達 3,801.65 坪、總購地金額 37.9 億元。其中，水湳經貿園區二筆土地，分別為鑫新平段 2,775 坪、文商段 53 地號約 649 坪，7、8 月均已取得建照，預計 2022 年進場推案，雙建案預計 2026 至 2027 年完工。"
240,2021/09/13,久元測試代工、設備業務需求滿 將規劃新一輪擴產,封測廠久元 () 受惠半導體測試市況熱絡，測試代工、自製設備兩大產品需求強勁，尤其測試代工隨著晶片產出量增加、中小型 IC 設計客戶積極包機，久元也規劃新一輪擴產。久元表示，測試代工自去年底開始，受惠各類晶片包括 PC 週邊 IC、MCU、MEMS、混合訊號、RF、SOC 等晶片供不應求，上半年已調漲價格 5-10%，至今測試產能維持滿載，預期下半年業務將再優於上半年。此外，久元客戶為確保產能穩定，也採包機模式，雙方簽訂一年合約，不僅可滿足客戶需求，也保障設備稼動率，加上現今晶圓代工廠的產出量不斷增加，久元也擬定資本支出計畫，啟動新一輪成長動能。久元自製設備也有斬獲，近兩年藉由調整銷售策略，從先前透過通路銷售，改為自營銷售，打入台灣、中國各大封測廠，隨著耕耘效益顯現，上半年自製設備銷售金額高達 7 億元，較去年同期的 2.6 億元逾倍數成長。尤其自製設備為高毛利產品，隨著產品組合優化，久元第二季毛利率攀升至 43.3%，創下 10 年來新高，法人看好，久元在設備需求帶動下，毛利率 40% 將成為未來新常態。久元 8 月受揚州廠停工影響，RFID 代工出貨受阻，由於該廠月營收貢獻約 4000 萬元，也影響營收較 7 月下滑，約 4.39 億元，月減 10.92%，年增 68.27%，9 月隨著揚州廠正式復工，營收也可望重返過往水準。
241,2021/09/13,光寶科高層連4個月加碼持股 大手筆買進超過5700張,光寶科 () 高層看好自家公司後市營運，從 5 月起，已連續 4 個月自集中市場加碼持股；據公開資訊觀測站資料顯示，董事長宋明峰、光寶集團創辦人暨董事宋恭源、總經理邱森彬等高層，近 4 個月共加碼超過 5700 張股票，其中，邱森彬近 2 個月持股共增加 200 張。據資料顯示，宋明峰 5 月大舉加碼公司股票 3500 張，其配偶及未成年子女 5、6 月分別加碼 31 張、30 張；宋恭源配偶及未成年子女 6 月也買進 2000 張股票。邱森彬 7、8 月也分別加碼 90、110 張，宋明峰配偶及未成年子女，於 8 月再買進 32 張；在公司董總相繼加碼持股下，顯示對公司後市營運深具信心。光寶科第二季稅後純益 40.34 億元，由於業外收益較上季減少，使獲利季減 5%，年增 17%，每股純益 1.74 元，仍寫單季次高，僅次於今年第一季；上半年稅後純益 82.98 億元，年增 65%，每股純益 3.57 元，創歷年同期新高。展望後市，光寶科表示，下半年營收會比上半年好，成長幅度可能稍受影響，透過調配產能資源，獲利不會受到太大壓抑，毛利率維持第二季目標沒問題，若缺料情況沒那麼嚴重，產能也發揮最大效益，第三季毛利率就可望優於第二季。光寶科也坦言，在缺料干擾下，可能導致旺季遞延至第四季，加上明年春節在 1 月底，客戶通常會先備足料源，預期第四季可能是全年營運高峰，但也不排除因疫情影響，導致需求趨緩，對第四季仍傾向保守看待。
242,2021/09/13,〈長佳智能展望〉每股37元登興櫃 近期將取得美FDA藥證,數位醫療研發公司長佳智能 (6841-TE) 明 (14) 日將以每股 37 元登陸興櫃，董事長陳明豐表示，已取得三張台灣 TFDA 藥證，另外有四個產品美國 FDA 正在審查中，其中影像傳輸裝置藥證審查進入尾聲，近期有望取證，挹注明年營運成長。長佳智能與中國醫藥大學醫院長期合作，透過授權取得醫療數據後，將大量資料建置成資料庫與人工智慧解決方案，提供給藥廠、學術研究公司、營養科學、保險業等不同領域業者。長佳智能共有三大事業體，分別為醫療大數據、醫療 AI 軟體醫材與雲端平台，其中，醫療大數據已接獲許多國際藥廠訂單，醫療 AI 軟體醫材則向台灣與美國申請藥證中，雲端平台則是與國內多數人壽壽險公司合作，預計明年上半年將會陸續亮相。陳明豐指出，醫療 AI 軟體醫材共有三項產品已取得台灣 TFDA 藥證，包括骨齡輔助診斷系統、醫學影像傳輸裝置、圖像記錄傳輸系統，其中，骨齡輔助診斷系統已開始有營收貢獻，後續還有兩項產品正在審查中、兩項產品也將陸續送件。美國藥證方面，長佳智能開發的醫學影像傳輸裝置，藥證審查已進入最後階段，待完成行政程序後，近期有望取得藥證，有機會明年開始有營收貢獻，另外，還有三項產品包括心電圖分析軟體、心胸比估算系統與骨齡圖譜參照系統正在審查中。陳明豐表示，除了布局美國、台灣市場外，旗下產品陸續取得藥證後，將擴大至中國與歐盟市場，目標成為國際級醫療大數據服務公司。此外，長佳智能也跨域發展基因檢測，在健康雲端平台中建置基因檢測 AI 分析平台，提供營養素分析、免疫力、過敏、視力、智力等 7 大報告，可藉此開發專屬基因檢測及提供行動化追蹤服務。
243,2021/09/13,台驊現增申購單7.75萬張 中籤率僅1.09%,貨攬業者台驊 () 今年辦理現金增資 10000 張，每股認購價 140 元，公開申購張數為 850 張，共吸引 77568 張申購單，中籤率 1.09%，增資新股預計 9 月 23 日上市。台驊是國際性物流服務商，擁有海、空、鐵、路完整物流產品布局，去年以來，新冠肺炎疫情推升遠距通訊需求，包括電子商務、防疫物資、居家生活和辦公用品等同步成長，加上供應鏈庫存回補所需，導致艙位與空櫃供不應求。台驊指出，海運業務在天災和 Delta 變種病毒蔓延影響下，艙位供給更加吃緊，適逢海運旺季的強勁需求，供需失衡推升海運價格上漲。空運方面，由於上海浦東機場擴大實施防疫檢測和隔離規定，造成運力持續短缺，同時處在電子產品出貨旺季，空運運價也持續上揚。台驊認為，航運產業供需失衡短期仍不見緩解，預期運價仍將維持高檔，後市展望樂觀。
244,2021/09/13,兆豐越南海防辦事處獲越央行核准 東協據點累計共21處,兆豐金 () 子公司兆豐銀行位於越南海防市新設海防代表人辦事處，日前已獲越南央行核准，目前銀行在越南、泰國、柬埔寨、新加坡、馬來西亞、菲律賓、緬甸、澳洲、印度 9 國設有 20 個據點，加上 2021 年上半年緬甸仰光分行、柬埔寨金邊桑園支行陸續開業，以及本次獲准設立越南海防代表人辦事處，累計東協市場已有 21 個據點。受到美中貿易戰影響，東南亞貿易與產業供應鏈結構改變，越南不論是外人投資或是出口貿易，均顯著成長，可說是貿易戰最大受益國，經濟戰略對台商更加重要。兆豐銀行目前在越南的南部設有胡志明市分行，看好北越的地理位置優勢，近期發展成電子、汽車零組件供應鏈產業聚落，台商投資與設廠漸增，且海防市為越南第三大城市及北部第二大工業中心，擁有越南北部最大的港口與機場，商業活動興盛，為近年電子業前進越南投資之主要城市，發展潛力可期。兆豐銀行表示，在海防市設立代表處可就近掌握當地市場動態及商情，加強開發北越商機，並由國內、外據點攜手合作，服務台商客戶，進而提升胡志明市分行經營利基。兆豐越南胡志明市分行今年前 8 月放款平均餘額較去年成長 11.76%，放款量為東南亞據點 (含子行) 第二大，營運及獲利狀況穩定，輔導眾多台商進入當地市場，在台資銀行中不論是業務規模、獲利能力、服務客層深廣度及越籍人才培育等方面，均居台資銀行領先地位。隨著台商對越南投資快速成長，胡志明市分行成為兆豐銀行新南向重要據點之一，今年更主辦越南胡志明市開發銀行 7100 萬美元聯貸案，及參與由德意志銀行主辦的越南工商銀行 7.9 億美元國際聯貸案，替新南向業務增添動能。
245,2021/09/13,Delta病毒來襲台股震盪 入列受益人前十名+今年績效前4大ETF戰勝大盤,上週美股轉為高檔震盪，加上台灣本土疫情升溫，台股回升至前波高點附近後，逢高檔獲利了結賣壓湧現，近期台股震盪明顯加劇，法人建議，以定期定額方式投資 ETF，增加資產的抗震力，入列受益人前十大且今 (2021) 年績效前 4 大的 ETF 皆戰勝大盤，可看出攻守兼備。法人表示，近期受到漲價、缺料及疫情等多空訊息反覆干擾，指數呈現高檔震盪，而中秋連假將至，市場觀望氣氛濃厚，台股恐持續量縮整理格局。本週關注蘋果新品發表，有望提振電子股表現。不過隨著震盪加劇，選股難度升高，法人建議可以布局 ETF，觀察今年以來截至 9/10，不但入列受益人前十大且績效名列前茅的 ETF，以國泰台灣 5G+() 表現最佳，今年以來報酬率達 20.39%；績效亞軍的富邦公司治理 () 也有超過兩成的水準、達 20.08%；富邦台 50()、元大台灣 50() 績效也都戰勝大盤，分別為 19.32%、18.98%。在高股息 ETF 部分，國泰永續高股息 () 今年以來報酬率達 16.32%，高於元大高股息 ()，並完成 100% 填息的紀錄，讓投資人股息、價差兩頭賺。而 0056 的受益人一直增加，已經達到約 47 萬，顯示投資人長期享受到 0056 穩定的息收與報酬，而非只看短期績效。上述 ETF 都在受益人前十大中榜上有名，其餘受益人最多的四檔 ETF 都是今年才發行的主題式 ETF，包括：中信關鍵半導體 ()、中信中國高股息 ()、富邦越南 ()、國泰智能電動車 ()，可見台股股民對主題式 ETF 的接受度相當高。國泰投信表示，8 月在國內當沖稅可否延續及美國購債政策等不確定因素干擾下，台股呈現價跌量縮格局，但 8 月下旬，在台積電漲價利多帶動下指數開始強勁反彈，展望後市，手機、伺服器與汽車強勁需求將帶動半導體與電子零組件延續缺貨與漲價潮，加上蘋果新機本週即將發表，有望帶動蘋概股表現，而國泰台灣 5G + 成分股中達 75% 屬蘋果供應鏈，可望跟著受惠。此外，Delta 變種病毒入侵提高警戒，導致台股出現震盪，建議可提升高股息配置，有利提升資產保護力。
246,2021/09/13,晶技前8月稅前盈餘年增1.5倍 每股賺8.11元,頻率元件龍頭廠晶技 () 今 (13) 日公布前 8 月自結，稅前盈餘 25.13 億元，年增 1.5 倍，每股稅前盈餘爲 8.11 元，晶技 8 月營收 13.49 億元，月增 2.8%，年增 34.16%，自結 8 月稅前盈餘 3.4 億元，月減 3.699%，年增 1.03 倍，單月每股稅前盈餘 1.1 元。晶技前 8 月營收營收 103.12 億元，年增 55.37%，稅前盈餘 25.13 億元，年增 1.5 倍，每股稅前盈餘爲 8.11 元，晶技受惠石英元件本業持續成長，且寧波廠產能陸續開出，前三季營收將超越 2020 年全年 110.48 億元。晶技核心頻率元件業務受惠 5G、電動車、WiFi 6、物聯網及 ADAS 新規格需求強勁，持續推升業績成長。2021 年上半年稅後純益 15.52 億元，創歷年同期新高，年增 1.48 倍，每股純益 5.01 元。
247,2021/09/13,振宇五金明起競拍 底價66.67元 10月上旬上櫃,五金連鎖通路業者振宇五金 (2947-TE) 配合初次上櫃前辦理現金增資發行新股，明 (14) 日至 16 日啟動上櫃前競價拍賣，競拍底價為 66.67 元，於 22 日上午 10 點開標，預計 10 月上旬正式掛牌上櫃。振宇五金此次競拍依投標價格高者優先得標，每一得標人應依其得標價格認購，競拍底價為 66.67 元，每標單最低為 1 張，最高 192 張。振宇五金是結合專業五金和家庭五金商品的複合式五金連鎖銷售通路，來客有 40% 為專業師傅，60% 為一般喜好 DIY 的客群。振宇五金表示，今年以來雖受本土疫情影響，門市營收仍持續成長，前 8 月合併營收 11.46 億元，年增 9.23%。目前振宇五金全台門市據點近 60 家，展望後市，仍將持續展店拓展市場版圖，振宇五金指出，下半年於北部和南部門市會陸續開出，朝 5 年內全台店數翻倍達 3 位數目標邁進。振宇五金上半年合併營收 8.37 億元，年增 7.43%，稅後純益 5995 萬元，年增 7.99%，每股純益 (EPS)3.47 元，其中，第二季稅後純益 2833 萬元，年增 5.74%，在疫情期間仍維持正成長。
248,2021/09/13,前台船總經理領軍 海天離岸工程將投資建造大型鋪纜船,繼台船環海投資大型浮吊船環海翡翠輪後，國內海事工程公司海天離岸工程也宣布，將投資建造我國首座大型鋪纜船 (CLV)，預計 2023 年完成建造，2024 年起全力投入離岸風場鋪纜作業，響應政府推動離岸風電國產化發展策略。海天離岸工程由前台船總經理暨台船環海董事長曾國正領軍，並擔任董座，延攬在海事工程領域具有豐富經驗的專家加入團隊，建構本土第一艘大型鋪纜船，致力以在地化服務提升本土產業鏈價值。以總產值來說，包括運輸及安裝作業的海事工程，費用約佔風機採購外的風場建置總成本 3 成；以風場併網時程來看，海事工程能否順利按計畫進度進行及完工，更是風場能否順利營運，及能源轉型能否順利達標的關鍵。政府在離岸風電第二階段潛力場址及第三階段區塊開發計畫中，鼓勵國內產業鏈發展本土海事工程能量。目前風場前期作業及輔助性海事工程已漸具規模，但主力海事工程能量，包括水下基礎運輸及安裝、海纜運輸及鋪設、風機運輸及安裝，仍待建立。海天離岸工程投資的大型鋪纜船，是最能適應台灣及亞太區域風場作業需求的先進船型，除能以高效率及高可靠度完成離岸風場內陣列電纜及輸出海纜鋪設外，也可執行通信海纜鋪設及電力海纜與通信海纜搶修。海天離岸工程進軍海事工程，除投入本土化大型鋪纜船建置，也將結合我國造船、修船、海事工程、資通訊整合及 AIoT 智能技術，鏈結本土船隊、創造在地價值
