,date,title,content
0,2014/09/16,力推亞太理財中心 銀行基金集合管理帳戶鬆綁 擬10月上路,金管會力推亞太理財中心，今(16)日預告「共同信託基金管理辦法」及「信託資金集合管理運用管理辦法」修正草案，鬆綁銀行共同信託基金、集合管理運用帳戶業務，讓銀行在財務管理業務的操作更有彈性，預計10月上路。為了讓銀行發展業務，金管會表示，擬放寬共同信託基金投資在有價證券的比重，從原本的6億元或40%，調整為10億元或50%。若超限的話就必須向金管會申請核准兼營投信，將該基金回歸投信。投資的範圍可為境外信評BBB-以上的商品；但境內無限制。至於集合管理帳戶此次鬆綁後，銀行可針對非專業投資人、專業投資人，量身訂做結合理財、退休金管理、公益、都市更新或公共建設等特定信託或投資目的之集合管理運用帳戶。據金管會統計，截至6月底，我國只剩元大銀行還有一檔共同信託基金，規模約3億多，相較2007年時的高檔規模高達52.6億元；此外，信託資金集合管理帳戶目前也只剩下上海、合庫、華銀、一銀以及台新等5家業者，僅剩19檔、規模87億元，亦遠不如2007年時的420億元。
1,2014/09/16,不動產放款集中度改善 金管會：3年來金額減少逾千億元,金管會最新統計，對不動產偏高的銀行進行控管後，自2011年至今(2014)年7月底，銀行不動產放款集中度較高的家數由當初的17家，迄今已降到7家，3年多來銀行不動產授信已減少超過千億。金管會表示，3年來銀行整體不動產授信金額減少1086億元，整體房貸加修繕貸款餘額約為3兆70億元，較2010年底的3兆1495億元明顯減少，不過，建築貸款餘額為5892億元，較2010年底的5553億元增加。此外，不動產集中度較高銀行的備抵呆帳增提達95.46億元。銀行局表示，土建融(建築貸款餘額)雖然持續增加，不過，土建融最終會轉入分戶房貸，因此，房貸餘額減少代表整體銀行對不動產授信還是在減少的。銀行局指出，銀行都有意識到風險，對不動產的授信也較謹慎，金管會將持續適用銀行不動產授信三大監控措施，包含：一、「購置加計修繕貸款餘額」前十大銀行，其餘額不能超過總放款的30%，其餘銀行不能超過40%；二、「建築貸款餘額」前十大銀行，其餘額不能超過總放款的10%，其餘銀行15%；三、所有不動產擔保放款，不能超過總放款的70%。
2,2014/09/16,為收回頻譜不讓WiMAX業者換照？ NCC石世豪：惡毒的猜測,NCC決議不讓大同電信換照，引來WiMAX業者不滿，更有媒體報導質疑NCC打算以不換照的手段收回頻譜，且因為這起事件，引發NCC內部不同意見的爭議；主委石世豪親上火線說明，強調外界的猜測太惡毒，他同時表示，內部會有不同的意見，但最後會達成共識，NCC合議制並沒有改變。NCC日前決議大同電信不予換照，引發WiMAX業者不滿，前往NCC抗議，同時也傳出NCC內部有不同聲音，主委石世豪與擔任發言人的副主委虞孝成不同調，針對大同電信換照案，包括虞孝成及委員彭心儀都提出不同意見書；但石世豪則是提出協同意見書，認為大同電信未達事業計畫書承諾的1837座基地台，依照管理規則不予換照。由於內部意見不同，引來外界質疑NCC合議制是否受到影響? 石世豪趕在NCC每周三委員會議後的例行記者會前，先召開記者會說明，他強調，內部從來沒有要以不讓WiMAX業者換照的手段來收回頻譜，媒體報導6家WiMAX業者將無法換照一事，是惡毒的主觀猜測。有關2.6GHz釋照的規劃，石世豪說，預計將釋出190MHz頻寬，其中90MHz頻寬與6家WiMAX業者目前使用的頻段重疊，業者只要依相關法律程序換照，就可以合法使用經營WBA業務。他表示，明年預計釋出2575MHz到2615MHz規劃為TDD的4G使用頻段，目前的WiMAX業者是合格的4G執照申請人和競標者，歡迎6家WiMAX業者直接申請競標成為4G經營者。
3,2014/09/16,中移動砍手機補貼 奚國華：未來以賣裸機為主,中移動董事長奚國華(右二)來台。(圖：遠傳提供)中國電信補貼政策改變，將降低手機補貼金額，中國移動董事長奚國華今(16)日證實，政策上今年確實將會降低補貼金額，但是還是會有補貼，只不過是以補貼用戶為主，未來發展將朝賣裸機方向進行，但會給用戶優惠；他強調，產品賣不賣的出去不完全取決於補貼，而是要看產品本身的性價比；至於是iPhone 6新機何時開賣及降低補貼是否會影響到銷售?他則未正面回應。兩岸4G LTE技術及商用發展正積極推進中，以中國移動為首的全球TD-LTE國際產業組織GTI(Global TD-LTE Initiative)，率領國際運營商及LTE產業鏈者共同來台，今(16)日與工研院共同舉辦「行動寬頻發展高峰論壇」，將進行為2天半的LTE TDD/FDD產業鏈產品與應用展示。奚國華指出，中移動現有用戶數有8億戶，其中大多數是2G的用戶，未來將加速促進2G用戶升級至4G，中國市場有巨大的4G需求，台灣在晶片、手機製造等產業具有優勢，尤其是高性價比的手機，更是台灣的優勢，兩岸的合作可以共創雙贏。奚國華指出，中移動今年預計銷售2億支手機，上半年已賣出約1億支3G手機，下半年以4G LTE手機為主，預計將賣出1億支4G手機；今年4G用戶目標5000萬戶將可以順利達成。至於補貼政策的改變，奚國華坦言，今年確實會降低補貼金額，但還是會有補貼，只不過是補貼用戶而不是補貼手機，未來會賣裸機為主；他說，在用戶的補貼上則是根據用戶對中移動的貢獻來決定。奚國華強調，手機賣不賣的出去不完全取決於補貼，而是取決於產品本身的性價比；有關iPhone 6新機上市時間，及銷售情況是否會受補貼降低影響?他則未正面回應。
4,2014/09/16,鴻海助「翻轉教育」！郭董：不要老是在考試制度上探討,鴻海董事長郭台銘力推「翻轉教育」！(鉅亨網記者胡薏文攝)鴻海集團()董事長郭台銘推動的「11屏3網1霧1雲與8大智慧生活」，其中在「教育生活」部分，今天在台灣跨出1大步！鴻海今天下午召開記者會，宣布與新亞太電信()捐贈上億元設備，為師大附中、台中女中、新竹試驗中學等3校，建立互聯「智慧教室」，預定11月底前即可達成第一階段建置。鴻海集團董事長郭台銘表示，盼能藉此翻轉台灣教育，不是老是要考試。與其在考試制度上探討，不如積極利用科技提升學習效率！鴻海集團副總裁、亞太電信董事長呂芳銘今天表示，此一「翻轉教育」計畫，將可透過網路、4G架構，相關教材可儲存在鴻海高軟雲端儲存平台中，3校學生透過電子白板、平板電腦、智慧手機即可打破校園的實體藩籬，進行互聯教學。鴻海將把這3所學校智慧教室「互聯」，當作在台灣實現「教育生活」的第一個場景，未來將繼續在台灣推動「翻轉教育」，並希望儘速擴及偏鄉地區。郭台銘透露，看到這3所學校校長積極推動，他立即將捐助預算加碼至「3倍」，而會先在這3所學校推行，不是經過挑選，而是這3位校長對於引進科技教育學生最為積極。郭台銘指出，雲端是很重要的，透過雲端，教育經費可以大幅減少，大家不必重複製作一樣的教材。而鴻海參與4G投標，就是要確保網路順暢，4G手機加上網路、上傳下載，「交給我們處理」，校長老師只要負責教育就好，而且教材可將過去的聲音、文字，隨頻寬加大，可改用影像教學。郭台銘強調，孩子是我們的未來，鴻海也會承諾把最新、最好的科技，提供給這3所學校，並將「智慧教育」擴及偏鄉，藉此「翻轉台灣教育」，不是老是要考試。「學生沒有聰明或笨，只有努力不努力」，希望未來台灣每個學校，沒有先天或後天環境的差異，未來的鑑定只有努力參與程度。
5,2014/09/16,◆投信連續3日賣超個股,投信連續3日賣超個股1.投信連續賣超3日的股票(2303)  聯電   、(3474)  華亞科 、(3481)  群創  、 (2886)  兆豐金、 (06205FB)上証2.投信連續賣超2日的股票(3474)  華亞科、 (2303)  聯電  、 (2883)  開發金、 (3481)  群創  、 (1447)  力鵬3.投信當日(16)賣超的股票(2303)  聯電  、 (3481)  群創  、 (3474)  華亞科、 (1447)  力鵬  、 (2458)  義隆
6,2014/09/16,◆投信連續3日買超個股,投信連續3日買超個股1.投信連續買超3日的股票(2883)  開發金、 (2634)  漢翔  、 (2409)  友達  、 (3698)  隆達  、 (2609)  陽明2.投信連續買超2日的股票　(2634)  漢翔  、 (3698)  隆達  、 (2609)  陽明  、 (1101)  台泥  、 (2891)  中信金3.投信當日(16)買超的股票(2634)  漢翔  、 (3698)  隆達  、 (2472)  立隆電、 (2327)  國巨  、 (5264)  F-鎧勝
7,2014/09/16,◆外資連續5日賣超個股,外資連續5日賣超個股1.外資連續賣超5日的股票(0050)  台灣50、 (2330)  台積電、 (2353)  宏碁  、 (4904)  遠傳  、 (2448)  晶電2.外資連續賣超4日的股票(0050)  台灣50、 (2330)  台積電、 (2353)  宏碁  、 (2883)  開發金、 (2303)  聯電3.外資連續賣超3日的股票(0050)  台灣50、 (2353)  宏碁  、 (2330)  台積電、 (2883)  開發金、 (2303)  聯電4.外資連續賣超2日的股票(0050)  台灣50、 (2330)  台積電、 (2353)  宏碁  、 (2883)  開發金、 (2303)  聯電5.外資當日(16)賣超的股票(0050)  台灣50、 (2330)  台積電、 (2353)  宏碁  、 (2883)  開發金、 (2303)  聯電
8,2014/09/16,◆外資連續5日買超個股,外資連續5日買超個股1.外資連續買超5日的股票(2409)  友達  、 (3231)  緯創  、 (2888)  新光金、 (2002)  中鋼  、 (2887)  台新金2.外資連續買超4日的股票(2409)  友達  、 (3231)  緯創  、 (2888)  新光金、 (2002)  中鋼  、 (2886)  兆豐金3.外資連續買超3日的股票(3231)  緯創  、 (2002)  中鋼  、 (2886)  兆豐金、 (2409)  友達  、 (2888)  新光金4.外資連續買超2日的股票(2886)  兆豐金、 (3231)  緯創  、 (2002)  中鋼  、 (2887)  台新金、 (4938)  和碩5.外資當日(16)買超的股票(2886)  兆豐金、 (3231)  緯創  、 (3474)  華亞科、 (2615)  萬海  、 (2603)  長榮
9,2014/09/16,聯電好爭氣！ 連續7年 名列道瓊永續性指數成分股,"聯電()今天(16日)宣布，連續7年列名於永續性指數(Dow Jones Sustainability Indexes, DJSI)之「世界指數」(DJSI-World) ，並同時列名於「新興市場指數」(DJSI- Emerging Markets)成份股之一。2014年永續性世界指數由全球大型企業中挑選約2500家企業參加評比，評選出319家企業為成分股，全球半導體業僅有5家列名，新興市場指數中半導體業則僅有2家列名。聯電此次在「反托拉斯政策」、「產品品質與召回管理」及「環境政策/管理系統」等3個項目獲得了滿分，在數個項目獲得了半導體業最高分，且整體成績也逐年提升。 聯電執行長顏博文表示，永續發展之理念已內化成為公司重要的核心價值，連續7年列名永續性指數，再次證明聯電可以在經濟發展、環境保護與社會公益3方面完整融合運作，同時發揮正面的影響力。顏博文還說，未來將以更前瞻與積極的作為，善盡企業公民責任，並且與供應鏈夥伴攜手合作，協助客戶研製綠色產品，共創卓越與永續的社會。近年聯電持續整合強化永續管理組織，並致力於推動清潔生產綠色工廠、溫室氣體減量、生態保育、健康職場促進、人才培育、企業志工、永續供應鏈等，實踐聯電對永續的承諾。永續性指數成立於1999年，由美國公司(Dow Jones Index)、歐洲STOXX公司與瑞士蘇黎士永續資產管理公司（Sustainable Asset Management, SAM）在1999年共同推出。這是全球第1個追蹤頂尖企業的社會責任指數，也是現今國際間最具公信力的企業永續評比工具之一，為全球投資機構之重要參考指標。永續性「世界指數」每年於全球挑選約2,500家大型企業參與評比，並於各產業評選出在永續經營上表現最好的前10%的公司為其成分股。「新興市場指數」則以新興市場前800大企業中，挑選各產業永續性績效前10%的公司成為其成分股。"
10,2014/09/16,電子大咖看好 聯生醫周五85元登興櫃 打造全台最大蛋白質產線,聯生醫總經理廖美君(左二)表示，公司建造2線3千公升級的蛋白質生產藥廠，最大可擴充12線，預計2016完工。右三為董事長王長怡。(鉅亨網記者張旭宏攝)擁有洪嘉聰及簡奉任等電子大咖在列的專攻單株抗體新藥聯合生物製藥(聯生藥)(6471-TW)將於本周五(19)日登錄興櫃，今(16)日開興櫃前業績發表會，總經理廖美君表示，公司建造2線3千公升級的蛋白質生產藥廠，最大可擴充12線，預計2016完工，屆時將成為台灣最大，並導入GE生產技術，將大幅降低成本2-3倍。聯生藥股東結構分別有聯亞生技的65.51%、台塑生醫24.68%、元富創投0.94%、璨圓(3061-TW)董事長簡奉任1.68%，值得注意的是，股市名人林滄海也持有0.64%，另外聯華電子董事長洪嘉聰擔任獨立董事。聯生藥由母公司聯亞生技的單株抗體藥品事業部分割新設生物製藥公司，專注於開發、製造與銷售單株抗體藥品，擁有承襲於母公司的蛋白質抗體藥品開發與生產技術，約40人研發團隊與創新產品線，包括愛滋病治療單株抗體(UB-421)、皰疹病毒治療單株抗體(UB-621)、乳癌治療單株抗體Heceptin®生物相似藥(UB-921)、類風濕性關節炎治療單株抗體Humira®生物相似藥UB-721、大腸癌治療單株抗體Avastin®生物相似藥(UB-922)、淋巴癌治療單株抗體Rituxan®生物相似藥(UB-923)與創新抗VEGF單株抗體(UB-924)。廖美君指出，公司的抗體藥物開發與生產平台，使新產品只需2-3年就可以進展到臨床試驗的申請，且蛋白質生產藥廠完成後，除自用外，可利用空閒產能代工生產其他藥廠委託蛋白質藥物，以代工業務支持新藥研發，並開發困難度較低的生物相似藥。聯生藥擁有母公司完整的抗體藥物開發與生產平台及愛滋病治療單株抗體UB-421等創新產品線，同時加入財務、臨床醫療資源豐富的台塑生醫，取得與長庚體系在臨床上的合作，加速產品線的發展及台灣藥品市場的開發。廖美君進一步指出，旗下最快的愛滋病治療單株抗體(UB-421)，治療性用藥Phasella臨床報告將於今年第三季完成，並於年底提出IND，目前正在接觸國際大廠，預計明年將會策略合作，收取授權金。廖美君強調，公司將建造2線3千公升級的蛋白質生產藥廠，最大可擴充12線，預計2016完工，屆時將成為台灣最大，並取得GE生產技術，將大幅降低成本2-3倍。提高獲利能力。
11,2014/09/16,限制型股票惹議 宏碁：原本就以獎勵主管為主,宏碁()8月發行多張限制型股票，宏碁今(16)日發出新聞稿，強調宏碁8月26日發行第一次限制型股票(Restricted Stock Award，RSA)，與一般以過去績效而發放的員工分紅不同，是針對公司未來業績與獲利發展需求所設計，是具有長期積極目標為條件的激勵獎酬工具，以達鼓勵功效，宏碁並強調，由於中高階主管擔負營運成敗重責，因此獎勵計畫對象以主管為主。宏碁指出，8月26日發行第一次限制型股票(Restricted Stock Award，RSA)，並非一般以過去績效而發放的員工分紅，而是針對公司未來業績與獲利發展需求所設計，是具有長期積極目標為條件的激勵獎酬工具，以此達到鼓勵的功效，進而創造股東價值，也讓員工在努力後能夠有實質的收入獲益，追求三贏的成果。宏碁強調，始終秉持王道精神、利益平衡的宗旨，通過股東會與董事會核可後，決定發行此限制型股票，作為未來的長期獎酬措施。宏碁指出，由於中高階主管擔負絕大部分的營運成敗重責，因此獎勵計畫主要對象是主管，希望藉此創造更多動力，鼓勵主管與員工和公司共同成長。宏碁表示，8月發行的限制型股票是一次給予、分4年到期(每年到期25%)，且逐年檢視，依照公司營運績效指標、與個人績效指標的達成狀態來計算獲獎股數，當限制型股票所設定的績效目標達成、且公司的業績與獲利皆達標，並持續在職的中高階主管，才能拿到承諾之股票，而股東及員工也可以拿到最終的盈餘分紅。宏碁重申，今年下半年發行的限制型股票，須依照公司和個人的營運績效指標之達成率、以及公司的業績與獲利狀態，並且員工在企業內繼續服務的條件下，才可能獲得這項獎勵措施的給予。宏碁今年8月第一次實施發行限制型股票，發放股票集中中高階主管，其中包含施振榮、黃少華與陳俊聖等人，4年內若績效達標，3人可各領到480張股票；另外發放的其餘股票，則多由事業群總經理與財務長等人分走。
12,2014/09/16,倫元投顧－將有機會止跌反彈,◆盤勢分析在包括今天在內的過去10個交易日內，呈現震盪走貶的走勢，自盤中最高至最低點計算，九月份貶值幅度為0.91％。由的持續貶值，以及外資在股市以及貨部分的操作，可以明顯看出，外資不但在股市持續站在賣方，甚至應該已經展開匯出資金的動作。外資之所以持續站在空方，除了台灣股市相對位階較高，上漲空間遠低於下跌空間外，匯率的變化，以及資金面的持續收縮，是造成外資持續外流的主要原因。事實上，自七月份開始，美元升值幅度已達5.97％，相對的，實施負利率以刺激經濟景氣的日本，卻大幅貶值6.2％。就連匯率和連動性最高的，在九月份都已貶值3％。相對的，始終維持穩定匯率的，在九月份卻僅只小幅貶值0.91％。美元的升值，本就已經吸引國際資金回流美元資產，的貶值，更使市場擔心亞洲區將展開貨幣貶值競賽，而在相對位階偏高的情況下，外資當然選擇流出台灣的操作方向。這一點，從外資持續在台股賣超，並且加碼布局空單，而也連續10個交易日回貶，就可看的非常清楚。不過，美元已經來到相對高檔，如果聯準會本週未如市場預期宣示調高利率的政策，將不排除美元反向回貶的可能，而一旦美元回貶，外資將停止自台灣流出，台股將有機會止跌反彈。外資今天在再度加碼空單4100口，持有的空單口數也再登17000口大量，理論上，明天外資壓低平倉的可能性將非常高，但是自短線技術指標看，負乖離已經大到隨時可以反彈的程度，而我們自反市場心理研判，最佳止跌、甚至反彈時機，應該就在明天。也就是說，除非明天全球股市崩跌，否則台股就算不止跌收紅，應該也會留下下影線。李永年分析師★ 此研究報告著作權屬倫元證券投資顧問(股)公司，切勿盜用或翻印，否則追究責任，決不寬貸 ★ 所有資料僅供參考，本公司不負盈虧責任，洽02-7725-8899理財專員
13,2014/09/16,工行首發寶島債 台星雙掛牌 大陸5大銀行全到齊,打亞洲盃，永豐金()也不落人後！大陸最大的國有商業銀行中國工商銀行（工行）新加坡分行，首度發行寶島債，採台灣新加坡雙掛牌模式，寶島債部分由永豐金旗下永豐金證券主辦，吸引法人熱烈認購。工行寶島債發行後，不僅陸5大國銀寶島債全員到齊，加上工行為新加坡業務清算行，因此以工行新加坡分行作為境外債券發行主體，意義格外重大，獲得市場高度的重視。本次發行「寶島獅城債」項目由永豐金證券、工行新加坡分行、星展銀行、法國巴黎銀行、花旗銀行、標準銀行、渣打銀行、匯豐銀行擔任聯席牽頭經辦人；德國商業銀行、澳大利亞聯邦銀行聯席經辦人，並由永豐金證券與星展銀行擔任簿記管理人。吸引了香港、新加坡、台灣等亞洲投資者以及德國、義大利等歐洲投資者的踴躍認購，認購金額超過73億元發行天期分為2、5、7年期，2年期在SGX新加坡交易所掛牌，5年期與7年期同時在台灣櫃檯買賣中心與新加坡交易所掛牌，市場給予其暱稱「寶島獅城債」，債券發行利率在台灣、新加坡及境外債券市場同步，吸引了主要機構投資人等熱烈認購。永豐金證表示，這次發行的債券包括不同期限組合，分別是2年期債券20億元、5年期債券7億元和7年期債券13億元，票面利率分別為3.5%、3.7%和3.95%，較指導價格分別收窄了10至15個基點。這批債券中，7年期債券為新加坡市場首次發行，為形成新加坡離岸債券收益率曲線進行了有益的探索。工行新加坡分行表示，這次債券發行體現了新加坡離岸中心地位逐步鞏固，也體現國際化進程不斷加快。此次債券發行嘗試在新加坡和台灣市場雙掛牌，有助提升兩地資金的流動，增加投資者的選擇，加強不同離岸中心之間的合作。為配合金管會打亞洲盃及「金融進口替代」的政策，永豐金積極佈局東南亞市場。永豐金表示，台灣與新加坡均為領先的離岸市場，資金池相互流通是國際趨勢，本案成功將境外債券資本市場相結合，是國際化歷程的重大突破，也為台星資本市場合作，跨進一大步，更證明了台灣與新加坡雙方在基礎設施等方面的合作創造了可能性，雙方的合作將有助為兩地投資人提供更全方位的服務。永豐金表示，未來永豐金將繼續結合工行在亞洲各國完整的佈局，積極爭取東南亞市場商機，為東南亞當地企業及台商進行發債、聯貸及應收帳款管理等融資業務合作。大陸廣西南寧第11屆中國－東盟博覽會在本週(16日~19日)舉行，永豐金也將利用此契機，與工行在東盟10國的團隊進行業務合作會議，目標在東南亞當地市場找到優質客戶發揮各自優勢共同提供服務，並尋找亞洲盃的商機。此外，工行將於22日在新加坡主辦第1屆高峰論壇，工行董事長姜建清將親自出席，並邀請產官學者專家，共同針對未來國際化方向及發展趨勢進行討論。
