,date,title,content
1023,2014/10/20,大陸廠挖角是長期現象 華亞科高啟全：Q4 DRAM市況穩定,三星宣布南韓京畿道平澤新廠擴建計畫，預計2015年初動工，最快可在2017上半年正式投產，市場擔心將對DRAM供需造成衝擊，華亞科(3474-TW)董事長高啟全今(20)日表示，第4季DRAM的市況穩定；至於大陸廠挖角台灣半導體人才一事，他認為是長期現象，政府及企業必須創造好的環境來留住人才。台灣玉山科技協會、台灣半導體產業協會、矽谷華美半導體協會台灣分會今日下午舉行「玉山資通訊科技論壇」，共同探討「通訊與半導體產業的新面向」。請到政委蔡玉玲、工研院董事長蔡清彥、中華電董事長蔡力行深入探討台灣的發展契機，且舉辦「資通訊與半導體業菁英對話」座談會，與談人包括中磊總經理王煒、遠傳總經理李彬、華亞科董事長高啟全、聯傑國際董事長郝挺，及中國移動通信集團蘇州分公司總經理陳煒等。高啟全在會前接受媒體訪問表示，三星計畫建新廠，但是新廠要2-3年後才完工投產，未來要生產的產品也還不確定，目前DRAM產銷狀況穩定，預期今年第4季DRAM市場可望維持穩定。有關中國半導體業來台挖角，高啟全說，挖角是產業的長期現象，政府政策及產業界要創造出好的、友善的環境，才能留住人才，因為人才在有發展空間及機會時難免會因選擇出現流動。華亞科9月營收69億元，較日前暫結的67.93億元增加1.07億元，較8月67.12億元增加2.8%，較去年同期59.76億元成長15.46%；第3季合計營收202.67億元，較第2季營收214.5億元減少5.51%，因貶值，可望出現匯兌收益，預期第3季獲利仍可持續成長；累計前9月營收619.42億元，較去年同期383.23億元成長61.63%。外資認為華亞科9月營收表現未如預期，第3季營收較第2季減少，因封測價格增加，毛利率可能下滑，維持中立評等，市場預期，因第3季價格續揚，加上走貶，可望出現匯兌收益，預期第3季獲利可望優於第2季，挑戰今年第1季的新高，10月29日法說會將公布第3季財報及未來展望。華亞科今日股價開高走高，以43元跳空開高後一路維持強勢，終場以漲停43.5元作收，一舉收復月線。
1024,2014/10/20,鉅亨晚報 2014年10月20日,■確定接任衛福部長的政務委員蔣丙煌，今天上午主持第2次食安工作推動小組會議，針對11月底將公布的油品「邊境分流」管制規定，聽取相關部會報告準備工作。■備受關注的中共十八屆四中全會今(20)日召開，中國法治進程臨近新的歷史節點。■封測大廠日月光(2311-TW)廠房汙染後勁溪案，今(20)日高雄地院做出判決，其中廠長蘇炳碩等4人獲判1年4個月至1年10個月不等之有期徒刑。■防內線交易 證交所建監視制度 ■最貴透天厝！ 西門町擊敗信義區奪冠 土地每坪1344萬 ■搶當5G早鳥 我將結盟歐陸■俄烏朝達成最終供氣協議邁進一步 緩解外界擔憂■安倍鬆口...重稅若衝擊經濟也「沒意義」或延後二度提高消費稅■亞股再淪外資提款機 上周韓股失血10億美元 台股遭賣8億美元■中國企業債臺高築 殭屍銀行企業大增成經濟風險 ■網家支付連 攜手騰訊財付通 搶攻兩岸跨境第三方支付■高盛為原油市場定調：長期過剩造成短期短缺■景氣燈號連7月綠 出口連8月成長 馬總統：經濟好轉成型[NT:PAGE=$]■德國財政部月報：德國9月稅收年率增長4.7%；1-9月年率增長3.0%。■韓國9月PPI月率-0.3%，預期值-，前值-0.1%。■台灣20日收盤上漲 150.26 點或 1.77 %，報 8663.14 點，成交金額 780.33 億元。■台股20日三大法人集中市場買超 37.62 億，其中外資買超 25.18 億，投信買超 2.60 億，自營商買超 9.84 億。■日經225指數20日收盤上漲578.72點或3.98%，報15111.23點；開盤14822.84點，全日高見15111.23點，低見14819.69點。■韓國Kospi指數20日收盤上漲29.40點或1.55%，報1930.06點；開盤1918.84點，全日高見1933.12點，低見1917.54點。■澳洲S&P/ASX 200指數20日收盤上漲47.679點或0.90%，報5319.40點；開盤5271.70點，全日高見5342.00點，低見5271.70點。■上海綜合指數20日上漲15.54點或0.66%至2454.71點。■香港20日上漲66.21點或0.29%至23089.42點。■台北匯市20日收盤，收盤升值 0.6 分，報 30.415 元兌 1 美元。成交金額為 5.74 億美元。
1025,2014/10/20,新日光N型雙面吸光電池技術突破 轉換效率提升,全球太陽能電池廠新日光()技術突破，N型雙面(BiFi)吸光太陽能電池研發轉換效率提升，正面效率最高可達20.4%，以背面貢獻20%的功率提昇計算，相當於單面電池轉換效率24.5%，可讓60片模組達到等效330Wp功率。根據新日光內部的場域測試(Field test)數據顯示，傾斜安裝下N型雙面太陽能模組，較一般單面模組多發出的電能可以高達20%以上。新日光表示，垂直安裝的雙面太陽能模組的電能輸出則具有雙峰值特性，分別發生於午前與午後，且避免落塵覆蓋，能夠與一般模組的電能輸出搭配，起互補作用。 N型雙面吸光太陽能產品，新日光指出，特別適合平屋頂、垂直安裝、建築整合型、停車棚、隔音牆、雪地、沙漠地區等應用。新日光董事長林坤禧表示，很高興繼2013 PV Taiwan首度發表之後，新日光能將雙面吸光電池效率進一步提昇。相信下游客戶將能開發出更多利基型應用，並且相對於使用一般模組，能獲取更高的投資回報。
1026,2014/10/20,乾景投顧盤後－外資大幅減碼空單 台股醞釀反彈契機,◆盤勢分析美股周五(10/17) 上週五大漲263點、大漲1.63%，NASDAQ漲0.97%，指數收紅0.81%。主因為市場預期各國央行將進一步推出振興措施，外加企業季報以及經濟數據表現優於預期，配合先前跌幅較深，使得單日出現較大的漲幅，帶動亞股全面出現反彈，台股亦開高100點以上。台股隨國際股市強彈下，收盤上漲150點、漲幅1.76%，成交量為782億，反彈成交量尚不足，指數將會再來測試此波低點。從技術面分析，在大跌一段趨勢中突然出現實體大量長黑K(10/17)，以歷史經驗解讀，此為跌勢的末端，往後雖還是有小破底的機率(M頭跌幅滿足點約8430~8400點左右)，但是再大幅度下跌機率將不多，盤勢將轉為大幅度的震盪打底。而由籌碼面觀察，外資在現貨結束連續9天的淨賣超，指數亦由9100多點跌至8500多點後反彈，亦有順勢回捕現貨跡象，今日終於呈現淨買超25億；外資期貨空單更是大幅回補了6千多口空單，淨空單剩下1.3萬口。綜合以上數據分析，指數大跌機率降低，將進入反覆測試低點來震盪打底。為了減少震盪階段所產生的非必要損失，請投資人稍安勿躁，先不急著搶一兩天的反彈。最後這階段應等待指數再次回測低點後，我們才能佈局領先大盤打底完成，將蓄勢待發的個股。簡福杉 分析師
1027,2014/10/20,台灣日月光污染案今日宣判 4人緩刑1人無罪,新浪科技訊 10月20日下午消息，據台灣“中央社”報導，曾經轟動一時的，今天上午正式宣判，5名犯罪嫌疑人4人獲緩刑，1人無罪釋放，公司被判處金300萬元(約60萬元)。日月光高雄K7廠去年10月因排放含鎳、銅等有毒廢水遭重，相關生停工。高雄地檢署今年1月依違反廢棄物清理法等罪，將廠務處長蘇炳碩等5人，依公共危險罪和違反廢棄物清理法提起訴訟。高雄地方法院今天上午宣判，廠務處長蘇炳碩等4人獲判1年4個月至1年10個月不等的有期徒刑，均獲緩刑，工程師何登陽無罪。日月光公司被300萬元。日月光今日發布聲明表示，公司尊重司法判決。對於廠務處4名被判處有罪的員工，日月光表示，將在合法及關懷員工的立場上，就后續法律程序給予必要的協助。對於K7廠，日月光指出，這僅是偶發事件，公司已建立完善的預防、預警及應變機制。高雄K7廠是日月光倒裝晶片(Flip Chip)等封測與12寸凸塊晶圓(Bumping)製程的主要基地，主要供應28納米製程通信晶片。晶圓凸塊占K7廠營收比重約30%到35%；倒裝晶片封裝占比約15%，其他包括打和測試。K7廠每月能接近5800萬美元，其中1800萬美元是晶圓製造，其他4000萬美元是非晶圓製造，K7廠營收占日月光集團總營收約9%。(木南)
1028,2014/10/20,鑫晶鑽受GT重整拖累 廢止現金增資！,藍寶石長晶廠鑫晶鑽科技(4969-TW)受到債務人極特GT無預警申請重整，加上資本市場環境不佳，因此公司決議申請廢止現金增資發行普通股。鑫晶鑽今年現金增資，在6月4日獲金管會核准生效，受到景氣下滑，因此歷經變更發行價格及延長延長特定人繳款期間，但近期因國內外資本市場環境不佳景氣趨勢未明，並受到本公司債務人極特GT無預警在美國向破產法庭依破產法第11章規定申請重整影響，導致興櫃股價產生鉅幅波動情形，因此無法順利募集完成本次現金增資，因此決議廢除今年首次現金增資案。鑫晶鑽表示，GT是選擇保獲重整而非破產清算，是希望重新調整繼續營運，因此對於回收5億元貨款是相當有信心；另外同時啟動專利保護動作，狀告灣美國蘋果亞洲、神腦國際、威寶電信等3家公司侵害專利權，並提起訴訟。鑫晶鑽指出，公司在國際間佈局多年的智慧財產權保護策略，如今在台灣先發動專利訴訟，希望蘋果公司及其他各家手機大廠都能尊重鑫晶鑽的智慧財產權。
1029,2014/10/20,網家支付連 攜手騰訊財付通 搶攻兩岸跨境第三方支付,灣網路支付發展再創新頁，網家PChome集團()旗下Pay支付連與騰訊財付通，將於本周四(23)日宣布，共同打造第三方支付的整合串接合作，全力搶攻兩岸跨境第三方支付市場。支付連指出，隨著國內第三方支付以進入立法院1讀，台灣網路支付發展進入新頁，PChome支付連除繼續在台灣市場提供完備的第三方支付服務，進一步帶動微型電子商務發展的強勁動能。支付連表示，為協助台灣商家前進大陸市場，首次與大陸超過2億人使用的騰訊第三方支付平台財付通攜手合作，透過兩岸第三方支付金流整合串接合作服務，搶攻兩岸跨境通航市場。
1030,2014/10/20,實威業績連3月成長 許泰源：要當兩岸3D軟硬體整合一哥,大中華區3D軟硬體整合代理商實威國際()9月營收達7535萬元，月增34.5%，月增54.9%，連續3個月營收持續成長，總經理許泰源表示，除站穩大中華市場外，今年為實威3D生活元年，全方位3D解決方案的提供者，打造是兩岸3D最大CAD/CAM系統整合顧問服務公司。實威成立17年來，除獨家代理達梭系統的3D設計軟體SOLIDWORKS解決方案外，更致力提供專業系統整合顧問服務。邁向2015年，並為實踐今年為公司3D生活元年，實威首要任務，就是如何採用最新的3D技術幫助產業轉型升級，並增加產業的附加價值，作為全方位3D解決方案的提供者。許泰源指出，透過達梭系統的SOLIDWORKS解決方案以及3D Systems的3D列印軟硬體設備，從產品/工業設計、分析驗證、3D列印、3D掃描、製造等步驟，提供客戶全方位的3D顧問服務，為企業量身打造最符合需求的解決方案，幫助其在競爭激烈的年代逆勢成長。許泰源進一步指出，公司提供的是一套完整的解決方案，從產品設計開始，到精準的驗證分析、產品發佈及管理、3D列印打樣以及生產製造等皆全面顧及，加上客制化的顧問服務，可以為企業提供一條龍的完整售前及售後服務，藉由軟、硬體產品線的完備，可提供製造業全方位的解決方案，更能縮短研發時間及成本花費。
1031,2014/10/20,永豐期貨台指選擇權盤後－美股大漲 台股跟進強彈百餘點,◆盤勢分析期貨走勢週一上漲162點收在8661點。價差方面，逆價差縮至2.14點，電子期轉為正價差0.17點，金融期逆價差縮至1.64點，摩台期轉為正價差0.57點。由籌碼面來觀察，三大法人於現貨市場轉為買超37.63億元；而在淨部位方面，三大法人空單減碼5750口，淨空單降至14513口，其中外資空單減碼6417口，淨空單降至13010口，自營則是空單加碼987口，淨空單升至2948口；另外十大交易人中的特定法人，全月份空單減碼3686口，淨空單降至15564口，整體來看，法人與大額交易人對台股後市仍持偏空看法，但偏空力道有減弱跡象。行情走勢方面，受到美股大漲、亞股強彈的激勵，週一跳空開高百點，早盤指數回測8600點但未見明顯賣壓湧出後，多頭信心回升，積極的買盤陸續進場推升指數走高，盤面上以鴻海帶動蘋概股反攻為要角，金融股回穩與傳產食品股跌深反彈亦扮演好綠葉推升指數衝高，終場就以大漲的紅K作收。由技術面觀察，週一大盤開高走高，收盤站上5日均線，化解短線再破底危機，惟成交量能不足800億是為隱憂，短線多頭若想更近一步奪回失地，則需加強火力持續增量才行，否則不排除仍有拉回再測試8600點，甚至8500點支撐的可能性，因此操作上建議以減倉觀望為佳。選擇權分析選擇權從成交量來觀察，11月份買權集中在8900點，賣權集中在8300點。未平倉量部份，買權大量區集中在9000點，而賣權大量區則在8200-8300點。全月份未平倉量put/call ratio值持平由0.87升至0.92，持續小於1反應選擇權籌碼面仍為偏空。11月買權平均隱含波動率由14.13%降至12.53%，賣權平均隱含波動率由17.78%降至15.97%，在盤勢仍處偏空格局背景下，操作上建議逢反彈以賣權空頭價差策略因應。近期上市的台灣50、寶滬深與FB上証等三檔ETF期貨，以台灣50成交量308口為最活絡商品。
1032,2014/10/20,日盛投顧盤後－短線反彈  強度視量,◆盤勢分析1.國際股市強彈，激勵週一台股開高走高，各類股皆有表現，盤面強勢主軸集中於跌深族群，例如食品、塑化、紡織、化學、汽車、觀光、中概、金融，以及部份稍佔權值的電子股，終場指數大漲150.26點，漲幅1.77%，收在8663.14，成交金額萎縮至782億元。2.觀察台股技術面，經過上週四、上週五大幅震盪後，週一開高走高收紅K棒，惟量能較上週五大幅萎縮，量能沒有放大前，指數恐將持續於8500附近震盪嚐試築底，5日均線沒有正式擴量突破前，指數於8500附近反覆震盪整理的格局不變；若能擴量突破5日均線，或有機會展開跌深反彈，上檔較大壓力區將落在年線8860附近，惟成交量必須趨勢性回溫，否則反彈空間有限。3.觀察台股籌碼面，外資+25.18億元、投信+2.60億元、自營商+9.84億元，三大法人合計買超37.62億元，外資終於結束連續賣超，期貨淨空亦回補6177口，淨空水位13010口，外資期現貨終於不再續空，將有助於盤勢的止穩。跌深反彈  長期均線有撐的權值股較值得留意1.觀察台股盤面結構，電子+1.86%、金融+1.84%、非金電+1.58%，最弱勢的食品出現強彈，短線跌深的塑化、紡織、觀光、金融亦有表現，顯然短期盤面結構的主軸在跌深反彈，由於集中市場上漲1.77%、OTC僅僅上漲1.18%，顯然權值股相對有撐，中小型股壓力相對沈重，因此多頭架構不變的強勢股持續值得留意外，長期均線附近有撐的中大型個股，操作上亦值得留意。
1033,2014/10/20,受美股激勵　台股收盤大漲150點,美股上週五強勁反彈，成功化解台股破底危機，大盤一早以跳空百點的姿態開出，隨後在高檔震盪。電子權值股扮演反彈急先鋒，以鴻海飆漲超過4%最受矚目。金融股也點火上攻，就連最弱勢的食品類股也上演跌深反彈，類股漲幅直逼6%。大盤終場上漲150點，收在8663點，成交量780億元。不過，針對今天的漲勢，市場解讀為跌深反彈，短線持續受美股以及外資動向影響。（張佳琪報導）美股週五強勁反彈，帶動台股止跌回升，早盤電子權值股一馬當先開高，其中，蘋果供應鏈族群受到iPhone6在中國市場銷售傳佳音激勵，表現最是活躍。指標股鴻海受買單青睞漲幅逐步擴大超過4%，台積電也有2%漲幅，抵銷大立光盤中翻黑的壓力。金融股由大型金控股發動攻勢，類股漲幅接近2%。傳產股聚焦食品類股，味全、卜蜂、統一等多檔個股收漲停板，食品類股狂飆5.5%。大盤終場收高漲150點，以8663點作收。第一金投信投資經理謝杰良表示，大盤的大漲應該以跌深反彈看待。謝杰良說：「因美股上週五也跌深反彈，所以目前來看只能把台股當跌深反彈，還不能看回升」。收盤量不到八百億，正是反應市場對於行情的謹慎心情，後市持續觀察美股表現與外資的操作動向。（圖：證交所提供）
1034,2014/10/20,彰銀董監戰提前開打 財長：有信心贏,彰銀明天(21日)召開董事會，討論12月8號臨時股東會改選相關事宜，由於涉及董監席次結構重組，財政部嚴陣以待，財政部長張盛和表示，公股「有信心贏」。（黃悅嬌報導）配合金管會政策，彰銀本次董事會議程將討論審計委員會設置辦法，最大股東台新金藉機提前進行權力布局。台新金主張在現有九席董事中，設五席一般董事、四席獨董；一般董事的分配，台新三席、公股兩席，獨立董事則各拿兩席，第二大股東財政部堅決反對，擔心台新再推彰銀整併案。財政部長張盛和指出，依據公司法，審計委員會過半將可掌握議程，台新金若在審計委員會占有兩席獨董，公股將無法制衡，如果是設置三席獨董，財政部占兩席，台新金一席，財政部可以同意。但與台新金幾次溝通雙方沒有共識。面對彰銀董監事改選戰恐提前開打，張盛和說，泛公股也準備了半年，有信心可以挺得住。『因為獨董二二，根據公司法規定，只要有兩席以上支持就過了，所以我們兩席完全沒有制衡力量。（我們會贏嗎？）有信心贏。』張盛和表示，21號彰銀董事會開會結果若不如預期，那就「各自努力」，他們很努力。財政部也布局了半年，有信心可以挺得住，至少可以保住總經理。（資料照片）
1035,2014/10/20,停工十個月    日月光K7廠近期可能復工,因為廢水污染後勁溪，日月光高雄K7廠從去年(2013)12月20日，被高市環保局勒令停工至今，已經十個月。日月光K7廠的「復工申請」，目前是在二次審查中，高市環保局表示，有可能在下個月讓日月光K7廠復工。(林憲源報導)日月光在2013年10月1日污水排入後勁溪，高雄市環保局認為日月光長期如此，環保局計算日月光在2013年一月到九月短少製程污泥4106噸，認為是以廢水形式排入後勁溪，省下的廢水處理費用就是不當利得，連同罰款，一共裁罰日月光一億零九百多萬元，日月光在2014年1月繳清。但對於日月光更嚴重的處分是K7廠停工，K7廠每月營收二十多億元，從2013年12月20日以來，已經被勒令停工十個月。日月光在被停工後不久就提出「復工申請」，負責審查的專家學者認為「試車計畫內容稍嫌簡略」，今年二月間結論不允通過，日月光公司於是重新檢討提出改善計畫，目前由環保局外聘的專家學者進行第二度審查。高雄市環保局表示，依據審查程序，可能會在11月讓日月光復工。
1036,2014/10/20,亞股再淪外資提款機 上周韓股失血10億美元 台股遭賣8億美元,全球經濟成長動能持續疲弱，通縮陰影揮之不去，加上伊波拉病毒來勢洶洶，亞股上周再次淪為外資提款機，資金已連續2周大幅流出南韓，韓股上周再遭賣超10.93億美元；同樣以出口為主的台股上周亦遭外資賣超求現，外資賣超金額8.88億美元，導致台股全年累計買超跌出百億美元之外，全年漲幅由正轉負。不過即使外資不給力，還是有不少股市力爭上游，像是印尼已遭外資連續6周賣超，但股市卻連續2周以小漲作收，顯示當地內資於國際多空紛擾之際，持續進場撐盤的決心。摩根亞太入息基金經理人羅傑瑞(Jeffrey Roskell)表示，全球景氣復甦力道呈現疲軟，區通縮風險升溫，市場擔憂歐債風暴再起，加上伊波拉疫情拉警報、中東地緣政治風險干擾，各項利空衝擊，造成全球資金上周恐慌性流竄，國際資金擴大對亞股賣超，也使得主要亞股近期表現震盪。景氣復甦趨勢不變，然隨國際利空紛沓，亞股表現隨之劇烈起伏，也使得投資人無所適從，羅傑瑞建議，投資人可以亞太收益型產品，在震盪之際，多元布局包括亞太高息股、亞債及REITs等收益型標的，由於該類標的具有穩定孳息收益，特別是亞太地區的收益率更是相較其他地區為高，是投資人在降低波動風險的前提下，參與亞洲成長契機的最佳選擇。摩根東協基金經理人黃寶麗(Pauline Ng)表示，儘管近期主要亞股遭到全球10月股災拖累，上周資金呈現淨流出，但相對於出口導向的東北亞國家的災情慘重，東協國家股市的整體表向相對抗跌，尤其是印尼去年出口占GDP比例約3成左右，因此外需市場經濟表現疲軟產生的負面衝擊影響相對較低。由於印尼總統當選人佐科威(Jokowi)過去在擔任雅加達省長期間便累積良好的親商改革紀錄，市場預期改革派佐科威(Jokowi)本周(20)正式就職後將開始大力推動選前承諾的經濟改革，包括減少燃油補助、推動基礎建設計畫、提高石油與天然氣生產，以減低能源進口與財政赤字壓力，深化印尼長線改革契機。黃寶麗認為，印尼媒體、基礎建設等相關族群皆具有長期投資題材，加上亞洲企業獲利開始止穩並有機會上修，投資人可以逢回布局。不過，考慮近期市場不確定性因素都較高，加上東協各國結構改革或企業獲利都有待時間改善，建議投資人布局以區域型基金來參與東協中長線改革之商機。
1037,2014/10/20,日月光：尊重司法判決,日月光污染後勁溪案宣判，日月光公司也發出聲明表示：尊重司法判決，將等收到判決書後再與律師研究後續事宜 。日月光聲明表示：對於日月光K7廠之偶發事件，公司已建立完善之預防、預警、及應變機制，對於四位被判處有罪的公司員工，將在合法及關懷的立場上，就後續的法律程序給予必要協助。
1038,2014/10/20,復航線上旅展開跑！三大熱門航點促銷 飛澳門機票便宜逾2成,看準旅展前各大業者拚促銷，復航(6702-TW)今(20)日宣布，即日起線上旅展即日開跑，至11月16日止針對最受國人喜愛的大阪、曼谷和澳門國際3大航點，祭出優惠機票，桃園澳門航線折扣達74折僅5300元，桃園曼谷航線優惠價7600元，而賞楓首選的桃園大阪航線只要8000元(以上價格均為未稅，來回經濟艙，14天票期)。復興航空集團旗下龍騰旅行社也同步推出淘樂假期機加酒自由選專案，提供消費者更多元豐富的出遊選項，所有行程和需求皆可自由搭配，包括機票、住宿、線上租車、保險以及旅行中需要用的無線上網wifi等均可一站購足，最適合自主性高的自由行旅客，即便是1人也能成行。為加碼回饋支持旅客，復航表示，於10月31日前購買淘樂自由選產品的旅客，周周都將抽出1位幸運得主獨得澳門免費來回經濟艙機票1張，若未中獎，將可繼續參與下周抽獎，最後1周再加碼抽2位得主，各得東京等熱門航點飯店住宿券1張。另外，復行指出，凡於線上旅展期間，由復興航空官網通路購買台灣始發的國際航線，且付款成功的前500名旅客消費者，將有機會獲贈成交禮，收納包、行李吊牌和束口袋中隨機擇1贈送，而購票付款成功即可參加雙人曼谷機票抽獎，每組訂位代號可享1次抽獎機會，活動期間將抽出5組幸運得主。
