,date,title,content
0,2014/11/01,搶興櫃末班車 10月衝上12家 凌昇、互動、瑞寶下周登板,搶年底興櫃末班車！9月登錄家數今年首度破10家後，10月登錄家數更達12家後，創下今年單月最多，緊接著11月首周將有3家新兵登板，包含太陽能矽材料及導電漿凌昇能源(6490-TW)、專營電信寬頻網路的互動國際數位()、動物疫苗的瑞寶基因(6479-TW)。凌昇將於6日以28元登錄興櫃，主辦券商國票證券，公司自有品牌SL系列，在價格優勢推升下，成功打進國內外太陽能矽原料供應市場，SL系列高階產品現已得到世界各大單晶製造廠認證，成為高規格單晶級矽原料，並發揮「資源再利用」概念，今年生產的矽原料突破2000噸，居全球之冠；同時自國外引進新技術，推出新產品銀漿，年底正式量產，搶攻太陽能下游電池片廠市場。凌昇目前股本2.34億元，今年前三季營收5.56億元，毛利率8.19%，稅後淨利2640萬元，每股盈餘1.21元。互動則選擇7日以每股56元登錄興櫃，主辦券商富邦證券，公司成立於2003年，為跨足電信暨寬頻網路、無線傳輸、數位媒體、雲端資訊及地理資訊系統整合廠商，主要客戶為國內電信固網業者、媒體廣播業者、民間企業、學術與政府部門等，主要銷售模式為結合國際網路暨電信大廠軟硬體及專業技術，整合開發應用平台，提供完整的解決方案，系統整合規劃、咨詢與售後維護服務。同時推出地理資訊系統(GIS)業務。互動目前股本4.2億元，近幾年營運相當不錯，連續3年每股盈餘都超過3元，去年更達4.07元，今年前三季營收為11.61億元，毛利率為39.08%，稅後淨利6851萬元，每股盈餘1.63元。瑞寶為生寶集團旗下子公司，同樣在7日以每股71元登興櫃，主辦券商凱基證券，公司專營動物疫苗研發生產，主要產品為「寬活豬生殖與呼吸道綜合症次單位(豬藍耳病)疫苗PRRSFREE」，2012年4月取得台灣地區動物用藥製造許可證及自由販售證明，為公司目前主要營收來源。目前除積極辦理國外藥證申請外，持續開發豬隻相關新產品，同時跨足寵物市場。
1,2014/11/01,熱門股—台壽保 不動產利益將入帳 股價挑戰月線,台灣人壽(2833-TW)前3季稅後獲利達19.88億元，成長103%，不動產利益預計第4季入帳，RBC可以拚上250%；基本面加持下，外資周五(31日)終於反手買超，拉抬台壽保股價上漲近3%、收在18.15元，一口氣站上5日線、10日線連過2關，下周將挑戰月線。台壽保第3季衝高至15億元以上，主要是有10億元的現金股息進帳，加上投資操作得宜，前3季單季稅後盈餘達19.88億元，每股稅後盈餘2.05元。台壽保出售大台北地區不動產，位於台北市中正區館前路8號10~11F及B2F車位，交易金額3.74億元，處分利益2.59億元，預計今年第4季完成入帳，可望充實資本，RBC可望提高到250%。
2,2014/11/01,熱門股—台虹 反彈攻擊量能浮現 收復季線在望,軟板上游基材軟性銅箔基板(FCCL)及太陽能電池背板廠台虹科技()10月31日爆出7865張的成交大量攻上漲停價45元，本周上漲幅度為6.51%，除成交量能跨越5日、10日、及月均量之外並成功站上短期均線，呈現在股價低檔區價量齊揚的強力反彈格局。台虹科技正式公布2014年第3季的財報，單季稅後盈餘2.9億元，創4個季度新高，單季每股稅後盈餘1.42元；累計今年1-3季稅後盈餘6.99億元，每股稅後盈餘為3.42元。同時，台虹科技也獲買回庫藏股的加持，台虹科技目前正處於執行買回庫藏股期間，台虹科技自10月16日起兩個月內，進場買回3000張庫藏股，將用於轉讓給員工。而在2014年的第4季進入市場需求走淡同時，台虹預估第4季營收在26億元，將較上季下滑6.2%，較去年同期下滑6.4%，而第4季毛利率則預估在22%上下兩個百分點。
3,2014/11/01,熱門股—致伸 內資自救外資回頭 單周強彈17%！,致伸()自9月以來，股價自44.35元打到低檔30.25元，跌幅高達31%，不過本周隨內資法人展開「自救」，外資也終於回補，帶動致伸展開強勁反彈走勢，致伸本周收盤價37元，單周漲幅高達17%，一吐悶氣！致伸第3季合併營收136.2億元，因第2季淡季不淡基期墊高，季增0.2%，但單季營收仍續創2012年掛牌上市以來新高，且對於第4季業績展望，預估將可維持高檔，除了音響產品外，相機鏡頭模組客戶端拉貨力道強勁，包括蘋果、大陸品牌手機，拉貨量可望持續成長。對於致伸下半年的獲利表現，法人也預估將可優於上半年。本周致伸「強彈」火種，是由內資法人自救點燃，投信、自營商本周聯手買超逾1萬張，周五外資終於也見到「回頭」，單日大手筆買超7000多張。
4,2014/11/01,熱門股—東陽 股價創波段低後 法人悄轉買 日買超量創3個月新高,汽車零組件大廠東陽()日前周線連8黑，股價更創下1年半來低點，相當弱勢，不過，下周起進入密集公布第3季財報的時點，三大法人本周五單日買超東陽超過1千張，創7月底以來單日新高，可能是法人看好其第3季財報的匯兌利益，已事先布局所致。東陽9月可望有3000萬元的匯兌利益進帳，推升自結單月合併稅前盈餘衝上1.18億元、年增9%，而進入第4季後，除了美元走強態勢不變，且適逢AM市場旺季，下半年整體獲利轉趨樂觀，吸引法人有意逢低布局。東陽強調，傳統旺季來臨，目前看來可維持旺季應有水準，產能已備齊將全力爭取訂單；另一方面，大陸轉投資18座生產基地已全數運轉，在車市穩定成長的態勢下，將更加積極爭取車廠訂單。法人指出，東陽第4季進入傳統營運旺季，同時，佛山和東陽2大新廠開始正式量產，在AM業務和中國OEM車市皆進入傳統旺季下，毛利率有望隨著稼動率提升而提高。
5,2014/11/01,熱門股—友達 外資近5天大買18萬張 蓄勢挑戰前高,友達()第3季業績表現亮眼，單季稅後淨利為73億元，創17季新高，基本每股盈餘為0.76元，累計前3季每股盈餘1.21元，第4季產能利用率逾9成，對明年需求維持樂觀；外資近5個交易日持續大買逾18萬張，周五單日買超61899張，股價以14.4元收盤，漲幅3.23%，站穩在各均線之上，蓄勢挑戰前波高點。友達公布自行結算2014年第3季財務報表，合併營業額1068.9億元，較第2季增加4.7%，稅後淨利為73億元，其中歸屬於母公司業主淨利為73.3億元，基本每股盈餘為0.76元。友達第3季營業毛利為153.8億元，毛利率14.4%；營業淨利87.8億元，營業淨利率為8.2%；EBITDA獲利率為21.2%；第3季大尺寸出貨量約達2948萬片，較第2季增加2.2%；第3季中小尺寸出貨量約4823萬片，較第2季成長4.2%。友達表示，合計2014年前3季合併營業額為3027.3億元，前3季合併稅後淨利為114.9億元，前3季基本每股盈餘為1.21元。展望第4季，友達表示，在產品組合上將與第3季有略微不同，預估大尺寸出貨量持平，平均銷售單價下滑1-3%，中小尺寸無法滿足部分客戶訂單，但在歲修及為明年新產品預做準備等因素影響，將會適當進行調整，預期整體產能利用率出現下降，但仍會超過9成。友達指出，由於電視尺寸朝向大型化方向發展，加上歐美、中國市場換機潮，另外，智慧型手機及筆記型電腦需求成長，明年市場需求審慎樂觀。友達近期股價由11.65元附近直往上攻，短線漲幅逾23%，股價攻上短期各均線之上，統計外資連續5個交易日大買，大有挑戰前波15.25元高點的氣勢。
6,2014/11/01,熱門股—F-艾美「雙11」打世界盃 電商出貨倍增 股價回神,中國小家電領導品牌艾美特(F-艾美)()在「雙11」宣布打世界盃，市場估計單日銷售金額將會爆表，艾美電商業務將會倍數成長，激勵周五股價低檔回神，大漲超過5%，來到34.85元，站上5日線。目前F-艾美中國電商市場淘寶天貓、京東商城、蘇寧易購、易迅和亞馬遜5個平台，並持續增加其他網上銷售平台，採取多元平台發展，上半年營收比重已達23%，隨著「雙11光棍購物節」全球化帶動下，11月電商業績可望較上月倍數成長，估計今年營收佔比達3成以上。F-艾美下半年重點將放在電暖器消化庫存，並積極調整經銷商銷售策略與投入電子商務活動，加上夏季經銷商已開始銷售非庫存電風扇，營運逐步回溫，法人估計第三季獲利將比第二季好，單季每股盈餘將挑戰1元。F-艾美江西九江新廠，佔地40萬平方米，是深圳廠的近3倍大，已正式投產，目前籌備進展順利，新廠效益將有效降低人工，倉儲與運輸費用，第四季開始就會成效出來，獲利能力將進一步提升。
7,2014/11/01,熱門股—南港舊廠案明年首季拿建照 股價攻上季線 週漲10%,老牌資產股南港輪胎()最受矚目的南港舊廠開發案，獲得階段性突破、通過台北市政府審議，加快開發時程，最快明(2015)年首季可取得建照。股價昨(31)日開盤之後跳空以33.3元漲停，一舉收復季線，累計周漲10.82%。南港舊廠開發案的基地約9457坪，總樓地板面積約 6.8萬坪，將採賣場(4%)、商辦(60%)、住宅(30%)、自用(6%)的綜合開發方向規劃。基地週邊的條件看好，包括南港軟體園區、南港展覽館、南港捷運站、展覽館站、中信總部大樓等。但開發案卡在都市審查階段、延宕多年，經過南港輪胎修正、補件之後，果然推快審議加速，10月30日公告開發案已經經過台北市政府都市設計審議委員會審查後「原則」通過，不用再提會討論。如此一來，南港舊廠開發案最快可望於明年首季取得建照，並將開始預售住宅建案。根據法人估計，南港案在完工銷售之後，將可為南港集團帶來超過100億元的進帳收益。股價昨(31)日開盤之後跳空以33.3元漲停，一舉收復月線、更跳空攻上季線，累計週漲10.82%。
8,2014/11/01,熱門股—辛耘Q4營收續成長 再生晶元產能滿載至明年中,辛耘許明棋認為半導體市場情況良好，對明年第一季也有信心。(鉅亨網記者許庭瑜攝)半導體設備廠辛耘日前舉辦法說會，總經理許明棋表示，第三季獲利較第二季大幅成長1.4倍，與去年同期相當，而第四季也將優於第三季，但是成長幅度還在估計中。且在辛耘3大產能中，再生晶片這塊接單相當暢旺，產能持續滿載，預估將可望維持到明年第二季。辛耘第三季營業收入為6.8億，毛利率42%近年最高，淨利稅後來7700萬，EPS達0.96元，較上一季成長144%，與去年同期相同。不過受到第一季、第二季營收不佳影響，今年前3季EPS表現則是落後去年同期，雖然第四季可望較Q3成長，但全年獲利是否能超越2013年，則還要觀望。在自製設備的部分，包括單晶圓濕製程設備與批次濕製程設備，今年總共出貨超過10台，且部分機台已陸續認列，雖然第三季有遞延的情況，但預估第四季或者第一季將可望進帳。許明棋指出，除了台灣的客戶外，現在也積極布局歐美，東南亞等國家。同時許明棋看好後段先進封裝設備的需求，認為當前段新蓋的12吋廠，20、28奈米都一定會用到先進封裝製成，才能達到輕薄短小，傳輸速率快的需求，所以一定要用先進製成做後段封裝；再加上IOT(物連網)的發展，因此看好後段先進發展速度快於前段市場的成長，並預估這會是半導體未來幾年發展最快的市場。
9,2014/11/01,〈觀察〉PCB產業復甦 HDI板將成台商在全球舞台決戰主戰場,2014第2季之後的全球PCB產業復甦態勢確立，而在全球PCB產值居龍頭地位的台商PCB廠也明顯受惠，在全球3C電子產品設計趨勢及PCB產業生產向亞洲地區集中的走勢下，具有高度資金、技術門檻的高階HDI板將成台商PCB在全球市場決戰的主戰場。在全球高密度連接板(HDI)居龍頭地位的日本大廠Ibiden因馬來西亞工廠良率不佳等因素，原定於9月起產能利用率達滿載的目標並未實現，也因此調降其財測；韓廠三星電機也沒有太好的表現；目前台商PCB廠主要生產HDI廠商包括欣興()、華通()及燿華()、健鼎科技()等，則有積極擴張產能接收市場需求的動作。華通客戶除美商蘋果公司之外，也已打入小米等中國品牌供應鍵，同時，華通針對中高階HDI板需求增加，2014年的資本支出將大幅提升到25億元，隨產能增加下，營運規模再放大，推升業績成長；而華通2015年則依照市場需求，擴充產能往高階HDI移動，預估明年資本支出20億元起跳。華通在重慶涪陵新廠以HDI為主，其第一階段的的設廠完經完成，10月則將會有營收開始貢獻，這一部分在2014年讓華通投資了高達15億元資金，而在市場對於HDI板的需求驅動之下，華通在2015年主要仍在於投資擴充中高階的HDI製程為主，加上對於重慶涪陵廠的再擴充，預估2015年的資本支出將由20億元起跳。華通目前在台灣的桃園、廣東的惠州及重慶的涪陵都設立有HDI生產線，而在明年的擴充重點，華通也在市場對於中高階HDI需求將明顯攀升的預估之下，對於廣東惠州廠將大力投資由現有的一般HDI板提升到進一步生產Anylayer HDI的製程。而就近期的華通營運來看，美商蘋果iPhone 6新產品被視為啟動蘋果營運「超級循環」的劃時代產品，而事實也證明其在歐美市場9月19日的正式推出上市後，已引爆「果粉」們搶購的狂潮，而屬美商蘋果公司PCB供應鏈的華通，在2014年8月營收以29.68億元改寫今年新高，而華通9月的營收以32.45刷新去年11月所創下的30.2億元歷史新高紀錄。而依照華通在9月的出貨熱烈狀況，其營收盛況並將進一步擴大到第4季。而這僅僅是華通在HDI Any Layer產品因蘋果iPhone 6大量組裝需求而提前引爆的營收熱況，同時，蘋果iPhone 6手機在市場熱銷之下，又有追加生產1000萬支的有利新狀況出現，也顯示高階HDI板市場將趨熱。HDI製程產能居台商PCB廠之冠的欣興電子也迎合市場的趨勢大幅投資100億元以上在擴充HDI高階製程產能，其獲利也有明顯的成長；欣興電子2014年第3季也在市場大量需求浮現之下，2014年第3季獲利大幅向上，單季稅後盈餘4.24億元，季增率高達67.59%，年增4.43%，創5季新高，欣興電子2014年1-3季營收451.24億元，毛利率10.01%，稅後盈餘7.64億元，每股稅後盈餘0.5元。
10,2014/11/01,大中華區首檔上市！ 元大寶來槓桿及反向ETF掛牌,台灣ETF市場發展邁入嶄新的里程碑，領先大中華區產品創新，推出首檔槓桿及反向ETF，元大寶來ETF傘型基金之元大寶來台灣50單日正向2倍ETF()，以及元大寶來台灣50單日反向1倍ETF()，兩檔ETF掛牌上市價格均為19.99元，台灣集中交易市場ETF掛牌檔數增加至22檔。元大寶來投信董事長林武田表示，全球ETF在金融海嘯後領先共同基金規模創下新高，ETF已成為投資者在資產配置上不可或缺的元件之一；該公司於2003年發行國內第一檔ETF--台灣卓越50ETF()，是國內連結台股指數規模最大ETF，另於2009年發行國內首檔連結A股ETF--標智滬深300ETF()，也是國內連結A股相關ETF中規模最大，兩檔ETF分別為國內ETF市場中連結台股、陸股最具指標與代表性的產品。林武田表示，元大寶來投信是台灣資產管理業者率先將「被動式管理」概念引進台灣的投信公司，若加計新發行的槓桿及反向ETF，ETF產品線達13檔之多，而公司不僅多年來積極持續向主管機關爭取引進槓桿及反向ETF商品發行，且早於2011年即提出新型態ETF之規劃發展相關論文，持續帶領市場參與ETF主流新趨勢。林武田指出，依照韓國經驗，預料國內券商亦可受惠於槓桿及反向ETF的上市後創造活絡交易量，甚至提升市占率，台灣ETF市場成交量占比可望逐年倍數成長。元大寶來投信總經理劉宗聖表示，放眼大中華市場，兩岸三地ETF百花齊放，近年來中港台三地ETF急速發展，在監管機關的開放下，大中華市場ETF成為國際投資焦點，而元大寶來投信的指數化產品不斷精進，今年率先推出大中華區首檔槓桿及反向ETF，也即將推出期信ETF。劉宗聖表示，元大寶來投信引領業界將指數投資再進化，透過前中後台全心投入，包括前台的全力聚焦ETF資產管理、強化基金追蹤績效；中台的嚴謹控制基金風險、維護基金投資人權益；以及後台的完善申贖流程架構、提供初級市場作業流暢，未來將會以海外市場以及不同的資產類別做為推進的原創力，以期更加深化ETF的堅強管理實力。在未來發展導向規劃上，劉宗聖表示，未來亦將積極規劃兩岸三地產品，除與大陸相關指數做為下一檔槓桿/反向ETF的追蹤指數外，透過元大金控資源之整合，該類產品發行經驗亦可運用於香港、大陸、泰國、韓國等，另外，大陸華潤元大基金管理公司也持續推出新產品。
11,2014/11/01,台灣主要報紙頭條要聞,彰化檢方昨證實，外洩的衛福部公文一度影響案件偵辦。檢方曾訊問頂新屏東廠長曾啟明，曾供認九日晚上接到屏東縣衛生局傳真，立即回傳總公司，總公司再傳給味全，員工奉命假日加班銷毀、藏匿文件。財政部昨（31）日邀集9大公股銀行總經理開會，財政部長張盛和直指，頂新集團黑心油品事件已「跨越紅線」，嚴重傷害國民健康及國家形象，且考量公股銀行對頂新集團的授信風險大幅增加，當場指示「要全面緊縮銀根」，年底前將收回105億元。費鴻泰︰曹啟鴻才是頂新門神見獵心喜 綠營政客嘴臉現形8大廠曾買黑心油 去向不明15檔大戶歸隊 發飆年底前抽回頂新105億銀根第3季經濟成長 3.78％ 超預期無心？有意？屏縣外洩公文 頂新早知要查廠餿、黑、混、怒… 2014年代表字票選  中華民國友邦布吉納法索「萬年總統」下台日銀意外擴大寬鬆…貶破112 全球股市飆急貶 觀光、汽車、面板股受惠4G吃到飽 電信三雄延長優惠包庇噁油 內鬼是屏縣府5官下台沒學乖「屏縣府餿了」雙子星案 賴素如重判10年QE傷增長陸加碼救市QE退場亞幣競貶 陸加碼穩經濟日與美對做 擴大寬鬆促貶
12,2014/11/01,ABAC行前記者會   台灣必須加入區域經濟整合,「APEC企業諮詢委員會(ABAC)年度大會」將在11月舉行，我國代表之一的「聯華神通集團」董事長苗豐強，今天在行前記者會中表示，台灣「有必要」加入區域經濟整合，不過，相關協議仍未通過，傷害許多中小企業。（馮建棨報導）亞太經合會議(APEC)即將在下周於北京舉行，其中我國政治與經濟界領袖也會參加，其中「APEC企業諮詢委員會」(ABAC)及「APEC企業領袖高峰會」都是會議亮點。而我國ABAC代表團長將由國泰金控董事長蔡宏圖擔任，另外團員中，有聯華神通董事長苗豐強與宏達電董事長王雪紅。據了解，今年APEC主題為「建構亞太社區，擘畫長期繁榮」，而ABAC提呈APEC領袖的建言書中，呼籲APEC各經濟體在推行貿易自由化的同時，也應防範「金融危機」、「主權危機」及「保護主義」興起。而周五ABAC行前記者會，聯華神通集團董事長苗豐強就指出，台灣有加入區域經濟整合的必要性，但必須先做好檢視工作，不只公部門要逐一清查各種項目，企業也不能墨守成規，必須做好準備。苗豐強:『每個經濟體都是希望跟其他經濟體有更好的結果，企業界也應該看一下什麼東西不應該墨守成規、保持在非常閉關自守的情況。經濟模式在改變，如果我們不開放的話，其實傷害到滿多中小企業。』外界猜測中國大陸跟韓國可能在APEC期間簽署FTA協議，對此苗豐強表示，中韓簽署FTA，對台灣中小企業將有很大的傷害。但對台灣來說，不跟中國簽相關協議，會讓我們失去在東南亞競爭力。（圖:馮建棨攝）
13,2014/10/31,宏達電看好中國、印度Q4成長 明年自有品牌平板不缺席,宏達電與Google合作推出Nexus 9。(圖：宏達電提供)宏達電()今(31)日召開法說會，公布第4季財測營收持續成長，全球業務銷售總經理暨財務長張嘉臨指出，智慧手機出貨將比第3季更好，中國及印度也是持續成長；另外，在平板市場領域上，除了與Google的合作之外，也考慮推出自有品牌，希望2015年在平板市場「有所著墨、不缺席」。張嘉臨表示，第4季智慧手機產品出貨持續成長，除將比第3季出貨高之外，也比去年同期成長，主要是來印度、美國、印尼、中國的市場帶動；今年第4季包括中國及新興市場的印度都將較第3季成長。他說，印度市場自第2季起逐季成長至第4季，主要以3G、4G手機混合出貨居多，中國市場競爭激烈，未來計畫推出行銷活動促銷，目標希望第4季較第3季出貨增加2-3成。在第4季的營收表現上，宏達電表示，10月營收可能較9月下滑，但11月則比9月好，12月耶誕節旺季可望登上高峰，根據宏達電財測，第4季營收預期第4季營業收入約430-470億元間，較第2季成長2.63-12.17%。張嘉臨說，RE目前開始少量出貨，主要是鎖定特定消費市場及族群，目前還沒辦法針對市占目標提供數字，但是市場潛力看好，他預期，非智慧手機出貨可望在12月銷售旺季中轉強，未來宏達電將再推出其他非智慧手機及非平板的產品。宏達電與Google合作推出Nexus 9，預購傳來好消息，因此出現不少追單，張嘉臨表示，不會幫別人代工產品，但會考慮共同品牌產品，跟Google合作的Nexus 9就是這樣合作模式；至於自有品牌平板部分，張嘉臨坦言會進入，目前還在考慮時間點，希望2015年在平板市場「有所著墨、不缺席」。
14,2014/10/31,財部「新五點」金融限縮裁制 頂新：竭力調度資金,頂新的劣質油風暴擴大，財政部今天就邀集9大公股銀行總經理開會，並對頂新集團授信達成契約到期不續借、調高利率等5大「緊縮銀根」共識，針對財政部的此一「新五點」授信指示，頂新集團回應指出，政府的決定，企業只能承受，頂新將竭力安排資金調度。頂新集團並強調，頂新集團會盡一切力量確保無辜的員工及家庭生計，不至於受到嚴重影響。由於頂新集團在台銷售劣質油品引起風暴，政府行政部門及司法單位已深入追查，行政部門並祭出各項措施制裁頂新集團，包括先前對於由頂新集團持股37%的台北地標台北金融大樓(台北101)，由頂新出任副董事長及總經理職務的魏應交請辭，而彰化地檢署也對於前頂新製油及味全()的魏應充求刑30年。而今天財政再度祭出以對頂新集團契約到期不續借、調高利率等5大緊縮銀根措施，進一步限縮頂新集團資金的融貸。頂新集團則對此表示既然是政府的決定，企業只能承受，而頂新將竭力安排資金調度。
15,2014/10/31,傳奇Q3EPS估1.28元 日韓遊戲上市 Q4營收挑戰新高,遊戲廠傳奇()第三季營收11億元，年增4成，法人估計單季稅後淨利將達1.13億元，每股盈餘1.28元，第四季日韓市場有遊戲上市，海外權利金再增加，單季營收可望再挑戰單季新高。傳奇9月受惠於可愛風格自製網遊新作《狩龍戰紀》在台火紅，及日系風格自製遊戲《幻想神域》持續帶動熱潮所帶動，營收1.59億元創下歷年單月新高，年增1.61%，月增13.85%；累計其前9月營收為11億元，年增4成，其中遊戲點數收入1.13億元，較8月成長3成。法人表示，第三季受到新遊戲《狩龍戰紀》上市，廣告投放增加，營業費用方面，較上季增加約5000萬元，但7月在中國推出《幻想神域》權利金挹注，因此營業費用率由66％降至57.2％，估計稅後淨利1.13億元，每股盈餘1.28元。進入第四季國內傳統營運淡季，但隨著日韓子公司新遊戲上市，包含《幻想神域》將授權韓國子公司「X-LEGEND KOREA」11月上市；《狩龍戰紀》則在日本正式推出，權利金可望再增加，單季營收將再挑戰新高。
