,date,title,content
912,2014/09/03,證交所邀請 裕隆集團裕融、江申等9/10舉行業績發表會,為使投資人了解國內上市公司營運績效，提升資訊流通及透明度，證交所將在9月10日舉辦上市公司業績發表會，本次邀請裕融()、江申()與嘉裕()等3家上市公司向投資大眾說明財務業務情形及對未來產業前景的看法。證交所指出，裕融企業營業項目為各式汽車分期付款買賣、租賃車、展示車買賣等業務；目前在新車分期付款，中古車貸款仲介及車輛租賃等汽車專業金融方面領先，且一直維持優良的資產品質及獲利，未來希望運用目前擁有的核心專長及人才，跨足台灣消費性金融領域，同時與裕隆集團共同進軍中國大陸，開拓中國大陸的汽車貸款市場；去年合併營收為141.78億元，較2012年度成長9.17%。江申深耕於汽車底盤、沖壓零組件、車架、大樑、木床後車身、模治具之銷售與研發，去年合併稅前淨利為3.64億元，較2012年成長4.31%。嘉裕營業項目為男仕西裝及各式成衣之製造與銷售，去年合併營收33.16億元，較2012年成長2.50%。
913,2014/09/03,F-再生：營運最壞狀況已過！今年營收目標2位數成長,F-再生()表示，營運最壞的狀況已經過去了！下半年為因應訂單的回流，重啟擴產，其中將擴產福建廠，新建江蘇廠，要把上半年所少的業績，要全力補回來，目標今年營收要有2位數成長。F-再生指出，福建廠將持續擴產，預計第三季第四車間完成後，陸續引進機台安裝，年底將達42台機組，其中4台規劃為新品試驗機，同時將砸下6億元，擴充137畝，面積將達12萬平方米，並依市場狀況，深加工產品產能持續擴充。至於江蘇新廠，F-再生指出，投資9千萬美元，產能設計30台機組，其中11台為1、2期工程，目前已完成10台組裝，並於6月投入試產，同時江蘇新廠將生產高毛利的新產品，包含減震隔音車輛應用、兒童用品地墊及健康保健醫療用品等，目前兒童用品地墊已通過歐美認證，將陸續打入IKEA等大型連鎖家居通路商，挹注新成長動能。F-再生強調，公司營運最壞的狀況已經過去了！隨著持續擴產，業績將逐步回到成長軌道，毛利將回到正常水位，下半年表現將會優於上半年，目標今年營收要有2位數成長。
914,2014/09/03,◆投信連續3日買超個股,投信連續3日買超個股1.投信連續買超3日的股票(2892)第一金、 (2327)國巨  、 (2330)台積電、 (3698)隆達  、 (6239)力成2.投信連續買超2日的股票　(2892)第一金、 (2327)國巨  、 (6239)力成  、 (2354)鴻準  、 (2330)台積電3.投信當日(03)買超的股票(2327)國巨  、 (2892)第一金、 (2634)漢翔  、 (2409)友達  、 (3698)隆達
915,2014/09/03,◆外資連續5日賣超個股,外資連續5日賣超個股1.外資連續賣超5日的股票(2303)聯電  、 (2384)勝華  、 (2356)英業達、 (2311)日月光、 (4904)遠傳2.外資連續賣超4日的股票(2356)英業達、 (2384)勝華  、 (4904)遠傳  、 (2311)日月光、 (2317)鴻海3.外資連續賣超3日的股票(4904)遠傳  、 (2317)鴻海  、 (3045)台灣大、 (2356)英業達、 (2311)日月光4.外資連續賣超2日的股票(4904)遠傳  、 (2356)英業達、 (2317)鴻海  、 (3045)台灣大、 (2384)勝華5.外資當日(03)賣超的股票(2356)英業達、 (2448)晶電  、 (4904)遠傳  、 (3045)台灣大、 (2311)日月光
916,2014/09/03,◆外資連續5日買超個股,外資連續5日買超個股1.外資連續買超5日的股票(3481)群創  、 (3474)華亞科、 (2409)友達  、 (3231)緯創  、 (2887)台新金2.外資連續買超4日的股票(3474)華亞科、 (3481)群創  、 (2892)第一金、 (2887)台新金、 (3231)緯創3.外資連續買超3日的股票(3474)華亞科、 (3481)群創  、 (2892)第一金、 (2887)台新金、 (3231)緯創4.外資連續買超2日的股票(2892)第一金、 (3481)群創  、 (2887)台新金、 (2409)友達  、 (2002)中鋼5.外資當日(03)買超的股票(2892)第一金、 (2887)台新金、 (3481)群創  、 (2409)友達  、 (2002)中鋼
917,2014/09/03,倫元投顧－國際資金開始撤出金融商品市場,◆盤勢分析昨天美國股市持續呈現狹幅盤整走勢，美國股市漲勢之所以減緩的最主要原因，應該在於等待週四聯準會將公布的褐皮書。由於市場普遍預期明年年中將調高利率，至於是否會如市場擔心的提前調高利率，市場也希望能夠從這一次公布的褐皮書中看出蛛絲馬跡。不過從技術面看，美國四大指數都已經出現回檔疑慮，又由於本波美股持續看回不回，無論市場情緒或是技術指標都已經緊繃到接近極限，只要出現任何利空消息或謠言，很可能就會造成美股的急跌，而一旦美股急跌，台灣股市恐怕就很難逆勢抗跌了。除了美國股市外，值得注意的是，昨天和石油期貨雙雙出現重挫走勢；油價昨天的長黑，吃掉了過去7天的紅棒，技術面上轉為極弱勢；金價則創下兩個月來的最低價。在中東局勢仍不穩定，烏克蘭局勢也越趨緊張的情況下，理應維持強勢的金價和油價，反而出現重挫走勢，我們唯一能想到的合理解釋，就是國際資金已經開始逐步撤出國際金融商品市場。事實上，按照央行的報告，今年以來持續大舉匯入的外資，也已經開始轉向匯出。雖然匯出的金額並不算多，但是一旦美股也展開波段回檔走勢，大致就可確定國際資金已經開始全面撤出金融商品市場，屆時，除了中國大陸股市外，恐怕沒有幾個國家的股市，能夠抵擋這股資金撤出浪潮的衝擊。純粹就技術面而言，明天沒有收紅或收黑的問題，只有必須收紅的問題。如果明天能夠收紅，短期內大盤還有機會維持橫向震盪走勢。但是如果明天走勢疲弱，恐將導致信心不足賣壓蜂擁而出，並迫使大盤以長黑作收，而一旦明天收中長黑，短中期移動均線和技術指標都將翻空，大盤恐將展開另一波的震盪回檔走勢。李永年 分析師★ 此研究報告著作權屬倫元證券投資顧問(股)公司，切勿盜用或翻印，否則追究責任，決不寬貸 ★ 所有資料僅供參考，本公司不負盈虧責任，洽02-7725-8899理財專員
918,2014/09/03,統一超打造最完備秋蟹預購通路！今年品項倍增 估業績年增6成,又到了品蟹季節，統一超()7-ELEVEN今(3)日起至10月28日止展開「秋蟹大賞」預購，今年訴求名地、名物和名店的概念，網羅兩岸和日本3個產地的螃蟹，也強化各式水產選擇，共計達30多個品項，較去年大增1倍，7-ELEVEN強調，太湖大閘蟹、江南大閘蟹和酷斯拉北海道帝王蟹3款「保證活蟹」，預計總檔期業績可較去年大增60%。統一超秋蟹預購活動舉辦超過10年，創造國內品蟹的熱潮，去年首度引進酷斯拉北海道帝王蟹，每隻要價萬元，仍引發消費者搶購，今年除將持續引進酷斯拉北海道帝王蟹，還提供太湖和江南大閘蟹，以及台灣萬里蟹、松葉蟹腳等7種螃蟹選擇，其中，獨家與新北市政府萬里蟹品牌合作，是唯一的預購通路。除了活蟹和熟凍蟹，今年也強化蟹料理銷售，特別與避風塘海鮮、港點大師等名店推出4款熟食料理；另一方面，7-ELEVEN還提供如烏魚子、鮑魚、澎湖明蝦、鮭魚、帆立貝等品項讓消費者做多元選擇，預購3-7日後消費者可選擇至原訂購門市取貨或低溫宅配到府。統一超強調，這次秋蟹預購期望打造國內最完備、最安心且最方便的通路，並希望將台灣的萬里蟹發揚光大。
919,2014/09/03,亞洲投顧 趨勢領航 盤後分析,"◆盤勢分析行情的回測整理型態已經確認完成，短線拉回後只要成交量續增，行情將回到多頭的上漲趨勢，指數後續將再創高。        1.今日行情回復穩定，成交量仍沒有變化，因此指數收復昨日一半跌幅，目前行情仍是整理格局。短線行情為正式攻高前的拉回誘空，拉回誘空結束後指數將會上攻創高。今日賣均大於買均0.27張，昨日壓盤造成的籌碼面鬆動現象已經消失，籌碼面回復穩定狀況。2.今日行情指標股鴻海、台積電、大立光，都回復穩定整理狀況，目前仍維持整理型態。以目前行情的量能水準，指標股不易出現連續漲勢，後續持續觀察指標股能否增量轉強現象，否則行情仍無法強攻高點。3.領先指標聯發科今日雖未續攻但維持強勢整理，今日高點已挑戰522元壓力。短線行情若在量能不足下出現拉回，只要領先指標聯發科不轉弱反而逆勢走強，就可以確認行情的拉回整理都是機會。亞洲投顧 蕭光哲 分析師以上資料僅供參考,投資時應審慎評估"
920,2014/09/03,聚陽旺季到！8月營收月增23% 創今年新高,聚陽()公布8月合併營收為20.36億元，較上月成長23.2%，年增率3成，創今年新高！由於聚陽進入冬裝交貨高峰，9月業績可望再升溫，並有機會挑戰21.2億元單月歷史新高紀錄！聚陽前8月合併營收為132.55億元，較去年同期成長15.6%。到目前為止，聚陽業績年增率已逾15%，超出內部原先預估的成長目標。聚陽第3季起進入旺季，冬裝交貨攀升，交貨量逐月增加，7月交貨為87.5萬打、8月95萬打，法人預估9月單月交貨量將可突破100萬打，並帶動營收持續攀高。聚陽今年的營運策略，以拉高ASP、衝刺獲利為主，機能性服飾加入交貨，今年上半年合併毛利率為23.38%，每股稅後盈餘已達4.95元，年增率已達23.6%，法人看好第3季業績、獲利將可再創單季新高。
921,2014/09/03,F-龍燈：Q4營運再創歷年單季新高,F-龍燈金保華協理表示，對於下半年營運相當樂觀，在含金量高藥證的產品推出，加上填補國際大廠除草劑缺口，第三季將持平，第四季營運較第二季成長2成，再創歷年單季新高。(鉅亨網記者張旭宏攝)全球前10大植物保護劑大廠龍燈環球(F-龍燈)()今(3)日參加證交所業績發表會，金保華協理表示，對於下半年營運相當樂觀，在含金量高藥證的產品推出，加上填補國際大廠除草劑缺口，第三季將持平，第四季營運較第二季成長2成，再創歷年單季新高，法人估計全年每股盈餘將衝破4元。F-龍燈第二季受惠國際大廠巴斯夫供貨出現缺口的除草劑麥草威，提高北美市場出貨量，推升業績攀高，單季營收28.31億元，季增43%，營業利益2.54億元，年增204.44%，由於巴西幣匯率持穩，挹注匯兌收益，進一步提高獲利表現，稅後淨利1.69億元，較去年同期虧損3588萬元，倍數成長，營收獲利創歷年次高，每股盈餘1.29元。金保華進一步表示，目前F-龍燈中國區佔營收比重逐年下降，將擺脫低毛利產品，取而代之的高毛利的南美洲及歐洲市場，目前全世界的藥證數量已經超過900張，今年含金量高的藥證新產品學名藥Rephon、Mazotam等已取得主要市場阿根廷與巴西的藥證，預計下半年陸續推出。金保華指出，第三季是中國傳統淡季，加上巴西受到天氣影響，旺季啟動期較去年延後到8月，因此營收較第二季歷史次高微幅下滑5%，但含金量高的產品芬普尼，開始從巴西大豆栽植進入，成為新成長動能；至於第四季進入傳統拉美旺季外，歐洲及北美需求也會拉高，單季營收將較第二季營收成長20%，將會創下歷年單季營收新高，法人估計全年每股盈餘4元起跳，有機會挑戰近3年高點。
922,2014/09/03,F-再生董座出席證交所法說會 丁金造：營運回到正常軌道,F-再生董事長丁金造親自出席，在會議開始前先對外致詞，丁金造表示，參加發表會就是要告訴市場，公司營運逐步回到正常軌道！(鉅亨網記者張旭宏攝)F-再生()今(3)日參加證交所業績發表會，董事長丁金造親自出席，在會議開始前先對外致詞，丁金造表示，參加發表會就是要告訴市場，公司營運逐步回到正常軌道！未來將專注本業發展，全力衝刺生產自動化效率改善，工藝技術提升，尋求併購機會，用穩健營運證明公司價值，讓投資大眾、供應商、客戶及銀行團持續對公司恢復信心。丁金造指出，公司今年4月24日突遭美商放空機構惡意控訴，導致市場對公司產生信心危機及股價非理性下跌，使得銀行團緊縮借款額度，或不延長放款期，供應商同步要求授信期限縮短，導致第二季原料供貨受到影響，由於數度公開說明，產品毛利結構外界都相當清楚，使得廠商紛紛要求讓利減價，在供料及調降售價雙重影響下，因此使得近期營收無法因產能擴充而成長。丁金造進一步指出，禿鷹事件後，子公司香港貿易第二季陸續辦理減資2500美元供母公司調度，另外江蘇新廠第三期工程擴建暫緩進行，進一步減少現金股利發放額度，以求先應付銀行及供應商抽銀根。丁金造強調，董事會4月25日決議買回庫藏股，同時調整現金股利，因此現金股利下修及庫藏股執行結果不如預期，是因為公司只能先確保本體營運穩定後，才能進一步考慮股價表現，希望市場能夠諒解。丁金造進一步強調，公司本業營運漸上軌道，資金調度已無問題，董事會6月決議福建子公司在2億的額度內，以外債方式借款亞塑再生母公司，以備年底需償還銀行借款，現金股利及明年可轉換公司債到期還款等資金需求。
923,2014/09/03,群益期貨台股期權盤後－財長出現喊話 台股守住10日線,◆盤勢分析台股來到短線頸線區果真發揮支撐效果，今天與昨天K棒形成母子線，有利於止穩，成交量稍稍縮減，至於接下來形態要走區間震盪或是持續走高，那麼昨天開始下殺的黑K棒高點必須突破才有機會，且必須要再補量，盤中勢必觀察台積電走勢，目前持續站穩平台上緣區，若再走強有利於盤勢。以9月份選擇權合約來看，買權OI小於賣權OI口數差距擴增至為七萬多口左右，屬於偏多的格局。今天盤勢反彈，所以賣權OI自然增加得較快許多，不過9600~9700點的買權OI都一直很多又突兀，且幾乎每天都增加口數的布局，反壓持續存在著。總結來說，外資雖然期貨繼續抱著空單，但是他在現貨的買超並沒有減少，只要其現貨繼續買超，盤勢還不至於走跌，再來可以觀察當指數又再接近近期高點時有沒有補量，若又量縮勢必會再度被壓回來，形成區間走勢。
924,2014/09/03,外資加碼 自行車廠巨大改寫歷史新高價,自行車品牌雙雄之一的巨大()今天股價表現在外資追捧下，盤中以257元又改寫歷史新天價，同時，巨大在今天的收盤價也以256.5元創收盤新高價位，收盤上漲6.5元或2.6%，而今天外資也對巨大買超137張。巨大的2014年上半年財報，其1-6月合倂營收293.37億元，較2013年的同期的271.94億元成長7.9%，稅前盈餘29.34億元，較去年同期增加21.8%，稅後盈餘為19.19 億元，較去年同期成長11.7 %；每股稅後盈餘為5.12元。同時，就第3季以來巨大的業績表現方面，其在第3季的銷售旺季挹注之下，7月營收以56.34億元創歷史次高，僅次於今年59.34億元歷史新高，而8月也是其銷售的旺季，也可望有佳績的演出。巨大在製造工廠方面，2014年上半年自行車及電動車總共產銷325萬台。在自有品牌銷售方面，除澳洲子公司外，其餘子公司上半年銷售都有成長。巨大對於去年股利配發6元現金股息，股利創歷史新高，巨大在8月11日除息之後的股價表現上不僅完成填息，並在今天股價又改寫歷史新高。自行車市場業界人士指出，今年以來，歐洲地區的天氣表現相對於去年有穩定表現，也將帶動自行車的銷售業績表現。
925,2014/09/03,元大寶來期貨台股期指盤後－短多早盤攻午盤休 續航力不足難發展,"◆盤勢分析週二美股漲跌互見，晚間的歐台指也呈現震盪，顯示市場多空未明的態度，週三台股早盤雖一度翻黑，但在金融族群積極撐盤的情況下，大盤大致維持盤上震盪為主，在10:00出現2分鐘逾6,000口成交量上攻，不過追價力道並不積極，短多倍受壓抑；終場扣除掉除息影響點數後，期現貨實質價差反轉為逆價差1點，期貨市場先前積極樂觀的態度已經逐漸降溫。觀察法人籌碼變化，三大法人土洋對作，其中外資買超71.2億元，自營商則賣超5.8億元，三大法人合計買超60億元；在淨部位方面，外資減碼淨空單3,714口至10,193口，自營商減碼淨多單1,418口至8,267口，三大法人合計偏多操作2,212口，翻多至淨多單807口，整體而言，雖然三大法人對作水位有所消減，但後市看法仍依舊分歧，因此仍有震盪洗盤的風險。週三台股成交金額略增至886億元，量能遲遲無法達到千億攻擊量，也使得多方反彈的力道仍遭受壓抑；金融期強漲1%，成功站回所有均線之上，但電子期與非金電期卻不見積極表現，透露出盤面上類股漲勢並不整齊，雖然現貨尾盤出現一波拉抬力道，但買盤卻顯得意興闌珊，並於現貨收盤後出現小幅壓回，皆突顯多方進一步攻擊意願並不積極，且上方5日均線反壓仍在，下方10日均線支撐也暫難確立，短線上檔空間恐相對受限。"
926,2014/09/03,乾景投顧盤後－權值股撐盤 台股回攻9450點,◆盤勢分析歐美股市無畏俄烏緊張情勢，維持高檔整理格局，讓周二受利空襲重挫的台股，周三受到激勵展開反彈走勢，早盤資金集結全力點火重量級權值股，指數一度攻克5日均線，不過由於市場信心仍然偏弱，終場台股只以小漲50點坐收，指數收在9450點，成交量為884億元。周二受利空侵襲的LED、面板以及蘋概股，周三跌勢已見和緩，部份個股甚至開始出現翻紅的走勢，其中以蘋概股的表現最為強眼，可成、鴻準受惠品牌手機大量採用金屬機殼利多消息激勵，早盤吸引大量買盤進駐，成為帶領蘋概股反攻的要角；面板雙虎同樣在周二大幅拉回後出現止穩的現象，友達終場甚至以上漲1%坐收。不過助大盤成功收高的關鍵個股則是落在權值股身上，由於半導體展開幕，帶動台積電以及同為晶圓代工廠的聯電、封測雙雄矽品、日月光同步走高，配合金融股國泰金及富邦金助拳，成功克服台股下跌家數大於上漲家數的劣勢，助台股終場以上漲50點收場。觀察本周台股漲跌皆量縮的情形來判斷，台股近期應以?盤整理的走勢為主，惟個股輪動速度過快，不易累積較好的獲利成績，建議操作上不宜積極追漲，利用低進高出的方式，反而較易有獲利的機會。簡福杉 分析師
927,2014/09/03,日盛投顧盤後－支撐轉強 有利續強,◆盤勢分析1.在美股續強之下，台股以高盤開出，雖然盤中持續震盪，但在金融股走強以及大型股守穩帶動之下，終場指數一掃周二頹勢，上漲50.63點，以9450.35點作收，成交量為886.89億元。2.從技術面看，台股日KD開口在高檔縮小，若週四仍再續強，則日KD將再度交叉，有利於指數突破前高9593點，而在均線方面，中期均線多頭走勢不變，短均線仍呈現交叉，且指數連續兩日守穩10日均線，短線多方也並未破壞，台股多方走勢仍然維持。3.三大法人買超59.98億元，其中外資買超71.21億元，投信賣超5.47億元，自營商賣超5.75億元。大型股轉穩 金融股有領先過高趨勢 題材股仍以蘋概、TESLA等為主要指標1.電子類股指數低檔均線集結，若見中紅棒出現，則376.45點將會突破，目前多方仍為盤面趨勢，次族群表現雖不整齊，但車用電子、蘋概以及機殼、第三方支付、通路股、網通等仍為指標，後續仍然要看大型指標股包括2308台達電、2454聯發科、3008大立光、2330台積電、2317鴻海等股價表現。2.非電族群仍以汽車相關股包括2207和泰車、1338F-華廣、1536和大等或是大型股，1101台泥、1102亞泥、1216統一、1402遠東新、1504東元等維持類股指數表現，而航太股近期表現轉強包括2634漢翔、4541晟田等，而上証持續走高，相關指標2915潤泰全、9945潤泰新、5907F-大洋仍可留意。3.金融股再度走高，也為週三盤面重點，從型態上，有機會領先大盤創波段新高，因此相關金融股包括2882國泰金、2886兆豐金、2881富邦金、2891中信金、2892第一金等，仍為多方主流。
928,2014/09/03,健鼎科技Q3接單順暢 8月營收再創今年新高,上市PCB廠健鼎科技()2014年業績將呈逐季向上攀升的走勢，包括HDI板及光電板仍然是兩大營收支柱，而汽車板的營收比重已一路成長並在第2季提高到14%，同時，健鼎在第3季接單順暢挹注下，健鼎科技初估8月營收也優於7月的36.68億元，改寫今年營收新高。今年以來，PCB產業呈現復甦的走勢，而健鼎在2014年第2季有佳績傳出，其2014年第2季營收突破100億元而達到103.38億元，為3年來單季營收新高，並較第1季的98.29億元成長5.17%；而健鼎科技的2014年上半年的財報，稅後盈餘達10.99億元，每股稅後盈餘並達到2.09元。外資法人估計健鼎2014年第3季營收將可進一步成長到105-110億元。在7月已達成36.68億元營收之下，預估將在第3季達成高標。而健鼎科技在第3季以來的接單順暢，初估其8月營收並已超越7月的36.68億元營收水準，也等於是再度改寫其2014年以來單月營收新高，也明顯比去年8月的35.1億元營收出現約5%的成長。由健鼎科技統計2014年第2季的各項產品應用，以應用於手機、平板電腦及NB的HDI板占第2季營收比重達22.7%最高，而TFT LCD光電板則占20.6%，而汽車板的營收比重已一路成長，並在第2季提高到14%而居第3位。
929,2014/09/03,鉅亨晚報2014年9月3日,◇重要新聞內容■台北市議員王世堅被週刊拍到帶前女助理小文上摩鐵，王稱將暫停所有競選活動。■世界經濟論壇公布2014年全球經濟競爭力報告，台灣比上年度退步兩名，排名14。■普京：兩周內可奪基輔，北約擬建快速部隊，48小時抵東歐戰線。◇財經新聞■債務危機潛在風險遍及全球 穆迪列出10個高風險國家■郭台銘：鴻海今年山西投資逾50億 發展電動車！■台積電協助高雄氣爆 曾銘宗高度肯定 籲強化公司治理■特斯拉股價登新高！貿聯、和大率族群搭上順風車■蝴蝶2高飛 宏達電8月合併營收145億元 月增36.57%[NT:PAGE=$]◇重要指標■澳洲Q2經濟成長0.5％ 寫下連23年擴張紀錄■匯豐中國8月服務業PMI升至54.1 攀17個月新高■陸8月非製造業PMI小幅回升至54.4◇亞洲股市■台灣今(3)日收盤上漲 50.63 點或 0.54 %，報9450.35點，成交量為884.21億元。■台股今(3)日三大法人集中市場買超59.98億，其中外資買超71.20億，投信賣超5.46億，自營商賣超5.75億。■日經225指數今(3)日收盤上漲 59.75 點或 0.38%，報 15728.35 點；高見 15829.38 點、低見 15723.54 點，開盤報 15797.79 點。■韓國Kospi指數今日收盤下跌 0.38 點或 0.02%，報 2051.20 點；全日高見 2054.08 點、低見 2040.44 點，開盤報 2050.09 點。■澳洲S&P/ASX 200指數今日收盤下跌 2.411 點或 0.04%，報 5656.10 點；全日高見 5672.70 點、低見 5643.60 點，開盤報 5658.50 點。■上海今(3)日收盤上漲22.58點或 1.00%，收盤報 2288.63點，成交金額1875.58億元。深成指數收盤上漲72.56點或 0.90%%，收盤報 8115.87點。■香港今(3)日收盤上漲568.93點或 2.30%，收盤報 25317.95點，成交金額1005億港元。 國企指數收盤上漲346.38點或 3.16%，收盤報 11312.54點，成交金額213.5億港元。◇台北匯市■台北匯市今(3)日收盤貶值 0.8 分，報 29.986 元兌 1 美元。成交金額為 6.52 億美元。
