,date,title,content
681,2014/10/24,乾景投顧盤前分析,◆盤勢分析1.大盤今日再量縮小回，持續是換手洗盤誘空再上攻的格局。我昨天說明近期大盤量縮的控盤思維是大戶條款的一著棋，逼出昨日加速滾量第四箭加速實施，以及今日盤後券商公會的記者會說明大戶條款的影響。最重要的結論；我從來沒聽過全世界有那一個國家，在發展股市資本市場會給大戶一個大戶條款的增稅?大戶可以用分散投資避稅，也可以選擇避開台股不交易，對股市資本市場絕對只有負面影響沒有正面的助益。所以我的看法大戶條款是不會實行長久，過程要拖多久，在股市中都是權謀利益在計算中。2.電視節目服務到下週一會先暫停，但是對會員服務都不會改變。第四季二大波動變數是美國QE到期及11月台灣百里侯九合一大選，會影響股市波動都有千點以上的可能。節目先暫停我要更專心帶會員掌握這二次的大波動。會員近期先跟自己的營業員確認一下，要能融券信用交易，要能買權證避險交易，Q4二大變數會有個股大波段行情利潤!3.市場喊空的聲音喊很大聲，不是喊很大聲真的就會賺!蘋果行動支付同亨、連宇今日續強除了主軸明星產業外，昨日融券同創新高，會是市場軋空個股指標領軍多頭上攻。馬明河 分析師
682,2014/10/24,永豐期貨台指選擇權盤前－量縮整理 台股守住10日線,◆盤勢分析期貨走勢週四下跌23點收在8721點。價差方面，逆價差擴至10.07點，電子期轉為逆價差0.04點，金融期逆價差縮至1.47點，摩台期正價差縮至0.03點。由籌碼面來觀察，三大法人於現貨市場買超15.57億元；而在淨部位方面，三大法人空單加碼670口，淨空單升至11929口，其中外資空單減碼308口，淨空單降至10538口，自營則是空單加碼13口，淨空單升至2073口；另外十大交易人中的特定法人，全月份空單減碼1390口，淨空單降至9686口，整體來看，法人與大額交易人對台股後市偏空預期已減緩。行情走勢方面，受到前晚美股回檔的影響，週四以平低盤開出，不過盤面上並未見到明顯賣壓殺出，全場指數皆維持在10日線之上進行橫盤整理，終場就以下跌的小十字黑K作收。由技術面觀察，週四大盤量縮小幅回檔，收盤連續第二日守在10日線之上，顯示市場偏空氣氛已轉淡，短線指數大跌的機率降低，不過多頭信心能否持續回穩，仍需視量能是否增溫而定，而面對跳空大缺口反壓，預期大盤仍以求穩打底為主，盤勢區間震盪整理機率高，因此操作上建議反彈時不宜過度追高。選擇權分析選擇權從成交量來觀察，11月份買權集中在9000點，賣權集中在8500點。未平倉量部份，買權大量區集中在9000點，而賣權大量區則在8300點。全月份未平倉量put/call ratio值持平由1.03降至1.02，反應選擇權籌碼面偏向中性結構。11月買權平均隱含波動率由10.72%降至10.59%，賣權平均隱含波動率由14.25%降至14.13%，在盤勢仍為偏空而選擇權結構轉為中性格局的背景下，操作上建議反彈以買權空頭價差策略因應。近期上市的台灣50、寶滬深與FB上証等三檔ETF期貨，以寶滬深成交量886口為最活絡商品。
683,2014/10/24,元大寶來期貨台股期指盤前－期指走勢疲弱 陷入區間整理,"◆盤勢分析週三美股走低，也令歐台期以小跌作收，週四亞股普遍以盤下震盪為主；台股中主要權值股也顯得有氣無力，台積電拖累大盤下跌13點，台股終場下跌17點，也開低震盪，振幅僅有38點，陷入狹幅整理的僵局，終場期現貨逆價差擴大到9點，但選擇權波動率下滑，透露出市場先前的謹慎態度明顯降溫。觀察法人籌碼變化，外資買超16.9億元，自營商賣超3.7億元，投信則連續四個交易日買超現貨，三大法人合計買超15.6億元；在淨部位方面，外資僅小幅減碼淨空單308口至10,538口，自營商淨空單約略持平在2,073口，外資與自營商的期貨部位變動不大，三大法人合計共加碼淨空單670口至11,929口，整體而言，近幾個交易日，外資在期貨部位的操作上並不積極，週四無論交易量或是淨部位變動都明顯較小，顯示外資觀望的態度相當濃厚。週四台股成交金額萎縮到619億元，呈現價跌量縮，市場交易意願並不熱絡；各類股期指方面，電子期雖然承壓不輕，但仍力挺於10日均線之上，金融期則是唯一守穩於平盤之上的期指，非金電期小幅開低後積極收斂跌幅，顯示下檔支撐力道仍在；持續陷入整理，雖然高低點呈現下移，但下方5日均線持續上探，即使出現壓回，10日均線也並未失守。"
684,2014/10/24,鉅亨早報 2014年10月24日,"■ 受到餿油食安風暴拖累，經濟部23日指出，9月食品零售業營業額因此年減4.8%，為2008年9月以來最大減幅；9月餐飲業營業額同樣受食安問題波及，外食意願降低，年減0.8%。 ■ 券商公會理事長簡鴻文23日公布證所稅影響報告，並建議證所稅不應匆促上路，應先求好再求有，簡鴻文坦言，一旦大戶條款上路，台股量能恐將縮減至400-500億元，建議維持過去以證交稅代替證所稅的作法，取消加徵證所稅。 ■ 券商公會理事長簡鴻文表示，一旦大戶條款上路，明年台股日均量恐怕不到500億元，因此呼籲廢除大戶條款。對此，金管會主委曾銘宗表示，尊重券商公會呼籲廢除大戶條款的建議，是否廢除大戶條款，屬於財政部的權責。而財政部政務次長吳當傑則表示，證所稅大戶條款明年會如期實施，台股現階段主要是受到國際因素影響，呼籲投資人應對台股有信心。 ■ F-TPK宸鴻()23日下午召開法人說明會，公布第3季財報，受到客戶新產品上市時間遞延，吸收提前準備的產能及人力成本，第3季營收表現雖較原預期略佳，但是獲利卻是受到衝擊，自結第3季稅後淨損2.4億元，稅後稀釋每股虧損為0.73元，累計前3季稅後稀釋每股盈餘為0.64元。 ■ 台灣之星23日表示，開台時以最小的電信業者之姿，投資超過100億元在網路基礎建設上提升收訊品質，截至10月底全台4G覆蓋率已達92%、六都達93%，普及22縣市322鄉鎮區。 ■ 網家()旗下第三方支付支付連23日宣布與騰訊旗下旗下第三方支付財付通進行電商金流跨境串接，立即開啟台灣商家銷售大陸的龐大商機，並由上海商業儲蓄銀行擔任收款銀行，在商店街平台推出「支付連‧財付通」付款服務 ■ 連鎖餐飲瘋上櫃！麻辣火鍋店「老四川」()將於下周二(28)日正式登錄興櫃外，另一家知名餐廳「天母洋蔥」()也將於11月登錄興櫃交易，由於去年每股盈餘超過11元，市場預估登錄價超過150元以上。 ■ 據彭博社報導，據知情人士透露，億萬富豪馬雲正在加大力度發掘在好萊塢的生意，率領阿里巴巴集團一高管與影業公司洽談獲取在線內容。 ■ 引發家用電腦革命，由蘋果 (Apple Inc.)() 共同創始人 Steve Wozniak 組裝成的「文化遺產」級電腦 Apple-1，現於紐約拍賣會中寫下 90.5 萬美元的歷史天價。 ■ 中國官方《新華社》週三報導，馬凱於中南海紫光閣會晤正在中國訪問的庫克，兩人就「加強信息通信領域合作、保護用戶信息安全」等問題交換意見。《路透社》則引述 Greatfire 報導，蘋果週二 (21 日) 似乎改變 iCloud 用戶資料路徑，以反制駭客攻擊。 ■ 蘋果周一甫推出新型行動設備支付系統 Apple Pay，但一些美國銀行(Bank of America) () 信用卡和金融簽帳卡 (debit-card) 用戶發現，他們在使用 Apple Pay 的時候，同一筆消費被重複記帳。美銀表示，正在處理刷退手續。 ■ 兌美元過去 2 年貶值了 26%，雖然提振了日本企業的獲利，但日本消費者的購買力卻因此受傷。摩根士丹利 (Morgan Stanley) 駐倫敦全球外匯策略部主任 Hans Redeker 直言，日本民眾實質可支配收入正在減少，已令日本政府非常擔憂這對於政府支持度的影響。 (接下頁)[NT:PAGE=$]■加拿大在3日內第二度發生恐襲，舉國震驚。當局表示，兩宗襲擊案的疑兇均為土生土長加拿大人，信奉伊斯蘭教，曾計劃出國，疑打算參與聖戰，近期被當局列入監察名單，屬高危人物，並遭沒收護照禁止出國。加國多地已加強保安，總理哈珀譴責暴力襲擊，強調加拿大將繼續打擊恐怖主義，不會屈服。■中共十八屆四中全會昨日閉幕，會議通過了「全面推進依法治國」的決定，提出全面推進依法治國的六大任務，包括加強憲法實施、加快建設法治政府、提高司法公信力、增強全民法治觀念、加強法治隊伍建設以加強和改進黨的領導。但特別強調中共「黨的領導」，會議公報還首次將「習近平總書記系列重要講話精神」與中共的多項指導思想並列，這是「習精神」首度在中共中全會公報中出現。■期四天的中共十八屆四中全會昨日在北京閉幕，全會審議通過了《中共中央關於全面推進依法治國若干重大問題的決定》，提出了執政黨依法治國的總目標和六大任務，勾勒出「法治中國」的升級版和宏偉藍圖。四中全會公報指出，要依法保障「一國兩制」實踐和推進祖國統一，保持香港、澳門長期繁榮穩定，推進祖國和平統一，依法保護港澳同胞、台灣同胞權益。■本周甫接替小淵優子擔任日本經濟產業大臣的宮澤洋一，上任僅三天便鬧出醜聞，他周四承認旗下政治支持團體曾到SM（性虐）俱樂部消費。在野黨民主黨及維新會立即炮轟事件丟架，要求宮澤洋一迅速處理好此事。■美國馬薩諸塞州（Massachusetts）交通局（MBTA）昨日（當地時間10月22日）正式批准，將向中國北車採購284輛地鐵車輛，裝備波士頓紅線和橙線地鐵。這是中國軌道交通裝備企業在美國面向全球的招標中首次勝出，登陸美國。據稱，今次中標金額約為34.85億元，列車服務年限至少30年。■亞洲基礎設施投資銀行籌建邁出關鍵一步，《籌建亞投行的政府間框架備忘錄》草案終稿今日在北京簽署。亞投行是新的多邊金融機構。去年10月，中國國家主席習近平、國務院總理李克強先後出訪東南亞，先後提出籌建亞投行的倡議。■西非伊波拉疫情持續，確診病例逼近1萬宗。朝鮮為防伊波拉傳入，昨日向經營赴朝旅遊的旅行社發出通知，從今日起停止所有外國人赴朝旅遊，暫時未知禁令會維持多久。另外，美國接連出現本土感染個案，當局宣布實施新檢疫措施，所有來自西非三國的旅客將被密切監察21天。■昨公布的匯豐中國製造業採購經理人指數(PMI)預覽，10月PMI初值回升至50.4，為三個月的高點，也較市場預計的50.2為高。這是該指數連續第五個月位於榮枯分水嶺上方，上月終值為50.2。不過，分析指出，數據也反映內地的內外需顯露放緩跡象，且投入和產出價格進一步回落，均表明經濟下行壓力猶存，要求政策面寬鬆以穩增長。■日本計劃興建賭場振興經濟，並希望於2020年東京奧運會前落成，以吸引更多遊客。但國會內支持及反對聲音拉鋸，令法案一再推遲。消息人士透露，支持計劃的議員前日放棄在本月繼續討論賭場法案，擬下月初再展開討論。按此情況，法案將難以在下月30日、本年度會期結束前通過，賭場在奧運前開幕的希望恐落空。)■美國國家公路交通安全局(NHTSA)周一發出緊急警告，指日本汽車零件製造商Takata的安全氣袋可能突然充氣及爆裂，建議車主回廠修理。涉及問題安全氣袋的汽車，單在美國已多達780萬輛，分別來自本田、日產及福特等10家車廠，消息拖累Takata股價連日大瀉。■東京森紀念財團早前發表本年度世界城市綜合實力排行榜，香港比去年排名上升兩位，名列第九，於亞洲城市中排名第四，僅次於東京、新加坡及首爾，北京則在香港之後。■步入第四季，香港各大小企業陸續為明年加薪幅度盤算，浸會大學最新的加薪調查顯示，受訪企業僱主預計明年加薪介乎百分之四點二至四點五，但面對近日佔領行動影響，年底的補充調查將加入佔中因素，評估事件對僱主加薪意欲影響。■佔領行動期間訪港內地客量不跌反升，旅遊業議會表示，十月至今的內地團數量，每日平均逾三百八十團，與正常情況相若。香港旅行社擔心佔領運動持續，影響港人外遊意欲，現時聖誕檔期報名進度較慢。■中國新股排隊難見曙光，不少公司都轉投香港懷抱，中國著名傢俬大賣場紅星美凱龍計畫放棄A股，轉赴香港上市，集資8億美元（約62億元）。■中移動（941）季績遜預期，股價昨日開市即受壓，加上遭一直看淡的投行中金「踩多腳」，指該公司曾故意將客戶數目「做細」，以提升每客月均消費（ARPU），又指4G上客量增速加快，無助ARPU增長。中移動昨連續第三日下跌，以全日低位88.1元收市，跌3.2%，至近兩個半月低位。■中國聯通（762）公布今年第三季度業績，季度盈利38.74億元，按年升26.7%，遠勝市場預期，因市場本預測其盈利將會下跌。季度業績理想主要由於手機補貼大減，以及網間結算費用減少。■建行(0939)昨晚公布截至9月30日止9個月業績，為內銀季績期掀開序幕。首三季淨利潤錄得1,906.85億元，較去年同期增長7.8%；其中，第三季淨利為596.36億元，環比及同比分別跌8%和升5%。截至9月底，不良貸款餘額1,053.2億元，較上年末增200.56億元或23.52%；不良貸款率1.13%，較上年末上升 0.14 個百分點。市場早前對建行業績的預測差別甚大，純利增長預測介乎1.4%至15.6%，而建行首三季的業績，處於市場預測的中位數。■中金公司昨宣佈，金立群不再擔任中金公司董事、董事長職務；中投公司董事長兼首席執行官丁學東出任中金公司董事、董事長。■柯林斯（Collins）英語詞典宣布，英文詞「Photobomb」（照片轟炸）突圍而出，獲選為二○一四年度單詞。■擁有全球最大畢加索作品收藏的巴黎畢加索博物館於2009年閉館翻新，原訂2年後峻工，豈料工程一拖再拖，引發畢加索兒子與法政府激烈爭拗，導致前館長被撤職。最終在大幅超支下，花了足足5年才完成工程，訂於明日畢加索誕辰133周年正式重開。(接下頁)[NT:PAGE=$]■美國上周初次申請失業金人數增加1.7萬人至28.3萬人，預估28.5萬人■FHFA：美國8月房價上漲0.5% 較去年同期上漲4.8%■美國9月芝加哥聯儲全國活動指數+0.47■英國10月CBI工業訂單差值-6■英國9月零售銷售年率+2.7%■區10月Markit服務業PMI初值52.4;預測52.0;前值52.40■區10月Markit制造業PMI初值50.7;預測49.9;前值50.30■區10月Markit綜合PMI初值52.2;預測51.7;前值52.00■德國10月Markit制造業PMI初值51.8;預測49.5;前值49.90■德國10月Markit綜合PMI初值54.3■西班牙第三季度失業率23.67%■法國10月Markit制造業PMI初值47.3■法國10月Markit綜合PMI初值48.0■中國10月匯豐制造業PMI初值50.4;預測50.3;前值50.20。■日本10月制造業PMI初值52.8;預測null;前值51.70。■紐西蘭第3季CPI年率+1.0%■ 工業平均指數收高216.58點或1.32%至16677.90點■ Nasdaq指數收高69.94點或1.60%至4452.79點■ 指數收高23.71點或1.23%至1950.82點■ 指數收高8.71點或1.46%至605.64點■ 德國 DAX-30指數收高107.17點或1.20%至9047.31點■ 英國 FTSE 100指數收高19.42點或0.30%至6419.15點■ 法國 CAC 40指數收高52.59點或1.28%至4157.68點■ 台股收盤下跌17.76點，報8731.07點，成交量635.67億元■ 日經225指數23日收盤下跌56.81點或0.37%，報15138.96點■ 韓國Kospi指數23日收盤下跌5.32點或0.27%，報1931.65點■ 澳洲S&P/ASX 200指數23日收盤下跌2.768點或0.05%，報5383.10點■ 上海綜合指數收低24.13點或1.04%至2302.42點■ 香港收低70.79點或0.30%至23333.18點■ COMEX 收跌16.40美元，收於每盎司1229.10美元■ NYMEX 原油期貨收漲1.57美元，至每桶82.09美元■ ICE 倫敦 布倫特原油期貨收跌1.51美元，至每桶84.71美元■ CBOT 玉米期貨上漲6.75美分，報每英斗3.5975美元■ CBOT 小麥期貨上漲4.50美分，報每英斗5.2675美元■ CBOT 黃豆期貨上漲30.25美分，報每英斗10.0000美元■ 美元/報30.4050，升0.0120或0.04%■ 美元/報6.1190，貶0.0000或0.00%■ 報85.8480，升0.0050或0.01%■ 美元/報108.1800，貶0.1220或0.11%■ /美元報1.2649，升0.0003或0.03%■ /美元報1.6023，貶0.0005或0.03%■ 美元/報0.9540，貶0.0002或0.02%■ 美元/報1.1226，貶0.0005或0.04%■ /美元報0.8747，貶0.0012或0.14%"
685,2014/10/24,◆外資連續5日買超個股,外資連續5日買超個股1.外資連續買超5日的股票(2384)勝華  、 (2330)台積電、 (2409)友達  、 (2610)華航  、 (3045)台灣大2.外資連續買超4日的股票(2330)台積電、 (2409)友達  、 (2610)華航  、 (3045)台灣大、 (2891)中信金3.外資連續買超3日的股票(2409)友達  、 (2330)台積電、 (2610)華航  、 (2891)中信金、 (2317)鴻海4.外資連續買超2日的股票(2409)友達  、 (2330)台積電、 (2610)華航  、 (2317)鴻海  、 (2002)中鋼5.外資當日(23)買超的股票(2330)台積電、 (2409)友達  、 (2610)華航  、 (2317)鴻海  、 (2603)長榮
686,2014/10/24,◆投信連續3日買超個股,投信連續3日買超個股1.投信連續買超3日的股票(2618)長榮航、 (2409)友達  、 (3474)華亞科、 (3481)群創  、 (2303)聯電2.投信連續買超2日的股票　(2618)長榮航、 (2409)友達  、 (3481)群創  、 (2303)聯電  、 (2610)華航3.投信當日(23)買超的股票(2409)友達  、 (2618)長榮航、 (3481)群創  、 (2610)華航  、 (2886)兆豐金
687,2014/10/24,◆外資連續5日賣超個股,外資連續5日賣超個股1.外資連續賣超5日的股票(2311)日月光、 (3481)群創  、 (2324)仁寶  、 (1301)台塑  、 (2337)旺宏2.外資連續賣超4日的股票(2324)仁寶  、 (1301)台塑  、 (2311)日月光、 (2303)聯電  、 (2886)兆豐金3.外資連續賣超3日的股票(2356)英業達、 (2337)旺宏  、 (2886)兆豐金、 (1301)台塑  、 (2324)仁寶4.外資連續賣超2日的股票(2886)兆豐金、 (2337)旺宏  、 (2324)仁寶  、 (2356)英業達、 (1301)台塑5.外資當日(23)賣超的股票(2886)兆豐金、 (2337)旺宏  、 (1301)台塑  、 (1402)遠東新、 (3576)新日光
688,2014/10/24,◆投信連續3日賣超個股,投信連續3日賣超個股1.投信連續賣超3日的股票(2801)彰銀  、 (1702)南僑  、 (3576)新日光、 (3013)晟銘電、 (1303)南亞2.投信連續賣超2日的股票(2801)彰銀  、 (1702)南僑  、 (3576)新日光、 (1303)南亞  、 (6176)瑞儀3.投信當日(23)賣超的股票(3576)新日光、 (2801)彰銀  、 (2324)仁寶  、 (6269)台郡  、 (6176)瑞儀
689,2014/10/24,【鉅亨-盤前掃瞄】基本面,1.23日交易日以30.405元兌1美元作收，收盤貶1.2分，成交值為 5.32億美元。2.集中市場23日外資買超 16.90億元，投信買超 2.30億元，自營商賣超 3.70億元。3.集中市場23日融資餘額較前1日減少 0.61億元，成為2038.09億元，融券餘額較前1日增加 15589張，成為496908張。
690,2014/10/24,【鉅亨-盤前掃瞄】技術面,1.5日均線8662.11點，10日均線8704.60點，20日均線8856.90點。2.6日RSI為59.14，12日RSI為31.60。3.9日K值為45.64，9日D值為31.43。4.20日乖離率為-1.42。
691,2014/10/23,◆投信連續3日賣超個股,投信連續3日賣超個股1.投信連續賣超3日的股票(2801)彰銀  、 (1702)南僑  、 (3576)新日光、 (3013)晟銘電、 (1303)南亞2.投信連續賣超2日的股票(2801)彰銀  、 (1702)南僑  、 (3576)新日光、 (1303)南亞  、 (6176)瑞儀3.投信當日(23)賣超的股票(3576)新日光、 (2801)彰銀  、 (2324)仁寶  、 (6269)台郡  、 (6176)瑞儀
692,2014/10/23,◆外資連續5日賣超個股,外資連續5日賣超個股1.外資連續賣超5日的股票(2311)日月光、 (3481)群創  、 (2324)仁寶  、 (1301)台塑  、 (2337)旺宏2.外資連續賣超4日的股票(2324)仁寶  、 (1301)台塑  、 (2311)日月光、 (2303)聯電  、 (2886)兆豐金3.外資連續賣超3日的股票(2356)英業達、 (2337)旺宏  、 (2886)兆豐金、 (1301)台塑  、 (2324)仁寶4.外資連續賣超2日的股票(2886)兆豐金、 (2337)旺宏  、 (2324)仁寶  、 (2356)英業達、 (1301)台塑5.外資當日(23)賣超的股票(2886)兆豐金、 (2337)旺宏  、 (1301)台塑  、 (1402)遠東新、 (3576)新日光
693,2014/10/23,元大寶來期貨台股期指盤後－期指走勢疲弱 陷入區間整理,"◆盤勢分析週三美股走低，也令歐台期以小跌作收，週四亞股普遍以盤下震盪為主；台股中主要權值股也顯得有氣無力，台積電拖累大盤下跌13點，台股終場下跌17點，也開低震盪，振幅僅有38點，陷入狹幅整理的僵局，終場期現貨逆價差擴大到9點，但選擇權波動率下滑，透露出市場先前的謹慎態度明顯降溫。觀察法人籌碼變化，外資買超16.9億元，自營商賣超3.7億元，投信則連續四個交易日買超現貨，三大法人合計買超15.6億元；在淨部位方面，外資僅小幅減碼淨空單308口至10,538口，自營商淨空單約略持平在2,073口，外資與自營商的期貨部位變動不大，三大法人合計共加碼淨空單670口至11,929口，整體而言，近幾個交易日，外資在期貨部位的操作上並不積極，週四無論交易量或是淨部位變動都明顯較小，顯示外資觀望的態度相當濃厚。週四台股成交金額萎縮到619億元，呈現價跌量縮，市場交易意願並不熱絡；各類股期指方面，電子期雖然承壓不輕，但仍力挺於10日均線之上，金融期則是唯一守穩於平盤之上的期指，非金電期小幅開低後積極收斂跌幅，顯示下檔支撐力道仍在；持續陷入整理，雖然高低點呈現下移，但下方5日均線持續上探，即使出現壓回，10日均線也並未失守。"
694,2014/10/23,亞洲投顧 趨勢領航 盤後分析,"◆盤勢分析目前行情結構開始逐漸有轉強現象，但外資短線壓盤跡象仍在，本週行情應該仍會震盪整理進行結構調整。期貨操作建議逢低佈局多單，行情未正式起漲前，8900點之下仍以拉回佈局波段多單為主。明日11月貨；支撐8702，壓力8764。 【行情方向】今日行情仍維持量縮整理，目前市場信心仍弱，成交量只有800億水準。而量縮整理也代表本週賣壓已經明顯減輕，行情隨著結構轉變將逐漸轉強。既然行情恐慌情緒高峰期已過，行情就不至於再度轉弱下跌，短線外資仍存在壓盤逢低回補持股現象，因此短線行情仍不會持續向上強攻，仍需再等待結構持續轉變，行情要出現連續強攻走勢仍需等待外資出現大幅回補持股動作。【行情結構】今日行情四大關鍵結構，半導體、面板、蘋概持續轉強現象，只有金融仍未表態，以控盤角度觀察，仍沒有要讓行情立即轉強。短線外資對大立光與聯發科壓盤現象仍在，但台積電與鴻海回補持股動作積極，顯示目前外資仍持續壓盤回補持股，代表外資已經不會再向下操作台股，只需等待外資反手做多時機。【資金流向】今日短線資金持續有流入面板類股現象。另外LED類股利空中逆勢轉強，也顯示市場資金逐漸回流跡象。作者：亞洲投顧 蕭光哲 分析師以上資料僅供參考,投資時應審慎評估"
