,date,title,content
154,2019/09/26,聯陽9月出貨更勝8月 Q3營收將衝破10億元 重返2011年榮景,IC 設計廠聯陽 () 第 3 季受惠旺季及備貨潮加持，品牌大廠積極拉貨，電腦相關產線出貨明顯升溫，聯陽指出，單以出貨力道來看，9 月更勝 8 月，且電腦相關營收比重約 9 成，將帶動本季營收逐月成長，法人估聯陽第 3 季營收將衝破 10 億元大關，重返 2011 年榮景。聯陽表示，目前主要營收來源為電腦相關產線，包括電腦相關 IC、高速傳輸介面 IC，營收比重分別為 60-65%、25-30%，雖然整體電腦市場持續衰退，但衰退幅度明顯趨緩，加上第 3 季客戶為因應美中貿易關稅提前拉貨，出貨明顯升溫，預計動能可延續至年底。由於聯陽 7、8 月合計營收已達 6.7 億元，9 月拉貨又優於 8 月，法人估第 3 季營收將衝破 10 億元大關，重返 2011 年榮景。此外，聯陽電容式觸控已陸續出貨給中國一線大廠，預計第 4 季出貨將倍增，營收比重約為個位數，隨著客戶在穿戴市場逐漸發酵，營收貢獻可望持續擴大。聯陽上半年雖因美中貿易戰負傷，但下半年搭上關稅備貨潮，出貨已超過預期，有助營運表現，累計前 8 月營收年增已達 2.35%，且備貨潮動能將延續至 11 月，法人看好全年營收可望達個位數成長。
155,2019/09/26,奇鋐除息首日一度填息6成 盤中翻黑陷貼息,散熱模組廠奇鋐 () 今 (26) 日進行除息，每股現金股利 1 元，除息參考價為 39.55 元，受惠華為基地台散熱訂單需求熱，伺服器打入美系供應鏈，營運看俏，早盤開高震盪，最高至 40.15 元，填息率一度達 6 成，不過盤中翻黑走弱陷入貼息情況。法人表示，奇鋐為中國 5G 設備大廠主要供應鏈，產品包括均熱片、散熱片、散熱模組及風機盒，其中風扇產品可自動化生產，隨著 5G 基地台需求增加，看好基站通訊散熱訂單將持續增溫。手機熱板方面，法人預期，今年底前月產能可望達到 200 萬片，將從 12 月開始貢獻營收，未來產能可望再擴大。伺服器方面，奇鋐出貨產品括伺服器外殻、熱板、風扇等，且生產線已開始獲利，目前積極爭取美系客戶訂單，法人預期，明年將有新客戶加入，挹注營運新活水。奇鋐 8 月營收 30.14 億元，月增 1.14%，年增 13.82%；累積前 8 個月營收 223.92 億元，年增 20.33%。第 2 季稅後純益 2.31 億元，月增 29%，年增 30%，每股純益 0.65 元；上半年稅後純益 4.11 億元，年增 27.6%，每股純益 1.16 元。
156,2019/09/26,台積電下半年營收估成長32% 7奈米製程比重Q4可望超過3成,研調機構 IC Insights 預估，在大客戶蘋果與華為 7 奈米需求貢獻下，台積電 () 下半年營收將較上半年強彈 32%，為業界水準的 3 倍，其中，第 4 季營收估季增 15%、達 105 億美元，且第 4 季 7 奈米製程營收比重將拉升至 33%，估全年 7 奈米製程營收占比將達到 26%，較去年的 8% 大幅成長。據台積電財測預估，第 3 季營收將季增 18%，估達 91-92 億美元。IC Insights 預期，在 7 奈米需求強勁帶動下，台積電下半年營收將較上半年強彈 32%，為業界水準 10% 的 3 倍以上，第 4 季營收可望季增 15%，估達 105 億美元，全年營收預期將年增 1%。從製程營收占比來看，IC Insights 預估，台積電今年營收中，40 奈米以下製程比重將達 66%，且今年來自 7 奈米營收可望上看 89 億美元，占全年營收比重的 26%，較去年的 8% 大幅躍升，且預期第 4 季在蘋果與華為等大客戶強勁需求貢獻下，7 奈米製程營收比重將由第 3 季的 25% 拉升至 33%。IC Insights 並指出，台積電在純晶圓代工市場居領導地位，40 奈米以下製程營收將是格芯、聯電 () 與中芯總和的 7 倍以上，且中芯 28 奈米製程在 2015 年第 4 季量產，落後台積電超過 3 年，而中芯 14 奈米 FinFET 製程將於今年第 4 季開始貢獻營收，製程技術再次落後台積電 3 年。IC Insights 表示，台積電客戶採用先進製程的腳步持續加快，推進 40-45 奈米製程時期，花費 8 季時間，才使營收貢獻達到整體營收的 2 成，而 28 奈米製程僅花費 4 季，就跨越同樣的門檻。不過，7 奈米製程僅花 3 季時間，營收占比就拉升至 2 成，且包括 20 奈米、14 奈米、10 奈米技術均在 3 季內，就成功達到同樣水準，且 5 奈米製程客戶導入速度，預期還會持續加快。IC Insights 認為，受惠先進製程需求強勁，供應將吃緊，且交期會更長，也因此，台積電計劃投入更多資金，擴充先進製程產能。
157,2019/09/26,麗嬰房喜迎旺季+店務調整完成 下半年表現可望優於上半年,連鎖童裝品牌商麗嬰房 () 預購誌電子版上線，盼藉由新服務擴大網購市場布局，麗嬰房指出，上半年已完成大部分店務調整，有望降低費用支出，加上傳統旺季到來，預料下半年整體營運表現將較上半年好。麗嬰房指出，因應商圈轉移和消費型態轉變，上半年約閉店 15%，下半年降低費用支出可期，由於店務調整已大致完成，接下來暫無大規模調整店鋪計畫；目前麗嬰房全台有逾 280 家門市、中國則有逾 300 家。另一方面，隨著秋冬裝陸續上市以及百貨周年慶登場，傳統旺季報到，麗嬰房指出，下半年整體營運可望優於上半年。除了實體門市優化經營，麗嬰房此次新推出預購誌，盼擴大網購市場版圖，也可望為後市添營運新動能。麗嬰房今年前 8 月合併營收為 4.38 億元，年減 20.9%，上半年稅後虧損 9100 萬元，每股堀隼 0.45 元，本月初董事會已決議再實施庫藏股，將原提案買回 3000 張，提高為 5000 張 (500 萬股)，預計將以上限 8.68 億元買回，區間價在 5-10 元。由於麗嬰房 2013 年起連虧 4 年，去年因業外挹注轉盈，但今年上半年仍呈現虧損，本業何時能轉盈受到投資人關注。
158,2019/09/26,【新光證券】盤前分析,◆盤勢分析美國眾院正式對川普啟動彈劾調查，政治不確定風險升溫，拖累美股及走跌，另外，川普於聯合國大會上批評中國，也使得貿易戰擔憂情緒上升，25 日亞股一遍愁雲慘霧，台股也在油電及零組件股重挫下，失守 10900 點關卡，終場收在 10873.69 點，跌 44.32 點或 0.41%，成交額 1062.59 億元。 OTC 指數收在 141.91 點，跌 0.59 點或 0.41%，成交額 311.95 億元。25 日台股收黑 K 棒，險守十日均線，日量不及五日均量，五日線轉為向下，技術面逐漸降溫。籌碼方面，三大法人同步賣超，其中外資期現貨偏空操作。川普的彈劾案，成立容易，但要成功，需要 20 位參院的共和黨成員支持才有機會，難度很高，且美國還沒有總統因彈劾案被下台，預期彈劾案對美朝野對立將惡化，但長期對股市影響有限，接下來關注美中貿易戰發展，若外資重回買超，則台股有機會再攻一波，盤中若大型權值股遭調節，則建議減碼持股因應。
159,2019/09/26,【日盛投顧】盤前分析,"◆盤勢分析1. 美國 8 月年化新屋銷售報 71.3 萬戶，預期 65.3 萬戶，前值 63.5 萬戶。美日 25 日簽署初步貿易協議後，川普表示，美中貿易協議可能比預期更早達成。標普 11 大板塊有 8 個板塊上揚，資訊科技、通訊服務與非必需消費品領漲，醫療保健、房地產與公用事業領跌。週三美股上漲，漲幅介於 0.61 至 1.78％，美股四大指數短期高檔震盪。2. 由以下三個面向檢驗方向及強弱：(1) 量能：回檔量縮或反彈成交量大於月均量方有利大盤反彈延續。(2) 均線：支撐為 10,700 點附近，壓力為 11,000 點附近。(3) 技術指標：KD 開口向下， 9 日 K 值大於 50，短線偏多整理。3. 以的線型及指標角度而言，支撐為 140 點附近，壓力為 144 點附近，KD 技術指標開口閉合，9 日 K 值大於 50，短線偏多但提防拉回。4. 觀盤重點：觀察台股指數是否能守穩在月線之上，回檔是否量縮或上攻成交量大於 20 日均量，台股選股方向可留意 5G、半導體、PCB、蘋概、工業 4.0、生技、內需、運動風、金融、車用、運輸等。5. 史上金額最大的單一商用不動產標售案京華城購物中心，25 日以 342 億價格進行第 4 度標售，結果殺出大黑馬，由京華城大股東 1314 中石化旗下的鼎越開發，以 372 億 1 萬元擊敗出價 300 億的 2542 興富發建設，一舉標得京華城，也坐上新「樓王」寶座。6. 未來 5G 市場將進入大規模商用化階段，屆時扮演收發天線的射頻（RF）元件將成為 5G 關鍵要角之一，高通（Qualcomm）看準這塊商機將推出完整相關解決方案。法人表示，高通 5G 射頻元件訂單已經獨家委由砷化鎵（GaAs）大廠穩懋（3105），一旦 5G 商機開始進入爆發成長期，穩懋未來訂單可望同步看俏。7. 蘋果 iPhone 11 系列手機及三星旗艦機 Galaxy Note10 都搭載新世代無線網路技術 WiFi 6，法人看好，今年底到明年迎來 WiFi 6 換機潮，正文（4906）、合勤控（3704）、明泰（3380）、中磊（5388）、神準（3558）都已經小量出貨，建漢（3062）也積極布局，預期最快今年底放量出貨。"
160,2019/09/26,【鉅亨-盤前掃瞄】技術面,1.5 日均線 10907.02 點，10 日均線 10885.51 點，20 日均線 10765.62 點。2.6 日 RSI 為 49.78，12 日 RSI 為  61.16 。3.20 日乖離率為  1.00。
161,2019/09/26,【鉅亨-盤前掃瞄】基本面,1.25 日交易日以 31.034 兌 1 美元作收，收盤貶 2.1 分，成交值為 8.81 億美元。2. 集中市場 25 日外資賣超  31.1 億，投信賣超  0.2 億元，自營商賣超 22.7 億元。3. 集中市場 25 日融資餘額較前 1 日增加  3.35 億元，成為 1335.38 億元，融券餘額較前 1 日增加  6898 張，成為 792834 張。
162,2019/09/26,摩台結算前回馬槍？10900關攻防 小心結帳亂流,美國總統川普又改口，美中貿易戰協議可望加速達成，美股應聲上漲，立刻將川普的「通烏門」遭到眾議院通過彈劾調查案干擾，拋諸腦後。台股昨日因周選擇權結算，莊家大玩雙巴盤，指數滑落 10 日均線，是否也僅是摩台指結算前的回馬槍? 短線上 10900 點關卡，仍是多空角力關鍵，只不過需提防法人結帳動作持續進行，別成為盤面亂流! 關鍵點位為 10844、10877 與 10906 點。多方如能趁美股反攻，成功再收復 10900 點關卡，並站穩 10906 點之上，昨日的回檔，可視為一日洗盤。站穩 10927 點之後，短多可望重掌控盤權，伺機再往 10944、10977 點挑戰。但如今日再攻 10900 點未能成功，甚至連 10877 點、10844 點都未能站穩，則需提防續往 10827 與 10800 點關卡回測，一旦失守 10777 點，即進入月線保衛戰!外資結束連 14 買，轉為調節，觀察外資調節股，除了面板雙雄與金融股之外，台達電一口氣遭賣超達 1.5 萬張，也使得台達電昨日股價摜破年線，創下除權後新低。外資此一動作，是否意味熱錢準備開始自台股提款走人? 短線上可留意如後續持續賣超，賣超幅度是否擴大? 尤其是對金融股的調節力道，是否轉向電子? 當然，匯率 31 元，仍是重要指標。在個股部分，尤其是法人本季布局持股較多的個股，仍得提防作帳結帳大亂鬥，而且盤面不時出現「拉東出西」的狀況，再次提醒，在目前盤勢此一位階，已出現波段漲幅個股，如爆量再創新高，容易遭到結帳賣壓調節。相對具有集團股色彩，且法人本季並未著墨，近期才開始買超個股，則是 9 月底前相對較具籌碼面優勢! (訊息僅供參考，請勿作為買賣股票之依據)
163,2019/09/26,台股盤前—美中貿易可望提前達成 估將震盪走揚,台股昨 (25) 日受美四大指數走跌影響，開盤跌破 10900 點，尾盤台積電翻紅大盤跌幅收斂，終場下跌 44.32 點，收在 10873.69 點，成交量縮至 1043.89 億元。法人指出，受到美中貿易協議可望提前達成，大盤今 (26) 日可望向上攀揚，站回 10900 點關卡，惟仍將維持震盪整理格局。台北市京華城標售案四度開標，二組投資方搶標，由威京集團旗下中石化透過鼎越開發，以 372 億 1 萬元「自己人」標回，溢價率 8.8%，換算每坪 746 萬元。由於土地開發為中石化雙主軸發展重點之一，看好未來台北市東區辦公大樓市場，決定由鼎越開發參與投標，京華城地上物預計明年初動工拆除，規劃闢建 4 棟地上層 19 樓的頂級商辦，有機會在 2023 年完工。阿里巴巴宣布旗下半導體公司平頭哥，首顆自行研發的人工智慧晶片「含光 800」問世，據了解，「含光 800」採用台積電 7 奈米製程生產，在 AI 應用普及之下，阿里加入人工晶片戰場後，也將為台積電後續營運添動能。聯電獲准併購與富士通半導體 (FSL) 合資的 12 吋晶圓廠日本三重富士通半導體 (MIFS) 全部股權，將於 10 月 1 日完成併購，未來將可為聯電年營收增加 10-12%，提升晶圓代工市佔率，挑戰格芯老二地位。晶片大廠高通搶占 5G 商機，5G 系統單晶片最快於今年底量產，將與聯發科的 5G 系統單晶片正面對決。法人表示，高通 5G 射頻元件訂單已獨家委由砷化鎵大廠穩懋，一旦 5G 商機進入爆發成長期，穩懋未來訂單展望將同步看俏。晶華酒店董事長潘思亮宣布，將在台灣投入「五星飯店 + 豪宅」開發案，規劃以 Regent(麗晶) 為品牌，攜手建商共同打造，目前正在洽談中，第一案可能鎖定台北市精華區，最快明年啟動。元大金控董事會決議，對元大人壽現金增資 140 億元，元大金表示，現增元大人壽主要是基於增資健全財務等三大考量。這也是元大金連續第 3 年對元大人壽增資，力拚元大人壽成為金控第三獲利引擎。法人指出，台股本周陷入漲多拉回修正，外資昨日也中止連 14 買，但受到美中貿易協議可望提前達成帶動，美股周三收漲，短線指數將以盤代跌，大盤今日可望向上攀揚，重新站回 10900 點關卡，惟仍將維持震盪整理格局，可留意季底投信作帳相關概念股。
164,2019/09/26,盤前財經大事搶先讀2019年9月26日,日本 8 月工具機訂單南韓 9 月消費者信心指數美國上週初領失業金人數股東會：聚碩、勝品、和潤企業法說會：東和鋼鐵、明安、明揚、安碁資訊《彭博社》週三 (25 日) 報導，歐盟 (European Union) 打算以牙還牙，對美國逾 40 億美元出口產品加徵關稅。消息人士提到，使用這一戰略的決定尚未達成一致，至少有一個歐盟成員國反對報復關稅想法。交通部觀光局昨 (25) 日公布 8 月來台旅客人次，其中陸客來台近 28.3 萬人次，較去年增加 10.1%，今年 1-8 月更突破 228 萬人次，年增 27.1%，由於中國官方是從 8 月 1 日起暫停自由行申請，不少人早已完成入台證申請，因此陸客來台並未出現衰退跡象，預估 9 月起將明顯下滑。銀行理專盜用客戶款項的弊案頻傳，今 (2019) 年以來開罰案件已破紀錄，外界關切恐還有未爆彈，金管會主委顧立雄昨 (25) 日表示，目前已找銀行總稽核來談，要求落實內控三道防線、「理專十誡」，並要求半年內要全面清查，若之後再發生就會究責到總行。元大金控 () 昨 (25) 日董事會通過，由元大金控對元大人壽現金增資 140 億元，將待元大人壽董事會通過並經主管機關核准後辦理。元大金表示，主要是基於增資健全財務等三大考量，因此決議此增資案，這也是元大金連續第三年對元大人壽增資，力拚元大人壽成為金控第三獲利引擎。週三 (25 日) 中國天風證券分析師郭明錤發表研報，預期 2020 年下半年推出的新款 iPhone 為了支持 5G 技術，金屬中框設計將顯著改變，相信供應鏈工業富聯、可成 () 與美商捷普 (Jabil) 為最大受益者。
165,2019/09/25,〈神盾展望〉挾供貨三星豐富經驗 可望持穩中國市占,市場點名看好，聯詠 () 將把 TDDI(顯示劑觸控整合驅動 IC) 與指紋辨識 IC 整合為解決方案，此舉恐影響神盾 () 指紋辨識 IC 出貨表現，連帶衝擊中國市占率，神盾強調，目前與客戶進展仍順利。神盾指出，與客戶進展雖仍處磨合期，但不久後即可見量，且在定價上給予客戶合理優惠，加上自身獲利能力提升，在產品組合優化下，有助取得中國更高市占。法人指出，神盾指紋辨識 IC 在中國市占率，僅次聯發科轉投資匯頂，穩居中國市場第 2。中國手機品牌大廠為避免匯頂獨大，影響晶片價格，多開始找尋第 2 供應商，神盾先前即為三星中低階機種的獨家供應商，且已量產，在具大廠合作經驗助攻下，神盾可望藉三星發揮指標成效，取得更多中國市場訂單。至於超薄螢幕指紋辨識晶片進度，神盾指出，目前仍持續研發，但因晶片製程是以更大面積換取厚度，所需晶圓產能較大，因此還在取得平衡點，且晶圓需求與成本是正相關，因此內部持續研究，取得最大效益。法人認為，聯詠在指紋辨識 IC 是後進者，神盾因有出貨三星經驗，且已與中國一線大廠合作，聯詠短期難影響供應比重，再者，神盾將隨著 OLED 在三星供應鏈滲透率提升，加上自身獲利成長，明年可望迎來營收、獲利雙成長。
166,2019/09/25,市場派質疑六大缺失 大同：對不實刊載提刑事自訴,大同 () 經營權之爭越演越烈，市場派代表三圓建設董事長王光祥，質疑大同董事會有六大缺失，已喪失經營管理職能，公司派回擊，該缺失已經北院裁定駁回，發言與法院裁定不符，已委任律師對王光祥就不實刊載，向法院提起刑事自訴。王光祥質疑，大同公司派有 6 大缺失，包括財報不實被移送法辦、違法背書保證、違法投資越南、違法竄改隱匿股東提案內容、剝奪股東投票權、違法刪除股東提案等，已喪失經營管理職能。王光祥表示，大同去年稅後虧損超過 332.92 億元，創史上虧損最嚴重的紀錄，旗下華映、綠能、尚志 3 家子公司，淨值也轉為負數下市，顯示董事會已喪失經營管理職能，董事會、審計委員會屢有弊端，且連續 3 年違法刪除、變動股東提名董事候選人及提案，股常會惡意縮短投票時間剝奪股東表達意見及參與權利。王光祥指出，依法規定，持有 1 年以上、持股逾 3% 股東，可請求董事會召開股東臨時會，若董事會不同意，股東可報請主管機關許可自行召集，而羅得、競殿、三雅投資，總持有大同股權 11.59%，不過今年 5 月請求董事會召開股臨會，但未獲同意，因此決定依法請經濟部許可自行召集。大同則表示，王光祥所指六大缺失，已經北院裁定駁回，發言與法院裁定不符，並散佈於眾，有損公司聲譽，已委任律師對王光祥就不實刊載向法院提起刑事自訴。
167,2019/09/25,電源、工業自動化需求弱 台達電Q3旺季獲利恐不如預期,台達電 () 受到筆電、電信電源供應器需求疲弱，加上工業自動化 (IA) 業務尚未復甦，外資及本土法人均認為，恐衝擊第 3 季及全年營收及獲利表現不如預期。美系外資出具報告指出，台達電受工業自動化業務復甦不如預期、今年併入的泰達電 (DET) 也尚未發揮效益，影響毛利率表現，下修今年獲利預估 2%，全年每股純益 9.56 元，重申中立評等，目標價由 165 元下修至 150 元。國內法人指出，台達電筆電客戶擔憂美中貿易戰衝擊，已在第 2 季提前拉貨，另外，歐洲電信客戶需求也疲弱，導致下半年以來，電信電源業務成長因此放緩，都影響第 3 季營收、營益率及獲利表現。不過，法人指出，雖然台達電目前電源、工業自動化等業務訂單能見度有限，但電動車能見度仍高，主要是許多車載專案將於明年展開。法人預期，配合客戶電動車推出時程，台達電電動車業務明年起將進一步加速成長，幅度將超越今年的 5 成，且預計 2021 年將開始獲利，挹注營運動能。
168,2019/09/25,鴻海強化歐洲生醫市場布局 增資夏普生命科學歐洲子公司3.1億元,"鴻海 () 強化歐洲生技醫療市場布局，今 (25) 日晚間公告，透過子公司對轉投資的 Sharp Life Science (EU) Limited (夏普生命科學歐洲子公司) 增資 800 萬元 (約 3.1 億元)，另外，鴻海同時公告，透過關係人交易，調整轉投資電視品牌 Vizio 的持股。鴻海晚間公告，子公司 Sharp FMSG Life Science Company KY，以每股 500 元、總價 800 萬元，取得 Sharp Life Science (EU) Limited 1.6 萬股。據了解，Sharp Life Science (EU) 主要是發展生技、醫療產業工作流程自動化解決方案，利用在微電子學和精密製造領域的專業知識，重新構想現代實驗室，因此，鴻海此次增資，被視為強化在歐洲生醫市場的布局。鴻海也同時公告指出，子公司 AFE, INC. 以每股 48.52 美元，處分 Vizio 51.52 萬股，交易總金額約 2500 萬美元，交易對象則為另一子公司 Foxconn Assembly Holding Corporation。鴻海強調，此股權交易案，主要是調整投資架構，調整後，AFE 的 Vizio 持股全數出脫，Foxconn Assembly Holding Corporation 則持有 Vizio 約 3.1% 股權。"
169,2019/09/25,郭台銘退黨遭慰留 重申決心「無黨一身輕」,鴻海 () 創辦人郭台銘申請退黨，但國民黨表態慰留，對此，郭台銘透過辦公室發出聲明，堅決表達「退黨」立場，強調郭台銘絕不接受慰留，現在更已是「無黨一身輕」。郭台銘日前大動作宣布退黨，更親手寫下退黨聲明，但國民黨於 25 日在中常會中，做出慰留的決議，不過郭辦發聲明強調，郭台銘已經堅決表達「退黨」立場，也絕對不接受中常委的慰留，盼大家好聚好散。郭台銘幕僚、永齡基金會副執行長蔡沁瑜下午接受媒體訪問時更透露，郭台銘下午跟朋友一起去打球，心情相當好，因為他創業數十年以來，首次在平日邀與朋友打球，主要就是無黨一身輕「太開心了」。至於外傳郭台銘將創辦「TGI 郭台銘學院」，蔡沁瑜指出，目前每天都在研究，未來會比較像組織，但現階段組織架構與名字都還沒確定，會以日本松下政經塾做為參考、目標，也不排除實際走一趟日本實地考察。蔡沁瑜強調，未來學院希望培養政策經濟、媒體科技、政治選舉人才等等，為社會國家來服務，招募對象要對政治、科技立法，甚至是媒體、公共事務參與有高度興趣，希望可以藉此解除政治亂象、跳脫藍綠。
170,2019/09/25,智崴前董座提民事訴訟 控告董事會改選無效,遊戲體感設備大廠智崴資訊 () 今 (13) 日公告，遭到前董座黃仲銘向高雄地方法院提起民事訴訟，訴訟聲明包括今年 6 月董事會改選董座無效等，並願供擔保，請高雄地方法院對智崴宣告假執行。智崴強調，董事會為依法改選，已委請律師評估起訴狀與相關證據資料，維護公司權益。智崴今年 6 月在董事會上，改選董事長，前董座黃仲銘依法解任，由潤泰集團長春投資公司法人董事代表人陳志全接任智崴董座；智崴目前持股單一最大股東為智崴總經理歐陽志宏、持股約 6.83%，前董事長黃仲銘持股約 5.38%，但潤泰集團以多家公司持股智崴，為智崴最大股東，持股約 15%。智崴董事會過去每 3 年改選一次，但今年因故提前改選，黃仲銘則因改選後遭解任，因此向高雄地方法院提起民事訴訟，訴訟聲明包括今年 5 月 13 日智崴召開的董事會中，解任董事長及選任董事長決議無效，並願供擔保，請高雄地方法院對智崴宣告假執行。黃仲銘並提出，智崴應給付其新臺幣 11 萬 3333 元，及自起訴狀送達翌日起，按年利率 5% 計算的利息；給付其新臺幣 24 萬元，及自起訴狀送達翌日起按年利率 5% 計算的利息；給付其新臺幣 24 萬元，及自追加起訴 (二) 狀送達翌日起按年利率 5% 計算利息；且應從今年 7 月 1 起至明年 6 月 30 日止，在每月 5 日前，給付其新臺幣 20 萬元。對此，智崴強調，今年 6 月董事會為依法進行改選，已委請律師評估起訴狀與相關證據資料，以維護公司合法權益。
