,date,title,content
528,2019/09/18,信紘科下半年營收估持平上半年 全年營收年增上看3成,半導體設備商信紘科 () 展望下半年，財務長王怡文表示，製程機能水已小量出貨，隨著客戶擴廠計畫持續進行，信紘科將可受惠，下半年營收估持平上半年，全年營收年增更上看 3 成。王怡文表示，信紘科今年採策略性接單，以具擴廠需求的客戶為主要訂單來源，全年營收表現不俗，年增上看 3 成，前 8 月營收已達 7.95 億元，年增 27%，法人預期月營收將持穩在 1 億元以上。不過，信紘科指出，今年接單均以擴廠客戶為主，因此影響一部分毛利率表現，明年將減少策略接單，毛利率估可回穩至 23-26% ，加上台灣、中國半導體設備需求漸增，明年營運動能看增。王怡文指出，看好環保趨勢，除原先經營的製程特殊廢液處理，近期已開發出製程機能水，取代台廠以往由美、日為主供應商，將提供給晶圓代工廠更有效且環保清洗液，目前小量出貨，預計明年開始放量，有助營運表現。王怡文強調，信紘科客戶仍以國內為主，營收比重達 85%，預計未來將瞄準海外市場，尤其是中國，主要因其半導體自產化加速，設備需求量逐漸明朗，可望隨中國市場成長帶動，有助營收成長。
529,2019/09/18,台積電明除息2元市值估減518億元 台股開盤蒸發17.36點,證交所今 (18) 日公告，台積電 ()、華孚 () 等 2 檔股票將在明 (19) 日除息，其中台積電發行市值將減少約 518 億元，2 檔股票除息後，台股明日開盤將減少約 17.36 點。台積電明日將除息 2 元，除息參考價為 267.5 元，預估市值將減少約 518 億元，占發行量加權股價指數約 17.32 點。
530,2019/09/18,壽險公會力推保險區塊鏈平台 8大壽險把關驗證測試,壽險公會今 (18) 日表示，推動「保險區塊鏈聯盟科技運用共享平臺」計畫自今 (2019) 年 5 月啟動至今，由 8 大壽險公司擔任驗證測試，測試已進入最後尾聲階段，未來一旦上路， 希望透過此平台發展保單電子化存摺、保險快速理賠、保險犯罪防治等業務。壽險公會表示，為推動壽險業導入金融科技，藉以改善業界的行政作業效率及作業成本，並提供保戶更好的服務體驗，該會偕同財團法人保險犯罪防制中心共同推動「保險區塊鏈聯盟科技運用共享平臺」計畫，自今年 5 月開始啟動。壽險公會說明，本計畫初期採取概念驗證 (POC) 方式，先以主管機關於去年核復同意的保單電子化方案為基礎，利用區塊鏈技術的分散式儲存及不可否認的特性，就跨公司電子化保單資料的統整及存證作業導入區塊鏈技術驗證其可行性，並由台灣人壽、國泰人壽、中國人壽、南山人壽、新光人壽、富邦人壽、三商美邦人壽及元大人壽等 8 家會員公司參與相關驗證測試工作。壽險公會表示，未來希望以此為基礎發展保單電子化存摺，讓消費者可以方便地掌握自身及家人的保單狀況，作為適時檢視調整保障內容的參考，而日後就保單內容若有所爭議時，亦可透過此平台提供具公信力的保單內容作為認定的準據。壽險公會表示，本計畫目前已進入測試尾聲，將根據測試結果進行平台端及公司端系統的流程改進及優化工作，仍須一定作業時間後才能正式上線。此外，因保戶在申請契約保全變更或保險事故發生後申請理賠時，常因有投保多家或多張保單，而需奔波於不同公司提出申請，造成保戶時間的浪費與不便，加上目前已有部分會員公司，如台灣人壽、國泰人壽、新光人壽等，與醫院洽談合作，就所屬公司保戶住院就醫時的資料與公司理賠系統進行串接，達到快速理賠的目的。為解決理賠奔波的問題，壽險公會在金管會保險局指導下，邀集會員公司組成專案小組，由新光人壽及國泰人壽代表分別擔任召集人及副召集人，負責統籌相關事宜，就保全及理賠服務導入區塊鏈技術的可行性進行研議，初步將以部分保單基本資料的變更及日額型醫療險的理賠申請為範圍，透過於平台單一申請的推播，即可讓保戶投保的各家公司都收到相同申請，並在當事人同意的情形下將理賠審核所必須的就醫資料於投保的公司間進行互通，以加快保險公司的契約變更及理賠審核工作。壽險公會表示，本案若在適法性、技術面及相關的資安、風控及消費者權益確保等層面上均屬可行，將於報主管機關核可後開始推動。至於在保險犯罪防制用途上，壽險公會表示，仍將偕同會員公司與犯防中心在現有基礎上持續合作，並在此平台及技術運作成熟後逐步運用作為防制保險犯罪及防制洗錢打擊資恐等相關用途。
531,2019/09/18,泰碩前8月稅後純益年增2.56倍 EPS 2.11元,散熱模組廠泰碩 () 今 (18) 日公布 8 月自結，受惠手機新品陸續出貨，加上貶值，前 8 月稅後純益 1.82 億元，年增 2.56 倍，每股純益 2.11 元，展望後市，法人表示，5G 商轉腳步加快，基地台出貨量可望成長，泰碩營運將旺到明年。泰碩今日公布自結，8 月營收 4.32 億元再新高，月增 5.39%，年增 16.13%；稅後純益 3700 萬元，月增 19.35%，年增 8.82%；每股純益 0.43 元。泰碩累積前 8 月營收 28.17 億元，年增 32.32%；稅後純益 1.82 億元，年增 2.56 倍；每股純益 2.11 元。展望後市，泰碩因應新客戶及下半年銷售旺季，產線持續擴增，預期手機散熱模組，出貨將逐季成長，法人估，步入下半年銷售旺季、新機陸續上市，下半年毛利率可望挑戰 25%，較上半年成長 2 個百分點。
532,2019/09/18,連三凍！經濟部決議 10月起電價費率不予調整,由於長期能源價格下跌，經濟部今（18）日召開電價審議委員會，決議 10 月起電價將不予調整，維持平均電價每度 2.6253 元，首創連三凍紀錄。經濟部表示，目前電價穩定準備餘額尚有 435 億元，為避免短期電價波動對物價造成影響，決議本次電價不調整，未來會依台電公司 2019 年實際盈虧情形運用電價穩定準備進行檢討。經濟部表示，燃料成本是影響電價的主要因素，而造成燃料成本變化的因素包括國際能源價格及匯率波動。目前國際預測原油及煤炭價格長期呈現下跌趨勢，且整體能源需求成長趨緩。雖然近期發生沙烏地阿拉伯油田遭空襲的突發事件，可能導致原油供給減少而使短期油價上升，但隨即產油國表示可望於 9 月底恢復產能，長期來看，能源價格仍屬下跌趨勢。經濟部指出，依公用售電業電價費率計算公式，電價調整頻率為 1 年檢討 2 次，原則為 4 月及 10 月進行，且明定平均電價調幅最高 3% 的限制。
533,2019/09/18,金管會獲頒《亞洲風險》雜誌「2019年最佳主管機關獎」,國際財經專業雜誌《亞洲風險》今 (2019) 年於新加坡舉行「第 20 屆亞洲風險獎 (Asia Risk Awards)」頒獎典禮，我國金管會獲頒本年度「最佳主管機關獎 (Regulator of the Year)」殊榮，並由金管會副主委張傳章代表領獎。《亞洲風險》每年評選「亞洲風險獎項」，表彰亞洲地區風險管理與衍生金融商品相關領域具有卓越成就者。該雜誌就金管會近年推動保險業風險監理強化措施的成效，及參酌外界對金管會風險管理政策的評價，評選金管會為本年度「最佳主管機關獎」，顯示金管會近年實施強化臺灣金融業相關風險管理的成果獲國際間認同及肯定。金管會表示，將持續秉持「沒有最好，只有更好」的理念，掌握重要金融監理議題發展面向、及時因應國內外經濟環境的快速變化，持續提供多元監理方針，以兼顧健全金融產業發展、維持金融市場穩定及保障金融消費者權益。
534,2019/09/18,〈MOD推自選餐〉搶東奧商機 明年4K機上盒用戶數將倍增達110萬戶,中華電 () 今 (18) 日宣布，除 MOD 推出 3 款「自選餐」外，也備戰 2020 東京奧運，董事長謝繼茂指出，已在洽談 IPTV 轉播權，並啟動 4K 機上盒升級計畫，目前約有 40 萬戶使用 4K 機上盒，預計明年東京奧運前，用戶數將成長 1.75 倍，達 110 萬戶。謝繼茂表示，為迎接即將登場的 2020 東京奧運，中華電已啟動 4K 機上盒升級計畫，雖然機上盒本來就會定期汰換，有正常汰換時程，但用戶也可免費申裝，估今年底前 4K 機上盒戶數將達 50 萬戶，明年受惠東京奧運，200 多萬 MOD 用戶中，將有 110 萬戶使用 4K 機上盒。東京奧運版權費用方面，謝繼茂指出，以 IPTV 轉播權為主，目前談到的金額為 1800 萬，不含稅金與傳輸費，不過，希望能組個團隊，如無線電視、有線電視等一同合作。另外， 5G 方面，NCC 日前公告「行動寬頻業務管理規則」，釋出頻譜包含 1.8GHz、3.5GHz 及 28GHz 頻段，合計 2790MHz 頻寬，中華電董事會今日決議，參加 108 年行動寬頻業務釋照競標。謝繼茂日前指出，3 個頻段競標總價 300 億元，雖然價格比預期高，但也接近目標價，預期競標回合數將較少，此外，開台初期將以自用網路為主，暫不會有商業談判的打算。
535,2019/09/18,陽明交大合校表決通過 最快明年8月正式掛牌,"備受矚目的陽明大學與國立交通大學合校案有重大突破。兩校今 (18) 日個別召開校務會議，表決通過合併計畫書，共同朝「國立陽明交通大學」（National Yang-Ming Chiao Tung University, YMCT）邁進，預估最快明年 8 月掛牌，將替台灣培育更多生醫理工跨領域人才。陽明大學表示，今日以 65 名校務會議代表同意、20 名校務會議代表不同意，超過 3 分之 2 通過合併計畫書。交大的部分，則以 59 名校務會議代表同意、15 名校務會議代表不同意，同樣超過 3 分之 2 通過合併計畫書。兩校的合校計畫書已於校務會議通過，接下來將送教育部，期間仍會與兩校往返溝通，預估最快明年 2 月行政院將正式核定，隨後將遴選陽明交大新校長，可望在明年 8 月正式掛牌。合校後的首任校長遴選，參與遴選者須分別獲得兩校 2/5 以上專任教師同意，才能取得候選資格，21 名遴選委員中，將納入 2 名學生代表。合校後將採單一校務會議運作，總人數 120 人，兩校區各占一半。"
536,2019/09/18,台股8月成交值萎縮 券商單月獲利月減逾3成,台股 8 月走跌收黑，拖累券商獲利表現，三大核心業務經紀、自營與承銷全數衰退，全體券商 8 月稅後純益 38.94 億元、月減 33.14%，累計前 8 月稅後純益 278.97 億元、年減 1.83%。觀察券商三大核心業務表現，自營業務單月稅後純 11.29 億元、月減 56% 居冠，承銷業務單月稅後純益 2.12 億元、月減 23.19%，經紀業務單月稅後純益 22.63 億元、月減 8%。券商表示，8 月美中貿易戰全面升溫衝擊，引發資金棄股轉債進而削弱市場投資信心，單月交易量降至 2.62 兆元、月減 2.38%，股價走跌、交易量下滑使得自營商與經紀業務同步萎縮，連帶拖累獲利表現。另外，今年前 8 月券商經紀與自營獲利都比去年同期減少，其中經紀業務因大盤成交值下滑，累計稅後純益 152.73 億元、年減 34.13%，自營業務稅後純益 92.2 億元、年減 0.26%，承銷業務獲利雖逆勢成長，累計前 8 月稅後純益 21.8 億元、年增 15.83%，但仍不敵自營與經紀業務衰退，整體券商前 8 月稅後純益年減 1.83%。
537,2019/09/18,〈MOD推自選餐〉推3款自選餐 最高僅350元 MOD業務今年力拚虧轉盈,中華電 () 今 (18) 日宣布，MOD 將推出 3 款「自選餐」，包括自選 20、自選 50 及全選，價格最高為月付 350 元，董事長謝繼茂表示，目前 MOD 客戶數約有 210 萬戶，預估至明年底前將有 7 萬戶選擇新方案，而今年隨著用戶數成長，MOD 業務可望轉虧為盈。謝繼茂表示，MOD 已發展 15 年，推出自選餐，是希望客戶除能選擇自己喜歡的頻道，也可自由更換頻道，滿足看多少、付多少的消費潮流，未來頻道服務還有很多創新空間，期盼可共創 MOD、頻道營運商、消費者 3 贏局面。MOD 自選餐中，頻道涵蓋電影、戲劇、體育、新聞、綜合及兒少節目等，「自選 20」月付 200 元，可自由挑選 20 個頻道；「自選 50」月付 300 元，可挑選 50 個頻道；「全選」則是月付 350 元，可收看超過 190 個頻道，含免費收視頻道。MOD 客戶數方面，謝繼茂表示，目前客戶數近 210 萬戶，站穩國內第一大影視平台，明年因有東京奧運，預期會再增加 20 萬戶數，2022 年登場的世足賽，訂戶數將飛躍式成長，MOD 業務預估最快今年全年就可轉虧為盈。謝繼茂指出，將不干預現有用戶是否訂購「自選餐」，但預期推出後反應將會不錯，估明年底前將有逾 7 萬戶選擇新方案。節目內容部分，謝繼茂指出，目前已投資「魂囚西門」，未來也將篩選節目題材，進一步投資，不會自製節目。
538,2019/09/18,〈半導體展開展〉沈榮津：台灣將積極發展智慧晶片 拚打入全球5G供應鏈,國際半導體展（SEMICON Taiwan）今 (18) 日在南港展覽館登場，下午舉行科技智庫領袖高峰論壇。經濟部長沈榮津致詞表示，台灣半導體朝向積極發展智慧晶片，政府也將推動台灣成為全球 5G 供應鏈的主要夥伴。沈榮津表示，台灣去年半導體產值超過 2.6 兆元，是帶動經濟成長，刺激產業創新的重要的基底，目前台灣半導體政策朝向發展智慧晶片，並結合 AI 人工智慧的相關應用，建立業界所需的智慧系統應用關鍵技術。政府利用台灣半導體產業的優勢，持續推動 5+2 產業創新的應用，來推升台灣在全球產業價值鏈的關鍵地位。沈榮津指出，5G 與 AI 將是台灣下一波產業成長的動能，經濟部已啟動 AI on Chip 的研發補助計畫，從系統應用角度發展智慧裝置 AI 晶片，並連結人工智慧物聯網（AIoT），促進台灣成為全球 AI 創新研發基地，以及 AI 系統輸出國。此外，行政院也核定台灣 5G 行動計畫，為 5G 系統測試平台提供有利的資源，同時也提供 5G 應用的試驗環境，協助廠商跨越 5G 技術門檻，以達成台灣成為全球 5G 供應鏈主要夥伴的目標。沈榮津表示，政府近年來努力優化國內投資環境，積極針對影響產業所面臨的缺水、缺地、缺電、缺工、缺人才等五缺的關鍵問題，提出具體的因應對策，並持續為產業界排除投資障礙。未來經濟部會持續聆聽國內高科技產業投資的相關問題，同時，也鼓勵半導體業界持續加碼投資台灣。
539,2019/09/18,台積電明將除息2元 資金湧進市值攀近7兆元,晶圓代工龍頭台積電 () 受惠中長期半導體需求支撐，加上半導體展開幕、市場也押寶除息行情，資金持續湧進，昨日 ADR 股價收漲逾 1%，今 (18) 日股價再創還原權值新高，午盤後一度衝上 269.5 元，市值更攀升至 6.988 兆元，逼近 7 兆元關卡。台積電明 (18) 日將除息 2 元，除息參考價為 265 元。台積電 8 月營收達 1061 億元，再寫歷史新高，月增 25.2%，年增 16.5%，7、8 月營收已達 1908 億元，第 3 季營收表現可望順利達陣，甚至不排除超標。台積電第 4 季營收展望也正向，預期營運將持穩向上，下半年逐季成長，而近期蘋果新機 iPhone 11 發表後預購情況優於預期，其中平價機種 iPhone 11 頻頻追單，市場看好供應鏈營運表現，而台積電做為主晶片供應廠商，營運將直接受惠。另外，中國挖礦公司比特大陸甫發表的第三代 AI 晶片 BM1684，該晶片採用 12 奈米製程，將用於雲端與 AI 邊緣運算，隨著價格走穩，相關需求也將有助台積電第 4 季營運。
540,2019/09/18,〈半導體展開展〉談AI發展 林百里：須思考商業模式與創新,國際半導體盛會 SEMICON Taiwan 今 (18) 日正式開展，廣達 () 董事長林百里表示，在半導體他只是一位小人物，未來發展仍需要持續思考商業模式改變與學習創新，AI 將是未來發展的重點之一。林百里表示，台積電 () 董事長劉德音說，摩爾定律還可以持續 60 年，則不能篤定，畢竟廣達只是做一個箱子，然後把半導體產品塞進去，因此未來重點在思考商業模式與創新。林百里也強調，2016 開始發展的 AI 人工智慧 (Artificial Intelligence)，相信還有很多的成長機會。隨著 AI 人工智慧發展，林百里表示，預估 2035 年 AI 對各國的 GDP 貢獻度將超過 0.8% 以上，台灣 2035 年 GDP 達 1.9%，納入 AI 後 GDP 可達 3.6%，隨著 AI 發展，預期也會有很多大公司陸續出現。林百里表示，今年 AI 發展呈現大三角對決，美國領先、中國超車、歐盟緊追，美國在人才、研究、發展、硬體領先，但在應用、資料方面則是中國領先，歐盟則位居兩者之後，而觀察現階段國際九大企業，包含 Google、Microsoft、amazon、Facebook、IBM、Apple、百度、阿里巴巴、騰訊都積極朝向雲端發展。林百里也提出未來的產業發展，從電腦服務 Computer、雲端計算 Computing 到提供 AI 解決方案 Solution，他也再次強調， AI 將結合 + HI(Human Intelligence)，未來也將更重視人文隱私，現在的使用者也更聰明意識到自我隱私保護，而包含麻省理工學院 MIT、史丹佛 Stanford HAI 都推出相關的課程甚至是創立學院的計畫。
541,2019/09/18,〈半導體展開展〉台灣半導體業如何揮灑下個60年榮景 劉德音提四大方向,「2018 國際半導體展 (SEMICON Taiwan)」今 (18) 日登場，晶圓代工龍頭台積電 () 董事長劉德音表示，由於摩爾定律仍存在，樂觀看待半導體發展，將持續至下個 60 年，對於台灣半導體產業如何保持競爭優勢，迎向下個 60 年榮景，他提出四大方向。去年 SEMICON Taiwan 適逢積體電路發明 60 周年，台積電創辦人張忠謀在開場專題演講中，回顧過去 60 年半導體產業的創新技術發展，而劉德音今年擔任「科技智庫領袖高峰會」首位演講者，便以「台灣半導體發展的下個 60 年」為題。劉德音表示，積體電路至今已問世超過 60 周年，未來半導體將持續快速發展，各項創新應用更深入生活層面，在生活中無所不在，半導體業發展是否能持續至下個 60 年，他樂觀看待，因為直到今天，摩爾定律仍好好存在著。至於台灣半導體產業如何保持競爭優勢，以揮灑下一個 60 年的榮景，劉德音提四大方向，第一，要發展成全球科技業不可或缺的夥伴，國內半導體廠商在全球佔有舉足輕重的地位，但近來在動盪的國際局勢下，從材料到封裝等產業鏈，都需共同努力，以鞏固全球夥伴的地位。第二，加強半導體產業基礎研發動能，從近期的國際局勢來看，半導體躍然成為許多國家策略發展重點，盼產學研能密切合作，政府能擬定研發投資的稅率優惠及提供產學研發展基金等，以鼓勵台灣半導體業及國家研究機構，投入資源，推進研發動能，也讓人才能發揮所長。第三，積極發展綠色製造，為因應未來經濟發展成長，半導體企業與政府更須在這片土地上，發展潔淨能源，對環境永續不遺餘力，讓產業與環境能共生共榮。第四，未來 10 年 5G、甚至 6G 等新技術，將更加速人工智慧應用的發展，必須推展 AI 與 5G 等新技術，導入先進製造的應用中，且新科技應用將再次顛覆想像，高速運算為產業帶來更快且更大的突破。
542,2019/09/18,因應貿易變局 二大選股方向避開中國賺更大,在美中貿易戰下，投資風向也跟著轉向，過去紅極一時的「中概股」已不是市場追逐焦點，反倒是能適時移動供應鏈、產能分散才是未來贏家。在「避開中國賺更大」的選股前題下，有二大方向值得重視。第一、能夠分散產能，獲利還能提高的公司；第二、中國布局本來就不高，技術含量又高。以此兩大指標追蹤上市櫃企業的獲利變化，勝算頗高。《財訊》報導指出，美中貿易戰反反覆覆的談判過程，企業決策者猶如置身雲霄飛車，各大台商也正上演一齣齣「出中國記」，各大企業的中國布局，也成為股東會、法說會的必考題。不過，台商在 1989 年六四事件後，率先進入中國，從華東開始，接著移到華中，再深入內陸如四川、河北設廠，和中國當局有著千絲萬縷的牽連，不管是關廠或縮編，都不能明說，以免刺激了愛面子的官方。從上半年上市櫃企業的財報數字，卻不難發現 1 年多來，台商漸漸改變整體布局，企業的獲利結構也開始出現轉變，有三大方向：中國投資遲緩近停滯、中國收益匯回趨緩、中國投資損益大幅縮減。根據《財訊》報導，從企業的長遠布局來看，美中不管是貿易戰、經濟戰，都是一場持久戰，中國因應勞工及經營成本高漲，本來就需要進行結構轉型，企業若能因應產品特性，分散產能供應，並進行質量升級，是非常健康的作法。今年上半年的財報中，EPS 較去年同期維持成長，且來自中國認列獲利比重逐年下降的公司，可視為已經有因應貿易戰的能力，值得注意。這種公司可分為三大類型：加碼非中國地區的產能、跨足新事業布局、新需求景氣循環帶動。除了轉型成功的案例，台灣還有很多企業，基於技術性或行業特性，中國資產、獲利占總公司的比重本來就不高，在 10% 以下，但依舊能維持高獲利，其中，台積電 ()、大立光 () 就是代表，其次是 IC 設計業，如果沒有特別針對中國內需，比重不會太高。整體而言，在「避開中國賺更大」的選股前提下，最能因應貿易變局的公司，將是長期追蹤的方向。
543,2019/09/18,〈半導體展開展〉劉德音：5奈米製程明年將急速擴張 2奈米製程研究中,「2018 國際半導體展 (SEMICON Taiwan)」今 (18) 日登場，晶圓代工龍頭台積電 () 董事長劉德音表示，台積電 5 奈米今日剛走出研發階段，明年將是急速擴張的一年，目前研發主力在 3 奈米，至於 2 奈米製程，目前持續研究中，且每周都有新的創意出現，令人振奮。劉德音今日擔任 SEMICON Taiwan「科技智庫領袖高峰會」首位演講者，就台積電技術發展來看，劉德音指出，7 奈米今年是第 2 年量產，已生產超過 100 萬片 12 吋晶圓，技術更達車用規格，是全球最領先的技術；5 奈米也在今日走出研發階段，準備進入量產，明年將是急速擴張的一年。研發進度方面，劉德音表示，目前研發主力著眼 3 奈米，3 奈米進步非常令人欣慰，2 奈米也在未來製程技術規劃中，目前台積電正研究中，每周都有新創意。從客戶產品來看，劉德音說，半導體的進步不只微縮，已發展到 3D IC、雲端設計等，與客戶進行架構創新，半導體進展將不再以面向考量，而是以密度、運算能力為指標，他並說，若每個人口袋都有量子電腦，相信台積電不會從中缺席，未來半導體發展的可能，將持續在眼前展現。
544,2019/09/18,〈群曜醫電新品〉磁控上消化道內視鏡將進軍中國市場 搶近400億商機,雷射標籤廠光群雷 ()，旗下轉投資群曜醫電成功研發磁控上消化道內視鏡，除在台上市外，也將進軍中國市場，董事長郭維武表示，目前已進入審查階段，最快 2021 年底前開賣，並將與醫療通路合作，搶近 400 億商機。據統計，全球 5 億胃病患者中，中國就占 1.2 億人，每年約有 2000 萬人次需照胃鏡，中國類似膠囊內視鏡檢查的市場規模，每年上看 90 億元 (約 393 億元)，且需求逐年快速成長。群曜已於江蘇無錫新高區設新廠，預計 2020 年 3 月正式投產，並和北京大學、吉林大學等指標性大學醫學部附屬醫院，進行臨床試驗項目合作簽約。群曜表示，目前磁控上消化道內視鏡，已送件食品藥品監督管理總局 (CFDA) 審查，預計最快 2021 年第 4 季能開賣，將為營運添新動能，且開賣後，新廠房產能很快就能達到滿載。歐美市場方面，群曜指出，歐美國家每年約有 1400 萬人次有照胃鏡的需求，預計磁控上消化道內視鏡，能在 2021 年上市，目前市占率可達 5%。
