,date,title,content
344,2019/09/23,〈財委會質詢〉機車汰舊換新減稅業者配合意願低 財長：貨物稅減徵方向不變,行政院指示財政部研議，針對機車汰舊換新提供貨物稅減徵優惠，傳出機車業對於配合減徵降價意願興趣不大，但財政部長蘇建榮今 (23) 日受訪時表示，汰舊換新貨物稅減徵加碼還是會做，但目前尚無具體細節。蘇建榮今天出席財委會總統專機走私菸品進行專案報告，會後受訪時針對行政院指示研議的機車汰舊換新貨物稅減徵方案做上述回應。據了解，財政部研議的機車汰舊換新貨物稅減徵方案，鎖定 125CC 以下並且符合六期環保排放標準的新機車，每輛新車減徵稅額擬從現行的 4000 元提高至 5000 元，優惠時間預計為期 5 年。蘇建榮今天受訪時指出，目前貨物稅條例的第 12 條之 5 提供氣缸排氣量 150CC 以下的舊機車，出口或報廢登記滿一年且出廠滿 4 年以上，並在出口或報廢日後 6 個月內購買新車並完成領照，購車時每輛能享有 4000 元貨物稅減徵優惠。蘇建榮說，機車汰舊換新貨物稅減徵推行方向不變，至於是從現有的貨物稅條例第 12 條之 5 延長並加碼，或是另外針對環保機車另訂新方案，目前尚無具體草案，但他也補充，未來貨物稅稅率調整會與能源稅一併考量，不會針對單一貨物調整稅率。
345,2019/09/23,英濟Q3旺季營運登全年高峰 下半年將優於上半年,"塑膠零組件廠英濟 () 第 3 季旺季力道強，營運可望達全年高峰，且下半年營運將優於上半年，今年全年獲利也可望優於去年，除塑膠零組件本業外，近來積極佈局光電事業，將透過雷射掃描投影技術切入 AR 領域，明年上半年推出 AR 商用化模組，為營運挹注新動能。英濟表示，下半年適逢營運傳統旺季，今年第 3 季旺季力道強勁，營運可望登全年高峰，下半年整體獲利表現將優於上半年。由於今年費用管控得宜，有機會帶動毛利率與純益率表現較去年成長，估今年獲利將較去年持穩，甚至可優於去年。英濟目前主力產品為數位、通訊、消費性、汽車與醫療器材等類型塑膠零組件，營收占比超過 9 成，塑膠模具營收占比則約 6%。不過，英濟近來積極轉型，持股 100% 子公司英綺投入光電事業研發，先前已發展出市場尚未普及的雷射掃描投影 (Laser Beam Scanning, LBS) 技術，與國際知名大廠合作開發新技術、新產品，包括手機、穿戴裝置、家電及車用抬頭顯示器等。雖然目前 LBS 技術仍以代工為主，但英濟規劃走商用化佈局，搶攻 AR 硬體應用市場，切入 AR 顯示解決方案，預計明年上半年正式推出 AR 商用化模組，為營運挹注另一波成長動能。英濟今年前 8 個月累計營收 31.99 億元，年增 4.67%。第 2 季稅後純益 1532 萬元，較上季與去年同期轉盈，每股純益 0.12 元；上半年稅後虧損 6335 萬元，每股虧損 0.48 元。"
346,2019/09/23,宏觀雙動能看俏 Q4將迎全年營收高峰,射頻晶片廠宏觀 () 隨著東奧需求明朗，且中國廠商去美化動作加快，新客戶陸續導入，電視相關 IC 成長動能看俏，同時，衛星出貨持續暢旺，雙引擎驅動下，宏觀第 4 季將挑戰全年營收高峰。法人指出，宏觀三大射頻產線成長穩健，包括電視、機上盒、衛星，其中，電視營收比重 37%，近期受惠東奧需求明朗，且品牌廠以 4K/8K 出貨挽救銷售量，高階晶片需求看增，有助拉升產線毛利率，預計第 4 季開始出貨，有助營運表現。再者，衛星產線持續成長，主要受惠客戶採用 SoC(系統單晶片) 的趨勢，加上產線布局完整，有助市占率提升，預計出貨動能將從第 4 季開始，延續至明年第 1 季。至於機上盒產線，受俄羅斯標案帶動，7 月出貨明顯增溫，與博通合作的射頻晶片也將在第 4 季開始小量出貨，營運成長動能強勁，且 2020 年將有另 2 顆整合型 IC 問世，可望為營運挹注新活水。整體而言，宏觀三大產線皆朝正向發展，加上布局光纖產線有成，可望在 5G、資料中心等應用發酵下，帶動營收進一步成長，法人估，宏觀今年每股純益可望突破 11 元。
347,2019/09/23,〈5G頻譜競標〉NCC：5家業者共拿7份招標書 12/10開始競標,5G 頻譜即將在年底開始競標，NCC 代理主委陳耀祥今 (23) 日表示，受理 5G 第 1 波釋照，5 家電信業者共拿 7 份招標書，預計 12/10 公開競標，競標將採兩階段。陳耀祥表示，5G 申請受理時間截止時間為 10 月 3 日，目前 7 份招標書中，有 2 家電信業者因備份所需，拿 2 份招標書。NCC 日前公布首波頻譜底價，3.5GHz 頻段釋照底價 243 億元、28GHz 頻段底價 25 億元及 1800MHz 頻段底價 32 億元，3 個頻段合計 300 億元，陳耀祥重申，標金底價是經過專業團隊評估後擬出的價格，「不算太低」，符合國際標準，且國內不會發生流標的情況。企業專頻方面，陳耀祥指出，雖然國外已有相關案例，國內 5G 也以 B2B 為主，未來是否開放，仍在與行政院協商當中，未來也會試驗半年至 1 年的時間。至於 6G 方面，陳耀祥表示，台灣 5G 是前段班，未來發展到 6G，仍有衛星接收的問題需要克服。
348,2019/09/23,高鐵南延經費 陳美伶：政策確定後 將有完整財務規劃,國發會主委陳美伶今 (23) 日表示，受美中貿易衝突、英國脫歐等影響，今年全球經濟成長率預測頻下修，但台灣受惠台商回台帶動投資動能，全年 GDP 可望穩定成長；針對高鐵南延經費從何而來，陳美伶強調，這是確定的政策，國發會將有完整的財務綜合規劃。陳美伶今天赴立法院經濟委員會報告業務概況，並備質詢。針對高鐵南延屏東議題，陳美伶指出，依照行政流程，交通部目前正在進行 4 條路線的可行性評估，因此尚未報行政院，若交通部完成評估、送入行政院，接下來才會交給國發會審查。陳美伶強調，高鐵南延是確定的政策方向，國發會會有完整的財務綜合規劃，才會開始編列預算，未來將按照工程時程安排，且早在前瞻基礎建設計畫中就已納入，未來是要完成行政流程，要外界不必擔心。全球經貿動能持續走弱，陳美伶則指出，根據 IHS Markit 9 月預估，今年全球經濟成長率將由 1 月預測的 2.9% 下修至 2.7%，美國、區及中國分別下調至 2.3%、1.1%、6.2%，經濟下行風險有增無減。不過，陳美伶表示，台灣因受惠台商回台帶動出口及投資動能，基本工資調升、旅遊補助及節能家電汰舊換新補助等，可望帶動民間消費溫和成長，因此，主計總處已於上月調升今年經濟成長率至 2.46%，全年 GDP 可望穩定成長。
349,2019/09/23,東和鋼鐵越南廠高價原料庫存去化完畢 下半年獲利逐季成長,東和鋼鐵 () 受惠台灣出貨持穩，加上越南廠稼動率提升、高價廢鋼原料庫存去化告一段落，法人看好，前 3 季獲利可望超越去年全年，第 4 季進入旺季，加上越南廠逆風因素排除，毛利率可望較第 3 季略增，獲利也將隨之成長，下半年獲利將逐季揚升，全年更可較去年顯著增加。法人分析，東鋼上半年每股純益已達 0.71 元，第 3 季估持平第 2 季，累計前 3 季每股純益將超越去年全年 0.88 元，第 4 季入旺季，獲利將更上層樓。東鋼越南廠去年下半年開始，受越南海關檢查趨嚴、流程拉長，因此墊高廢鋼進口成本，不過，今年第 3 季末，越南廠高價原料庫存可望去化完畢，回到以往的正常水準。原料廢鋼成本在煉鋼總成本中，占比約 7 成，原料回穩有有助提振毛利率表現，另外，越南廠在去年變壓器爆炸狀況排除後，稼動率也攀升，是改善獲利表現的另一大關鍵因素。至於台灣市場方面，東鋼表示，目前出貨都是過去接的中長期的訂單為主，加上廢鋼價格修正，也拉大利差空間，目前台灣廠區的毛利率持穩 1 成以上。以東鋼目前產能來看，越南廠設計產能約 60 萬噸，可生產鋼筋、小型材、線材，台灣則有桃園、苗栗、高雄 3 個生產基地，約有 150 萬噸的鋼筋產能、型鋼 120 萬噸，總產能約 330 萬噸。東鋼認為，越南市場雖然沒有那麼快起來，但預計隨著當地政府擴大基礎建設，都將帶動鋼筋及鋼構需求，且未來也將以越南做為東南亞市場的發展基地，拓展柬埔寨等地的市場。
350,2019/09/23,半導體產業推動AI發展 科技部制定科研8大準則,科技部今 (23) 日舉辦 AI 人工智慧科研發展指引記者會，科技部部長陳良基表示，半導體產業是推動 AI 人工智慧最重要的產業，台灣也掌握領先技術，將透過政策輔助產業培育人才，並加強基礎研究投入，而科技部也制定科研指引，提出 AI 科研 8 大準則。陳良基表示，AI 科研核心價值為以人為本、永續發展、多元包容，科技部也與台大、成大、清大、交大分別設立 4 個 AI 人工智慧研究中心，並提出 8 大準則，包含共榮共利、公平性與非歧視性、自主權與控制權、安全性、個人隱私與數據共治、透明性與可追溯性、可解釋性、問責與溝通。除了訂定 8 大準則，陳良基表示，人類進入到數位時代，資料將推升 AI 自主學習演化，因此科技部除了輔助科研團隊，也要求團隊將所有程式原始碼保留，包含 AI 應用學習過程中的資料都要保留，並把關提供數位資料人員具備人文倫理。目前全球有提出相關準則的國家組織，包含歐盟提出 AI 人工智慧倫理準則、日本提出以人為本 AI 社會原則、OECD AI 準則、IEEE AI 道德設計準則。陳良基解釋，科技部訂定 AI 科學研究指引而非法令的訂定，主要是因為現階段 AI 人工智慧還在發展，加上 AI 應用將會滲透到日常生活、各行各業，包含自駕車、機器人、智慧醫療，因此在法令的訂定上，後續要配合各項應用發展去制定。陳良基表示，半導體產業是推動 AI 人工智慧最重要的產業，而台灣也掌握這方面的領先技術，面對前陣子半導體產業呼籲政府要協助產業培育人才、基礎研究，他表示，這 2-3 年在基礎研究上有長足的經費投入，也會持續投入新興項目，如 2 奈米製程、量子電腦，吸引更多年輕學子進入產業。
351,2019/09/23,〈財委會質詢〉總統專機私菸案 財長：法人部分沒有走私問題,立法院財委會今 (23) 日針對總統專機涉嫌走私菸品要求相關部會進行專案報告，在野黨立委問，運輸私菸到底是走私還是超買？財政部長蘇建榮說，私菸案要從法人與自然人兩個角度來看，法人部分是由華航委託華膳存放在保稅倉庫內，未將菸品從國外運輸入境內，沒有走私問題。總統專機 7 月 22 日遭踢爆涉嫌違法走私菸品，案發迄今滿 2 個月餘，立法院財委會新會期開議就鎖定私菸案，要求財政部、金管會、國安局、總統府與交通部等相關部會進行專案報告。國民黨立委賴士葆質詢時問，總統專機私運菸品案是「走私」還是「超買」？蘇建榮答詢說，這要從法人與自然人兩大層面來看，法人部分，根據北檢偵查結果，認定本案是華航委託子公司華膳存放保稅倉庫內，該菸品已在境內，處於保稅狀態，並非從國外「輸入」至境內，因此未涉及菸酒管理法第 45 條第 2 項輸入私菸罪，應該由菸酒管理法進行行政裁處。至於自然人部分，北檢則以違反貪汙治罪條例與稅捐稽徵法，就相關部分人員進行起訴，根據刑事優先原則，因此行政法暫緩處理。財政部強調，對於檢察官不起訴或緩起訴等未涉及刑責部分，台北關已經取得刷卡訂購明細，後續將啟動相關行政調查，待調查結果後再分由權責機關依法裁處。
352,2019/09/23,三大因素 外資再喊買南亞科 目標價上看95元,美系外資最新出具報告，看好南亞科 () 出貨動能，第 3 季位元銷售量季增幅上看 3 成，再者採用 20 奈米製程，成本也管控得宜，第三是獲利動能轉佳，三大因素推升下，重申南亞科「買進」評等，目標價由 80 元上調至 95 元。外資認為，即便 DRAM 大廠三星目前 DRAM 晶片庫存水位仍相當高，但庫存多為伺服器 DRAM，讓南亞科有機會投入其他包括消費性電子、車用或 PC DRAM 領域，另一方面，三星縮減資本支出，晶片庫存水位快速降低，對南亞科營運有利。由於 DRAM 供需逐步平穩，南亞科 9 月初時，上調本季位元銷售量季增幅度，由 14-16% 上調至逾 25%。不過，外資指出，從通路消息來看，在中國市場新筆電與智慧型手機訂單動能強勁下，南亞科第 3 季位元銷售量表現可望更強勁，季增幅上看 3 成。外資看好，南亞科今年下半年在新訂單增加下，位元銷售量成長動能強勁，庫存也可望在第 4 季末回歸合理水位，樂觀看待明年銷售表現。
353,2019/09/23,富致3動能推升營運 掛牌首日大漲逾3成,保護元件廠富致 () 今 (23) 日轉上櫃，法人看好，在下游庫存去化告一段落，加上物聯網、車用、工控 3 大應用帶動下，第 4 季營運可望回溫，明年更將重返成長軌道，富致掛牌參考價 30 元，盤中大漲 33.17%，最高來到 39.95 元。富致今年受到美中貿易戰影響，終端客戶拉貨動能較緩，不過，在下游庫存去化已告一段落，加上近期 TWS 蓬勃發展，帶動保護元件需求成長，公司看好，下半年營運可望優於上半年，也優於去年同期。據了解，富致保護元件主要交給日系客戶 JVC，再藉此打入如小米等終端品牌供應鏈，不過，富致認為，TWS 動能雖強，但電子產品需求波動大，較屬於短期動能，中長期還是得靠工控、車用及能源應用。富致指出，工控應用受惠貿易戰，各國企業均強化在地生產，帶動自動化及設備等需求，至於車用方面，隨著汽車內部的電子系統比重提高，加上電動車蔚為趨勢，都將推升保護元件需求同步增加，可望成為推升明年營收年增上看 1 成。
354,2019/09/23,台股盤中－美中談判橫生枝節 陸股下跌 平盤附近狹幅震盪,美中貿易談判再現變數，中國赴美參訪行程突然喊卡，美國總統川普放話，無須在 2020 大選前達成協議，拖累美股上周收黑，亞股今 (23) 日漲跌互見，陸股跌幅約 1%，台股在電子三雄走弱下，開盤下跌 4.88 點，以 10924.81 點開出，盤中一度黑翻紅，惟漲幅隨即收斂，法人表示，本周有摩台指結算與投信法人季底作帳，將影響台股能否續朝萬一前進。觀察權值股表現，電子三雄開盤走弱，大立光、鴻海盤中一度由黑翻紅，不過盤中持續平盤附近震盪，台積電也在平盤遊走，台塑四寶方面，台塑早盤開小紅，盤中紅翻黑，台塑化及台化則在盤下震盪，南亞相對抗跌，漲幅 0.4%。PCB 族群成盤面焦點，嘉聯益延續上周漲勢，加上受惠高頻天線材料趨勢明確，一度觸及漲停，惟盤中收斂，漲幅逾 7%，銘旺科開盤即攻上漲停鎖死，來到 22.65 元，南電、敬鵬漲幅逾 3%，欣興、精成科、定穎漲幅逾 2%。個股方面，iPhone 11 系列新機銷售優預期，供應鏈營運增溫，光學鏡頭廠玉晶光，早盤跳空開高震盪，最高至 442 元，漲幅逾 2%；聲學元件廠美律，早盤帶量強彈 4%，攻上季線，並創兩個來高點。法人表示，台股在技術面、籌碼面偏向多方，但美中貿易戰的不確定性，仍舊影響投資市場信心。
355,2019/09/23,〈金管會備詢〉國安人員刷卡買私菸 顧立雄首表態：玉山銀皆符合規定,國安人員吳宗憲藉總統出訪專機之便，夾帶走私免稅菸，針對國安人員透過玉山銀行信用卡刷卡買菸金額竟高達 645 萬元，引發外界疑慮是否有洗錢之虞，對此，金管會主委顧立雄今 (23) 日於立法院首度對外公開表示，經查玉山銀行目前都有符合相關規定。財委會今天邀請財政部長蘇建榮、金管會主委顧立雄、國家安全局長邱國正等相關單位就「108 年 7 月總統專機違法走私菸品案相關調查、處分及改善作為」進行專題報告，並備質詢。國安人員吳宗憲夾帶走私免稅菸，涉案人每一筆訂單都是用玉山銀行發行的同一張信用卡刷卡，總金額竟高達 645 萬元，由於只是一個國安單位的少校，為何可以動用如此高的信用卡額度，引發外界關切玉山銀行是否有符合洗錢防制的申報？顧立雄表示，這部分有洗錢防制相關規定，玉山銀行經查都有符合相關規定。根據辦理信用卡業務機構防制洗錢及打擊資恐注意事項範本規定，客戶沒有正當理由且與其身分、收入明顯不相當，突然同一營業日累計溢繳且領取 50 萬元（含等值外幣）以上的金額者或有其他明顯不正常的交易行為等情況，應特別注意。如果認為有疑似洗錢或資恐的交易，除了應確認客戶身份且留存記錄及交易憑證外，並應自發現疑似洗錢或資恐交易日起 10 個營業日內向法務部調查局辦理申報。
356,2019/09/23,六福村全年來客增逾1成可期 六福估最快明年轉盈,旅遊集團六福 () 董事長莊豐如指出，由於政府積極刺激國旅觀光，而六福村適逢 40 周年推動一連串主題行銷有成，今年前 8 月入園人次成長 10%，維持全年挑戰總入園人次 160 萬、年增 14% 的目標，至於全集團轉盈，預計時間點最快落在明年。莊豐如表示，今年六福村除持續鞏固家庭親子客群，也強化企業家庭戶、樂齡族群布局，並規劃一系列生態主題活動，以增加不同來客，前 8 月入園人次成長 10%，在觀光大環境低迷之際逆勢成長實屬不易。另外，對於飯店經營，目莊豐如指出，陸客衰退衝擊整個觀光市場，不過，旗下六福萬怡酒店下半年進入旺季，又受惠於南港展覽館舉辦展期吸引商務客，餐飲和住房表現仍不會差。莊豐如直言，觀光業景氣不佳，六福皇宮吹熄燈號不會是唯一，房東沒有共體時艱，不過，六福皇宮結束營業後反而對獲利面有利，集團整體最快明年轉虧為盈，惟仍有些變數。莊福文教基金會長期關注犀牛保育，在 9 月 22 日世界犀牛日和六福旅遊集團聯合辦「紅鼻子挺犀牛．鐵牛三項運動會」。
357,2019/09/23,安力重慶二廠新產能Q4逐步開出 車用領域也有新斬獲,金屬壓鑄及沖壓件廠安力 - KY() 8 月營收以 1.44 億元創 9 個月來新高，重慶新增的重慶二廠預計第 4 季開出新產能，逐步貢獻營收，安力並進一步鎖定在天然氣、汽車應用等非資訊應用產品，2020 年新產能開出後，車用產品線將成中、長期推升獲利關鍵。安力 8 月營收為 1.44 億元，月增 7.55%，年增 6.62%，累計前 8 月營收 9.2 億元，年增 3.3%。第 4 季除新廠產能陸續完工開出，也是原有產品旺季，安力 - KY 預計，美中貿易戰紛擾下，營收仍可維持成長。安力 - KY 去年起，在散熱產品壓鑄及沖壓件產品外，積極進行市場多元布局，並鎖定中國內需民生、5G 光纖、伺服器、電動車等領域，成果可望自今年第 4 季起顯現。安力 - KY 的新產品則深耕中國民生內需市場，與重慶當地的大企業開發天然氣產品，產能方面重慶廠二廠廠房工程已完工，預計第 4 季生產線產能開出後，2020 年起逐步貢獻營收安力 - KY 開發車用部分，在汽車內構件及電控類相關應用產品已有進展，目前汽車中控面板相關產品開始出貨，汽車電裝馬達內構件及其他電控類應用，今年第 4 季也會小量出貨，為佈局車用產線及整體長遠營運考量，安力湖州擴廠計畫持續進行，2020 年產能開出後車用產品線應為該公司中、長期推升獲利的關鍵。
358,2019/09/23,統一證輔導聚恆科技 9/30登興櫃,統一證券 () 主辦輔導聚恆科技 () 9 月 30 日將登錄興櫃，並於 9 月 25 日先行辦理興櫃前法人說明會。聚恆資本額 5 億元，有別於太陽能模組廠，主要從事 EPC 太陽能系統建置商 Engineering (設計)、Procurement (採購) 和 Construction (施工)，也稱工程總承包商，當上游模組廠價格越低，有利於降低電廠建置成本，並提高售電投報率。統一證券資本市場部副總經理郭麗雲進一步指出，綠電是全球大勢所趨，國際大廠蘋果、谷歌均要求 100% 使用再生能源，加上國家政策大力支持，太陽能建置廠商 EPC 獲利持續攀高，國內太陽能產業有一定比例的穩定內需市場，不隨國際環境而大幅波動。統一證配合政府綠能產業發展政策，積極推動 EPC 產業籌資或進入資本市場，8 月剛完成主辦承銷樂士 () 現金增資 3.3 億元，進能服 () 登錄興櫃市場，均為 EPC 太陽能系統建置商。聚恆成立於 1998 年，以太陽能電廠 EPC 為主要業務，並率先推出全台唯一雙保政策，對投資人提供發電量保證和台電躉購合約相同期限 (20 年) 保固服務。除了現有太陽能電廠 EPC 業務外，聚恆正開發節能、儲能和系統智能控管技術，並與大亞集團策略合作投資太陽能電廠，可帶來 15-20 年長期且穩定的收益。聚恆去年全年合併營收 11.7 億元，每股純益 (EPS)2.15 元。
359,2019/09/23,川普又變臉 10900關再玩豬羊變色？,美國總統川普趁美股「四巫日」，對美中貿易戰談判又出聲變臉，美股應聲回檔，而目前多頭紮營在 10900 點關卡的台股，也要陪玩豬羊變色? 台股能否不甩美股再登高，高檔電子族群將扮演關鍵角色。關鍵點位為 10844、10877 與 10906 點。多方攻勢能否延續，或進入回檔，今日的關鍵價位為 10906 點，如能站穩 10906 點之上，無礙多方攻勢，將可續往 10927、10944 推進，而要闖 11000 點關卡，10977 為最重要的灘頭堡。但如今日未能守住 10906 點，台股恐進入回檔，下方 10877 與 10844 點為回檔幅度指標，如棄守 10844 點，回檔震盪幅度恐將擴大。台股本波內外資法人齊心合作，大買高價股與電子權值股，讓指數在 10900 關卡紮營，蘋果新機開賣，蘋果股價未上漲慶賀，台股蘋概股今日能否隨 iPhone 11 銷售開紅盤，尤其是電子三王，能否穩住，最好能再往上登高，才可望推升指數更上層樓。但如高檔高價電子出現獲利調節賣壓，則需留意資金是否轉進傳產，或其他低位階、低價電子，如類股間也出現「豬羊變色」，台股順勢進行位階調整，指數維持在高檔盤整，對闖關 11000 點，並非壞事。另外，時序進入 9 月下旬，第三季法人作帳結帳，以及集團作帳進入倒數，投資人也需提防法人大幅認養股，提前出現結帳賣壓，短線漲幅已大、法人持股水位明顯較高的個股，投資人搶進需謹慎，以免遭到短套。(訊息僅供參考，請勿作為買賣股票之依據)
