,date,title,content
656,2020/09/19,〈美擴大管制華為〉華為占營收比重逾4成 相互訂單驟減本業難有表現,不敵美中貿易對抗及川普對華為的嚴格管制衝擊，軟硬結合板相互 (6407-TE) 將整併產能，全面終止在台生產，未來生產集中大陸常熟廠，主要原因在於，相互客戶華為出貨占比逾 4 成，在訂單縮減下，全年本業恐難有表現。相互主要客戶端包括鴻海 ()、致伸 ()、舜宇、歐菲光、丘鈦科技等手機鏡頭模組廠，終端客戶則為華為等非蘋陣營手機廠，相互發言人林維鵬指出，去年營收華為占 5 成、今年上半年占營收也達 4 成。受到美國擴大管制華為的禁令影響，相互在今年 8 月底起陸續收到模組廠客戶暫停出貨通知，林維鵬指出，華為訂單驟減，造成相互產能利用率大減，嚴重影響營運，在運輸成本及客戶地區屬性的考量下，公司決定做出整併產能的決定， 終止在台生產業務，未來生產集中在大陸常熟廠。相互 2020 年上半年營收下滑且由盈轉虧，上半年營收 15.28 億元，毛利率 8.83%，年減 13.67 個百分點，稅後虧損 2616 萬元，較去年同期由盈轉虧，每股虧損 0.34 元。相互在 7 月及 8 月營收都較去年同期下滑 4-5 成，在產能利用的低落之下，全年本業恐難獲利， 不過林維鵬對於下半年營運不提預測性的看法。林維鵬指出，相互的產品在 PCB 的分類上屬於軟硬結合板，與華通 ()、燿華 () 產品屬同一類別，不過，華通及燿華的軟硬結合板有來自美商蘋果的支持，僅相互則為非蘋陣營。
657,2020/09/19,〈美擴大管制華為〉相互全裁撤在台產能 同步終止泰山新廠33億元投資案,全球手機鏡頭模組軟硬複合板最大供應商相互 (6407-TE) ，不敵美中貿易對抗及川普對華為的嚴格管制，今 (19) 日董事會決議將整併產能，全面終止在台生產，未來生產集中在大陸常熟廠，將在年底前裁撤在台人員 600 人；同時，原規劃在新北市泰山 33 億元投資新建廠案也取消。相互今天並由發言人林維鵬赴 OTC 說明董事會決議。相互預估，今年底前對新莊廠的產能裁撤之後，總體產能將減少約 50%，人員資遣費用預估為 1.1 億元，另有資產減損認列 1.9 億元，這也是繼軟板廠嘉聯益 ()、PCB 廠定穎 () 之後，PCB 產業在台的大量解僱員工狀況。 興櫃掛牌的 PCB 廠相互公司，目前股本 8.21 億元，台灣廠位於新莊、大陸廠則設立於江蘇省常熟，主要產品為手機相機鏡頭模組板及軟硬複合板，主要客戶端包括鴻海 ()、致伸 ()、舜宇、歐菲光、丘鈦科技等手機鏡頭模組廠，終端客戶為華為等非蘋陣營手機廠。相互決定裁撤台灣新莊廠之後，加上原規劃在新北市泰山 33 億元投資新建廠案也決議取消，台灣僅剩由 700 人縮減為 100 人的企業總部，且僅保留財務、研發等間接人員，等於在台全無產能可提供。相互原規劃在新北市泰山工業區投資建立新廠及研發總部案，去年 11 月 7 日由經濟投資台灣事務所 33 億元，原預估完工後增加就業人員 200 人，現在也確定落空，原有的新莊廠還要裁撤掉 600 人，員工裁撤預估費用達 1.1 億元，將消化對客戶交貨後，分批裁撤。相互原規劃在新北市泰山工業區投資建地 4244 坪，去年取得成本約 12.19 億元，相互將該土地加以出售，目前台灣北部地區工業地產交易夯，已有其他廠商因需求而積極洽談中，應不致造成處分損失，出售後將償還 9.75 億元的銀行貸款，也有助降低負債比。相互今年因泰山廠興建現增籌資 3.6 億元，也將變更用途，以其中 1 億元償還銀行借款，2.6 億元用於充實營運資金。
658,2020/09/19,輝達併安謀、蘋果新品發表、FED維持零利率 本周大事回顧,輝達本周宣布，將以 400 億美元併購全球矽智財龍頭安謀，創下半導體產業最大併購規模，蘋果也在本周發表新品，推出首款搭載 5 奈米晶片的平板，以及手錶等新品，FED 最新談話則指出，將維持近零利率政策至 2023 年底，也暗示經濟復甦之路仍漫長；台股本周收在 12875.62 點，上漲近 200 點，周線連二紅，以下是本周大事回顧：輝達 (Nvidia) 在美國時間 13 日發布新聞稿宣布，正式以 400 億美元併購軟銀旗下半導體事業安謀 (Arm)，創下半導體產業最大併購規模，輝達也表示，合併後結合兩企業優勢下，輝達將成為人工智慧時代下，首屈一指的晶片運算企業。不過，外界認為，隨著輝達併購安謀，安謀的第三方中立性優勢將逐漸縮小，有助 RISC-V 取得更多機會，晶心科總座林志明也看好，RISC-V 相關業績將在未來十年保持成長，預計在 AI、AIOT、生物辨識等領域，可率先看到產品發酵。蘋果本周三在加州庫比蒂諾市舉行線上秋季發表會，一共推出端款軟、硬體新品，包括 Apple Watch Series 6、Apple Watch SE、第八代 iPad、第四代 iPad Air、健身與運動服務以及 Apple One 搭售服務等。其中，最受矚目為今年新款 iPad Air 將首度搭載 5 奈米晶片，由晶圓代工龍頭台積電打造，晶片內部電晶體高達 118 億個；採用 6 核心 CPU 設計，性能較前代提升 3 成； GPU 採用 4 核心架構，性能也較前代提升 3 成，未來在 iPhone 也可望看到同款晶片。美國聯準會 (FED) 周三宣布最新利率決定，維持接近零利率政策，且依據最新聲明，有 17 位官員中預計至少到明年，利率將保持接近零，有 13 位預計利率維持不變至 2023 年。FED 主席鮑爾也提到，FED 將監視事態發展，並適當調整政策計劃，同時預計今年 GDP 萎縮將比先前預測有所減少，但未來幾年的復甦將放緩，也再度示警，未來前景仍充滿高度不確定性。台灣央行本周四召開第三季理監事會議，會後除了宣布連二季利率不變，也上修我國今年經濟成長率 (GDP) 至 1.6%，較上一季的預測上修 0.08 個百分點，也高於主計總處 8 月 14 日的預測值 1.56%。央行維持利率連二凍，重貼現率、擔保放款融通利率和短期融通利率分別 1.125%、1.5% 和 3.375%，仍是史上最低，楊金龍定調目前貨幣政策為寬鬆，並說明，維持利率不變理由有二點，分別是此次央行上修我經濟成長率，及下修物價年增率至負值，並表示「不會有通縮疑慮」。晶圓代工龍頭台積電總裁魏哲家周四表示，全台灣都是台積電的基地，會持續在台深耕發展，也不排除赴高雄投資的可能；在採用綠電方面，會以「很大的承諾」，回應政府做出的努力。台積電本周進行除息，每股配息 2.5 元，除息參考價 455.5 元，不過，受美國科技股走跌影響，外資呈現連兩賣，本周終場收在 444 元，除息行情罕見失靈，也導致台股走勢疲軟。新光金子公司新光人壽因投資業務等 5 大缺失違反保險法，遭金管會重罰 2760 萬元，新壽董事長吳東進祭出停職處分至任期屆滿，另外，投資長袁宏隆副總與投資長職務也遭解除，且不得擔任與投資相關職務。新光金也公告，新壽新任董事長將由現任新光金董事長許澎接任，但此人事案仍有待金管會核准，外界指出，許澎在新光金控貢獻近 50 年，向來是吳東進最信任的下屬，此次接任新壽董座也符合市場期待。街口集團執行長胡亦嘉多次隔空嗆聲金管會，周四再度大動作召開記者會批金管會濫權，對此，金管會表示，胡亦嘉申請出任街口投信董事長的認可案，因胡亦嘉不配合提供學經歷證明，金管會已於昨日駁回申請案，最重不排除對街口投信撤照。
659,2020/09/19,〈熱門股〉江申兩岸車市均有利多 周漲逾13%挑戰前高價,裕隆集團旗下汽車零組件大廠江申 () 8 月中旬以來股價強勁上揚，過去二周漲多整理後，本周再度轉強，周漲 13.5%，周線終結連 2 黑，最高來到 74.3 元，有再戰前高價位 80 元意味。法人指出，由於中國車市持續回穩，帶動汽車零件需求落底回升，再加上我國六期環保上路前商用車需求有望提前發酵，下半年江申營運可望優於上半年，而明年上半年再優於今年下半年，呈現成長態勢。據中汽協統計，8 月汽車產銷連 5 個月增長，其中，銷量已連 4 個月增速保持 10% 以上，法人認為，中國車市自第二季以來呈逐月成長態勢，加上日本和歐美地區急需備足汽車零件庫存，江申獲利面應已於上半年落底。另一方面，法人著眼於台灣商用車需求將推升江申出貨，原因在於六期環保上路後將使汽車售價上升，預期商用車買氣於下半年至明年上半年將提前發酵，有助推升江申的本業表現，預料其營收將逐季成長，並於明年上半年達到高峰。江申是台灣最大的車架和木製後車斗供應商，同時轉投資廣州和襄陽恩梯恩以經營中國的汽車零組件市場，主要生產汽車傳動軸、底盤、客車車架等，而廣州恩梯恩裕隆已切入特斯拉美國廠供應鏈，供應 Model 3 傳動軸。
660,2020/09/19,〈熱門股〉力麗環保紗線獲蘋果擴大採用 周漲逾3成改寫33個月高價,聚酯纖維加工廠力麗 () 環保紗線獲蘋果擴大採用，不只音箱、傳輸線，更打進蘋果新款 Apple Watch 的編織材錶帶，本週股價滾量上攻，大漲逾 3 成收 12.55 元，一舉突破前波新高，改寫 33 個月高價。蘋果發表會除了展示出 Apple Watch Series 6、Apple Watch SE 等兩款智慧手錶外，也推出新款的編織單圈錶環，官網更強調，編織單圈錶環採用具延展性再生紗繩與矽膠線編織而成，無錶扣無扣環的設計，配戴舒適。力麗也證實，環保聚酯原抽色紗線「ReEcoyA」，今年起的確開始應用在客戶新款智慧錶的錶帶上，在客戶除了與編織廠合作外，負責 Apple Watch 組裝的中系及台系代工廠也前來接洽取經。力麗近年環保紗線頻頻獲蘋果青睞，除了打進初代智慧音箱 Homepod 的外層網布外，今年更大有斬獲，不僅打進智慧錶帶供應，傳出打進編織線材，大啃蘋果商機。
661,2020/09/19,〈熱門股〉雙鴻上修營運展望 股價創波段新高收復短均,散熱大廠雙鴻 () 受惠韓系手機客戶拉貨力道回溫，加上 5G 高速傳輸帶動散熱需求強勁，及既有伺服器需求推升，上調營運展望，激勵本周股價走勢強勁，站穩所有短均，周五 (18 日) 收在 240.5 元，創波段新高。雙鴻為韓系手機品牌主要供應商之一，今年受到新冠肺炎疫情、美中貿易戰持續蔓延，手機需求疲軟，客戶訂單量也減少，壓抑本季營運；不過，近期需求顯著回溫，第三季營運估可優於第二季，第四季也將更好。雙鴻同樣受惠伺服器需求帶動，尤其疫情帶動宅經濟、電競與雲端需求增加，雙鴻旗下品牌客戶包括 Facebook、AWS 及 Google，占出貨比重約 5 成，其中 Facebook 需求最強，全年伺服器營收仍可年增 15%。據雙鴻 7、8 月合計營收 21.28 億元來看，與第 2 季營收 29.9 億元僅有 8.62 億元缺口，據悉雙鴻 9 月營收可望維持 10 億元，第 3 季營收可望季增 5% 以上。雙鴻指出，筆電、伺服器、顯示卡等需求動能延續，其中，部分高階筆電將導入單價較高的熱板，有助毛利率成長，整體來看，下半年營運仍不看淡，全年目標年增 15%，續拚創新高。
662,2020/09/19,〈熱門股〉新品、購物節挹注動能 晶碩股價衝新高,和碩 () 旗下隱形眼鏡廠晶碩 () 在中國、日本需求回溫下，8 月營收衝上歷史次高，法人看好，下半年晶碩在客戶新品推出、購物節旺季需求帶動下，營運可望逐季成長，本周股價再衝新高，周漲 14.74%，最高來到 227 元。法人表示，晶碩受惠中國、日本市場需求回溫，加上電商平台銷售也在疫情助推下，優於預期，看好晶碩今年營運谷底落在第 1 季，下半年在客戶新品推出後，可望再挹注營運成長，全年將逐季成長。晶碩目前產能利用率達逾 9 成，因應客戶需求，晶碩正積極調整產線、提升產量，桃園大溪擴廠計畫也持續進行，根據規劃，大溪廠預計明年下半年土建完工，估投產後最大月產能可達 4600 萬片，加上目前龜山廠產能已接近 4000 萬片，月產能將可達 8000 萬片以上。晶碩 8 月營收達 3.49 億元，月增 25.71%、年增 23.99%，為歷史單月次高紀錄，累計今年前 8 月合併營收達 21.84 億元，年增 5.32%。
663,2020/09/19,台股周線連二紅 留意華為、疫情潛在風險,台股在多空拉鋸下，單周上漲 199 點、收在 12875.62 點，週線驚險收紅，法人指出，後續須觀察電子族群是否受華為禁令影響，壓抑出貨動能，至於觀光、傳產則要留意疫情二度復發等潛在風險。在資金動能持續挹注下，台股本周大漲近 200 點，上市公司總市值跳升至 39.1 兆元，但資金短線輪動快速，反覆遊走在電子、傳產族群，在多空拔河下，度朝 13000 點叩關，最後仍無功而返。安聯台灣科技基金經理人廖哲宏表示，美國對華為制裁禁令 15 日正式生效，因此後續須觀察，包括手機製造、光學零組件等部分供應鏈需求是否受華為出貨禁令影響而受壓抑。廖哲宏進一步說明，考量部分禁令對電子族群的潛在影響，台廠相關供應鏈營收表現，將是未來重要觀察指標，因此可作為觀察明年上半年手機供應鏈動能的參考。廖哲宏表示，近期盤面主要以 IC 代工相關族群表現相對強勢，其他冷門類股因著各自題材輪；在國際情勢上，則隨著美國大選時間逼近、更多潛在科技禁令、地緣政治風險，以及疫苗進度左右明年國際觀光差旅消費動能等變數。富蘭克林華美第一富基金經理人周書玄表示，科技股修正整理時間已經超過一個月以上，短線觀察到部分科技股有低接買盤進場，科技股動能有轉強的走勢。至於台股後續是否持續向上，突破區間整理格局，技術上仍要看成交量是否可以放大超過前波高點，3525 億元成交量，大盤才有機會更進一步向上挑戰。周書玄分析，短線來看，會以科技、傳產與消費類股輪動為主，在科技類股走弱的期間，也可挑選傳產中具發展趨勢者來布局；而操作上，建議可觀察蘋果新品是否帶動相關供應鏈表現。
664,2020/09/19,〈熱門股〉敬鵬擺脫谷底Q3營收回溫 量能放大填息,全球第二大汽車板廠敬鵬 () 7 月起汽車板需求回溫，本周股價上漲 4.58%，收在 27.4 元，完成填息。敬鵬 8 月營收 12.37 億元，連三月逐月成長，汽車板訂單已見回溫跡象，後續營收視全球車市能否翻揚，及敬鵬供應的汽車板車種及地區別而定。敬鵬第二季底每股淨值 37.78 元，18 日股價上漲 2.24%，收 27.4 元，股價淨值比只有 0.725 倍，技術線型站上所有短期均線，並突破兩個月來整理平台，KD 值交叉向上，如成交量能持續放大，將有助突破前波段高點的 28.3 元。
665,2020/09/19,〈熱門股〉太極碳化矽受矚目 本周強漲23%創新高,太陽能廠太極 () 碳化矽 (SiC) 基板已送樣客戶測試，預計最快明年第一季量產，激勵市場買盤進駐，本周股價強漲 23%，終場收在 34.8 元，創下歷史新高。太極看好，碳化矽是第三代半導體材料，因具備元件體積小、耐高壓、高溫等優勢，將大量應用在高壓功率元件，目前已透過中科院專利授權，跨足碳化矽領域，瞄準碳化矽的長晶與基板需求。太極也預計在今年國際半導體展 (SEMICON)，展出 4 吋與 6 吋的碳化矽基板。太極本周突破前方盤整區，沿五日線走高，周五更開高走高，收最高 34.8 元，創下歷史新高價，單周強漲 23%，籌碼方面，外資買超最積極，大買 484 張。
666,2020/09/19,〈熱門股〉外資不挺 台積電貼息跌破5日線,晶圓代工龍頭台積電 () 周三 (16 日) 寫下的收盤新高後，受美股科技股連兩日走跌影響，加上外資反手轉賣，除息行情失靈，周四 (17 日) 除息以來，股價表現疲弱，持續貼息，周五 (18 日) 終場收在 444 元，跌破 5 日線。台積電 17 日除息，每股配息 2.5 元，除息參考價為 455.5 元，外資在除息前夕，大舉湧入押寶除息行情，但在獲利了結賣壓出籠下，除息以來已連 2 日大砍持股超過 2.7 萬張。儘管持續貼息，亞系外資仍將目標價上調至 600 元，力挺台積電，也是目前外資圈最高價。外資看好，蘋果 iPhone 12 新機、平價版 iPhone 12 Lite，及蘋果自製 Mac 中央處理器 Apple Silicon 晶片與伺服器 CPU 等，可填補流失的華為訂單缺口，並推升台積電獲利表現。從蘋果新款 iPad Air 到將登場的 iPhone 12，及 Mac 等，蘋果今年發表的新品所搭載的處理器，大多都採用台積電 5 奈米製程，對其先進製程需求強勁，市場也傳出，台積電 9 月 14 日無法再出貨華為海思後，5 奈米產能已由蘋果全包。台積電前 8 月營收 8501.37 億元，年增 30.7%。受惠客戶先進製程需求暢旺，台積電預估今年美元營收將成長 2 成以上，優於產業平均。
