,date,title,content
444,2020/09/23,聯發科、聯電撐盤 台股驚守季線 跌61點收12583點,美股周二在科技股領軍下反彈收漲，台股今 (23) 日早盤也回神上漲，聯發科及聯電強力撐盤，帶領指數站上 12700 點，不過，蘋果三王及金融、傳產族群表現積弱不振，指數一度摜破季線支撐，終場跌點略收斂至 61.63 點，收在 12583.88 點，成交值 1730.7 億元。權王台積電昨日跌破月線，今日股價持續震盪走跌，終場下挫 0.8%，收在 433.5 元；鴻海、大立光皆在平盤附近遊走，大立光終場翻紅小漲 0.3%、鴻海則收小跌；聯電傳出可望獲得高通晶片轉單，外資喊出目標價 40 元，帶動股價上漲 3.6%，收在 26 元。聯發科獲外資看好，可望承接 OPPO、小米等品牌廠更多的訂單，今日強漲逾 2%，收在 617 元；IC 設計股維繫人氣，除了金麗科亮燈漲停，創意、力旺、瑞昱、聯詠、敦南、原相、智原、松翰、偉詮電等也都表現不俗。其他權值股方面，近期遭外資大舉減碼的金融族群，今天依舊是殺盤重心，中信金、兆豐金、華南金等均跌逾 1%；傳產族群也偏弱勢，台塑集團股持續回檔，其中，台塑下跌 1.6% 最重；台泥、中鋼、和泰車、南亞科等跌勢都相當重。太陽能族群今日重獲買盤青睞，碩禾、達能、聯合再生、元晶均強勢亮燈漲停，太極也翻紅漲逾 2%。風電概念股方面，同開獲沃旭維運中心大單，今日股價一度亮燈漲停，終場漲逾半根停板；今年積極跨足離岸風電的樺晟，股價也相對強勢，逼近漲停價作收。今日資金轉進中小型股，強勢翻紅，其中，網通設備廠康全電訊 IPO 首日一度大漲逾 5 成，蜜月行情火熱。今年以來截至 22 日，櫃買市場日成交均值已達 479 億元，預計今年將創高。
445,2020/09/23,〈宏碁醫療布局〉醫療布局有成 下一步瞄準超音波、心臟腫瘤,品牌大廠宏碁 () 與台大醫院、台灣諾華共同合作，打造眼科 AI 輔助診斷軟體，搶攻智慧醫療商機，展望未來，董事長陳俊聖今 (23) 日表示，除了 AI 輔助診斷軟體通過 TFDA 認證，宏碁在超音波、癌症心臟腫瘤布局也持續進行。宏碁提供的 AI 輔助診斷軟體， 9 月正式獲得台灣衛福部食藥署 (TFDA) 第二級醫療器材軟體認證，預計下月就可以開始導入醫療院所進行實際應用；據了解，目前以 AI 輔助眼科診斷的醫療器材市面上僅有一、兩款產品，經過歐、美 FDA 認證，因此未來發展空間仍大。展望未來，陳俊聖指出，AI 輔助診斷軟體是由旗下宏碁智醫 (Acer Healthcare) 負責，台灣取得認證後，也規劃赴美、歐、東南亞等地申請認證，另外，內部也有超音波、心臟腫瘤方面計畫，並與台大醫院、三總、中央研究院、國防醫學院等醫療研究院所合作，擴大智慧醫療聯盟布局。陳俊聖表示，宏碁有短中長期目標，短期專注本業筆電發展、中長期有旗下小金雞、智慧城市、智慧醫療布局，以 AI 輔助診斷系統為例，光計畫、認證時間就長達三年。陳俊聖強調，隨著智慧醫療、智慧城市等應用逐步發酵，集團非電腦營收比重逐年成長，不過今年筆電動能強，擠壓部分非筆電成長，今年非筆電營收上看 20%，未來成長可期。
446,2020/09/23,正崴成本優化今年三率三升 可望賺逾半個股本,連接器廠正崴 () 表示，下半年宅經濟相關產品觸控筆、真藍芽無線耳機 (TWS)，以及遊戲機等需求延續，零組件及系統整合組裝產品拉貨動能強勁，加上費用持續改善，全年將「三率三升」帶動獲利逆勢成長，法人看好，正崴全年仍可望挑戰半個股本獲利目標。正崴表示，第三季在宅經濟相關應用出貨暢旺下，加上人力成本由去年占營收 17.5%，到今年降至 15% 以下；此外，過往淡季就會面臨虧損的通路事業，在費用控管下，今年上半年也小有獲利，整體獲利狀況明顯改善。而受到疫情影響，不僅 5G 400G 傳輸線束模組、電動自行車等新品進度遞延，美系客戶新機上市時辰也延後，但正崴認為，第三季獲利仍可望維持去年同期高檔水準，第四季隨客戶新機開賣，營運可望進一步來到今年高峰，全年獲利仍可望挑戰半個股本。以正崴目前產品營收組合來看，零組件約占 41%、系統組裝業務占 49%，通路業務則約 10%。
447,2020/09/23,〈5G論壇〉中華電總座：5G初期應用亮點 將聚焦娛樂領域,中華電 () 總經理郭水義今 (23) 日表示，5G 創造萬物聯網，初期應用亮點會以「樂」先行，其中娛樂領域包括多視角轉播、雲端遊戲、無損音樂、虛擬演唱會等，其中雲端遊戲有望成為主流。郭水義今日出席「2020 科技論壇 5G×AI 生活新境界」論壇，並以「5G×AI 新紀元來了」為題發表演講。郭水義表示，5G 應用初期亮點在娛樂，包括雲端遊戲、多視角轉播、無損音樂、閱讀等，其中，雲端遊戲加上 5G 網路後，遊戲產業會出現革命性變化，玩家過去需要購買遊戲機，將由手機取代，預期雲端遊戲會成為主流。郭水義指出，多視角轉播可運用在棒球、籃球等賽事，過去受限於導播、主審角度，精彩畫面也未能即時觀看，透過 5G 高速率、大量攝影機可立即剪接，能把精采畫面即時重播。中華電近年積極切入智慧農業，郭水義表示，將 5G 物聯網通訊、無線感測設備出智慧農業管理系統，監控環境的濕度、溫度，適時給予植物所需農藥，藉此降低成本，目前該系統已導入全台 13 個縣市、17 個業者、13 個農作物。
448,2020/09/23,太極碳化矽客戶需求樂觀 明年資本支出估持平今年,太極 () 今 (22) 日參與 SEMI(國際半導體產業協會)台灣展，執行長謝明凱指出，由於客戶對碳化矽 (SiC) 基板需求強勁，明年將持續增加資本支出，估與今年相當，約 3-5 億元。謝明凱指出，太極碳化矽產品包括 4 吋及 6 吋，產品涵蓋導電型 (N 型) 及半絕緣型 (SI 型)，由於客戶對半絕緣型需求較強，加上其單價為導電型的三倍以上，因此以 6 吋半絕緣型晶圓基板為主力發展產品。謝明凱表示，目前碳化矽基板良率可達 50% 以上，客戶以台灣磊晶廠為主，今年底前將再增加 10 台設備，合計共 15 台，預計明年第一季將進入量產，初期月產能約 400-500 片。
449,2020/09/23,謝金河：見證台中港區離岸風電傳奇 新能源產業至少奔馳30年,財信傳媒董事長謝金河日前帶團考察台中港工業區的離岸風電大廠，華城 () 總經理許逸德指出，政府力推離岸風電的態度，決定今天產業發展，謝金河也認為，台灣除了半導體外，新能源未來可望成為奔馳 30 年的新興產業。吉興工程前董事長陳立誠日前出書指離岸風電是世紀大騙局，引發外界譁然，部分專家也擔憂，一旦遇到強颱侵襲，海上風機是否具備抵禦能力。因此，謝金河特地率團前往風電電力設備大廠華城電機參訪。華城總經理許逸德於簡報中指出，政府力推離岸風力發電的態度，決定今天產業發展的力度，態度正面的廠商已經嚐到商機，抱持懷疑的仍在旁觀望，有許多業者還猶豫不決。謝金河觀察，原先由水泥、大宗物資及倉儲物流業者盤踞的台中港工業區，現在逐漸被離岸風電取代，目前已完成 5 個離岸風電的專業碼頭，西門子歌美颯、三菱重工維特斯的風機都已進駐，此外，樺晟世紀 ()、台欣世紀、永冠 ()、天力等今年也都相繼來設廠，可以感受到整個產業要崛起的態勢。謝金河表示，無論看不看得懂離岸風電產業，當台積電 () 宣布買下沃旭能源 2 座風場 20 年的發電量，總共 920 百萬瓦，已為這個產業拉出亮點，再加上台積電 2050 年將全面使用綠電，可以想像到未來台灣除了半導體外，新能源這項新興產業，將至少再奔馳 30 年，為國產風電相關上、中、下游帶來龐大的商機。
450,2020/09/23,碩辣椒自製手遊進軍日本 首月營收貢獻上看3000萬元,興櫃遊戲股碩辣椒 (6736-TE) 自製手遊《戦国 RENKA ズーム!》9 月中旬在日本上市，表現符合預期，法人估首月營收貢獻可達 3000 萬元，而《真 ‧ 三國無雙 斬》中國版號預計 10 月底取得，若能照計畫上市，有助今年營運朝損平邁進。《新千姬大亂鬥》為碩辣椒自製研發的 3D 美少女動作 RPG 手遊，定名為《戦国 RENKA ズーム!》，9 月 15 日透過傲視辣椒在日本推出。《戦国 RENKA ズーム!》目前每日不重複在線人數約 2 萬人，平均每人日付費約 1000 元，付費比率超過 5%，法人估首月可望貢獻營收 3000 萬元。由於目前該款手遊在日本行銷費用僅約 500 萬元，增加廣告行銷投放後，人數有機會持續墊高，以日本市場特性來看，平均每人日付費金額有機會翻倍成長，帶動單月營收貢獻達到 4000-5000 萬元。除《戦国 RENKA ズーム!》外，碩辣椒也聯手中國遊戲大廠北京暢遊，要在中國推出《真 ‧ 三國無雙 斬》，盼能在 10 月底前取得版號；碩辣椒上半年虧損 3000 萬元，該款手遊在中國上市時間點，將攸關碩辣椒今年營運能否損平。另外，碩辣椒第四季也有《純潔的魔法少女》美術外包專案挹注，最快 10 月底可望開案。
451,2020/09/23,藥品再度不符規定 杏輝：為自主預防性回收 影響金額低於280萬元,杏輝 () 再爆出 14 款藥品不符規定，今 (23) 日公告，公司本月啟動藥品檢測清查，主動向食藥署申報清查進度，並將藥品自主預防性回收，初估影響金額不超過 280 萬元。杏輝今日受到利空消息影響，股價開低震盪，跌幅逾 5%，跌破短均線；旗下子公司杏國 () 同樣受拖累，持續在盤下震盪，也有超過 3% 跌幅。杏輝表示，本月啟動全系列藥品檢測清查，昨 (22) 日主動向食藥署申報清查進度、提出藥品安定性效期修正改善計劃，同時將 14 個品項進行預防性回收。杏輝強調，本次為自主預防性回收，故無罰款問題，影響金額初估不超過 280 萬，且對市場供貨不會產生影響，後續藥品出廠前，皆經過品質管控合格後才放行，民眾使用安全健康無虞。食藥署自 7 月底針對國內藥廠展開 GMP(藥品優良製造作業規範) 查廠工作，發現杏輝有 6 款藥品效期不到一年，主成分含量降至 8 成以下，後續進一步調查發現，另有 14 款藥品違反 GMP 規定，並要求下架。食藥署調查，14 款藥品有 10 款為處方藥、4 款指示用藥，藥品出現有效成分含量低於 90%、軟膏變色等狀況，目前要求杏輝需在 10 月 6 日前限期改善。
452,2020/09/23,〈寶華經濟預測〉4個理由台幣將越來越強 明年均價升破29關卡,元大寶華綜合經濟研究院今 (23) 日上修台灣經濟成長率 (GDP) 至 1.63%，較 3 月的預測值上修 1.3 個百分點，對於近日強勢走升的匯率也同步上修，預估今年兌一美元匯率從 30.36 元上修至 29.65 元，明年平均匯率更將升破 29 元關卡至 28.93 元，元大寶華綜經院院長梁國源直言，明年還會較今年更強勢。梁國源指出，升值主要有 4 個理由，(1) 台灣經濟基本面表現優異，優於主要貿易對手國，促升商品貿易順差，(2) 外商來台和台商回流重大投資案增加，(3) 持續攀高的國內壽險公司海外投資，因己達高原水準，對美元需求降低，再加上 (4) 與連動性高，美元已形成趨貶格局等，均有助推升匯率。元大寶華預估今年第 3、4 季匯率預測分別為 29.47 元、29.05 元，而明年各季分別為 29.00 元、28.95 元、28.90 元與 28.85 元。梁國源說明，無論從對美元雙邊匯率，或是其名目和實質有效匯率指數來看，近期走勢偏強，預料至明年底前兌美元仍將偏強，而也較亞洲其他主要國家貨幣強勁。就與美元、和相關程度來看，近 30 周交易資料顯示，與相關性最高，若將對美元匯率與交易資料拉長至 2017 年，其相關性也高，因此，對匯率的影響明顯。另一方面，Bloomberg 市場共識預測，至 2021 年底仍將偏弱，原因在於美國 續處低檔，隱含市場認為未來美國經濟前景堪憂，而通膨連結的美元交換利率上揚，反映其預期通膨將升高，讓債券實質收益率走低等因素，美元已形成趨向貶值格局。梁國源認為，以每日外匯資料看來，目前央行已有適時進場調節匯率，但名目有效匯率指數值並未偏離中線太多，央行理應不需作太大干預，鑑於台灣已符合美國匯率操縱國的兩項標準，且央行近期開始公布兌美元換匯交易資料，顯示央行透明度漸趨向 IMF 標準，企盼降低外界對其干預匯市的看法。
453,2020/09/23,〈5G論壇〉台灣5G網速躍居全球第4 謝繼茂：基礎建設將加速、加量,中華電 () 董事長謝繼茂今 (23) 日出席「2020 科技論壇 5G×AI 生活新境界」論壇表示，台灣今年 6 月底啟動 5G 網路服務，其中，台灣 5G 網路速度更排名全球前段班，躍居第 4 名，後續 5G 基礎建設也會持續加速、加量，且 5 年計畫縮短至 3 年完成。謝繼茂表示，國際研調機構針對全球已啟動 5G 國家進行調查，其中台灣 5G 網速排名第 4 位、5G 可使用率位居第 6，顯示台灣 5G 的建設與與發展，已在全球前段班。謝繼茂強調，5G 基礎建設將會持續加速、加量，預計 5 年的建設計畫，縮短至 3 年完成，此外，5G 具備高速度、低延遲、廣連結等三大特性，也被視為快速又四通八達的神經系統，再結合 AI 技術，可推動智慧交通、智慧城市、智慧安防、智慧醫療等應用，並打造新的商業模式。謝繼茂指出，台灣今年為 5G 元年，5G 與 AI 結合不僅驅動產業進入智慧化，也是帶領人類生活進入智慧化的關鍵技術。副總統賴清德表示，5G 除替產業帶來龐大商機外，也將是在新冠肺炎疫情下，經濟復甦的重要支柱，據研調機構統計，截至今年 8 月底，全球共有 41 個國家、超過 90 個通訊公司提供 5G 網路，預估 2035 年將創造 3.5 兆美元商機。賴清德指出，5G 不只會帶來通訊應用上的突破，也帶動產業升級，因此政府也提出 4 年投入 500 億元經費，範圍包括 5G 基礎建設、縮短城鄉差距、落實通譯服務等。
454,2020/09/23,〈半導體展登場〉AIT處長酈英傑：樂見台灣半導體業與美國合作研發,SEMICON Taiwan 2020 國際半導體展今 (23) 日開展，行政院長蘇貞昌致詞時表示，在許多國家鎖國封城的情況下，台灣還能盛大舉行半導體展，是亂世中的福地；AIT 處長酈英傑則說，樂見台灣半導體產業與美國企業合作進行研發，有助半導體產業發展。行政院長蘇貞昌、美國在台協會處長 (AIT) 酈英傑均出席開幕典禮。蘇貞昌致詞時表示，當全世界已有 3000 萬人因肺炎確診，近百萬人死亡，許多國家鎖國封城的此時此刻，半導體展在台灣盛大舉行，不但是亂世中的福地，也如台灣半導體協會 (TSIA) 常務理事盧超群所說，這是優聖美地，是台灣業界一起創造出來的。蘇貞昌並說，上次當行政院長時，推動兩兆雙星產業，希望兩個產業產值破兆，其中一個就是半導體產業，經過 14 年來大家一起努力，去年半導體產值達 2.7 兆元，今年可以突破 3 兆元。蘇貞昌表示，台灣民主自由、安全開放，尤其對資安環境非常重視，是發展半導體相關產業最好的基地，也一再被國際相關權威機構評價，台灣確實有最好的投資環境，政府會繼續往這方面布局，做最好的努力。AIT 處長酈英傑則說，由於台灣疫情控制得當，使台灣半導體業今年即便在逆風中，仍可維持強勁成長，也樂見台灣半導體產業與美國企業合作進行研發，有助半導體產業發展，尤其是 5G 基礎建設上，將與供應鏈建立深厚關係。盧超群表示，台灣今年在全球疫情中表現相對出色，在半導體市場表現也值得讚賞，鞏固在半導體領域的關鍵地位，但未來仍需持續審慎以對，全力把握商機，帶動產業技術提升，透過半導體與世界各國加速合作。SEMICON Taiwan 2020 今日登場，展出 15 大主題展區與創新館、19 場國際論壇、5 大同期展覽，以虛實整合呈現最新的 5G、AI 應用。
455,2020/09/23,〈寶華經濟預測〉上修我GDP至1.63% 梁國源：屬K型不均復甦,元大寶華綜合經濟研究院今 (23) 日發布台灣經濟成長率 (GDP) 最新預測值為 1.63%，較 3 月上修 1.3 個百分點，也較近期台灣央行上修的預測值 1.6% 略高，元大寶華綜經院院長梁國源表示，台灣經濟和金融市場呈「K 型」不均發展，但由於適切的產品組合結構搭上宅經濟列車與遠端商機發威，使復甦樣態介於長 U 型、短 U 型間，經濟情勢優於全球。梁國源表示，台灣出口超乎預期好，隨著疫情趨緩，預料明年台灣的民間消費和輸出也將回到既有成長軌道，不過，疫情重創全球經濟，復原之路仍漫長。元大寶華預測，第 3、4 季成長率分別為 2.58%、2.28%，較原先預期的 1.55% 和 2.18% 高，尤其第三季明顯上修，反映民眾報復性消費和政府振興券有效帶動內需。梁國源說明，儘管國內零售和餐飲業營業額從低點翻轉，不過，因消費者對未來半年信心仍低弱，民間消費成長率自原先預估的 1.04% 下修至 - 1.53%。就民間投資來看，由於部分廠商持續將生產基地移回台灣，民間投資成長率預測自 2.79% 略上修至 2.82%，並預測第 3、4 季成長率分別為 6.14%、-0.02%，而明年成長率仍可達 2.50%。對外貿易方面，雖今年以來台灣出口增速明顯優於中國、韓國，對 GDP 貢獻加大，不過，來台旅客劇減，衝擊服務輸出，拉低整體輸出表現，元大寶華將輸出成長率預測從 1.27% 下修至 - 2.06%，而輸入成長率從 1.3% 下修至 - 3.35%。消費者物價方面，由於權重不低的交通及通訊、教養娛樂類受疫情衝擊程度仍大，拉低整體 CPI 走勢，加上 9 月 EIA 預測今、明兩年國際油價將為近年低點，因此元大寶華下修今年 CPI 至 - 0.20%。另外，元大寶華預測明年經濟成長率有望「保 3」達 3.10%，各季成長率分別為 3.80%、5.55%、1.80%、1.50%。
456,2020/09/23,華友聯擬發行10億元CB籌資 預計11月中完成,市場資金寬鬆造成建商、代銷業者業務量增加，業績可望成長，同時，也積極進行市場籌資以改善本身財務體質，建商華友聯開發 ()申報發行 10 億元有擔保可轉換公司債 (CB) 今 (23) 日生效，將用於償還銀行借款，預計 11 月中旬完成募集。建商華友聯開發此市場籌資案，由第一金證券主辦。建商華友聯開發在今年 3 月也已發行 3 億元 CB，完成今年第一次市場籌資，今天申報生效的 10 億元 CB 發行案，爲今年第二度市場籌資，用於償還短期借款，一年可節省 1900 萬元利息支出。華友聯今年 3 月參與高雄地政局的土地標售，總共標得 2 筆建地，一是位於小港的 1880.14 坪商業用地，由華友聯開發以每坪 28.11 萬元、總價 5.28 億元得標，溢價率約 21.49%。第 2 筆為位於高雄大學生活圈的 1513.55 坪「住三」建地，華友聯以每坪 26.07 萬元、總價約 3.94 億元得標，溢價率約 19.49%，目前都在申請建照中。
457,2020/09/23,〈宏碁醫療布局〉攜手台大醫院、台灣諾華 AI輔助診斷軟體取得TFDA,品牌大廠宏碁 () 搶攻智慧醫療商機，今 (23) 日宣布與台大醫院、台灣諾華共同合作，打造眼科 AI 輔助診斷軟體，運用 AI 判斷糖尿病視網膜病變，也取得台灣首張由衛福部食品藥物管理署 (TFDA) 核發的眼科智慧醫材許可證。宏碁創辦人暨榮譽董事長施振榮指出，自從退休後鎖定資通訊、醫療是台灣未來發展方向，宏碁從三年前就與台大醫院、諾華三方合作，近期終於獲得衛福部食藥署 TFDA 認證，未來希望宏碁協助產品落地，並搭配諾華推廣到國際市場，讓台灣產業升級轉型。AI 輔助診斷軟體是宏碁智慧醫療策略聯盟首個具體成果，依據台大醫院臨床試驗，準確度已達 95%，軟體應用宏碁 AI 技術、資通訊經驗，台大醫院提供醫療專業、臨床試驗，台灣諾華則擔任臨床試驗顧問，提供臨床試驗執行諮詢、市場研究、應用推廣等，在取得藥證後，目前也與國內醫療院所簽約計劃導入。根據 2019 台灣糖尿病年鑑統計，台灣糖尿病盛行率超過 9.32%、糖友病患超過 220 萬人，而糖尿病會併發血管病變，其中以糖尿病視網膜病變最常見，依國民健康署調查，糖尿病視網膜病變盛行率高達 35%，但糖尿病患眼部檢查率卻低於 5 成，顯示台灣篩檢度仍偏低。宏碁是在去年 11 月與台灣諾華簽訂合作備忘錄 (MOU)，共同攜手強攻智慧醫療商機，將運用人工智慧 AI，整合雙方軟硬體，提升醫療效率，瞄準黃斑部退化、糖尿病視網膜病變及心血管疾病等領域。
458,2020/09/23,〈台股盤中〉金融傳產跳水急殺摜破季線 兩大族群逆勢走揚,台股今 (23) 日開高走低，早盤反彈到 12700 點後，突然跳水急殺由紅翻黑，壓盤重心落在金融、傳產股，最低一度跌到 12558.2 點，跌破季線，盤面上靠聯發科領軍高價 IC 設計股、光電族群逆勢撐盤。美股四大指數擺脫陰霾全數收紅，激勵台股今日開在 12656.3 點，開高到 12700 點後沒多久就下挫，由紅翻黑。金融股一片綠油油，國票金跌逾 2% 最疲弱，上海商銀、安泰銀、王道銀行、第一金、三商壽、台企銀、新光金、兆豐金、富邦金、開發金、中信金等，跌幅都超過金融指數與大盤。傳產類股中的營建股、運輸股、水泥股、紡織股、汽車股等都相對弱勢，台泥、台塑、統一超、和泰車、遠東新、亞泥、台化等都走跌。不只金融傳產軟趴趴，蘋概三王也都熄火，台積電最低跌到 433 元、跌幅近 1%；大立光最低跌到 3435 元，在盤面下游走；只有鴻海在平盤附近震盪。聯發科宣布與愛立信攜手進行 5G 關鍵互通性測試，成功完成全球首批 5G 獨立組網載波聚合互通性測試，聯發科逆勢勁揚超過 2%，領軍高價 IC 設計股表態，包括：力旺、創意、譜瑞 - KY、世芯 - KY、瑞昱等都強勢攻高。光電族群也是多頭聚焦所在，吉祥全、華上亮燈漲停，新世紀也強漲超過 7%，元晶、聯合再生、國碩、光磊、安集等都是撐盤要角。整體來說，台股面臨檔長黑、以及月線下彎等壓力，讓賣壓魚貫湧出，盤中跌幅擴大，季線 12570 點進一步遭跌破，預估量能也放大到 1900 億元，呈現帶量下殺。
459,2020/09/23,康全電訊轉上櫃 掛牌首日飆漲逾5成大展蜜月行情,網通設備廠康全電訊 () 今 (23) 日興櫃轉上櫃，掛牌參考價 45.25 元，IPO 首日大漲逾 5 成，盤中最高來到 68.5 元，大展蜜月行情。康全電訊三大產品線為光通訊中繼設備 DPU、寬頻用戶端設備及家庭網路設備，另外也提供雲端管理系統，以自有品牌「COMTREND」，打入客戶國際知名電信運營商、電信網路系統整合大廠、有線電視運營商及北美電信網路設備經銷商。其中，DPU 是較特殊利基市場，康全電訊指出，除了常裝設於惡劣環境，要滿足防塵、防水、防雷擊等規格外，因為本身無法供電，因此必須將智慧型反向饋電系統，整合到 G.fast 用戶端設備中，用以解決 DPU 的遠端供電問題，雖然很多大廠要做，但公司仍保有技術領先優勢。以康全電訊目前營收占比來看，光通訊中繼設備佔營收近 1 成，毛利最高，主要出貨亞太地區，寬頻用戶端設備約 6 成、家庭網路設備約 3 成。康全電訊認為，目前需求仍將穩定成長，下半年營運可望延續上半年的成長趨勢，也新增多個歐美客戶，並已完成認證，最快年底可開始出貨，將成新的營運成長動能。康全電訊上半年稅後純益 1.11 億元，年增 53%，每股純益 2.26 元，公司看好，法人估，康全電訊全年獲利上看半個股本。
