,date,title,content
220,2020/09/28,【日盛投顧】盤前分析,◆盤勢分析 1. 美國 8 月耐用品訂單初值月增 0.4%，低於預期值 1.4%。眾議院民主黨擬推出一項 2.4 兆美元的新刺激法案，波士頓聯邦儲備銀行總裁表示儘管聯準會可能會增加資產購買以試圖支撐經濟。上週五美股上漲，漲幅介於 1.34 至 2.26，美股四大指數短期震盪整理。2. 由以下三個面向檢驗方向及強弱：(1)、量能：回檔量縮或反彈成交量大於月均量方有利盤勢回穩。(2)、均線：支撐為 12，000 點至 11，800 點，壓力為 12，500 點至 12，600 點。(3)、技術指標：KD 開口向下，9 日 K 值位處超賣區，醞釀反彈。3. 以的線型及指標角度而言，支撐為 155 點附近，壓力為 165 點左右，KD 技術指標開口向下，9 日 K 值小於 50，短線整理。4. 觀盤重點：觀察台股指數是否能收復季線，我們認為台股選股方向可留意 9 月營收優、第三季財報佳、5G、半導體、綠能、運動風、運輸 / 原物料、內需、生技 / 防疫等。5. 業界消息指出，採用中芯製程生產網通及電源管理 IC 的高通、博通等半導體業者，近期開始積極與 2330 台積電、2303 聯電、5347 世界先進等台灣晶圓代工廠接洽，詢問第四季及明年產能配置情況，而部分不需更改光罩的成熟製程晶片，可望自第四季起開始以急單或短單方式轉至台灣晶圓代工廠生產。6. 美國出手制裁大陸晶圓代工龍頭中芯國際 (SMIC)，引爆晶片業新一波晶圓代工產能卡位戰，筆電相關 IC 廠受惠宅經濟效益積極擴大尋求晶圓代工產能之際，更是被客戶追著跑，包括義隆(2458)、偉詮電(2436)、茂達(6138) 等廠商訂單塞爆，業者訂單能見度直達明年農曆年過後。7. 南韓三星積極衝刺先進顯示器技術，傳有意來台找盟友，參與 LED 驅動 IC 廠 3527 聚積私募案，攜手搶食商機龐大的 Mini／MicroLED 應用市場。聚積先前已引入全球筆電觸控板、觸控螢幕 IC 與指向裝置市占龍頭廠 2458 義隆資金，讓義隆成為聚積公司派之外最大股東。若三星參與聚積私募案成局，未來三星、聚積、義隆鐵三角勢力成形，將是台韓廠商首次在先進顯示器領域開發大串連。8.2002 中鋼次級品鋼價與 2014 中鴻 10 月盤價上周各調漲 1，000 元，為近期最高漲幅，鋼市連連安打，預期國慶假期過後中鋼將開出的 11 月行情，可望接續漲價火力，為各鋼廠第 4 季得分扮演關鍵角色，2002 中鋼、2014 中鴻、2023 燁輝、2029 盛餘等鋼鐵股有機會受惠。
221,2020/09/28,〈台股盤前〉美股走強雖有利指數回穩 中秋假期前觀望氣氛相對濃厚,台股上周五 (25 日) 開高走低，早盤雖一度站上 12300 點，終場小跌 31.47 點，收在 12232.91 點。法人指出，美股上周五走強，台股今 (26) 日可望同步止跌，但中秋假期前，投資人相對觀望，市場交投恐不熱絡，進一步測試支撐。美國政府出手制裁中國晶圓代工龍頭中芯國際，引爆晶片業新一波晶圓代工產能卡位戰，筆電相關 IC 廠包括義隆、偉詮電、茂達等廠商訂單塞爆，業者訂單能見度看到明年農曆春節過後。品牌手機廠 10 月新機齊發，除蘋果傳出將發表新 iPhone，非蘋陣營也有三星、索尼、vivo、小米，及 Google 等至少 7 款新機問世，帶旺鴻海、大立光、玉晶光、英業達、聯發科等零組件廠。三星積極衝刺先進顯示器技術，傳有意來台找盟友，參與 LED 驅動 IC 廠聚積私募案，攜手搶食商機龐大的 Mini／Micro LED 應用市場。印刷電路板廠搶搭 5G 相關應用商機，台郡、臻鼎 - KY 因應傳統旺季生產，全面總動員，看好第 4 季營運攀峰；華新麗華集團旗下 NB 板大廠瀚宇博的中國 5G 相關伺服器訂單，也已排到 11 月。法人指出，過去一周內外資同步倒貨，多方結構已遭破壞，不排除季底前還有一波結帳潮，雖然在美股上周五走強下，台股今日可望同步止跌，但預期中秋假期前，投資人相對觀望，導致市場交投不熱絡，進一步測試支撐。
222,2020/09/28,盤前財經大事搶先讀2020年09月28日,新股掛牌：上品股臨會：建暐台股過去一周在美股修正、法人結帳雙重衝擊下，熱錢行情失靈，周跌 642 點，上方均線已成層層反壓，接下來中秋連假在即，本周僅 3 個交易日，據投顧統計，過去 15 年來中秋節前上漲機率不到 5 成。據《日經商業》週日 (27 日) 報導，由於中國和美國之間的緊張關係不斷加劇，全球第二大記憶體晶片製造商鎧俠 (Kioxia Holdings Corp) 將取消 IPO 的計畫。塑化紡織廠為強化一貫化能力、尋求新出海口，除了內部調整外，也對外尋求資源，包括添購土地廠房、股份合作等，市場人士認為，在大者恆大的趨勢下，後續相關產業將掀起新一波整併潮。離岸風電第三階段區塊開發最快明年第二季進行遴選，近來包括由 3 家外商握有股權的海鼎風電、上緯新能源的 Formosa 4 風場，正摩拳擦掌瞄準區塊開發獲配容量，積極進行相關佈局。工總多次呼籲政府應拉高直接金融比重，日前更建議建議應讓直接金融比重與世界接軌，且希望直接金融比重可提高至 50% 以上。今 (2020) 年的疫情，更突顯我國過度傾斜向間接金融所造成的籌資不正常、不健康現象，台灣中小企業面臨資金告急，甚至有些「慘業」出現倒閉潮。
223,2020/09/27,8月景氣燈號、生技論壇、鎧勝股臨會 本周大事預告,國發會明日將公布 8 月景氣燈號，隨著國內工業、餐飲業等逐步復甦，市場看好，本月有機會終止連五個月的黃藍燈，轉亮綠燈，生物‪產業協會則預計周二‬舉辦年會，聚焦國內生技產業發展，‬鎧勝 - KY 將在周三召開股臨會，討論下市一案，本周也將迎來中秋連假，以下是本周大事預告：國發會先前指出，7 月景氣對策信號綜合判斷分數為 21 分，月增加 2 分，燈號連五亮黃藍燈，景氣、同時指標雖持續下跌，但跌幅持續收斂，加上領先指標已連續四個月上升，顯示疫情衝擊影響持續縮減。外界看好，隨著台灣半導體高階產能陸續開出，廠商在台擴產效益延續，加上遠距商機、5G 通訊等新興應用需求，有助維繫台灣出口動能，8 月景氣燈號也可望終止連五月的黃藍燈，轉為綠燈。生物產業發展協會將在周二 (29 日) 舉辦 2020 會員大會暨論壇，將邀請副總統賴清德蒞臨致詞，以及經濟部長王美花也將以「台灣生技產業發展之策略與展望」為題進行演說，聚焦國內生技發展。生物產業學會表示，台灣生技產業在疫情中，不論疫苗、藥物、醫材及檢測研發等均陸續傳出好消息，將藉由此次論壇集結產官學研專家座談，共同探討台灣生技產業發展的關鍵課題。機殼廠鎧勝 - KY 預計周三 (30 日) 召開股東臨時會，將討論由母公司和碩進行收購並下市議案，收購案通過後，鎧勝 - KY 將下市，合併基準日暫訂為 2021 年 2 月 26 日。外界看好，和碩私有化鎧勝 - KY 後，可有效整合上下游，並擴大印度、越南等海外市場布局，瞄準蘋果訂單，強化集團競爭優勢，與代工廠龍頭鴻海看齊。英特爾指出，2018 年公司在邊緣運算領域的營收達 95 億美元，年增幅達 20% 以上，看好 2023 年前，全球邊緣運算晶片市場上看 650 億美元，領域包括製造、零售、醫療保健、智慧城市與交通運輸等。英特爾預計周二 (29 日) 發表，針對邊緣運算發表的產品與解決方案，並偕同台灣多家合作夥伴，共同介紹新產品，與分享未來幾年邊緣運算 AI 市場的發展。
224,2020/09/27,台新冠疫苗三期臨床面臨龐大投資成本 業界籲集中資源,台灣共有三家廠商開發新冠疫苗，若執行順利，明年將啟動臨床三期，不過收案人數、投資成本龐大，疫苗廠恐難以負擔，業界認為，政府能扶植業者，並將資源整合，打造單一新冠疫苗進行開發。新冠病毒 (Covid-19) 屬於 RNA 病毒，據過往經驗，RNA 病毒引發的疾病至今尚未研發出疫苗，包括 17 年前的 SARS、C 型肝炎、愛滋病等，雖然疫苗為最有效抑制病毒，但開發並不容易。台灣新冠疫苗開發案陸續進入臨床一期試驗，不過目前仍採緊急使用授權方式，臨床試驗部分可重疊，預期最快明年有望啟動三期臨床試驗，業界指出，臨床三期需要龐大收案人數，並需執行多國多中心臨床試驗，藉此增加收案人數數據。此外，臨床試驗收案人數，至少需要 3-6 萬人以上，且業者需要透過 CRO(委託研究機構) 進行抽血分析、數據整理等，費用初估 20 億元。業界表示，以目前台灣 3 家正在開發新冠肺炎疫苗廠，包括國光生、高端疫苗及聯亞，若疫苗開發順利並進入臨床三期，投資成本恐難以承擔，此外，業界呼籲，政府除資金扶植業者開發新冠疫苗，但也能將各廠資源進行整合，開發出台製的新冠疫苗來進行臨床三期。
225,2020/09/27,APEC財長會議 蘇建榮：我長債負債比低於35% 財政復原彈性佳,今年 APEC 財政部長視訊會議 25 日登場，財政部長蘇建榮會中表示，我因應疫情編列特別預算並實施財政擴張因應，預估今年兩年的長債比率將分別微幅增至 30%、30.6%，但仍是 APEC 中少數維持在 35% 以下的經濟體，具備財政復元彈性。因應防疫，今年 APEC 財長會議改採視訊進行，我財長蘇建榮率領財政部、金管會與外交部同仁出席。蘇建榮於 25 日晚間登場的 APEC 企業諮詢委員會 (ABAC) 與各國財長對話，分享我國近年累積的財政能量。今年的財政部長會議主題是「因應 COVID-19 疫情紓困與復甦階段之財政與貨幣政策及數位化發展之影響」。蘇建榮表示，我國因防疫有成並未實施封城措施，預估今年 GDP 仍能維持 1.56% 正成長，加上近年減債有成，累積充分財政能量足以因應本次疫情衝擊。蘇建榮進一步指出，在編列特別預算支應防疫、紓困、振興措施及採行擴張性財政政策下，我國一年以上公共債務未償餘額占當年度名目生產毛額 (GDP) 比率，預估於今年及明年雖將微幅上升至 30%、30.6%，但仍在可控制範圍內，是 APEC 少數長債負債比率維持在 35% 以下的經濟體。在財政部長與 ABAC 政策對話部分，議題包括協助微中小型企業加速復原、透過數位化促進金融包容性，及環境、社會與公司治理（ESG）等，盼於後疫情時期強化能力建構，共同朝永續發展目標邁進。財政部表示，APEC 財政部長宣言－COVID-19 疫情之紓困及復甦，經各經濟體財政部長共同採認通過。各經濟體為因應 COVID-19 帶來重大衝擊，須考量於健康與經濟間取得平衡。為緩解個人及企業財務壓力，財金部門採行前所未見財政及貨幣措施，尤其關切微中小型企業等受影響最大部門與勞動者。另外，宣言也特別強調增進財政透明與永續，持續分享政策經驗，確保強勁、平衡及包容之經濟復甦，該宣言將提報今年底舉行之 APEC 領袖會議，展現財政部長具體貢獻。
226,2020/09/27,台灣中油：明(28)日起國內汽油價格不調整，柴油調降0.1元,台灣中油公司公告指出，自明（28）日凌晨零時起汽油價格不調整，柴油調降 0.1 元，調整後的參考零售價格分別為 92 無鉛汽油每公升 22.2 元、95 無鉛汽油每公升 23.7 元、98 無鉛汽油每公升 25.7 元、超級柴油每公升 19.5 元。中油表示，本週美國墨西哥灣區海上鑽油平台受熱帶風暴貝塔影響而暫時關閉，原油供應下降，導致國際油價上漲。本週調價指標 7D3B 週均價為每桶 41.30 美元，較前週 40.75 美元上漲 0.55 美元，新臺幣兌美元匯率升值 0.093 元，國內油價依公式計算漲幅為 0.82％，按浮動油價調整原則，汽、柴油每公升原應各調漲 0.1 元，經考量亞鄰最低價限制，本週汽油價格不調整，柴油調降 0.1 元，汽、柴油應調未調之 0.1 元及 0.2 元皆由台灣中油吸收。
227,2020/09/27,〈台股風向球〉連假前停看聽 節前上漲機率不到5成,台股過去一周在美股修正、法人結帳雙重衝擊下，熱錢行情失靈，周跌 642 點，上方均線已成層層反壓，接下來中秋連假在即，本周僅 3 個交易日，據投顧統計，過去 15 年來中秋節前上漲機率不到 5 成，而美國總統辯論將登場，觀望氣氛將進一步升溫，整體來看，台股恐暫難轉強，在收復季線關卡前以弱勢整理視之。國泰證期研究部指出，過往中秋節前 5 個交易日指數多因節前賣壓出現整理，近 15 年秋節前上漲機率僅 47%。平均下跌幅度 - 0.5%，顯示節前觀望氣氛濃，類股中以食品、百貨類股秋節前上漲機會相對大，機率約 67%。法人認為，過去一周內外資同步倒貨，多方結構已遭破壞，多頭要再重掌短線發球權有難度，甚至不排除季底前還有一波結帳潮，短線有待籌碼面沉澱，所幸，美國科技股周五回穩，而市場正等待美國新一輪紓困案的投票結果。從籌碼面來看，三大法人在集中市場連 7 賣，創下 3 月中旬以來最長連續賣出，其中，外資和投信在集中市場皆出現連 7 賣，自營商則是連 5 賣，法人結帳態勢明朗。統計一周以來，外資賣超達 719 億元，投信賣超逾 55 億元，自營商賣超 264.34 億元，其中，台積電一檔合計遭三大法人賣超共 326 億元，成為最大提款機。法人解讀，近來台積電已有利多漲不太動的情況，大盤要回穩有待外資對台積電賣超收手。技術面上，大盤短線支撐可先看 8 月 20 日的波段前低 12144 點，展望後市， 9 月 29 日將進行摩台指結算，且美國總統選舉第一場辯論將登場，市場如何解讀辯論結果，將影響未來美股走勢，以及台股連假過後表現。元大投顧則認為，美國眾議院多位官員表示將起草新一輪 2.4 兆美元的刺激法案，預計最快本周表決，若美股因此跌深反彈，上周台股的大震盪就有機會是短線的最後洗盤。
228,2020/09/27,面板景氣轉佳 偏光板廠價格Q4具調漲空間,面板景氣持續回溫，在傳統旺季需求刺激下，市場預期第 4 季大尺寸面板仍有 10% 上漲空間，隨著面板廠營運逐步改善，市場認為，上游偏光板價格也有機會調整，明基材 ()、誠美材 () 第 4 季營運可望再加溫。市調機構集邦 (TrendForce) 日前指出，第 3 季電視面板價格平均漲幅達逾 30%，筆電面板價格季漲幅也有 5-10%，預期第 4 季大尺寸面板供不應求情況將延續，面板價格第 4 季仍有調漲空間，助推面板廠營運轉佳，上游偏光板廠可望同步受惠。觀察台廠偏光板營運，明基材近年持續聚焦高毛利產品，產能維持穩健，且並未有大型擴產計畫，今年以來產能利用率維持在滿載高檔水準，並積極進行產線去瓶頸，估今年產能將可望增加 5-10%，加上轉投資醫材產品下半年增溫，營運可望逐月成長，維持穩定獲利。誠美材去年經營權之爭落幕後，持續調整營運，雖然上半年仍虧損，但虧損幅度已逐步收斂，誠美材表示，下半年進入產業傳統旺季，在日、韓新客戶產品放量、組合優化，稼動率提升，第 3 季營運估持平第 2 季，第 4 季則在價格持穩、強勁需求支撐下，估季增幅將達雙位數，且單季可望虧轉盈。至於偏光片近期是否有調漲空間，產業人士指出，價格調漲與否仍需看下游面板廠營運，但觀察近期面板廠營運改善、加上供需吃緊狀況將延續至明年，預期第 4 季將具備價格調整空間，幅度則還要觀察。
229,2020/09/27,奇力新電感電阻量價持穩 Q3營運戰2年新高,被動元件廠奇力新 () 受惠教育、電競筆電需求暢旺，不僅帶動電感訂單能見度延續、晶片電阻也持穩，法人估，第三季營收及純益均將季增 5-10%，營運挑戰 8 季新高。法人認為，防疫需求提升、居家辦公學習型態持續，教育用 Chromebook、電競應用出貨量提升，加上時序邁入消費性電子旺季，遊戲機、電視及真藍牙無線耳機 (TWS) 出貨升溫，均帶動奇力新一體成型電感 (Molding Choke) 呈現供不應求、稼動率滿載。此外，奇力新電阻產品今年上半年調價後，目前價格仍持穩，加上一體成型電感毛利率較佳，法人看好，奇力新第三季毛利率將持穩 3 成水準，加上營收規模增長，獲利也將續強，單季純益挑戰 8 季新高。不過，第四季進入傳統淡季，且因疫情影響，通訊、工業用等其他應用營運動能依舊較弱，加上提列庫存損失等因素，法人認為，奇力新第四季營運將進入季節性修正，但獲利仍可望較去年同期大幅成長，全年每股純益估達 7 元之上。
230,2020/09/27,5G+AI擘劃未來智慧工廠 SEMICON概念股搶先看,今年 SEMICON Taiwan 國際半導體展，首次推出 Hybrid 模式串聯線上線下平台，展示最新上中下游產業鏈的尖端技術，其中，結合 5G 及 AI 的高科技智慧製造為本次展覽的一大亮點，可望讓台灣半導體全面升級，在新時代中鞏固國際產業的關鍵地位。《鉅亨網》幫讀者盤點出本屆 SEMICON 智慧工廠概念股，後市值得留意。晶圓代工龍頭台積電 () 董事長劉德音表示，市場對於 AI 及 5G 的數位運算效能提升永不滿足，未來半導體技術發展將跳脫奈米製程節點的陳述，若要持續創新，製程就得微縮，讓運算效能提升、攻耗降低，未來每兩年能源效率就會持續倍增，目前還看不到停止跡象。儘管新冠肺炎疫情打亂了全球展覽的步調，但本次 SEMICON 仍聚集 550 家廠商，展出超過 2000 個攤位，估吸引 4.5 萬名專業人士參觀。今年有許多產業積極導入智慧製造尋求生機，讓工廠運用高效能計算，做到自動化系統整合與生產流程最佳化，藉此全面提升產能及良率。SEMICON 邀請遠傳 ()、台達電 ()、倍福自動化、新漢智能 ()、科林研發等企業攜手合作，創造虛實整合技術應用裝置互動展出，包含無人機巡檢、工業 AR 智慧眼鏡、磁浮自動搬運系統、物聯網等，以 5G 前瞻視野，擘劃出未來智慧工廠的樣貌。設備廠均豪 () 與 IBM 技術合作的高敏度皮秒 IC 分析儀器，取代國外設備，正式出貨給台積電，進軍半導體再邁大步；自動導引運輸車也進駐台積電 5 奈米工廠，未來將擴大導入其他廠區。均豪在本屆 SEMICON 展出 GPM IDMS 智慧感測系統於機械設備預知保養的應用。晶圓傳載解決方案廠家登 ()，半導體事業占整體營收約 75%，第 3 季客戶議價期間暫停出貨，造成整體的營收下滑，不過，董事長邱銘乾表示，第 4 季客戶需求回溫，業績應可止跌回升，此外，晶圓載具可望切入前段製程市場，中國市場新客戶效益有機會發酵，都是明年營運成長動能。帆宣 () 目前在手訂單已達 255 億元創新高，今年營運可望逐季成長，並樂觀看旺至明年，此外，帆宣積極拓展 5G 時代的企業專網市場，跨足智慧城市的基礎建設，將成為明年貢獻業績的動能來源。氣動元件廠亞德客 - KY() 看好產業對自動化需求提升，加上 5G 基地台、手機等應用逐步發酵，今年營收成長將優於平均值，營益率也可望優於去年。原先業務以 PCB 製程自動化設備為主的迅得 ()，近兩年積極跨入半導體領域，目前線邊倉設備已打進台積電供應鏈，預估今年毛利率將提升至近 30%，未來可望擴展至封裝廠。東台 () 在 SEMICON 上展出用於 InFo 與 SiP 製程的雷射鑽孔系統，全自動化與 SECS/GEM 通訊功能可直接用於先進封裝產線上，將攜手東捷 () 聯合推出應用於半導體、5G 電路板製程、封裝檢測等高階機種。
231,2020/09/27,瑪利歐兄弟35週年遊戲助攻Switch買氣暢旺 旺宏受惠,任天堂 (7974-JP) Switch 主機在 9 月 14 至 20 日期間，單周賣出超過 11 萬台，迎接超級瑪利歐兄弟 35 週年的遊戲軟體《超級瑪利歐 3D 收藏輯》，也賣出超過 21 萬套，Switch 主機大賣，遊戲卡匣也銷售暢旺，有利推升記憶體廠旺宏 () 營運動能。據日本電玩綜合情報媒體《Fami 通》24 日公布最新統計數據指出，9 月 14 至 20 日期間，主機單周賣出逾 11 萬台。而任天堂將三款 3D 瑪利歐遊戲《超級瑪利歐 64》、《超級瑪利歐陽光》和《超級瑪利歐銀河》集結而成的遊戲軟體《超級瑪利歐 3D 收藏輯》，9 月 18 日在日本推出後，也已賣出超過 21 萬套，銷售暢旺。旺宏主要供應 Switch 主機 NOR Flash 晶片，並獨家供貨遊戲卡匣 ROM 記憶體，在主機、遊戲卡匣需求同步熱絡下，有助推進旺宏第四季營運動能。任天堂上季 Switch 系列主機全球銷售量達 568 萬台，遊戲軟體銷售 5043 萬套，均較去年同期成長超過 1 倍，表現超乎預期，任天堂預估今年 Switch 產量可達 2500 萬台。
232,2020/09/26,晶心科8月每股虧0.18元 Q4營運可望好轉,晶心科 () 今日 8 月自結，稅後虧損 0.08 億元，每股稅後虧損 0.18 元；由於受疫情干擾，客戶開案態度趨緩，導致 8 月呈現虧損，展望第四季，晶心科認為，營運將再優於本季，明年隨著中國客戶積極導入高階 RISC-V 產品，有助營運表現。晶心科表示，隨著公司下半年開始恢復員工出差中國，且因 RISC-V 中高階產品，已可與 Arm 的同等級產品匹敵，中國客戶採用意願高，有助明年授權金持續成長，是明年主要成長動能。RISC-V 權利金已在今年下半年開始貢獻營收，產品分別為指紋辨識晶片、智慧音箱的音效晶片，晶心科看好，明年將有更多晶片導入量產，RISC-V 權利金也將成為新動能。
233,2020/09/26,遠東新新埔廠北廠區火警意外遭勒令停工1個月,紡織大廠遠東新 () 今 (26) 日公告，接獲勞動部職業安全衛生署來函，新埔化纖廠北廠區熱媒鍋爐熱媒輸送相關作業，及其場所必須停工 1 個月，不過，遠東新強調，備有安全庫存，並調度各廠產能，對公司財務業務無重大影響。遠東新位在新竹新埔的化纖廠北廠區，23 日晚間發生火災，遠東新強調，全力配合調查，並分析、檢討與提出改善對策，準備復工所需資料，並於申請該署核准後立即復工。而先前普遍認為是道生油外洩引發火災，遠東新今日也特別說明，洩漏及於空氣中者為熱媒油，而非道生。遠東新埔化纖廠火災並無人員傷亡，也未波及到產線以及生產主要設備，復工後水煤爐短時間內也可以完成修復，產線將立刻重啟，對營運並無造成重大影響。
234,2020/09/26,尖點5G板鑽孔應用帶動 Q4營收可望再成長,PCB 鑽針及代鑽孔服務廠尖點 () 優化產能的效益今年快速顯現，第三季鑽針產能利用率達 85-90%，代鑽孔業務也達 80% 高水準，在 5G 板鑽針應用需求提升下，第四季營收將較第三季再成長。同時，尖點在 5G 板鑽孔用鑽針開發效益上，將加強產品鍍膜、高散熱、高鑽孔數耐用度，並在台增設 1 條鍍膜線，擴增產品鍍膜產能，可使台灣與大陸廠商形成有利區隔，估 2021 年 5G 應用板鑽孔用鑽針營收，將由今年的個位數營收比重提升到 10% 以上。尖點今年第三季代鑽孔業務稼動率達 80% ，主要來自尖點 2019 年開始執行聚焦收斂策略，不再擴大投入不具生產效益的代鑽孔廠業務，同時不盲目擴充無助去化鑽針的雷射代鑽孔業務，只維持現有設備汰舊換新；在此策略執行下，尖點為 PCB 廠執行的廠內代鑽孔業務稼動率，顯著拉高到 80% 歷史高檔區。尖點今年對鑽針持續進行製程去瓶頸化、並增加 1 條鍍膜產線，今年已增約一成產能。尖點 2020 年第二季稅後純益 6238 萬元，季增 1.92 倍，年增 10%，每股純益為 0.44 元；上半年稅後純益 8376 萬元，年減 4.3%，每股純益為 0.59 元。尖點預期，在第三季的 PCB 需求旺季效應下，營收及獲利表現將優於第二季。
