,News,All,SVO
0,20130325_2940,鉅亨晚報2013年3月25日◇重要新聞內容■賽普勒斯紓困新案獲100億救急，第二大銀行大戶存款「充公」救火！■中俄簽大型軍售，買24架戰機蘇愷35戰鬥機。■國立故宮文物清點殘件未現。故宮：原件價值無損。◇財經要聞■根據《路透社》最新報導，賽普勒斯政府周一（25 日）稍早已與歐盟以及國際貨幣基金組織（IMF）等達成最新的紓困安排，以注資給這個人口不 到百萬的小島國，及其瀕臨崩潰的銀行，現在就是等待這項計畫提案獲區其它國家財長批准。■美國科技網站《The Verge》報導指出，三星電子的機皇 Galaxy S4 方上市不久，現傳出又將推出下一款全新商品，網路上現外流出疑似 Galaxy S4 mini 的間諜照。■報載媒體今(25)日皆傳出行政院政務委員薛琦將主導金融整併，「公公併」將由現行8家公銀整併成4家；今天在立法院財委會引發關注，財政部長 張盛和表示，此事僅止於個人意見，尚未搬上檯面討論，財政部、行政院都沒討論。■美科技網站《AllThingsD》報導，美國西維吉尼亞州擬立法禁止駕駛人開車時，配戴 Google Glass 等頭戴式顯示器。■宏達電()新 HTC ONE話題十足！宏達電新HTC ONE明天就鋪貨給電信商業者可望到貨！◇重要指標■新加坡二月份消費價格指數(CPI)按年上升4.9%◇亞洲股市■台北股市今(25)日收盤上漲 58.90 點或 0.77%，報 7856.12  點，成交金額 590.81 億元。■台股集中市場今(25)日外資買超 15.06 億，投信賣超 0.16 億，自營商賣超 5.32 億，三大法人合計買超 9.57 億元。■韓國Kospi指數收報1977.67點，漲28.96點或1.49%，盤中高見1981.75點，低至1968.14點，開盤報1968.85點。■澳洲S&P/ASX 200指數收報4990.200點，漲22.938點或0.46%，盤中高見5023.200點，低至4968.800點，開盤報44968.800點。■日經225指數收報12546.46點，漲207.93點或1.69%，盤中高見12594.36點，低至12480.42點，開盤報12507.61點。■滬深股市今 (25) 日收盤，上證綜合指數下跌 1.56 點或 0.07%，收報 2326.72 點；盤中高見 2344.89 點，最低至 2317.91 點，成交量 854.19 億。■港股今 (25) 日收盤，香港上漲 135.85 點或 0.61%，報 22251.15 點；盤中高見 22351.08 點，最低至 22201.06 點，成交量 606.77 億。◇亞洲匯市■台北匯市今(25)日收盤，兌美元收報29.889元兌1美元，升值2分，成交量6.08億美元，全日高見29.760元，低至29.910元，波動幅度達1.5角。,"[['紓困新案', '獲', '100億救急'], ['中俄', '籤', '大型軍售'], ['25日週一賽普勒斯政府', '達成', '紓困安排'], ['25日週一賽普勒斯政府', '達成以', '注資小島國'], ['及其', '瀕臨', '崩潰'], ['這項計劃', '獲', '其它國家財長批准'], ['科技網站The Verge報導', '指出', 'Galaxy方上市'], ['三星電子機皇', 'Galaxy', 'S4'], ['流出疑似間諜照', '疑似', 'Galaxy'], ['政務委員薛琦', '主導', '金融'], ['財委會', '引發', '關注'], [' 張盛和', '表示', '此事止'], ['此事', '止於', '個人意見'], ['美科技網站《AllThingsD', '報導', '配戴頭戴式顯示器'], ['立法', '禁止', '駕駛人開車'], [')日外資買', '超', '15.06億'], ['自營商賣', '超', ' 億'], ['韓國Kospi指數', '收', '報'], ['澳洲S&P/ASX 200指數', '收報', '4990.200點'], ['高', '見', '5023.200點'], ['高', '見', '12594.36點'], ['上證綜合指數', '下跌', '1.56點'], ['盤中', '高見', '2344.89'], ['最低', '至', '2317.91點'], ['香港', '上漲', '135.85點'], ['29.889元', '兌', '1美元'], ['波動幅度', '達', '1.5角']]"
0,20130325_2941,黑松在台投資逾20億元執行創新再造計畫今動土內需產業潛力大無限!除了統一()將投資100億元在新竹湖口投資綜合食品園區之外，老牌飲料廠黑松()並進行投資逾20億元的「中壢總廠製造三場」，且在今天動土正式落實「創新再造計畫」的第一步。黑松此一投資總投資金額超過20億元的「中壢總廠製造三場」，今天動土後，預計在2014上半年完工後，未來新產線每分鐘產量可達600瓶，除了產能的提升之外，更重要的是黑松也將正式具備台灣最先進、第1條世界級的「無菌碳酸/非碳酸多功能寶特瓶生產線」，用以製造具差異化與創新的高附加價值飲料產品。黑松公司強調，新廠房充份展現黑松實踐「綠色企業」的理念決心，以綠化量、基地保水、日常節能、二氧化碳及廢棄物減量、水資源利用方式、污水及垃圾處理、生物多樣化與室內健康及環境等9大綠建築指標為設計概念，朝中壢工業區首座「級」綠建築廠房為目標邁進；而全新「無菌碳酸/非碳酸多功能寶特瓶生產線」還是1條省能源、省水源、省包材的綠色環保節能生產線，生產效率可增進到一分鐘600瓶，包材輕量化可節省約30%的包材使用量。馬英九總統今天並親臨黑松中壢總廠製造三場動土典禮，現場為黑松持鍬動土。,"[[')', '進行', '投資逾製造三場'], ['投資', '逾', '製造三場'], ['總投資金額', '超過', '製造三場'], ['每分鐘產量', '可達', '600瓶'], ['更重要的', '是', '黑松具備無菌碳酸/非碳酸多功能寶特瓶生產線'], ['黑松', '具備', '無菌碳酸/非碳酸多功能寶特瓶生產線'], ['用以飲料產品', '製造具', '差異化'], ['黑松公司', '強調', '新廠房展現理念決心'], ['新廠房', '展現', '理念決心'], ['黑松', '實踐', '綠色企業'], ['黑松', '實踐', '綠色企業'], ['生產效率', '增進到', '包材使用量'], ['總統馬英九', '親臨', '動土典禮'], ['黑松中壢總廠', '製造', '三場'], ['黑松中壢總廠', '製造', '三場']]"
0,20130325_2942,宏達電行銷戰強打在地生活、好玩有趣！新一波代言人找上王力宏宏達電()新HTC ONE最快明天將到貨，行銷戰也開打，在繼公告大中華地區代言人五月天後，預計4月中公佈另一波品牌代言人就是歌手王力宏！宏達電行銷長何永生表示，「大膽(bold)、真實(authentic)、活潑(playful)」是今年行銷策略重點，而且「會放一些好玩的東西」，讓廣告內容將貼近在地生活。宏達電新HTC ONE發布的很大聲，不再是「quietly brilliant」?何永生說明，quietly brilliant是內部文化，產品發表上會強調功能廣告語，三星的發表會上，宏達電很大膽的行銷，但不是去攻擊。而是展示自己的產品，讓大眾能比較，消費者會有自己的想法。宏達電這次行銷廣告企圖心十足，何永生強調，今年行銷會增加，鎖定具11億人口的科技重度使用者，目前合作電信業者從140家擴增至200多家，數位媒體預算會年增250%，傳統媒體預算也會增加100%。不過更令市場好奇的是宏達電今年將以何種廣告吸引消費者目光，何永生說明，這次廣告會平衡，也很生活化，先聚焦推出相關Blinkfeed、HTC Zoe、Boomsound功能廣告後，會推出更多廣告。目前宏達電流露出的相關廣告，的確令人耳目一新，正如何永生所言「這次放了很多好玩的video，讓功能應用更生活化」。包括：按摩師電話廣告篇，強調一翻過來就手機就靜音，按摩師也將吵雜的客戶翻過來就靜音；尋找女友電話篇，手機掉入廁所馬桶防波水，又可智慧播話都等，廣告內容取自生活片段，但都詼諧有梗，有笑點。此外，這次大中華地區品牌代言人其實還有隱藏版，除了天團五月天外，即是歌手王力宏，今年尾牙宏達電邀請王力宏登台獻唱已預留伏筆。據了解，五月天和王力宏相關廣告在中國、香港和台灣都會播出，預計4月中旬就可目睹！至於廣告詳細內容，據了解，國際版歐洲將以LIVE HOME SCREEM為主題，北亞地區廣告將以王力宏強調新HTC ONE 的Blinkfeed功能和翻蓋靜音，北亞區廣告也會有五月天主打Boomsound 相關功能。3支廣告推出後，也不排除會再出整合版，搶進消費者目光焦點。,"[['宏達電行銷戰強', '打在', '地'], ['新一波代言人', '找', '王力宏宏達電('], ['繼', '公告', '大中華地區代言人'], ['品牌代言人', '就是', '歌手王力宏'], ['宏達電行銷長何永生', '表示', '大膽'], ['何永生', '說明', '攻擊'], ['quietly brilliant', '是', '內部文化'], ['消費者', '有', '自己想法'], ['何永生', '強調', '行銷會增加'], ['鎖定', '具', '科技重度使用者'], ['合作電信業者', '擴增至', '200多家'], ['數位媒體預算', '增', '250%'], ['傳統媒體預算', '增加', '100%'], ['令的', '是', '宏達電吸引消費者目光'], ['宏達電', '吸引', '消費者目光'], ['何永生', '說明', '平衡'], ['永生所言', '放', '好玩video'], ['手機', '掉入', '防波水'], ['智慧', '播', '話'], ['廣告內容', '取自', '生活片段'], ['大中華地區品牌代言人', '還有', '隱藏版'], ['北亞地區廣告', '強調', 'Blinkfeed功能'], ['主打', 'Boomsound', '相關功能']]"
0,20130325_2943,日盛投顧：前波見高未爆大量，結構屬整理走勢1.賽國風暴對國際股市影響漸弱，週一亞股轉強，台灣也受激勵開出高盤；盤面上，業界建議官股銀行整併訊息帶動金融股走高(彰銀、台企銀、合庫金較強)，電子股則以面板股(友達、群創)帶頭補漲，部份LED及記憶體族群走勢不弱，傳產部份以生醫股表現最為整齊，另外資產營建、水資源概念題材也相對強勢，加上大型股走穩，最後大盤以上漲59.9點的7856.12作收，整場追價意願不高，指數高低點也只有23點，成交量萎縮至592.53億元。2.近期指數壓回後就在一直在季線位置上下來回，其間量能也一直無法有效擴大，這雖不利短期多方攻擊，但由於前波見高時(8089點)沒有爆出異常大量，因此大盤回檔的幅度將不會太大，整體的結構上只可視為整理走勢(要脫離整理，則要收紅並補量到800億以上)；籌碼上，三大法人3/12在現貨反手賣超後，就一路站在賣方，直到今日才出現回補(其中外資買15.06億，投信減碼0.16億，自營則賣超5.32億，合計三大法人買超9.57億)；相對外資在作法則與現貨不大一致，在結算完畢後，目前仍是淨多部位，意味外資除對盤勢保守外，多空方向看法也不明確。3.目前選股上，先拉回整理轉強者(資產、營建、面板)，部份電子股(3月營收預期表現佳者、年報優於預期者)，及法人或資金仍未撤出者的族群(如部份傳產大型股、指標金融股)都是可考慮介入標的。結構：部份大型股走勢仍穩，生醫、資產為指標　　　跌深蘋果及大型股止穩反彈，人氣指標看IC設計，面板、記憶體多方不變　　　金融指數920-925點為短多防守點1傳產大型股走勢如1216統一、1907永豐餘、2501國建走勢仍穩。中概以9914美利達、9910豐泰為代表，另外中線有止穩訊號的9945潤泰新則可納入參考；資產已先拉回短期轉強者，像在低檔的2504國產、2515中工、2547日勝生都是可考慮的；生醫短線具代表者有1734杏輝、8406F-金可、1737台鹽，及在相對低檔的4164承業醫、4142國光生。2.電子指數上檔轉折在296點(站上對多方有利)。連續多日收黑重量級個股2330台積電今日止穩，二線封測6257矽格為多頭指標；2308台達電、高價股3673F-TPK、3008大立光、2357華碩仍在整理；蘋果概念股收紅，但漲幅都不大；中小型股弱轉強指標看2458義隆電、3034聯詠及3545旭曜及3698隆達；面板及記憶體3481群創、2409友達、8299群聯、3260威剛多方格局沒有改變。3.金融股指數920-925點為目前下檔支撐區，942點為上檔轉折點。近期法人買超金融動作雖不如之前積極，但只要佔大盤成交比重不低於10%太多，則市場資金將不易退去；再者金銀會沒開之前，也沒有利多出盡問題。短期強勢指標在官股行庫(2801彰銀、2834台企銀)，中長期具代表，且有籌碼優勢者為2882國泰金、2881富邦金、2884玉山金等。,"[['結構', '屬', '整理走勢'], ['臺灣', '受', '激勵'], ['業界', '建議', '並訊息帶動金融股高走'], ['並訊息', '帶動', '金融股高走'], ['指數高低點', '只有', '23點'], ['成交量', '萎縮至', '592.53億元'], ['8089點', '爆出', '異常大量'], ['投信', '減', '0.16億'], ['三大法人買', '超', '9.57億'], ['年報', '優於', '預期者'], ['撤出者族羣', '都是', '考慮介入標的'], ['可', '考慮', '介入'], ['深蘋果', '爲', '指標'], ['面板', '不變', '\u3000\u3000\u3000金融指數'], ['另外中線', '有', '止穩訊號'], ['另外中線', '有', '止穩訊號'], ['9945潤泰新', '納入', '參考'], ['資產', '拉回', '轉強者'], ['2504國產', '都是', '考慮的'], ['生醫短線具代表者', '有', '1734杏輝'], ['電子指數上檔', '轉折在', '296點'], ['二線封測6257矽格', '爲', '多頭指標'], ['蘋果概念股', '收', '紅'], ['股弱轉指標', '看', '2458義隆電'], ['金融股指數920925點', '爲', '支撐區'], ['942點', '爲', '上檔轉折點'], ['法人', '買', '超金融'], ['法人', '買', '超金融'], ['只要', '佔', '大盤成交'], ['佔大盤成交比重', '低於', '10%太多'], ['金銀', '開', '會'], ['沒', '開', '會'], ['強勢指標', '在', '2801彰銀'], ['籌碼優勢者', '爲', '等2882國泰金']]"
0,20130325_2944,"統一期貨：三大期指逆價差收斂，有利於止跌周五歐美股市上漲，日、韓開高之下，台股開高震盪；電子類股部分，權值股上漲居多，台積電一度站回百元關卡，面板雙虎大漲，友達觸及漲停；金融類股利多大漲，國泰金上漲超過1%；傳產類股，紡織與玻璃表現較佳；收盤上漲59點，收在7856點，成交值為593億元。在期指部分，上漲77點，逆價差為5.12點；電子期上漲2.9點，逆價差為0.38點，金融期上漲14點，正價差則為0.1點，三大期指逆價差收斂，有利於止跌。就未平倉部位分析，自營商淨空單減少1,714口，淨空單部位4,131口；投信淨多單增加140口，淨多單部位255口；外資淨多單增加1,094口，淨多單部位5,119口；在籌碼面部份，外資買超現股15億元，期貨淨多單部位增加，看法偏向多方。就技術面觀察，開高震，呈現無量反彈，不過再度站回季線，外資現貨由賣轉買，期貨多單部位增加，加上殺尾盤跡象不再現，整體短線空方氣氛趨緩，短線不宜再度跌破季線，否則行情恐回測年線。","[['日', '韓開', '高'], ['、', '韓開', '高'], ['上漲', '超過', '1%'], ['成交值', '爲', '593億元'], ['逆價差', '爲', '5.12點'], ['金融期', '上漲', '14點'], ['正價差', '爲', '0.1點'], ['三大期', '指', '逆價差收斂'], ['三大期指逆價差收斂', '有利於', '止跌'], ['自營商淨空單', '減少', '1'], ['外資', '買', '外資'], ['看法', '偏向', '多方'], ['短線', '不宜', '跌破季線']]"
0,20130325_2945,台股收盤漲59點　收在7856點台股今天跟隨國際市場呈現反彈，指數重回季線以上。金融股受到公股行庫整併消息面影響，領軍反彈，類股指數平均漲幅超過1%。重量級電子股也一掃上週的陰霾，台積電一度回升到百元以上，宏達電表現也不錯，加上面板二虎、LED股強勢表態，大盤終場上漲59點，以7856點作收，收盤量593億元。反彈缺量成為短線隱憂，本週大盤如果要繼續往上，成交量應再擴大。（張佳琪報導）國際股市走揚給予台股反彈契機，大盤早盤開高向上，表現不錯。市場焦點擺在金融股身上，三次金改可能推動公股行庫整併的消息，激勵金融股多頭士氣，公股行庫一開盤隨即展現強勁漲勢，資金流入，包括富邦金、國泰金、中壽等多檔重量級個股也啟動攻勢，推升金融股平均漲幅達1%以上。電子股則是面板股與LED股漲勢最強，友達一度攻上漲停板，群創大漲5%且盤中創下19.15元的波段新高，人氣紅不讓。台積電股價也有回升，盤中最高攻抵100.5元價位，類股漲幅在1%以上。有了主流股支撐，大盤收紅上漲59點。國泰證期顧問處協理簡伯儀表示，以目前的技術面來看，週二大盤有機會再挑戰十日線。簡伯儀說：「日KD指標如果明天有機會挑戰十日線的話，應有機會在低檔出現日KD的交叉」。收盤量低於六百億，短線大盤必須補量，一般認為，至少有要有八百億的資金動能較有利行情表現。,"[['7856點臺股', '跟隨', '國際市場'], ['指數', '重回', '季線以上'], ['金融股', '受到', '並消息面影響'], ['平均漲幅', '超過', '1%'], ['臺積電', '回升', '一掃上週陰霾'], ['反彈缺量', '成爲', '短線隱憂'], ['大盤早盤', '開', '高'], ['市場焦點', '擺在', '金融股身上'], ['三次金改', '推動', '整並消息'], ['公股行庫', '展現', '強勁漲勢'], ['平均漲幅', '達', '1%以上'], ['電子股', '是', '最強'], ['盤中', '創下', '19.15元'], ['臺積電股價', '也有', '回升'], ['最高攻', '抵', '100.5元價位'], ['類股漲幅', '在', '1%以上'], ['大盤', '收', '紅'], ['國泰證期顧問處協理簡伯儀表', '示', '週二大盤有機會'], ['有機會', '出現', '日KD交叉'], ['收盤量', '低於', '六百億']]"
0,20130325_2946,上福去年EPS 2.13元決配發1.7元股息 盈餘配發率近80%事務機器耗材廠商上福全球()2012年營運倒吃甘蔗，其下半年的獲利明顯優於上半年的表現，上福全球2012年財報稅前盈餘為2.47億元，稅後盈餘1.94億元，依照上福的9.11億元股本計算，每股稅後盈餘為2.13元；同時，上福今天召開董事會並決議對於去年股利配發現金股息1.7元。上福全璩的此一董事會決議去年股利配發案，其盈餘的配發率達到79.12%。上福將在5月31日召開股東會。上福在本次的股東會中將進行董監事全面改選。上福全球2012年全年財報營收14.13億元，營業毛利5.83億元，毛利率為41.23%，優於2011年的38.3%，營業淨利為2.87億元，稅前盈餘為2.47億元，稅後盈餘1.94億元，依照上福的9.11億元股本計算，每股稅後盈餘為2.13元同時，由上福全球轉投資的「台中港酒店」已在3月1日正式投入營運，上福全球主管今天指出，此一酒店的的經營主要主要鎖定商務客為目標客群，目前觀察住房率在上升之中，而餐廳則有較佳的業績表現。上福全球100%轉投資的台中港酒店股本為7億元，上福全球對於台中港酒店實際投入的資金近10億元，並聘請來的專業管理經團隊進駐經營。上福全球100%轉投資的台中港酒店設計有202間客房，其主要鎖定的客層為來自台中港關連工業區、加工出口區甚至彰濱工業區的商務客。,"[['去年EPS', '配發', '1.7元股息'], ['稅前盈餘', '優於', '上半年表現'], ['稅後盈餘', '爲', '2.13元'], ['上福', '召開', '董事會'], ['盈餘配發率', '達到', '79.12%'], ['上福', '召開', '股東會'], ['上福', '進行', '董監事改選'], ['毛利率', '爲', '41.23%'], ['營業淨利', '爲', '2.87億元'], ['稅前盈餘', '爲', '2.47億元'], ['轉投資臺中港酒店', '投入', '營運'], ['一酒店經營', '鎖定', '目標客羣'], ['觀察住房率', '在', '上升之中'], ['餐廳', '有', '業績表現'], ['轉投資臺中港酒店股本', '爲', '7億元'], ['轉投資臺中港酒店設計', '有', '202間客房'], ['其鎖定客層', '爲', '來自工業區商務客']]"
0,20130325_2947,群益期貨台股期權盤後－賽普勒斯紓困案過關 台股跳空重回7800◆盤勢分析台股今天盤前受到美股期貨上漲0.4%的激勵，一開盤就直接越過頸線，留下了一個小缺口，但是高點也剛好在上方的缺口下緣，成交量繼續縮減，減少至600億以下，短期均線仍快速下彎，況且短期下降壓力線尚未能突破，還未能確定底部已經成立。外資已經期貨多單增加至五千多口。以4月份擇權合約來看，買權OI小於賣權OI擴增至一萬兩千多口。代表支撐的下方賣權OI往上移動至7600點的履約價；而上方依舊在8000~8100點。月選擇權籌碼屬偏多，周選擇權籌碼屬偏多。總結來說，今天台股漲了將近1個百分點，而且期貨漲幅比現貨來得大，但是成交量來到缺口前又急凍，是否開始反彈還不能太早下定論，需有更明確的訊息。不過就賽普勒斯情況漸明朗，選擇權籌碼扭轉偏多，盤勢就算下跌空間也不大。,"[['臺股', '受到', '美股期貨上漲激勵'], ['短期均線', '下', '壓力線突破'], ['買權OI', '小於', '賣權OI擴增'], ['賣權OI', '擴增至', '一萬兩千多口'], ['賣權OI移動履約價', '代表', '支撐'], ['賣權OI', '移動至', '7600點'], ['上方', '在', '~8100點'], ['周選擇權籌碼', '屬', '多'], ['成交量', '來到', '缺口']]"
0,20130325_2948,國泰期貨台指選擇權盤後分析◆盤勢分析上週五美股反彈，市場預期賽普勒斯紓困案會得到解套，四大指數漲幅介於0.63%~1.14%之間，而在今日協商會議也符合市場預期的進展順利，推升亞股普遍收紅。台指今日也在紓困案出現曙光下由金融類股領漲，開高68點，盤中維持高檔狹幅震盪，尾盤收高77點，以7851點作收。目前指數落於季線之上、前波挑空缺口下緣，就現況僅能視為跌深反彈，是否為反轉跡象仍需待指數重回月線之上，而在今日雖然漲幅將近1%，現貨成交量卻萎縮至600億之下，表示追價意願不高，恐難以推升指數續攻，操作上仍建議保守偏空為宜。台指籌碼面部分，外資今日多單加碼1094口，大台未平倉部位為多單5119口；三大法人整體未平倉為多單1243口，顯示目前三大法人對於台指看法為偏多。選擇權CALL及PUT成交量最大的序列分別是8000CALL及7600PUT，其序列為目前上檔及下檔的指數區間位置，PUT/CALL值目前來到1.06，顯示指數應以震盪格局視之。,"[['市場預期賽普勒斯紓困案會', '得到', '解套'], ['四大指數漲幅', '介於', '0.63%之間'], ['協商會議', '符合', '推升亞股收紅'], ['推升亞股', '收', '紅'], ['尾盤', '收', '高'], ['指數', '落於', '季線之上'], ['前波', '挑', '前波'], ['挑前波空缺口', '下', '緣'], ['現況', '視爲', '跌深反彈'], ['反轉跡象', '需待', '指數重回月線'], ['仍', '需待', '指數重回月線'], ['指數', '重回', '月線'], ['現貨成交量', '萎縮至', '600億'], ['表示高', '追', '價'], ['未平倉部位', '爲', '多單'], ['三大法人平倉', '爲', '多單1243口'], ['對於看法', '爲', '多'], ['最大序列', '是', '8000CALL'], ['其序列', '爲', '指數區間位置'], ['PUT/CALL值', '來到', '1.06'], ['指數', '視', '之']]"
0,20130325_2949,乾景投顧盤後分析－外資期貨偏多操作  台股後勢轉趨樂觀◆盤勢分析外資期貨偏多操作  台股後勢轉趨樂觀聯準會主席柏南克上周針對賽普勒斯問題發表看法，認為該國問題對經濟影響不大，美國股市投資人大受振奮，不等賽國金援問題是否有解就展開反彈，亞股周一在美股收紅帶動下也呈現大漲走勢，台股早盤也跳空大漲66點，一口氣站回季線之上，不過在追價意願不高的情況下，台股指數未能再往上突破，終場台股上漲59.9點收在7856點，成交量萎縮至590億元。綜觀台股周一表現仍以金融表現最佳，整體漲幅超過1%，由於金融股為台股前波攻上八千大關的主要功臣，金融股的止穩的確有利於提升多方的信心，只不過近3個交易日台股平均只有600餘億的成交量，這次要回攻八千點的難度更高，建議持續觀察台股成交量的變化。籌碼方面，截至目前為止台股呈現K線連10黑，其間外資法人雖連續9天賣超台股，累計共賣超430餘億元，本土投信法人賣超動作也是不落人後，呈現連續第19天的賣超。不過外資繼上周四及周五的賣超金額明顯的下降之後，周一已反手買超台股15億元，加上外資及投信在期貨方面的布局仍持續維持多方操作，尤其是目前外資已累積了5000口左右淨多單，預估在法人賣壓告一段落後，台股後勢仍大有可為。簡福杉分析師,"[['後勢', '轉趨', '樂觀'], ['亞股週一', '投資人大受', '振奮'], ['成交量', '萎縮至', '590億元'], ['整體漲幅', '超過', '1%'], ['金融股止穩', '有利於', '提升多方信心'], ['近3個交易日臺股', '只有', '600餘億成交量'], ['回', '攻', '八千點'], ['臺股', '呈現', '10黑'], ['外資法人', '賣', '超臺股'], ['在佈局', '維持', '多方操作']]"
