,News,All,SVO
0,20130812_621,"鉅亨早報2013年8月12日■ HTC宏達電()9日與台灣電信業者共同推出HTC One mini，宏達電表示，全球經濟仍面臨挑戰，不過，第3季台灣旺季動能看起來還不錯，由於手機市場往中階發展，因此，宏達電中階手機的比重會在量的方面會增加 ■ 宏碁()法說會中釋出第3季產品出貨量比第2季成長5%以內，營益率力拚「損益兩平」，多位外資認為宏碁第3季營益率難逃虧損，今年全年也將虧損，紛紛下調目標價，目前出爐的外資研究報告中，以高盛證券最低，目標價僅15元 ■ 在台股持續籠罩沉悶氣氛下，台灣央行罕見對此表示，要「推動外資以股票為擔保品，向國內金融機構借投資股市」，央行大動作鼓勵外資不用從海外提錢，可直接透過股票質借，希望藉此快速激勵外資持續進場買股的意願。 ■ 金管會9日就第三方支付邀集跨部會與業者討論，金管會主委曾銘宗表示，關於非金融業第三方支付業者儲值金額上限僅有1萬元，是否調整，將與經濟部觀察過去的交易情況及開放後交易筆數與金額後再檢討。 ■ 為便於消費者帳戶使用管理，並為預防金融犯罪，衡酌業者帳戶管理成本，金管會今(8)日表示，9月起，凡設有靜止戶的銀行業，應善盡管理人責任，對即將轉入靜止戶要先通知存款人。 ■ 筆電品牌宏碁()董座王振堂指出，宏碁正持續改善產品組合，以掌握市場需求動向，除持續拉高高階產品比重，Google系統產品數量也將快速提升，今年底Google裝置產品(平板、智慧型手機與Chromebook)出貨比重估達10-12%左右，明年期望能攀升至20-30%，以此平衡產品發展。 ■ 台積電()()9日公佈2013年7月營收報告。7月合併營收約為521.3億元，較上月減少了3.6%；公司特別說明，精材科技股份有限公司(Xintec)的營收將不再列入台積公司的合併財務報表中，使得和上月及去年同期相較結果之百分比均減少了0.6個百分點。 ■ 筆電品牌華碩()9日召開法說會，並公布第 2 季財報，淨利為47.65億元，季減21%，每股稅後盈餘為6.3元；第 2 季筆電出貨量為410萬台，季減12.7%，平板出貨200萬台，季減33%。 ■ 有「末日博士」封號的知名投資人麥嘉華 (Marc Faber) 周四 (8 日) 警告，今年來漲勢持續耀眼的美國股市，恐怕將重現 1987 年股市大漲後隨即暴跌的危險走勢。 ■ 《彭博社》報導，瑞士信貸集團（Credit Suisse Group）預估短期升破關鍵關卡後將有一波上揚，然後反轉向下進入另一階段的長期跌勢。 ■ 根據經濟合作與發展組織 (OECD) 周四 (8 日) 發布調查，包括中國、俄羅斯、巴西及印度等「金磚四國」新興市場國家代表，經濟成長前景正出現令人擔憂的跡象。反觀美國、歐洲及日本等已開發經濟體，成長動力卻看升 ■ NCC將在12日對7家投標業者做最後資格審查，也是7家投標業者能否進入競標行列的第一關，傳出主帥親自上陣者包括鴻海()郭台銘、頂新集團魏應交、中華電()李炎松、遠傳()徐旭東、亞太電信()邱純枝等都將長將帶團前往「面試」。 ■ 澳洲央行(RBA)周五(9日)下修經濟成長預期，但對未來的利率展望則未明確表示，僅說它將「視需要」調整。  (接下頁)[NT:PAGE=$]■中國政府網昨日發布《國務院關於加快發展節能環保產業的意見》，當中提出節能環保產業的目標是產值年均增幅超過15%，到2015年，總產值達4.5萬億元，成為國民經濟新的支柱產業。■大陸即將擴大房產稅試點，預計今年10月份杭州將開徵房產稅，成為繼上海與重慶後，第3個試行房產稅的城市。■霸菱資產管理表示，東盟地區的增長前景仍然十分理想。基於製造業基地的地域分布考慮，越來越多跨國公司考慮採取「中國+1」策略。中長線而言，該行十分看好東南亞市場的前景，並相信近期市場的回落為錯過之前股市升勢的投資者帶來了趁低吸納的良機。■大陸國台辦發言人楊毅指出，大陸對民進黨的政策沒有變化。民進黨不改變「台獨」立場，我們就不會與其進行黨際交流。■在經歷了一週多的焦慮與惶恐後，美國國務院當地時間9日宣佈，自4日起、出於對恐怖主義擔憂而關閉的19個國家的美國駐外領事館中，18個將於當地時間11日重新開放。■俄羅斯總統普京簽署法案，禁止宣揚同性戀，引發爭議。同性戀權益分子發起杯葛明年於俄國索契舉行的冬季奧運會，蒐集到32萬網民聯署聲援。英國首相卡梅倫與美國總統奧巴馬均批評新法涉及歧視，但反對杯葛冬奧。■荷蘭一家名叫「火星一號」（Mars One）的私人公司發起一項單程火星殖民計畫，在二○二二年送首批四個人出發前往火星，然後讓他們在火星上建立新家園及度過餘生。雖然是一條有去無回的不歸路，但該公司聲稱，至今已有超過十萬人報名。■日本是個網購十分成熟的市場，據最新《日本通訊發展趨勢報告》指出，網絡購物是日本網民第二位的電腦上網目的，有近46.9%日本網民使用電腦網購。■美國政府財政緊絀，期望藉加強海外查稅打擊逃稅，但未見其利先見其害。美國官方《聯邦公報》指，上季有1,130人放棄美國國籍，按年升6倍，創歷史新高。專家指，美國海外查稅複雜和繁瑣，海外居民報稅時費時失事，稍有不慎更會誤墮法網，令不少人索性放棄國籍。■本周有兩大藍籌的業績值得關注，分別是本周三（14日）的騰訊（0700）及本周四（15日）的中移動（0941）兩股的中期業績，上周中聯通（0762）業績雖然有「早泄事件」的小插曲，但半年多賺55%大勝預期市場，刺激股價連彈兩日升近5%；投資者亦憧憬騰訊帶來驚喜，但對中移動則看淡。(接下頁)[NT:PAGE=$]■由金管局、證監會及保監處聯手制定的銷售投資相連壽險計畫新指引一出，即趕絕銀保的投連險業務，即使匯豐、渣打香港兩大行也不例外，令銀行銷售投連險近乎絕跡。匯豐表面上雖繼續有售投連險，但早前已下令前線銷售人員不用銷售此產品，渣打則於6月底停售。■英國泰晤士高等教育（THE）今日會公布一項全新的「世界學術峰會創新指數」，就大學學術及科研人員的「商業價值」，即從業界所獲的人均研究經費作國際性排名，當中以韓國及新加坡高居第一及第二位，但香港被遠遠拋離只排第二十。■傳於今年下半年來港上市的內地食品公司安琪集團，公司董事長梁球勝日前於北京活動上表示，目前未有來港上市的時間表，強調不能排除在其他地方上市的可能性。但他承認，現時已在聯絡戰略投資者，如上市會將旗下的3間子公司一併上市。該公司早於07年已分拆其中一間子公司到新加坡上市，至2011年私有化。■德國《明鏡》周刊日前披露更多美國中情局前職員斯諾登提供的文件，顯示美國國安局(NSA)將監視對象分為5級，中國、俄羅斯和伊朗等國家被列為最高的一級。■本周四是日本戰敗投降紀念日，部分內閣成員已表示有意當日參拜靖國神社，料將引起中韓等鄰國不滿。東京前晚有數百名分別支持及反對拜鬼的示威者遊行，警方調停期間與右翼組織成員一度衝突。■大陸食品安全再現隱患，公安日前破獲一起獸藥非法添加「瘦肉精」案，江西一知名獸藥企業為提升藥效，竟在給家畜治病的獸藥中添加違禁物質，導致多家養殖戶生豬被染「瘦肉精」。■廣東省政府昨日（11日）緊急召開全省人感染H7N9禽流感防控工作領導小組會議，研究部署當前防控工作。省疾病預防控制中心主任張永慧在會上透露，廣東首例H7N9患者經營的雞鴨已基本查明來源，其中雞隻來源於東莞市橋頭鎮三鳥批發市場，鴨子購自惠州市博羅縣橫河鎮沙上村村民自養鴨。■法國八月初的一場雹暴導致釀酒商損失慘重，著名釀酒區波爾多的葡萄園約有百分之五被摧毀，導致乾白葡萄酒供應短缺，波爾多白酒價格料將上升。連同受雹暴摧毀的勃艮第葡萄園，估計兩個釀酒區的損失料高達一億。■亞太區掀起航母競賽，繼日本準航母「出雲號」上周下水後，印度首艘國產航空母艦「維克蘭特號」也將於今日正式下水，標誌該國成為全球五個自行設計和生產航母的國家之一。該國第一艘國產核動力潛艇「殲敵者號」的外海試航，亦已準備就緒。(接下頁)[NT:PAGE=$]■ 美國6月躉售庫存下降0.2%至4992億美元，也是自2009年以來首度出現連續三個月下降。■法國6月工業產出意外下滑1.4%■英國二季度建築業產出季率升1.4%■意大利6月季調後貿易帳盈餘30.91億■英國6月商品貿易赤字收窄至80.82億■中國7月M2同比增長14.5%，新增貸款6999億元■中國7月份工業增加值同比增長9.7%，勝預期■中國7月CPI持平於2.7%，略低於預期■日本7月家庭消費者信心指數43.6，前值44.3■日本7月M2貨幣供應年率上升3.7%，升幅略低於上月■  9 日跌 72.81 點或 0.47%，收 15425.51 點。■ Nasdaq 指數 9 日跌 9.01 點或 0.25%，收 3660.11 點。■  指數 9 日跌 6.06 點或 0.36%，收 1691.42 點。■ 指數 9 日跌 2.55 點或 0.54%，收 471.76 點。■ 歐洲 Stoxx 600 指數 9 日漲 1.75 點或 0.58%，收 305.92 點。■ 英國 FTSE 100 指數 9 日漲 53.71 點或 0.82%，收 6583.39 點。■ 德國 DAX 30 指數 9 日漲 19.99 點或 0.24%，收 8338.31 點。■ 法國 CAC 40 指數 9 日漲 12.23 點或 0.30%，收 4076.55 點。■台北股市 9 日收跌51.53 點或0.65%，收盤報7856.14點。■澳洲 S&P/ASX 200 指數 9 日收報5055.2點，跌9.599點或0.19%。■日經 225 指數 9 日收報13615.19點，漲9.63點或0.07%。■南韓 Kospi 指數 9 日收報1880.71點，跌3.26點或0.17%。■上海 9 日上漲 7.34 點或 0.36%，報 2052.24 點。■香港恒生指數 9 日上漲 151.68 點或 0.70%，報 21807.56 點。■ COMEX 12 月 9 日漲 2.30 美元，結算報每盎司 1312.20 美元。■ NYMEX 9 月原油期貨 9 日漲 2.57 美元或 2.5%，結算報每桶 105.97 美元。■ ICE 倫敦 9 月布倫特原油 9 日漲 1.57 美元或 1.5%，結算報每桶 108.25 美元。■ CBOT 9 月小麥期貨 9 日跌 7-3/4 美分或 1.2%，收每英斗 6.33-1/2 美元■ CBOT 9 月玉米期貨 9 日跌 8 美分或 1.7%，收每英斗 4.65-1/2 美元■ CBOT 11 月黃豆期貨 9 日跌 2 美分或 0.2%，收每英斗 11.82-1/4 美元■兌美元 9 日收報29.955元兌1美元，升值0.5分，成交量4.55億美元。■兌美元 9 日收6.1230，較昨日6.1225，跌5點。■台北時間 12 日 8 時 25 分，報 81.13 點，漲 0.004 點或 0%，開盤報 81.125 點，昨收價 81.126 點。■美元兌報 96.164 元，貶 1.6 分或 0.02%，開盤報 96.15 元，昨收價 96.18 元。■兌美元報 1.3337 元，升 0.02 分或 0.01%，開盤報 1.33358 元，昨收價 1.3335 元。■兌美元報 1.5513 元，升 0.23 分或 0.15%，開盤報 1.5494 元，昨收價 1.549 元。■美元兌瑞郎報 0.9222 元，貶 0.062 分或 0.07%，開盤報 0.92233 元，昨收價 0.92282 元。■美元兌報 1.0285 元，貶 0.01 分或 0.01%，開盤報 1.0289 元，昨收價 1.0286 元。■兌美元報 0.9192 元，貶 0.06 分或 0.07%，開盤報 0.91947 元，昨收價 0.9198 元。","[['HTC宏達電9日', '推出', 'HTCOne mini'], ['宏達電錶', '示', '全球經濟面臨挑戰'], ['全球經濟', '面臨', '挑戰'], ['多位外資', '認爲', '第3季營益率難逃虧損'], ['臺股', '籠罩', '沉悶氣氛'], ['持續', '籠罩', '沉悶氣氛'], ['外資', '爲', '擔保品'], ['金管會主委曾銘宗', '表示', '儲值金額上限僅有1萬元'], ['儲值金額上限', '僅有', '1萬元'], ['8日', '表示', '善管理人責任'], ['()董座王振堂', '指出', '宏碁改善產品組合'], ['宏碁', '改善', '產品組合'], ['宏碁', '改善以', '掌握市場需求動向'], ['平板產品出貨', '估達', '-12%左右'], ['7月合併營收', '爲', '521.3億元'], ['公司', '說明', '精材科技股份有限公司Xintec營收列入財務報表中'], ['精材科技股份有限公司Xintec營收', '列入', '財務報表中'], ['筆電品牌', '召開', '法說會'], ['淨利', '爲', '47.65億元'], ['季', '減', '21%'], ['每股稅後盈餘', '爲', '6.3元'], ['筆電出貨量', '爲', '410萬臺'], ['季', '減', '12.7%'], ['季', '減', '33%'], ['美國股市', '重現', '危險走勢'], ['GroupSuisse預估', '有', '上揚'], ['成長前景', '出現', '令人跡象'], ['等美國', '開發', '經濟體'], ['成長動力', '看升', '■NCC做資格審查'], ['■NCC', '做', '資格審查'], ['成長動力看升■NCC做資格審查', '也是', '第一關'], ['投標業者', '進入', '競標行列'], ['能否', '進入', '競標行列'], ['等郭臺銘', '帶', '團'], ['澳洲央行RBA', '修', '經濟成長預期'], [']中國政府網', '發佈', '國務院關於加快發展節能環保產業的意見'], ['節能環保產業目標', '是', '年均增幅超過15%'], ['年均增幅', '超過', '15%'], ['總產值', '達', '4.5萬億元'], ['大陸', '擴大', '房產稅試點'], ['成爲試行房產稅城市', '繼', '後'], ['第3個', '試行', '房產稅'], ['霸菱資產管理', '表示', '理想'], ['越來越多跨國公司', '考慮', '採取中國+1策略'], ['該行', '看好', '東南亞市場前景'], ['大陸國臺辦發言人楊毅', '指出', '對政策變化'], ['民進黨', '改變', '臺獨立場'], ['我們', '進行', '黨際交流'], ['當地時間', '宣佈', '18個開放'], ['俄羅斯總統普京', '簽署', '法案'], ['權益分子', '發起', '冬季奧運會'], ['新法', '涉及', '歧視'], ['荷蘭一家', '名叫', '火星一號'], ['私人公司', '發起', '殖民計劃'], ['該公司', '聲稱', '已有超過人報名'], ['日本', '是', '成熟市場'], ['網絡購物', '是', '日本網民第二位電腦上網目的'], ['日本網民', '使用', '電腦網購'], ['美國官方聯邦公報', '指', '上季有1'], ['上季', '有', '1'], ['130人', '放棄', '美國國籍'], ['專家', '指', '複雜'], ['藍籌業績', '值得', '關注'], ['上週中聯通業績', '有', '小插曲'], ['騰訊', '帶來', '驚喜'], ['匯豐表面上', '有', '售投連險'], ['前線銷售人員', '銷售', '此產品'], ['THE', '公佈', '創新指數'], ['公司董事長梁球勝', '表示', '未有來港時間表'], ['他', '承認', '聯絡戰略投資者'], ['該公司', '分拆', '一間子公司'], ['德國明鏡週刊', '披露', '職員斯諾登提供文件'], ['美國國安局NSA', '分爲', '5級'], ['等中國國家', '列爲', '最高一級'], ['本週四', '是', '日本戰敗投降紀念日'], ['部分內閣成員', '表示', '有意參拜靖國神社'], ['料', '引起', '不滿'], ['公安', '破獲', '一起獸藥'], ['獸藥企業', '添加', '違禁物質'], ['多家養殖戶生豬', '染', '瘦肉精'], ['控制中心主任張永慧', '透露', 'H7N9患者經營雞鴨查明來源'], ['H7N9患者經營雞鴨', '查明', '來源'], ['只', '來源於', '自養鴨'], ['波爾多葡萄園', '有', '摧毀'], ['慘重', '導致', '短缺'], ['連同', '受', '勃艮第葡萄園'], ['損失料', '高達', '一億'], ['該國', '成爲', '設計國家之一'], ['躉售庫存', '下降', '至4992億美元'], ['7月M2', '增長', '14.5%'], ['中國7月CPI', '持平於', '2.7%'], ['略', '低於', '預期'], ['9指數', '跌', ' 點'], ['日', '漲', ' 點'], ['上海', '上漲', '7.34點'], ['美元', '兌', '9美元']]"
0,20130812_622,乾景投顧盤前分析◆控盤心法：1.今日控盤拿台積電攪亂指數的節奏；正常國際股市如陸港日股今日都是開平高震盪收紅。台股一開盤強拉台積電+3.6元讓指數開盤+47點開最高7955，便一路走低壓尾盤收低，今日收中黑K線讓大盤連4天跌-282點。本週週線中長黑-243點，讓週KD向下交叉中線技術派看保守。控盤今日此舉把中線結構弄弱，卻又讓短線連4跌後形成超跌要反彈的格局。短中線方向是交錯的，散戶看連跌不敢買整體量縮，但電子類股及台積電都形成底部中黑K在洗盤進貨的控盤手法。2.今日類股中電子跌幅小，主壓回在金融、傳產股上。電子雖然權值股也有弱勢股，但是節奏是前面拉抬的強勢股拉回，最弱勢的強彈，說明即使是資金在電子權值股也是在交替輪動。大盤連4跌後短線超跌會多頭反攻。領先的電子期今日收紅拒絕再跌。加上國際股市都沒有像台股弱勢超跌，控盤壓低吃貨明顯。行動大商機的美國團購網、旅遊網續大漲創新高甚至是歷史新高，台股第三方支付股族群下週持續看好領軍再上攻!馬明河分析師,"[['今日', '控盤', '攪亂指數'], ['短中線方向', '是', '交錯的'], ['散戶', '看', '跌'], ['電子類股', '形成', '控盤手法'], ['權值股', '也有', '弱勢股'], ['節奏', '是', '拉抬強勢股拉回'], ['臺股第三方', '支付', '股族羣看好領軍'], ['股族羣', '看好', '領軍']]"
0,20130812_623,永豐期貨台指選擇權盤前－外資萬口空單不減 短空趨勢不變◆期貨走勢週五下跌20點收在7825點。價差方面，四大期指皆為逆價差，其中逆價差31.14點，電子期逆價差0.84點，金融期逆價差6.61點，摩台期逆價差1.88點，其中以金融期連八黑K最為弱勢。從期指大額交易人部位變化來分析，全月份十大交易人於期貨市場空單回補碼3287口，淨空單降至9106口，特定法人空單加碼3161口，淨空單升至11189口。三大法人於期貨市場空單回補1008口，淨空單降至10333口，外資期貨空單加碼447口，淨空單升至16289口，避險水位持續增加，顯示法人對後勢看法偏空。期貨走勢方面，在美股收紅帶動下，台股週五小紅開出，但大盤在陸股開盤過後指數出現急墜，縱使有宏達電受到實施庫藏股發酵下，走勢一路攻堅收漲停，但孤掌難鳴金融期出現了連續第八根的黑K，多頭火種熄火，指數週線下跌237點，中多格局受到破壞，目前下方僅年線支撐。由籌碼面來觀察，外資萬口空單持續維持高檔，短線要出現反彈需先觀察外資空單回補速度，且由八大公股行庫進出來看，目前連續三日出現了低檔買盤，也就是說公股行庫仍是偏空看待目前的走勢。技術面觀察，日K連日黑K，短線跌勢尚未終止仍屬偏空，指數持續下探支撐的可能性高，操作上建議反彈偏空操作並請嚴守停損。◆選擇權分析選擇權從成交量來觀察，8月份買權集中在8000 點，賣權集中在7800點。未平倉量部份，買權未平倉量大量區在8300 點，而賣權大量區則在7600 點。全月份未平倉量put/call ratio 由0.78降至0.75，買權平均隱含波動率由13.32%降至12.96%，賣權平均隱含波動率由15.33%升至15.06%，買賣權同步降，操作上建議在7600至8000點建立賣權空頭價差因應。,"[['永豐期貨臺', '指', '萬口空單不減外資'], ['永豐期貨臺', '指', '萬口空單不減外資'], ['萬口空單', '不減', '外資'], ['四大期指', '爲', '逆價差'], ['逆', '價差', '0.84點'], ['摩臺期', '逆價差', '1.88點'], ['淨空單', '降至', '9106口'], ['三大法人', '回補', '1008口'], ['指數', '出現', '急墜'], ['宏達電', '受到', '庫藏股發酵下'], ['了', '連續', '第八根'], ['多格局', '受到', '破壞'], ['萬口空單', '維持', '高檔'], ['短線', '出現', '反彈'], ['公股行庫', '偏', '空'], ['賣權', '集中在', '7800點'], ['大量區', '在', '8300點'], ['大量區', '在', ' 點'], ['put/callratio', '降至', '0.75'], ['平均隱含波動率', '降至', '12.96%'], ['平均隱含波動率', '升至', '15.06%'], ['8000點', '建立', '價差']]"
0,20130812_624,"元大期貨台股期指盤前－買盤氣虛力不濟 期指腿軟續破底◆行情分析評論：週四美股小漲，週五亞股則是漲跌互見，其中以台股的表現最為弱勢，在金融族群以及塑化權值拖累下，即便跌深的宏達電強漲，仍是陷入連四黑的窘境，而在高檔解套賣壓頻頻摜壓下，空方仍相對強勢，所幸終場期現貨實質逆價差大幅收斂至15點，且選擇權波動率也下滑，期貨市場悲觀程度稍有收斂跡象。觀察法人籌碼變化，外資賣超81.9億元，自營商賣超14.3億元，投信買超0.7億元，三大法人合計賣超95.5億元；在淨部位方面，外資加碼淨空單447口至16,289口，自營商加碼淨多單1,536口至3,939口，三大法人減碼淨空單1,008口至10,333口；另外，前十大交易人減碼淨空單987口至8,170口，整體來看，大額交易人仍抱持著謹慎態度。週五台股成交量為771億元，市場持續量縮盤跌；雖然早盤因台股開高與先行開盤的實質逆價差一度達一百多點，造成早盤的幾度急拉，歷經多空交戰上下不斷沖洗後，目前指數暫時守穩7800點，但從連日的破底走勢來看，上方層層套牢反壓持續壓抑多方的反彈，因此在無夠大利多消息出現之下，後市仍應看外資的臉色，因為高達一萬六千口以上的淨空單何時減碼，關乎大盤能否有反攻的契機出現，目前在技術面與籌碼面皆屬空方相對有利的情況。","[['空方', '陷入', '四黑窘境'], ['大幅逆價差', '收斂至', '15點'], ['悲觀程度', '有', '收斂跡象'], ['自營商賣', '超', '14.3億元'], ['交易人', '減', '碼'], ['交易人', '減', '碼'], ['交易人', '抱', '謹慎態度'], ['臺股成交量', '爲', '771億元'], ['臺股', '開', '高'], ['逆價差', '達', '一百多點'], ['上方層層', '守', '多方反彈']]"
0,20130812_625,台股盤前—外資站空方 蘋概股與4G概念出頭 力抗探底壓力台股上周五終場跌破7900點，下探年線支撐，而外資則持續站在空方，期貨淨空單部位達到1.6萬多口，並持續賣超現貨，本周台股變數仍多，包含電子廠法說陸續對下半年釋出保守展望，以及政府規劃出售股票以彌補財政預算缺口，雖預計由四大基金承接，對台股實質影響有限，不過恐再影響多頭信心，盤面上電子股留意蘋果概念股與4G概念股等，力抗大盤下跌壓力，下檔先看年線支撐。台股持續面臨回檔壓力，以技術面而言，指數仍在5、20日線以下游走，趨勢也往下挪移，顯示台股仍有修正的路要走，外資也連續賣超台股 4 個交易日，已賣超360多億元，期貨淨空單口數也持續增加，達到1.6萬多口，皆壓抑台股走勢，近日傳政府規劃出售大型股股票，以彌補財政預算缺口，預期將由四大基金進場承接，雖可減少對台股之實質衝擊，不過卻可能打擊多頭。電子股今聚焦蘋果概念股，市場傳蘋果 9 月將推出新款iPhone，包含iphone 5S與低價版的iphone，搭載新的A7處理器，指紋辨識等新功能，相關概念股如鴻海、和碩、F-鎧勝、鴻準等個股股價可望有表現空間。NCC釋出4G執照今日將進入第一關面試， 7 家競標業者將由董事長親自領軍，包含 4 大電信業者，鴻海董座郭台銘，與頂新集團董事長魏應交等人，市場看好今日相關4G概念股股價走勢也可望持穩。筆電類股股價也將成盤面焦點，在宏碁第 2 季虧損後，華碩對全年筆電也釋出保守看法，下調全年出貨總量，高標僅有1900萬台，而外資對華碩看法也保守，共有 8 家外資調降目標價，最低喊出200元，今日走勢恐有不小壓力。晶圓代工台積電 7 月營收表現也不佳，達521億元，月減3.6%，相較之下聯電 7 月營收則達115.6億元，月增7.4%，兩家營收表現不同調，另外台積電也傳出遭到搶單的利空，包含格羅方德搶28奈米訂單，以及高通新的晶片訂單轉向三星。整體而言，台股在外資持續站在空方的壓力下，加上技術面不利多方，短線回檔壓力沉重，恐再回頭測年線支撐。,"[['上週五終場', '跌破', '7900點'], ['外資', '站在', '空方'], ['淨空單部位', '達到', '1.6萬多口'], ['政府規劃', '出售', '股票'], ['電子股', '留意', '等蘋果概念股'], ['臺股', '面臨', '檔壓力'], ['臺股', '有', '修正路走'], ['政府', '規劃', '大型股股票'], ['電子股今', '聚焦', '蘋果概念股'], ['個股股價', '有', '表現空間'], ['相關4G概念股股價走勢', '持', '穩'], ['華碩', '釋出', '保守看法'], ['高標', '僅有', '1900萬臺'], ['今日走勢', '有', '小壓力'], ['月', '減', '3.6%'], ['7月營收', '達', '115.6億元'], ['月', '增', '7.4%'], ['臺積電', '傳出', '遭到搶單利空'], ['格羅方德', '搶', '28奈米'], ['格羅方德', '搶', '28奈米'], ['晶片訂單', '轉向', '三星'], ['外資', '站在', '空方壓力下']]"
