,News,All,SVO
0,20130809_671,理周投顧贏家日報盤後－指數區間震盪重點仍在選股◆盤勢分析受QE將退場疑慮和電子旺季不旺下，台股今天是開高走低以下跌51點收在7856點，成交量為769億。一、上揚的年線在7700~7800具支撐，但季線因扣高而暫時下彎在8100上下形成反壓，所以短期台股將在7800~8100區間震盪。而央行總裁彭淮南曾在年初提過，台灣今年景氣是呈現U型復甦，所以年中二、三季本就是今年指數的相對低檔，高點是在第四季或明年初。既然指數低檔有限只是時間的整理且未來仍往上看，那壓回的操作重點就仍是在選股和佈局下波強勢主流股。二、多數電子不論從產業景氣或季術線型都明確告知妳只有短期的跌深反彈而無多頭回升波，只少數個股表現空間而已。而多頭市場的特性就是緩漲急跌，所以妳會發現許多金融傳產股都是溫溫慢慢漲，然後每每在跌勢末端急殺下來，之後又開始慢慢悄悄震盪走高上去。金融與大盤是同步的，整理完仍往上看，等波段最後加碼點即可。營建因短線漲多和受奢侈稅修正板將出盧影響而拉回，但若後勢房價不看漲，政府也不必處心積慮打房了。理周精英會★ 此研究報告著作權屬理周證券投資顧問(股)公司，切勿盜用或翻印，否則追究責任，決不寬貸★ 所有資料僅供參考，本公司不負盈虧責任,"[['QE', '受', '選股'], ['成交量', '爲', '769億'], ['央行總裁彭淮南', '提', '今年景氣呈現U型復甦'], ['今年景氣', '呈現', 'U型復甦'], ['二三季本', '就是', '相對低檔'], ['高點', '是', '在'], ['低檔', '只是', '時間整理'], ['操作重點', '仍是', '在波強勢主流股'], ['多數電子', '告知', '只有跌反彈'], ['的', '跌', '深'], ['少數個股', '表現', '空間'], ['金融', '是', '同步的'], ['此研究報告著作', '權屬理', '股顧問公司'], ['所有資料', '僅供參考', '不負盈虧責任']]"
0,20130809_672,華信投顧盤後－政府對股市不友善◆盤勢分析如同我們之前提示，本週台股之所以走勢疲弱，最主要的原因在於受到下跌因素影響：一）.美國和亞洲股市出現回檔疑慮；市場普遍預期，美國聯準會將自今年九月起縮減QE規模，過去一個月期間，之所以能夠利空不跌維持橫向盤整格局，最主要的原因在於經濟景氣以及就業率的持續好轉。但是目前情勢相當詭異的地方在於，並未因美元供應量將要減少而上漲，反而持續走弱，使得呈現利多不漲的背離走勢，當金融市場出現這種不合邏輯的背離走勢時，通常表示資金正自美元市場流出；如果連美元這種最佳避險工具都出現資金外逃現象，其他金融市場前景恐怕也不容樂觀。至於美國股市，週四雖然反彈，但未能收復月線，暫時視為弱勢反彈，週五必須繼續收紅，而且至少須收復月線，方能暫時化解回檔危機，外資也才有翻空為多的可能。如果美股續跌，外資必然持續站在賣方，在目前大盤資金動能退潮、抗壓性嚴重不足的情況下，外資的操作動見觀瞻，簡單的說，美國股市的漲跌，就成為影響台股走勢最主要的因素之一，而以目前的情況看來，心態上是需要謹慎以待的。二）.政府對股市不友善：本週政府一連推出兩項利空：1.央行發行兩年定存單，回收100億資金。2.國發基金打算釋出170-180億的台積電；這兩項政策，雖然看起來不致於對股市造成強烈衝擊，但是無論是外資或本土法人都強烈感受到政府不友善的心態，當然會選擇退出股市，這也是外資本週大舉調節持股的主要原因之一。大盤在4天內跌幅達3.5％，短線技術指標已經進入超賣區，純粹就技術面而言，兩個交易日內應有反彈，但是需要注意的是，如果成交值位能充分放大，反彈的幅度和時間長度恐怕都極為有限；萬一國際股市持續走弱，更須提防大盤出現短線超跌走勢的可能。李永年分析師★ 此研究報告著作權屬華信證券投資顧問股份有限公司，切勿盜用或翻印，否則追究責任，決不寬貸★ 所有資料僅供參考，本公司不負盈虧責任,"[['友善盤勢', '如同', '提示'], ['主要原因', '在於', '受到下跌因素影響'], ['美國', '出現', '回檔疑慮'], ['美國聯準會', '縮減', '規模'], ['主要原因', '在於', '持續好轉'], ['金融市場', '出現', '背離走勢'], ['這種', '不合', '邏輯'], ['避險工具', '出現', '外逃現象'], ['其他金融市場前景', '不容', '樂觀'], ['外資', '有', '翻空爲多可能'], ['外資', '站在', '賣方'], ['美國股市漲跌', '成爲', '主要因素之一'], ['美國股市漲跌成爲主要因素之一', '影響', '臺股走勢'], ['政府', '推出', '兩項利空'], ['央行', '發行', '定存單'], ['國發基金', '打算', '釋出170-180億臺積電'], ['兩項政策', '不致於', '造成強烈衝擊'], ['外資', '感受到', '友善心態'], ['這', '也是', '主要原因之一'], ['在跌幅', '達', '3.5％'], ['技術指標', '進入', '超賣區'], ['兩個交易日內', '應有', '反彈'], ['但是', '需要', '注意'], ['需要注意的', '是', '有限'], ['大盤', '出現', '超跌走勢'], ['大盤', '出現', '超跌走勢'], ['此研究報告著作', '權屬', '華信證券投資顧問股份有限公司'], ['所有資料', '僅供參考', '不負盈虧責任']]"
0,20130809_673,日盛投顧：年線7800附近有機會形成支撐1.週五台股隨歐美指數收紅加上台積電開高，指數開高後隨後震盪，多空交戰激烈，最低來到7853.97點，跌破週四低點7894點及07/04低點7877點，第三方支付、網通、LED、電動車、部份跌深電子股相對強勢，7月營收或第三季展望較差的部份個股表現相對較弱，終場指數下跌51.53點，跌幅0.65%，收在7856.14點，成交金額為771.85億元。三大法人合計賣超95.52億元：外資賣超81.92億元、投信買超億元、自營商賣超14.34億元。2.由以下三個面向檢驗台股方向及強弱：(1)量能：5日均量仍低於20日均量，短線量能不足，上攻量約在850億元左右。(2)均線：8439-8265下降線形成壓力，年線7800附近有機會形成支撐。(3)技術指標：RSI及KD開口均向下，但9日K值低於20已進入超賣區。【強勢】第三方支付、網通、LED、電動車、跌深股【弱勢】IC設計業績及展望較差個股1. 第三方支付：第三方支付預定8月底前上路，4965商店街、8044網家、3687歐買尬昂首。2. 網通：高速網路時代來臨，4G、光纖需求強，3062建漢、3163波若威、2314台揚將受惠。3. LED：2448晶電由虧轉盈第2季EPS0.38元， 2393億光第2季EPS0.92元季增78％。4. 電動車：電動車龍頭tesla財報亮眼，Q2順利轉虧為盈，電子相關股8261富鼎、6138茂達、6282康舒及非電個股3665F-貿聯、1536和大受到激勵，表現相對大盤強勢。5. 跌深反彈股：2498宏達電加強中階手機版面推新機，3638F-IML下半年營運倒吃甘蔗。6. 【弱勢】IC設計：3582凌耀7月營收1.47億年減34%，3035智原3Q營收季增僅個位數。,"[['有機會', '形成', '臺股收紅支撐'], ['臺股', '收', '紅'], ['歐美指數', '收', '紅'], ['成交金額', '爲', '771.85億元'], ['投信', '買', '超億元'], ['自營商賣', '超', '14.34億元'], ['5日均量', '低於', '20日均量'], ['攻量', '在', '850億元左右'], ['下降線', '形成', '壓力'], ['K值', '低於', '20'], ['4965商店街', '買', '昂首'], ['8261富鼎', '受到', '激勵'], ['3582凌耀', '營收', '1.47億年減']]"
0,20130809_674,永豐期貨：中多格局遭破壞，下方支撐看年線期貨走勢週五下跌20點收在7825點。價差方面，四大期指皆為逆價差，其中逆價差31.14點，電子期逆價差0.84點，金融期逆價差6.61點，摩台期逆價差1.88點，其中以金融期連八黑K最為弱勢。從期指大額交易人部位變化來分析，全月份十大交易人於期貨市場空單回補碼3287口，淨空單降至9106口，特定法人空單加碼3161口，淨空單升至11189口。三大法人於期貨市場空單回補1008口，淨空單降至10333口，外資期貨空單加碼447口，淨空單升至16289口，避險水位持續增加，顯示法人對後勢看法偏空。期貨走勢方面，在美股收紅帶動下，台股週五小紅開出，但大盤在陸股開盤過後指數出現急墜，縱使有宏達電受到實施庫藏股發酵下，走勢一路攻堅收漲停，但孤掌難鳴金融期出現了連續第八根的黑K，多頭火種熄火，指數週線下跌237點，中多格局受到破壞，目前下方僅年線支撐。由籌碼面來觀察，外資萬口空單持續維持高檔，短線要出現反彈需先觀察外資空單回補速度，且由八大公股行庫進出來看，目前連續三日出現了低檔買盤，也就是說公股行庫仍是偏空看待目前的走勢。技術面觀察，日K連日黑K，短線跌勢尚未終止仍屬偏空，指數持續下探支撐的可能性高，操作上建議反彈偏空操作並請嚴守停損。選擇權分析選擇權從成交量來觀察，8月份買權集中在8000 點，賣權集中在7800點。未平倉量部份，買權未平倉量大量區在8300 點，而賣權大量區則在7600 點。全月份未平倉量put/call ratio 由0.78降至0.75，買權平均隱含波動率由13.32%降至12.96%，賣權平均隱含波動率由15.33%升至15.06%，買賣權同步降，操作上建議在7600至8000點建立賣權空頭價差因應。,"[['中多格局', '遭', '破壞'], ['中多格局', '遭', '破壞'], ['四大期指', '爲', '逆價差'], ['逆', '價差', '0.84點'], ['摩臺期', '逆價差', '1.88點'], ['淨空單', '降至', '9106口'], ['三大法人', '回補', '1008口'], ['指數', '出現', '急墜'], ['宏達電', '受到', '庫藏股發酵下'], ['了', '連續', '第八根'], ['多格局', '受到', '破壞'], ['萬口空單', '維持', '高檔'], ['短線', '出現', '反彈'], ['公股行庫', '偏', '空'], ['賣權', '集中在', '7800點'], ['大量區', '在', '8300點'], ['大量區', '在', ' 點'], ['put/callratio', '降至', '0.75'], ['平均隱含波動率', '降至', '12.96%'], ['平均隱含波動率', '升至', '15.06%'], ['8000點', '建立', '價差']]"
0,20130809_675,鉅亨晚報 2013年8月9日■儘管歐美股市都翻紅，但台股早盤開高後，陸股翻黑，台股多頭信心又受到干擾，電子族群雖然跌深的宏達電強彈，但難獲共鳴，連金融都挺不住，大盤翻黑後，後半場7900失守後，賣壓擴大，前波低點7877點又被摜破，收盤下跌51.53點，以7856.14點作收，成交值769.61億元。台股本周5個交易日，日線有4天收黑，周線也重挫243點。■金管會今(9)日就第三方支付邀集跨部會與業者討論，金管會主委曾銘宗表示，關於非金融業第三方支付業者儲值金額上限僅有1萬元，是否調整，將與經濟部觀察過去的交易情況及開放後交易筆數與金額後再檢討。■在台股持續籠罩沉悶氣氛下，台灣央行罕見對此表示，要「推動外資以股票為擔保品，向國內金融機構借投資股市」，央行大動作鼓勵外資不用從海外提錢，可直接透過股票質借，希望藉此快速激勵外資持續進場買股的意願。央行強調，鼓勵外資以股票為擔保品，向國內金融機構質借投資股市，此舉除了有助於外資降低匯率風險，也可擴大國內銀行授信業務，是一舉兩得。■大陸國家統計局9日公布，2013年7月全國居民消費價格總水平(CPI)年增2.7%，與上月持平(大陸6月CPI年增2.7%、創下四個月新高)，低於市場預計的2.8%。其中，城市上漲2.6%，農村上漲2.9%；食品價格上漲5.0%，非食品價格上漲1.6%。大陸1-7月平均全國居民消費價格總水平為年增2.4%。■華碩今舉行第二季法說，第二季稅後盈餘為47.65億元；EPS為6.3元，季衰退21%、年衰退1%；毛利率為13.5%，較上季13.2%小幅衰退；營業利益率4.4%。展望第三季，華碩估NB及類NB出貨430萬台，而平板出貨350萬台，主機板出貨550萬片。華碩第三季的平板出貨估值較第二季大幅成長7成，展現其強烈的企圖心，公司目標是在平板領域中，穩居全球市占第三名。■台積電今(9)日公佈2013年7月營收報告。7月合併營收約為521.3億元，較上月減少了3.6%；公司特別說明，精材科技股份有限公司的營收將不再列入台積公司的合併財務報表中，使得和上月及去年同期相較結果之百分比均減少了0.6個百分點。■筆電品牌宏碁董座王振堂指出，宏碁正持續改善產品組合，以掌握市場需求動向，除持續拉高高階產品比重，Google系統產品數量也將快速提升。■記憶體價格下跌，但記憶體模組廠威剛()對第3季市場發展，持正面向上看法。威剛表示，DRAM產業經整併完成，今年開始步入健康的供需形態。■澳洲央行(RBA)周五(9日)下修經濟成長預期，但對未來的利率展望則未明確表示，僅說它將「視需要」調整。■根據經濟合作與發展組織 (OECD) 周四 (8 日) 發布調查，包括中國、俄羅斯、巴西及印度等「金磚四國」新興市場國家代表，經濟成長前景正出現令人擔憂的跡象。■台灣金控暨台灣銀行今(9)日舉行代理、新任董事長交接典禮，新任董事長李紀珠表示，台灣銀行ROE(股東權益報酬率)、ROA(總資產報酬率)在2009-2011年都低於同業平均水準，身為龍頭銀行一定要自我期許提升到超越同業。■HTC宏達電()今(9)日與台灣電信業者共同推出HTC One mini，宏達電表示，全球經濟仍面臨挑戰，不過，第3季台灣旺季動能看起來還不錯，由於手機市場往中階發展，因此，宏達電中階手機的比重會在量的方面會增加。■《彭博社》報導，正朝著 2011 年來最大周增幅邁進，中國周五（9日）公佈的工業生產數據優於預期，更進一步提振了的升值力道。(接下頁)■法國統計局周五公布的數據顯示，法國6月工業產出月率下降1.4%，預期為增長0.1%，前值修正為下降0.3%，初值下降0.4%；年率下降0.2%，前值下降0.7%。■中國家統計局周五發布的數據顯示，中國7月份工業增加值同比增長9.7%，增速較6月份的8.9%有所加快。市場預期7月份工業增加值增長9%。■大陸國家統計局9日公布，2013年7月全國居民消費價格總水平(CPI)年增2.7%，與上月持平(大陸6月CPI年增2.7%、創下四個月新高)，低於市場預計的2.8%。■台北股市 9 日收跌51.53 點或0.65%，收盤報7856.14點，成交金額769.61億元。■台股 9 日三大法人集中市場賣超95.51億，其中外資賣超81.91億，投信買超0.73億，自營商賣超14.33億。■澳洲 S&P/ASX 200 指數 9 日收報5055.2點，跌9.599點或0.19%，盤中高見5076.7點，低至5023.1點，開盤報5064.8點。■日經 225 指數 9 日收報13615.19點，漲9.63點或0.07%，盤中高見13754.96點，低至13527.81點，開盤報13673.49點。■南韓 Kospi 指數 9 日收報1880.71點，跌3.26點或0.17%，盤中高見1888.79點，低至1876.07點，開盤報1884.57點。■香港恒生指數 9 日收盤上漲 151.68 點或 0.70%，報 21807.56 點，全日高見 21811.24 點，低見 21674.97 點，成交量 441.26 億港元。國企指數亦收升 114.82 點或 1.21%，收報 9599.46 點，盤中高見 9613.26 點，低見 9529.27 點。■上海 9 日收盤上漲 7.34 點或 0.36%，報 2052.24 點，全日高見 2061.71 點，低見 2030.13 點，成交量 830.36 億。深成指則漲 31.10 點或 0.38%，報 8145.97 點，成交量 1086.02 億。■台北匯市 9 日收盤，兌美元收報29.955元兌1美元，升值0.5分，成交量4.55億美元，全日高見29.882元，低至29.960元，開盤報29.960元。,"[['臺股早盤', '開', '高'], ['多頭信心', '受到', '干擾'], ['成交值', '作', '769.61億元'], ['日線', '有', '收黑'], ['金管會主委曾銘宗', '表示', '儲值金額上限僅有1萬元'], ['儲值金額上限', '僅有', '1萬元'], ['臺股', '籠罩', '沉悶氣氛'], ['持續', '籠罩', '沉悶氣氛'], ['臺灣央行罕見', '表示', '推動外資爲擔保品'], ['外資', '爲', '擔保品'], ['央行大動作', '鼓勵', '外資'], ['央行', '強調', '此舉是一舉兩得'], ['外資', '爲', '擔保品'], ['此舉', '是', '一舉兩得'], ['CPI年', '增', '2.7%'], ['非食品價格', '上漲', '1.6%'], ['全國居民消費價格', '增', '2.4%'], ['舉行第二季法', '說', '第二季稅後盈餘爲47.65億元'], ['第二季稅後盈餘', '爲', '47.65億元'], ['EPS', '爲', '6.3元'], ['毛利率', '爲', '13.5%'], ['公司目標', '是', '在'], ['7月合併營收', '爲', '521.3億元'], ['公司', '說明', '精材科技股份有限公司營收列入財務報表中'], ['精材科技股份有限公司營收', '列入', '財務報表中'], ['筆電品牌宏碁董座王振堂', '指出', '宏碁改善產品組合'], ['宏碁', '改善', '產品組合'], ['宏碁', '改善以', '掌握市場需求動向'], ['威剛', '表示', 'DRAM產業完成'], ['澳洲央行RBA', '修', '經濟成長預期'], ['成長前景', '出現', '令人跡象'], ['新任董事長李紀珠', '表示', '臺灣銀行ROE股東權益報酬率低於平均水準'], ['臺灣銀行ROE股東權益報酬率', '低於', '平均水準'], ['今9日', '推出', 'HTCOne mini'], ['宏達電錶', '示', '全球經濟面臨挑戰'], ['全球經濟', '面臨', '挑戰'], ['工業生產數據', '優於', '升值力道'], ['接下頁法國統計局公佈數據', '顯示', '6月工業產出月率下降1.4%'], ['6月工業產出月率', '下降', '1.4%'], ['預期', '爲', '增長0.1%'], ['前值修正', '下降', '0.3%'], ['初值', '下降', '0.4%'], ['發佈數據', '顯示', '工業增加值增長9.7%'], ['工業增加值', '增長', '9.7%'], ['增速', '有所', '加快'], ['工業增加值', '增長', '9%'], ['CPI年', '增', '2.7%'], ['日股市', '收', '跌 點'], ['自營商賣', '超', '14.33億'], ['高', '見', '5076.7點'], ['國企指數', '收升', ' 點'], ['深成指', '漲', ' 點'], ['29.955元', '兌', '1美元']]"
0,20130809_676,瓦城7月營收年增逾12% Q3旺季樂觀、將開新品牌在全台持續展店挹注以及暑期餐飲旺季的帶動下，餐飲高價股瓦城()今(9)日公布7月營收持續維持在2億元以上的高檔水準，單月營收達2.06億元，月微減1.8%、年增12.57%，創下同期新高表現，累計前8月營收達13.08億元，年增15.7%，瓦城也持續看好第3季業績將持續暢旺。瓦城表示，下半年除了積極落實展店目標，進駐全台更多縣市以持續深耕台灣市場外，也將推出第4個「以滿足大眾消費族群」為訴求的全新品牌，將加速擴大集團在國內餐飲市場的市占表現，再加上「瓦城泰統」第1家上海店開幕，代表集團正式跨足海外市場，對後市發展深具信心。另外，為歡慶集團23周年，集團結合旗下瓦城、非常泰及1010湘等3品牌，鎖定女性消費族群，推出9款經典LV周周送的慶祝活動，自7月29日起連續9周，凡來店消費滿1500元，即可獲得1次抽獎機會，每周抽出1名幸運得主，拚在慶祝活動的挹注下，持續刺激暑期旺季消費。,"[['旺季樂觀', '維持', '高檔水準'], ['年', '減', '1.8%'], ['年', '增', '15.7%'], ['瓦城', '表示', '代表'], ['持續', '深耕', '臺灣市場'], ['」', '爲', '訴求'], ['集團', '跨', '海外市場'], ['集團', '結合', '3品牌'], ['凡', '來', '店'], ['來店消費', '滿', '1500元']]"
0,20130809_677,台股再跌51點失守七千九受到國際盤影響，加上外資持續性賣超，台股今天再度拉回修正，重量級電子權值股走勢普遍不盡理想，只有宏達電、TPK強勢反彈大漲。投資人信心不足，加上金融、傳產股缺乏撐盤力道，大盤終場下跌51點，收在7856點，成交量772億元。目前技術面壓力沈重，短線指數很可能持續測試年線支撐。（張佳琪報導）外資連日減碼，週四大賣超過百億，投資人對行情後市提高警覺，國際盤的表現同時也牽動台股行情，大盤又是回檔修正走勢。大型重量級權值股普遍休息，面板二虎開高走低；龍頭股台積電一度試圖反彈，卻抵擋不住空方壓力又回落到平盤附近。反倒是近期弱勢的宏達電、TPK展現逆勢抗跌力道，又以宏達電6%的漲幅最受到矚目，同時，太陽能族群也頗能吸金。只是，電子股個別的零星走勢不足以撐起一片天，且非電子股扯後腿，大盤收低跌51點，以7856點作收。日盛投顧總經理李秀利表示，大盤出現長黑K且再創波低新低，後續盤勢恐將持續下探。李秀利說：「因所有均線已破形成蓋頭壓力，所以指數如果不能先止穩重新收復五日線，對多方的局面是會有較大壓力」。外資近來偏空操作，央行鼓勵外資借錢買股的利多，究竟能不能發揮力量激勵外資轉賣為買，仍須再觀察。（圖：證交所提供）,"[['外資', '賣', '超'], ['電子權值股走勢', '不盡', '理想'], ['金融', '缺乏', '撐盤力道'], ['短線指數', '持續', '年線支撐'], ['外資', '減', '碼'], ['週四大賣', '超過', '百億'], ['投資人', '提高', '警覺'], ['國際盤表現', '牽動', '臺股行情'], ['大盤', '是', '修正走勢'], ['面板二虎', '開', '高'], ['龍頭股臺', '積', '電'], ['近期弱勢宏達電', '展現', '抗跌力道'], ['太陽能族羣', '吸', '金'], ['電子股', '扯', '後腿'], ['投顧總經理李秀利', '表示', '恐下探'], ['大盤', '出現', '長黑K'], ['外資', '操作', '多發揮力量'], ['多', '發揮', '力量']]"
0,20130809_678,國泰期貨台指選擇權盤後分析◆盤勢分析昨日美股結束連續三日的跌勢，小幅收高，歐股也受到拉抬而走高。市場的走向，依舊隨著聯準會的動向以及經濟數據而跌宕起伏，國際情勢仍不明朗。今日大盤指數上檔壓力重重，在幾經掙扎之後終究還是無力反彈，跌破7900點，呈現價跌量增的格局。今日作橫盤整理，小跌20點，收在7825點，回測年線，此波下跌趨勢還沒有止血跡象。電子族群以及金融類股無力撐住盤面，高價股也不見起色，加上外資空方強勢，未來走勢不甚樂觀。指數可能還會繼續探底，建議投資人偏空操作。台指籌碼面部分，外資今日空單加碼447口，大台未平倉部位為空單16289口；三大法人整體未平倉為空單10333，顯示目前三大法人對於台指看法為偏空。選擇權CALL及PUT成交量最大的序列分別是8000CALL及7800PUT，其序列為目前上檔及下檔的指數區間位置，PUT/CALL值目前來到0.68，顯示指數應以偏空格局視之。,"[['歐股', '受到', '拉抬'], ['下跌趨勢', '還沒有', '止血跡象'], ['電子族羣', '撐住', '盤面'], ['高價股', '不見', '起色'], ['三大法人平倉', '爲', '10333空單'], ['三大法人', '爲', '偏空'], ['最大序列', '是', '8000CALL'], ['其序列', '爲', '指數區間位置'], ['PUT/CALL值', '來到', '0.68'], ['顯示指數', '視', '之']]"
0,20130809_679,群益期貨台股期權盤後－金融類股煞不住 台股持續探低點◆盤勢分析台股今天持續探低點，不過今天反而是金融類股跌幅較大，許多權值較重的金融股跌幅大多有1%，電子股稍作止跌。以周線來看，目前下方仍有紅K棒作收的包覆線，仍有機會發揮支撐力道。外資部位持續偏空，且略為增加至一萬六千多口，法人的操作依舊偏保守不變。以8月份選擇權合約來看，買權OI大於賣權OI迅速擴增為十一萬五千多口，選擇權籌碼面屬偏空。本月份買權OI已經大於上個月合約的買權OI，差距也快速地拉大至超過十萬口，選擇權籌碼表現明顯勢空方勢力。總結來說，目前外資部位依舊持有大部位的空單，選擇權籌碼也是空方勢力，不過今天在現貨方面又出現包覆線，再加上電子類股今天也稍作止跌，需注意是否會在此處做築底的可能性。,"[['臺股探低點盤勢臺股', '探', '低點'], ['金融股跌幅', '有', '1%'], ['電子股', '作', '止跌'], ['下方', '有', '有機會'], ['買權OI', '大於', '賣權OI'], ['選擇權籌碼面', '屬', '空'], ['本月份買權OI', '大於', '上個月合約買權OI'], ['選擇權籌碼', '表現', '空方勢力'], ['外資部位', '持有', '大部位空單'], ['選擇權籌碼', '也是', '空方勢力'], ['電子類股', '稍作止', '跌']]"
