,News,All,SVO
0,20130325_2919,承啟與七彩虹合推輕薄平板 近期上市搶商機在蘋果()宣布推出更輕巧的iPad mini後，平板市場規模就更為擴大，與承啟()合作的中國廠商七彩虹，近日發表一款極致超輕薄平板，與iPad mini採用同樣7.85吋螢幕設計，厚度更薄，預期近日就會上市開賣，可望對承啟營運產生正面助益。與承啟具有密切合作關係的七彩虹，近期宣布推出一款極致超薄平板，與iPad mini採用同樣的7.85寸設計，但厚度卻僅6.8mm，產品型號為「CT781」，CT781只有4.9超窄邊框，內建最新全志A31s四核處理器，並使用旭硝子超硬玻璃G+G觸控屏。七彩虹指出，CT781採用全致A31s處理器，A31s做為A31的後續產品，擁有四個Cortex-A7處理器核心，同時還搭載PowerVR SGX544 MP2圖形晶片，配合1GB DDR3記憶體，在保證性能的基礎上，進一步降低功耗，使得整機待機與散熱表現更為出色。另外，Colorfly CT781也採用G+G超薄觸控屏，由於超薄平板多數皆使用較不安全的OGS 觸控屏，七彩虹為保障平板機子堅固度，因此特別使用旭硝子超薄超硬G+G玻璃，擁有更強硬度，不僅能防止刮花，也可帶來更好視覺通透性。七彩虹透露，Colorfly CT781這款產品預計近期就會上市，時間點約在 4 月底前，可望對承啟與七彩虹營運產生助益，而七彩虹先前預期今年平板電腦出貨目標要達80萬台， 3 年後要在中國大陸平板市場吃到 1 成市佔率。,"[['承啓', '具有', '密切合作關係'], ['產品型號', '爲', 'CT781'], ['CT781', '只有', '窄邊框'], ['七彩虹', '指出', 'CT781採用後續產品'], ['CT781', '採用', '後續產品'], ['在', '保證', '性能'], ['Colorfly CT781', '採用', '超薄觸控屏'], ['超薄平板', '使用', 'OGS觸控屏'], ['七彩虹', '爲', '保障平板機子堅固度'], ['七彩虹', '透露', '上市'], ['時間點約', '在', '4月底'], ['七彩虹', '預期', '出貨目標達80萬臺'], ['出貨目標', '達', '80萬臺']]"
0,20130325_2920,力積去年虧轉盈 稅後淨利1296萬元 EPS 0.2元記憶體控制IC力積(3553-TW)今(25)日公布去年獲利，去年稅後淨利為1296萬元，從2011年虧損泥沼中走出來，每股稅後盈餘為0.2元，營運順利轉盈。力積去年營收為23.13億元，較2011年降低22.39%，不過隨著整體記憶體產業趨向健康，庫存去化順利，帶動整體毛利率上揚，達14.99%，年增12.6個百分點，稅前淨利為939.4萬元，稅後淨利1296.4萬元，每股稅後盈餘為0.2元。不過雖然去年順利轉盈，但力積不配發去年股利；而力積也宣布，將申請赴中國大陸深圳地區，設立辦公室，以因應公司營運與業務發展之需求。,"[['稅後淨利', '爲', '1296萬元'], ['稅後盈餘', '爲', '0.2元'], ['力積去年營收', '爲', '23.13億元'], ['，', '達', '14.99%'], ['年', '增', '12.6個百分點'], ['稅前淨利', '爲', '939.4萬元'], ['稅後盈餘', '爲', '0.2元'], ['力積', '宣佈', '申請赴深圳地區']]"
0,20130325_2921,外資上周賣超台股356億元 大賣台積電13.64萬張據證交所統計，外資上週(3/18-3/22)賣超台股356.7億元，累計今年至上周五為止，外資買超金額縮水至96.19億元，上周買超個股以群創()最多，買超3.76萬張，賣超則以台積電()最多，大賣13.6萬張。證交所統計，外資上周在集中市場買進835.87億元，賣出1192.6億元，累計賣超356.73億元，總計今年初至上周五為止，累計買超金額縮手，掉到僅96.19億元。外資總持股市值為7.39兆元，占整體上市股票市值約34.18%，較3月15日當周7.58兆元減少1885.74億元。就個股部分，外資上周買超前三名為群創、新日光與三陽，買超張數分別達3.76萬張、1.67萬張與1.56萬張；賣超張數則以台積電、聯電與兆豐金為主，賣超張數分別為13.6萬張、7.38萬張與4.7萬張。台積電歷史走勢圖,"[['外資', '賣', '超臺股'], ['外資買超金額', '縮水至', '96.19億元'], ['賣超', '賣', '13.6萬張'], ['外資', '買進', '835.87億元'], ['累計賣', '超', '356.73億元'], ['持股市值', '爲', '7.39兆元'], ['超前三名', '爲', '羣創'], ['買超張數', '達', '3.76萬張'], ['，', '賣', '超張數']]"
0,20130325_2922,歐司朗來台採購照明設備  商機達15.5億元 大同參與採購會德國百年照明設備大廠歐司朗(OSRAM GmbH)派員來台採購照明設備材料、零組件及車燈等40餘項產品，今天(25日)採購政策說明會吸引大同()等30家廠商參加，經過12場次一對一洽談會，共促成商機4000萬，大約15.5億元。歐司朗全球採購部經理Mr.Tilman Roeder表示，本次來台採購以金屬、玻璃/陶瓷類、塑膠等各類材質照明（含車用）設備零配件及原材料為大宗，充分顯示對台灣產品的肯定。外貿協會表示，配合台灣國際照明展展出，27日將辦理相關產業的聯合採購洽談會，預計有93場次洽談會。外貿協會今年度超大型採購活動－「2013年全球採購大會」，即將於28日在南港展覽館登場，有60國600名海外買主將來台採購洽談。繼歐司朗之後，3月29日美國知名鞋廠Deckers、4月11日美商Honeywell、4月15日德商Robert Bosch、4月16日美商IBM、4月24日西班牙知名女裝品牌商Mango及5月27日美商Microsoft等業者將派員來台與國內供應商進行採購洽談會。 歐司朗來台採購照明設備，商機達15.5億元。(照片來源：外貿協會),"[['大同', '參與', '採購'], ['Mr.Tilman Roeder', '表示', '本次來臺採購爲大宗'], ['（', '含', '車用'], ['本次來臺採購', '爲', '大宗'], ['外貿協會', '表示', '辦理聯合採購洽談會'], ['海外買主', '將來', '臺'], ['派員', '來', '臺'], ['照明設備商機', '達', '15.5億元']]"
0,20130325_2923,永豐餘斥資80億元 3年內增建10部家紙紙機 產能將倍增永豐餘()今(25)日宣布，為搶佔兩岸生活用紙的領導地位，繼去(2012)年下半年揚州5、6號紙機建置量產後，近日再通過營運擴充計畫，確定未來3年將在台灣及大陸增建10部生活用紙紙機，持續提升五月花、得意、柔情等品牌的市佔率和通路，總投資金額高達80億元。永豐餘發言人殷國堂表示，10部紙機增建地點將在桃園、廣東、及江蘇等三處，與永豐餘工業用紙、中華紙漿之生產據點相結合，有效發揮集團的漿源、能源的整體綜效，創造生產成本的競爭優勢。殷國堂表示，永豐餘生活用紙的總產能將呈2倍數的成長，達42萬噸以上。整體投資案預計分兩階段進行。第一階段的投資預計將於2014年完成，分別於台灣，大陸廣東省及江蘇省等三處各增建兩部紙機。2015年第二階段預計於大陸廣東省及江蘇省兩處各續建兩部紙機。兩階段共增建10部紙機，目前已著手進行紙機建置規畫，以及相關設備的詢議價作業。永豐餘消費品實業分析，台灣及大陸市場均有容納新產能的空間。根據台灣海關統計，2012年台灣衛生紙原紙進口量為5.3萬噸，佔國內總生產總量的22%；而大陸地區去年生活用紙市場消費量約560萬噸，預估至2015年消費總量將達到660萬噸，推估3年內中高檔生活用紙消費量將由336萬噸提升到400萬噸。無論是台灣現存就有22%國產紙品推升空間，或是大陸供給面約20%成長空間，在在佐證永豐餘家品事業在兩岸中高檔生活用紙市場的商機與潛力。永豐餘表示，去年10月中華紙漿和紙與紙板事業部合併，連同廣東鼎豐也納入整合資源架構，此次生活用紙紙機增建地點就充分掌握集團資源，包括工業用紙新屋廠、揚州廠汽電共生設備，兼收節能減碳與成本降減效益；以及廣東省鼎豐紙業直接採用濕漿製紙，節省運輸成本，更省去漿紙二次蒸發的能源成本。永豐餘消費品實業在兩岸行銷家用紙品行之有年，台灣地區推出五月花、得意、柔情三大品牌，合計市佔率為25%，新增產能除了填補目前台灣自產原紙供應不足的缺口，至2015年市佔率可望提高至35%。在大陸地區，五月花品牌在華東地區和京津市場有優異的表現，歷經2012年在產品線的重新規劃，以及積極有效的市場推廣和通路的拓展下，整體業績大幅成長55%。展望未來，大陸地區更將加速市場的推展，持續強化五月花品牌的差異化定位，在銷售區域上持續精耕華東和京津區域，同時也將積極開發華南和華北地區，儘速達成大陸地區25萬噸產銷，進入市場排名前5名的主要競爭者行列。永豐餘歷史走勢圖,"[['產能', '倍增', '永豐餘'], ['爲', '搶佔', '生活用紙'], ['總投資金額', '高達', '80億元'], ['永豐餘發言人殷國堂', '表示', '10部紙機增建相結合'], ['殷國堂', '表示', '總產能呈2倍數成長'], ['總產能', '呈', '2倍數成長'], ['臺灣市場', '均有', '容納新產能空間'], ['臺灣衛生紙原紙進口量', '爲', '5.3萬噸'], ['消費總量', '達到', '660萬噸'], ['生活用紙消費量', '提升到', '400萬噸'], ['永豐餘', '表示', '紙板事業部合併'], ['增建地點', '掌握', '集團資源'], ['廣東省鼎豐紙業', '採用', '溼漿製紙'], ['臺灣地區', '推出', '三大品牌'], ['合計市佔率', '爲', '25%'], ['市佔率', '提高至', '35%'], ['五月花品牌', '有', '優異表現'], ['大陸地區', '加速', '市場推展']]"
0,20130325_2924,〈權證〉歐債風波鬆口氣 認購占比創近2周新高 力成、可寧衛超夯受到賽普勒斯紓困案過關激勵，國際股今(25)日多同步走揚慶賀，台股早盤開高瞬即收復7800點大關，終場上漲59.9點以7856點作收，儘管成交量能僅590億元，攻擊量仍顯不足，在權證市場中，多方已興致勃勃順勢加碼，認購占比更衝上86%，創3月13日以來新高，除了電子權值股強勢穩盤，認購方又有新兵竄起，顯示大盤氣氛轉佳，中小型個股可隨著高殖利率概念等題材各自崢嶸。從認購觀察，聯發科()已連4個交易日榮登認購王，雖今日成交量能稍下滑至8000萬元附近，但多方占比達85%，創下4個交易日來新高，而鴻海()作為認購熱門亞軍，認購更連2日達90%之上，可望發揮穩盤作用。特別的是，台積電()引領的半導體類股風潮稍稍退溫後，認購成交量能退居第5，認購占比也創4個交易日來新低僅65%，反倒是力成()異軍突起，成交量能一舉衝上4400餘萬元，認購占比更衝上98%，較昨日大增逾10個百分點，看來高殖利率題材發威，且公開收購同為封測業的超豐涉內線消息一事並未衝擊多方信心。另一方面，可寧衛()因大方配發12.03元現金股利，配息率高達90%，不僅股價已創下10個月來新高，認購多方繼續加碼擁戴，認購成交量衝上3000萬元，也是罕見大黑馬，以可寧衛作標的的認購權證共有7檔不僅單日漲幅超過20%，且成交量破千張，其中以元富48(061508)、日盛16(061591)以及元大1U(061668)到期日較長。權證市場仍由多方控盤，但有幾檔標的也不可大意，目前上銀()、銘異()以及台灣50(0050-W)空方占比皆超過50%，相對弱勢。永豐金證券衍生商品部指出，適逢329房地產超級檔期，房地產業界估今年329檔期北台灣可推案量上看3600億元，再加上營建類股高殖利率題材加持，不妨可留意已公布股息的皇翔()，現金殖利率9.7%，或者是市場預測今年現金股息可逾8元、現金殖利率達8.4%的長虹()等， 投資人若看好相關個股後市，可選擇連結皇翔的2X永豐(061609)、KU凱基(060712)，目前約價外8%-10%，槓桿效果好。,"[['認購佔比創', '近', '2周新高'], ['寧衛超夯', '受到', '賽普勒斯紓困案'], ['臺股早盤', '開', '高瞬'], ['今日成交量', '下滑至', '8000萬元附近'], ['多方佔', '比達', '85%'], ['特別的', '是', '認購成交量退居第5'], ['認購成交量', '退居', '第5'], ['認購佔比', '創', '4個交易日'], ['成交量', '一舉衝', '4400餘萬元'], ['同', '爲', '封測業'], ['超豐涉內線消息一事', '衝擊', '多方信心'], ['配息率', '高達', '90%'], ['股價', '創下', '來新高'], ['認購權證', '共有', '7檔'], ['單日漲幅', '超過', '20%'], ['佔比', '超過', '50%'], ['永豐金證券衍生商品部', '指出', '適逢超級檔期'], ['房地產業界估', '看', '3600億元'], ['現金殖利率', '留意', '連結皇翔2X永豐061609'], ['已', '公佈', '股息'], ['現金股息', '逾', ')('], ['現金殖利率', '達', '8.4%'], ['現金殖利率', '達', '8.4%'], ['可選擇', '連結', '皇翔']]"
0,20130325_2925,"上週外資在集中市場賣超356.73億元，賣超台積電13.64萬張最多根據台灣證券交易所統計，上週（102/3/18~102/3/22）外資在集中市場總買進金額為835.87億元，總賣出金額為1,192.60億元，累計賣超為356.73億元，另統計自102年年初至3月22日止，外資總買進金額為1兆551.82億元，總賣出金額為1兆455.63億元，累計買超為96.19億元。外資總持股（包括原始股東持股及自集中市場買進之持股）市值為7兆3,943.76億元，占全體上市股票市值的34.18%，較3月15日的7兆5,829.51億元減少1,885.74億元。就個股部分比較：　上週外資自集中市場買超最多的前三名上市公司為：第一名：群創：買進85,660千股，賣出48,006千股，買超37,654千股。第二名：新日光：買進18,500千股，賣出1,711千股，買超16,789千股。第三名：三陽：買進19,388千股，賣出3,754千股，買超15,634千股。上週外資自集中市場賣超最多的前三名上市公司為：第一名：台積電：買進87,035千股，賣出223,424千股，賣超136,389千股。第二名：聯電：買進23,291千股，賣出97,177千股，賣超73,886千股。第三名：兆豐金：買進14,775千股，賣出61,775千股，賣超47,000千股。","[['上週外資', '賣', '356.73億元'], ['買進金額', '爲', '835.87億元'], ['賣超', '爲', '356.73億元'], ['外資總買進金額', '爲', '1兆551.82億元'], ['賣出金額', '爲', '1兆455.63億元'], ['買超', '爲', '96.19億元'], ['（', '包括', '持股'], ['市值', '爲', '7兆3'], ['943.76億元', '佔', '上市股票市值34.18%'], ['829.51億元', '減少', '1885.74億元'], ['外資', '賣', '超'], ['市場', '賣', '超'], ['，', '賣出', '775千股'], ['賣超', '47', ',000千股']]"
0,20130325_2926,"今(25)日證券商申報客戶違約買賣總計金額9,225,100元，買進、賣出相抵後金額4,425,100元。今(25)日證券商申報客戶違約買賣總計金額9,225,100元，買進、賣出相抵後金額4,425,100元。","[['證券商', '申報', '客戶違約'], ['證券商', '申報', '客戶違約'], ['證券商', '申報', '客戶違約'], ['證券商', '申報', '客戶違約']]"
0,20130325_2927,股王大立光決配發17元現金股息 玉晶光2元台北股市股王大立光()今天召開董事會，決議對於去年股利配發17元現金股息，此一配息的額度與上一年相同；同時，大立光董事會也決議今年股東會訂6月21日召開。同時，今年的大立光股東會中並將進行董監全面改選。而另一中部光學元件廠商玉晶光()今天也召開董事會，會中並敲定6月19日召開股東會；同時，玉晶光董事會決議對於去年股利派發2元的現金股利。光學元件的需求在去年第3季起因蘋果iPhne 5以及iPad mimi新機的上市效應而明顯提升，但包括股王大立光及玉晶光兩大蘋果概念光學股，在2012年業績都出現大幅成長。大立光歷史走勢圖,"[['現金股息玉晶光2元臺北股市股王大立光', '召開', '董事會'], ['大立光董事會', '決議', '股東會訂召開'], ['股東會', '訂', '召開'], ['玉晶光董事會決議', '派發', '現金股利']]"
0,20130325_2928,F- 富驛侯尊中：砸12億元開發金門度假園區 首期明年底完工F-富驛董事長侯尊中表示，全部將投入12億元規畫建設整座度假園區，第1期工程2014年第4季前完成，3年後將全部興建工程完成。(鉅亨網記者張旭宏攝)F-富驛()看好金門觀光商機，攜手台灣新光不動產開發、台灣新光建經等業者，共組金門樂活假期酒店公司，標下4.55公頃的金門縣綠色休閒度假園區BOT案，今(25)日與金門縣長李沃士完成簽約儀式。董事長侯尊中表示，全部將投入12億元規畫建設整座度假園區，第1期工程2014年第4季前完成，3年後將全部興建工程完成。侯尊中指出，「金門縣綠色休閒渡假園區」，結合全球知名的飯店設計團隊紐約Rockwellgroup及國內知名設計師潘冀參與建造，知名度假村為讓度假園區和金門當地環保生態更融合，將會以「漣漪」的概念出發，結合環保生態，以一滴小水滴向外擴張的思考，不破壞環境且與環境作更和諧融合的設計，整個案子將會以綠建築的理念來設計，園區內將會包含Villa式 旅館、戲院表演廳、水上主題樂園、商店街及結婚禮堂等，第1期工程2014年第4季前完成，3年後將全部興建工程完成，未來將會是金門觀光旅遊的新亮點。金門樂活假期酒店公司由台灣富驛、新光集團、創意家共同組成，現在資本額為1億元，未來將增資至4億元，目前持股比例中，F-富驛持有10%、新光持有30%、創意家持有35%、侯尊中個人持有25%。李沃士強調，金門擁有3大優勢，第一不僅能提供免稅優惠，提供觀光消費最大助力；其次、配合兩岸的推展，擁有比台灣本島更寬鬆的陸客觀光限制，共有33個海西地區能申請來金門自由行；最後目前金門政府已爭取到廈門陸客得以自由申請來金門1日遊，1年能為金門多帶來6-7萬名陸客。,"[['全部', '投入', '12億元規畫'], ['F-富驛', '看好', '觀光商機'], ['董事長侯尊中', '表示', '全部投入12億元規畫'], ['全部', '投入', '12億元規畫'], ['侯尊', '中指出', '金門縣綠色休閒渡假園區結合'], ['設計團隊紐約Rockwellgroup潘冀', '參與', '建造'], ['知名度假村', '爲', '讓'], ['現在資本額', '爲', '1億元'], ['-富驛', '持有', '10%'], ['新光', '持有', '30%'], ['創意家', '持有', '35%'], ['侯尊中個人', '持有', '25%'], ['李沃士', '強調', '金門擁有大優勢'], ['金門', '擁有', '大優勢'], ['第一', '提供', '免稅優惠'], ['金門政府', '爭取', '到廈門陸客'], ['1年', '帶來', '7萬名陸客']]"
0,20130325_2929,永豐餘將砸80億兩岸擴產家紙，3年產能翻倍精實新聞 2013-03-25  記者 王彤勻 報導繼新建的揚州廠5、6號紙機於去年投入營運後，永豐餘(1907)再宣布家紙的重大投資計劃。永豐餘指出，看好家紙市場成長空間，未來3年將斥資80億元，於台灣、中國大陸再擴建10部紙機。待2015年家紙擴產完成後，永豐餘預估，兩岸家紙年產能可望從目前的17.5萬噸、大幅成長至2015的42萬噸。法人估，永豐餘去年家紙年營收約80億元，今年可望突破百億元規模，明年隨著家紙新產能的開出，永豐餘家紙部分的營收可望逼近200億元、翻倍跳增。永豐餘協理殷國堂進一步說明，這10部紙機建置地點，將鎖定桃園、廣東、江蘇三處，而此選址考量，主要是希望與公司本身的工紙廠，以及永豐餘和華紙(1905)共同投資的廣東鼎豐、揚州廠等生產據點相互結合，發揮集團最大的漿源、能源生產綜效。他表示，整體投資案預計分兩階段進行：第一階段投資將於2014年完成，永豐餘屆時將在台灣、廣東、江蘇三省各增建2部紙機(共6台)，2015年則進入第二階段，永豐餘將在廣東和江蘇各擴建2部紙機(共4台)，待擴產告一段落後，永豐餘的家紙年產能將呈現翻倍成長，站上42萬噸規模。事實上，台灣家紙市場已經有近10年未見如此大手筆投資，永豐餘為何選擇在此時出擊？對此永豐餘總經理特助(永豐餘消費品總經理何奕達為推動此投資案的推手)鄭春暉指出，無論台灣或中國大陸家紙市場都有容納新產能的空間，而根據台灣海關統計，去年台灣衛生紙原紙進口量為5萬3千噸，佔國內生產總量的22%，顯示台灣國內自製的衛生紙原紙比重僅78%。而由於進口紙運費必然較高，台灣自製紙張在品質、價格上都有不錯優勢，因此永豐餘仍看好未來可進一步擴展於台灣地區家紙的市佔。據了解，目前台灣家紙第一大廠為金百利克拉克，市佔約34%、永豐餘則約25%，兩者就吃掉台灣家紙市場的6成，其他則多為較低價的小品牌，也因此永豐餘看好，隨著生活水準提高，消費者對中、高階家紙用量的提升，將有助於公司進一步拉高在台灣的市佔。公司預估，隨著家紙新產能陸續開出，至2015年為止，永豐餘於台灣的家紙市佔率將能升至35%。鄭春暉進一步舉例，以台灣的廚紙市場為例，近2年市場規模約有18%的成長，而永豐餘也搭上這個趨勢，廚紙的市佔率從2011年的32%提升至2012年的38%，顯見消費者對特殊用途的家紙越來越捨得花錢，也因此公司決定不僅是在中國大陸擴充家紙產能，也在台灣擴產。至於中國大陸市場方面，永豐餘則引述研調資料指出，中國大陸去年家紙消費量達560萬噸，估計至2015年會再成長至660萬噸，其中高檔生活用紙消費量可望再從去年的336萬噸增加至400萬噸，也因此家紙市場在兩岸都有很大成長潛能。永豐餘並於今日董事會中通過去年合併財報數字：營收為539.6億元，較2011年的534.64億元微幅增加；然雖去年包括家紙、文紙、工紙本業表現均優於2011年，但受轉投資元太(8069)表現不佳拖累，永豐餘去年獲利砍半為10.9億元，EPS為0.66元。永豐餘並於董事會通過，每股將配發0.4元現金股利。,"[['永豐餘', '砸', '擴產家紙'], ['紙機', '投入', '營運'], ['永豐餘1907', '宣佈', '投資計劃'], ['永豐餘', '指出', '看好成長空間'], ['紙年產能', '可望', '成長'], ['永豐餘協理殷國堂', '說明', '希望結合'], ['建置地點', '鎖定', '桃園三處'], ['他', '表示', '整體投資案預計進行'], ['將', '擴建', '4臺紙機'], ['紙年產能', '呈現', '成長'], ['家紙市場', '有', '如此大手筆投資'], ['永豐餘消費品總經理何奕達', '推動', '此投資案'], ['爲', '推動', '此投資案'], ['永豐餘消費品總經理何奕達推動此投資案推手鄭春暉', '指出', '原紙進口量爲5萬3千噸'], ['臺灣', '有', '容納新產能空間'], ['原紙進口量', '爲', '5萬3千噸'], ['自制紙張', '有', '不錯優勢'], ['第一大廠', '佔', '34%'], ['兩者', '喫掉', '家紙市場6成'], ['生活水準提高', '有助於', '佔'], ['公司', '預估', '家紙市佔率升'], ['永豐', '餘於', '臺灣'], ['市場規模', '有', '18%成長'], ['永豐餘', '搭上', '這個趨勢'], ['市佔率', '提升至', '2012年38%'], ['對家紙', '捨得', '花錢'], ['公司', '決定', '擴充家紙產能'], ['研調資料', '指出', '去年家紙消費量達560萬噸'], ['去年家紙消費量', '達', '560萬噸'], ['用紙消費量', '可望', '增加'], ['家紙市場', '有', '很大成長潛能'], ['永豐餘', '於', '合併財報數字'], ['營收', '爲', '539.6億元'], ['家紙', '優於', '2011年'], ['轉投資元太8069', '表現', '不佳拖累'], ['永豐餘去年獲利', '爲', '10.9億元'], ['EPS', '爲', '0.66元'], ['永豐餘', '於', '董事會通過'], ['配', '發', '現金股利']]"
