,News,All,SVO
0,20130812_600,《股市》09:00台期指08 報7850.00點，漲26.00點或0.33%《股市》09:00台期指08 報7850.00點，漲26.00點或0.33%。免責聲明：本文所載資料僅供參考，並不構成投資建議，鉅亨網對該資料或使用該資料所導致的結果概不承擔任何責任。該資訊若與事實不符，應以商品原交易所之公佈為主。,"[['00臺', '期指', '報7850.00點'], ['00臺', '期指', '08報7850.00點'], ['導致結果', '承擔', '任何責任']]"
0,20130812_601,《股市》09:00台股加權 報7882.49點，漲26.35點或0.34%《股市》09:00台股加權 報7882.49點，漲26.35點或0.34%。免責聲明：本文所載資料僅供參考，並不構成投資建議，鉅亨網對該資料或使用該資料所導致的結果概不承擔任何責任。該資訊若與事實不符，應以商品原交易所之公佈為主。,"[['導致結果', '承擔', '任何責任']]"
0,20130812_602,統一涼麵食品中毒案 食藥署：業者應強化自主管理措施統一涼麵食品中毒案引發外界關注，食品藥物管理署表示，食品業者應強化自主管理措施，違法者將依食品衛生管理法第四十七條之規定，處3萬元以上300萬元以下罰鍰。食品藥物管理署表示，為預防食品中毒及不符合食品流通市面，食品業者應強化自主管理措施，當接獲民眾客訴，只要有可能是所製造或販售產品有危害衛生安全之虞時，應該立即主動停止製造、加工、販賣、及辦理回收，並通報所轄衛生主管機關。違反者，食品藥物管理署表示，將依食品衛生管理法第四十七條之規定，處3萬元以上300萬元以下罰鍰；情節重大者，並得命其歇業、停業一定期間、廢止其公司、商業登記、工廠之全部或部分登記事項，或食品業者之登錄。食品藥物管理署強調，食品衛生管理法修法後，為確保消費者飲食衛生安全，已強化各階段食品業者對其產品負有落實自主管理及確保食品安全之責任，除符合食品良好衛生規範及經公告指定之業者並須實施食品安全管制系統外，食品業者一旦發現其產品有危害衛生安全之情事時，應立即主動通報主管機關，俾使民眾飲食安全及消費權益獲得保障，並避免觸法。,"[['業者', '強化', '自主管理措施'], ['涼麪食品中毒案', '引發', '外界關注'], ['藥物管理署', '表示', '食品業者強化自主管理措施'], ['食品業者', '強化', '自主管理措施'], ['違法者', '處', '300萬元以下罰'], ['藥物管理署', '表示', '食品業者強化自主管理措施'], ['食品業者', '強化', '自主管理措施'], ['產品', '有', '危害衛生安全虞'], ['違反者', '表示', '處300萬元以下罰'], ['食品管理署', '強調', '食品衛生管理法修法'], ['食品業者', '落實', '自主管理'], ['對其產品負有', '落實', '自主管理'], ['除', '符合', '良好衛生規範'], ['符合良好衛生規範業者', '實施', '食品安全管制系統'], ['一旦', '發現', '其產品有危害衛生安全情事'], ['其產品', '有', '危害衛生安全情事'], ['食品', '通報', '主管機關']]"
0,20130812_603,華南期貨台股期指盤前分析◆盤勢分析陸股盤中重挫，使得宏達電獨木難撐大局，多頭信心喪失，終場下跌51.53點，週五量縮長黑破低，線型上仍未見止跌訊號，外資期貨空單續增，不過買進買權超過萬口，開始有鎖住獲利的動作，下週大盤接近自去年低點以來的上升趨勢線，短線上或有反彈，不過仍建議逢反彈偏空布局。籌碼面的部份，外資現貨賣超81.92億，淨部位為淨空16289口。8月合約買權 OI大量分佈在8000以上，目前買權OI最大量在8300，約6.1萬口左右，賣權OI大量分佈在7800以下，賣權最大量目前在7600，約4萬口。,"[['華南期貨臺股期分析盤勢', '分析', '陸股盤中重挫'], ['買進買權', '超過', '鎖住獲利動作'], ['有', '鎖住', '獲利'], ['反彈', '偏', '空'], ['現貨賣', '超', '81.92億'], ['淨部位', '爲', '淨空16289口'], ['OI', '分佈在', '8000以上'], ['賣權OI', '分佈在', '7800以下'], ['賣權', '在', '7600']]"
0,20130812_604,統一期貨台指選擇權盤前分析◆盤勢分析多空就選擇權籌碼觀察，賣權/買權未平倉比由0.79下降至0.75，為偏空格局。在最大未平倉量序列部份，買權維持在8300點，賣權維持在7600點。外資選擇權賣權有做獲利了結，但看法仍偏空。,"[['賣權買權平倉比', '下降至', '0.75'], ['買權', '維持在', '8300點'], ['外資選擇權賣權', '做', '獲利了結']]"
0,20130812_605,"統一期貨台股期指盤前－多方失信心，台股7900點失守◆盤勢分析週四歐美股市多為收紅，但僅讓台股開盤有好的表現，盤中因欠缺量能，多方喪失追高信心，使行情反向走跌，日K再收中黑K；電子股方面，雖有宏達電一度漲停，企圖強彈撐盤，但孤掌難鳴，加上NB股仁寶跌4%的拖累，使類股僅收小紅；金融股方面，災情顯得較為慘重，開盤便湧現賣壓，多數權值股跌逾1%；傳產方面，表現也不甚理想，水泥、塑膠下跌均超過1%；終場收盤51點，收在7856點，成交值771億元。在期指部分，下跌20點，逆價差31.14點；電子期小漲0.6點，逆價差0.84點，金融期下跌7.6點，逆價差6.61點；下跌逆價差縮小，但氣氛依然偏空。就未平倉部位分析，自營商多單增加1,546口，淨多單部位3,939口；投信多單減少81口，淨多單部位2,017口；外資空單增加455口，淨空單部位16,289口；在籌碼面部份，外資賣超現股82億元，期貨淨空單部位增加，看法偏向空方。就技術面觀察，開高走低，日K不僅連四黑，更收中黑K棒，7900點關卡失守，加上籌碼面外資不論期現貨仍同步做空，盤面氣氛偏空無疑，短線若再遭遇國際股市回檔，台股再創新低的機會頗大，投資人須留意下檔風險。","[['歐美股市', '收', '紅'], ['電子股方面', '有', '宏達電漲停'], ['災情', '顯得', '慘重'], ['股跌', '逾', '1%'], ['下跌', '超過', '1%'], ['氣氛', '偏', '空'], ['自營商', '增加', '546口'], ['多單', '減少', '81口'], ['外資空單', '增加', '455口'], ['看法', '偏向', '空方'], ['日K', '收中', '黑K棒'], ['短線', '遭遇', '國際股市回檔'], ['投資人', '留意', '下檔風險']]"
0,20130812_606,券商分析摘要◆券商推薦個股排行： ◆ 大慶證：雖然上週五亞股普遍在下跌後出現反彈，但台股近期卻相對弱勢，主要原因除了原先市場期待的兩岸服貿協議仍在立院擱置外，外資的持續調節賣壓也是指數積弱不振的兇手，外資現貨持續砍殺81.9億元，三大法人合計賣超95.5 億元；外資加碼淨空單447口至16289口，也因此，導致週五指數續跌51點跌破7900關卡，而成交量較前一日略縮為771億元。 ◆ 新光金：雖然宏達電因新機加入戰場及庫藏股效應勁揚，但NB股旺季不旺，連翻走跌，加上金融及傳產股表現疲弱、外資持續賣超，使得週五台股開高走低，終場收7856.1 4點，下跌51.53點或0.65%，成交量783.84億元。 ◆ 大昌證券：台股上週就在盛傳美國QE政策即有可能將在9月退場的消息刺激下，大盤一舉慣破下檔半年線及8000點整數關卡的支撐，週線合計下跌243點收在7856點，外資也調節晶圓雙雄及金融族群，短短四天賣超台股合計即高達362億元。 ◆ 福邦證券：國際股市上週五漲跌互見，歐股三大指數全數收漲，止跌反彈，而美股則是向下修正，持續未完成的路。亞股中日本、韓國陷入反彈後的休息，陸股和港股則是尾盤拉高，企圖守穩前波低點，國際股市看起來似乎沒有一個共同的方向，說穿來，也不過就是在等待美國聯準會九月份是否會確定縮減購債規模。 ◆ 統一證：由於QE提前退場利空再度襲來，美歐股短期表現難脫震盪。台股本週受到半年報與重量級法說會接近尾聲，「醜媳婦見公婆」效應仍存，且政府將大幅釋股，外資於現貨、期貨偏空、MSCI季度權重調整，上半週台股行情將受到壓抑，預期指數難有表現。不過，股價跌深後將醞釀個股反彈契機，加上時序進入中國「金九銀十」拉貨效應，可留意相關中概股跌深反彈操作機會。,"[['券商', '分析', '摘要'], ['券商', '推薦', '個股'], ['週五亞股', '出現', '反彈'], ['外資調節', '也是', '積弱不振兇手'], ['三大法人', '賣', ' 億元'], ['51點跌', '跌破', '7900關卡'], ['新機', '加入', '戰場'], ['外資', '賣', '超'], ['臺股上週', '在', '盛傳QE政策'], ['在', '盛傳', 'QE'], ['退場消息', '刺激', '退場消息可能'], ['大盤', '慣破', '半年線支撐'], ['外資', '調節', '晶圓雙雄'], ['陸股', '是', '尾盤拉高'], ['企圖', '守', '前波低點'], ['國際股市', '沒有', '共同方向'], ['美國聯準會', '確定', '購債規模'], ['縮減', '購', '債'], ['半年報', '接近', '尾聲'], ['醜媳婦', '見', '公婆'], ['醜媳婦', '見', '公婆'], ['政府', '釋', '股'], ['上半周臺股行情', '受到', '壓抑'], ['預期指數', '有', '表現'], ['股價', '跌', '深'], ['」', '拉', '貨']]"
0,20130812_607,台股8月12日訊息盤點(五) 外資報告(1) 華碩（2357）法說會內容低於外資圈的預期，昨（11）日共牽動8家外資券商調降目標價，最低為摩根大通與花旗環球證券的200元，今（12）日開盤股價雖仍有下修風險，惟可望比照F-TPK（3673），在已出現一波大跌後，進入盤整期。,"[['說會內容', '低於', '外資圈預期'], ['開盤股價', '有', '修風險'], ['可望', '進入', '盤整期']]"
0,20130812_608,台股8月12日訊息盤點(四) 歐美股市(1)多頭應是度夏季假期，美國股市周五收低，本周亦下跌。盤中大跌逾150點，而後反彈，縮小跌幅。分析師說，該賣壓並沒有明顯理由。工業平均指數收低72.81點或0.47%至15425.51。Nasdaq指數收低9.01點或0.25%至3660.11。指數收低6.06點或0.36%至1691.42。指數收低2.55點或0.54%至471.76。(2) 歐股周五 (9日) 連續2日上漲，讓基準指數本周收高，係因中國數據正面，提升市場對該國經濟的樂觀心態。泛歐Stoxx 600指數收高 0.6%至 305.92。區幾家大型企業本周公布正面獲利消息，激勵市場。,"[['分析師', '說', '賣壓並沒有明顯理由'], ['賣壓', '並沒有', '明顯理由'], ['泛歐Stoxx 600指數', '收', '高'], ['大型企業', '公佈', '獲利']]"
0,20130812_609,台股8月12日訊息盤點(三) 盤前分析(1)台股上周五終場跌破7900點，下探年線支撐，而外資則持續站在空方，期貨淨空單部位達到1.6萬多口，並持續賣超現貨，本周台股變數仍多，包含電子廠法說陸續對下半年釋出保守展望，以及政府規劃出售股票以彌補財政預算缺口，雖預計由四大基金承接，對台股實質影響有限，不過恐再影響多頭信心，盤面上電子股留意蘋果概念股與4G概念股等，力抗大盤下跌壓力，下檔先看年線支撐。台股持續面臨回檔壓力，以技術面而言，指數仍在5、20日線以下游走，趨勢也往下挪移，顯示台股仍有修正的路要走，外資也連續賣超台股 4 個交易日，已賣超360多億元，期貨淨空單口數也持續增加，達到1.6萬多口，皆壓抑台股走勢，近日傳政府規劃出售大型股股票，以彌補財政預算缺口，預期將由四大基金進場承接，雖可減少對台股之實質衝擊，不過卻可能打擊多頭。,"[['上週五終場', '跌破', '7900點'], ['外資', '站在', '空方'], ['淨空單部位', '達到', '1.6萬多口'], ['政府規劃', '出售', '股票'], ['電子股', '留意', '等蘋果概念股'], ['臺股', '面臨', '檔壓力'], ['臺股', '有', '修正路走'], ['政府', '規劃', '大型股股票']]"
0,20130812_610,台股8月12日訊息盤點(二) 個股訊息(1)NCC釋出4G執照今日將進入第一關面試， 7 家競標業者將由董事長親自領軍，包含 4 大電信業者，鴻海董座郭台銘，與頂新集團董事長魏應交等人，市場看好今日相關4G概念股股價走勢也可望持穩。(2)筆電類股股價也將成盤面焦點，在宏碁第 2 季虧損後，華碩對全年筆電也釋出保守看法，下調全年出貨總量，高標僅有1900萬台，而外資對華碩看法也保守，共有 8 家外資調降目標價，最低喊出200元，今日走勢恐有不小壓力。(3)晶圓代工台積電 7 月營收表現也不佳，達521億元，月減3.6%，相較之下聯電 7 月營收則達115.6億元，月增7.4%，兩家營收表現不同調，另外台積電也傳出遭到搶單的利空，包含格羅方德搶28奈米訂單，以及高通新的晶片訂單轉向三星。,"[['1訊息NCC', '釋出', '4G執照'], ['競標業者', '領', '大電信業者'], ['相關4G概念股股價走勢', '持', '穩'], ['華碩', '釋出', '保守看法'], ['高標', '僅有', '1900萬臺'], ['今日走勢', '有', '小壓力'], ['月', '減', '3.6%'], ['7月營收', '達', '115.6億元'], ['月', '增', '7.4%'], ['臺積電', '傳出', '遭到搶單利空'], ['格羅方德', '搶', '28奈米'], ['格羅方德', '搶', '28奈米'], ['晶片訂單', '轉向', '三星']]"
0,20130812_611,統一證券盤前－半年財報、政府釋股，指數難有表現【昨日盤勢】：美股小漲，結束連三天跌勢，激勵上週五台股開盤以上漲47點跳空開出，但龐大賣壓隨即出籠，指數由紅翻黑後一度下挫57點跌至7853點。盤面上電子股相對強勢僅小跌0.3%，宏達電與TPK續彈，高價與權重股亦多止穩，但傳產與金融族群表現疲弱皆下挫近1%，其中汽車股在和泰車領跌下重挫1.9%，生技、塑膠、電器與水泥股跌幅亦達1%以上。終場下挫51點或0.65%，以7856點作收，成交量769億元；累計上週台股重挫243點或3%，週量不減反增，由3837億元增至3950億元。【資金動向】：三大法人合計賣超86.4億元。其中外資賣超81.9億元，投信買超1.8億元，自營商賣超6.3億元。外資買超前五大為宏達電、勝華、彩晶、潤泰全、F-TPK；賣超前五大為聯電、台積電、中信金、友達、兆豐金。投信買超前五大為台苯、喬鼎、仁寶、遠百、第一金；賣超前五大為統一、F-中租、台積電、華航、冠德。資券變化方面，融資增加3.89億元，融資餘額為1873.3億元，融券減少0.42萬張，融券餘額為37.43萬張。【今日盤勢分析】：上週因QE提前退場利空再起，美股創高後拉回，歐股除法國外亦同步走跌，亞洲股市表現亦疲軟，如日、韓、港股分別下挫-5.9%、-2.2%、-1.7%，其中台股單週下挫243點或3%表現更為弱勢。觀察上週類股表現，電子股指數下跌2.68%，雖持續破底，但跌勢略為減緩，反而是金融與傳產股分別重挫3.72%與3.16%，已由高檔震盪轉為拉回下跌走勢。本週預期下列多空因素將影響盤勢演變，其一、QE提前退場議題持續發酵或冷卻? 由於月底Jackson Hole全球央行年會始有較明確答案，預期美經濟穩健復甦腳步將逐漸抵銷QE退場的不確定性，且債市資金外逃，短期仍有利於美股表現。其二、半年報公佈期限僅剩3天，雖重要公司財報多已揭曉，但「醜媳婦見公婆」效應仍存，上半週台股表現可能受到壓抑。其三、台股法說會亦逐漸進入尾聲，本週金控股中信金與富邦金，NB股和碩、英業達與廣達法說將陸續登場，雖對整體行情挹注有限，但可留意個別股操作機會。其四、中國「金九銀十」即所謂9月中秋與十一長假週，所帶來內需消費效應有機會開始顯現，包含零售、百貨、觀光、智慧型手機、TV等次族群將優先受惠。其五、須留意政策態度，不但服貿協議將延至立院下會期9月份才進行審議，上週央行發行兩年期NCD、回收百億元資金與包含國發基金將釋出台積電股票、政府將大幅釋股等，恐持續壓抑台股表現。另外，8/15日MSCI將公佈台股權重調整，預期獲得調升機率偏低，且外資於現貨、期貨偏空態度不變，也對本週台股行情不利。【投資策略】：由於QE提前退場利空再度襲來，美歐股短期表現難脫震盪。台股本週受到半年報與重量級法說會接近尾聲，「醜媳婦見公婆」效應仍存，且政府將大幅釋股，外資於現貨、期貨偏空、MSCI季度權重調整，上半週台股行情將受到壓抑，預期指數難有表現。不過，股價跌深後將醞釀個股反彈契機，加上時序進入中國「金九銀十」拉貨效應，可留意相關中概股跌深反彈操作機會。,"[['指數', '表現', '盤勢'], ['指數', '下挫', '57點'], ['生技跌幅', '達', '1%以上'], ['自營商賣', '超', '6.3億元'], ['外資買', '爲', '宏達電'], ['賣超前五大', '爲', '聯電'], ['賣超前五大', '爲', '統一'], ['融資', '增加', '3.89億元'], ['融資餘額', '爲', '1873.3億元'], ['融券', '減少', '0.42萬張'], ['融券餘額', '爲', '37.43萬張'], ['電子股指數下跌', '破', '底'], ['多空因素', '影響', '盤勢演變'], ['Jackson Hole全球央行年會', '有', '明確答案'], ['復甦腳步', '抵銷', 'QE退場不確定性'], ['公佈期限', '僅剩', '3天'], ['醜媳婦', '見', '公婆'], ['醜媳婦', '見', '公婆'], ['臺股表現', '受到', '壓抑'], ['中國金九銀十', '即', '9月中秋'], ['消費內需效應有機會', '開始', '顯現'], ['服貿協議', '進行', '審議'], ['、', '回收', '百億元'], ['與', '包含', '國發基金'], ['政府', '釋', '股'], ['大幅', '釋', '股'], ['政府等釋股資金', '恐', '壓抑臺股表現'], ['8/15日MSCI', '公佈', '臺股權重調整'], ['預期', '獲得', '調升'], ['外資', '於', '現貨'], ['外資', '於', '現貨'], ['期貨', '偏', '空'], ['半年報', '接近', '尾聲'], ['醜媳婦', '見', '公婆'], ['醜媳婦', '見', '公婆'], ['政府', '釋', '股'], ['上半周臺股行情', '受到', '壓抑'], ['預期指數', '有', '表現'], ['股價', '跌', '深'], ['」', '拉', '貨']]"
0,20130812_612,台股8月12日訊息盤點(一) 部會消息(1)為籌編明（103）年度政府總預算，經建會、交通部、財政部三大部會將被迫賣股票，除已知處分國發基金手中台積電持股外，其他持有上市櫃股票也評估中，初估須處分包括中華電、兆豐金、第一金、合庫等標的，釋股總額超過800億元。這是馬政府近5年首度編釋股預算籌措財源。(2)為因應日益困窘的國家財政，財政部獻策擬引進英國、日本「PFI民間融資制度」，為政府增加財務調度靈活，推動公共建設。惟江揆表示，牽涉長期政府財務負擔，宜審慎規劃，以免反成政府長期債務負擔。上周五，財政部向江揆提出「PFI民間融資制度」機制規劃，但各部會對於這項國內首創機制是否安全，有無後遺症，一旦政黨輪替是否有變數，是否現任政府為後人決定債務等討論甚多。(3)政府籌編明年度預算鬧錢荒，國發基金被鎖定為挹注國庫的金雞母，除手中持有台積電被迫拋售外，還有航空類、生技類及半導體或光電等類股，均列入評估中，明年繳庫盈餘近380億元，創下11年來新高、史上第二高。,"[['1消息', '爲', '總預算'], ['三大部會', '被迫', '賣股票'], ['除', '已知', '處分'], ['其他', '持有', '股票'], ['初估須處分', '包括', '等電標的'], ['股總額', '超過', '800億元'], ['這', '是', '編釋股預算籌措財源'], ['編釋股預算', '籌措', '財源'], ['爲政府', '增加', '財務調度靈活'], ['江揆', '表示', '宜審慎規劃'], ['財政部', '提出', '機制規劃'], ['政黨輪替', '有', '變數'], ['政府', '籌編', '鬧錢荒'], ['手中', '持有', '拋售'], ['明年', '繳', '庫'], ['繳庫盈餘', '創下', '11年來新高']]"
0,20130812_613,福邦證券盤前－回測年線多方展現防守力道◆盤勢分析國際股市上週五漲跌互見，歐股三大指數全數收漲，止跌反彈，而美股則是向下修正，持續未完成的路。亞股中日本、韓國陷入反彈後的休息，陸股和港股則是尾盤拉高，企圖守穩前波低點，國際股市看起來似乎沒有一個共同的方向，說穿來，也不過就是在等待美國聯準會九月份是否會確定縮減購債規模。台北股市也在國際股市的不確定因素之中，顯得風兩飄搖。上週台北股市總共下挫了244 點，成交量放大至3863 億，形成了一根帶量黑K的走勢，所以本週還有低點。若是如此，下檔支撐就是直接觀察年線：7814。由於上週五的收盤位置是7856，距離年線也不過才42 點，所以，指數很有可能會跌破年線，但六月下旬的位置，有一個島狀反轉缺口，所以，我個人認為7700~7800是多頭防守的底限，不會輕易被跌破。只不過，可惜的是，上檔蓋頭反壓重重，五日、十日、月均線以及季均線，紛紛彎頭向下，多頭想要往上反攻，短時間不是一見容易的事，俗話說：「眾志成城」，我研判至少要有 1000 億的多方量，才有可能成功化解上方賣壓。七月份營收已經公告完畢，根據統計，總共有111 檔個股創下新高紀錄。所以，第三季的傳統旺季效應還是發酵，其中不乏指標股，如：F-中租(5871)、億光(2393)、東聯(1710)、精華光(1565)、兆豐金(2886)、開發金(2883)、美利達(9914)、聯電(2303)、第一金(2892)、中信金(2891)、穩懋(3105)……等，所以，雖然目前大家對下半年的景氣半信半疑，但我認為絕對不會比去年差，所以，本波回測之後，仍應站在買方。本週 MSCI 將調整台股權重，市場預期台北股市的權重仍將被調降，引發外資法人的調節賣壓。上週外資對台股加權市場總計賣超353.4 億，本月累計賣超358.6 億，平均一天賣超 50 餘億。上週投信合計賣超8.3 億，八月累計賣超9.6 億。比較值得留意的是，外資在期貨市場留倉淨空單16289 口，再度呈現期、現貨同步偏空的趨勢。今日的觀察重點，在於網通4G題材的延燒，包括建漢(3062)、台揚(2314)、智易(3596)、訊舟(3047)，在上週五已有資金進場卡位。短壓：7900~7920，短撐：7800~7810。,"[['多方', '展現', '防守力道'], ['陸股', '是', '尾盤拉高'], ['企圖', '守', '前波低點'], ['國際股市', '沒有', '共同方向'], ['美國聯準會', '確定', '購債規模'], ['縮減', '購', '債'], ['臺北股市', '顯得', '飄搖'], ['成交量', '放大至', ' 億'], ['收盤位置', '是', '7856'], ['指數', '跌破', '年線'], ['六月下旬位置', '有', '反轉缺口'], ['我個人', '認爲', '跌破'], ['77007800', '是', '防守底限'], ['可惜的', '是', '彎頭'], ['我', '研判', '有1000多方量'], [' 檔個股', '創下', '新高紀錄'], ['我', '認爲', '差'], ['本週MSCI', '調整', '臺股權重'], ['比較', '值得', '留意'], ['值得留意的', '是', '在'], ['外資', '在', '留倉淨空單16289口'], ['期', '偏', '空'], ['同步', '偏', '空'], ['觀察重點', '在於', '網通延燒'], ['觀察重點在於網通延燒', '網通', '4G題材']]"
0,20130812_614,台指期 12 日開漲21.00點或0.27% 開盤報7848.00今 (12) 日開盤報7848.00點或漲0.27%。,"[['日開盤報7848.00點', '漲', '0.27%']]"
