,News,All,SVO
0,20151209_832,"富味鄉：公告本公司收到財政部關務署臺北關行政處分書第三十四條　第21款1.事實發生日 :104/12/092.發生緣由:  本公司自主查核發現外銷芝麻油品申請沖退進口關稅有計算錯誤之情事，主動向財政  部關務署陳報，並表明願繳回溢沖退之稅款；惟處分機關除追徵所溢沖退稅款外，截  至本日為止，處分機關已處罰鍰共計130,844,216元。3.處理過程:  本公司主動向財政部關務署陳報並表明願繳回溢沖退之稅款，更提供更正溢退稅額等  多份完整報單內容暨事證等相關檔案，向處分機關主動據實陳報及詳加解釋。依據「  海關緝私案件減免處罰標準」第17條規定，「於海關或其他協助查緝機關接獲檢舉或  進行調查前，因違法行為人或報關業者主動陳報或提供違法事證，並因而查獲或確定  其違法行為者，免予處罰。」處分機關漏未審酌，該行政處分適法性容有疑義，本公  司將依法提出復查等行政救濟程式。4.預估可能損失:  (1)本公司已將溢沖退稅款60,021,716元於民國102年合併財務報告及103年第　     二季合併財務報告中提列為銷貨成本。  (2)本件為本公司主動向財政部關務署陳報，依法應免予處罰，主管機關之裁罰處分     明顯違反相關法律規定，本公司將循求法律途徑救濟，就已處分之罰鍰及未來因     本件所處之罰鍰於限期內依法提起訴願、行政訴訟救濟，以維護股東權益。5.可能獲得保險理賠之金額:無6.預計改善情形及未來因應措施:  本公司已加強作業流程管理，恪守法令規範。7.其他應敘明事項:  (1)本公司已於104年2月4日召開記者會說明本事件。  (2)本次係公告處分機關目前累計處罰鍰共計130,844,216元。  (3)主管機關針對本公司前揭主動陳報案件皆已開立行政處分書在案，公司將依法提     出行救濟程式。","[['本公司', '收到', '發生日'], ['申請', '有', '關務署陳報'], ['申請有關務署陳報', '計算', '錯誤'], ['願繳', '回溢', '沖稅款'], ['除', '追徵', '沖稅款'], ['  本公司', '表明', '沖稅款'], ['完整', '報', '單'], ['海關', '接獲', '檢舉'], ['該行政處分適法', '性容', '有疑義'], ['本公  司', '提出', '行政救濟程式'], ['本公司', '退', '021稅款'], ['本件', '爲', '向陳報'], ['本公司', '向', '財政部關務署'], ['主動', '向', '財政部關務署'], ['裁罰處分', '違反', '相關法律規定'], ['本公司', '求', '法律途徑'], ['本公司', '求以', '維護股東權益'], ['本公司', '加強', '恪守法令規範'], ['本公司', '召開', '記者會'], ['主管機關', '開立', '行政處分書在案'], ['公司', '提', '出行']]"
0,20151209_833,"天蔥：本公司股票初次上櫃現金增資發行新股公告一、本公司為配合初次上櫃前公開承銷辦理現金增資14,460,000元，發行普通股1,446,000股，每股面額10元，業經財團法人中華民國證券櫃檯買賣中心104年11月20日證櫃審字第1040032141號函申報生效在案。二、茲依據公司法第273條第2項之規定，將增資發行新股事項公告如下：(一)公司名稱：天蔥國際股份有限公司(二)所營事業: (1) F501060 餐館業。 (2) F501030 飲料店業。 (3) C104020 烘焙炊蒸食品製造業。 (4) F203010 食品什貨、飲料零售業。 (5) F203020 菸酒零售業。 (6) F201010 農產品零售業。 (7) F201020 畜產品零售業。 (8) F206020 日常用品零售業。 (9) F401010 國際貿易業。 (10)I101090 食品顧問業。 (11)I199990  其他顧問服務業   (12)ZZ99999  除許可業務外，得經營法令非禁止或限制之業務  (三)本公司所在地：台北市內湖區港墘路221巷35號4樓。(四)公告方式：公告於公開資訊觀測站(五)訂立章程之年、月、日：本公司章程訂立於民國96年2月7日，第9次修訂於民國104年6月30日。(六)董事及監察人之人數及任期：董事7人(含獨立董事3人)，監察人3人，任期均為三年，連選得連任。(七)本次增資發行新股總額、每股金額及其發行條件：1.本次現金增資發行新股1,446,000股，每股面額10元。2.本次現金增資發行新股除依法令規定保留發行新股總額15%計216,000股供員工認購，其餘計1,230,000股依證券交易法第28條之一及相關申請初次上櫃承銷新制度規定，由原股東放棄認購以供全數提撥公開承銷，不受公司法第267條之限制。員工放棄或認購不足部份，授權董事長洽特定人認足之。對外公開承銷認購不足部分，擬依「中華民國證券同業公會證券商承銷或再行銷售有價證券處理辦法」規定辦理。3.現金增資發行價格：本次現金增資採溢價方式辦理，實際發行價格依詢價圈購之結果議定。(八)增資發行新股後股份總額及每股金額：本次增資後實收資本額159,781,960元整，每股面額10元，計15,978,196股，均為記名式普通股。(九)增資計劃用途：充實營運資金。(十)本次發行新股全面採無實體方式發行。(十一)股款代收暨存儲機構：1.員工認股代收股款機構：國泰世華商業銀行內湖分行。2.詢價圈購及公開申購代收股款機構：國泰世華商業銀行仁愛分行。3.存儲專戶機構：國泰世華商業銀行瑞湖分行。(十二)對外公開銷售受理時間：1.詢價圈購期間：104年12月11日至104年12月16日。2.公開申購期間：104年12月14日至104年12月16日。(十三)繳款期間：1.員工認股繳款日期：104年12月18日至104年12月21日。2.公開申購扣款日期：104年12月17日。3.詢價圈購繳款日期：104年12月18日。4.特定人認股繳款日期：104年12月22日。5.增資基準日期：104年12月23日。(十四)主辦承銷商：國泰綜合證券股份有限公司。(十五)公開說明書之陳列處所及索取方式：1.陳列處所：除依法分送主管機關公開陳列外，另陳列於本公司所在地。2.索取方式：請上網至公開資訊觀測站(http://mops.twse.com.tw/)查詢。(十六)本次現金增資預計於股款募集完成後，將先行以股款繳納憑證劃撥至認購繳款人指定之集保帳戶，股東不得請求交付股款繳納憑證。增資發行新股股票俟呈奉主管機關核准變更登記後30日內以無實體發放。三、本公司最近年度經會計師查核簽證之財務報表請至「公開資訊觀測站」查詢。四、特此公告。","[['上櫃現金增資', '發行', '一'], ['本公司', '承銷', '460增資'], ['104年11月20日證櫃', '審', '字'], ['增資', '發行', '新股事項'], ['本公司章程', '訂立於', '民國96年2月7日'], ['(', '含', '3人'], ['任期', '均爲', '三年'], ['本次增資', '發行', '新股總額'], ['不足部份', '授權', '之'], ['不足部分', '擬', '辦理'], ['詢價', '圈購', '發行價格'], ['發行新股採', '無', '實體'], ['員工', '認', '股'], ['員工', '認', '股'], ['員工', '認', '股'], ['員工', '認', '股'], ['公開', '申購', '扣款'], ['詢價圈', '購', '繳款'], ['特定人', '認', '股'], ['特定人', '認', '股'], ['股東', '請求', '交付繳納憑證']]"
0,20151209_834,永佳樂11月營收0.97億元年減0.27% 1— 11月達10.87億元永佳樂(9983-TW)2015年 11月營收資料(單位:千元),"[['-', 'TW', '9983']]"
0,20151209_835,大揚有線11月營收0.26億元年減3.49% 1— 11月達2.91億元大揚有線(8970-TW)2015年 11月營收資料(單位:千元),[]
0,20151209_836,鳳信有線11月營收1.02億元年減0.19% 1— 11月達11.30億元鳳信有線(8966-TW)2015年 11月營收資料(單位:千元),[]
0,20151209_837,紅樹林11月營收0.42億元年增2.90% 1— 11月達4.61億元紅樹林(8960-TW)2015年 11月營收資料(單位:千元),"[['紅樹林', '營收', '0.42億元年']]"
0,20151209_838,匯特11月營收0.00億元年增0% 1— 11月達0.01億元匯特(6458-TW)2015年 11月營收資料(單位:千元),"[['匯特', '營收', '0.00億元']]"
0,20151209_839,健永生技11月營收0.01億元年減68.48% 1— 11月達0.10億元健永生技(6453-TW)2015年 11月營收資料(單位:千元),[]
0,20151209_840,穎漢科技11月營收0.79億元年減25.71% 1— 11月達10.98億元穎漢科技()2015年 11月營收資料(單位:千元),[]
0,20151209_841,"國泰證券立足香港 放眼東南亞及內地市場香港, 2015年12月9日 - (亞太商訊) - 台灣國泰金控旗下子公司國泰綜合證券今日宣布，在香港成立國泰證券（香港）有限公司，利用香港的國際金融中心地位及優越地理位置，將業務擴展至東南亞及內地市場。過去三年國泰綜合證券在香港證券市場的交易量快速增加，從二○一三年交易12.1億，快速增加至二○一四年的43.3億，截至二○一五年十月已達64億。國泰證券（香港）有限公司董事總經理林健治表示，為進一步增加台灣國泰證券在亞洲地區的競爭力，因此有必要在香港設立據點。他表示：「香港是內地金融服務的國際門戶，加上二○一四年底滬港通啟動，進一步強化香港作為內地主要金融中心的地位，因此集團在香港設立據點，可以乘勢把握這龐大機遇。」他補充：「香港位於亞洲心臟地帶，並鄰近內地，有利拓展內地及東南亞的業務。我們初期以集團客戶為基礎，主要為客戶提供有價證券交易及投資建議，未來計劃以香港為據點向內地及東南亞市場擴展業務。」投資推廣署助理署長吳國才表示：「作為台灣大型集團的證券企業之一，很高興看見國泰綜合證券選擇香港作為據點來拓展其東南亞及內地業務。國泰證券(香港)有限公司的開業，不但可以滿足香港及亞洲區內對證券交易服務急速增長的需求，還可鞏固香港作為亞洲區內國際金融中心的地位。」關於國泰證券(香港)有限公司國泰證券(香港)有限公司持有香港證監會發給第一類(證券交易)及第四類(證券提供意見)等兩項牌照，主要為客戶提供的經紀業務及交易商品涵蓋港股現貨、ETF、權證、牛熊證以及台股。除以上市場之證券及債券交易服務外，該公司亦提供不限港股之證券融資業務、債券融資、新股認購、財富管理業務等多元化證券相關業務以及證券期貨自營業務。如欲了解更多關於國泰證券的資料，可瀏覽 www.cathaysec.com.hk/index.aspx。Copyright 2015 ACN Newswire. All rights reserved.","[['亞太商訊', '宣佈', '成立香港有限公司'], ['董事總經理林健治', '表示', '設立據點'], ['香港', '是', '國際門戶'], ['香港', '作爲', '金融中心'], ['香港', '作爲', '金融中心'], ['集團', '設立', '據點'], ['香港', '位於', '心臟地帶'], ['我們', '爲', '基礎'], ['國泰綜合證券', '選擇', '香港'], ['香港有限公司開業', '滿足', '對需求'], ['香港', '作爲', '亞洲區內國際金融中心'], ['香港國泰證券有限公司持有香港證監會', '發給', '兩項牌照'], ['該公司', '提供', '相關業務']]"
0,20151209_842,黃蔭基：台股Q1見低點估7900 油價不會跌到比燒餅便宜永豐金()今(9)日舉行2016投資展望說明會，首席經濟學家黃蔭基表示，台股必須先經歷總統大選的政治面調整，以及美國聯準會開始升息後的資金面調整，第一季指數低點落在7900點，其後景氣逐季轉佳，企業獲利絕對數字高峰落在第三季，預期指數高點將挑戰9500點。至於油價持續崩跌，市場已經傳出恐跌到每桶10美元的聲音，對此，黃蔭基認為，明年油價區間在40至70美元間，不會比燒餅油條便宜。展望2016年，黃蔭基表示，隨著今年美國經濟穩步復甦，就業穩健，失業率降至5.0%，非農就業人口全年平均超過20萬，房市信心增強帶動明年的投資與消費，預估GDP會與今年相同成長2.5%。全世界關心聯準會的動向，從內部美國經濟情勢來看，Fed升息早就OK，但從外部國際經濟情勢來看，則不OK。新興市場成長放緩，金融市場動盪讓今年Fed持續保持耐心，然Fed不升，全球鶴唳風聲，目前市場預期Fed最終會在12/16升息一碼，等於從2014年10月的結束QE，進展到2015年3月的移除patient，再進展到2015年12月的正式升息。黃蔭基說，這將是2006年以來Fed的首次升息，預估2016年的gradual升息策略，將會是每季升息一碼，全年共4碼，升到2016年底的1.375%。黃蔭基進一步表示，全球通縮威脅中，區的壓力最大，因此ECB貨幣政策從再融通零利率0.05%，到存款負利率-0.3%，到QE購債，預定從2015年3月實施到2017年3月，單月規模600億，總規模1.5兆，力脫通縮泥沼。QE奏效讓區的PMI來到4年高，零售銷售成長10年高，出口成長6%，GDP成長從去年的0.9%上升到今年的預估1.6%，2016年將更上層樓到1.8%。歐洲的債務問題存在，需要時間消化，所幸目前PIIGS五國只剩希臘隱伏，因此2016年歐洲債務危機，不論是希臘或西班牙，不會是景氣的黑天鵝。黃蔭基認為，QE的命運永遠不會改變，過去有美國，現在有日本，未來有，所以貨幣政策分歧(Monetary policy divergence)將是2016年最重要的主軸，我們會看到美國升息，中國降準降息，歐洲擴大QE，影響所及，全球景氣持續復甦，股市蝴蝶效應加大震盪加劇，S&P高點預估在2220點，債市美債10年券殖利率上揚，2016年區間預估在1.88%~2.80%間，美債與德債的利差擴大，美元強勢讓2016年會與美元平價，區間預估在1.15~0.99之間。金價持續下探＄999，原物料低檔徘徊，油價大區間則可望維持在＄40~＄70之間。黃蔭基指出，十三五計畫開始，宣示2020年人均較2010年成長一倍，即未來五年GDP成長率底線為6.5%，預估2016年各季都無法達到7字頭，全年為6.7%。股市表現，上証指數在3200點形成底部，2016年預期攻堅4200點，離目前3450點約有22%的空間，陸股ETF可以參與。投資新題材環繞在一帶一路、十三五計畫，其中二胎化、環保、工業2025與綠色能源四項是當紅炸子雞，2016年的投資報酬率絕對可以超越ETF。利率方面，2016年預期人行再降息，存款利率降1碼到1.25%，存準率降10碼到15.0%。納入SDR，將會使全球央行在外匯儲備上提高的配置，但Fed升息、亞幣競貶、經濟下行以及匯率彈性加大將使承壓，2016年預期偏弱，往6.60。黃蔭基表示，明年經濟上雖有紅色競爭、房市修正等利空干擾，然歐美景氣復甦，外需逐漸回溫，外銷訂單可望站穩400億，明年出口正成長，全年GDP預估成長2.45%。台股必須先經歷總統大選的政治面調整，以及美國聯準會開始升息後的資金面調整，第一季指數低點落在7900點，其後景氣逐季轉佳，企業獲利絕對數字高峰落在第三季，預期指數高點將挑戰9500點。利率2016上半年央行還有降息半碼到1.625%的空間，匯率因而先貶後升。,"[['臺股Q1', '見', '估舉行投資展望說明會'], ['首席經濟學家黃蔭基', '表示', '臺股經歷政治面調整'], ['臺股', '經歷', '政治面調整'], ['聯準會', '開始', '升息'], ['聯準會', '開始', '升息'], ['油價', '崩', '跌'], ['市場', '傳出', '跌聲音'], ['黃蔭基', '認爲', '便宜'], ['黃蔭基', '表示', '失業率降至5.0%'], ['失業率', '降至', '5.0%'], ['就業人口', '超過', '20萬'], ['全世界', '關心', '聯準會'], ['全世界', '關心', '聯準會'], ['黃蔭基', '說', '這是首次升息'], ['這', '是', '首次升息'], ['黃蔭基', '表示', '最大'], ['ECB貨幣政策', '到', '購債'], ['讓區PMI', '來到', '高'], ['去年0.9%', '上升到', '今年'], ['PIIGS五國', '剩', '希臘隱伏'], ['歐洲債務危機', '是', '希臘'], ['黃蔭基', '認爲', '貨幣政策分歧Monetary policy是重要主軸'], ['貨幣政策分歧Monetary policy', '是', '重要主軸'], ['我們', '看到', '美國升息'], ['中國', '降準', '降息'], ['2016年區間預估', '在', '~2.80%間'], ['區間預估', '在', '1.15之間'], ['金價', '下探', '＄999'], ['黃蔭基', '指出', '十三五計劃開始'], ['GDP成長率底線', '爲', '6.5%'], ['2016年各季', '達到', '7字頭'], ['全年', '爲', '6.7%'], ['股市', '表現', '上證指數形成底部'], ['上證指數', '形成', '底部'], ['新題材', '環繞在', '一帶'], ['二胎化四項', '是', '當紅炸子雞'], ['2016年投資報酬率', '超越', 'ETF'], ['存款利率', '降', '1碼'], ['存準率', '降', '10碼'], ['存準率', '降到', '15.0%'], ['Fed升息', '將使', '承壓'], ['黃蔭基', '表示', '明年經濟上有利空干擾'], ['明年經濟上', '有', '利空干擾'], ['臺股', '經歷', '政治面調整'], ['聯準會', '開始', '升息'], ['聯準會', '開始', '升息'], ['第一季指數低點', '落在', '7900點'], ['企業', '獲利', '絕對數字'], ['央行', '還有', '到空間'], ['匯率', '貶', '升']]"
0,20151209_843,陸客熱情 台開金門風獅爺商店街11月業績創新高台開集團在金門的BOT案中金門風獅爺商店街11月業績創新高，圖為台開董事長邱復生。(鉅亨網記者張欽發攝)台開()集團在金門的BOT案中金門風獅爺商店街近來喜事連連，受惠於陸客訪金人數陸續成長，風獅爺商店街今年11月單月業績創歷史新高，初步核算較去年同期成長192.73%；金門風獅爺商店街同時榮獲內政部全台灣第一家級「智慧建築標章」商場殊榮。台開指出，由日本建築大師隈研吾設計的「金門風獅爺—光之藝廊」，也計劃於2016年完工啟用。台開引用金門縣觀光處統計資料指出，隨著「離島落地簽」與「離島中轉團不受台灣每日員額限制」等政策實施，陸客訪金人數持續創新高，累計今年1-10月訪金觀光人次已達124萬人次，較去年同期成長近14%，更逼近去年全年的130萬人次，小三通成長是主因。拜陸客訪金人次增加之賜，風獅爺商店街11月單月業績較去年同期大幅成長192%，加上年底是旅遊旺季，訪金人數應可再創新高。台開指出，風獅爺商店街也將持續進行招商，與推介更多好品牌給金門鄉親與觀光客，綺麗珊瑚專櫃店，業績持續穩定成長；蘋果專賣店-STUDIO A，自iPhone 6S系列新品上市以來，64G及128G產品供不應求，果粉迷搶購人潮不斷；星巴克客源穩定，許多觀光客慕名而來人手一杯；同時，86小舖金門門市實體與線上電商業績相當搶眼，主攻O2O，今年大陸光棍節業績逆勢增長。台開表示，日本建築大師隈研吾設計「金門風獅爺—光之藝廊」，也計劃於2016年完工啟用，隈研吾大師擅長自然質感空間設計，總面積約300坪，位在風獅爺北棟三樓，目前露台區有吳炫三大師雕塑作品「父親、母親、小孩」與楊英風大師作品「鳳凰來儀」等展出。,"[['圖', '爲', '臺開董事長邱復生'], ['金門風獅爺商店街', '榮獲', '建築標章商場殊榮'], ['臺開', '指出', '風獅爺光之藝廊計劃完工'], ['風獅爺光之藝廊', '計劃', '完工'], ['臺開', '引用', '觀光處統計資料'], ['訪金觀光人次', '達', '124萬人次'], ['成長', '是', '主因'], ['訪金人數再創新高', '拜', '陸客'], ['加上年底', '是', '旅遊旺季'], ['，', '訪', '金'], ['風獅爺商店街', '進行', '招商'], ['許多觀光客', '慕名而來', '一杯'], ['臺開', '表示', '隈研吾設計獅爺光之藝廊'], ['隈研吾', '設計', '獅爺光之藝廊'], ['隈研吾大師', '擅長', '自然質感空間設計'], ['露臺區', '有', '雕塑作品父親展出']]"
0,20151209_844,"元大期貨台股期指盤後－空方攻勢難阻擋 期指跌破八千三◆盤勢分析受到油價重跌的影響，週二歐美股市普遍下挫，連帶影響週三台股的表現，使得早盤開低震盪，加上盤中公布的中國PPI年率為-5.9%，連續45個月呈現衰退，代表中國景氣尚未回溫，也令跌幅擴大，雖然10:30分後跌勢趨緩，但買盤還是無力拉抬，隨後期指便在8250點附近狹幅整理，終場收在8220點，連續2日下跌超過100點，空頭行情未減弱，舊制選擇權波動率指數由19.11增至19.74，也顯示市場信心逐漸消退。觀察法人籌碼變化，三大法人持續賣超現貨98.7億元，其中外資大舉賣超89.4億元，自營商也賣超1.6億元；由留倉淨部位來看，外資減碼淨多單2,045口至10,132口，自營商逢低偏多操作797口，淨部位由空翻多至661口，整體三大法人淨多單減少1,571口至2,160口，淨多單水位持續遭到削減，不排除有翻空的可能。週三各類期指依然維持空頭走勢，其中仍以金融期為空方摜壓的重心，期指開低下殺後持續探底，不但跌至1000點之下，目前已經接近8/24日全球股災時的水位，另外電子期雖然表現相對有撐，但也來到所有均線之下，技術面明顯轉弱；日K棒連續3日收黑，5日和10日均線都向下穿過月均線形成死亡交叉，近期的盤整區間下緣8300點也遭到跌破，收盤價更是改寫11/16日以來的新低，顯示空方氣燄旺盛。","[['難阻擋', '期指', '八千三盤勢分析受到油價重跌影響'], ['八千三盤勢分析', '受到', '油價重跌影響'], ['連帶', '影響', '週三臺股'], ['，', '加上', '盤中公佈'], ['收', '在', '8220點'], ['舊制選擇權波動率指數', '增至', '19.74'], ['三大法人', '賣', '現貨'], ['由', '留', '倉淨'], ['外資', '減', '碼'], ['淨多單水位', '遭到', '削減'], ['各類期指', '維持', '空頭走勢'], ['爲摜壓重心', '期指', '探底'], ['技術面', '轉', '弱'], ['月均線', '形成', '交叉'], ['下緣8300點', '遭到', '跌破'], ['收盤價', '是', '/16日以來新低']]"
0,20151209_845,生華科癌症新藥 在澳獲突破性發現興櫃新藥股生華科()在澳洲的臨床試驗夥伴PMCC(Peter MacCallum Cancer Center)，在國際知名的Cancer Discovery期刊發表關於CX-5461與其他藥物合併治療惡性血液性腫瘤的突破性發現。生華科表示，CX-5461首次用於人類且為市場首見的全新小分子藥物，目前正在澳洲PMCC執行治療惡性血液性腫瘤的第一期臨床試驗，此項計畫係由澳洲墨爾本大學研究經費贊助，由生華科提供藥品共同開發，至今已有15位受試者接受過此新藥治療，獲相當成果，未來將對澳洲惡性血癌患者如骨髓癌、白血病、淋巴癌有所貢獻。生華科指出，CX-5461治療血癌的作用機制，係抑制細胞核中的第一型RNA聚合酶，藉以活化抑癌基因p53，最後驅動癌細胞死亡，達到抑癌的效果；同時CX-5461可標靶性地抑制核糖體合成，與目前市面上口服標靶藥物mTOR的抑制劑Everolimus(癌伏妥)合併使用，將可更強化CX-5461抑癌效果，達到合併治療的綜效。生華科強調，CX-5461已於今年10月1日獲選為「加拿大SU2C-CBCF抗乳癌夢幻團隊」的用藥，顯見全球重要癌症研究團隊對於CX-5461的高度重視，CX-5461除了可用於治療血癌、乳癌外，有擴大應用至其他癌症治療的實力。,"[['癌症新藥', '發現', '新藥股生華科Peter MacCallum Cancer Center'], ['生華科', '表示', '小分子藥物執行臨牀試驗'], ['CX-5461', '用於', '人類'], ['首次', '用於', '人類'], ['小分子藥物', '執行', '臨牀試驗'], ['小分子藥物執行臨牀試驗', '治療', '血液性腫瘤'], ['15位受試者', '接受', '新藥治療'], ['生華科', '指出', '作用機制'], ['5461', '抑制', '核糖體合成'], ['生華科', '強調', 'CX-5461獲選'], ['加拿大SU2CCBCF', '抗', '夢幻團隊'], ['加拿大SU2CCBCF', '抗', '夢幻團隊'], ['除了', '可用於', '治療血癌'], ['CX-5461', '有', '擴大實力']]"
0,20151209_846,山林水：公告本公司董事會決議召開105年第一次股東臨時會相關事宜第三十四條　第32款1.董事會決議日期:104/12/092.股東臨時會召開日期:105/01/273.股東臨時會召開地點:台北市松江路162號地下二樓4.召集事由:一、討論事項修訂本公司「公司章程」案二、選舉事項本公司補選一席董事案三、其他討論事項解除本公司新任董事競業禁止限制案四、臨時動議5.停止過戶起始日期:104/12/296.停止過戶截止日期:105/01/277.其他應敘明事項:無,"[['股東', '召開', '日期'], ['討論事項', '修訂', '二案'], ['本公司', '補選', '三董事案'], ['其他', '應', '敘明']]"
