,News,All,SVO
0,20151209_814,"台灣高鐵：兆豐國際商業銀行股份有限公司撤回請求本公司給付96年度及97年度甲種特別股股息訴訟案第三十四條　第2款1.法律事件之當事人、法院名稱、處分機關及相關文書案號: 上訴人：兆豐國際商業銀行股份有限公司 被上訴人：台灣高速鐵路股份有限公司 法院名稱：台灣高等法院 訴訟案號：103年度重上字第449號及104年度重上字第758號2.事實發生日:104/12/093.發生原委（含爭訟標的）:(1)兆豐國際商業銀行股份有限公司（下稱兆豐商銀）請求本公司給付96年度甲種   特別股96年1月5日至96年12月31日止之股息共計新臺幣197,808,219元，及自   98年1月1日起至清償日止按週年利率5%計算之利息。案經台灣士林地方法院以   102年度重訴字第391號判決駁回後，兆豐商銀不服，提起上訴，刻正由台灣高等   法院以103年度重上字第449號進行審理中。(2)兆豐商銀請求本公司給付97年度甲種特別股股息共計新臺幣200,000,000元，   及自99年1月1日起至清償日止按週年利率5%計算之利息。案經台灣士林地方法院   以104年度重訴字第62號判決駁回後，兆豐商銀不服，提起上訴，刻正由台灣高等   法院以104年度重上字第758號進行審理中。4.處理過程:兆豐商銀今日已具狀向台灣高等法院撤回上訴及起訴，本公司亦於今日具狀表示同意，有關本公司與兆豐商銀間之前揭訴訟終結。5.對公司財務業務影響及預估影響金額:無。6.因應措施及改善情形:無。7.其他應敘明事項:無。","[['（', '含', '爭訟標的'], ['96年12月31日', '止', '之'], ['兆豐商銀', '撤回', '上訴'], ['本公司', '表示', '同意']]"
0,20151209_815,觀天下11月營收0.43億元年增0.49% 1— 11月達4.72億元觀天下(9985-TW)2015年 11月營收資料(單位:千元),"[['營收', '增', '單位資料']]"
0,20151209_816,永豐銀行11月營收18.99億元年減4.92% 1— 11月達227.90億元永豐銀行(5849-TW)2015年 11月營收資料(單位:千元),"[['永豐銀行', '營收', '18.99億元年減']]"
0,20151209_817,佳得11月營收0.97億元年增94.32% 1— 11月達4.53億元佳得()2015年 11月營收資料(單位:千元),[]
0,20151209_818,"耕興加強布局陸、韓市場 出售設備給韓KCTL並增資陸子公司手機檢測耕興()宣布，日前召開董事會，通過將原本租借給韓國子公司與分公司之檢測設備，以溢價1400萬美元，出售給韓商KCTL(Korea Compliance Testing Laboratories Co., Ltd.)，同時簽訂服務合約並由耕興提供技術服務，另外更星也決定，通過增資中國大陸子公司400萬美元，持股比重從原本的77.4%增加到83.6%，對耕興獲利可望有正面幫助。耕興表示，為因應全球智慧型手機市場成長趨緩，加上韓國市場因客戶集中、產品集中在手機、廠房擴充不易之因素，影響韓國子公司未來營收與獲利，有鑑於此，決定讓韓國子公司轉型為韓國在地化、本土化之公司，並以溢價方式出售給韓國KCTL (Korea Compliance Testing Laboratories Co., Ltd.)。KCTL的母公司Sky Lake Investment的會長陳大濟曾任三星電子digital media代表理事社長，及韓國情報通信部門長官，對韓國電子產業市場與生態了解甚深，是韓國電子業具影響力的人士之一。在增資中國大陸子公司方面，耕興表示，增資大陸子公司是考量近年大陸電子產業的蓬勃發展，加上未來物聯網(IOT)的龐大商機以及美國FCC不再接受中國實驗室的檢測報告等因素，可預期未來中國大陸的業績將大幅成長，故將持續擴充在大陸的產能和營業據點，同時準備在昆山以自有的土地建設成完整的檢測大樓，此大樓除擁有完整的檢測能力和能量外，同時將作為未來在大陸的營運總部，擴大公司在中國大陸市場的布局，創造公司未來的成長動能。耕興強調，由於智慧型手機、網通產品等無線技術進步日新月異，大陸子公司對此新技術的引進和國際大廠的接單、實驗室認證等，均需依靠母公司的支援；加上投資股東反應希望提高母公司對大陸子公司的持股比例要求，故決定增資400萬美元，母公司持有大陸子公司的持股比例，將由77.41%增加到83.6%，提升耕興股東權益。","[['耕興', '加強', '宣佈'], ['出售設備', '給', '韓KCTL'], ['更星', '決定', '有正面幫助'], ['耕興', '表示', '爲'], ['KCTL母公司', 'Sky Lake', '三星電子digital media代表理事社長'], ['在', '增資', '中國大陸子公司'], ['耕興', '表示', '大陸子公司是蓬勃發展'], ['大陸子公司', '是', '蓬勃發展'], ['龐大商機', '接受', '因素'], ['除', '擁有', '檢測能力'], ['此大樓', '擴大', '在佈局'], ['耕興', '強調', '等引進依靠母公司支援'], ['等引進', '依靠', '母公司支援'], ['母公司', '持有', '持股比例']]"
0,20151209_819,客戶需求減少 聯電11月業績減少7.8% 今年單月次低水準聯電()今天公佈11月業績，由於晶圓代工仍處在庫存調節階段，客戶需求減少，當月合併營收僅111.17億元，月減7.8%、年減3.62%，是今年單月業績次低的水準。累計聯電今年前11月合併營收為1341.57億元，年增4.97%。展望後續，由於晶圓代工的景氣旺季不旺，聯電先前已經預告，對本季的營運展望保守，晶圓出貨量將較第3季減少5%以內，產品平均售價將下滑約1%。按此推估，聯電的12月營收可能持續小幅下滑。,"[['晶圓代工', '處在', '庫存調節階段'], ['月', '減', '7.8%'], ['合併營收', '爲', '1341.57億元'], ['年', '增', '4.97%'], ['晶圓出貨量', '減少', '5%以內']]"
0,20151209_820,產業吹寒風面板11月營收冷颼颼 群創寫22月新低面板價格跌勢不止，市調機構預期這波跌勢可能將延續到明年1月、2月，第4季甚至明年第1季面板廠恐將陷入虧損困境；面板廠11月營收結算出爐，群創()11月合併營收255億元，月減13.9%，創下自去年2月來單月營收新低；友達()11月營收月減2.4%，華映(2475-TW)減少9.3%，凌巨()J  減6.48%。群創11月合併營收254.57億元，較10月合併營收295.83減少13.9%，較去年同期384.56億元減少33.8%；出貨量方面，11月大尺寸合併出貨量共計965萬片，較10月減少5.6%；中小尺寸合併出貨量共計2326萬片，較10月增加7.4%；累計前11月合併營收3377.09億元，年減13%。友達11月合併營收284.9億元，較10月291.93億元減少2.4%，較去年同期347.73億元下降18.1%；11月整體大尺寸面板出貨量包括液晶電視、桌上型顯示器及筆記型電腦等約985萬片，較10月增加11.0%，中小尺寸面板出貨量較10月份減少7.1%，約994萬片；累計前11月合併營收3345.88億元，年減10.7%。華映11月合併營收為37.54億元，較10月合併營收41.4億元，減少9.3%，較去年同期合併營收49.23億元，減少23.7%。累計今年1至11月合併營收為440.88億元，較去年同期減少15.1%。華映11月大尺寸TFT出貨片數為10.1萬片，較10月減少22.9%，較去年同期減少46.8%=ㄝ11月中小尺寸出貨量為3342萬片，較10月中小尺寸出貨片數3294萬片，增加1.4%；較去年同期減少20.2%。凌巨11月合併營收8.83億元，較10月9.44億元減少6.48%，較去年同期增加6.83%；累計1至11月合併營收為99.61億元，較去年同期減少20.21%。,"[['11月營', '收', '11月營'], ['市調機構', '預期', '波跌勢延續'], ['波跌勢', '延續到', '明年1月'], ['廠恐', '陷入', '虧損困境'], ['月', '減', '13.9%'], ['收月', '減', '2.4%'], ['2475TW', '減少', '9.3%'], ['凌巨', '減', '6.48%'], ['295.83', '減少', '13.9%'], ['384.56億元', '減少', '33.8%'], ['合併出貨量', '共計', '965萬片'], ['中小尺寸', '合併', '2326萬片'], ['291.93億元', '減少', '2.4%'], ['347.73億元', '下降', '18.1%'], ['大尺寸面板出貨量', '包括', '約'], ['中小尺寸面板出貨量', '減少', '7.1%'], ['合併營收', '爲', '37.54億元'], ['合併營收', '爲', '440.88億元'], ['出貨片數', '爲', '10.1萬片'], ['中小尺寸出貨量', '爲', '3342萬片'], ['11月凌巨', '營收', '8.83億元'], ['合併營收', '爲', '99.61億元']]"
0,20151209_821,仁寶11月筆電、非筆電加持 營收779億元 今年次高代工廠仁寶()今(9)日公布11月營收，達778.9億元，較10月成長6.55%，較去年同期衰退5.5%，創今年次高，筆電出貨330萬台，較10月成長1成，為今年第三高，仁寶表示，筆電出貨略優於預期，但因客戶提前拉貨，因此預期12月出貨約與11月持平，整季出貨維持原來法說預估高個位數衰退，以此來看仁寶第4季出貨約達960萬台，較第3季下滑8.5%。仁寶11月營收持續升溫，筆電出貨達330萬台，月增1成，營收達778.9億元，月增6.55%，但仍較去年衰退5.5%；累計前11月營收達7640.5億元，與去年同期約略持平。仁寶指出，11月筆電出貨略優於預期，因此原本預期12月出貨會持續成長，目前看來估約與11月持平，整季出貨維持原法說預估，估較第3季高個位數衰退，出貨約減少6-9%。以仁寶12月出貨330萬台計算，第4季出貨約960萬台，季減8.5%，符合法說預期。在非筆電產品方面，仁寶表示，11月出貨持續成長，不過高峰約落在11月，預期12月出貨會向下修正，整季出貨估增3成以上。,"[['今年次高代工廠仁寶', '公佈', '11月營收'], ['筆電出貨略', '優於', '預期'], ['客戶', '拉', '貨'], ['出貨', '約達', '960萬臺'], ['筆電出貨', '達', '330萬臺'], ['仁寶', '指出', '成長'], ['筆電出貨略', '優於', '預期'], ['季', '減', '8.5%'], ['仁寶', '表示', '出貨成長'], ['高峯', '落在', '11月'], ['整季出貨', '估增', '3成以上']]"
0,20151209_822,順藥：本公司與英特瑞生醫(股)公司簽訂產品授權暨合作開發合約第三十四條　第8款1.事實發生日:104/12/092.契約或承諾相對人:英特瑞生醫股份有限公司3.與公司關係:無4.契約或承諾起迄日期(或解除日期):104/12/10~121/07/055.主要內容(解除者不適用):順天醫藥生技股份有限公司(以下稱順藥)與英特瑞生醫股份有限公司(以下稱英特瑞)，簽訂LT1001 (長效止痛針劑) 產品授權暨合作開發合約，有效期間至121年7月5日。順藥將依約定條件授予英特瑞LT1001於台灣市場的獨家銷售權及技術使用權，雙方並共同合作開發臨床試驗。合約總金額可達一億元，包括與授權相關之簽約金一千萬元與里程金，以及臨床試驗合作開發金。除此之外，順藥將享有特定百分比之銷售權利金。6.限制條款(解除者不適用):無7.對公司財務、業務之影響(解除者不適用):對公司長短期營運具有正面的影響8.具體目的(解除者不適用):產品授權暨合作開發合約9.其他應敘明事項:1.LT1001相關技術係由科技部與國防醫學院等專屬授權予順藥實施與商業化，就順藥再授權予英特瑞，需支付科技部與國防醫學院等再授權回饋金。2.新藥開發時程長、投入經費高且並未保證一定能成功，此等可能使投資面臨風險，投資人應審慎判斷謹慎投資。,"[['本公司', '簽訂', '事實發生日'], ['以下', '稱', '順藥'], ['有效期間', '至', '121年7月5日'], ['總金額', '可達', '一億元'], ['短期營運', '具有', '正面影響'], ['相關技術系', '授權', '實施'], ['投資人', '判斷', '謹慎投資']]"
0,20151209_823,康科特：公告本公司第三屆第四次董事會重要決議事項第三十四條　第42款1.事實發生日:104/12/092.公司名稱:康科特股份有限公司3.與公司關係(請輸入本公司或聯屬公司):本公司4.相互持股比例(若前項為本公司，請填不適用):不適用5.發生緣由:本公司104年12月9日董事會重要決議事項如下:(1)通過修正本公司「公司章程」案。(2)通過追認前期關係人存續合約案。(3)通過解除經理人競業禁止案。(4)通過財務部門擬訂之「公司提升自行編製財務報告能力計畫書」案。(5)通過本公司105年度稽核計畫案。(6)通過本公司稽核主管任命案。(7)通過本公司105年營運計畫及預算案。6.因應措施:無。7.其他應敘明事項:無。,"[['前項', '爲', '本公司']]"
0,20151209_824,康科特：內部稽核主管異動公告第三十四條　第11款1.人員變動別（請輸入發言人、代理發言人、重要營運主管、財務主管、會計主管、研發主管或內部稽核主管）:內部稽核主管2.發生變動日期:104/12/093.舊任者姓名、級職及簡歷:范鳳殷、內部稽核主管4.新任者姓名、級職及簡歷:羅翎云、內部稽核主管、證券公司內部稽核及上市公司財務副理5.異動情形（請輸入「辭職」、「職務調整」、「資遣」、「退休」、「死亡」或「新任」）:職務調整6.異動原因:職務調整7.生效日期:104/12/098.新任者聯絡電話:02-225450799.其他應敘明事項:無,"[['2主管', '發生', '變動日期']]"
0,20151209_825,精測：公告本公司受邀參加凱基證券舉辦之第四季投資論壇第三十四條　第30款符合條款第XX款：30事實發生日：104/12/101.召開法人說明會之日期：104/12/102.召開法人說明會之時間：15 時 20 分 3.召開法人說明會之地點：晶華酒店(台北市中山北路2段39巷3號)4.法人說明會擇要訊息：本公司受邀參加凱基證券舉辦之第四季投資論壇5.法人說明會簡報內容：內容檔案於當日會後公告於公開資訊觀測站6.公司網站是否有提供法人說明會內容：有，網址： http://www.cht-pt.com.tw/Zh-Tw/7.其他應敘明事項：因場地有限，請向主辦單位報名參加,"[['公告本公司', '受', '邀'], ['公告本公司', '受', '邀'], ['法人', '說明', '會'], ['法人', '說明', '會'], ['法人', '說明', '會'], ['法人', '說明', '會'], ['法人', '說明', '擇要訊息'], ['本公司', '受', '邀'], ['本公司', '受', '邀'], ['法人', '說明', '簡報內容'], ['內容檔案', '公告於', '.公司網站']]"
0,20151209_826,"訊映：本公司董事會通過本公司對廣州睿博電子科技有限公司債權處理案第三十四條　第42款1.事實發生日:104/12/092.公司名稱:訊映光電股份有限公司3.與公司關係(請輸入本公司或聯屬公司):本公司4.相互持股比例(若前項為本公司，請填不適用):不適用5.發生緣由:本公司董事會通過本公司對廣州睿博電子科技有限公司債權處理案如下：(1)債務人名稱：廣州睿博電子科技有限公司(2)債權金額：應收帳款： 871,054.46元預付貨款： 663,664.03元，已於104年11月份轉列「其他應收款」。(3)處理債權緣由：本公司自民國96年起即銷售血糖儀與血糖試片與廣州睿博電子科技有限公司(以下稱廣州睿博)，廣州睿博一直為本公司拓展大陸市場之重要夥伴，且自民國100年起成為本公司血糖儀之電路板之設計與製造協力廠商；惟廣州睿博近年財務狀況不佳，對本公司之應收帳款時有拖延。6.因應措施:(1)本公司自民國104年3月起即以「現金交易」，以滿足大陸地區終端使用者(病人)之需求。(2)經多次催收，廣州睿博僅小金額還款，故本公司委任律師於104年12月1日向新竹地方法院聲請「民事調解」，且將於105年2月4日於新竹地方法院民事庭進行調解。(3)104年12月9日本公司董事會授權董事長與債務人廣州睿博進行「民事調解」，且將於往後董事會中報告本案進度，至本案結案為止。7.其他應敘明事項:無","[['本公司董事會', '通過', '發生日'], ['前項', '爲', '本公司'], ['664.03元', '轉列', '其他應收款'], ['本公司', '銷售', '血糖儀'], ['廣州睿博', '拓展', '重要夥伴'], ['本公司', '應收', '帳款'], ['之', '應收', '帳款'], ['本公司民國', '交易以', '滿足終端使用者病人需求'], ['本公司委任律師', '聲請', '民事調解'], ['授權董事長', '進行', '民事調解']]"
0,20151209_827,"彥陽科技：代子公司Promaster (Brunei) Technology Corp.公告資金貸與達處理準則第二十二條第一項第三款規定標準第三十四條　第20款1.事實發生日:104/12/092.接受資金貸與之:(1)公司名稱:晏陽科技國際貿易(上海)有限公司(2)與資金貸與他人公司之關係:100%持有之子公司(3)資金貸與之限額(仟元):130000(4)原資金貸與之餘額(仟元):116098(5)本次新增資金貸與之金額(仟元):10538(6)是否為董事會授權董事長對同一貸與對象分次撥貸或循環動用之資金貸與:否(7)迄事實發生日止資金貸與餘額(仟元):126636(8)本次新增資金貸與之原因:依財團法人中華民國會計研究發展基金會93.7.9基秘字第167號函規定，將帳齡滿半年以上之應收帳款轉列資金貸與。3.接受資金貸與公司所提供擔保品之:(1)內容:無(2)價值(仟元):04.接受資金貸與公司最近期財務報表之:(1)資本(仟元):83678(2)累積盈虧金額(仟元):-1836275.計息方式:0%6.還款之:(1)條件:償還應收帳款(2)日期:償還應收帳款之日7.迄事實發生日為止，資金貸與餘額(仟元):1266368.迄事實發生日為止，資金貸與餘額占公開發行公司最近期財務報表淨值之比率:33.309.公司貸與他人資金之來源:子公司本身10.其他應敘明事項:本公司之子公司為100%持有之子公司，故不受融資金額不得超過本公司之子公司淨值之40%，另本公司之子公司董事會於104.8.13訂定貸與上海晏陽限額為130,000仟元。","[['代子公司', 'Promaster', 'Brunei'], ['董事會', '授權', '對資金貸與'], ['第167號函', '規定', '轉列資金貸'], ['公司', '提供', '擔保品'], ['所', '提供', '擔保品'], ['日期', '償還', '2帳款'], [')', '償還', '應收帳款'], ['資金貸', '佔', '發行'], ['本公司子公司', '爲', '持有子公司'], ['不受融資金額', '超過', '子公司淨值40%'], ['訂定貸', '爲', '130000仟元']]"
0,20151209_828,"彥陽科技：代子公司Promaster (Brunei) Technology Corp.公告資金貸與達處理準則第二十二條第一項第二款規定標準第三十四條　第20款1.事實發生日:104/12/092.接受資金貸與之:(1)公司名稱:晏陽科技國際貿易(上海)有限公司(2)與資金貸與他人公司之關係:100%持有之子公司(3)資金貸與之限額(仟元):130000(4)原資金貸與之餘額(仟元):116098(5)本次新增資金貸與之金額(仟元):10538(6)是否為董事會授權董事長對同一貸與對象分次撥貸或循環動用之資金貸與:否(7)迄事實發生日止資金貸與餘額(仟元):126636(8)本次新增資金貸與之原因:依財團法人中華民國會計研究發展基金會93.7.9基秘字第167號函規定，將帳齡滿半年以上之應收帳款轉列資金貸與。3.接受資金貸與公司所提供擔保品之:(1)內容:無(2)價值(仟元):04.接受資金貸與公司最近期財務報表之:(1)資本(仟元):83678(2)累積盈虧金額(仟元):-1836275.計息方式:0%6.還款之:(1)條件:償還應收帳款(2)日期:償還應收帳款之日7.迄事實發生日為止，資金貸與餘額(仟元):1266368.迄事實發生日為止，資金貸與餘額占公開發行公司最近期財務報表淨值之比率:33.309.公司貸與他人資金之來源:子公司本身10.其他應敘明事項:本公司之子公司為100%持有之子公司，故不受融資金額不得超過本公司之子公司淨值之40%，另本公司之子公司董事會於104.8.13訂定貸與上海晏陽限額為130,000仟元。","[['代子公司', 'Promaster', 'Brunei'], ['董事會', '授權', '對資金貸與'], ['第167號函', '規定', '轉列資金貸'], ['公司', '提供', '擔保品'], ['所', '提供', '擔保品'], ['日期', '償還', '2帳款'], [')', '償還', '應收帳款'], ['資金貸', '佔', '發行'], ['本公司子公司', '爲', '持有子公司'], ['不受融資金額', '超過', '子公司淨值40%'], ['訂定貸', '爲', '130000仟元']]"
0,20151209_829,"彥陽科技：代子公司Promaster (Brunei) Technology Corp.公告資金貸與達處理準則第二十二條第一項第一款規定標準第三十四條　第20款1.事實發生日:104/12/092.公開發行公司及其子公司資金貸與他人之餘額達該公開發行公司最近期財務報表淨值百分之二十以上者:(1)接受資金貸與之公司名稱:晏陽科技國際貿易(上海)有限公司(2)與資金貸與他人公司之關係:100%持有之子公司(3)資金貸與之限額(仟元):130000(4)迄事實發生日為止資金貸與餘額(仟元):126636(5)迄事實發生日為止資金貸與原因:依財團法人中華民國會計研究發展基金會93.7.9基秘字第167號函規定，將帳齡滿半年以上之應收帳款轉列資金貸與。3.迄事實發生日為止，資金貸與餘額(仟元):1266364.迄事實發生日為止，資金貸與餘額占公開發行公司最近期財務報表淨值之比率:33.305.公司貸與他人資金之來源:子公司本身6.其他應敘明事項:本公司之子公司為100%持有之子公司，故不受融資金額不得超過本公司之子公司淨值之40%，另本公司之子公司董事會於104.8.13訂定貸與上海晏陽限額為130,000仟元。","[['代子公司', 'Promaster', 'Brunei'], [')', '接受', '與'], ['迄事實發生日', '爲止', '仟元貸'], ['迄事實發生日', '爲止', '資金貸'], ['第167號函', '規定', '轉列資金貸'], ['資金貸', '佔', '發行'], ['本公司子公司', '爲', '持有子公司'], ['不受融資金額', '超過', '子公司淨值40%'], ['訂定貸', '爲', '130000仟元']]"
0,20151209_830,天蔥：公告本公司董事會決議解除經理人競業禁止第三十四條　第22款1.董事會決議日期:104/12/092.許可從事競業行為之經理人姓名及職稱:張國強規則長3.許可從事競業行為之項目:澳洲TIAN-TON GROUP INTERNATIONAL BUSINESS PRESIDENT、六角國際事業股份有限公司顧問。4.許可從事競業行為之期間:任職本公司經理人職務期間。5.決議情形（請依公司法第32條說明表決結果）:經主席徵詢全體出席董事無異議照案通過。6.所許可之競業行為如屬大陸地區事業之營業者，經理人姓名及職稱（非屬大陸地區事業之營業者，以下欄位請輸不適用）:不適用7.所擔任該大陸地區事業之公司名稱及職務:不適用8.所擔任該大陸地區事業地址:不適用9.所擔任該大陸地區事業營業項目:不適用10.對本公司財務業務之影響程度:無11.經理人如有對該大陸地區事業從事投資者，其投資金額及持股比例:無12.其他應敘明事項:無,"[['規則', '長', '從事競業行爲'], ['許可', '從事', '競業行爲'], ['董事', '無', '異議'], ['董事', '無', '異議'], ['競業行爲', '屬', '大陸地區事業營業者'], ['以下欄位', '請', '輸不適用'], ['經理人', '如有', '從事投資金額'], ['敘明事項', '無', '12']]"
0,20151209_831,"天蔥：公告本公司股票初次上櫃前現金增資發行新股相關事宜第三十四條　第42款1.事實發生日:104/12/092.公司名稱:天蔥國際股份有限公司3.與公司關係(請輸入本公司或聯屬公司):本公司4.相互持股比例(若前項為本公司，請填不適用):不適用5.發生緣由:公告本公司股票初次上櫃前現金增資發行新股相關事宜6.因應措施:無7.其他應敘明事項:一、本公司為配合初次上櫃前公開承銷辦理現金增資14,460,000元，發行普通股1,446,000股，每股面額10元，業經財團法人中華民國證券櫃檯買賣中心104年11月20日證櫃審字第1040032141號函申報生效在案。二、本次發行之新股依法規定保留發行總股數之15%，即216,000股由本公司員工認購，其餘1,230,000股全數供辦理上櫃承銷之用，保留予員工認購之普通股股份，如有員工放棄認購或認購不足之部分，授權董事長洽特定人認購之。三、本次現金增資採溢價方式辦理，實際發行價格俟辦理公開承銷當時之股票市場狀況及向投資人詢價圈購結果後，由本公司與主辦承銷商議定。四、本次現金增資發行新股之認股期間：1.詢價圈購期間：104年12月11日至104年12月16日2.公開申購期間：104年12月14日至104年12月16日3.員工認股繳款期間：104年12月18日至104年12月21日4.公開申購扣款日期：104年12月17日5.詢價圈購繳款日期：104年12月18日6.特定人認股繳款日期：104年12月22日7.現金增資基準日期：104年12月23日五、本次增資發行之新股，其權利義務與已發行之原有股份相同。","[['前項', '爲', '本公司'], ['敘明事項', '無', '7'], ['本公司', '承銷', '460增資'], ['104年11月20日證櫃', '審', '字'], ['本次發行新股', '規定', '保留髮行總股數15%'], ['員工', '放棄', '認購部分'], ['發行價格', '辦理', '股票市場狀況'], ['增資', '發行', '新股之認股'], ['員工', '認', '股'], ['員工', '認', '股'], ['公開', '申購', '扣款'], ['詢價圈', '購', '繳款'], ['特定人', '認', '股'], ['特定人', '認', '股']]"
