,News,All,SVO
0,20151029_2600,鉅亨早報2015年10月29日■笑傲全球！張忠謀：半導體零成長 但台積電還有10%成長率■墨西哥調高鋼品進口關稅 台灣製冷軋、熱軋鋼、合金鋼中箭■台北101有條件讓黑石實地查核 財政部：尊重董事會決議■觀光撐內需！外籍觀光客來台人數 今年可望破千萬大關■油價跌勢難止？經濟學家：原油供給過剩將持續到2017年■Uber估值可望衝上700億美元 但真這麼值錢嗎？■警訊！調查：美國未來一年衰退機率創兩年新高■油國陸續撐不住！俄羅斯憂明年儲備基金將耗光■新北、花蓮青年宅實際租售價不到7折 甭驚拉低區域行情■富豪多！調查：上海列亞洲奢華生活最貴城市 台北居第六(接下頁)[NT:PAGE=$]■美國國防部長卡特昨日在國會表示，最近幾天美軍已在南海區域執行任務，未來幾周和幾個月都會持續運作。事件亦可能令美國太平洋艦隊司令哈里斯（Harry B. Harris）下周一（11月2日）的訪華行程蒙上陰影。中國駐美大使崔天凱昨日在CNN受訪時，被質疑中國是用很久以前的老舊地圖來主張權利，他反駁說：「很久以前還沒有美國呢」。大陸專家說，現在中美關係已進入十字路口，以「炮艦外交」來解決歧見，必增加擦槍走火的概率。■美國國防部和軍方周二舉行記者會，公布防衞軍備生產商諾斯羅普格魯曼（Northrop Grumman）擊敗兩大對手波音和洛歇馬丁，奪得建造美國一百架新一代B-3長程隱形轟炸機的合約，總值超過八百億美元。這是美國國防部在十年多來批出的最巨額建造軍備合約。軍備分析家指出美國建造超級轟炸機，顯然是要針對兩大勁敵中國和俄羅斯。■美國將大幅調整對抗「伊斯蘭國」（ISIS）策略。國防部長卡特周二（27日）出席參議院聽證時表明會加強打擊ISIS，包括增加空襲及支援反對派、針對油田以打擊ISIS財源等。美國傳媒報道，總統奧巴馬正考慮軍方提出的一系列建議，包括加派地面部隊、派出阿帕奇直升機和加強空襲等，最快本周正式批准。這意味美國在伊、敘的角色將大幅提升。■美國計劃加強打擊「伊斯蘭國」(ISIL)之際，各國亦盡力在外交上斡旋，希望為持續逾4年的敘利亞內戰畫上句號。美國、俄羅斯、歐洲和阿拉伯國家外交代表今日起在奧地利召開解決敘利亞危機多邊會談，美國更首次邀請敘國盟友伊朗參與，反映西方國家對伊朗的立場有所轉變。伊朗外交部昨日證實，外長扎里夫將出席會談。■十八屆五中全會今在京閉幕，預料稍後會公布會議重點討論的第十三個五年規劃建議，而近日一段《十三五之歌》短片也在網上走紅，新華社譽為「洗腦神曲」，通過4個歐美年輕人的英文說唱，詮釋「十三五」的「前世今生」。《紐約時報》也說「現在，一段新影片把世界上最大的宣傳機器，帶進了新時代」。■德國總理默克爾今日抵達中國展開兩日的訪問，這是她第8次訪華，她也是中共五中全會閉幕後首名訪華的外國領袖。國務院總理李克強今日與她會談，雙方會談及經濟、環保等議題。有專家認為，中國經濟放緩，默克爾此行正處在一個比以往都更困難的時期。■李克強周六（31日）就要出訪韓國，並出席在首爾舉行的第6次中日韓首腦會議。這是中日韓峰會中斷3年後首次召開，自貿區談判將是重頭戲。■法國政府昨日宣布，包括中國、美國與印度這3個溫室氣體最大排放國的政府首腦在內的最少80名各國領袖，將出席月底在巴黎登場的聯合國氣候峰會。法國希望在這個峰會上促成國際社會達成對抗氣候變化的單一協議，目標是把全球溫度升幅控制在不超出工業革命前2℃水平。■尼泊爾國會昨日選出該國史上首名女性總統，前國防部長班達里(Bidhya Bhandari)以327對214票擊敗對手，成為國家名義上元首。54歲的班達里在年輕時便從政，致力尋求推翻君主專制，現為尼泊爾共產黨（聯合馬列）副主席，該黨主席奧利本月較早前當選總理，掌握實權。■阿富汗本周發生的規模七點五級大地震，已知有超過三百八十人喪生，而救難人員發出警告稱，在阿富汗及另一災區巴基斯坦，有些無家可歸的災民恐因露宿戶外而喪命。■印尼霾害危機最嚴重地區的民眾受夠政府三個月來撲火動作慢，自行赴火場前綫對抗霧霾，運用手中僅有的資源迎擊吞噬家園的山火，表示「現在這是全民的戰爭了。」印尼五個省份的四千萬人正深受霾害之苦，包括首都耶加達在內，四分之三國土已被濃度不同的煙霾籠罩。■英國有智庫預測，氣候變化引發的氣溫與濕度上升，可能導致不安全的「熱壓力」日子增加，東南亞地區的生產力有可能因此減少16%。■猴子在人類登陸月球的征途中立下汗馬功勞，俄羅斯科學家原來也有意再次借牠們的力量，協助探索火星。俄羅斯科學院正訓練4支獼猴操作搖桿和解答簡單數學謎題，目標於2017年讓牠們飛往火星，但不保證能讓牠們回來。■美國聯儲局公開市場委員會(FOMC)結束一連兩日的議息會議，於香港時間今晨2時公佈議息結果，一如外界預料維持利率不變。今次議息聲明與上月的大致相似，當中再一次提到局方關注環球經濟形勢，並認為出口和通脹疲弱。不過市場最關注聲明其中一段有關加息的句子，《華爾街日報》認為，這是聯儲局至今有關下次會議可能加息的最明確一次暗示。■美國聯儲局前主席伯南克前日指，現時環球經濟的最大風險是新興市場債務累積。他認為世界並未從1990年代亞洲金融危機汲取教訓，當時亞洲地區銀行向外資借入美元，再向本地企業提供本幣貸款，所謂「貨幣錯配」是導致金融風暴的原因之一。■國際葡萄及葡萄酒組織(OIV)昨日公佈最新全球葡萄酒生產數據，意大利以48.9億公升產量，擊敗47.4億公升的法國，重奪失落一年的最大葡萄酒生產國寶座，第三位則是36.6億公升的西班牙。OIV指今年全球葡萄酒產量達275.7億公升，按年增加2%，但仍在等待中國和俄羅斯的數據完成確認。■西班牙分裂危機進一步加深！新一屆加泰羅尼亞議會計劃下月初通過議案，啟動脫離西班牙獨立的程序，實質等同單方面宣佈獨立，議長福卡德利更呼籲民眾發起公民抗命，對抗中央政府。西班牙執政人民黨及主要反對派社會黨分別發聲明譴責，首相拉霍伊揚言「不惜動用一切政治和法律途徑」阻止加泰羅尼亞獨立。■國台辦昨日舉行新聞發佈會，發言人安峰山回應台灣「國防報告書」所提出的解放軍換裝多項主戰裝備，規劃2020年前完備攻台戰力的說法，稱炒作所謂大陸對台軍事威脅既不符合事實，也有違兩岸的政治互信，更加不符合兩岸同胞關於兩岸關係和平發展的願望。安峰山還表示，兩岸事務主管負責人溝通機制基於「九二共識」，只要認同這一點，台灣任何政黨和團體同大陸打交道都不存在障礙。■為收購喜達屋酒店集團（Starwood Hotels & Resorts），至少有3家中國企業在力爭獲得中國政府的批准。預計競購方的出資規模高達120億美元（約930億港元）以上，如果一切順利，這將是有史以來中資對美國公司規模最大的一次收購行動。■ 「十三五」規劃呼之欲出，轉型升級、中國「智造」、網際網路融合等成為券商薦股的新寵。彭博篩選出約170支至少有10位分析師評級的A股，所有評級為「買入」的滿分個股只有16支。其中，美的獲得最多20位分析師的一致意見，包括摩根大通本月作出的「增持」初始評級。■有「商品大王」之稱的投資大師羅傑斯近日表示，看好中國經濟的觀點不改變，下一步對中國投資的領域將集中在「一帶一路」、健康醫療、環保和金融等。但是他同時提醒，中國股市科技股板塊估價較高，存在潛在泡沫。■大陸經濟放緩，亦有持續貶值的跡象，連帶影響香港經濟亦出現下行風險，瑞士寶盛私人銀行預料大陸經濟增長明年及後年只能「保6」，至2020年進一步放緩至5.3%。而香港經濟增長明年亦將放緩至2%，至2020年回升至3.3%。■瑞士寶盛私人銀行昨發表第五份亞洲財富報告，預計至2020年，香港富豪身家將達1兆美元(約7.8兆港元)，較今年增加42%；大陸富豪的財富更達8.25兆美元，較今年增逾七成，並佔亞洲富豪財富比重超過一半。該行又指，受惠於與大陸的強大貿易和經濟聯繫，港股的表現會好過新加坡，惟香港樓價昂貴，令生活成本在亞洲第二貴。■世銀昨日發表《2016年營商環境報告》，新加坡連續第10年蟬聯全球營商最便利經濟體，香港則由去年第3位下跌2級至第5位，不過得分較去年上升，有83.67分；而且今年世銀採用了新評估方法，若去年採用同一套評估方法的話，香港去年亦是排第5位。至於中國由去年的90名升至第84名；台灣由去年的19位升至11位。■阿里巴巴關連公司螞蟻金服公布，支付寶將在今年12月正式登陸台灣，並且推出台灣跨境O2O服務，讓大陸遊客到台灣旅遊時，在便利店及超市都可直接以手機進行付帳，免除匯兌之苦。 ■作案長達六十年的著名珠寶女賊佩恩（Doris Payne），上周五在美國亞特蘭大一家百貨公司偷竊耳環後被揭穿就逮。由於她在夏洛特市涉及另一宗珠寶盜竊案遭通緝，據報她可能被移送到當地受審。《重要指標》◇ 美洲■■◇ 歐洲■意大利10月消費者信心指數續升至116.9■法國10月消費者綜合信心意外微降至96■德國11月GfK消費信心續降至9.4 符預期■德國9月出口物價指數年率上升0.3%，前值上升0.8%◇亞洲■日本10月中小企信心指數回落至48.7■《金融市場》◇美股■■■■◇歐股■■■◇亞股■台灣28日收盤跌35.33點或0.41%，報8665.99點，成交金額800.01億元。■台股28日三大法人集中市場賣超5.81億，外資賣超11.66億，投信買超3.34億，自營商自行買賣賣超0.23億，自營商避險買超2.74億。■日經225指數28日收盤上漲125.98點或 0.67%，收盤報 18903.02點。盤中高見18925.51點，低至18815.12點，開盤報18826.94點。■韓國Kospi指數28日收盤下跌2.14點或 0.1%，收盤報 2042.51點。盤中高見2045.67點，低至2032.39點，開盤報2045.67點。■澳洲S&P/ASX 200指數28日收盤下跌10.93點或 0.2%，收盤報 5335.22點。盤中高見5354.90點，低至5319.40點，開盤報5346.20點。■截止收盤，報3375.20點，跌59.14點，跌幅1.72%。■收報22956.57點下跌186.16點或0.8%。◇■◇原油■■◇穀物■■■◇匯市■兌美元匯價收盤貶1分，達32.686元，成交金額7.07億美元。開盤價為32.710元，盤中最高32.400元、最低32.710元。■■■■■■■■,"[['臺積電', '還有', '墨西哥調有條件成長率'], ['墨西哥', '調', '有條件'], ['墨西哥', '調', '有條件'], ['觀光', '撐', '內需'], ['可', '望破', '千萬大關'], ['衰退機率', '創', '兩年新高'], ['儲備基金', '不到', '7折'], ['臺北', '居', '第六'], ['臺北', '居', '第六'], ['美國國防部長卡特', '表示', '美軍執行任務'], ['美軍', '執行', '任務'], ['中國', '駐', '美'], ['CNN', '受', '訪'], ['駐美大使崔天凱', '質疑', '中國是主張權利'], ['中國', '是', '主張權利'], ['大陸專家', '說', '增加擦槍走火概率'], ['中美關係', '進入', '十字路口'], ['美國國防部', '舉行', '記者會'], ['Northrop Grumman諾斯羅普格魯曼', '擊敗', '對手波音'], ['總值', '超過', '八百億美元'], ['這', '是', '軍備合約'], ['分析家', '指出', '超級轟炸機'], ['美國', '調整', '對抗ISIS策略'], ['）', '出席', '參議院聽證'], ['表明', '加強', '打擊ISIS'], ['美國傳媒', '報道', '總統奧巴馬正考慮一系列建議'], ['總統奧巴馬', '正考慮', '一系列建議'], ['這', '意味', '在伊角色提升'], ['美國計劃加強', '打擊', 'ISIL伊斯蘭國'], ['各國', '盡力在', '上斡旋'], ['持續', '逾', '4年'], ['外交代表', '起在', '奧地利'], ['伊朗外交部', '證實', '外長扎裏夫出席會談'], ['外長扎裏夫', '出席', '會談'], ['會', '公佈', '會議討論'], ['新華社', '譽爲', '洗腦神曲'], ['紐約時報', '說', '新影片帶'], ['德國總理默克爾', '抵達', '中國展開兩日訪問'], ['這', '是', '第8次訪華'], ['她', '也是', '外國領袖'], ['雙方', '會談', '等經濟議題'], ['專家', '認爲', '中國經濟放緩'], ['默克爾', '處在', '困難時期'], ['週六李克強', '出訪', '韓國'], ['這', '是', '召開'], ['自貿區談判', '是', '重頭戲'], ['法國政府', '宣佈', '各國領袖出席氣候峯會'], ['各國領袖', '出席', '氣候峯會'], ['法國', '希望', '單一協議'], ['國際社會', '促成', '達成對抗氣候變化'], ['目標', '是', '控制'], ['尼泊爾國會', '選出', '女性總統'], ['前國防部長班達裏Bidhya Bhandari', '擊敗', '對手'], ['國家名義', '上', '元首'], ['該黨主席奧利本月', '當選', '總理'], ['五級大地震', '已知', '有超過三百八十人喪生'], ['救難人員', '發出', '警告'], ['霾', '害', '嚴重地區'], ['害嚴重地區民衆', '受夠', '政府'], ['這', '是', '全民戰爭'], ['五個省份四千萬人', '深受', '霾害苦'], ['英國', '有', '預測'], ['智庫', '預測', '氣候變化引發氣溫上升導致熱壓力日子增加'], ['氣候變化引發氣溫上升', '導致', '熱壓力日子增加'], ['東南亞地區生產力', '減少', '16%'], ['人類', '登陸', '月球'], ['猴子', '中立', '汗馬功勞'], ['俄羅斯科學家', '借', '牠們力量'], ['4支獼猴', '操作', '搖桿'], ['4支獼猴', '操作', '搖桿'], ['美國聯儲局公開市場委員會FOMC', '結束', '議息會議'], ['外界預料', '維持', '利率不變'], ['市場', '關注', '聲明'], ['其中一段', '有關', '加息'], ['華爾街日報', '認爲', '這是一次暗示'], ['這', '是', '一次暗示'], ['至今', '有關', '下次會議加息'], ['最大風險', '是', '新興市場債務累積'], ['他', '認爲', '世界汲取教訓'], ['世界', '汲取', '教訓'], ['亞洲地區銀行', '借入', '美元'], ['所謂貨幣錯配', '是', '導致金融風暴原因之一'], ['葡萄組織OIV', '公佈', '全球葡萄酒生產數據'], ['意大利', '擊敗', '47.4億公升法國'], ['第三位', '是', '36.6億公升西班牙'], ['OIV', '指', '葡萄酒產量達275.7億公升'], ['葡萄酒產量', '達', '275.7億公升'], ['加泰羅尼亞議會', '計劃', '通過'], ['議長福卡德利', '呼籲', '民衆發起公民抗命'], ['民衆', '發起', '公民抗命'], ['西班牙執政人民黨', '譴責', '發聲明'], ['國臺辦', '舉行', '新聞發佈會'], ['發言人安峯山', '回應', '主戰裝備'], ['完備說法', '稱', '炒作對威脅不符合事實'], ['炒作對威脅', '不符合', '事實'], ['安峯山', '表示', '溝通機制基於九二共識'], ['溝通機制', '基於', '九二共識'], ['任何政黨打交道', '不存在', '障礙'], ['3家中國企業', '力爭', '獲得中國政府批准'], ['出資規模', '高達', '930億港元120億美元以上'], ['這', '是', '收購行動'], ['彭博', '篩選出', '約170支A股'], ['所有評級', '爲', '買入'], ['所有評級', '爲', '買入'], ['滿分個股', '只有', '16支'], ['美的', '獲得', '一致意見'], ['美的獲得一致意見', '包括', '初始評級'], ['■', '有', '商品大王稱'], ['近日', '表示', '看好中國經濟觀點改變'], ['投資領域', '集中在', '等醫療'], ['他', '提醒', '較高'], ['大陸經濟放緩', '有', '貶值跡象'], ['預料大陸經濟增長', '保', '6'], ['香港經濟增長', '放緩至', '2%'], ['香港富豪身家', '達', '7.8兆港元'], ['大陸富豪財富', '更達', '8.25兆美元'], ['增', '逾', '七成'], ['逾七成比重', '超過', '一半'], ['該行', '指', '受惠'], ['港股表現', '好過', '新加坡'], ['世銀', '發表', '2016年營商環境報告'], ['新加坡', '蟬聯', '經濟體'], ['今年世銀', '採用', '評估方法'], ['香港', '排', '第5位'], ['阿里巴巴關連公司螞蟻金服', '公佈', '支付寶登陸臺灣'], ['支付寶', '登陸', '臺灣'], ['臺灣', '跨境', 'O2O服務'], ['臺灣', '跨境', 'O2O服務'], ['作案', '長達', '六十年'], ['她', '涉及', '珠寶盜竊案遭通緝'], ['珠寶盜竊案', '遭', '通緝'], ['微', '降至', 'GfK96'], ['指數年率', '上升', '0.3%'], ['盤中高', '見', '18925.51點'], ['韓國Kospi指數', '下跌', '2.14點'], ['盤中高', '見', '2045.67點報'], ['盤中高', '見', '5354.90點'], ['兌美元匯價收盤', '貶', '1分'], ['開盤價', '爲', '32.710元']]"
0,20151029_2601,日盛投顧盤前分析◆盤勢分析1.周三晚間FED利率會議會後聲明指出，近幾個月，家庭支出與企業固定投資以穩固比例增加，房屋市場已進一步改善，然而，淨出口一直疲弱。就業成長速度減緩，失業率則維持穩定，通貨膨脹持續低於委員會的長期目標，為支持持續邁向最大就業與物價穩定，委員會重申目前0至0.25%的聯邦基金利率目標範圍仍屬適當的觀點。在決定於下次會議中，調高目標範圍是否適當，在聲明過後美股一度下殺，但尾盤仍以大漲作收，終場美國四大指數分別上揚1.13%~1.73%，四大指數全數突破年線，顯見市場對於寬鬆政策的利多反應仍強於對升息的擔憂，在美股再度大漲之下，對於亞洲股市仍為正面。2.週三台股在美股回檔壓力下，加上蘋概股利多不漲以及聯發科再度轉弱，引發市場短線賣壓，終場指數下跌35.33點，以8665.99點作收，成交量為802.45億元。3.短線台股在指數過高，但KD指標並未同步過高之下，加上進入壓力區但成交量無法放大，出現短多獲利回吐賣壓，從技術面看，五日均線與十日均線即將死亡交叉，對短多造成壓力，不過低檔月線持續走升，且季線即將翻揚之下，中線有逐漸轉強機會，後續觀察本月29日凌晨，FOMC利率會議結論，將對美國升息時間點的預期，為短線轉強或持續修正的關鍵，強勢月線8530點不破，弱勢低檔頸線8488點不破，原則上都可視為漲多回檔。4.三大法人賣超5.81億元，外資賣超11.66億元，投信買超3.34元，自營商買超2.51億元。5.電子類股仍為當前主流，車用電子3552同致轉強，6279胡連、3665F-貿聯高姿態整理，2355敬鵬回測季線轉強，仍為多方觀察重點，第三方支付在3687歐買尬成為警示股下進入休息，週三再度轉強，LED在跌深後2499東貝營收加溫、3698隆達受惠於香港燈飾展買盤進場，光電4935F-茂林第三季營收創新高，加上新廠年底完工，股價創波段新高，4960奇美材中國客戶比重拉高，帶動業績，網通在進入旺季之下，2485兆赫法人買盤推升股價，6285啟碁受惠於車聯網應用，3558神準利基型企業用戶市場發酵，股價轉強，而蘋果公佈財報優於預期，但相關指標股2474可成、2354鴻準、4938和碩等皆未有表現，後續仍觀察蘋果股價表現，2454聯發科將在30日法說，市場悲觀預期導致股價拉回。6.傳產近期油價再度回落，台塑四寶進入震盪，紡織短線漲多進入整理，中多尚未破壞，指標股1476儒鴻、4426利勤等，生技股在民進黨總統參選人提出政策利多之下，週三再度轉強，高價股4174浩鼎守穩10日均線，4130健亞、4129聯合、4107邦特等業績股走高。7.金融股近期持續整理，包括2881富邦金、2882國泰金、2884玉山金等外資買盤並未鬆動，未來仍有表現機會，惟需留意當金融股轉強，是否出現拉金融出電子的可能性。8.主計處預計30日公佈第三季GDP，各界都預估負成長，行政院可能將推動刺激經濟方案，金額不小於50億元，其中將以節能家電、電信補助、鼓勵國內旅遊、電子商務網購等為重點，預期將帶動內需股轉強，包括觀光5706鳳凰、2707晶華等、百貨2903遠百、賣場通路2430燦坤、電信三雄與電子商務古3687歐買尬、6180橘子等。9.蘋果財報優於預期，但週三蘋概股仍然走弱，但若以季報來看，包括2474可成、2354鴻準、6269台郡、4938和碩；2317鴻海等表現將亮眼，市場仍預期第四季在拉貨動能轉強之下，鴻海第四季營收獲利仍可期待，而週三晚間蘋果股價大漲4.12%，創波段新高，今日觀察近期持續疲弱的蘋概股仍否轉強。,"[['通貨膨脹', '低於', '長期目標'], ['利率目標範圍', '屬', '適當觀點'], ['美國四大指數', '上揚', '~1.73%'], ['利多反應', '強於', '對擔憂'], ['市場短線', '賣', '壓'], ['成交量', '爲', '802.45億元'], ['中線', '有', '轉強機會'], ['逐漸', '轉', '強'], ['對預期', '爲', '短線轉關鍵'], ['自營商買', '超', '2.51億元'], ['電子類股', '爲', '當前主流'], ['東貝營收加溫', '受惠於', '香港燈飾展'], ['在', '進入', '旺季'], ['啓碁', '受惠於', '車聯網應用'], ['蘋果公佈財報', '優於', '預期'], ['市場悲觀預期', '導致', '股價拉回'], ['臺塑四寶', '進入', '震盪'], ['參選人', '提出', '利多'], ['參選人', '提出', '利多'], ['週三', '轉', '強'], ['各界', '預估', '負成長'], ['行政院', '推動', '刺激經濟方案'], ['金額', '小於', '50億元'], ['預期', '帶動', '轉'], ['蘋果財報', '優於', '預期'], ['市場', '預期', '鴻海第四季營收穫利期待第四季'], ['鴻海第四季營收穫利', '期待', '第四季'], ['疲弱蘋概股', '轉', '強']]"
