,News,All,SVO
0,20151209_847,基米：本公司董事會決議通過受讓他公司股份第三十四條　第9款1.併購種類(如合併、分割、收購或股份受讓):股份受讓2.事實發生日:104/12/93.參與併購公司名稱(如合併另一方公司、分割新設公司、收購或受讓股份標的公司之名稱:世基生物醫學股份有限公司4.交易相對人(如合併另一方公司、分割讓與他公司、收購或受讓股份之交易對象):世基生物醫學股份有限公司之股東5.交易相對人為關係人:否6.交易相對人與公司之關係(本公司轉投資持股達XX%之被投資公司)，並說明選定收購、受讓他公司股份之對象為關係企業或關係人之原因及是否不影響股東權益:本公司目前無該公司股份，該公司非本公司之關係企業或關係人本案係為能結合雙方所長，資源共用不致影響股東權益7.併購目的:提升營運綜效8.併購後預計產生之效益:藉此股份交換後，未來可整合彼此市場與客戶資源，發揮客戶整合及產品線互補之綜效，創造客戶價值，拓展未來產品佈局，擴大經濟效益，創造雙贏之局面並提升股東價值。9.併購對每股淨值及每股盈餘之影響:本股份受讓案，預期將有助雙方提升營運綜效，對每股淨值及每股盈餘均有正面助益。10.換股比例及其計算依據:1.換股比例：本公司1股普通股換發世基生物醫學股份有限公司5.9012股普通股。2.計算依據：本合作案之換股比例係參酌本公司及世基公司近期之財務  資訊，並考量各項相關關鍵因素後協議之。11.預定完成日程:股份交換基準日暫定為105年1月15日12.既存或新設公司承受消滅(或分割)公司權利義務相關事項(註一):不適用13.參與合併公司之基本資料(註二):基龍米克斯生物科技股份有限公司:基因定序，合成，臨床醫學檢測世基生物醫學股份有限公司以基因檢測為專業服務，並持有痛風藥物過敏之基因檢測專利及該項目之醫療器材藥證14.分割之相關事項(含預定讓與既存公司或新設公司之營業、資產之評價價值；被分割公司或其股東所取得股份之總數、種類及數量；被分割公司資本減少時，其資本減少有關事項)(註：若非分割公告時，則不適用):無15.併購股份未來移轉之條件及限制:無16.其他重要約定事:若世基股東於104年12月16日前(取得本公司同意時得延長至104年12月18日)提出之意向書未達該公司已發行普通股股份６６．６７％以上時，本案自動終止。17.本次交易，董事有無異議:否18.其他敘明事項:無註一、既存或新設公司承受消滅公司權利義務相關事項，包括庫藏股及已發行具有股權性質有　　　價證券之處理原則。註二：參與合併公司之基本資料包括公司名稱及所營業務　　　之主要內容。,"[['股份', '受讓', '2'], ['股份', '受讓', '2'], ['如', '合併', '一方公司'], ['交易', '人爲', '關係人'], ['交易', '關係', '投資公司'], ['對象', '爲', '關係企業'], ['本公司', '無', '該公司股份'], ['關係企業本案系', '爲', '結合所長'], ['資源共用', '影響', '併購目的'], ['預期', '提升', '營運綜效'], ['.', '換', '股'], ['換股比例系', '參酌', '資訊'], ['股份交換基準日', '暫定', '承受注一'], ['承受注一', '消滅', '權利義務'], ['.', '參與', '合併公司'], ['基本資料', '注', '二'], ['臨牀醫學檢測世基生物醫學股份有限公司', '爲', '專業服務'], ['並', '持有', '基因檢測專利'], ['分割公司', '取得', '股份'], ['所', '取得', '股份'], ['非', '分割', '公告'], ['世基股東', '取得', '延長'], ['(', '取得', '延長'], ['該公司', '發行', '意向書達'], ['董事', '有無', '異議'], ['存公司', '承受', '相關事項'], ['存公司承受相關事項', '消滅', '公司權利義務'], ['已', '發行', '具有有\u3000\u3000\u3000價證券處理'], ['主要內容', '參與', '合併'], ['基本資料', '包括', '主要內容']]"
0,20151209_848,訊映：公告本公司104年12月09日董事會重要決議事項第三十四條　第42款1.事實發生日:104/12/092.公司名稱:訊映光電股份有限公司3.與公司關係(請輸入本公司或聯屬公司):本公司4.相互持股比例(若前項為本公司，請填不適用):不適用5.發生緣由:本公司104年12月09日董事會重要決議事項如下：(1)決議通過本公司『105年度營運計畫』案。(2)決議通過本公司『105年度預算』案。(3)決議通過本公司105年度『內部稽核計畫』案。(4)決議通過修訂本公司『內部控制制度』案。(5)決議通過修訂本公司『內部稽核實施細則』案。(6)決議通過修訂本公司『薪酬委員會組織章程』案。(7)決議通過本公司『提升自行編製財務報告計畫書』案。(8)決議通過本公司對廣州睿博電子科技有限公司債權處理案。(9)決議通過修訂本公司『訊映光電股份有限公司民國一○四年度第一次限制員工權利新股發行辦法』案。(10)決議通過本公司104年度第一次限制員工權利新股之員工分配明細表及發行新股案。(11)決議通過本公司總經理、一級主管及財務部兼會計部主管之104年度年終?金案。6.因應措施:不適用7.其他應敘明事項:無,"[['前項', '爲', '本公司'], ['『', '提升', '編制財務報告'], ['本公司', '限制', '員工權利新股員工分配明細表']]"
0,20151209_849,世新有線11月營收0.36億元年減3.65% 1— 11月達4.04億元世新有線(8974-TW)2015年 11月營收資料(單位:千元),[]
0,20151209_850,天瑞企業11月營收0.88億元年減29.55% 1— 11月達13.85億元天瑞企業(8065-TW)2015年 11月營收資料(單位:千元),[]
0,20151209_851,保勝光學11月營收0.41億元年減14.80% 1— 11月達5.15億元保勝光學()2015年 11月營收資料(單位:千元),"[['保勝光學', '營收', '0.41億元']]"
0,20151209_852,凌昇科11月營收0.44億元年減28.75% 1— 11月達3.61億元凌昇科(6490-TW)2015年 11月營收資料(單位:千元),[]
0,20151209_853,國碳科11月營收0.34億元年減30.93% 1— 11月達3.05億元國碳科()2015年 11月營收資料(單位:千元),[]
0,20151209_854,旭東機械11月營收2.02億元年增56.73% 1— 11月達18.42億元旭東機械()2015年 11月營收資料(單位:千元),"[['旭東機械', '營收', '2.02億元年增']]"
0,20151209_855,基米11月營收0.28億元年減8.76% 1— 11月達3.13億元基米()2015年 11月營收資料(單位:千元),[]
0,20151209_856,福永生物11月營收0.22億元年減40.19% 1— 11月達3.73億元福永生物()2015年 11月營收資料(單位:千元),[]
0,20151209_857,明躍國際11月營收1.23億元年減5.56% 1— 11月達11.52億元明躍國際()2015年 11月營收資料(單位:千元),[]
0,20151209_858,健格11月營收0.16億元年減39.40% 1— 11月達2.17億元健格()2015年 11月營收資料(單位:千元),[]
0,20151209_859,嘉實資訊11月營收0.54億元年增5.81% 1— 11月達4.62億元嘉實資訊()2015年 11月營收資料(單位:千元),"[['11月營收0.54億元年', '增', ' 11月']]"
0,20151209_860,國泰產險11月營收15.83億元年增8.06% 1— 11月達170.55億元國泰產險(2877-TW)2015年 11月營收資料(單位:千元),[]
0,20151209_861,F-楷捷11月營收0.20億元年減25.74% 1— 11月達3.60億元F-楷捷()2015年 11月營收資料(單位:千元),[]
0,20151209_862,電商+周年慶！橘子11月營收近9億 創歷年同期新高遊戲廠橘子集團()11月在旗下電商樂利助威下，加上橘子舉辦20週年歡慶活動，帶動遊戲、樂點表現，單月合併營收達8.9億元，創歷年11月新高紀錄，月增12.7%，累計前11月營收88.5億元，年增7.2%。橘子表示，電商部分，樂利數位一條龍營運服務在雙11發威，帶領Costco、可口可樂、荷蘭最大食品零售商Royal Ahold旗下超市Albert Heijn等及「吉室商行台灣品牌旗艦店」旗下舊振南餅店、林三益等台灣百年老字號品牌成功搶灘中國天貓購物商機，打造亮眼成績，進一步推動11月營收成長。電子支付方面，樂點行動支付持續多方拓展線下實體據點，新夥伴中興保全集團加入，透過中興保全在保全、物管、停車、微型商店等服務領域，擴大樂點行動支付服務應用範疇。此外，樂點行動支付並於日前領先取得國內O2O(Online to Offline)實體通路支付服務業務核准，成為首家經金管會核准經營台灣國內O2O支付業務的電子支付業者，首波佈線10萬實體據點，新添營運動能。至於新媒體方面，橘子旗下原創網路影音平台酷瞧，今年3月正式開台以來全網影片觀看數已達1.55億次，進接著乘勝追擊拓展多元類型節目內容，企劃推出以女性為主題的特色節目，提升用戶族群多元性。最後遊戲營運方面，橘子為因應聖誕節與元旦跨年連假，旗下多款重點線上遊戲及手機遊戲包括《天堂》、《CSO絕對武力》、《艾爾之光》、《新瑪奇》等推出相關節慶活動；群眾募資方面，群募貝果開創台灣群募平台跨區域合作首例，與中國群募平台「點名時間」合作，讓台灣創意提案能夠在雙方平台同時集資，藉由雙方管道與資源相互推廣，大幅提高提案曝光度，達募資成果加成綜效。,"[[')新高遊戲廠橘子集團', '加上', '橘子'], ['橘子', '表示', '發威'], ['全網影片觀看數', '達', '1.55億次'], ['線上遊戲', '包括', '推出節慶活動'], ['羣募貝果', '開創', '跨區域合作首例'], ['募資成果', '加成', '綜效']]"
0,20151209_863,9成受訪者自認退休金不夠 7成民眾覺得醫療保障不足康健人壽今(9)日首度公布2015年「360°康健指數」調查結果，從身體、家庭、社交、財務與工作五大康健面向，深入瞭解台灣人對各個面向的重視程度與自身表現的滿意度。調查顯示，約34%的受訪者自評在家庭面向表現最佳，財務面向的表現則有很大改善空間，高達9成的受訪者自認沒有足夠金錢可以退休，還有近7成的受訪者覺得目前的保險不足以支付醫療支出，突顯出財務面向風險多與保障缺口大的隱憂。康健人壽建議民眾應及早積極規劃和補足保障缺口，才能減輕財務壓力。康健人壽行銷長邱柏爾表示，民眾對「財務」面向的相關表現的滿意度很低，反映出國人普遍對於財務面向的不確定和焦慮。「民眾必須同時考量收入、支出與風險，三者缺一不可才能提升財務康健的程度。康健人壽未來也會以『360 °康健指數』調查持續推廣全方位健康觀念，並針對調查結果及消費者需求，推出更多健康及醫療保障方案，幫助台灣民眾追求更均衡、更美好的康健生活。」「360°康健指數」是台灣首度以全方位健康概念出發的調查，除了涵蓋身體康健，也特別加入家庭、社交、財務與工作等其他面向，深度剖析國人在各面向的表現與原因。經由五大面向的調查綜合評估後，台灣民眾平均康健指數為56.8分（滿分為100分），各年齡層的自評表現普遍不高。在五大面向中，受訪者自評在「財務」面向表現最不理想，倒數第二則是「工作」面向。對於所有財務相關議題近9成都認為自己的表現有很大改善空間，且不分年齡層各個族群都對自己的財務狀況感到憂心。受訪者在財務面向的自評分數較低也是拉低整體康健指數的關鍵。「工作」面向：有78%的受訪者最不滿意的是「薪資」與「獎酬福利」，而且有四分之三的人覺得工作壓力大。工作面向表現最好的與同事和上司的關係，超過半數的人感到滿意。「財務」面向：只有10%的受訪者認為「自己有足夠金錢可以退休」，認為自已「無法工作時的經濟保障」已經足夠的受訪者僅11%，覺得自己擁有「滿足自己與/或家人醫療需求的經濟能力」為12%，而對「自己目前整體財務狀況」表示滿意的人也只有13%。「360°康健指數」調查也顯示，受訪者中每五人就有一人是三明治族，除了自身需求還得同時照顧扶養父母和子女，家庭責任更為重大。康健人壽行銷長邱柏爾提醒，身為家中經濟支柱的三明治族，更應預先為自己規畫相關保障，面對突發狀況時才不會衝擊到心愛的家人。值得注意的是，調查發現不論是過去或未來退休後的醫療支出，都有約6成的人是靠自己的儲蓄或購買商業保險支付，卻有高達7成受訪者覺得目前擁有的保險還不足以支付未來醫療支出，突顯了財務面向的潛在風險與醫療保障不足的隱憂。康健人壽行銷長邱柏爾建議民眾要積極面對財務壓力，選擇適合的保險與足夠保障架好防護網，將生活中不確定性的「風險」轉嫁給保險公司，由保險公司承受損失，才能沒有後顧之憂的追求康健生活。,"[['9成受訪者', '自認', '不夠'], ['7成民衆', '覺得', '保障不足'], ['調查', '顯示', '34%受訪者評'], ['財務面向表現', '有', '改善空間'], ['，', '高達', '9成'], ['康健人壽', '建議', '民衆規劃'], ['康健人壽行銷長邱柏爾', '表示', '反映對於不確定'], ['民衆', '考量', '收入'], ['三者', '提升', '財務康健程度'], ['康健人壽', '推廣', '健康觀念'], ['360康健指數', '是', '出發調查'], ['平均康健指數', '爲', '56.8分'], ['滿分', '爲', '100分'], ['受訪者', '自評在', '財務面向表現'], ['倒數第二', '是', '工作面向'], ['9成都', '認爲', '自己表現有改善空間'], ['自己表現', '有', '改善空間'], ['低', '也是', '拉整體康健指數關鍵'], ['78%受訪者不滿意的', '是', '有四分之三人覺得工作壓力大'], ['而且', '有', '四分之三'], ['有四分之三人', '覺得', '工作壓力大'], ['工作', '面向', '與關係'], ['，', '超過', '半數'], ['超過半數人', '感到', '滿意'], ['受訪者', '認爲', '退休'], ['自己', '有', '足夠金錢'], ['「', '滿足', '自己'], ['自己擁有', '表示', '滿意'], ['」', '表示', '滿意'], ['自己擁有表示滿意人', '只有', '13%'], ['360康健指數調查', '顯示', '每五人有一人是三明治族'], ['每五人', '有', '一人是三明治族'], ['一人', '是', '三明治族'], ['康健人壽行銷長邱柏爾', '提醒', '保障'], ['，', '面對', '突發狀況'], ['值得注意的', '是', '調查'], ['擁有保險', '覺得', '支付醫療支出'], ['邱柏爾', '建議', '民衆面對財務壓力'], ['民衆', '面對', '財務壓力']]"
0,20151209_864,瓦城泰統累積營收破紀錄　衝破31億元創新高記者彭夢竺／台北報導瓦城泰統集團（2729）今（9）日公布營收相關資訊， 2015年11月營收再傳捷報，單月業績逾2.7億，較去年同期增長19.51%，緊接著的年菜商機、12月中下旬的聖誕節檔期，都可望為第四季帶動消費熱力，推助全年營收、獲利表現。瓦城泰統表示，他們在單月、累計營收的年增率雙雙逼近2成，在百貨周年慶、歲末尾牙商機及新開店的動能推升下，單月業績逾2.7億元，較去年同期增長19.51%，累計營收也衝破31.55億，不僅較去年同期成長18.54%，更一舉超越2014全年總營收29.05億。瓦城泰統指出，12月份各品牌將持續穩健拓點，除了1010湘已在12月4日成功挺進高雄，進駐知名的義大購物中心外，瓦城泰國料理也持續積極布局，自六都都會區延伸至各城市重要商圈，大心新泰式麵食則再開高雄三多店、誠品松菸店。此外，時序邁入年終餐敘高峰期，集團旗下3大品牌聯手搶先推出尾牙春酒專案，一推出即吸引許多中小企業及部門聚餐客層，深獲消費者好評，極具市場競爭力，預計將創造再一波的熱銷佳績，緊接著的年菜商機、聖誕節檔期，還有延長至年底的百貨周年慶，都可望為第四季帶動消費熱力，推助全年營收、獲利表現。,"[['\u3000', '衝破', '高記者'], ['單月業績', '逾', '2.7億'], ['瓦城泰統', '表示', '單月業績逾2.7億元'], ['單月業績', '逾', '2.7億元'], ['各品牌', '持續', '拓點'], ['已', '挺進', '高雄'], ['新泰式麪食', '再開', '高雄三多店'], ['時序', '邁入', '年終餐敘高峯期'], ['年菜商機', '帶動', '消費熱力']]"
0,20151209_865,外資看大立光小幅調高目標價 但遭連5賣今收最低大立光遭外連5日賣超，今以盤中最低價2305元作收，為今年1月7日以來收盤新低；圖為大立光執行長林恩平。(鉅亨網記者張欽發攝)台北股市在今天集中市場加權股價指數收盤大跌114.24點或1.37%，以8229.62點作收，成交值為893.57億元；台股股王大立光()雖獲外資麥格里證券小幅調高目標價由2600元調高到2615元，仍維持中立評等；但大立光股價在外資已連續賣超5個交易日的提款下，今天以2305元的盤中最低點作收。同時，今天大立光的收盤價2305元，更是2015年1月7日以來的收盤新低價；而外資對於大立光已連續賣超5個交易日，淨賣超張數並達到1021張。以大立光的今天股價走勢來看，大立光早盤以2355開出後振盪走低，以盤中的最低價2305元作收，成交量1143張，成交值26.84億元，居台股第3位，僅次於台積積電()及中裕()。但是盤後統計資料來看，外資今天仍然賣超大立光173張，近5日來外資賣超大立光1021張。就大立光個股來看，大立光2015年11月仍站穩57億元高檔，為57.07億元，較上月的歷史新高57.69億元衰退1.06%，但較去年同月的56.2億元成長1.55%。大立光累計2015年1-11月營收為519.03億元，較去年同期的400.25億元成長29.68%。但是12月營收可能再較11月的57.07億元下滑。外資麥格里證券昨日的報告顯示，已小幅調高大立光目標價由2600元調高到2615元，仍維持中立評等。大立光2015年10月營收為57.69億元創歷史新高，其揭露的11月營收也維持於57億元的歷史高檔水準。不過，大立光在11月連遭法人調降評等，先有凱基證券於11月6日調降大立光評等為降低持股，目標價位為2200元；而12月3日的JP摩根對於大立光報告則由前次的中立降為減碼，目標價位更下調到2100元，而前次來自外資麥格里證券的對於大立光報告，顯示其評等由優於大盤降為中立，目標價則降為2600元。大立光的2015年第3季營收以160.86億元創下單季歷史次高紀錄，單季獲利則以82.06億元創新高，累計1-3季稅後盈餘174.37億元，每股稅後盈餘129.99元。,"[['看大立光', '調', '目標價'], ['連5', '賣', '收最低大立光'], ['圖', '爲', '大立光執行林恩平長'], ['大立光', '執行', '林恩平長'], ['成交值', '爲', '893.57億元'], ['證券', '小幅調', '高'], ['外資', '賣', '超張數'], ['外資', '賣', '173張立光'], ['大立光', '站穩', '57億元高檔'], ['-11月營收', '爲', '519.03億元'], ['昨日報告', '顯示', '高'], ['營收', '爲', '創歷史新高'], ['11月營收', '維持於', '高檔水準'], ['大立光', '遭', '調降評'], ['凱基證券', '調降', '大立光評'], ['目標', '爲', '2200元'], ['前次', '來自', '外資麥格里證券']]"
0,20151209_866,高野：本公司上櫃前業績發表會公告第三十四條　第30款符合條款第XX款：30事實發生日：104/12/151.召開法人說明會之日期：104/12/152.召開法人說明會之時間：14 時 30 分 3.召開法人說明會之地點：台北文創大樓6樓多功能會議廳A-B廳(台北市信義區菸廠路88號6樓)4.法人說明會擇要訊息：本公司簡介及概況、產品介紹、未來風險說明及公開說明書補充揭露事項說明5.法人說明會簡報內容：內容檔案於當日會後公告於公開資訊觀測站6.公司網站是否有提供法人說明會內容：有，網址： http://www.hoyaresort.com.tw/investors.aspx7.其他應敘明事項：法人說明會簡報相關內容將依規定於召開當日揭露於公開資訊觀測站,"[['法人', '說明', '會'], ['法人', '說明', '會'], ['4樓法人', '說明', '擇要訊息'], ['法人', '說明', '簡報內容'], ['內容檔案', '公告於', '.公司網站'], ['法人', '說明', '規定'], ['相關內容', '規定於', '揭露']]"
0,20151209_867,儀大11月營收3.43億元年減14.29% 1— 11月達36.51億元儀大(9961-TW)2015年 11月營收資料(單位:千元),"[['大11月營收', '達', '36.51億元儀']]"
0,20151209_868,北港有線11月營收0.19億元年減1.94% 1— 11月達2.18億元北港有線(8995-TW)2015年 11月營收資料(單位:千元),[]
0,20151209_869,麗冠有線11月營收0.31億元年減0.26% 1— 11月達3.55億元麗冠有線(8981-TW)2015年 11月營收資料(單位:千元),[]
0,20151209_870,新東亞11月營收2.62億元年增22.04% 1— 11月達23.24億元新東亞(8351-TW)2015年 11月營收資料(單位:千元),[]
0,20151209_871,榮輪科技11月營收5.75億元年減3.47% 1— 11月達59.87億元榮輪科技(8350-TW)2015年 11月營收資料(單位:千元),[]
0,20151209_872,春日11月營收1.25億元年增39.87% 1— 11月達12.77億元春日()2015年 11月營收資料(單位:千元),[]
0,20151209_873,全球傳動11月營收1.03億元年減33.38% 1— 11月達15.02億元全球傳動()2015年 11月營收資料(單位:千元),[]
0,20151209_874,聯致11月營收0.83億元年減7.51% 1— 11月達11.82億元聯致()2015年 11月營收資料(單位:千元),[]
0,20151209_875,宏塑11月營收3.52億元年減9.13% 1— 11月達38.55億元宏塑(3463-TW)2015年 11月營收資料(單位:千元),"[['-', 'TW', '3463']]"
0,20151209_876,群益期貨台股期權盤後－台股遭外資提領 面臨支撐決戰點◆盤勢分析台股連兩日的黑K走勢讓均線糾結後呈現下彎型態，目前面臨11/16和11/30的支撐位置附近，成交量略增至889億，若明日沒有反彈而又再度破底，短線上將擺脫區間震盪而形成空頭態勢。目前貶值到6.42的價位，讓金融類股的TRF隱憂再度放大，今日金融期跌破1000的信心位置，短線上台股是否持續震盪偏弱，明日的走勢極為關鍵。外資在期貨再減至10132口，現貨部分賣超89億，外資今日依舊同步站在賣方，而自營商在賣買權持續加碼，仍皆屬於偏空的訊號。在12月份選擇權籌碼當中，賣權OI轉為小於買權OI為四萬一千多口，屬於偏空的局面。今日買權最大量OI從8800轉為8500履約價，下移企圖明顯大增，而賣權OI新增布局為8000履約價以下持續作堅守支撐。綜合以上，整體籌碼面為偏空的格局，外資今日在期現貨持續賣超台股，12月份選擇權籌碼的買權OI下移積極。另外，目前技術面均線呈現下彎趨勢，若明日沒有反彈，在未來呈現下殺走弱的可能性將大增，建議可偏空操作。,"[['遭外資領', '面臨', '盤勢'], ['成交量', '面臨', '支撐位置附近'], ['金融期', '跌破', '1000'], ['金融期', '跌破', '1000'], ['外資', '減至', '10132口'], ['現貨部分賣', '超', '89億'], ['外資', '站在', '賣方'], ['賣權OI', '轉爲', '小於'], ['買權OI', '爲', '四萬一千多口'], ['最大量OI', '轉爲', '8500履約價'], ['新增佈局', '爲', '8000履約價'], ['整體籌碼面', '爲', '空格局'], ['現貨', '賣', '超臺股'], ['技術面均線', '呈現', '下彎趨勢'], ['未來', '呈現', '下殺走弱']]"
0,20151209_877,科雅11月營收0.05億元年增29.71% 1— 11月達0.48億元科雅(3375-TW)2015年 11月營收資料(單位:千元),[]
0,20151209_878,金融大樓11月營收4.62億元年增1.65% 1— 11月達50.47億元金融大樓(2899-TW)2015年 11月營收資料(單位:千元),[]
0,20151209_879,F-英利11月營收10.81億元年減11.25% 1— 11月達112.13億元F-英利()2015年 11月營收資料(單位:千元),"[['11月營收', '年減', ' 11月']]"
