,News,All,SVO
0,20151028_2700,《股市》09:00台股店頭 報125.95點，漲0.51點或0.41%《股市》09:00台股店頭 報125.95點，漲0.51點或0.41%。免責聲明：本文所載資料僅供參考，並不構成投資建議，鉅亨網對該資料或使用該資料所導致的結果概不承擔任何責任。該資訊若與事實不符，應以商品原交易所之公佈為主。,"[['00臺股店頭', '報', '125.95點'], ['00臺股店頭報125.95點', '漲', '0.51點'], ['00臺股店頭', '報', '125.95點'], ['00臺股店頭報125.95點', '漲', '0.51點'], ['導致結果', '承擔', '任何責任']]"
0,20151028_2701,《股市》09:00台期指11 報8671.00點，跌-23.00點或-0.26%《股市》09:00台期指11 報8671.00點，跌-23.00點或-0.26%。免責聲明：本文所載資料僅供參考，並不構成投資建議，鉅亨網對該資料或使用該資料所導致的結果概不承擔任何責任。該資訊若與事實不符，應以商品原交易所之公佈為主。,"[['00臺', '期指', '11報8671.00點'], ['11', '報', '8671.00點'], ['00臺', '期指', '11報8671.00點'], ['11', '報', '8671.00點'], ['導致結果', '承擔', '任何責任']]"
0,20151028_2702,蔡明介獲半導體聯盟張忠謀博士模範領袖獎半導體聯盟(GSA)宣布，聯發科()董事長暨執行長蔡明介，榮獲2015年半導體聯盟最高殊榮「張忠謀博士模範領袖獎」。GSA總裁Jodi Shelton表示，蔡明介奠定全球業務基本運營模式，並成就一家全球知名的企業，自2003年GSA創立以來，聯發科為聯盟作出了卓越貢獻，作為業界領袖，蔡明介的視野與遠見促進了整個半導體產業的演進及發展，在其領導下，聯發科已成長為全球領導企業。創立在1999年首屆GSA「模範領袖獎」得主是台積電董事長暨執行長張忠謀，如今張忠謀博士模範領袖獎旨在表揚個人的全球領導才能及其為促進整體半導體產業改造與提升的卓越貢獻。蔡明介表示，將與全體聯發科員工共享此榮譽，獎項肯定了聯發科致力連結下一個10億中產階級消費者的目標與願景。蔡明介在1997年創立聯發科，在他領導下，聯發科成長為全球前三大無晶圓半導體公司，同時也是第一家且是唯一一家總部設在美國以外的無晶圓半導體上市企業，聯發科是全球最大的光儲存、DVD播放器和智慧電視晶片公司，及全球第二大手機晶片供應商。蔡明介擁有台灣大學電子工程學士學位與美國辛辛那提大學電子工程碩士學位，職業生涯開始於台灣工研院(ITRI)的電子工業研究所(ERSO)，期間擔任了7年的IC設計經理，隨後14年時間中，蔡明介在聯電子公司()擔任多個高階職位，1994年擢升為聯電第二事務部(生產消費電子和多媒體產品晶片)總裁，三年後該事業部從聯電分拆出來，成為今日的聯發科。蔡明介之前已榮獲工業研究院院士(ITRI Laureate)、台灣清華大學與交通大學名譽工學博士學位、國立台灣大學傑出校友獎等；此外還著有《競爭力的探求》一書，分享在全球IC設計產業中的寶貴經驗及對產業發展的深刻思考；2013年和2014年，蔡明介先生連續兩屆獲選為《哈佛商業評論》全球百大CEO；2015年，聯發科技上榜《Forbes》全球企業2000強名單，榮膺《Forbes》全球最佳CEO榜單第三位。,"[[')董事長', '執行', '蔡明介'], ['GSA總裁Jodi Shelton', '表示', '蔡明介奠定基本運營模式'], ['蔡明介', '奠定', '基本運營模式'], ['聯發科', '作出', '卓越貢獻'], ['蔡明介視野', '促進', '半導體產業演進'], ['模範領袖獎得主', '是', '臺積電董事長'], ['領袖獎', '旨在', '表揚卓越貢獻'], ['蔡明介', '表示', '共享此榮譽'], ['獎項', '肯定', '中產階級消費者目標'], ['蔡明介', '創立', '聯發科'], ['聯發科成長', '爲', '半導體公司'], ['一家總部', '設在', '美國以外'], ['一家總部', '設在', '美國以外'], ['的', '無', '上市'], ['聯發科', '是', '光儲存'], ['蔡明介', '擁有', '電子工程學士學位'], ['職業生涯', '開始於', '電子工業研究所ERSO'], ['蔡明介', '擔任', '高階職位'], ['蔡明介', '榮獲', '等院士'], ['聯發科技', '上榜', '2000強名單']]"
0,20151028_2703,鉅明瘦身有成 Q3淡季仍有獲利進帳 1-3季EPS 2.52元高爾夫球具鑄造廠鉅明()瘦身有成，在第3季的市場淡季仍有獲利進帳，鉅明董事會通過其2015年第3季財報淨利為883萬元，每股稅後盈餘0.17元，累計2015年1-3季財報每股稅後盈餘為2.52元。歷年的第2季及第3季為高爾夫球具廠的淡季，而鉅明第3季營收略較第2季的3.12億元回升，營業毛利3470萬元，毛利率9%，稅後盈餘為883萬元，每股稅後盈餘0.17元；累計2015年1-3季營收13.62億元，毛利率19%，2015年1-3季財報稅後盈餘1.28億元，每股稅後盈餘為2.52元。鉅明已在去年裁撤在中國華南的非核心製造業，整體鉅明在今年的第2季及第3季為高爾夫球具廠的淡季中都有獲利。而另一高爾夫球具廠大田精密() 大田精密在2015年的第2季及第3季淡季呈現連續的虧損，大田精密自結2015年1-3季稅後虧損1800萬元，累計1-3季稅後虧損9001萬元，每股稅後虧損0.76元。大田精密2015年第3季營收為10.3億元，較去年同期的9.34億元成長10.28%，自結單季稅前虧損2200萬元，稅後虧損1800萬元，單季每股稅後虧損0.17元。而加計1-6月財報顯示，累計1-3季稅後虧損9001萬元，每股稅後虧損0.76元。大田精密目前已全力朝自有品牌產品發展，包括運用其碳纖複合材料核心技術發展自有品牌自行車，同時，將開發不銹鋼材質水五金產品進行市場行銷。,"[['巨明瘦身', '有', '有1-3季帳'], ['瘦身', '有', '鑄造廠巨明'], ['財報淨利', '爲', '883萬元'], ['稅後盈餘', '爲', '2.52元'], ['歷年第2季', '爲', '高爾夫球具廠淡季'], ['稅後盈餘', '爲', '883萬元'], ['稅後盈餘', '爲', '2.52元'], ['巨明', '裁', '非核心製造業'], ['大田', '結', '-3季'], ['每股', '虧損', '0.76元'], ['2015年第3季營收', '爲', '10.3億元'], ['而', '加計', '-6月'], ['加計-6月財報', '顯示', '虧損9001萬元'], ['每股', '虧損', '0.76元']]"
0,20151028_2704,券商分析摘要◆券商推薦個股排行： ◆ 統一證：昨日指數回測五日均線後守住8700點，考量FED本次會議升息機率低，各國央行維持寬鬆基調不變，股市資金動能充沛，且外資偏多佈局台股，外資期貨未平倉淨多單達兩萬口水準，周四摩台指結算在即，指數大幅下跌機率較低，預期台股將維持盤堅走勢。選股上除了第四季基本面良好之光纖、PCB、鞋材、塑化及汽車零組件等績優族群外，也可著墨十三五規劃概念股。 ◆ 大昌證券：昨日台股開低走低，盤中也受到陸股走跌影響，跌破8700點整數關卡，不過尾盤支撐力道浮現向上拉抬，終場以44.04點作收，力守8700點之上。三大類股齊跌，電子族群蘋概股走弱，而太陽能、DRAM、光通訊族群表現較為亮眼。傳產類股也呈現走跌，不過仍有像生技、航運、高爾夫相關族群向上攻高，航運雖走強但中長期仍需關注油價狀況。金融指數持續疲弱，不過回測10日線有守，且維持在季線之上，若指數要上攻，金融也不可缺席。而相對抗跌，再創波段新高，不過追價力道趨緩，恐需補量上攻較佳。 ◆ 新光證：蘋果在財報公布前股價重挫3%、市場等待聯準會利率決策會議，美股漲少跌多，27日台股在蘋概股走弱、千興爆發停工一個月利空消息影響下，開低走低，終場收在 8701.32點，下跌44.04點或0.5%，成交額891.39億元。OTC指數收在 125.44點，下跌0.26點或0.21%，成交額244.65億元。 27日台股在油價走跌，國際股市拉回整理下，收黑K棒，靠拉尾盤保住8700點關卡。籌碼方面，三大法人同步賣超，其中外資結束連八買，小賣1.38億，自營商則是大賣近29億。此外，外資淨多單減少至2萬餘口，顯示外資操作未如先前樂觀，隨國際股市出現少量調節，不過由於額度不多，不致動搖多方看法，若指數跌破月線支撐，則建議嚴控停損，靈活操作。 ◆ 大慶證：德股下跌1%，美股四大指數小漲小跌，不過型態上仍偏多不變。歐股回檔的原因除了中國經濟不振，多家企業財報獲利不如預 期，還有原油價格連3跌，能源股走疲拖累。美國經濟數據部分，耐久財訂單連2個月下降，消費者信心也低於預期，顯示經濟成長轉弱，市場觀望FOMC聲明，造成買盤縮手導致。蘋果財報優於預期，不過市場並不買單，截至今天早上，盤後漲幅不到1%，仍需要時間盤底。中國股市昨天單日V轉，連續3天站穩季線，趨勢由空翻多，十三五計畫即將出台，近期與中國連動較高的類股可多留意。,"[['券商', '分析', '摘要'], ['券商', '推薦', '個股'], ['各國央行', '維持', '寬鬆基調'], ['臺股', '維持', '盤堅走勢'], ['盤中', '受到', '跌影響'], ['傳產類股', '呈現', '跌'], ['10日線', '有', '守'], ['指數', '上', '攻'], ['市場', '等待', '聯準會利率決策會議'], ['OTC指數收', '在', ' 125.44點'], ['外資', '減少至', '2萬餘口'], ['外資操作', '如', '樂觀'], ['德股', '下跌', '1%'], ['獲利', '不如', '預 期'], ['消費者信心', '低於', '預期'], ['經濟成長', '轉', '弱'], ['市場', '觀望', 'FOMC聲明'], ['市場觀望FOMC聲明', '造成', '縮手導致'], ['蘋果財報', '優於', '預期'], ['盤後漲幅', '不到', '1%']]"
0,20151028_2705,新光證券盤前分析◆盤勢分析蘋果在財報公布前股價重挫3%、市場等待聯準會利率決策會議，美股漲少跌多，27日台股在蘋概股走弱、千興爆發停工一個月利空消息影響下，開低走低，終場收在 8701.32點，下跌44.04點或0.5%，成交額891.39億元。OTC指數收在 125.44點，下跌0.26點或0.21%，成交額244.65億元。27日台股在油價走跌，國際股市拉回整理下，收黑K棒，靠拉尾盤保住8700點關卡。籌碼方面，三大法人同步賣超，其中外資結束連八買，小賣1.38億，自營商則是大賣近29億。此外，外資淨多單減少至2萬餘口，顯示外資操作未如先前樂觀，隨國際股市出現少量調節，不過由於額度不多，不致動搖多方看法，若指數跌破月線支撐，則建議嚴控停損，靈活操作。,"[['市場', '等待', '聯準會利率決策會議'], ['OTC指數收', '在', ' 125.44點'], ['外資', '減少至', '2萬餘口'], ['外資操作', '如', '樂觀']]"
0,20151028_2706,台股10月28日 訊息盤點(五) 外資報告1.,[]
0,20151028_2707,台股10月28日 訊息盤點(四) 歐美股市1.2.,[]
0,20151028_2708,台股10月28日 訊息盤點(三) 盤前分析1.2.,[]
0,20151028_2709,台股10月28日 訊息盤點(二) 個股訊息1.2.3.4.5.6.,[]
0,20151028_2710,台股10月28日 訊息盤點(一) 部會消息1.2.3.4.,[]
0,20151028_2711,日盛投顧盤前分析◆盤勢分析1.歐股受能源、原物料類股拖，泛歐Stoxx 600指數下跌0.92%。投資人等待周三的Fed會後聲明及重要企業財報，但耐久財訂單連二月下降，且消費者信心低於預期，顯示第三季經濟成長轉弱，大盤終場走低，四大指數下跌(跌幅介於0.09到0.67%)。整體而言，主要歐美股市短期內仍有機會再彈，但中期大區間震盪的格局不變。2.今日看盤重點(1) 指數走高到8757反彈新高後拉回，雖然大盤賣壓並不強，但需留意沿著短期均線盤高的格局、量價及指標有無再次背離狀況出現，目前來說下檔10日線為多空轉折，一旦跌破短多主導局面將改變。 (2)半導體類股為電子指數強弱關鍵；電子類指標為台積電(是否站穩240日線)；蘋果股看股王大立光是否續彈，在權值股沒轉強前，市場資金仍會回太陽能、LED、光通訊、IC設計上面。(3) 金融族群籌碼面好轉是能否轉強的關鍵；金融指數1082點為上檔轉折，站上則短多將重新主導，短線下檔暫以1050點為參考。 (4)傳產大型股指標看台塑集團及東元。汽車零組件、紡纖、生技為觀盤重點。3.蘋果Q4 財報顯示，中國市場連三季高度成長，使蘋果該季營收 515 億美元、淨利 111 億美元、EPS 1.96 美元，優於去年同期，也優於市場預期。其中在中國市場銷售總額成長 1 倍，來到 125.2 億美元，貢獻整體營收近 4 分之 1。至於蘋果 2016 年 Q1的業績展望：營收預計介於 755 億至 775 億美元之間，毛利率預計介於 39% 至 40% 之間，營運費用預計介於 63 億至 64 億美元之間。4.友達(2409)公告第3季合併財報，總計合併營業額為893億元，較第2季減少3.3%。營業毛利為91.5億元，毛利率為10.2%，第3季稅後純益為33.8億元，基本每股盈餘為0.36元。合計今年前3季合併營收為2769億元，前3季合併稅後純益為130.8億元，前3季EPS為1.36元；在財務結構方面，第3季淨負債比進一步下降至19.7%，創下2009年以來的新低。接下來由於全球經濟前景也不是很明朗，因此友達將以動態調整產能利用率，管理庫存，並且在不增加產能的狀況下，控制資本支出。5.(1) 華亞科 (3474)第3季因從30元貶至33元，單季匯兌收益達26億元，第3季稅後淨利57.74億元，每股盈餘0.88元；累計前3季每股盈餘2.69元。第3季由於市場平均銷售價格下跌，加上晶圓出貨量些微減少，營收較上季下滑11%；第3季位元出貨量比上季微幅減少2.9%，與先前預估一致；第4季位元出貨量預估將較上季增加數個百分點。(2)華邦電(2344) 第3季合併財報，第3季合併營收約為95.34億元，季增加3%，營業毛利率為28%，稅後純益約為7.31億元，每股純益為0.18元，累計前3季為0.67元。第3季利基型記憶體（Specialty DRAM）佔營收54%，營收較前一季增加8%，成長動能來自車用電子的應用增加；46奈米佔Specialty DRAM營收比重，已由上一季79%成長至84%。行動記憶體（Mobile DRAM）佔營收10%，營收較前一季減少15%，主要受到手持裝置客戶需求疲弱的影響；快閃記憶體（Flash Memory）佔營收36%，較前一季增加4%，營收成長來自網通應用需求增加。6.盛群(6202)公布今年第三季財報，合併營收10.14億元較去年第三季9.8億元增加3.5%，累計104年1月至9月合併營收29.28億元，較去年同期28.95億元增加1.1%。今年第三季毛利率49.9%，比去年同期47.6%小幅增加。第三季稅前淨利2.66億元，較去年同期成長2.45億元增加8.7%。前三季稅前淨利7.18億元，比去年同期的6.79億元增加5.7%，第三季每股盈餘0.97元，前三季每股盈餘2.65元。股價沿均線盤高格局不變。7.力成(6239)公布2015年第三季財報，合併營收107.56億元，季增5％、年增2.84％，毛利率19.2％，優於第二季的18.7％及去年第三季的18.01％，營益率13.4％，優於第二季的13.2％及去年第三季的11.48％。稅後淨利10.96億元，季增18.3％、年增14.4％，基本每股盈餘1.42元，優於第二季的1.2元及去年第三季的1.25元。前三季營收年增率已由負轉正。第三季由DRAM和Flash為成長主力，整體營運狀況符合第二季法說預期，營收和毛利率創下13季以來新高，毛利率已接近20％目標，整體表現仍然不錯。8.矽品(2325)第3季獲利26.82億元，季減27%、年減17.7%，毛利率24.7%、營益率14.6%、EPS 0.86元，主要原因是客戶進行庫存調節。展望第4季，由於中國大陸與歐洲經濟成長率趨緩，消費力大減使得客戶庫存調節延至年底，庫存要到明年第1季才會去化，但不排除會看到急單出現。矽品預估第4季營收落在188億元至200億元之間；毛利率約23%到25%；營業利益率則估在13%到15%之間。,"[['歐股', '受', '能源類股拖'], ['泛歐Stoxx 600指數', '下跌', '0.92%'], ['投資人', '等待', '週三Fed'], ['消費者信心', '低於', '預期'], ['第三季經濟成長', '轉', '弱'], ['0.09', '到', ')'], ['歐美股市', '彈', '有機會'], ['留意高格局', '無', '背離狀況'], ['10日線', '爲', '多空轉折'], ['半導體類股', '爲', '強弱關鍵'], ['電子類指標', '爲', '臺積電'], ['蘋果股', '看', '股王大立光是否續彈'], ['股王大立光', '是否', '續彈'], ['市場資金', '回', '太陽能上面'], ['金融族羣籌碼面好轉', '是', '轉關鍵'], ['金融指數1082點', '爲', '上檔轉折'], ['短線下檔', '爲', '參考'], ['汽車零組件', '爲', '觀盤重點'], ['蘋果Q4財報', '顯示', '使'], ['營收預計', '介於', '755之間'], ['毛利率', '預計', '介於 之間'], ['營運費用預計', '介於', '64億美元之間'], ['合併營業額', '爲', '893億元'], ['營業毛利', '爲', '91.5億元'], ['毛利率', '爲', '10.2%'], ['稅後純益', '爲', '33.8億元'], ['每股盈餘', '爲', '0.36元'], ['合併營收', '爲', '2769億元'], ['純益', '爲', '130.8億元'], ['前3季EPS', '爲', '1.36元'], ['友達', '調整', '產能利用率'], ['不', '增加', '產能'], ['單季匯兌收益', '達', '26億元'], ['第3季位元出貨量', '減少', '2.9%'], ['合併營收', '爲', '95.34億元'], ['季', '增加', '3%'], ['營業毛利率', '爲', '28%'], ['約', '爲', '7.31億元'], ['每股', '爲', '0.18元'], ['前3季', '爲', '0.67元'], ['利基型記憶體Specialty DRAM', '佔營收', '54%'], ['營收', '增加', '8%'], ['成長動能', '來自', '車用電子'], ['成長動能', '來自', '車用電子'], ['46奈米', '佔', '營收比重'], ['MobileDRAM', '佔營收', '10%'], ['營收', '減少', '15%'], ['Flash', '佔', '營收'], ['營收成長', '來自', '網通應用'], ['較去年第三季9.8億元', '增加', '3.5%'], ['28.95億元', '增加', '1.1%'], ['6239', '公佈', '第三季財報'], ['季', '增', '18.3％'], ['每股', '盈餘', '1.42元'], ['由DRAM', '爲', '成長主力'], ['營運狀況', '符合', '第二季法說預期'], ['毛利率', '接近', '20％目標'], ['季', '減', '27%'], ['主要原因', '是', '客戶進行庫存調節'], ['客戶', '進行', '庫存調節'], ['矽品預估第4季營收', '落在', '188億元之間'], ['毛利率', '23%到', '25%'], ['營業利益率', '估', '在']]"
0,20151028_2712,大慶證券投顧盤前－歐美靜待FOMC聲明 聚焦中國十三五◆盤勢分析德股下跌1%，美股四大指數小漲小跌，不過型態上仍偏多不變。歐股回檔的原因除了中國經濟不振，多家企業財報獲利不如預 期，還有原油價格連3跌，能源股走疲拖累。美國經濟數據部分，耐久財訂單連2個月下降，消費者信心也低於預期，顯示經濟成長轉弱，市場觀望FOMC聲明，造成買盤縮手導致。蘋果財報優於預期，不過市場並不買單，截至今天早上，盤後漲幅不到1%，仍需要時間盤底。中國股市昨天單日V轉，連續3天站穩季線，趨勢由空翻多，十三五計畫即將出台，近期與中國連動較高的類股 可多留意。昨日台股下跌44點收8701點，成交量883億元，仍守穩5日線，短多趨勢不變。技術線型來看，目前季線扣抵 值約在8600附近，隨著季線扣抵值接下來兩個禮拜急速往下扣低，將有利台股上攻。盤後籌碼，外資賣超1.38億元，期貨空單2454口，淨多單仍高達20759口，外資態度仍偏多，有利台股上攻，建議聚焦美國 財報連動個股以及中國十三五計畫受惠股。盤面個股受國際股市回檔以及早盤陸股較為疲弱的拖累，權值股僅宏達電及低基期的DRAM及面板收紅，其餘皆小幅回檔。 不過，主流權值股半導體及NB仍呈現強勢整理的態勢，包括： 台積電、聯電、鴻海、新日興…等指標股，外資仍站在買方，研 判整理後將持續走高。金融股近期外資買超積極，包括：國泰金、富邦金、中壽及玉山金都已站穩季線，部分官股也明顯轉強，金融股成為撐盤要角。 中小型股部分，節能股及機器人相關個股近期表現較為亮眼，先前強勢的網通、紡織、汽車、生技…等雖然持續看好，但基期較高， 現階段以個股表現為主。中國十三五計畫即將出台，加上11/30為全球氣候變遷大會將在巴黎展 開，節能題材的太陽能持續強勢整理，而風電及LED近期也明顯轉強，指標股看碩 禾、昱晶、上緯、晶電及隆達。機器人相關個股在陽程獲得鴻海私募的激勵下，包括工具機的上銀、F-亞德、控制器的樺漢、新漢，以 及設備的盟立、均豪…等，短線行情可期。,"[['歐美', '靜待', 'FOMC聲明'], ['德股', '下跌', '1%'], ['獲利', '不如', '預 期'], ['消費者信心', '低於', '預期'], ['經濟成長', '轉', '弱'], ['市場', '觀望', 'FOMC聲明'], ['市場觀望FOMC聲明', '造成', '縮手導致'], ['蘋果財報', '優於', '預期'], ['盤後漲幅', '不到', '1%'], ['臺股下跌44點', '收', '8701點'], ['值', '約在', '8600附近'], ['外資賣', '超', '1.38億元'], ['淨多單', '高達', '20759口'], ['盤面個股', '受', '國際股市回檔'], ['宏達電DRAM', '收', '紅'], ['主流權值股半導體', '呈現', '整理態勢'], ['外資', '站在', '買方'], ['國泰金', '站穩', '季線'], ['金融股', '成爲', '要角'], ['陽程', '獲得', '鴻海私募激勵'], ['陽程', '獲得', '鴻海私募激勵'], ['相關個股', '包括', '等上銀']]"
0,20151028_2713,大昌投顧盤前分析◆盤勢分析1.昨日台股開低走低，盤中也受到陸股走跌影響，跌破8700點整數關卡，不過尾盤支撐力道浮現向上拉抬，終場以44.04點作收，力守8700點之上。三大類股齊跌，電子族群蘋概股走弱，而太陽能、DRAM、光通訊族群表現較為亮眼。傳產類股也呈現走跌，不過仍有像生技、航運、高爾夫相關族群向上攻高，航運雖走強但中長期仍需關注油價狀況。金融指數持續疲弱，不過回測10日線有守，且維持在季線之上，若指數要上攻，金融也不可缺席。而相對抗跌，再創波段新高，不過追價力道趨緩，恐需補量上攻較佳。2.從技術面觀察，大盤指數結束連三紅收黑，回測5日均線有守，盤勢似乎開始震盪，拉升幅度逐漸趨緩。指標部分，日KD轉為死亡交叉向下，對盤勢較為不利，但也可能逐漸開始鈍化，需配合量能觀察。量能部分，似乎有量價背離之疑慮，價跌量平接近900億，若要上攻恐需補量，指數才可望再創新高表現。從籌碼面觀察，外資結束連八買，不過賣超金額僅2.3億，投信結束連三買，金額約5.4億，自營商結束連二買，金額約28.9億，三大法人轉為賣超，恐對台股動能有所影響。3.國際股市方面，歐美股市皆走跌，其中歐股跌幅較為沉重，陸股震盪劇烈，尾盤拉升力守季線之上。而台股量價無法同步，恐將進入震盪整理，而明日有摩台指結算也需留意，預計區間為8600-8800點。題材上，蘋果財報已公布，銷售量在最新iPhone 6S／6S Plus帶動下成長36%，最近一季賣出近4805萬支 iPhone，不過略低於市場預期，而在中國市場銷售總額成長1倍，來到125.2億美元，貢獻整體營收近4分之1，整體財報表現在中國市場帶動之下，優於市場預期。,"[['盤中', '受到', '跌影響'], ['傳產類股', '呈現', '跌'], ['10日線', '有', '守'], ['指數', '上', '攻'], ['盤勢', '開始', '震盪'], ['日KD', '轉爲', '死亡向下'], ['價跌量', '上', '補量'], ['指數', '再創', '新高表現'], ['三大法人', '轉爲', '賣超'], ['恐', '有所', '影響'], ['尾盤拉', '升力', '守季線之上'], ['恐', '進入', '震盪整理'], ['區間', '爲', '8600-8800點']]"
