,News,All,SVO
0,20151020_3241,外銷訂單連6黑  年減4.5%經濟部統計處今天(10/20)公布外銷訂單統計，金額四百一十三億美元，和去年同期比較，年減4.5%，連續6個月衰退。不過比上個月成長六十三點二億美元，月增率為百分之十八。統計處表示，由於國際品牌手持行動裝置新品上市，帶動組裝代工及相關產業供應鏈訂單明顯增加，加上各貨品年底銷售旺季之備貨需求，讓九月外銷訂單較前月大幅成長，不過因去年同期比較基期高，因此外銷訂單仍呈現衰退，雖然連續六個月呈現負成長，不過衰退幅度有縮小的趨勢。而累積前三季訂單金額為一千一百二十六點六億美元，年減百分之三點一。,"[['經濟部統計處', '公佈', '外銷訂單統計'], ['月增率', '爲', '百分之十八'], ['統計處', '表示', '外銷訂單呈現衰退'], ['外銷訂單', '呈現', '衰退'], ['衰退幅度', '有', '縮小趨勢'], ['前三季訂單金額', '爲', '一千一百二十六點六億美元']]"
0,20151020_3242,華信投顧－驚驚漲階段◆盤勢分析雖然中國大陸公佈的經濟數據不如人意，但是持續回流的外資，卻將利空轉換為利空出盡的漲勢。今天陸股上半場表現疲弱，但是下半場買盤再度湧入，展開強力拉尾盤的走勢，上海綜合指數經過一天半的震盪盤整，終於確定站穩13週線，只要沒有重大意外利空，否則陸股應該可望就此展開波段反彈，而一旦陸股展開波段反彈，就如我們之前一再提示的，包括台灣在內的國際股市，都有機會隨著陸股展開一波看回不回的強勢震盪走勢。我們由最近四個交易日的走勢，可以很明顯的看出，台灣股市正處於驚驚漲的階段：現在一般投資人擔心的是：已經反彈超過1450點，而且面臨技術壓力，似乎隨時有展開波段回檔的可能。加上總統大選迫在眉睫，執政黨候選人的民調卻大幅落後在野黨，市場普遍擔心執政黨一旦確定勝選無望，有可能就此放手讓股市以自然落體的方式回檔。這就是一般投資人不敢進場的主要原因。但是，外資不斷回流，本土大戶資金似乎也並未出現逃離跡象，因此大盤總是呈現看回不回的震盪走高走勢。我們認為，只要明天不出現長黑走勢，大盤應該還有繼續反彈的空間。李永年 分析師★ 此研究報告著作權屬華信證券投資顧問(股)公司，切勿盜用或翻印，否則追究責任，決不寬貸 ★ 所有資料僅供參考，本公司不負盈虧責任,"[['經濟數據', '不如', '人意'], ['上海綜合指數', '確定', '站穩線'], ['陸股', '展開', '波段反彈'], ['陸股', '展開', '波段'], ['我們', '看出', '臺灣股市處於漲階段'], ['臺灣股市', '處於', '漲階段'], ['反彈', '超過', '1450點'], ['執政黨', '確定', '無望'], ['這', '就是', '主要原因'], ['本土大戶資金', '出現', '逃離跡象'], ['大盤', '呈現', '回震盪走走勢'], ['我們', '認爲', '大盤還有反彈空間'], ['大盤', '還有', '反彈空間'], ['此研究報告著作', '權屬', '股顧問公司'], ['所有資料', '僅供參考', '不負盈虧責任']]"
0,20151020_3243,日月光與經濟部合作 楠梓加工出口區建海棉步道 創生態圈圍籬日月光斥資2600萬元，打造海綿步道，透過多孔隙與多樣性生態廊道，創造生態綠圍籬。(圖片：日月光提供)日月光(2311-TW)文教基金會，與經濟部楠梓加工出口區合作，在加工區西側至北側外牆新建出入口，以綠色環保為出發點，斥資約2600萬元，以新時代綠色工法打造「海綿步道」，透過多孔隙、多樣性生態廊道，創造一條「生態綠圍籬」，日月光在今(20)日舉行啟用暨捐贈儀式，象徵具49年歷史之楠梓加工出口區從此走向開放的形象。日月光文教基金會秉持推廣環境永續之理念，為楠梓加工區興建總長度970公尺，總面積5792平方公尺之綠圍籬，並以現在最新的「基地保水JW海綿生態工法」進行設計，讓圍籬達到綠美化功能，路面鋪設如海綿般具備吸水、保水、過濾空氣之功能，雨水能以自然滲透方式滲入路面下，炎熱時可散發水汽降低地表氣溫，舒緩都市熱島效應，成為一條會呼吸的道路。經濟部楠梓加工區處長黃文谷表示，綠圍籬與行人出入口啟用後，每日將有2000名以上員工受益，可促進加工區內與區外的連結性、增加區內員工出入的便利性外，更達活絡地方經濟發展之效益。日月光文教基金會董事，也是日月光營運長吳田玉則指出，綠圍籬興建時除鋪設最新的海綿道路外，同時種下9205顆長虹木、大王仙丹、金露華及洋紅仙丹等植物，未來的固碳量1年約可達14.7公噸，而在人文與社區的面向上，設計舒適的休憩座椅，並與公車亭結合，開放於鄰近里民使用，成當地居民散步時的首選。,"[['日月光', '提供', '文教基金會'], ['日月光', '舉行', '啓用'], ['，', '象徵具', '49年曆史'], ['日月光文教基金會', '秉持', '永續理念'], ['總面積', '進行', '設計'], ['雨水', '滲入', '路面下'], ['楠梓加工區處長黃文谷', '表示', '每日有2000名以上員工受益'], ['每日', '有', '2000名以上員工受益'], ['則', '指出', '綠圍籬興建種等長虹木植物'], ['綠圍籬興建', '種', '等長虹木植物'], ['未來固碳量', '可達', '14.7公噸']]"
0,20151020_3244,倫元投顧－太陽能股再大漲◆盤勢分析今天台股的走勢和昨天差不多，盤中都在蘋概股持續向下盤跌及大立光持續破底的拖累下，而在平盤上下游走，不過也因週三將結算，尾盤拉高以上漲22點收在8653點，成交量為818億。國際主要股市目前也和台股差不多，從之前低檔上來的急拉大漲，近期皆已逼近反彈滿足點而漲勢變的溫吞。而台股近日更是在台積電漲不太動、蘋概股因iphone 6s銷售低預期法人賣，大立光率先破底、其它則是持續向下盤跌中，主要電子權值股漲不動，還能期待指數短期還有多少高點可期，而這兩天的拉尾盤撐指數，很明顯的就是在撐明天的結算。王信傑 分析師★ 此研究報告著作權屬倫元證券投資顧問(股)公司，切勿盜用或翻印，否則追究責任，決不寬貸 ★ 所有資料僅供參考，本公司不負盈虧責任,"[['倫元', '投顧', '分析差不多'], ['收', '在', '8653點'], ['成交量', '爲', '818億'], ['臺股', '銷售', '預期法人'], ['其它', '是', '盤跌中'], ['指數短期', '還有', '多少高點可期'], ['很明顯的', '就是', '撐明天結算'], ['所有資料', '僅供參考', '不負盈虧責任']]"
0,20151020_3245,"元大期貨台股期指盤後－高檔狹幅整理區 期指等待明結算◆盤勢分析週一美股小漲作收，帶動歐台期小漲16點，收在8639點，而週二一開盤就直接開在8644點，展現攻高企圖心，只可惜電子類股孤掌難鳴之下，期貨與現貨指數都沒有突破前一天的高點，全日呈現狹幅震盪，高低差距僅有34點，追價意願薄弱。不過終場期現貨轉為正價差5點，且舊制選擇權波動率指數下降1.59%至16.09，還是可以看出市場信心持穩的一面。若以法人籌碼布局情況來看，土洋法人在現貨市場買賣不同調，其中外資買超51.1億元，投信賣超5.6億元，自營商賣超13.2億元，合計買超現貨32.3億元；再由留倉淨部位來看，外資淨多單持平在20,965口，自營商則偏空操作348口，淨部位又轉為小額淨空單43口，三大法人合計淨多單稍微減少667口，但仍有15,799口的高水準。在10月合約結算前夕，外資留倉淨多單仍高達兩萬口以上的龐大規模，將使得週三結算日的行情波動更加值得投資人關注。就技術面來看，台股成交金額小幅擴增為821億元，行情走揚但無法帶出量能一直是多方攻勢的隱憂。盤面上以週一較弱的電子期漲幅較為明顯，金融與非金電期都以黑棒作收；不過目前除了金融期之外，所有期指都朝向短中期均線多頭排列的方向發展，並且沿著5日均線緩步走揚，配合外資淨多單的加持，使得短線依然有利多方。","[['小漲作收', '帶動', '歐臺期漲'], ['期貨與現貨指數', '開在', '8644點'], ['高低差距', '僅有', '34點'], ['，', '追', '價'], ['終場期現貨', '轉爲', '正價差5點'], ['舊制選擇權波動率指數下降', '還是', '市場信心持穩一面'], ['市場信心', '持', '穩'], ['市場信心', '持', '穩'], ['由', '留', '倉淨'], ['單', '持平在', '20'], ['自營商', '偏', '操作348口'], ['淨部位', '轉爲', '43口單'], ['淨', '減少', '667口'], ['淨多單', '高達', '龐大規模']]"
0,20151020_3246,摩根大通：是時候加碼新興市場！首選台灣、韓國、印度資料圖片：afp據《Barrons》報導，隨著新興市場近期內出現了一波反彈潮，摩根大通 (JPMorgan) 建議投資人目前或可以開始考慮加碼新興市場。摩根大通分析師 Adrian Mowat 在週一發布的報告內指出，目前新興市場正出現空單回補潮，而這也意味著新興市場經濟開始出現復甦。摩根大通表示，事實上情況並沒有大家想像的這麼糟，一些重要的產業部門的 EPS 預估值皆在向上修正，而整體經濟環境的回穩，也讓公司股價的基本面有了相對應的支撐，同時政府刺激經濟的力度也在加大當中，這些條件皆有利於新興市場的前景。而除了中國股市之外，投資人還可以考慮持有哪些新興市場呢？ Adrian Mowat 建議可以買入基本面較為強健的國家和產業，而不要在空頭回補的市場中追高。Adrian Mowat 指出，摩根大通曾在八月底上調了韓國和台灣的投資評級，建議投資人可以關注政府支持的相關產業，以及受益於季節性因素的科技產業。以台股與韓股來看，台股已自八月中旬該波拋售潮的低點，上漲了 16.7%。而韓股也有 11% 的漲幅。 台股近月走勢圖 韓股近月走勢圖Mowat 並認為印度股市雖然短期表現可能落後，但仍然是新興市場不錯的機會之一。同時，摩根大通依然對巴西及俄羅斯持悲觀看法，認為這兩個國家的經濟正在持續衰退當中。但據《CNBC》此前報導，高盛與摩根大通的看法恐怕是大相逕庭，高盛認為新興市場最近的反彈只是因為先前超跌了，但其實經濟基本面依然尚未好轉。高盛於上週曾發布報告指出，隨著原物料商品價格急遽性的崩跌，加上美國聯準會 (Fed) 即將進入升息循環，第三波世界性的金融危機，恐將從新興市場開始掀起。,"[['JPMorgan建議投資人', '開始', '考慮加碼新興市場'], ['摩根大通分析師Adrian Mowat', '指出', '新興市場出現補潮'], ['新興市場', '出現', '補潮'], ['這', '意味著', '新興市場經濟開始出現復甦'], ['新興市場經濟', '開始', '出現復甦'], ['摩根大通', '表示', '事實上情況並沒有大家想像糟'], ['事實上情況', '並沒有', '大家想像糟'], ['政府', '刺激', '經濟'], ['政府', '刺激', '經濟'], ['政府刺激經濟力度', '在', '加大當中'], ['這些條件', '有利於', '新興市場前景'], ['投資人', '考慮', '持有哪些新興市場'], ['摩根大通', '上調', '投資評級'], ['投資人', '關注', '相關產業'], ['臺股', '自', '拋售潮低點'], ['韓股', '也有', '11%漲幅'], ['Mowat', '認爲', '是不錯機會之一'], ['摩根大通', '持', '悲觀看法'], ['這兩個國家經濟', '正在', '衰退當中'], ['高盛看法', '是', '大相逕庭'], ['高盛', '認爲', '只是'], ['最近反彈', '只是', '因爲'], ['發佈報告', '指出', '第三波世界性金融危機掀起'], ['美國聯準會Fed', '進入', '升息循環']]"
0,20151020_3247,自動化設備及元件廠台灣氣立10/27每股70元IPO專業氣動元件製造廠商台灣氣立()預計將於10月27日掛牌上市，將為10月以來繼RFID電子標籤廠商韋僑科技()之後另一正式IPO的廠商，台灣氣立2015年1-9月營收為10.86億元，較去年同期成長4.86%。台灣氣立今天並正式敲定上市承銷價為每股70元；而今天台灣氣立的興櫃成交價格為80元。台灣氣立2015年上半年財報內容顯示，營收6.64億元，毛利率為51.14%，稅前盈餘1.8億元，稅後盈餘1.33億元，每股稅後盈餘為2.19元。台灣氣立以生產中高階氣動元件為主，目前元件品項已高達30多萬項，每年仍自主研發逾10 種以上系列的新產品，以滿足客戶一站式購足服務。台灣氣立產品利基為提供客戶少量多樣、客製化、模組化以及高性價比優勢，不但可有效為客戶提升生產效率，且成功避開競爭激烈的規格化大量的市場，取代日本同類型產品搶下市占率；同時不斷改善製程及提昇品質，而維持50%以上的高毛利水準。公司目前銷售產品以中高階精密的執行元件占營收53.23%，銷售單價即為中國同業的2-3倍，產品包括自動化夾取、上下料、旋轉、更換元件的滑台氣缸、氣動夾爪、迴轉氣缸等，廣泛的為電子業及機械設備廠所採用。台灣氣立目前客戶在自動化設備應用市場主要以電子產業及機械設備業為主，各占約40%比例，電子業以生產高品質的精密機台應用為主，囊括蘋果及非蘋陣營手機製造以及3C類客戶；而為避免客戶過度集中並分散風險，搭配多元化市場策略，公司已成功攻下不同產業領域客戶，包括輪胎、汽車、食品及醫療等新領域，今年主要成長動能即是來自新客戶的貢獻，其中紡織業及汽車業的成長最為明顯，目前二者合併約占10%之營收貢獻。,"[['臺灣氣立', '預計', '掛牌'], ['上市承銷價', '爲', '每股70元'], ['興櫃成交價格', '爲', '80元'], ['財報內容', '顯示', '6.64億元'], ['毛利率', '爲', '51.14%'], ['稅後盈餘', '爲', '2.19元'], ['元件品項', '高達', '30多萬項'], ['客戶一站式', '購', '足'], ['臺灣', '氣立', '產品利基'], ['銷售單價', '爲', '中國同業2-3倍'], ['產品', '包括', '等氣缸'], ['臺灣', '氣立', '爲主'], ['各', '佔', '約比例'], ['以', '生產', '高品質'], ['公司', '攻下', '產業領域客戶'], ['成長動能', '是', '來自新客戶貢獻']]"
0,20151020_3248,"iPhone 6S救台灣！ 9月外銷訂單連6黑 但衰退幅度收斂未惡化受惠iPhone 6S系列產品上市，年底銷售旺季備貨潮拉動，經濟部今(20)日公佈的9月外銷訂單儘管連續6個月衰退，以金額413.5億美元、年減4.5%，但減幅已較上個月收斂3.8個百分點，未惡化衝破雙位數關卡。其中，9月資訊通信產品接單135.5億美元，創歷年同月新高。受到全球經濟衰退的拖累，外銷訂單的年增率從今年4月起至8月一路走黑，分別是-4% 、-5.9% 、-5.8% 、-5、-8.3%。根據經濟部今天公佈的9月份外銷訂單表現，金額為413.5億美元，年增率為-4.5%，月增率為18%。從年增率來看，儘管連續6個月負成長，但衰退幅度已經收斂，較8月份減少3.8個百分點。第3季外銷訂單1,126.6億美元，季增2.7%、年減5.9%。累計前3季外銷訂單3,297.1億美元，年減3.1%。外銷訂單稍稍轉佳，經濟部表示，主要是國際品牌手持行動裝置新品上市，帶動組裝代工及相關產業供應鏈訂單明顯增加，加上各貨品年底銷售旺季之備貨需求。按貨品別觀察，資訊通信產品創歷年同月新高，年增5.4%；電子產品因半導體客戶端庫存尚在調整，及液晶電視接單減少，致年減5.6%；精密儀器則年減15.9%。由於油價仍較上年同月跌5成以上，致塑橡膠製品及化學品接單年減13.4%及8.2%；國際鋼市低迷，價格下跌，基本金屬接單年減19.0%；機械產品則因全球經濟展望不佳，廠商機械設備投資轉趨保守，各主要接單地區均呈減少，年減14.3%。主要訂單地區部分，經濟部表示，9月接自美國及歐洲訂單年增率均呈正成長，各0.6%、1.8%，但接自中國大陸及香港、東協六國、日本訂單仍衰退。","[['外銷訂單', '連', '6黑'], ['衰退幅度', '收斂', '6S系列產品'], ['金額', '爲', '413.5億美元'], ['年增率', '爲', '4.5%'], ['月增率', '爲', '18%'], ['外銷訂單', '轉', '佳'], ['經濟部', '表示', '是上市'], ['，', '帶動', '組裝代工'], ['年', '增', '5.4%'], ['調整', '致', '年減5.6%'], ['油價', '跌', '5成以上'], ['基本金屬', '接', '單年減19.0%'], ['單年', '減', '19.0%'], ['經濟部', '表示', '自']]"
0,20151020_3249,鉅亨晚報2015年10月20日◇重要新聞內容■醫護納勞基法 再等八年■南市爆隨機殺人 女店員遭刺胸命危■洪孟啟反批邱于芸：公文送去  羊入虎口◇財經新聞■A9亮相倒數王雪紅親上陣發表 高通放連結力挺兼宣示主權■柱版證所稅何去何從？毛治國：有投資界民意基礎 會繼續支持■不妙！失業率回升 發電量急降 中國經濟前景埋陰霾■GDP能否保1%？ 張盛和：要看國際動能復甦 掌控不在台灣■i6s開賣電信業大手筆搶客 恐衝擊Q4獲利衰退18-26.5%[NT:PAGE=$]◇重要指標■區8月經常賬盈餘按月意外大幅收窄至177億■台灣9月外銷訂單額年跌意外收窄至4.5%■日本9月機械工具訂單終值按年急跌19.1%■德國9月PPI年跌擴至2.1%超預期◇亞洲股市■台灣20日收盤漲22.10點或0.26%，報8653.6點，成交金額818.29億元。■台股今(20)日三大法人集中市場買超32.32億，外資買超51.12億，投信賣超5.55億，自營商自行買賣賣超0.21億，自營商避險賣超13.02億。■日經225指數今(20)日收盤上漲75.92點或 0.42%，收盤報 18207.15點。盤中高見18253.13點，低至18147.98點，開盤報18245.54點。■韓國Kospi指數今(20)日收盤上漲9.09點或 0.45%，收盤報 2039.36點。盤中高見2040.24點，低至2026.67點，開盤報2031.50點。■澳洲S&P/ASX 200指數今(20)日收盤下跌34.109點或 0.65%，收盤報 5235.60點。盤中高見5269.70點，低至5228.70點，開盤報5269.70點。■上証指今(20)日收報3425.33點，漲38.63點或1.14%。■今(20)日收報22989.219點，下跌86.39點或0.37%。◇台北匯市■兌美元匯價收盤貶9.2分，達32.510元，成交金額7.72億美元。開盤價為32.550元，盤中最高32.330元、最低32.580元。,"[['女店員', '遭', '命危'], ['女店員', '遭', '命危'], ['經濟前景', '埋', '陰霾'], ['GDP', '保', '1%'], ['動能復甦i6s', '開賣', '恐衝擊'], ['恐衝擊', 'Q4獲利衰退', '18-26.5%'], ['常賬盈餘', '收窄至', '177億臺灣'], ['機械工具訂單終值', '報', '818.29億元金額'], ['高', '見', '報18245.54點'], ['盤中高', '見', '2040.24點'], ['高', '見', '5269.70點'], ['低', '至', '5228.70點'], ['開盤', '報', '5269.70點'], ['上證', '指', '收報3425.33點'], ['開盤價', '爲', '32.550元']]"
0,20151020_3250,群益期貨台股期權盤後－追高意願薄弱 台股高檔盤旋◆盤勢分析台股昨天雖然收了一根十字線，但是今天還是開小高越過了它，是屬於一個延續的格局，並非是反轉的型態，成交量維持在八百二十億左右，目前短線上的結構依舊是早盤附近會是一個高點，不過比較不一樣的是，今天尾盤有比較往上拉抬的狀況，再加上電子期一反昨天頹勢而開高走高，明天結算仍是多方站上風。外資期貨淨多單不變，仍抱有兩萬多口淨多單，偏多意圖不必多說；自營商亦持有大部位的賣出賣權。在10月份選擇權籌碼中，整體賣權OI大於買權OI的口數擴增至二十一萬六千多口，屬相當偏多的結構。買賣權OI密集壓縮在8500~8700之間。綜合以上，明天10月合約將要結算，以選擇權籌碼的布局相當密集，再來法人偏多籌碼頗多，所以會在高檔結算，但是不會偏離目前太大，且當天波動亦不會很大，因此在操作上還是偏短提早獲利了結。,"[['－', '追', '意願薄弱'], ['盤勢臺股', '收', '一根十字線'], ['不一樣的', '是', '尾盤有拉抬狀況'], ['尾盤', '有', '拉抬狀況'], ['早盤附近', '開', '昨天頹勢'], ['自營商', '持有', '賣出賣權'], ['買權OI口數', '擴增至', '二十一萬六千多口'], ['整體賣權OI大於', '屬', '偏多結構'], ['買賣權OI', '壓縮在', '~8700之間']]"
0,20151020_3251,"亞洲投顧 獲利全壘打 盤後分析◆盤勢分析台股今日以平高盤開出，指數來到8663點後開始震盪小幅拉回整理，終場小漲22點，以8653點作收,成交量為818億元。台北股市今日一樣處於橫向整理態勢，指數上下震盪空間不大，走勢呈現緩步墊高的狀況，從今日的收盤位置看來已創下了本波段反彈以來的收盤新高，從指數的位置與成交量的變化可以看出，目前仍是屬於多方掌控，只要大盤後續補量將有機會出現較大的上漲空間。就目前大盤整體狀況仍屬個股輪動的表現盤，週三(10月21日)將結算，後勢仍需留意外資台指淨多單的變化，將影響市場操作的信心，依目前盤面仍數個股輪動表現的情形，主要上漲的個股仍屬落後補漲的中小型個股為主，短線連漲三天後的個股建議不宜再追，積極佈局強勢股逢拉回整理後的買點。作者：亞洲投顧 楊基政 分析師以上資料僅供參考,投資時應審慎評估","[['指數', '來到', '8663點'], ['震盪', '拉', '整理'], ['成交量', '爲', '818億元'], ['臺北股市', '處於', '橫向整理態勢'], ['走勢', '呈現', '高狀況'], ['有機會', '出現', '上漲空間'], ['整體狀況', '屬', '個股輪動表現盤'], ['後勢', '需', '留意外資臺指淨多單變化'], ['意外資臺', '指', '淨多單變化'], ['上漲個股', '屬', '中小型個股'], ['強勢股', '逢', '整理後買點']]"
