,News,All,SVO
0,20151028_2639,日盛投顧：台股技術面，短多有壓，中線有轉強機會1.週三台股在美股回檔壓力下，加上蘋概股利多不漲以及聯發科再度轉弱，引發市場短線賣壓，終場指數下跌35.33點，以8665.99點作收，成交量為802.45億元。2.短線台股在指數過高，但KD指標並未同步過高之下，加上進入壓力區但成交量無法放大，出現短多獲利回吐賣壓，從技術面看，五日均線與十日均線即將死亡交叉，對短多造成壓力，不過低檔月線持續走升，且季線即將翻揚之下，中線有逐漸轉強機會，後續觀察本月29日凌晨，FOMC利率會議結論，將對美國升息時間點的預期，為短線轉強或持續修正的關鍵，強勢月線8530點不破，弱勢低檔頸線8488點不破，原則上都可視為漲多回檔。3.三大法人賣超5.81億元，外資賣超11.66億元，投信買超3.34元，自營商買超2.51億元。原主流不變 留意車用相關、生技、第三方支付、網通、PA、光纖等法人買超股1.電子類股仍為當前主流，車用電子3552同致轉強，6279胡連、3665F-貿聯高姿態整理，2355敬鵬回測季線轉強，仍為多方觀察重點，第三方支付在3687歐買尬成為警示股下進入休息，週三再度轉強，LED在跌深後2499東貝營收加溫、3698隆達受惠於香港燈飾展買盤進場，光電4935F-茂林第三季營收創新高，加上新廠年底完工，股價創波段新高，4960奇美材中國客戶比重拉高，帶動業績，網通在進入旺季之下，2485兆赫法人買盤推升股價，6285啟碁受惠於車聯網應用，3558神準利基型企業用戶市場發酵，股價轉強，而蘋果公佈財報優於預期，但相關指標股2474可成、2354鴻準、4938和碩等皆未有表現，後續仍觀察蘋果股價表現，2454聯發科將在30日法說，市場悲觀預期導致股價拉回。2.傳產近期油價再度回落，台塑四寶進入震盪，紡織短線漲多進入整理，中多尚未破壞，指標股1476儒鴻、4426利勤等，生技股在民進黨總統參選人提出政策利多之下，週三再度轉強，高價股4174浩鼎守穩10日均線，4130健亞、4129聯合、4107邦特等業績股走高。3.金融股近期持續整理，包括2881富邦金、2882國泰金、2884玉山金等外資買盤並未鬆動，未來仍有表現機會，惟需留意當金融股轉強，是否出現拉金融出電子的可能性。,"[['臺股技術面', '有', '壓'], ['中線', '有', '1'], ['成交量', '爲', '802.45億元'], ['中線', '有', '轉強機會'], ['逐漸', '轉', '強'], ['對預期', '爲', '短線轉關鍵'], ['自營商買', '超', '2.51億元'], ['電子類股', '爲', '當前主流'], ['在', '進入', '旺季'], ['啓碁', '受惠於', '車聯網應用'], ['蘋果公佈財報', '優於', '預期'], ['東貝營收加溫', '觀察', '蘋果股價表現'], ['東貝營收加溫', '觀察於', '香港燈飾展'], ['市場悲觀預期', '導致', '股價拉回'], ['臺塑四寶', '進入', '震盪'], ['參選人', '提出', '利多'], ['參選人', '提出', '利多'], ['週三', '轉', '強']]"
0,20151028_2640,笑傲全球！張忠謀：半導體零成長 但台積電還有10%成長率台積電() ()董事長張忠謀今(28)日表示，第4季科技業展望不佳，今年全球半導體零成長率，但台積電還有10%的成長，明年的展望會相當不錯，會比今年好。張忠謀今天下午出席活動時對媒體表示，全球半導體業從2000年起進入成長相當緩慢的階段，但一個半導體公司做得好的話，成長可望比整個產業好得多。他以台積電為例表示，「在過去好幾年，台積電的成長都比世界半導體業快很多」，期待台積電可以繼續維持。台灣今年經濟成長率「保1%」困難，引發外界憂心。對此，張忠謀表示，現在台灣經濟並不是這麼好，光是擔心也沒什麼用，還是要做，主要是增強競爭力，還是要轉型。張忠謀強調，台積電自己跟自己比，今年第4季確實比較差一點，但跟整個半導體比較起來還是不錯，「今年整個世界半導體成長大概是零左右，但我們大概還有10％的成長」。展望明年，張忠謀認為，明年台積電應該還是會相當不錯，明年還是會比今年更好。,"[['28日', '表示', '不佳'], ['臺積電', '還有', '10%成長'], ['今天下午', '出席', '活動'], ['張忠謀', '表示', '好'], ['全球半導體業', '進入', '緩慢階段'], ['他', '爲', '例'], ['經濟成長率保困難', '引發', '外界憂心'], ['張忠謀', '表示', '好'], ['光', '是', '擔心'], ['張忠謀', '強調', '我們還有10％成長'], ['整個世界半導體成長', '是', '左右零'], ['我們', '還有', '10％成長'], ['張忠謀', '認爲', '不錯']]"
0,20151028_2641,"亞洲投顧 富貴福臨 籌碼動能 盤後分析◆盤勢分析一樣是整理盤，個股表現，如果光以大盤來看的話，這裏似乎有點黏住了，且今日外資賣超，期貨的未平倉多單也掉到二萬口以下，雖然仍是17910的高水位，但量能不出，也沒有要衝關的樣子，因此，對於大盤不用太多期待，短線仍是個股為主。創新高的個股還是很多，F-廣華，F-豐祥還在衝，生技族群也在未來會有政策利多的情況下今日紛紛表態，但值得留意的是，過去生醫漲的多是新藥，但這次在十三五計劃裏拉出的健康中國，走的是醫材族群，新藥是個夢，會不會成不知道，還要很多年才有結果，但台灣的醫材在全球是很有競爭力的，這幾日如果大盤壓回個股有回檔機會的話，建議可在這族群裏，尋找好標地。作者：亞洲投顧 謝宗霖 分析師以上資料僅供參考,投資時應審慎評估","[['盤勢分析', '是', '整理盤'], ['今日外資', '賣', '未平倉'], ['短線', '仍是', '個股爲主'], ['會', '有', '利多'], ['但', '值得', '留意'], ['生醫漲的', '是', '新藥'], ['走的', '是', '醫材族羣'], ['新藥', '是', '個夢'], ['臺灣醫材', '是', '有競爭力的'], ['很', '有', '競爭力']]"
0,20151028_2642,鉅亨晚報2015年10月28日◇重要新聞內容■柯文哲准辭 研考會主委陳銘薰：解脫了■推動「製造業生產力4.0」 行政院三管齊下 加速點火■蘋果EPS 1.96美元勝市場預期 中國銷售總額成長1倍◇財經新聞■新北、花蓮青年宅實際租售價不到7折 甭驚拉低區域行情■蘋果財報獲利大增31% 蘋概股慶祝行情落空零星表現■Uber估值可望衝上700億美元 但真這麼值錢嗎？■油國陸續撐不住！俄羅斯憂明年儲備基金將耗光■買101 董事會同意黑石集團實地查核[NT:PAGE=$]◇重要指標■法國10月消費者綜合信心意外微降至96■德國11月GfK消費信心續降至9.4 符預期◇亞洲股市■台灣28日收盤跌35.33點或0.41%，報8665.99點，成交金額800.01億元。■台股今(28)日三大法人集中市場賣超5.81億，外資賣超11.66億，投信買超3.34億，自營商自行買賣賣超0.23億，自營商避險買超2.74億。■日經225指數今(28)日收盤上漲125.98點或 0.67%，收盤報 18903.02點。盤中高見18925.51點，低至18815.12點，開盤報18826.94點。■韓國Kospi指數今(28)日收盤下跌2.14點或 0.1%，收盤報 2042.51點。盤中高見2045.67點，低至2032.39點，開盤報2045.67點。■澳洲S&P/ASX 200指數今(28)日收盤下跌10.93點或 0.2%，收盤報 5335.22點。盤中高見5354.90點，低至5319.40點，開盤報5346.20點。■截止收盤，報3375.20點，跌59.14點，跌幅1.72%。■收報22956.57點下跌186.16點或0.8%。◇台北匯市■兌美元匯價收盤貶1分，達32.686元，成交金額7.07億美元。開盤價為32.710元，盤中最高32.400元、最低32.710元。,"[['實際租售價', '不到', '7折'], ['慶祝行情', '落空', '零星表現'], ['儲備基金', '耗', '買101'], ['董事會', '同意', '實地查覈NT'], ['微', '降至', '28日收盤35.33點'], ['盤中高', '見', '18925.51點'], ['盤中高', '見', '2045.67點報'], ['盤中高', '見', '5354.90點'], ['兌美元匯價收盤', '貶', '1分'], ['開盤價', '爲', '32.710元']]"
0,20151028_2643,"亞洲投顧 獲利全壘打 盤後分析◆盤勢分析台北股市今日開低震盪走低，走勢跟昨日很像，雖然蘋果昨日公布財報優於預期，但也沒有激勵蘋果概念股走強，所幸盤面上有生技族群扮演撐盤的角色，讓台股人氣不墜，終場加權下跌35點，以8665點作收，成交金額萎縮至800億元。台股今日表現依然屬於淺水無大魚的狀態，指數上漲不易持續再作震盪拉回整理的走勢，從今日的盤面上表現最為明顯的就是生技族群，主要受惠總統參選人蔡英文提出的生技政策牛肉，激勵生技族群今日表現大漲，另外一方面剛好也符合近期盤面上的中小型股活蹦亂跳的輪動，由於大盤指數來到8600點之上，除了成交量能無法放大之外，另一個就是投資人的信心都尚未完全回復，經歷過了2800點的大跌過後，死的死傷的傷套牢的套牢，元氣才剛大傷怎麼可能馬上就會復原，所以成交量能短時間無法放大的情形這也是預料中的事，所以操作上就不需要太過貼於大盤，把操作的重心放在精選的個股，就過往的經驗告訴我們，當大家不太敢進場佈局的階段通常都是最好賺的，掌握主流強勢股來回操作，將是不錯的一個選擇。作者：亞洲投顧 楊基政 分析師以上資料僅供參考,投資時應審慎評估","[['臺北股市', '開低', '震盪'], ['財報', '優於', '預期'], ['所幸盤面上', '激勵', '有生技族羣扮演撐盤角色'], ['成交金額', '萎縮至', '800億元'], ['今日表現', '屬於', '無大魚狀態'], ['指數上漲', '持續再作', '整理走勢'], ['明顯的', '就是', '生技族羣'], ['另一個', '就是', '投資人信心回覆'], ['，', '經歷', '2800點大跌'], ['大家', '進場', '佈局'], ['敢', '進場', '佈局']]"
0,20151028_2644,台股小跌35點  收8665點蘋果財報揭露成績還不錯，但是股價沒有太強勢的表現，影響所及，台廠供應鏈也熄火，對台股行情帶來壓力。重量級電子股走勢普遍不強，非電子股零星演出，只有生技類股行情較為出色。大盤終場下跌35點，指數收在8665點，成交量802億元。受制於上檔半年線壓力，法人認為近期行情將偏向震盪。（張佳琪報導）蘋果第三季財報不負眾望繳出理想成績，但是股價沒有激情表現，台廠供應鏈受到影響由大立光領跌。少了蘋果光護持，台股有些黯淡，倒是非蘋陣營的宏達電走勢不錯，市場對新機銷售以及法說會仍有期待。電子股缺乏主流股，非電子股則只有生技類股表現較強，平均漲幅達3%，主要是反應總統參選人蔡英文提出的生技政策利多。大盤隨著個股表現呈現盤下震盪，終場下跌35點，收8665點。新光投信協理謝學雲表示，八千六以上是較沈重的套牢帶，盤勢震盪難免。謝學雲說：「這個階段八千六附近，本就面臨解套賣壓及獲利了結賣壓的雙重反壓出現，所以盤不容易一路往上攻」。本週國內仍有許多法說會相關消息，國際市場則聚焦美國聯準會的會議，會後是否針對景氣與利率政策動向發表看法，值得留意。（圖：證交所提供）,"[['小跌', '收', '蘋果財報'], ['股價', '沒有', '強勢表現'], ['大盤', '下跌', '35點'], ['法人', '認爲', '震盪'], ['張佳琪', '報導', '蘋果第三季財報'], ['股價', '沒有', '激情表現'], ['臺廠供應鏈', '受到', '影響'], ['市場', '有', '期待'], ['電子股', '缺乏', '主流股'], ['平均漲幅', '達', '3%'], ['新光投信協理謝學雲', '表示', '八千六以上是較沈重套牢帶'], ['八千六以上', '是', '較沈重套牢帶'], ['八千六附近', '面臨', '解套賣壓'], ['國內', '有', '許多法說消息'], ['許多法', '說', '消息'], ['國際市場', '聚焦', '美國聯準會會議']]"
0,20151028_2645,日盛投顧盤後－短線修正指標背離 偏多不變◆盤勢分析     1.週三台股在美股回檔壓力下，加上蘋概股利多不漲以及聯發科再度轉弱，引發市場短線賣壓，終場指數下跌35.33點，以8665.99點作收，成交量為802.45億元2.短線台股在指數過高，但KD指標並未同步過高之下，加上進入壓力區但成交量無法放大，出現短多獲利回吐賣壓，從技術面看，五日均線與十日均線即將死亡交叉，對短多造成壓力，不過低檔月線持續走升，且季線即將翻揚之下，中線有逐漸轉強機會，後續觀察本月29日凌晨，FOMC利率會議結論，將對美國升息時間點的預期，為短線轉強或持續修正的關鍵，強勢月線8530點不破，弱勢低檔頸線8488點不破，原則上都可視為漲多回檔。3.三大法人賣超5.81億元，外資賣超11.66億元，投信買超3.34元，自營商買超2.51億元。原主流不變 留意車用相關、生技、第三方支付、網通、PA、光纖等法人買超股1.電子類股仍為當前主流，車用電子3552同致轉強，6279胡連、3665F-貿聯高姿態整理，2355敬鵬回測季線轉強，仍為多方觀察重點，第三方支付在3687歐買尬成為警示股下進入休息，週三再度轉強，LED在跌深後2499東貝營收加溫、3698隆達受惠於香港燈飾展買盤進場，光電4935F-茂林第三季營收創新高，加上新廠年底完工，股價創波段新高，4960奇美材中國客戶比重拉高，帶動業績，網通在進入旺季之下，2485兆赫法人買盤推升股價，6285啟碁受惠於車聯網應用，3558神準利基型企業用戶市場發酵，股價轉強，而蘋果公佈財報優於預期，但相關指標股2474可成、2354鴻準、4938和碩等皆未有表現，後續仍觀察蘋果股價表現，2454聯發科將在30日法說，市場悲觀預期導致股價拉回。2.傳產近期油價再度回落，台塑四寶進入震盪，紡織短線漲多進入整理，中多尚未破壞，指標股1476儒鴻、4426利勤等，生技股在民進黨總統參選人提出政策利多之下，週三再度轉強，高價股4174浩鼎守穩10日均線，4130健亞、4129聯合、4107邦特等業績股走高。3.金融股近期持續整理，包括2881富邦金、2882國泰金、2884玉山金等外資買盤並未鬆動，未來仍有表現機會，惟需留意當金融股轉強，是否出現拉金融出電子的可能性。,"[['短線修正指標', '背離', '.盤勢'], ['市場短線', '賣', '壓'], ['中線', '有', '轉強機會'], ['逐漸', '轉', '強'], ['對預期', '爲', '短線轉關鍵'], ['自營商買', '超', '2.51億元'], ['電子類股', '爲', '當前主流'], ['在', '進入', '旺季'], ['啓碁', '受惠於', '車聯網應用'], ['蘋果公佈財報', '優於', '預期'], ['東貝營收加溫', '觀察', '蘋果股價表現'], ['東貝營收加溫', '觀察於', '香港燈飾展'], ['市場悲觀預期', '導致', '股價拉回'], ['臺塑四寶', '進入', '震盪'], ['參選人', '提出', '利多'], ['參選人', '提出', '利多'], ['週三', '轉', '強']]"
0,20151028_2646,永豐期貨台指選擇權盤後－短多熄火日線下跌收黑 指數失守8700◆盤勢分析期貨走勢週三下跌56點收在8638點。價差方面，逆價差擴至27.99點，電子期逆價差擴至1.24點，金融期轉為逆價差4.04點，摩台期轉為逆價差1.1點。由籌碼面來觀察，三大法人於現貨市場持續賣超5.81億；而在淨部位方面，三大法人多單減碼3272口，淨多單降至10134口，其中外資多單減碼2849口，淨多單降至17910口；另外十大交易人中的特定法人，全月份多單減碼214口，淨多單降至13726口，顯示目前法人與大額交易人對台股短線續彈預期仍持續未變。期貨行情走勢方面，歐美股市連二日出現拉回走勢，帶動週三早盤以下跌9點開出，而現貨開低後行情一度拉高由黑翻紅，但10點後隨著陸股跌勢放大後盤勢一路震盪走低，而陸股早盤收盤後指數再度震盪拉高，加上連二日台股尾盤現貨買盤敲進拉高指數，最終期貨以下跌56點作收。技術面觀察，週三大盤開低走低以帶下影線小黑K回測10日線，而成交量能縮小至802億水準，短線量價結構仍不利多方續航。而以日線型態來看，目前指數日K連二黑失守5日線支撐，且指數波段反彈以來竭盡缺口始終未回補，而多項技術指標出現背離格局，趨勢仍為高檔整理格局。操作上建議可在月線與半年線間來回操作並請嚴設停損。選擇權分析選擇權從成交量來觀察，11月份買權集中在8800點，賣權集中在8500點。未平倉量部份，買權大量區至9000點，而賣權大量區至8300點。全月份未平倉量put/call ratio由1.06降至0.9，為近期首次低於中性值1，顯示選擇權結構有轉趨中性偏空跡象。11月買權平均隱含波動率由11.65%降至11.11%，賣權平均隱含波動率由15.81%升至16.33%，買權降賣權升，週三指數下跌收黑仍守於10日均線之上，短線持續高檔整理型態，操作上建議積極者可以買進勒式價差策略因應可能的突破性波段行情。,"[['永豐期貨臺', '指', '跌收黑指數失守盤勢'], ['線下', '跌收', '黑'], ['金融期', '轉爲', '逆價差4.04點'], ['摩臺期', '轉爲', '逆價差'], ['三大法人', '減', '3272口'], ['特定法人', '減', '214口'], ['淨多單', '降至', '13726口'], ['歐美股市', '出現', '拉回走勢'], ['成交量', '縮小至', '802億水準'], ['二黑', '失守', '5日線'], ['技術指標', '出現', '背離'], ['趨勢', '爲', '整理格局'], ['11月份買權', '集中在', '8800點'], ['選擇權結構', '有', '偏跡象'], ['中性', '偏', '空'], ['平均隱含波動率', '升至', '16.33%'], ['收黑', '守於', '10日均線之上'], ['積極者', '買進', '勒式價差策略'], ['積極者', '買進因', '突破性波段行情']]"
0,20151028_2647,經商便利度我國全球11名  歷年來最佳世界銀行發布「2016經商環境報告」，我國在189個經濟體中，經商便利度全球排名第11名，較去年的第19名進步8名，國發會指出，這是我國政府從2008年10月宣示推動改革以來全球最佳排名，7年改革共推進50名。國發會分析指出，名次能大幅邁進，主要是因應國際，調整組織並在經商法制與國際接軌，同時建立單一窗口網站，以提升政府效能及網路整備度，希望明年我國可以擠進前10名。經商便利度排名新加坡仍維持第一，紐西蘭第二，第三到第十丹麥、韓國、香港、英國、美國、瑞典、挪威、芬蘭。而我國排名第11名，比澳洲、加拿大、德國、馬來西亞、法國、日本及中國大陸都還要好。,"[['最佳世界銀行', '發佈', '2016經商環境報告'], ['會', '指出', '這是我國政府宣示推動最佳排名'], ['這', '是', '我國政府宣示推動最佳排名'], ['我國政府', '宣示', '推動最佳排名'], ['國發會分析', '指出', '名次邁進是應國際'], ['名次邁進', '是', '應國際'], ['我國', '擠進', '前10名']]"
0,20151028_2648,國泰證赴曼谷推廣台商回台掛牌國泰證券攜手安永聯合會計師事務所和理律法律事務所，共同赴泰國曼谷舉辦「2015年前進台灣資本市場研討會」，並邀請台灣證券交易所主管蒞臨指導，一同參訪當地台商企業，致力推動優質海外台商企業回台第一上市櫃。「2015年前進台灣資本市場研討會」共吸引近30家台商企業、近50位企業負責人和高階主管與會， 國泰證券董事長朱士廷指出，近年來泰國經濟起飛，成為跨國企業競相爭逐之地，台商企業應積極善用資本市場資源，協助本身企業加速市場拓展及創造競爭力。不過，朱士廷認為，企業選擇上市的地點，最重要的是適合自身的發展條件，泰國台商在當地資本市場雖有近20家企業掛牌，但能見度不高、籌資不易，反觀台灣資本市場除股市表現不俗，還具備審查制度成熟透明、籌資成本合理、再籌資便捷與中小企業活躍等多項優勢，相對適合台商回台上市櫃掛牌，因此，鼓勵在外打拼多年的優質台商，善用台灣資本市場加速企業成長。國泰證券承銷業務部副總蔡以哲進一步說明台灣與泰國資本市場的差異，台灣資本市場產業多元，中小型企業相當活躍，掛牌總數和整體市值規模皆較泰國為高，且再籌資、流動性和外資參與率等方面亦表現較佳。據國泰證券內部統計，目前76檔F股共完成28次可轉換公司債(CB)籌資，其中國泰證券主辦件數為5件，領先同業水準。,"[['國泰證', '赴', '推廣臺商'], ['臺商企業', '回', '第一上市櫃'], ['國泰證券董事長朱士廷', '指出', '泰國經濟起飛成爲跨國企業爭逐地'], ['泰國經濟起飛', '成爲', '跨國企業爭逐地'], ['臺商企業', '善用', '資本市場資源'], ['朱士廷', '認爲', '高'], ['企業', '選擇', '上市地點'], ['重要的', '是', '適合發展條件'], ['泰國臺商', '有', '近20家企業掛牌'], ['國泰證券承銷業務部副總蔡以哲', '說明', '臺灣資本市場差異'], ['76檔F股', '完成', '可轉換公司債籌資'], ['國泰證券主辦件數', '爲', '5件']]"
0,20151028_2649,"富鼎投顧盤後－台股壓回8500會有撐◆盤勢分析這兩天美國利率走向又開始顯得不明、加上福特等公司業績令人失望，以及數據顯示美國9月企業投資連跌第二個月，昨晚美股主要指數小跌。終場收盤，跌41.62點或0.24%，為17,581.43點。另外標準普爾500指數跌5.29點或0.26%，為2,065.89點。而綜合股價指數跌4.56點或0.09%，為5,030.15點。昨晚焦點股在於福特汽車上季業績不如市場預期，股價下挫5.04%。此外阿里巴巴業績優於預期，股價逆勢上漲4.05%，為79.44美元。我們沒有因美股小回改變現在的看法，因為一旦FED會議結束後投資人又會蠢蠢欲動了！美股連續第二天走跌，蘋果(Apple)在美股盤後公布財報，業績超越預期，帶動今早以股王3008大立光為首之蘋概股多數走揚，抵銷2330台積電小幅壓回，台股早盤在平盤附近狹盤，維持於8700點附近高檔震盪的格局。美國企業財報好壞參半，在聯準會即將展開為期兩天的決策會議之前，美股走跌，小跌41.62點作收，指數跌4.56點；與台股連動性較高的則相對弱勢。蘋果(Apple)在美股盤後公布財報，因中國市場對iPhone需求強勁，蘋果每股收益1.96美元，營收515億美元，均優於預期。蘋果預計下季度營收755~775億美元，也略優於預期。整體而言8500是技術面支撐之所在！","[['臺股', '壓', '會'], ['臺股', '壓', '會'], ['會', '有', '撐'], ['美國利率走向', '開始', '顯得不明'], ['數據', '顯示', '9月企業投資跌'], ['數據', '顯示', '9月企業投資跌'], ['綜合股價指數', '跌', '4.56點'], ['綜合股價指數跌4.56點', '爲', '5030.15點'], ['焦點股', '在於', '上季業績不如市場預期'], ['上季業績', '不如', '市場預期'], ['股價', '下挫', '5.04%'], ['阿里巴巴業績', '優於', '預期'], ['我們', '沒有', '現在看法'], ['美股', '走', '跌'], ['Apple蘋果', '公佈', '財報'], ['業績', '超越', '預期'], ['美國企業財報', '好壞參', '半'], ['蘋果Apple', '公佈', '財報'], ['蘋果', '預計', '775億美元'], ['8500', '是', '技術面支撐所在']]"
