,News,All,SVO
0,20160406_1000,矽品Q1營收季減逾7% 4/28實體法說 加強和法人面對面溝通封測大廠矽品(2325-TW)今(6)日公告3月營收，達64.2億元，月增2.8%，年減13.7%，第1季營收為192.99億元，季減7.1%，年減7.2%；矽品今日也宣布，4/28將重新召開實體法說，屆時董事長林文伯可望對外說明下一季的景氣展望。矽品對第1季看法保守，由於季上旬產業仍在修正庫存，而小年夜前又有南台灣強震，影響台積電的晶圓供貨情況，也使得封測端營收表現向下修正，雙重因素影響下，封測廠第1季營收多估較第4季修正。而矽品2月營收僅62.45億元，明顯下滑修正，3月小幅回升至64.2億元，月增2.8%，但仍較去年同期減少13.7%，第1季營收為192.99億元，季減7%，年減7.2%。隨著時序進入第2季，IC設計端多擔憂若無法取得足夠產能，下半年旺季需求晶片出貨恐不及，因此多積極在3月向晶圓代工廠備貨，預料晶圓代工廠第2季營運動能可望升溫，連帶推升封測廠第2季營收動能。值得注意的是，矽品預計4/28將重新召開現場實體的法說會，董事長林文伯屆時可望對產業、景氣以及日矽併後續，有更多清楚的說法。,"[['Q1營收季', '減逾', ' 7%'], ['減逾 7%4/28實體法', '說', '3月營收達64.2億元'], ['3月營收', '達', '64.2億元'], ['季', '減', '192.99億元'], ['矽品', '宣佈', '4/28召開實體法說'], ['4/28', '召開', '實體法說'], ['董事長林文伯', '說明', '景氣展望'], ['季上旬產業', '修正', '庫存'], ['月', '增', '2.8%'], ['第1季營收', '爲', '192.99億元'], ['季', '減', '7%'], ['IC設計端', '取得', '足夠產能'], ['值得注意的', '是', '召開法說會'], ['董事長林文伯', '可望', '後續']]"
0,20160406_1001,"億而得:(更正)本公司董事會決議召開105年股東常會相關事宜第三十四條第32款1.董事會決議日期:105/03/162.股東會召開日期:105/06/143.股東會召開地點:新竹縣竹北市台元街28號7樓之2(本公司會議室)4.召集事由:本(一○五)年股東常會召集事由訂定如下：一、報告事項 (1)本公司民國104年度營業狀況報告。 (2)本公司民國104年度虧損金額已達實收資本額二分之一報告。 (3)監察人審查104年度決算表冊報告。二、承認事項 (1)本公司104年度營業報告書及財務報表案。 (2)本公司民國104年度之虧損撥補案。三、選舉事項 改選第五屆董事及監察人案。四、討論事項 (1)修訂本公司「公司章程」部分條文案，謹提請 討論。 (2)擬解除新任董事及其代表人之競業禁止限制案，謹提請 討論。五、臨時動議。5.停止過戶起始日期:105/04/166.停止過戶截止日期:105/06/147.其他應敘明事項:擬依公司法172-1及192-1規定,訂定自105/04/08日起至105/04/18日止，請於受理期間內寄(送)達，於新竹縣竹北市台元街28號7樓之2(本公司財會部)受理股東提案以及提名獨立董事候選人。","[['股東會', '召開', '股東會'], ['105/06/143股東會', '召開', '105/06/143股東會'], ['虧損金額', '達', '實收資本額二分之一報告'], ['1事項', '修訂', '部分條文案']]"
0,20160406_1002,"顧德投顧 賺錢金鐘講 盤後分析◆盤勢分析清明連假當中，全球的股市都出現下跌的情況，台股自然是不意外，終場下跌了144點。只不過，近期的經濟數據表現不差，股市出現拉回，只能說做手找不到下車的理由，索倖就出脫獲利部位，等待營收明朗再出發。今天主流的個股，依舊是電動車族群，包括1536和大、3665F-貿聯、4739康普，都是因特斯拉預購突27萬輛而大漲。另外，工業電腦的樺漢，因先前併購kontron，打進自動化銀行的題材，可望提升北美的獲利，因此股價直奔漲停。由於時序進入第二季，也是電子類股的旺季，除了工業電腦之外，還有下半年即將發酵的運動風，也是近期拉回可以觀察的標的。指數下跌量微增，說明了橫盤整理的開始。不過，由於量能沒有進一步的擴大，代表著後續的大幅度的下跌，不易發生，比較有可能的情況就是緩跌，只是這樣一來，整理的時間也可能相對比較久，未來一個月左右的時間，指數都可能持續整理，在年線和半年線之間來回遊走。在籌碼的部份，外資持續賣超台股，貶值的狀況也在持續中，若無意外，外資還是會持續調節一段時間，建議投資人選擇第二季或是短線有題材的股票，選股的功力，這個時候會明顯的出現差異，不妨多多觀察拉回至年線附近、且年線上揚的個股，都是可以逢低進場的股票。上周美國的經濟數據，雖然沒有說非常的亮眼，但是製造業指數以及「非」製造業指數也都在50的臨界值上面，最主的原因來自於企業投資信心上升。除了電子業庫存去化之外，上游的原料價格上漲，也是帶動企業活動增溫的主因之一。不過，有一項數據需要大家特別留意的是，汽車的銷售量為1660萬輛，低於市場預期的1700萬輛，這已經是過去13個月的新低的紀錄！【後續觀察】1. 台股後續放量的方向作者：顧德投顧 鍾騏遠 分析師以上資料僅供參考,投資時應審慎評估","[['全球股市', '出現', '下跌情況'], ['股市', '出現', '拉回'], ['做手', '找不到', '下車'], ['索幸', '出脫', '獲利部位'], ['主流個股', '是', '電動車族羣'], ['時序', '進入', '第二季'], ['比較', '有', '可能'], ['有可能情況', '就是', '跌'], ['外資', '賣', '超臺股'], ['貶值狀況', '在', '持續中'], ['投資人', '選擇', '有題材股票'], ['短線', '有', '題材'], ['觀察拉回至年線附近個股', '都是', '進場股票'], ['製造業指數', '在', '50臨界值上面'], ['主原因', '來自於', '投資信心上升'], ['上游原料價格上漲', '也是', '帶動企業活動增溫主因之一'], ['一項數據', '需要', '大家留意'], ['的', '是', '汽車銷售量爲1660萬輛'], ['汽車銷售量', '爲', '1660萬輛'], ['這', '是', '新低紀錄']]"
0,20160406_1003,鉅亨晚報2016年4月6日◇重要新聞內容■浩鼎公布解盲過程 對不實報導將追訴到底■輝瑞中止對愛力根的1600億收購案 醫藥產業史上最大併購告吹 ◇財經新聞■蔡英文胞兄竟名列巴拿馬文件 曾銘宗：設境外公司有3目的 蔡家踹共！■大立光4/14召開法說 訂單遭分食及雙鏡頭成焦點■大貶苦果現！中企2015年匯損金額暴增「13倍」■陳正輝帶領王品進入3.0時代 設定3大目標■台灣金融科技公司催生生態圈 金管會金融科技白皮書4月發布 ◇重要指標■日本2月領先指標初值99.8，預期99.8，前值101.8■德國2月工業生產年增率1.3%，預期0.4%，前值2.2%■區3月零售業採購經理人指數49.2，前值50.1■德國3月零售業採購經理人指數54.1，前值52.5■法國3月零售業採購經理人指數45.5，前值48.1◇亞洲股市■台灣收盤跌144.25點，為8513.30點，跌幅1.67%，成交金額967.28億元。■三大法人合計賣超59.42億元。外資及陸資今天賣超66.85億元，投信賣超5.1億元，自營商買超12.54億元。■日經225指數今(6)日收盤下跌17.46點或0.11%，報15715.36點；開盤15727.70點■韓國Kospi指數收盤上漲8.58點或0.44%，報1963.17點；開盤1971.32點■澳洲S&P/ASX 200指數收盤上漲21.51點或0.44%，報4945.90點；開盤4924.40點■截至收盤，滬指報3050.59點，跌2.47點，跌0.08%；深指報10683.86點，漲43.59點，漲0.41%；創業板報2297.04點，漲17.52點，漲0.77%。■截至收盤，漲0.15%，報20206.67點，國企指數跌0.12%，報8668.63點，紅籌指數漲0.23%，報3658.25點。◇台北匯市■兌美元收盤收32.442元，貶6.4分，成交金額8.61億美元。開盤價為32.300元，最高32.300元、最低32.502元。,"[['輝瑞', '中止對', '醫藥產業史上'], ['境外公司', '有', '3目的'], ['蔡家', '踹', '共'], ['大立光4/14召開法', '說', '貶苦果現'], ['訂單', '遭', '分食'], ['訂單', '遭', '分食'], ['陳正輝', '帶領', '王品'], ['跌幅', '爲', '1.67%'], ['Kospi指數收盤', '上漲', '8.58點'], ['15727.70點上漲', '報', '1963.17點'], ['澳洲S&P/ASX 200指數', '上漲', '21.51點'], ['收盤', '漲', '0.15%'], ['國企指數', '跌', '0.12%'], ['紅籌指數', '漲', '0.23%'], ['臺北匯市', '兌', '美元收盤收32.442元'], ['美元收盤', '收', '32.442元'], ['開盤價', '爲', '32.300元']]"
0,20160406_1004,"亞洲投顧 獲利全壘打 盤後分析◆盤勢分析觀察外資成本線8460點.強勢產業車用相關續強台股今日權值股續跌收盤大跌144點，收8513點，領跌個股包括聯發科、碩禾、日月光等權值股。技術面而言，台股上週五4/1日跌破月線8697點，月線跌破，因此選股操作宜更謹慎。精神指標台積電今日下跌5元。個股部份出現強弱分岐，強勢的產業族群仍以車用相關概念最整齊，強勢族群本身也形成輪動，今日的劍麟、江申、東陽、F-貿聯、和大、康普、F-六暉、智伸科都挑戰前波高點寫下新高價。此外，工業電腦6414樺漢及4916事欣科也創新高。其中4551智伸科利基產品:電子車身穩定系統(ESC)為先進駕駛輔助系統(ADAS)關鍵技術之一。台積電相關供應鏈弘塑為濕製程設備廠，股價技術面回測季線守穩，2015年EPS16.41元，擬配發現金股息12元，2016年2月營收3.07億，年增30.39％。弘塑提供台積電高階封測。工業電腦廠4916事欣科轉虧為盈題材，與恩德攜手切入美國國防領域，航太訂單想像空間大。2115F六暉為全球輪胎氣門嘴龍頭，歐洲宣布新車強勢配置胎壓偵測器，全球高階氣門嘴需求大增。 大盤月線8696點跌破後，留意葛蘭碧均線8460點支撐。祝大家操作順利。作者：亞洲投顧 楊基政 分析師以上資料僅供參考,投資時應審慎評估","[['跌個股', '包括', '等聯發科權值股'], ['積電', '下跌', '5元'], ['個股部份', '出現', '強弱分岐'], ['強勢族羣本身', '形成', '輪動'], ['電子車身穩定系統ESC', '爲', '駕駛輔助系統ADAS關鍵技術之一'], ['2015年EPS16.41元', '擬', '配12元股息'], ['配12元股息', '發現', '金'], ['年', '增', '30.39％'], ['弘塑', '提供', '臺積電封測'], ['六暉', '爲', '輪胎氣門嘴龍頭'], ['歐洲', '宣佈', '新車配置胎壓偵測器'], ['新車', '配置', '胎壓偵測器']]"
0,20160406_1005,"亞洲投顧 富貴福臨籌碼動能 盤後分析◆盤勢分析指數繼續拉回，但感覺是大跌嗎？三月底我們跟大家預告，這個月有飆股，沒錯，預告了三天，四月一日的分析裏，還說他動了一下，今天大盤跌144點，他竟然神奇的亮燈漲停，所以，操作到底是看大盤還是看個股，以指數來看，沒錯，有點轉弱了，但若以個股呢？強勢股的PARY 看來還沒結束。上週強勢股的續航力在今日看來，並沒有因今日大盤拉回受到影響，這部分我們再觀察幾日，若是個股能持續表現的話，那就會是多空並存，多空並存在操作上還是能作，過去也發生過很多次，要順勢放空，可以，要找強勢股，當然也可以，今日漲停上市櫃還有21家，是跌停家數的一倍，所以，就看怎麼選股而已。台積電跌回155以下，外資也開始減持期指多單，接下來指數理應不易大漲，天雨路滑，投資朋友請小心操作，善設停損停利，祝大家操作順利。【留意個股】多方續強標地：3665F-貿聯多方轉強留意：3003健和興多方拉回留意：5309系統電、2379瑞昱【重點新聞】特斯拉品牌光芒太甚 車輛可靠性不佳也無傷建議：會買特斯拉的多數家裏都有另一台能源車，所以嚴格說來，他並不是主要的代步車，新奇，好看又好玩，預購量爆表，想像空間很大。作者：亞洲投顧 謝宗霖 分析師以上資料僅供參考,投資時應審慎評估","[['我們', '預告', '這個月有飆股'], ['這個月', '有', '飆股'], ['操作', '看', '大盤'], ['大盤拉回', '受到', '影響'], ['我們', '觀察', '這部分'], ['多空', '存在', '操作上'], ['外資', '開始', '指數大漲'], ['會', '買', '特斯拉'], ['多數家裏', '有', '能源車'], ['他', '不是', '主要代步車']]"
0,20160406_1006,森霸電力:公告本公司總經理異動補充第七條第6款1.董事會決議日:NA2.變動人員職稱(請輸入〝董事長〞或〝總經理〞):總經理3.舊任者姓名及簡歷:黃傳先公司總經理4.新任者姓名及簡歷:新任總經理待董事會通過聘任後另行公告5.異動原因:原任黃傳先總經理報請退休6.新任生效日期:NA7.其他應敘明事項:本公司黃傳先總經理於105年4月1日起退休，新任總經理人選俟提報董事會通過後另行公告。,"[['本公司總經理', '補充', '1第6款董事會決議日'], ['待董事會', '公告', '異動原因'], ['原任黃傳先總經理', '報請', '6退休'], ['原任黃傳先總經理', '報請', '6退休']]"
0,20160406_1007,"永箔:公告召開本公司重大訊息記者說明會第三十四條第16款1.事實發生日:105/04/062.發生緣由:本公司前董事長王家順以本公司名義濫行開立支票，被盜開支票28張。3.處理過程:該些票據開立均與本公司無任何業務往來，亦無任何借貸關係，為保全公司資產，避免影響本公司股東權益，本公司無法讓該等支票兌付。4.預計可能損失:本公司被盜開支票28張，其中21張註記金額計105,290仟元，截至105年4月1日止，本公司已接獲臺灣銀行三重分行致電表示有執票人持本公司名義開立之支票為付款之提示計5張18,490仟元，以致有跳票情形，本公司截至105年4月6日止，尚有16張未知到期日計86,800仟元，僅留存根聯未註記金額計7張。5.對公司財務業務之影響:公司正常營運。6.改善情形及未來因應措施:就王家順已犯背信及違反證券交易法第171條第1項第3款之行為，本公司已正式向法務部台北市調查處提起刑事告訴，案件已交由檢調進行偵辦中。7.其他應敘明事項:因王家順盜開支票致本公司跳票，後續再有跳票情事本公司將以重大訊息公告揭露。","[['公告', '召開', '重大訊息記者'], ['前董事長王家順', '濫行', '開立支票'], ['該些票據開立', '無', '任何業務往來'], ['計', '爲', '付款提示'], ['本公司', '尚有', '7張計'], ['王家順', '犯', '背信'], ['已', '犯', '背信'], ['本公司', '提起', '刑事告訴'], ['開支票', '致', '本公司跳票'], ['後續', '再有', '跳票情事']]"
0,20160406_1008,瑞祺電通3月營收3.24億元年增0.74% 1—2016月達10.00億元瑞祺電通()2016年 3月營收資料(單位:千元),[]
0,20160406_1009,兆豐保險3月營收3.99億元年減4.3% 1—2016月達11.72億元兆豐保險(5834-TW)2016年 3月營收資料(單位:千元),[]
0,20160406_1010,皇將3月營收1.47億元年增263.48% 1—2016月達2.75億元皇將()2016年 3月營收資料(單位:千元),[]
0,20160406_1011,萬通票券3月營收0.80億元年減10.08% 1—2016月達2.73億元萬通票券(2874-TW)2016年 3月營收資料(單位:千元),[]
0,20160406_1012,永豐期貨台指選擇權盤後－清明變盤 指數大跌破8500◆盤勢分析期貨走勢4月份週三下跌168點。價差方面，逆價差擴至-53.3點，電子期逆價差擴至-1.79點，金融期逆價差擴至-4.55點，摩台期逆價差擴至-0.57點。由籌碼面來觀察，三大法人於現貨市場賣超-59.42億元；而在淨部位方面，三大法人多單減碼8424口，淨多單降至12378口，其中外資多單減碼7703口，淨多單降至38704口；另外十大交易人中的特定法人，全月份多單減碼4041口，淨多單降至10030口。目前籌碼面顯示法人對於後勢仍持偏多預期。期貨行情走勢方面，歐美股市連假期間累積較大跌幅，台股結後補跌壓力導至早盤跳空下跌37點開出，而現貨同步開低後一度跌破8500點整數大關，且摩台期盤中更是大跌2.3%領跌四大期指，外資變心導至盤中權值股賣壓不斷湧現，期貨市場連三日下跌且三日合計成交47.82萬口，大跌爆量導至終場以大跌168點作收。技術面觀察，週三大盤開低走低以帶下影線中黑K勉守8500點，且成交量能放大至965億水準，短線量價結構轉為震盪偏空。而以日線型態來看，目前指數重挫回補3/1多方缺口，且短期均線轉為下彎且空頭排列，而多項技術指標持續偏弱格局，短線仍有回檔修正壓力。操作上建議可沿月線偏空操作並請嚴設停損。選擇權分析選擇權從成交量來觀察，4月份買權集中在8700點，賣權集中在8300點。未平倉量部分，買權未平倉最大量集中在9000點，賣權未平倉最大量集中在8200點。全月份未平倉量put/call ratio值由1.1降至0.9，等於中性值1，反應選擇權籌碼面為偏空架構。4月份買權平均隱含波動率由11.82%升至13.13%，賣權平均隱含波動率由16.42%升至20.35%，買賣權皆升。目前指數正處在回檔階段，多方應該靜待落底訊號出現再行布局方為謹慎。,"[['永豐期貨臺', '指', '◆盤勢'], ['電子期', '逆價差擴至', '1.79點'], ['金融期', '逆價差擴至', '4.55點'], ['摩臺期', '逆價差擴至', '-0.57點'], ['三大法人', '減', '碼'], ['特定法人', '減', '碼'], ['淨多單', '降至', '10030口'], ['籌碼面', '顯示', '法人持多預期'], ['法人', '持', '多預期'], ['大跌爆量', '導至', '終場'], ['週三大盤', '開低以', '帶下影線中黑K勉守8500點'], ['下影線中黑K', '勉守', '8500點'], ['成交量能', '放大至', '965億水準'], ['量價結構', '轉爲', '震盪空'], ['短期均線', '轉爲', '彎'], ['技術指標', '偏', '格局'], ['短線', '有', '回檔壓力'], ['月線', '偏', '空'], ['4月份買權', '集中在', '8700點'], ['賣權', '集中在', '8300點'], ['全月份未平倉量', 'put/call', '全月份未平倉量'], ['反應選擇權籌碼面', '爲', '偏架構'], ['反應選擇權籌碼面爲偏架構', '偏', '空'], ['平均隱含波動率', '升至', '13.13%'], ['平均隱含波動率', '至', '20.35%'], ['指數', '處在', '回檔階段'], ['多方', '靜待', '落底訊號'], ['行佈局方', '爲', '謹慎']]"
0,20160406_1013,群益期貨台股期權盤後－外資國安資金大撤退  台股內外夾殺急重挫◆盤勢分析由於長假期間全球主要股市多為下跌修正，以及清明變盤和國安基金退場的隱憂浮現下，以致今日台股除了呈現補跌走勢外，並擴大跌幅形成開低走低的重挫，成交量放大為965億。技術面上今日的放量長黑K，讓台股上檔壓力亦逐漸沉重。外資現貨賣超66億為連兩賣，期貨淨多單大減至38704口；自營商選擇權淨部位仍以賣買權為主。4月選擇權籌碼轉為中性格局，賣權OI大於買權OI大減剩一萬四千餘口，賣權OI最大量再退至8200履約價，買賣權OI增量皆往下履約價作翻移布局。在周選新開倉方面，買權OI呈現大於賣權OI，短線上依舊為有利空方的局面。綜合以上，籌碼面轉為中性平衡格局，外資依舊在期現貨呈現同步作空，在今日台積電遭逢提領重挫和也呈現續貶下，外資熱錢匯出疑慮加劇。技術面上今日放量下彎的黑K頭部型態，讓台股轉為震盪走跌的格局。另外，國安基金將於4/12退場，短線上台股或有賣壓，目前仍可偏空看待台股。,"[['主要股市', '爲', '下跌修正'], ['除了', '呈現', '跌走勢'], ['賣', '超', '66億'], ['賣權OI', '減剩', '一萬四千餘口'], ['短線上', '爲', '有利空方局面'], ['籌碼面', '轉爲', '平衡格局'], ['期現貨', '呈現', '同步作空'], ['臺積電', '遭逢', '續貶']]"
0,20160406_1014,台虹Q1營收年增19% 太陽能材料占44%台虹科技()今天揭露2016年3月營收為7.9億元，較上月的5.52億元成長43.18%，較去年同月6.24億元成長26.6%；而台虹科技2016年1-3月營收為22.83億元，也較去年同期的19.05億元成長19.87%。台虹科技預估在2016年將降低出貨比例的太陽能材料部分，3月營收為3.5億元，較上月的2.09億元成長66%。累計台虹科技2016年1-3月營收中，太陽能材料營收達10億元，仍占營收比重達44.02%台虹科技2015年營收102.68億元創新高，但全年稅後盈餘7.07億元為近3年新低，每股稅後盈餘3.61元，台虹科技在太陽能材料去年營收44.88億元，但在太陽能材料毛利偏低及收款風險及匯兌風險之下，台虹科技預計在今年下調對於太陽能材料的營收金額。台虹科技對於今年太陽能材料的出貨金額預計將較去年下降10%，也就是說今年的台虹科技太陽能材料銷售將在40億元，而公司方面則期望在FCCL的出貨成長能彌補起來，讓2016年的營收能維持在100億元的水準。台虹科技2015年第4季營收29.09億元，毛利率20.1%，為去年4個季度最低，單季稅後盈餘1.22億元，每股稅後盈餘為0.64元，但台虹2015年全年稅後盈餘7.07億元為近3年新低，每股稅後盈餘3.61元。台虹股東會將於5月27日召開，而台虹董事會也通過去年股利配發2元加上0.2元資本公積配發股票股利。台虹是全台最大的軟性銅箔基板(FCCL)、太陽能背板(PV Backsheet)供應廠，同時，台虹科技的高雄市前鎮加工出口區擴廠增加產能方案定案後，並敲定2015起兩年有10億元的資本支出計畫，高雄前鎮加工出口區新廠房的部分投資4億元，新廠預計2017年投產。,"[['太陽能材料', '佔', '臺虹科技'], ['-3月營收', '爲', '22.83億元'], ['臺虹科技', '預估', '3月營收爲2.09億元成長66%'], ['將', '降低', '出貨比例'], ['3月營收', '爲', '2.09億元成長66%'], ['太陽能材料營收', '達', '10億元'], ['仍', '佔', '營收比重'], ['7.07億元', '爲', '近3年新低'], ['臺虹科技', '下調', '營收金額'], ['臺虹科技', '預計', '下降'], ['臺虹科技太陽能材料銷售', '在', '40億元'], ['公司方面', '期望', '出貨成長彌補'], ['稅後盈餘', '爲', '0.64元'], ['稅後盈餘', '爲', '新低'], ['臺虹董事會', '加上', '發股票股利'], ['臺虹', '是', '銅箔基板FCCL'], ['出口區', '擴', '定案'], ['出口區擴定案', '敲定', '10億元資本支出計劃'], ['新廠', '預計', '投產']]"
0,20160406_1015,清明後補跌台股狂瀉144點台股結束清明假期恢復交易，由於休市期間國際股市表現不理想，大盤今天補跌一早跳空開低摜破八千六，隨後在低檔震盪，一度還跌破八千五大關。重量級電子股權值股跌多漲少，金融股表現也弱勢，盤面上只剩下個股零星表現，大盤狂瀉144點，以8513點作收，成交量反而增加至965億元。長黑的走勢讓投資人格外擔憂，預料企業三月營收以及外資是否轉向，將成為台股四月行情的關鍵。（張佳琪報導）台股連休假期間，國際盤不太妙，盤勢果然在清明節後補跌。外資賣壓增強導致重量級權值股跌勢重，台積電大跌3%以上，鴻海雖有鴻夏簽約的利多也下跌超過2%。股王大立光更因為三月營收成績不佳一開盤就是4%的跌幅，蘋果供應鏈與高價股都被拖累。金融股賣壓強大，利率環境不利金融股利差表現，法人擔心獲利受影響而減碼，造成金融股跌幅達1.8%，壓垮盤勢。傳產股幾乎是全盤盡沒，只有機類股略有抗跌力道。生技股則受浩鼎大跌6%的衝擊，股價普遍收低大盤大跌144點，以8513點作收，成交量大增至9百多億。康和證券自營部協理林蒼賢表示，目前正值營收財報發佈期，法人也擔心第一季的強勢表現會反應在電子業財報上。林蒼賢說：「直到上週五來看（走勢），可以明確確定第一季蠻多的外銷成份股可能會有匯損出現」。外資上週五已轉為賣超，先前外資狂買的情況不復見，未來如果熱錢退潮持續減碼，對台股會是極大衝擊。（圖：取自證交所官網）,"[['144點臺股', '結束', '恢復交易'], ['由於', '休', '市'], ['大盤', '補', '跌'], ['成交量', '增加至', '965億元'], ['盤勢', '補', '跌'], ['外資賣壓增強', '導致', '重'], ['鴻海', '有', '鴻夏簽約利多'], ['下跌', '超過', '2%'], ['開盤', '就是', '4%跌幅'], ['利率環境', '不利', '金融股利差'], ['法人', '擔心', '獲利受影響'], ['獲利', '受', '影響'], ['金融股跌幅', '達', '1.8%'], ['傳產股', '盡', '全盤'], ['機類股', '略有', '抗跌力道'], ['股價', '收低', '大盤大跌'], ['成交量', '大增至', '9百多億'], ['協理林蒼賢', '表示', '營收'], ['法人', '擔心', '在'], ['會反應', '在', '電子業財報上'], ['外銷成份股', '有', '匯損'], ['外資上週五', '轉爲', '賣超']]"
