,News,All,SVO
0,20160907_645,"散裝業8月業績回穩 正德營收創歷史次高！散裝航商正德 () 公布 8 月合併營收為 7407 萬元，月增 0.13%，年增 25.33%，創歷年次高，而慧洋 - KY()8 月合併營收 8.9 億元，月增 3.13%，年減 8.22%，但仍來到 3 個月來高點，展望後市，正德海運指出，隨著 已回穩，預期下半年整體表現將優於上半年。正德今年共有 2 艘 1.65 萬噸新散裝貨輪分別在 1 月、4 月加入帶動營收成長，除了 8 月營收創單月次高，累計前 8 月營收 5.29 億元，年增率 7.5%，也創下歷史同期新高。正德現自有船隊共計 11 艘，平均船齡為 7.5 年，正由目前亞太區域性散裝經營業者向外發展至歐洲等遠洋市場，公司表示，近年來 雖相對低迷，但受惠新造船陸續加入且長約鎖定獲利得宜，整體營運維持穩健水準。而慧洋 - KY 前 8 月合併營收為 71.19 億元，年減 4.61%，累計營業利益 10.92 億元，年減 34.85%，累計稅前損益 8.71 億元，年減 44.11%，稅前 EPS 1.7 元。慧洋說明，8 月營業利益相較去年同期減少，主因今年客戶考量自身營運調度而提早解除船舶租約，將相關補償款項帳列業外收入，原船舶租約與市場轉租的租金差異造成營業利益減少；至於稅前損益較去年同期減少，則是因航運市況不佳以及升值所致。另一方面，慧洋指出，8 月因海外可轉債賣回權依公司股票市價評價損失約 0.19 億元，帳列業外損失，但若未來股價市價相對上漲，將以業外利益迴轉入帳。慧洋 8 月分別有 Daiwan Hero(Handy/34,000DWT)(日本名村造船建造)、Sakizaya Hero(Panamax/80,800DWT)(日本海洋聯合造船建造) 和 Daiwan Infinity(Handy/34,000DWT)(日本名村造船建造)3 艘高規格新型節能船交船營運，皆已簽訂期租合約，平均毛利率保持正向貢獻。至年底前慧洋尚有 2 艘新船準備交船營運，目前平均船齡為 5.83 年，船隊保持輕齡化優勢，總船隊規模已達 112 艘。","[[' 正德', '公佈', '7407 萬元營收爲'], ['整體表現', '優於', '上半年'], ['新散裝貨輪', '加入', '帶動營收成長'], ['正德', '自有', '船隊共計11艘'], ['船隊', '共計', '11艘'], ['平均船齡', '爲', '7.5年'], ['經營業者', '發展至', '遠洋市場'], ['公司', '表示', '新造船加入'], ['整體營運', '維持', '穩健水準'], ['慧洋', '說明', '營業利益減少'], ['慧洋', '指出', '迴轉'], ['平均毛利率', '保持', '正向貢獻'], ['新船', '準備', '交營運'], ['平均船齡', '爲', '5.83年'], ['船隊', '保持', '輕齡化優勢'], ['總船隊規模', '達', '112艘']]"
0,20160907_646,樂陞風波未平賣壓沉重苦吞第6根跌停板記者許家禎／台北報導 百尺竿頭收購樂陞破局，市值已蒸發百億元，今（7）日再以跌停開出，已連續苦吞第 6 根跌停板，來到 41.6 元的價位，委賣張數達 1.3 萬張。雖然樂陞祭出庫藏股，百尺竿頭也澄清市場謠言，並說目前正在研擬解決方案，包括可能的補償方式，會盡快對外說明，但獨董陳文茜請辭，與投資人信心不足等，仍止不住賣壓。百尺竿頭收購樂陞破局風波未平，股價從高點 100 多元到昨日 46.2 元已腰斬，而今天依舊以跌停開出，苦吞第 6 根跌停，來到 41.6 元的價位，委賣張數達 1.3 萬張。昨日陳文茜表示因既定工作陸續出國，其中一次甚至長達 3 星期，公司又在重大危機中，不克繼續擔任獨立董事職務監督該公司，為免失職，故自 6 日起辭任獨立董事一職，引起外界關注。而董事長許金龍寫了封信給陳文茜，表示帶給她困擾真的很抱歉，為獨董們抱屈抱憾。他說陳文茜不僅被外界誤會坐領高薪，真的為了工作時程辭職還要被質疑，他不得不跳出來說話，最後說「文茜，謝謝妳，真的非常抱歉！」昨日一度傳出許金龍會回國，但目前人還在國外處理相關事情。至於被大家質疑落跑的百尺竿頭負責人樫埜由昭，百尺竿頭昨日也發出聲明，澄清樫埜由昭的背景，說此次公開收購絕不是詐欺，是抱持極大誠意，原本收購的資金來源就是數個資金提供者組成之基金投資架構，並沒有欺瞞。還說公司就是樂陞的股東，自己也深受其害，並強調樫埜由昭正盡全力研擬解決方案，包括可能的補償方式，會盡快對外說明。而金管會則表示，已掌握百尺竿頭在台灣一些資產，包括持有樂陞的 14% 多的股票，有些已先以行政程序技術性先扣住。 『新聞來源／NOWnews 』,"[['樂升風波', '賣', '沉重'], ['賣張', '數達', '1.3萬張'], ['百尺竿頭', '澄清', '市場謠言'], ['賣張', '數達', '1.3萬張'], ['陳文茜', '表示', '辭任獨立董事一職'], ['其中一次', '長達', '3星期'], ['該公司', '擔任', '獨立董事職務監督'], ['董事長許金龍', '寫', '封信'], ['他', '說', '陳文茜坐領高薪'], ['陳文茜', '坐領', '高薪'], ['人', '處理', '相關事情'], ['大家', '質疑', '落跑'], ['樫埜由昭背景', '說', '收購絕不是詐欺'], ['收購', '絕不是', '詐欺'], ['抱資金來源', '就是', '投資架構'], ['公司', '就是', '樂升股東'], ['自己', '深受', '其害'], ['金管會', '表示', '掌握一些資產']]"
0,20160907_647,旭源8月營收1.22億元創新高 Q3營收可望續創新高炎夏高溫發威帶動飲料銷售量的攀高，以及積層袋客戶端訂單的出貨，推升旭源 ()8 月營收以 1.22 億元創新高，而在 9 月的接單也處於高檔的水準，將有助於改寫旭源的單季營收新高紀錄。飲料收縮膜包材及設備廠旭源包裝科技的 8 月營收以 1.22 億元創歷史新高，年增率 10.9%，累許其 1-8 月營收 8.71 億元，年增率 21.62%；主要在於飲料包裝收縮膜及包括面膜、休閒食品包裝積層袋營收都跨越 4000 萬元的金額，而巴西廠的營收也到 2000 萬元，合力推升 8 月營收向上竄高。旭源股價今天以 23.55 元高盤 23.55 元開出後走高，最高 24.25 元，並一舉跨越所有均線壓力。旭源 2016 年第 2 季營收 3.33 億元改寫歷史新高，其 2016 年第 2 季財報顯示，其第 2 季單季淨利 3265 萬元創新高，每股稅後盈餘 0.73 元，單季獲利已超過 2015 年全年。旭源 2016 年上半年稅後盈餘 5081 萬元，每股稅後盈餘 1.14 元，也創同期新高；第 3 季包括飲料標籤、積層包裝袋等業務接單旺盛，台灣的嘉義大埔美工業區新廠也為此大幅增加產能因應；同時，在巴西廠的部分，也受惠奧運舉辦，明顯挹注其獲利。但依其出貨結構來看，其獲利成長幅度則遠高於營收的成長，預期第 3 季仍將持續上揚。旭源在 2016 年 1-6 月的每股每股稅後盈餘已達 1.14 元的水準，超越 2015 年的每股 0.71 元淨利，也顯示旭源自去年轉虧為盈餘以來的業績持續明顯向上改善，也推升其股價走揚，而旭源 9 月營收也維持高檔水準。旭源包裝科技屬食品級印刷包材熱收縮膜印刷與機台設備廠，除在彩色收縮膜標籤印刷產品隨夏季飲料產品需求而走揚之外，由旭源開發的食品、醫療級積層包裝袋業務並已開始受市場重視，旭源的積層包裝袋並取得國內美妝業者面膜產品包裝採用。旭源包裝科技的業務包括彩色收縮膜標籤印刷、食品包裝積層袋印刷、自行開發的套用及貼用標籤設備、膠膜上游材料。,"[['帶動飲料銷售量攀高', '升', '高'], ['在接單', '處於', '高檔水準'], ['飲料包裝收縮膜', '跨越', '4000金額'], ['巴西廠營收', '到', '2000萬元'], ['單季獲利', '超過', '2015年全年'], ['第 3季', '包括', '旺盛'], ['臺灣嘉義大埔美工業區新廠', '增加', '因應'], ['成長幅度', '高於', '營收成長'], ['超越0.71元淨利', '顯示', '爲盈餘以來業績改善'], ['9月營收', '維持', '高檔水準'], ['旭源', '包裝', '屬食品級'], ['旭源', '包裝', '屬食品級'], ['而', '走揚', '隨需求'], ['開發食品', '開始', '受重視'], ['積層包裝袋', '取得', '採用面膜產品包裝'], ['包裝科技業務', '包括', '貼用標籤設備']]"
0,20160907_648,陳文茜辭樂陞獨董後的長信：從收購違約案學到的5大教訓百尺竿頭悔婚，樂陞 (3662-TW) 吞連吞第 6 根跌停板，股價恐怕快要失守 40 元，今 (7) 日股價來到 41.6 元，委賣張數仍有 13605 張，樂陞科技董事長許金龍預計本周五前和樂陞收購自救會的成員以視訊會議面談，而這起樂陞收購破局案，昨 (6) 日獨立董事陳文茜請辭後，今天凌晨寫了封長信給許金龍以及樂陞科技公司人員，以下為陳文茜公開信全文。給許金龍、樂陞科技公司人員等的信：-- 陳文茜我認識金龍近 14 年。他曾經是我敬重的記者，直到有一天，他跑到我家，把我當一個可以信賴的姊姊，告訴我他可能必須離開心愛的媒體工作，因為他投資的遊戲軟體公司，快要倒了。當時是一個下午，金龍坐在牆角單椅，後面牆色是紅的，燈光很暗，金龍最終站起來，背包提起，上路了。他正式入主樂陞科技。他的付出不是只有辭掉一個穩定工作，而是賣了他的家（一個年紀輕輕，自己聰明投資賺來的家），然後住在公司，從谷底爬起。重提往事，當時的風暴沒有今天大，只是一個不起眼的公司要不要倒閉：但是從手中資源上看，當時才是樂陞科技的谷底。因為萬事永遠起頭難。之後，我陸陸續續見到金龍，樂陞科技做出了功夫熊貓遊戲⋯⋯一個一個得獎，有一天快上市了，許金龍找我做獨立董事，我沒有猶豫，立即答應，當然也沒有問酬勞。過去我拒絕數家收入優渥的獨董工作，因為那不是我的本業。但是我看到樂陞科技公司從幾近破產，不到幾年又站起來，我像母親看到一個孩子美麗勇敢的成長，我不是以任何理性思考答應了獨立董事，而是看著一個孩子長大的喜悅。接下來幾年，公司很忙，我又忙又病：我的工作性質沒有自由度，廣播節目或者電視節目主持人，不到了，就是開天窗。各種狀況下，我覺得他們可以找到更好的獨立董事，我能貢獻，或者臨時開董事會隨叫隨到的配合度都很低。但是金龍多次以市場信心，拜託我。回想幾個月前，江蕙最後演唱會，那天金龍難得變成我們的哥哥，帶我們一行人看首場。如今一切恍若隔世，當時的我們多們開心，金龍更高興，他居然有回頭照顧我們的一天。直到 5/31 中信商銀送來的公開收購通知書，改變了一切。樂陞科技由於不斷的併購其他遊戲公司或者實體的食品公司，使董監事持股比例過低，一方面很容易失去經營權，一方面遇到危機時立即成為公司的脆弱點，尤其禿鷹攻擊。所有遊戲軟體由於開發時間過長，風險高，勝敗立見，我們曾經在董事會提醒，許金龍解釋遊戲軟體業併購其他更多團隊分散風險的必要性：但也恰恰好是如此的性質，使其財務槓桿過高，隨時在禿鷹猖厥的台灣，都可能受到禿鷹的攻擊。除非你口袋很深。日商百尺竿頭違約，讓我學到了非常多的教訓：1）我們的公開收購法律非常不完備，可以要來就來，要違約就違約：2）承銷商中信商銀只是手續費公司，不負責對其客戶的信用調查，也不用查核其資金來源，是否充足。3）獨立董事審查會依法律規定，居然必須從公司接到被迫公開併購通知書那天起，七天內就必須由律師、會計師出示意見，然後當下完成審議並且公告，如此短促的時間，加上獨立董事不是擁有調查權的公權力，在對方是非合意併購時，根本不可能完成替投資人全面把關工作，於是我建議以中立態度：不鼓勵、不反對公開收購，並且在會議紀錄中，特別提醒投資人注意風險。4）接著我們將此公司是否有能力及適格公開收購 25.7% 股權，依規定由投審會通過。5）投審會放行後，不到一個月，接著禿鷹、放空、尤其可能是特殊性質交易的放空集中於某二券商，大量出現。做為獨立董事，我經常忙碌工作，平常我也不進出股市，更遺憾的有些過程，包括 8/26 已經接近違約，中信商銀竟以行政作業不及要求延期，樂陞科技公司也未警覺，並沒有任何人主動通知我們。一切等到股東大會後，晚報報導了，我走入廣播公司才看到消息，當場差一點沒有昏倒。之後，等了空白的一天，我以 Line 主動慰問公司，才開始了聯繫及建議的危機處理。許金龍時而拚命，時而低落，我也不忍苛責。畢竟他是最大的壓力者，而公司營運須要靠他。而且我發現由於我擔任獨立董事，對此刻危機的樂陞科技，反而招蜂引「諜」，因為我而招來太多謡言及話題性。我第一時間並没有想到應該辭職，雖然我早已想離開。但若別人有難，我怎麼可以跳船？對投資人又如何交代。這不是我。於是我和許金龍達成幾項共識和危機處理，有的他最終努力了，因為別人拒絕無法做到，但更有許多原則性的措施，金龍初啟採納，終而沒有履行。或許我們永遠無法代替彼此。我不是金龍，所以沒有他的創業動機：但是我是我，我目睹的是投資人的痛苦，危機正在擴大，而且輿論正出於某種對公司的見解，或者對獨立董事的好惡，把本也是受害者的公司，捲入爭議。我仍然懷念 14 年前的許金龍，也疼痛他今天的處境。但當我過去幾天，幾乎耗盡體力努力維持公司運作，給予各種意見，且幾近無法盡責我的本業，我知道自己的角色該告一段落：過去的事情我會必然面對，但是未來的工作我已無法勝任。一段緣份，陪你們走到這裡。最終的告別，也是最後的勸告：今天的危機不比當年，必須成熟應對，但只要合法，就不必氣餒。我盼望再見到一個令我欽佩的後輩，任何一個人摔倒了，永遠是他站得更穩的轉機。未來我希望在我的生命記憶中，許金龍，仍然是那個冒險、勇敢、熱情的許金龍，我可以再為他鼓掌。不論我們是否重逢。,"[['股價', '失守', '40 元'], [' 日股價', '來到', ' 元'], ['張數', '有', '張13605'], ['樂升', '收購', '自救會'], ['陳文茜我', '認識', '14年'], ['他', '是', '敬重記者'], ['他', '跑到', '我家'], ['他', '離開', '心愛的媒體'], ['金龍', '坐在', '牆角單椅'], ['牆色', '是', '紅的'], ['他', '入主', '樂升科技'], ['他付出', '不是', '辭掉穩定工作'], ['我', '見到', '金龍'], ['樂升科技', '做出', '一個一個得獎'], ['我', '拒絕', '獨董工作'], ['那', '不是', '我本業'], ['我', '看到', '站起來'], ['我', '像', '母親看到美麗成長'], ['母親', '看到', '美麗成長'], ['我', '答應', '獨立董事'], ['工作性質', '沒有', '自由度'], ['我', '覺得', '他們找到更好獨立董事'], ['他們', '找到', '更好獨立董事'], ['金龍', '拜託', '我'], ['金龍', '變成', '我們的哥哥'], ['一切', '恍若', '隔世'], ['他', '有', '回頭我們的一天'], ['一方面', '遇到', '危機'], ['我們', '提醒', '金龍解釋遊戲軟體業併購必要性'], ['許', '金龍解釋遊戲軟體業併購', '更多團隊分散風險'], ['更多團隊', '分散', '風險'], ['承銷商中信商銀', '只是', '手續費公司'], ['不是', '擁有', '調查權'], ['投資人', '注意', '風險'], ['我們', '有', '能力'], ['是否', '有', '能力'], ['性質交易放空', '集中於', '某二券商'], ['我', '進出', '股市'], ['任何人', '通知', '我們'], ['一切', '等到', '股東大會'], ['我', '走入', '廣播公司'], ['我', '慰問', '公司'], ['我', '不忍', '苛責'], ['他', '是', '最大壓力者'], ['公司營運', '靠', '他'], ['我', '發現', '招蜂引諜'], ['我', '擔任', '樂升科技'], ['我', '招來', '太多謠言'], ['我', '想到', '辭職'], ['我', '想', '離開'], ['這', '不是', '我'], ['我', '達成', '共識危機處理'], ['我們', '代替', '彼此'], ['我', '不是', '金龍'], ['我', '是', '我'], ['我目睹的', '是', '投資人痛苦'], ['本', '也是', '受害者公司'], ['我', '懷念', '14 年前許金龍'], ['我', '勝任', '未來工作'], ['最終告別', '也是', '最後勸告'], ['我', '盼望', '再見'], ['許金龍', '是', '冒險許金龍']]"
0,20160907_649,統一證券：台股反彈力道不宜過度期待【昨日盤勢】：雖然周一美股因國定假日休市，台股昨日仍以上揚 12 點 9102 點開出後，傳產、電子、金融三大族群權值股全線逐步拉升，全場支撐於月線 9097 點之上，尾盤再度長紅作收，並收復 9100 點關卡。觀察盤面變化，三大類股呈普漲格局，其中電子上揚 1.09% 最大，而傳產及金融則上揚 0.92 及 0.91%。在次族群部份，漲勢前三名分別為玻璃陶瓷 2.74%、水泥 2.6%、電腦及週邊 1.87%。終場指數上揚 91 點，收在 9181 點，成交量能放大為 752 億元。【資金動向】：三大法人合計買超 82.75 億元。其中外資買超 94.2 億元，投信賣超 0.41 億元，自營商賣超 11.04 億元。外資買超前五大為錸德、富邦金、第一金、緯創、開發金；賣超前五大為群創、億光、仁寶、統一、中鼎。投信買超前五大為敦泰、神基、東陽、華新科、岳豐；賣超前五大為統一、友達、台耀、光聯、中信金。資券變化方面，融資減 0.1 億元，融資餘額為 1344 億元，融? 增 0.9 萬張，融券餘額為 46.2 萬張。外資部位，淨多單增 2092 口，淨多單部位 89627 口。借券賣出金額為 17.56 億元。【今日盤勢分析】：台股在美國非農數據遠低於市場預期，導致九月的升息預期降低，恐慌指數也大減，帶動亞幣普遍升值，使指數延續前日強勢，反彈站上 9100 點大關，但 9200 點前波壓力尚未消除，台股後市行情觀察分析如下：第一、國際股市部份。在八月份非農就業人數公佈後，雖然大幅降低了九月份升息的可能性，但市場仍對十二月份是否升息給予較為肯定的預期。因此，近期亞洲股市的反彈，宜視為短線亞幣反彈導致的國際短期資金行情，但升息效應對美元及亞幣的中長期影響仍不可無視之，應把握反彈做好選股及風險控管。第二、短期市場重新聚焦營運表現。八月中旬以來的多項市場負面訊息，使大盤整體陷入信心不足的低量震盪盤跌格局，樂陞收購案更使市場傳出內資因此大幅撤回資金的傳言，使上周五重挫；在指數整體修正後，短期市場資金重新將焦點放在 8 月營收及第三季營收數據佳的個股使其回歸應有價值 (??)，連帶使指數出現短期拉升，故仍不宜視為行情向上反轉。第三、技術面觀察。雖指數再度突破均線糾結壓力區，也站回月線壓力之上，但量能仍未有效放大，量價背離狀況續存，且前波 9200 壓力並未明確突破，易呈高檔震盪格局；在均線未呈顯著多頭排列且大盤重回 900 億以上量能之前，不宜輕易追高。第四、盤面觀察，昨日盤中亮點聚焦在汽車零組件以及報價題材類股。汽車零組件由於 Q3 的旺季預期，倉佑強勢攻上漲停，東陽、堤維西、大億、英利 - KY 均表現不俗；報價題材如水泥及塑化族群也出現反彈，如台泥、亞泥、台塑四寶等。【投資策略】：台股昨日維持反彈格局，重回 9100 點關卡之上，但量能僅有 751 億元並未有效放大，加上即將面臨前波 9200 點套牢賣壓，反彈力道不宜過度期待。雖然美國 9 月升息預期降低，導致短線亞幣走升，但年底前美國升息機率仍高，且外資期貨買超力道並未持續放大，短線易呈高檔震盪，須謹慎應對，建議選股重於選市，建議防禦型選股，擇優佈局本益比低、業績展望佳及具題材者，如汽車零組件、壽險股、美國房市概念股及散熱等族群。,"[['臺股反彈力道', '不宜', '期待盤勢'], ['全場', '支撐於', '月線9097點之上'], ['三大類股', '呈', '普漲格局'], ['前三名', '爲', '玻璃陶瓷'], ['自營商賣', '超', '11.04億元'], ['超前五大', '爲', '錸德'], ['賣超前五大', '爲', '羣創'], ['超前五大', '爲', '統一'], ['融資', '減', '0.1億元'], ['融資餘額', '爲', '億元1344'], ['融券餘額', '爲', '46.2萬張'], ['賣出金額', '爲', '17.56'], ['在非農數據', '遠低於', '市場預期'], ['在非農數據遠低於市場預期', '導致', '升息預期降低'], ['市場', '給予', '肯定預期'], ['亞洲股市反彈', '宜視爲', '短期資金行情'], ['內資', '撤回', '資金'], ['大幅', '撤回', '資金'], ['指數', '突破', '糾結'], ['均線', '糾結', '壓力區'], ['前波9200壓力', '明確', '突破'], ['均線', '呈', '900以上量能'], ['未', '呈', '900以上量能'], ['盤中亮點', '聚焦在', '汽車零組件類股'], ['水泥', '出現', '反彈'], ['臺股', '維持', '反彈格局'], ['9月升息預期降低', '導致', '短線亞幣走升'], ['短線', '呈', '高檔震盪']]"
0,20160907_650,國票證券：台股多方重新掌握控盤優勢盤勢分析因美股前日休市、歐股表現平淡，台股週二在無明顯外在因素干擾下，市場仍延續前日美國升息預期降溫的氛圍，大盤開高在 9100 點上方後，盤中在台積電穩定走高、鴻海順利填息，加上金融、傳產股同步走揚帶動下，早盤指數穩步上攻後持穩高檔，加上最後一盤多檔電金權值股獲買盤拉抬，促使指數擺尾收高 91 點或 1.01%，以 9181 點作收，成交值亦放大至 764 億元，呈現價漲量增格局。29 大類股中除了食品、光電及資訊服務類股以小跌作收外，其餘類股同步收漲，其中玻陶及水泥類股均上漲逾 2.6% 表現最為亮眼，至於電腦週邊、其它電子與其它類股也都有 1.5% 以上的漲幅。籌碼方面，三大法人共買超現貨 82.75 億元，其中外資買超 94.20 億元，投信與自營商分別賣超 0.41 億元與 11.04 億元。期貨方面，外資持續加碼 2092 口多單，目前淨多單續增至 89627 口，連續兩天創歷史新高。操作建議台股週二再度以中紅 K 作收，同時量能也見回升，可見多方繼前日反撲後，持續展現上攻意圖，短線上量能若能持續加溫，推估突破 9200 點前高的可能性甚大。以近兩個交易日來看，多方接連突破 9000 點與 9100 點兩道整數關卡，使指數順利重返所有均線之上，並來到高檔區間的上緣，除了兩條短均及月線止跌翻揚外，KD、RSI 等指標也都再度轉強，且週二量能方面已較前日有明顯改善，盤勢重回有利於多方的局面。目前指數相距 8/10 所創下 9200 點前高僅剩不到 20 點，預期週三再見高點不難，應留意的反而是後續多方能否維持現有節奏，並且延續追價的力道。整體而言，短線上盤勢已扭轉上週偏弱的態勢，由多方重新掌握控盤優勢，有鑑於外資近兩天同步買超期現貨，加上與台灣 50 均領先大盤創高，因此只要量價配合得宜，台股過高後應仍存在向上空間，建議可密切關注本週瑞信論壇與蘋果新機發表相關訊息，料將引領短線上盤勢的發展。,"[['臺股多方', '掌握', '盤勢分析'], ['市場', '延續', '降溫氛圍'], ['積電', '走', '高'], ['其餘類股', '收', '漲'], ['三大法人', '買', '超現貨82.75億元'], ['其中外資買', '超', '94.20億元'], ['多', '增至', '89627口'], ['量能', '見', '回升'], ['多方繼', '展現', '攻意圖'], ['接連', '突破', '9000'], ['盤勢重回', '有利於', '多方局面'], ['留意的', '是', '維持現有節奏'], ['短線上盤勢', '扭轉', '偏弱態勢'], ['外資', '買', '超期現貨'], ['瑞信論壇', '發表', '相關訊息']]"
