,News,All,SVO
0,20170323_1480,財長：當沖稅率減半 估稅損37.5億元立法院財委會今天（二十三日）審查現股當沖證交稅調降相關修法草案，財政部長許虞哲表示，行政院版本稅率降至千分之一點五，預估一年稅收損失三十七點五億元，將試行一年，立委羅明才等人版本希望降到千分之一，且試行三年，稅收損失將擴大，還是政院版較好。立法院財政委員會今天審查現股當沖證交稅調降相關修法，財政部長許虞哲在財委會表示，現股當沖證交稅率若按政院版本，由現行千分之三降至千分之一點五，一年稅收損失三十七點五億元，如果日均量增加一百億元，即可彌補稅收損失；立委版本降稅率到千分之一，試辦三年，稅收損失將再擴大，有鑑於全世界其有當沖交易制度的市場，都沒有類似減稅措施，但基於金管會建議適度降稅率可以提振交易動能，因此仍以行政院版本較好，不宜再擴大。許虞哲說『依金管會推估對提升股市成交值成長，已可發揮助益，不宜再調降至千分之一，以免擴大稅收損失』(資料照片),"[['財政部長許虞哲', '表示', '行政院版本稅率降至千分之一點五'], ['行政院版本稅率', '降至', '千分之一點五'], ['財政委員會', '審查', '修法'], ['財政部長許虞哲', '表示', '交現股當衝證稅率降至'], ['現股當衝證', '交', '現股當衝證'], ['一年稅收', '損失', '三十七點五億元'], ['日均量', '增加', '一百億元'], ['立委版本', '降', '稅率'], ['有鑑於市場', '鑑於', '交易制度'], ['降稅率', '提振', '交易動能'], ['許虞哲', '說', '發揮助益']]"
0,20170323_1481,大甲媽遶境商機夯 電信業提供門市應援搶客一年一度大甲鎮瀾宮媽祖遶境活動將在明 (24) 日晚上登場，每年都吸引上萬信眾跟隨大甲媽全程遶境，電信業當然不會放過這個大商機，啟動遶境路線上的門市提供服務，台灣大 ()、台灣之星門市應援信眾瓶水、手機充電等服務外，還有專屬活動搶客。大甲媽祖遶境是國內重要宗教盛事，今年遶境活動從 3 月 24 日到 4 月 2 日為期 10 天，體恤信眾徒步辛勞，台灣大安排 43 家在大甲媽遶境路線上的門市，從明 (24) 日起，提供所有信眾瓶水、扇子及免費充電等應援服務。台灣大表示，喝完水的瓶子，不要任意丟棄，凡是憑標註大甲媽的回收水瓶，在全省 myfone 門市申辦資費專案並選搭 2017 限定版 iPhone 6，可立即現折 500 元，還有機會抽全景相機 (全省限量 5 台)，媽祖加持客製化包膜可享 89 折。另外，大甲媽遶境期間，沿線 43 家台灣大門市還特別訂製一座可愛的擲筊「搖轎」，信眾只要在這 43 家門市消費，就可「搖轎」試手氣；為配合全台瘋媽祖，全台近 900 家門市一同舉辦大甲媽擲筊祈福活動，前往門市消費，就送鎮瀾宮授權的媽祖、千里眼、順風耳、報馬仔等貼紙，還可再參加消費滿千擲筊送禮活動，贈禮包括 7-11 禮券 100 元或手機運動臂套等。台灣之星指出，中部門市總動員化提供五星級貼心服務，遶境沿途門市不分直營或加盟，都歡迎信眾進去歇腳吹冷氣，接受奉茶款待，同時還有免費手機清潔、保養、充電服務，另外，還可順手免費申辦全網公測體驗卡。 台灣之星指出，響應在地信仰文化慶典活動，提供大甲鎮瀾宮過火加持的媽祖發財金，即日起只要到台灣之星中部實體門市 (台中、彰化、嘉義、雲林、南投) 及網路門市，新申辦、續約電信資費專案，不限資費門檻就可獲贈一組發財金，申辦全網公測體驗卡也可獲贈發財金。,"[['電信業', '放過', '這個大商機'], ['臺灣', '還有', '專屬搶客'], ['大甲媽祖遶境', '是', '宗教盛事'], ['在門市', '提供', '瓶水'], ['臺灣', '大表示', '喝完水瓶子丟棄'], ['，', '喝完', '水'], ['機會', '抽', '全景相機'], ['媽祖', '加持', '客製化包膜'], ['臺灣大門市', '訂製', '搖轎'], ['搖轎', '試', '手氣'], ['近900家門市', '舉辦', '大甲媽'], ['臺灣星', '指出', '中部門市總動員化提供貼心服務'], ['中部門市總動員化', '提供', '貼心服務'], ['門市', '不分', '直營'], ['信衆', '進去', '歇腳'], ['臺灣星', '指出', '信仰文化慶典活動']]"
0,20170323_1482,〈財政部立院備詢〉當沖降稅闖關 許虞哲：藥不能下過重 降到千分之1.5是極限立法院財委會今 (23) 日審查當沖降交易稅，立委提案直接由千分之 3 降到千分之 1，但財政部長許虞哲表示，當沖交易稅若降至千分之 1，每年稅收損失達 50 億元，觀察期拉長為 3 年，稅損恐怕更大，「藥不能下那麼重，降到千分之 1.5 是極限。」金管會主委李瑞倉表示，政府是一體的，金管會支持行政院版本，即降到千分之 1.5 即可。原力拚農曆年前過關的「當沖降稅」，終於要闖關。立法院財委會今日將審查《證券交易稅條例》修正草案，依據行政院版本，擬將現行當沖證交稅率由千分之 3 降為千分之 1.5，以一年為觀察期，預估一年證交稅收將短少 37.5 億元。但因在野黨立委羅明才、曾銘宗等人表態當沖交易稅要降至千分之 1、觀察期應拉至 3 年，稅率與實施期間成為今日修法攻防焦點。金管會預估，目前當沖交易量占集中市場交易量近 10%，若交易稅降到千分之 1.5，當沖交易量可望提高到 15%，當沖占上櫃市場交易量的 15% 左右，一旦降稅，當沖交易量則可拉高到 22.5%，整體日均交易量可拉高 250 億元左右，有助台股發展。,"[['〉', '當', '衝降稅闖關'], ['藥', '下', '降'], ['立法院財委會', '審查', '降交易稅'], ['觀察期拉長', '稅收損失達', ' 億元'], ['觀察期拉長', '稅收損失達降至', '千分之1'], ['降', '是', '極限'], ['會主委李瑞倉', '表示', '降即可'], ['政府', '是', '一體的'], ['金管會', '支持', '行政院版本'], ['過關當衝降稅', '要', '闖關'], ['立法院財委會', '審查', '修正草案'], ['在野黨', '立委', '羅明才'], ['稅率', '成爲', '修法焦點'], ['金管會', '預估', '當衝交易量佔市場交易量'], ['當衝交易量', '佔', '市場交易量'], ['交易稅', '降到', ' 1.5'], ['日均交易量', '拉高', '左右億元']]"
0,20170323_1483,全球股市居高 價值投資首選中國今年來全球股市維持在高點，但投資人開始擔心漲多後的股市動能可否延續，就價值投資來看，目前全球主要股市中，以中國 (恆生國企) 股的評價相對被低估，加上自 2005 年來，投資國企股的滾動年報酬平均有將近一成的水準，不失為金融市場居高下的投資標的。  鉅亨網投顧指出，對一般投資人來說，藉由觀察經濟指標好壞，進而判斷景氣循環與挑選對應投資標的，是項極為耗費心力且容易失敗的大工程，因此大部份投資人多透過短期股價變化，來挑選未來的投資標的。而單純仰賴股價變化來判斷投資標的又可粗略分為兩派，分別是挑選目前上漲最多的贏家，並認為其上漲趨勢將延續下去的動能派（每季結束時，選擇當季上漲最多者)；與相信短期市場容易陷入不理性，任何過度下跌都提供未來上漲獲利空間，進而押注的價值派（每季結束時，選擇本益比與過去歷史平均偏差最大者）。鉅亨網投顧表示，以這方式來看，目前國企股的評價為全球主要股市中最為被低估者，進一步來看中國經濟的基本面，OECD 最新出爐的半年度經濟展望報告中指出，中國今年 GDP 可望達 6.5%，在全球主要市場中仍屬前段班；另一方面，數據也顯示中國的消費者及企業也積極借款，有望刺激經濟成長，讓中國經濟與消費都溫和向上。鉅亨網投顧總經理朱挺豪表示，不只是國企股的評價偏低，目前的本益比也低於過去 10 年平均，顯示整個陸股在全球投資市場攀高的環境下被低估，以中國的經濟成長無虞，加上儘管美國步入升息循環，但全球仍維持低利率環境，評價較合理的陸股將是長線資金的最佳去處之一。,"[['全球股市', '維持在', '高點'], ['投資人', '開始', '擔心股市動能延續'], ['，', '投資', '國企股'], ['滾動年報酬', '有', '投資標的'], ['金融市場', '居', '金融市場'], ['投顧', '指出', '大部份投資人挑選投資標的'], ['標的', '是', '大工程'], ['極爲', '耗費', '心力'], ['大部份投資人', '挑選', '投資標的'], ['來', '判斷', '投資'], ['判斷投資標的', '分爲', '兩派'], ['延續動能派', '選擇', '最多者'], ['任何下跌', '提供', '獲利空間'], ['巨亨網', '投顧', '表示'], ['國企股評價', '爲', '低估者'], ['今年GDP', '可望達', '6.5%'], ['數據', '顯示', '中國消費者借款'], ['巨亨網投顧總經理朱挺豪', '表示', '顯示整個陸股低估'], ['目前本益比', '低於', '平均'], ['全球', '投資', '市場攀高'], ['美國', '步入', '升息'], ['美國', '步入', '升息'], ['全球', '維持', '低利率環境'], ['合理陸股', '是', '最佳去處之一']]"
0,20170323_1484,天蔥新品牌展店加速 年底前再開3家黃記煌天蔥 () 旗下轉投資公司煌天國際代理來台的北京鍋物名店「黃記煌三汁燜鍋」首店營運亮眼，落腳於桃園市站前商圈 ATT 筷時尚的二號店也將於本周六 (25) 日開幕，天蔥目標今年底前總分店數將達 4 家，以中部以北地區為展店重心。黃記煌三汁燜鍋主打「沒有湯的火鍋」，最大的特色在於鍋物採用「燜」的方式、不加一滴水，在鍋內加入底油之後，平鋪 10 種蔬菜底料，並於底料上加上自選單品主料或多項主料搭配成組合鍋，全程桌邊服務有專人現場打醬，創造出完全不同於一般火鍋的吃法，受到消費者歡迎。此次桃園新店點為了吸引消費者，新菜單同步開賣，包括多人套餐特別加碼贈送哈根達斯冰淇淋作為甜點招待，以及「鍋物自由配」可供消費者選擇。黃記煌三汁燜鍋是由天蔥於去年 6 月，與中國黃記煌成立的合資公司煌天國際引進台灣，天蔥持股 51%，投資額近千萬元，去年 10 月在台北市信義區百貨 ATT 4 FUN 開出首店，法人估平均單店營收約 400 萬元，成為目前天蔥主要的成長動能。除了黃記煌成為主要展店動能，目前天蔥旗下自有主要品牌 Mr. Onion 共有 30 家店，以百貨店型為主。,"[['天蔥新品牌展店', '加速', '亮眼'], ['旗下', '轉投資', '來臺'], ['總分店數', '達', '4家'], ['「', '沒有', '湯'], ['最大特色', '在於', '鍋物採用燜方式'], ['鍋物', '採用', '燜方式'], ['桌邊服務', '有', '專人打醬'], ['專人', '打', '醬'], ['完全', '不同於', '一般火鍋'], ['黃記煌', '成爲', '展店動能'], ['天蔥旗下', '自有', '主要品牌'], ['Mr. Onion', '共有', '家店']]"
0,20170323_1485,新光證券盤前分析◆盤勢分析擔心美新健保法案恐遭否決，影響減稅進度，加上油價走疲，拖累美股大跌， 22 日台股開低續挫，最多跌近 130 點，所幸玻璃、營建、太陽能、電池等類股逆勢走強，配合電子權值股跌幅萎縮，使得台股守穩 9900 點，終場收在 9922.66 點，下跌 49.83 點或 0.5%，成交額 974.49 億元。 OTC 指數收在 137.62 點，上漲 0.49 點或 0.36%，成交額 299.24 億元。雖然美股出現劇烈賣壓，拖累亞股壓回整理，不過外資買超依舊， 22 日台股日線連五紅，守穩五日線，則小幅回貶，9 日 KD 值仍交叉，技術面仍正向發展。籌碼方面，外資連 5 日買超，自營及投信連 2 日賣超。考量蘋果發表 i7 機款，股價再創新高，有機會提升供應鏈股價，前 2 月外銷接單年增率達 12.7%，3 月出口有機會兩位數成長，台股不乏高殖利率個股，有助吸引外資加碼投資，萬點行情仍可期。選股方面，可留意業績成長性佳的高殖利率個股波段操作。,"[['盤勢分析', '擔心', '遭否決'], ['油價', '走', '疲'], ['指數收', '在', '137.62點'], ['美股', '出現', '拖累亞股壓整理'], ['拖累亞股', '壓', '整理'], ['股價', '再創', '新高'], ['有機會', '提升', '供應鏈股價'], ['單年增率', '達', '12.7%'], ['臺股', '乏', '高殖利率']]"
0,20170323_1486,"元大期貨台股期指盤前－美股大跌台股挫 期指失守九千九◆盤勢分析週二美國金融股跌勢加重，川普減稅計畫可能延後，美股三大指數皆大跌逾 1%，拖累週三以跳空下跌 73 點開出，直接摜破 9900 點關卡，並於 9:05 分左右來到 9851 的低點，台積電、大立光等重要權值股皆明顯拉回，尾盤跌勢略有收斂，不過終場仍下跌 65 點以 9896 點作收。在各大期指的表現上，蘋果週二推出紅色的 iPhone 7 與新版 9.7 吋的新 iPad，不過股價收跌逾 1%，先前領漲台股的蘋果供應鏈亦拉回修正，股王大立光下跌 1.5%，權值龍頭台積電則回檔 0.8%，電子期以下跌 0.68% 作收；傳產族群中，油價週二持續走跌，台塑化下挫逾 1%，塑化、鋼鐵、水泥等原物料類股弱勢呈現，非金電期收低 0.79%；美國金融股連日修正，金融龍頭國泰金續跌約 1%，金融期收跌 0.44%。另外，觀察期現貨逆價差由 9 點擴大至 27 點，舊制選擇權波動率指數由 9.38 上升至 9.96，顯示隨著美股重挫，市場避險情緒有加重的趨勢。週三跳空跌破 9900 點關，不過以留有長下影線的小紅 K 作收，顯示低接買盤力道並不弱；就籌碼面來看，週三台股成交金額略減至 959 億元，外資在現貨仍小幅買超 6.8 億元，期貨淨多單則減碼 2,202 口至 53,560 口。研究部認為技術面上偏多格局並未改變，資金行情亦未見退燒，不過仍需留意歐美政經情勢的變化，及近期明顯升值，將不利於出口導向產業的第一季財報表現。","[['大跌臺股挫', '期指', '失守九千九盤勢'], ['三大指數', '大跌逾', '1%'], ['尾盤跌勢', '略有', '收斂'], ['65點', '作', '收'], ['週二', '推出', '紅色'], ['電子期', '跌', '作收'], ['跳空', '跌破', '點關'], ['成交金額', '減至', '959億元'], ['202口', '至', '53口'], ['資金行情', '未見', '退燒']]"
0,20170323_1487,永豐期貨台指選擇權盤前－美股大跌回檔 台指長下影線力守9900◆盤勢分析期貨走勢    週三下跌 65 點至 9898 點。價差方面，逆價差擴至 - 24.66 點，電子期正價差縮至 0.19 點，金融期轉為正價差 3.82 點。現貨部分，三大法人賣超 9.18 億元；而在淨部位方面，三大法人多單減碼 2838 口，淨多單降至 18886 口，其中外資多單減碼 2202 口，淨多單降至 53560 口；另外十大交易人中的特定法人，全月份多單減碼 1928 口，淨多單降至 13037 口。台指籌碼面顯示目前法人對指數持中性偏多預期。期貨行情走勢方面，美股創下今年以來最大跌幅，帶動以下跌 73 點開出，而現貨開盤同步跳空開高後隨即期現貨同步大跌逾百點，且週三轉貶一度貶破 30.5 大關，盤中賣壓轉向賣出權值股，但中小型股維繫盤面人氣，早盤傳出利空的人氣股環球晶與玉晶光，利空不跌尾盤雙雙見到亮燈漲停，率先翻紅帶動期現貨跌幅收斂，終場開低走平以下跌 65 點作收。技術面觀察，週三大盤開低走平以帶長下影線小紅 K 力守 9900 點，而成交量能縮小至 957 億水準，短線量價結構仍為區間震盪偏多型態。以日線型態來看，目前指數日 K 連五紅且回測 5 日線有守，多項技術指標持續交叉向上，技術面仍為區間震盪偏多型態。操作上建議可沿五日線偏多操作並請嚴設停損。選擇權分析選擇權從成交量來觀察，買權集中在 10200 點，賣權集中在 9700 點。選擇權未平倉量部分，買權未平倉最大量集中在 10200 點，賣權未平倉最大量集中在 9500 點。全月份未平倉量 put/call ratio 值由 1.5 降至 1.25，大於中性值 1，反應籌碼面為偏多架構。買權平均隱含波動率由 9.28% 升至 9.51%，賣權平均隱含波動率由 11.36% 升至 11.92%，買賣權皆升。選擇權部位顯示偏多。本投資研究報告由永豐期貨股份有限公司版權所有，未經授權，禁止轉載節錄。本資料內容僅供參考，客戶應審慎考量本身之需求與投資風險，本公司恕不負任何法律責任，亦不作任何保證。,"[['永豐期貨臺', '指', '走勢\xa0\xa0 \xa0週三下跌 65 點至 9898 點'], ['金融期', '轉爲', '正價差點'], ['正', '價差', '3.82'], ['三大法人', '減', '2838口'], ['淨多單', '降至', '13037口'], ['臺指籌碼面', '顯示', '偏預期'], ['法人', '持', '中性'], ['指數', '持', '中性'], ['中性', '偏', '多'], ['最大跌幅', '帶動', '73點'], ['跳空', '開', '即期現貨大跌'], ['轉貶', '破', '盤面人氣'], ['早盤', '傳出', '人氣股環球晶'], ['週三大盤開低', '走平以', '帶力守點小紅'], ['成交量', '縮小至', '957水準'], ['短線量價結構', '爲', '多型態'], ['5日線', '有', '守'], ['技術面', '爲', '多型態'], ['買權集中', '在', '10200點'], ['最大量', '集中在', '10200點'], ['全月份未平倉量', '降至', '1.25'], ['反應籌碼面', '爲', '偏多架構'], ['選擇權部位', '顯示', '多'], ['客戶', '考量', '本身需求'], ['本公司', '恕', '不負任何法律責任']]"
0,20170323_1488,台灣主要報紙重要財經新聞 2017年3月23日中央研究院前院長翁啟惠昨天為浩鼎案出庭，檢方「突襲」當庭表示變更起訴法條，以翁違反中研院內部的利益迴避規定，從原本起訴的「不違背」職務收賄、改以「違背」職務收賄罪論罪；翁啟惠當場變臉，律師當庭抗議。國際熱錢不斷匯入帶動台灣股匯雙漲，對美元匯率本周攀上近 2 年半來新高。路透引述知情人士說法報導，央行已要求部分管理外資現金和證券的保管銀行建議客戶停止匯入資金，此舉可望紓解升值壓力。但此說法隨即遭央行駁斥非事實。暌違 2 年多，蔡力行重返半導體業！聯發科（2454）昨日董事會通過延攬蔡力行至聯發科擔任共同執行長的人事案，預計 7 月 1 日到任，未來蔡力行直接對董事長暨執行長蔡明介負責，同時在聯發科集團擔任集團副總裁。,"[['突襲當庭', '表示', '變更起訴法條'], ['此舉', '可望', '紓解升值壓力'], ['此說法', '遭', '央行駁斥非事實'], ['央行', '駁斥', '非事實'], ['蔡力行', '重返', '半導體業'], ['董事會', '擔任', '執行長人事案'], ['共同', '執', '行長']]"
