,News,All,SVO
0,20190805_776,台股盤前—均線下彎技術面轉弱 下檔支撐看年線受到美國總統川普發文宣布 9 月 起，將對 3000 億美元中輸美商課徵 10% 關稅，衝擊台股上周五 (2 日) 表現，開盤跳空開低下殺，終場重挫 182.71 點，收 在 10549.04 點，成交值擴增至 1580.53 億元。法人指出，技術面明顯轉弱，台股短線維持弱勢格局，量能為後續觀望重要指標，下檔先看年線 10387 點，若再失守，將下探 5 月低檔 10227 點。日韓貿易戰加劇，日本管制關鍵高純度氟化氫等應用在極紫外光 (EUV) 原料輸韓，直接打亂三星衝刺 7 奈米以下先進製程布局，在原料管制趨嚴下，三星要藉衝刺先製程，搶食台積電晶圓代工大餅的難度預料將會大增，加速拉開台積電與三星的差距。除有利台積電甩開三星外，日韓貿易戰可能讓全球科技產業陷入斷鏈危機，由於日本將南韓移出白色名單後，管制範圍將從原本 3 項半導體和面板製程關鍵材料，擴大至半導體矽晶圓、設備和電子級化學材料等千項審查產品，可能讓仰賴這些產品的資通訊產業陷入缺貨情況。而在美中貿易戰方面，美國 9 月將對中國 3000 億元商品課徵關稅。電子業界研判，對終端品牌廠商及組裝廠商，直接影響最大，可能使國內電子產業旺季不旺，iPhone 恐怕是此波受衝擊最嚴重對象，關鍵零組件供應商為配合客戶需求，短期可能會有一波加速囤貨及備料的急單需求，以因應後續產品價格上漲的壓力。經濟部有意整合國內不銹鋼產業，鎖定到印尼紅土鎳礦區設年產 200 萬公噸的不銹鋼煉鋼廠，總投資額估計將逾 200 億元。目前經濟部全面與龍頭廠燁聯、華新麗華、台塑福欣、遠龍等台資不銹鋼界洽談，盼能開創台灣不銹鋼產業新局面。法人指出，台股技術面明顯轉弱，均線開始下彎，短線維持弱勢格局，量能為後續觀望重要指標，可待成交量萎縮至 1300 億元以下，再進場佈局，下檔先看年線 10387 點，若再失守，將下探 5 月低檔 10227 點。,"[['下檔支撐看年線', '受到', '美國總統川普發文'], ['開盤跳空', '開在', '10549.04點'], ['成交值', '擴增至', '1580.53億元'], ['法人', '指出', '弱'], ['臺股短線', '維持', '重要指標'], ['日韓貿易戰', '加劇', '等氟化氫應用輸韓'], ['等氟化氫應用', '輸', '韓'], ['三星', '衝刺', '三星'], ['積電', '甩開', '三星'], ['日本', '移出', '白色名單'], ['管制範圍', '擴大至', '審查產品'], ['讓', '仰賴', '這些產品'], ['美國', '徵', '關稅'], ['iPhone', '是', '此波受衝擊對象'], ['此波', '受', '衝擊'], ['此波', '受', '衝擊'], ['關鍵零組件供應商', '有', '單需求'], ['一波', '加速', '囤貨'], ['經濟部', '整合', '不鏽鋼產業'], ['不鏽鋼鍊鋼廠', '估計', '逾億元'], ['法人', '指出', '臺股技術面轉弱'], ['臺股技術面', '轉', '弱'], ['均線', '開始', '彎'], ['量', '維持', '弱勢格局'], ['成交量', '萎縮至', '億元以下']]"
0,20190805_777,盤前財經大事搶先讀2019年8月5日台灣 7 月外匯存底中國財新綜合 PMI法說會：TPK-KY、立積除權息：友訊、和鑫、鄉林、良維、大江、鉅祥等8 月才 2 個交易日，台股就跌掉 274 點，幾乎吐回 6、7 月的漲點，多頭格局一下子就遭破壞，台股交易員指出，本周先將觀盤重心放在法說，同時，隨著貿易戰範圍擴大，美聯準會 9 月降息機率又增，不排除此將成為股市支撐，預料台股指數年線位置 10400 點附近有撐。面對年底 5G 頻譜競標，電信三雄態度大不同，中華電 () 不但展現競標決心，以 3.5GHz 頻段、首家開台電信業者為目標，也是首家明確說明 5G 資本支出高峰時間，估落在 2022 年至 2024 年，相比之下，台灣大 () 認為，若競標結果不合理，可能不會標滿，而遠傳 () 則尚未表態，態度相對保守。矽晶圓大廠環球晶 () 將於明 (6 日) 召開線上法說，屆時將公布第 2 季財報，並釋出後市營運展望，市場將聚焦長約訂單出貨情況、產業庫存去化狀況、合約價與現貨報價下修情況、8 吋與 12 吋晶圓近期需求表現，及公司對下半年半導體市況展望。美國將對中國課徵新一輪關稅，不過對網通業者來說，因應前次關稅所做的擴產、調整產線等措施逐漸顯現，在海外產能將成稀缺、電子代工廠產能優先給予大客戶下，台網通廠轉單效益將浮現，就有網通業者形容，現在是「天下大亂、局勢大好」。全球製造業衰退程度，已經超出市場預期，值得關注的是連區的核心大國—德國，其製造業惡化的程度也正在加速，反映出德國經濟衰退已經近在咫尺。週五 (2 日) 德國 30 年期公債殖利率盤中跌至負利率，這是德債 30 年期史上首次出現負利率之狀況。,"[['臺股', '跌掉', '274點'], ['多頭格局', '遭', '破壞'], ['臺股交易員', '指出', '本週放在法說'], ['本週', '放在', '法說'], ['中華電', '展現', '競標決心'], ['首家', '開臺', '電信業者'], ['中華電展現競標決心', '也是', '首家說明支出高峯時間'], ['首家', '說明', '支出高峯'], ['明確', '說明', '支出高峯'], [' )', '說', '公佈 季財報'], ['市場', '聚焦', '出貨情況'], ['美國', '徵', '新一輪關稅'], ['產能', '成', '代工廠產能'], ['衰退程度', '超出', '市場預期'], ['，', '值得', '關注'], ['值得關注的', '是', '核心大國德國'], ['衰退程度超出市場預期', '反映', '德國經濟衰退近在咫尺'], ['這', '是', '出現負利率狀況'], ['首次', '出現', '負利率']]"
0,20190804_778,信邦7月營收年增近2成 首破17億元連5月創高電子零組件大廠信邦 () 7 月在醫療及健康照護、汽車、工業應用、通訊及電子週邊等應用成長下，單月營收 17.02 億元續創新高，月增 1.27%、年增 19.4%；累計前 7 月營收 106.47 億元，年增 18.7%，亦為同期新高。信邦指出，7 月醫療及健康照護、汽車、工業、通訊及電子週邊等產業應用，均較前月個位數成長，綠能應用雖然月減 8.49 %，但仍較去年同期成長 64.58%。累計前 7 月前 5 大產業應用，醫療及健康照護產業成長 16.60%；汽車產業成長 3.67%；綠能及節能產業成長 50.00%；工業應用產業成長 17.73%；通訊及電子週邊產業成長 1.44%。產業別營收占比來看，綠能及節能產業佔 28.54%；工業應用產業佔 28.45%；通訊及電子週邊產業佔合併營收 25.46%；醫療及健康照護產業佔 9.13%；汽車產業佔 8.42%。就產品別銷售比重來看，連接線組生產銷售佔集團營收 76.62%；連接器及零組件銷售佔 23.38%。信邦今年從 3 月開始，已連續 5 個月單月營收創高，前 7 月營收 106.47 億元，也較去年提早一個月突破百億大關，而第 3 季進入出貨旺季，法人推估營收將來到單季新高，全年營收也將同步創高。,"[['首', '破', '大廠信邦'], ['信邦', '指出', '產業應用成長'], ['綠能產業', '佔', '28.54%'], ['法人', '進入', '出貨旺季'], ['估營收', '到', '單季新高']]"
0,20190804_779,郭粉連署力挺選總統 郭台銘正面回應曝光鴻海 () 創辦人郭台銘初選落敗後，支持者仍發起連署力挺參選到底，對此，郭台銘今 (4) 日也透過親筆信正面回應。郭台銘初選雖然落敗，但支持者仍不放棄，在全台各地發起連署活動，以行動力挺郭台銘出馬參選 2020 年總統大選。郭台銘粉絲老虎軍團的臉書今日傍晚也貼出郭台銘的親筆信，信中寫到，「親愛的老虎軍團兄弟姐妹們，諸位的儘心儘力、不離不棄，台銘永遠銘感五內，郭台銘敬上 2019.8-4。」據了解，依照總統副總統選舉罷免法規定，若要以「連署」方式申請登記為總統、副總統候選人，連署人數須達最近一次立法委員選舉選舉人總數 1.5%。若以第 9 屆立法委員選舉，中選會所統計人數 1830.51 萬人計算，郭台銘要獨立參選總統，最低連署人數門檻為 27.46 萬人。,"[['郭粉連署力', '選', '郭臺銘曝光鴻海總統'], ['郭臺銘', '曝光', '鴻海'], ['回應', '曝光', '鴻海'], ['郭臺銘', '透過', '正面回應'], ['郭臺銘粉絲老虎軍團的臉書', '貼', '郭臺銘親筆信'], ['郭臺銘', '敬', '2019.8-4'], ['連署人數', '須達', '立法委員選舉選舉人總數'], ['郭臺銘', '參選', '總統'], ['連署人數門檻', '爲', '27.46萬人']]"
0,20190804_780,〈台股風向球〉過去2個月幾乎白忙一場 人氣乏弱恐續測年線8 月才 2 個交易日，台股就跌掉 274 點，幾乎吐回 6、7 月的漲點，多頭格局一下子就遭破壞，台股交易員指出，本周先將觀盤重心放在法說，同時，隨著貿易戰範圍擴大，美聯準會 9 月降息機率又增，不排除此將成為股市支撐，預料台股指數年線位置 10400 點附近有撐。美國總統川普宣布， 9 月 1 日將對另外 3000 億美元中輸美產品加徵 10% 的關稅，衝擊全球金融市場震盪回檔，美股上周五續跌，四大指數中指數跌幅較重，達 1.56%。交易員指出，過去 6-7 月透過 5G 題材引領多頭行情後，原預期 8 月起將由蘋果新機接棒，透過蘋概股維繫多頭士氣，然而，這次美國宣布再加稅，iPhone 供應鏈將明顯承壓。觀察外資過去一周賣超，金額高達 423 億元，其中，遭賣超前 10 大標的依序是群創、友達，均遭賣超逾 13 萬張，新光金遭賣逾 5 萬張，玉山金 4.3 萬張，元大滬深 300 正 2 和中信金均超過 3.5 萬張，兆豐金和中鋼均逾 3 萬張，國泰金、開發金也都超過 2.7 萬張。而吸引外資買超的前 10 大標的，全是債券 ETF，依序分別為國泰投資級公司債超過 3.7 萬張，富邦 A 級公司債和國泰 A 級公司債均達 3.5 萬張，凱基金融債 20 + 衝上 3.1 萬張，元大 AAA 至 A 公司債、聯電均逾 2.8 萬張，凱基科技債和南亞科也獲買超逾 2 萬張，旺宏則逾 1.9 萬張。本周還有不少重量法說將陸續登場，8 月 5 日 TPK-KY、8 月 6 日環球晶、南茂、8 月 7 日精測、康舒、研華和上銀，8 月 8 日則開始以金控為主，包括永豐金、國票金和華南金；9 日華碩、仁寶和亞太電。整體來看，隨著貿易戰不確定壓力升溫，台股許多績優股股價逢壓，大盤短期勢必受到亂流干擾，法人認為，不排除回測年線 10400 點支撐，先看本周召開法說個股股價能否因訊息面帶動強彈，作為行情回溫試金石。另外，聯準會將在 9 月 19 日召開下次會議，是否再宣布預防性降息，受高度矚目，市場對聯準會後續降息預測，也是影響本周全球股匯市的主要因素。,"[['臺股', '跌掉', '274點'], ['多頭格局', '遭', '破壞'], ['臺股交易員', '指出', '本週放在法說'], ['本週', '放在', '法說'], ['美國總統川普', '宣佈', '徵10% 關稅'], ['3000 億美元中', '輸', '美'], ['交易員', '指出', '美國宣佈加稅'], ['題材', '引領', '多頭行情'], ['美國', '宣佈', '加稅'], ['金額高達', '423', '億元'], ['超前遭賣依序', '是', '羣創'], ['遭賣', '超逾', '萬張'], ['兆豐金', '均逾', '3萬張'], ['國泰金', '超過', '2.7萬張'], ['吸引前10大標的', '是', '債券'], ['公司債', '爲', '公司債超過3.7萬張'], ['公司債', '超過', '3.7萬張'], ['和國泰 A 級公司債均達 3.5 萬張，凱基金融債 20 + 衝上 3.1 萬張，元大 AAA 至 A 公司債', '均逾', '2.8萬張'], ['大盤', '受到', '亂流乾擾'], ['召開法', '說', '個股股價帶動強彈'], ['個股股價', '帶動', '強彈'], ['聯準會', '召開', '下次會議'], ['市場', '預測', '後續降息'], ['預測', '也是', '主要因素'], ['預測也是主要因素', '影響', '全球股匯市']]"
0,20190804_781,中油：汽、柴油價格8/5起不予調整中油公司今 (4) 宣布，自明 (5) 日凌晨零時起，各式汽、柴油價格均不予調整，參考零售價格仍維持 92 無鉛汽油每公升 27.2 元、95 無鉛汽油每公升 28.7 元、98 無鉛汽油每公升 30.7 元、超級柴油每公升 25.1 元。中油表示本週國際油價呈現漲跌互現的震盪走勢，雖因美國原油庫存連續 7 週下降及北半球適逢夏天用油旺季，帶動國際油價上漲。但美中貿易談判歧見仍深，抑制油價漲勢。中油指出，調價指標 7D3B 週均價為每桶 62.75 美元，較前週 62.83 美元下跌 0.08 美元，新臺幣兌美元匯率貶值 0.079 元，國內油價依公式計算漲幅為 0.10%。本週 92 無鉛汽油及柴油因未超過亞鄰國家最低價，故汽、柴油價格均不予調整。而實際零售價格以各營業點公告為準。,"[['各式汽價格', '不予', '調整'], ['，', '參考', '零售'], ['參考零售價格', '維持', ' 元元'], ['中油', '表示', '震盪走勢'], ['國際油價', '呈現', '漲跌現'], ['國際油價', '呈現', '漲跌現'], ['中油', '指出', '周均價爲美元'], ['周均價', '爲', '美元'], ['公式計算漲幅', '爲', '0.10%'], ['無鉛汽油', '超過', '亞鄰國家最低價'], ['汽價格', '不予', '調整']]"
0,20190804_782,環球晶本周法說 聚焦報價與產業景氣矽晶圓大廠環球晶 () 將於周二 (6 日) 召開線上法說，屆時將公布第 2 季財報，並釋出後市營運展望，市場將聚焦長約訂單出貨情況、產業庫存去化狀況、合約價與現貨報價下修情況、8 吋與 12 吋晶圓近期需求表現，及公司對下半年半導體市況展望。環球晶第 1 季毛利率攀升至 41%，為首度站上 40% 大關，營益率也達到 33.35%，雙率同步創高，稅後純益 38.63 億元，季增 3.84%，年增 39%，每股純益 8.88 元，持續改寫單季 EPS 新猷。不過，第 2 季由於客戶拉貨動能受美中貿易戰影響而趨緩，合併營收達 146.93 億元，季減 5.75%、年增 2.27%，為近 1 年以來低點，法人估單季每股純益上看 8.5 元。展望下半年，環球晶董事長徐秀蘭日前在股東會後指出，下半年價格壓力小、量的壓力會比較大，今年整體出貨面積可能較去年少，但 8 吋和 12 吋等較高單價矽晶圓出貨比重拉升，小尺寸比重相對下滑。徐秀蘭對今年整體營運樂觀看待，認為表現不會太差，原先預期今年營運將大幅優於去年，但隨著半導體產業需求趨弱，環球晶也下修全年營運成長幅度，「本來預期比去年好蠻多的，但現在可能好少一點」，仍估今年全年將維持成長態勢不變。從市場庫存水位來看，徐秀蘭認為，第 2 季市場庫存水位將達到高峰，並從第 3 季開始逐季緩降，第 4 季存貨水位還會再較第 3 季下降，市場存貨將會逐季越來越健康。,"[[' )', '召開', '線上法'], ['市場', '聚焦', '出貨情況'], ['1季毛利率', '攀升至', '41%'], ['客戶', '拉', '貨'], ['客戶', '拉', '貨'], ['合併營收', '達', '146.93億元'], ['每股', '看', '8.5元'], ['環球晶董事長徐秀蘭', '指出', '拉昇'], ['將', '優於', '去年'], ['環球晶', '下修', '營運成長幅度'], ['全年', '維持', '成長態勢不變'], ['徐秀蘭', '認爲', '第 2季市場庫存水位達到高峯'], ['第 2季市場庫存水位', '達到', '高峯']]"
0,20190804_783,韋僑醫療應用擴展快且獲利倍增 新廠擬年底前動工電子標籤廠韋僑 () 上半年稅後純益倍數成長，每股純益達 1.02 元，公司規劃投資 6 億元擴產，新廠已進入設計階段，預計今年動工，新產能將主攻電子票證、醫療及工業 4.0 等無線射頻辨識（RFID）應用市場。同時，韋僑在醫療工業應用等營收成長帶動下，預計明年將辦理市場公開籌資案，充實營運資金，這也是韋僑 2015 年 10 月上櫃掛牌以來，首度進行市場籌。韋僑第 2 季營收 2.59 億元，毛利率為 26.59%，年增 2.2 個百分點，稅後純益為 2326 萬元，季增 77.17%，年增 1.44 倍，每股純益為 0.65 元；上半年營收為 4.67 億元，毛利率 26.6%，年增 3.42 個百分點，稅後純益 3639 萬元，年增 1.16 倍，每股純益達 1.02 元。韋僑下半年營收將上看 7 億元，較上半年成長逾 5 成，全年將突破 11 億元，創新高，韋僑已斥資 3.15 億元購置台中市大里仁化工業區內約 1370 坪建廠土地，正進行建廠動工前準備階段，規劃投資 6 億元擴產，新廠已進入同步設計階段，將用於擴充應用鎖定票證、物流、醫療及工業製程等領域。韋僑科技 RFID 應用在工業製程領域，包括物聯網（IoT）到工業 4.0，可藉由感測器讀取 RFID 相關資料，預計將隨工業 4.0 擴大而成長；而目前成長最快的醫療耗材市場，營收比重約 16-17%，預計下半年還有新醫療客戶加入，營收比重可望增加，也可透過降低傳統 RFID 門禁卡片產品營收比重，避開陸廠價格競爭。RFID 運用在智慧醫療耗材產品，包括注射針筒及手術止血帶，醫師開刀後，可從感測器讀取 RFID 後，適時盤點開刀房止血帶數量，避免發生人為疏忽。韋喬已出貨美商針筒品牌廠，進入穩定供貨期，屬於高單價、高毛利的利基型產品。韋僑去年盈餘每股將配 0.6 元現金股利，預計 8 月 14 日除息，目前韋僑以石英元件廠希華晶體 () 持股 11.46% 為最大股東，董事長並由希華董事長曾穎堂擔任。,"[['每股', '純益達\xa0', ' 元'], ['新廠', '進入', '設計階段'], ['新產能', '主攻', '等4.0無線射頻辨識'], ['韋僑', '預計', '辦理公開籌資案'], ['這', '也是', '進行市場籌'], ['毛利率', '爲', '個百分點'], ['稅後純益', '爲', '2326 萬元'], ['每股', '爲', '0.65元'], ['上半年營收', '爲', '4.67億元'], ['每股', '純益達', '1.02元'], ['韋僑', '看', '7億元'], ['新廠', '進入', '設計階段'], ['RFID韋僑科技', '應用在', '工業製程領域'], ['IoT物聯網', '到', '4.0工業'], ['針筒品牌廠', '進入', '穩定供貨期']]"
0,20190804_784,年底5G頻譜競標 中華電標金無上限 台灣大、遠傳相對保守面對年底 5G 頻譜競標，電信三雄態度大不同，中華電 () 不但展現競標決心，以 3.5GHz 頻段、首家開台電信業者為目標，也是首家明確說明 5G 資本支出高峰時間，估落在 2022 年至 2024 年，相比之下，台灣大 () 認為，若競標結果不合理，可能不會標滿，而遠傳 () 則尚未表態，態度相對保守。NCC 規定 5G 得標者的建設義務，包括 3.5GHz 頻段得標者，不論標到多少頻譜，5 年內至少建 1000 個 5G 基地台，涵蓋全國人口比例至少 50%；28GHz 頻段得標者，建置 375-3000 個 5G 基地台，對電信業來說，建設成本上看 5000 萬元，競標前難以與其他業者合作，加上標金底價尚未公布等因素下，壓力仍不小。法人表示，目前五家電信均宣布參與年底的 5G 頻譜競標，其中，中華電及台灣大都把目標擺在 3.5GHz 頻段標滿 100MHz，中華電更宣示標金無上限，另外，遠傳則考慮競標規章尚未公告，對於後續資本支出及頻段，尚未鬆口。中華電董事長謝繼茂曾表示，標金金額沒有上限，朝最有效率的頻寬設計，目標競標半年後開台，挑戰電信業第一，總經理郭水義則表示，今年資本支出約 290 億元，預估明、後年資本支出將持平，直到 2022 年後，5G 的資本支出將攀到高峰。台灣大總經理林之晨指出，由於 3.5GHz 頻段最能發揮 5G 效益，因此將以合理的價個標滿 100MHz，但若最終標金不合理則不會標滿；遠傳總經理井琪則認為，由於 5G 競標詳細規章尚未公告，較以難評估 5G 資本支出，加上建設義務，對於資本支出謹慎看待。,"[['中華電標金', '無', '上限'], ['中華電標金', '無', '上限'], ['首家', '開臺', '電信業者'], ['首家', '說明', '5G資本支出高峯'], ['明確', '說明', '5G資本支出高峯'], ['建設義務', '包括', '3.5GHz頻段得標者'], ['至少', '建', '個5G'], ['基地臺', '涵蓋', '人口比例'], ['28GHz頻段得標者', '建置', '基地臺'], ['法人', '表示', '五家電信宣佈5G頻譜競標'], ['五家電信', '宣佈', '5G頻譜競標'], ['中華電', '擺在', '100MHz'], ['更', '宣示', '標金無上限'], ['標金', '無', '上限'], ['遠傳', '考慮', '公告競標規章'], ['中華電董事長謝繼茂', '表示', '標金金額沒有上限'], ['標金金額', '沒有', '上限'], ['總經理郭水義', '表示', ' 億元'], ['3.5GHz頻段', '發揮', '5G效益'], ['遠傳總經理井琪', '認爲', '評估5G資本支出']]"
0,20190804_785,減產因應供過於求 面板雙虎朝高值化發展面對面板產業逆風持續，面板雙虎友達 ()、群創 () 調整策略布局，將減產 5-10%，以因應整體供過於求現象，並朝向高值化、多元市場發展，加值面板價值，不過預期面板價格仍要到本季底才有機會回穩。IHS Markit 顯示部門研究總經理謝勤益表示，目前只有看到韓國廠商在電視需求訂單稍稍回升，全球面板廠幾乎都下調產能利用率，面板雙虎本季減產約 5-10%，群創主要是修改面板設計，調整包含 5 代、5.5 代、6 代線產能，而友達則是調整 6 代、7 代線產能，因應現階段市場供過於求的現象。受到美中貿易戰談判無進展，美國總統又宣布將對 3000 億美元中輸美商品加徵關稅，謝勤益分析，整體面板產能稼動率勢必會受到關稅影響，目前全球消費型電子產品仍有 60-70% 是在中國生產製造，關稅一提升，將衝擊終端市場需求下滑。面對產業逆風，友達、群創日前公布第 2 季財報，虧損皆較首季收斂，顯示近期積極策略轉型布局高階及多元市場有所成效，不過雖然面板跌價狀況相比去年逐步收斂，但預料短期價格仍會呈現低迷狀態，直到 9 月底才有機會反彈。友達日前法說會表示，預期本季在高階手機、開學季、非消費型面板需求帶動下，中小尺寸面板銷量將有 5% 以上成長，但對價格表現相對保守，同時強調將持續朝利基型、高價值、一站式整合服務發展，包含大健康產業、循環經濟、工業製造、智慧零售等，目前非消費性產品銷售比重占 25%，而高端產品出貨也整體的 5 成以上，未來不單只是聚焦本業面板，也將提供更多服務及解決方案。群創則認為，隨著歐美黑色星期五以及中國雙十一、雙十二購物節即將到來，預期客戶將逐步進入促銷檔期的備貨期，面板需求將緩步落底回升，電視面板需求也可望回溫，而群創積極布局的電視整機市場營收比重也逐年增加，去年已成長至 8%，今年目標是達到 25%。,"[['預期面板價格', '到', '本季底'], ['IHSMarkit', '顯示', '部門研究總經理謝勤益表示'], ['部門', '研究', '總經理謝勤益表示'], ['面板廠', '下調', '產能利用率'], ['友達', '是', '調整現象'], ['友達是調整現象', '調整', '6代'], ['美國總統', '宣佈', '關稅'], ['整體面板產能稼動率', '受到', '關稅影響'], ['消費型電子產品', '有', '6070%是生產'], ['6070%', '是', '生產'], ['轉型佈局高階', '有所', '成效'], ['短期價格', '呈現', '低迷狀態'], ['說會', '表示', '保守'], ['中小尺寸面板銷量', '有', '成長'], ['羣創', '認爲', '客戶逐步進入促銷檔期備貨期'], ['客戶', '逐步進入', '促銷檔期備貨期'], ['今年目標', '是', '達到']]"
0,20190804_786,郭台銘與柯文哲會面討論脫黨參選？ 郭辦：雙方僅短暫通話外傳鴻海 () 創辦人郭台銘與台北市長柯文哲見面，並表態以無黨籍的身分角逐 2020 年總統大選，對此，郭台銘辦公室澄清，雙方並無會面，但的確有短暫通話，至於參選事宜，純為臆測。郭台銘辦公室表示，關於郭台銘及柯文哲會面為誤傳，雙方有通電話，但時間很短暫，主要就是打個招呼。據了解，郭台銘在電話中表示有機會再拜訪柯文哲，柯文哲則表示再看看時間。此外，郭台銘也也提到，柯文哲組黨成立大會，因為有其他的事不會去，但會送個花祝賀，表達心意。郭台銘幕僚強調，雙方通話沒有特別其他內容，外傳郭台銘參與台民黨或是脫黨參選等，純屬臆測，雙方幕僚也沒有見面的安排。,"[['雙方', '通話', ' 創辦人郭臺銘見面'], ['郭臺銘辦公室', '表示', '短暫'], ['郭臺銘會面', '爲', '誤傳'], ['雙方', '有', '通電話'], ['郭臺銘', '表示', '有機會'], ['則', '表示', '看看時間'], ['郭臺銘', '提到', '組'], ['雙方通話', '沒有', '其他內容'], ['外傳郭臺銘', '參與', '臺民黨'], ['雙方幕僚', '沒有', '見面安排']]"
