,News,All,SVO
0,20190226_753,誠品生活去年EPS為5年低點 每股賺7.32元 擬配息6.8元誠品生活 () 今 (26) 公告去年第 4 季與全年財報，第 4 季稅後純益 8647.4 萬元，季增 78.55%，年減 1.82%，每股純益 1.83 元。受到去年 3 家新店開展，營業費用較高影響，全年稅後純益 3.47 億元，年減 17.98%，每股純益 7.32 元，為近 5 年新低。誠品生活董事會也通過擬配息 6.8 元，配息率 92.9%，現金殖利率約 5.17%。誠品生活去年第 4 季營收 12.77 億元，季減 15.8%，年減 11.19%，毛利率 44.9%，季增 3.64 個百分點，年增 0.97 個百分點，營益率 3.87%，季增 0.61 個百分點，年減 2.01 個百分點；稅後純益 8647.4 萬元，季增 78.55%，年減 1.82%，每股純益 1.83 元。誠品生活去年全年營收 45.04 億元，年增 5.29%，毛利率 44.15%，年減 0.85 個百分點，營益率 6.09%，年減 3.09 個百分點；稅後純益 3.47 億元，年減 17.98%，每股純益 7.32 元。誠品生活去年 10 月開展南西店，而台中三井購物中心大店、中國深圳店也趕在去年 12 月開幕，在新店陸續貢獻下，帶動營收規模擴增，不過，誠品生活董事長吳旻潔先前表示，雖然去年因新店開展，將有較大的費用支出，可能因此影響損益表現，但相關效益與獲利能力，可望於今年顯現。誠品生活目前店數共 48 家，其中包含台灣 43 家、香港 3 家與中國 2 家，今年秋季也將於日本東京日本橋展店，未來將進行日本地區拓點計畫，盼 3 至 5 年內走出東京都，延續誠品生活「連鎖不複製」的展店精神持續拓點。海外拓點也考慮東南亞市場，但確切時程仍未定。誠品生活董事會今日也通過擬配發每股現金股利 6.8 元，配息率 92.9%，若以今日收盤價 131.5 元計算，現金殖利率約 5.17%。,"[['EPS', '爲', '5年低點'], ['每股', '賺', '7.32元'], ['季', '減', '15.8%'], ['毛利率', '季增', ' 個百分點'], ['營益率', '季增', '個百分點'], ['營益率', '年減', '個百分點'], ['誠品', '開展', '南西店'], ['誠品生活董事長吳旻潔', '表示', '影響相關效益'], ['海外拓點', '考慮', '東南亞市場']]"
0,20190226_754,神基去年純益創高EPS 3.83元 擬配息3元平歷史紀錄強固型工業電腦廠神基 () 公布去年稅後純益 22.12 億元，年增 15.8%，每股純益 3.83 元，創下歷史新高，董事會決議每股擬配息 3 元，平歷史紀錄，若以今日收盤價 46.8 元計算，現金殖利率達 6.4%。神基去年第 4 季營收 64.75 億元，季減 5.1%、年增 12%，營業利益 7.45 億元，季減 17.3%、年增 10.7%，營益率 11.51%，季減 1.7 個百分點、年增 0.67 個百分點，稅後純益 6.06 億元，季減 12.9%、年增 18.4%，每股純益 1.05 元。神基去年營收 246.93 億元，年增 11.3%，營業利益 26.52 億元，年增 5.5%，營益率 10.74%，年減 0.58 個百分點，稅後純益 22.12 億元，年增 15.8%，每股純益 3.83 元。獲利衝高，神基董事會也通過每股擬配發 3 元現金股利，平前年新高，配發率約 78%，預計將發放 17.38 億元現金股利，若以今日收盤價 46.8 元計算，現金殖利率約 6.4%。,"[[' )', '公佈', '去年稅後'], ['營益率', '增', '10.7%']]"
0,20190226_755,北富銀越南業務高速成長 打造當地銀行首見越南特色分行看準越南經濟起飛趨勢，富邦金 () 旗下台北富邦銀行十年前即開始布局越南，伴隨業務規模高速成長，北富銀特別進行胡志明市分行喬遷改裝，以越南傳統元素融合全球思維，創新打造出當地銀行中首見的越南特色分行，極受客戶及員工好評，不僅把國際上開放互動的經營哲學帶進越南，也成為見證胡志明市成長繁榮的另類指標。近年來越南經貿規模快速增長，根據越南統計總局統計，2018 年越南 GDP 增幅達 7.08%，遠高於全球平均，加上積極開放的政策和可觀的人口紅利及內需市場，成為台商投資設廠的新興基地。北富銀總經理程耀輝表示，北富銀自 2008 年成立胡志明市分行，從企業金融領域切入，以台商及越南企業雙向並進的核心策略，搭配北富銀於兩岸五地的整體資源，為客戶搭建起跨國性的專業整合式服務平台，並積極參與當地重要投資案，成為台商和越南企業堅實的金融後盾。截至 2018 年底，北富銀在越南的總資產增長至 317 億，稅前淨利更增加至 4.5 億元，與 2010 年相比成長 31 倍，表現優異。北富銀表示，越南目前有超過 30 家商業銀行，北富銀越南地區分行之所以能在激烈的市場競爭中維持亮眼營收成長，除了有賴台商進駐越南的數量和規模持續增加，針對越南本國企業的深耕布局亦發揮綜效。在強大的國際化融資能力加持下，北富銀主辦許多對當地民生經濟有重大影響的開發融資案，如胡志明市富美興新月灣及 midtown 造鎮開發案、越南最大民營集團 Vingroup 旗下國民汽車品牌建廠融資案等。迎接越南業務的高速成長，北富銀特別將胡志明市分行喬遷至胡志明市第一郡，胡志明市的重要機關和各國總領事館皆位於此地，為越南一大經濟、貿易、金融及行政中心。北富銀表示，遷移後的新分行將更能呼應當地的財經需求，提升企業客戶經營之整合深度，也為接下來跨足個人房信貸等消金業務奠定更佳的客群服務基礎。結合越南發展脈絡，胡志明市分行在設計上著重越南傳統文化與創新的融合。越南以農漁立國，分行迎賓牆面用波浪式裝置藝術展現越南稻浪的豐美，彩繪頂燈則彷彿讓客戶置身於藍天白雲之間，搭配饒富趣味的斗笠吊燈、漁船沙發和越南傳統草編及圖騰紋飾，在領略傳統文化的敦厚樸實之餘，也提醒在城市的快速發展中更要珍惜當地得天獨厚的豐沛水土資源。隨著國民收入提升及服務產業的快速發展，越南個人金融需求已趁勢而起，未來北富銀將積極延伸業務觸角，除持續提升企業金融服務質量，更將切入個人房貸與信貸等消金業務，打造出跨台、港、中、越、星「兩岸五地」的區域性金融服務平台。,"[[' 旗下臺北富邦銀行', '開始', '越南佈局'], ['創新', '打造', '首見越南特色分行'], ['成爲另類指標', '見證', '胡志明市'], ['臺商投資', '設', '廠'], ['總經理程耀輝', '表示', '胡志明市分行'], ['在總資產', '增長至', '317億'], ['稅前淨利', '增加至', '4.5億元'], ['北富銀', '表示', '越南目前有超過家商業銀行'], ['越南', '目前有', '超過家商業銀行'], ['北富銀越南地區分行', '維持', '營收成長'], ['有賴臺商', '進駐', '越南'], ['有賴臺商', '進駐', '越南'], ['北富銀', '主辦', '開發融資案'], ['當地民生經濟', '有', '重大影響'], ['重要機關', '位於', '此地'], ['北富銀', '表示', '新分行呼應財經需求'], ['新分行', '呼應', '財經需求'], ['在', '領略', '傳統文化'], ['北富銀', '延伸', '業務觸角']]"
0,20190226_756,大成擴大投資台灣 加碼逾9億元為國成麵粉取得土地資產大成 () 看好台灣食品業發展，除投資 24 億元在嘉義馬稠後產業園區興建全新食品工廠，未來將主要產品以雞、豬加工品類為主，也對於轉投資國成麵粉加碼，取得現有生產使用的土地廠房及設備，總計新增投資達 15.71 億元。大成今日在交易所發布重大訊息指出，持股 55% 的子公司國成麵粉，將由大成及國成麵粉共同出資 15.71 億元，取得現有生產使用的土地、廠房及設備，其中大成將另出資 9.17 億元，購入桃園楊梅段目前由國成麵粉使用中的生產用土地 8955 坪，另由國成麵粉出資 6.74 億元，買下 6060 坪的生產用土地及 3374 坪的現有生產中廠房，也就是國成麵粉將現有租用運用中的土地及廠房，透過本身的資金及大股東大成的投資，將資產買下。同時，大成此次加碼買下的國成麵粉營業用土地、廠房資產，交易對象為持有國成麵粉 45% 股權的國豐實業，而國豐實業的代表人陶傳正，也為大成的獨立董事。大成董事長特助周叔恆指出，國成麵粉為大成的高雄楠梓廠遭徵收後，北上與國豐實業合資的麵粉廠，由大成持股 55%，國豐持股 45%，成立已 10 年，目前日產麵粉 390 公噸，仍有後續的發展計畫將執行。,"[['加碼', '逾', '爲國成麪粉'], ['重大訊息', '指出', '國成麪粉出資'], ['大成', '出資', '9.17億元'], ['交易對象', '爲', '持有45%股權國豐實業'], ['大成的高雄楠梓廠', '遭', '徵收']]"
0,20190226_757,〈免稅天堂沒了〉全球反避稅浪潮來襲 免稅天堂未來恐加入課稅行列企業想要透過到免稅天堂開設紙上公司節稅，這招已經行不通，開曼群島近日頒布，設籍當地的境外公司須證明在當地有實質經濟活動，勢將增加台商營運成本，也讓企業面臨去留兩難的困境，會計師對此建議，企業想留在當地，除要重新精算營運成本外，更要留意，未來這些租稅天堂是否會因全球反避稅壓力，而加入課稅行列。勤業眾信聯合會計師事務所稅務部會計師廖哲莉分析，面對免稅天堂的實質經濟活動要求，讓企業面臨留下來或離開的抉擇困境，如果決定繼續留下來，就要評估為滿足經濟實質而增加的營運成本。舉例來說，企業為保留公司稅籍，為增加經濟實質勢將提高集團營運成本，包括聘僱員工與董事的人事成本，此外，因必須有實際營運場所地址，因此郵政信箱 (P.O. Box) 可能不再適用，未來租金費用將提高。廖哲莉進一步指出，在滿足最低實質性要求後，也要考慮如果涉及關係人交易，自移轉訂價與 BEPS 行動方案之角度，集團企業間利潤與功能風險是否合理配置？如果決定裁撤集團境外公司，也要評估能否承擔因境外公司解散清算，而需處分資產或股權及組織重整之稅務成本，以及合約重議與簽約主體變更等議題。此外，若涉及營運模式及供應鏈變更，也須自投資架構及移轉訂價觀點，全盤檢討重組方案並重新定位集團功能、風險、成本與利潤的分配。資誠聯合會計師事務所稅務法律服務會計師曾博昇提醒，面對全球反避稅的環境帶來的制度變化，台資企業及個人應思考各項可行的調整方案，特別針對控股活動以外的其他應申報活動，例如配銷活動及無形資產活動。至於調整方案，曾博昇說明，包括調整交易模式、控股架構、變更稅務居民地點等，每個調整方案都會有相對的成本及效益，必須事先妥善分析評估，才能做出正確決策。,"[['免稅天堂', '恐', '加入課稅行列'], ['未來', '恐', '加入課稅行列'], ['免稅天堂恐加入課稅行列企業', '想要', '透過'], ['境外公司', '證明', '有實質經濟活動'], ['企業', '想', '留在當地'], ['精算', '營運', '成本'], ['租稅天堂', '加入', '課稅行列'], ['衆信聯合會計師事務所稅務部會計師廖哲莉', '分析', '面對經濟活動要求'], ['爲營運成本', '滿足', '經濟實質'], ['企業', '提高', '營運成本'], ['包括人事成本', '聘', '僱員工'], ['廖哲莉', '指出', '考慮是否'], ['集團企業間利潤風險', '是否', '配置'], ['臺資企業', '思考', '申報活動'], ['曾博升', '說明', '包括等調整交易模式'], ['調整方案', '有', '相對成本']]"
0,20190226_758,〈光寶科法說〉Q1營收季減幅與往年相近 仍可優於去年同期光寶科 () 今 (26) 日召開法說會，集團副董事長暨總執行長陳廣中表示，首季適逢營運淡季，營收季減幅將與往年相近，毛利率也會再下修，但整體表現將比去年同期好很多，全年毛利率目標仍維持逾 14.5%，至於高雄廠，預計 6 月可望投產。展望第 1 季，陳廣中指出，核心事業預期將穩健發展，包括雲端運算、LED 元件、LED 車用照明與 AI 智慧居家設備等，不過，由於第 1 季適逢營運淡季，工作天數少、需求也減少，預期營收季減幅度將與往年相近，毛利率也會再下修，但因已處分部分營運表現不佳的事業，因此預期第 1 季表現將比去年同期好很多。陳廣中表示，今年營運主要成長動能將來自雲端應用、LED 及戶外照明兩大主軸，儘管預期第 1 季毛利率將較去年第 4 季的 13.4% 再下修，但全年目標仍維持毛利率平均超過 14.5%。光寶科近來積極佈局車用領域，目前車用營收占比僅約個位數，營收規模超過百億元，但要挑戰雙位數營收占比，仍須時間醞釀。其中，車用攝像頭預計今年第 4 季試產，已取得歐洲 Tier 1 車廠訂單，但初期營收貢獻幅度較小，明年將會持續貢獻，但相關效益要到 2020 年才可望明顯發酵。談及美中貿易戰，陳廣中表示，目前客戶訂單因美中貿易戰而要求轉移訂單至台灣生產的較少，大多為考量資安因素，已將部分客戶要求的雲端網通與電源產品移回台灣生產，而高雄廠預計 6 月可望量產，屆時雲端與電源等產品將移至高雄廠生產。光寶科去年陸續處分部分事業，包括完成手機事業相機模組營業讓與，及可攜式機構事業群子公司股權出售等營運調整。陳廣中表示，處分其他不賺錢的事業為公司長期政策，目前也有將處分的事業正評估中。,"[['集團副董事長陳廣中', '表示', '首季適逢營運淡季'], ['首季', '適逢', '營運淡季'], ['毛利率目標', '維持至於', '高雄廠'], ['陳廣', '中指出', '好'], ['部分營運', '表現', '不佳事業'], ['陳廣中', '表示', '自'], ['成長動能', '自', '兩大主軸'], ['全年目標', '維持', '毛利率超過14.5%'], ['毛利率', '超過', '14.5%'], ['光寶科', '佈局', '車用領域'], ['營收規模', '超過', '百億元'], ['車用攝像頭', '預計', '試產'], ['陳廣中', '表示', '較少'], ['客戶訂單', '要求', '轉移訂單'], ['而', '要求', '轉移訂單'], ['高雄廠', '預計', '可望量產'], ['等雲端產品', '移至', '高雄廠'], ['光寶科', '處分', '部分事業'], ['陳廣中', '表示', '處分爲公司長期政策'], ['處分', '爲', '公司長期政策']]"
0,20190226_759,聖暉去年純益歷史新高 每股擬配15元現金股利 殖利率逾7%無塵室廠聖暉 () 今(26)日召開董事會，通過去年財報，稅後純益 10.49 億元，每股純益達 19.52 元，創歷史新高，聖暉表示，去年因 IFRS 15 新準則適用，調增保留盈餘約 6000 萬，加計此部份，每股稅後純益應更加亮眼；同時，聖暉董事會通過去年盈餘分配，每股擬配現金股利 15 元，以今日收盤價 195 元計算，殖利率達 7.7%。聖暉今日董事會也通過，提送子公司未來於大陸申請掛牌議案，聖暉表示，中國公司蘇州聖暉申請掛牌，目的是為快速拓展大陸業務、吸引當地專業人才、提高市場知名度及提升公司競爭力，如能順利完成上市程序，將有助對公司形象與業務帶來正面效益，並提升聖暉轉投資價值。聖暉表示，子公司大陸送件申請時程最快預計明年，將視整理發展情況調整，首要仍以公司健全體質，重視公司治理、人才培育及永續發展為目標。聖暉去年純益創年度新高，聖暉指出，因半導體、電子零組件及光電面板產業客戶營收貢獻明顯，且中國大陸隨中美貿易戰議題逐漸明朗，今年來看，台灣市場隨著廠商回流建廠及多產業特性，東南亞擴產需求也逐步增溫，2019 年營運預期仍可望持平或微幅成長。,"[['歷史新高殖利率', '逾', '召開董事會'], ['每股', '配', '元股利'], ['子公司', '申請', '掛牌議案'], ['聖暉', '表示', '目的是爲'], ['蘇州聖暉', '申請', '掛牌'], ['目的', '是', '爲'], ['聖暉', '表示', '大陸送件申請時程預計明年'], ['大陸送件申請時程', '預計', '明年'], ['聖暉', '指出', '貢獻']]"
0,20190226_760,〈免稅天堂沒了〉台商最晚明年底前申報 證明有實質營運過去台商基於稅務考量，會到有「免稅天堂」之稱的開曼或維京群島 (BVI) 設立紙上公司，在全球反避稅浪潮趨勢襲捲下，這些免稅天堂今年起陸續祭出規範，要求當地註冊公司須有實質經濟活動，會計師提醒，在當地設立公司的台商要儘快在 2020 年底前完成申報，證明有實質營運，以免遭註銷登記。免稅天堂今年以來紛紛立法，要求註冊當地公司需有實質經濟活動，以開曼群島為例，今年 1 月 1 日起要求在當地設立公司的台資企業或個人必須繳交年度報告，說明在當地的實質經濟活動，並完成相關申報，否則將祭出刑責、罰緩伺候，甚至註銷其登記。根據開曼群島日前公布的細則，在當地設籍註冊的控股公司，必須申報資料包括，實質營運活動，例如董事會成員與會議召開、員工人數、營運場所與設備，證明註冊公司並非虛幌一招的紙上企業。至於申報期限，則依公司設立時間點而異，因此滿足實質經濟要件的起算時間點也有所差異，其中 2019 年前設立的公司，有半年的法規緩衝期，因此滿足實質經濟要件的起算點可延後到今年 7 月 1 日起算；如果是 2019 年成立者，就要從開始進行相關申報活動起始日，就要滿足實質經濟要件。至於申報日期，則必須在年度財務年度結束日後的 12 個月後，舉例來說，某公司財務年度在今年 12 月 31 日結束，則必須在 2020 年 12 月 31 日進行申報。勤業眾信聯合會計師事務所稅務部會計師廖哲莉解釋，所謂「經濟實質性測試」要件，包括：一、須在境內進行產生核心利潤活動，也就是本業所得活動；二、針對相關活動進行適當管理，包括董事會成員與董事會召開紀錄，且會議要有策略性決議，三、境內要有適當營運費用與全職員工。資誠聯合會計師事務所稅務法律服務會計師曾博昇指出，建立實質需要考量當地的資源，並注意在申報年度結束日期前預留足夠的準備時間，這些都將與各該企業或個人現有的投資架構與交易模式密切相關。曾博昇建議，低稅區及免稅天堂的經濟實質法是國際租稅規則一個巨大的改變，透過開曼群島與其他低稅地區施行細則出爐，台資企業及個人應密切關注未來發展。,"[['維京羣島BVI', '設立', '紙上公司'], ['這些免稅天堂', '祭出', '規範'], ['會計師', '提醒', '設立公司臺商完成申報'], ['當地', '設立', '公司'], ['設立公司臺商', '完成', '申報'], ['當地', '設立', '公司'], ['董事會成員', '證明', '註冊公司並非紙上企業'], ['註冊公司', '並非', '紙上企業'], ['因此', '滿足', '起算'], ['滿足起算時間點', '有所', '差異'], ['設立公司', '有', '法規緩衝期'], ['從', '開始', '進行申報活動'], ['衆信聯合會計師事務所稅務部會計師廖哲莉', '解釋', '經濟實質性測試要件包括'], ['董事會成員', '召開', '紀錄'], ['會議', '有', '策略性'], ['三境內', '有', '營運費用'], ['建立實質', '需要', '當地資源'], ['曾博升', '建議', '經濟實質法是巨大改變'], ['經濟實質法', '是', '巨大改變'], ['臺資企業', '關注', '未來發展']]"
0,20190226_761,合勤控子公司組織重整 強化通路與市場端布局合勤控 () 今 (26) 日宣布，100% 持股子公司合勤科技，及其子公司合勤丹麥(Zyxel Communications A/S)，決議分割減資，擬將合勤科技及合勤丹麥通路業務事業群下之各營運事業處，分別分割讓與新設子公司兆勤科技，及其新設之子公司兆勤丹麥(Zyxel Networks A/S)，強化通路與市場布局效益。合勤控表示，透過組織分割調整後，合勤科技將專注於電信事業市場發展，提供完整架構性的解決方案與應用服務給電信服務供應商，滿足其客製化需求。此外，分割新設之兆勤科技將完全聚焦於通路業務發展，著眼於企業對無線連網與雲端運用，藉由通路與市場端的明確區隔，強化各布局效益。本次合勤科技預計分割讓與之資產總額約 21 億元，負債總額約 9 億元，營業價值計 12 億元，合勤科技同時辦理減資 7.24 億元，預計減資比例約為 50%，分割減資後，合勤科技資產總額約 65.23 億元，實收資本額約為 7.24 億元，淨值約 38.49 億元。兆勤科技及兆勤丹麥將分別發行新股予合勤控，及兆勤科技作為分割受讓對價，預計將發行普通股 7245 萬股換取分割受讓對價，受讓之營業價值超出股本部份列為資本公積，分割基準日擬訂於 4 月 1 日。合勤控表示，此分割案為集團內之組織調整，分割後合勤科技與兆勤科技均為合勤控 100% 持股之子公司，並不會影響合勤控之股東權益。,"[['控子公司', '組織', '重整'], ['持股子公司合勤科技', '決議', '分割'], ['合勤控', '表示', '將專注'], ['將', '專注於', '電信事業市場發展'], ['分割新設之兆勤科技', '聚焦於', '業務發展'], ['實收資本額', '爲', '7.24億元'], ['淨值', '約', '38.49億元'], ['兆勤科技', '發', '新股予合勤控分割受讓對價'], ['新股', '予合', '勤控'], ['新股', '予合', '勤控'], ['股本部份', '列爲', '資本公積'], ['合勤控', '表示', '此分割案爲組織調整'], ['此分割案', '爲', '組織調整'], ['合勤科技', '均爲', '持股子公司']]"
0,20190226_762,黑松切入兩岸氣泡水市場 添加膳食纖維切入健康概念台灣去年氣泡水產品成為飲料市場年度重要話題，黑松 () 繼泰山 () 之後，也將在明 (27) 日推出添加膳食纖維的氣泡水飲品，搶攻全台 1 年 10 億元市場規模商機，同時，此新產品也將在中國大陸北京、天津同步上市。這是黑松公司在既有碳酸飲料黑松沙士、即飲茶、咖啡產品之外，拓展的新品項，黑松推添加膳食纖維的氣泡水，並添加日本專利的膳食纖維，約等於 3.3 顆蘋果的纖維含量，促進腸道蠕動為重要訴求，並鎖定 25-34 歲的年齡層消費群行銷。黑松董事長張斌堂指出，新推出的氣泡水飲品，鎖定的年齡層略較現有黑松碳酸飲料消費群略年長，同時也加入保健概念，而氣泡水產品，所想引導出的為生活情境清爽感受。近年來清涼暢快的氣泡水在亞洲及歐美地區快略長速成長，張斌堂指出，黑松此次推出添加膳食纖維的氣泡水，其中並加入健康的訴求元素，藉以與現在市場做出區隔。健康訴求將是品牌未來新產品方向，另外下半年也會有跨界新產品推出。,"[['黑松', '切入', '水市場'], ['氣泡水產品', '成爲', '重要話題'], [') 泰山', '推出', '氣泡飲品'], [') 泰山推出氣泡飲品', '添加', '膳食纖維'], ['這', '是', '黑松公司拓展新品項'], ['在', '既有', '碳酸飲料黑松沙士'], ['推', '添加', '氣泡水'], ['促進腸道蠕動', '等於', '纖維含量'], ['黑松董事長張斌堂', '指出', '年長'], ['張斌堂', '指出', '黑松推出添加氣泡水'], ['黑松', '推出', '添加氣泡水'], ['健康訴求', '是', '未來新產品方向']]"
