,News,All,SVO
0,20200527_1068,金管會推信託2.0計畫 信託公會三路出擊打造全方位安養信託金管會主委黃天牧宣示推動信託 2.0 計畫，透過跨產業合作結合現有的金融商品與政策滿足各年齡層的信託安養需求，信託公會理事長雷仲達強調，信託公會未來將從三大面向執行，包括：打造友善住宅、推動在地安養，協助資產管理保障經濟安全、跨業合作結盟滿足各種服務需求，目標在三個月內邀請產學界研議推動計畫。黃天牧日前公開指出，為達到政府的普惠金融目標，金管會將推動信託 2.0 計畫，推動跨產業結盟全方位信託，結合現有金融商品，透過異業結盟建構多元化服務生態圈，滿足食衣住行育樂全方面需求信託，希望銀行業務的融資與地上權信託、不動產開發信託等，可以結合都市更新或利用公有閒置土地開發安養住宅，達各年齡層需要的安養需求。雷仲達指出，過去信託業雖已有類似的安養信託業務，但主要以標準化的信託商品為主，缺乏客製化商品，加上缺乏跨業結合，因此未來將會鼓勵業者發展相關業務。雷仲達進一步指出，信託公會擬規畫打造友善住宅，推動在地安老，同時協助資產管理，保障經濟安全；透過跨業合作結盟，滿足多元高品質服務需求之三大面向出發，以達到人身照顧、健康醫療、社會福利及生活育樂之四大目標，並於三個月內邀請學者專家及信託業者積極研議具體推動執行規畫。信託公會祕書長呂蕙容指出，信託公會未來將持續推動異業結盟，將信託與長照 2.0 計畫、健康醫療、社福團體及照護相關產業結合，建立跨業溝通合作平台，定期開會研商以強化信託與不同產業間之聯結。另外，考量全方位信託服務須具備整合跨領域知識技能之專業能力，將推動「高齡金融規劃顧問師」等培訓計畫，提升信託人員跨領域專業知識技能及整合能力，並與相關政府機關、社福團體與地方金融共同協力推動，滿足各年齡層食衣住行育樂全方位需求安養目的。,"[['跨業合作結盟', '滿足', '服務需求'], ['黃天牧', '指出', '金管會推動2.0計劃'], ['金管會', '推動', '2.0計劃'], ['推動全方位信託', '跨', '產業結盟'], ['等融資', '結合', '都市更新'], ['雷仲達', '指出', '鼓勵'], ['過去信託業', '已有', '安養信託業務'], ['雷仲達', '指出', '規畫'], ['信託公會祕書長呂蕙容', '指出', '信託公會推動異業結盟'], ['信託公會', '推動', '異業結盟'], ['考量信託服務', '具備', '專業能力'], ['考量信託服務具備專業能力', '整合', '知識技能'], ['整合知識技能', '跨', '領域'], ['信託人員', '跨', '領域']]"
0,20200527_1069,熱映4月純益年增逾200倍 每股賺2.35元熱映 () 今 (27) 日公告自結，受惠體溫測量產品可開始銷往國外市場，4 月稅後純益 1.02 億元，年增 202.4 倍，每股純益 2.35 元。熱映 3-4 月營收 4.14 億元，年增 2.25 倍；稅後純益 1.97 億元，年增 47 倍，每股純益 4.56 元。法人表示，熱映主力產品為溫度量測品，營收比重近 7 成，自新冠肺炎疫情爆發後，推升體溫量測需求增加，今年初開始訂單大舉湧入，產品單價、利潤也同步翻漲。因應國內政府政策，4 月開始溫度量測產品可銷往國外，預期第 2 季營收、獲利都將進一步成長。熱映董事會日前也決議，每股擬配發現金股利 1 元，包括現金股利 0.265 元及資本公積配發 0.735 元，股利寫近 4 年最佳。,"[['熱映', '逾', '200倍'], ['受惠體溫測量產品', '開始', '銷往國外市場'], ['每股', '純益', '4.56 元'], ['法人', '表示', '映主力產品爲溫度量測品'], ['映主力產品', '爲', '溫度量測品'], ['，', '推', '體溫量測'], ['溫度量測產品', '銷往', '國外'], ['熱映董事會', '決議', '每股配']]"
0,20200527_1070,〈友訊經營權之爭〉股東委託律師赴北檢告5董事背信 公司擬提誣告回擊網通廠友訊 () 經營權之爭延燒至法律戰，名列市場派股東常會委託書徵求人之一的股東黃俊仁，今 (27) 日委託律師，赴北檢針對公司派 5 名董事提告；對此，友訊也反擊表態將提出誣告。友訊 25 日董事會通過將股東常會日期由 6 月 15 日延至 6 月 29 日，遭證交所質疑公司變更股東會日期的適法性並重罰 30 萬元，同時要求友訊限期改善，否則將按次處違約金或列為變更交易方法有價證券。友訊股東黃俊仁今日發出聲明，認為友訊董事會執意維持延後開會的決議，恐導致友訊繼續遭證交所裁處違約金，甚至因此遭證交所列為變更交易方法之有價證券，打入全額交割股，屆時股價將因此受到重創，恐怕將造成友訊及全體股東超過 500 萬元的鉅額損害。因此，黃俊仁今日也委託律師，前往台北地檢署，對出席 25 日董事會的董事胡雪、顧啟東、高宏毅、宋正一，以及獨董陳立君等 5 人，提出刑法第 342 條背信罪及證券交易法第 171 條第 1 項第 3 款特別背信罪之刑事告訴。對此，友訊則重申，董事會決議合法有效，絕無程序違法或侵害股東及公司利益，無損害公司利益之背信⾏為市場派利⽤股東名義，對於董事提起背信等不實告訴，也將協助董事對不實指控之⼈提出誣告之訴追，以正視聽！,"[['股東委託律師', '赴', '北'], ['董事背信公司', '擬', '誣告回擊'], [')網通廠友訊經營權爭', '延燒至', '法律戰'], ['股東黃俊仁', '委託', '律師'], ['友訊', '反擊', '表態'], ['質疑公司', '變更', '股東會日期適法性'], ['友訊股東黃俊仁', '發出', '聲明'], ['友訊董事會', '執意', '維持延後決議'], ['執意', '恐', '導致'], ['證交所', '列爲', '有價證券'], ['證交所列爲有價證券', '變更', '交易方法'], ['股價', '受到', '重創'], ['友訊', '超過', '500 萬元'], ['全體股東', '超過', '500 萬元'], ['黃俊仁', '委託', '律師'], ['對', '出席', '25日董事會'], ['友訊', '重申', '合法'], ['，', '無損害', '公司利益'], ['市場', '爲', '股東名義'], ['董事', '提起', '背信']]"
0,20200527_1071,"蔡明彰觀點：解封日賣防疫股買成長股今天報告的主題是「解封日賣防疫股買成長股」。全球都步入了解封的時刻，美國國殤日人潮湧現，全美 50 洲都已逐漸放寬防疫禁令，西班牙對外國觀光客不用入境 14 天的隔離，日本也解除了全國緊急狀態，台灣將會在 6 月 7 日起大量解封，對休閒集會活動不限制人數，所以來到了解封日，對全球的投資人到底是買股還是賣股呢？萬寶投顧蔡明彰強調，回顧主要的國際股市低點都出現在疫情最緊張的時刻，比如說台股的 8,523 點、的 18,213 點，都發生在疫情最緊張的 3 月份，買在期待、賣在事實，所以解封日反而是賣點，其實是有點道理的。但是，賣什麼股票？應該是賣防疫概念股，疫情下的生技故事很火，但是到底是救星還是泡沫呢？5 月中旬，今年中國生物科技行業的股權融資達到了 68 億美元，IPO 募資超過了 21 億美元，比去年同期倍翻，香港生技指數今年大漲 14％，對應下跌 15％，生技股的確是大漲。另外，台灣的生技醫療指數今年以來也漲了 4％，但是對比大盤下跌了 8％，生技股的確火紅。但是，很多正在發展新冠藥物的企業，距離成功的路途還很遙遠，所以估值太高，舉例康希諾生物 ()，這是中國軍方生物工程研究所的研究團隊，在新冠疫苗當中已經發展了第一期的臨床試驗，這是全球第三支、亞洲第一支的疫苗，但是就在利多頻傳的時候，5 月 21 日在港股，一天閃崩將近 30％，從 2019 年 3 月在香港掛牌，康希諾生物從 22 元飆到了今年的高點 285 元，大漲了 12 倍。大家認為它現在的估值已經超過了它的基本面。根據世衛組織 5 月 15 日的公佈，全球一共 118 個研發新冠疫苗，8 個進入了臨床試驗。其中，中國 4 個、美國 2 個、德國跟美國合作 1 個、英國 1 個。但是，看台灣兩大疫苗公司國光生 ()、高端疫苗 ()) 都還沒有進入了一期的臨床試驗，但今年股價分別大漲了 1.4 倍跟 2.5 倍。另外，美國最知名的莫德納 (Moderna) 也是新冠疫苗已經發展第一期試驗，但是從利多發佈之後，從高點已經回調了 30％。萬寶投顧蔡明彰強調，我們知道防疫跟消費是對立的行為，但 6 月 1 日開始，台灣口罩自由買賣，業者初期可以出口接大單，但長期以大陸百倍的產能競爭，將會出現供過於求。所以，口罩的股票可能慢慢出現了高點，當然可能會採取打帶跑的手法震盪出貨，但是基本上，說故事的行情已經沒有了，恆大 () 今年漲 8 倍，EPS 估計雖然有 10 元以上，但是明年開始獲利能力打回原形，雖然本益比 15 倍不高，但是，回歸它的基本面，股價淨值比卻高達了 7 倍。這是什麼概念？我們對比了台積電 ()，股價淨值比不到 5 倍，大立光 () 只有 4 倍，所以，這個口罩股的基本面，股價已經遠遠超過了基本面。所以，解封的時候，真正要買的是成長股，成長股將成為未來台股的最大主流，我們找出產品有長期實質的需求，但個股的營收，EPS 成長搭配了除息行情的高殖利率，將會是未來選股的主軸。6 月 7 日台灣大量解封，也是股東會的一個旺季，緊接 7、8 月的除息，所以找出一些個股。但，今年的除息有一個很大的陷阱，因為股息來自去年的 EPS，但是今年的新冠疫情影響到非常多公司的成長，所以你假如參加除息，對於這種沒有成長的公司，將會賺股息、賠價差。所以，成長股才能參加除息，在電子股當中，從今年前 4 個月的營收的成長率來看，有 15 檔是超過了 50％，包括了宣德 () 年成長 154％，宏捷科 () 成長 151％，精材 () 成長 133％、玉晶光 () 成長 121％、鈊象 () 成長了 89％、倉和 () 成長 88％、勤凱 () 成長 86％、博智 () 成長 85％、立積 () 成長 85％、穩懋 () 成長 65％，昇佳電子 () 成長 65％、原相 () 成長 64％，敦泰 () 成長 60％，旺宏 () 成長 59％，茂林 - KY() 成長 57％。但是這些公司當中，有一些今年以來的績效依然是負報酬，包括宣德、宏捷科、玉晶光、立積、穩懋、昇佳電子、旺宏都是負報酬。但是在禮拜三的盤面，我們可以看到，記憶體的股價，華邦電 () 拉出漲停，站回了淨值，2020 年第一季全球記憶體的銷售 280 億美元，終結了連五季的下滑。所以，在後疫情的時代，5G 手機的一個加溫，預計 NOR Flash 第二季延續第一季的價量齊揚，所以有些公司，這個除了旺宏的這個獲利成長以外，有一些公司，在第一季財報的存貨大量增加，比如說群聯 ()、威剛 ()、宇瞻 ()，存貨大量增加，假如記憶體的價格價量齊揚，將會有庫存的增值利益，在禮拜三當中，宇瞻成為低檔記憶體改寫歷史的新高。另外，宣德隨著母公司的立訊精密第一季毛利率，已經回升到 20％，較去年同期大增 5％，所以顯示它的學習曲線已經完成，今年營收倍增， EPS 也可望成長一倍，母公司立訊精密將會在 AirPods 之外，也有可能在今年切入了 iPhone 12 的組裝，帶動了宣德的成長。還有感測器的昇佳電子 ()，即將上櫃，應該有蜜月行情，今年的 EPS 估計從 35 元成長到 40 元，對於母公司矽創 () 也帶來可觀的利益跟獲利的成長。立即免費加入蔡明彰粉絲團，可獲得更多資訊分享蔡總選黑馬蔡明彰 FB 社團蔡總選黑馬蔡明彰 telegram 粉絲團蔡總選黑馬蔡明彰 LINE 粉絲團本公司所推薦分析之個別有價證券無不當之財務利益關係 以往之績效不保證未來獲利投資人應獨立判斷 審慎評估並自負投資風險","[['今天報告主題', '是', '賣防疫股買成長股'], ['都', '步入', '瞭解封'], ['50洲', '放寬', '防疫禁令'], ['對外國觀光客', '入境', '14天隔離'], ['日本', '解除', '全國緊急狀態'], ['休閒集會活動', '限制', '人數'], ['回顧國際股市', '出現在', '緊張時刻'], ['解封日', '是', '賣點'], ['股權融資', '達到', '68 億美元'], ['IPO募資', '超過', '21億美元'], ['正在', '發展', '新冠藥物'], ['，', '距離', '成功'], ['這', '是', '研究團隊'], ['這', '是', '全球第三支疫苗'], ['康希諾生物', '飆', '今年高點285 元'], ['大家', '認爲', '現在估值超過它基本面'], ['現在估值', '超過', '它基本面'], ['全球', '研發', '新冠疫苗'], ['()', '進入', '臨牀試驗'], ['今年股價', '大漲', '1.4倍'], ['新冠疫苗', '發展', '第一期試驗'], ['萬寶', '投顧', '蔡明彰'], ['我們', '知道', '防疫是對立行爲'], ['防疫', '是', '對立行爲'], ['業者', '接', '大單'], ['口罩股票', '出現', '高點'], ['，', '說', '故事'], ['能力', '打回', '原形'], ['股價淨值', '高達', '7倍'], ['這', '是', '什麼概念'], ['我們', '對比', ')臺積電'], ['大立光)', '只有', '4倍'], ['股價', '超過', '基本面'], ['要買的', '是', '成長股'], ['成長股', '成爲', '最大主流'], ['我們', '找出', '產品有長期實質需求'], ['產品', '有', '長期實質需求'], [' 成長', '搭配', '高殖利率'], ['臺灣解封', '也是', '一個旺季'], ['今年除息', '有', '很大陷阱'], ['股息', '來自', ' EPS'], ['新冠疫情', '影響', '多公司成長'], ['你', '參加', '除息'], ['成長股', '參加', '除息'], ['15檔', '超過', '50％'], ['有15檔超過50％', '包括', '玉晶光60％成長'], ['今年以來績效', '是', '負報酬'], ['宣德', '都是', '負報酬'], ['我們', '看到', '華邦電)拉出'], ['一個加溫', '預計', '在存貨增加'], ['NOR Flash', '延續', '第一季'], ['第二季', '延續', '第一季'], ['宇瞻', '成爲', '低檔記憶體'], ['宣德', '回升到', '20％'], ['母公司立訊精密', '切入', '12iPhone組裝'], ['今年EPS', '估計', '帶來可觀利益'], ['加入蔡明彰團', '蔡明彰', '粉絲'], ['個別有價證券', '無', '財務利益關係'], ['以往績效', '保證', '獲利投資人']]"
0,20200527_1072,專案進度遞延影響 聖暉謹慎看今年無塵室機電工程廠聖暉 () 今 (27) 日召開股東會，展望後市，聖暉認為，由於疫情干擾，短期專案進度認列遞延，今年展望謹慎看待，但長期仍看好半導體、被動元件產業投資力道。聖暉指出，雖短期營運受專案進度遞延影響，但長期在半導體、被動元件等電子業調高資本支出支撐下，有助接單金額成長，且隨著台商回流，以及全球供應鏈轉移至東南亞國家，未來營運正向看待。此外，美國進一步擴大限制對華為的技術輸出，預期將加速中國半導體自主化及 5G 布局，皆有助無塵室廠務設備需求升溫，期望憑藉高接單彈性，挹注公司未來營運成長。聖暉股東會今日通過，每股擬配發 15 元現金股利，連 9 年現金股利配發率達 65%，依今日收盤價 209.5 元計算，殖利率達 7.16%。,"[['專案進度遞延', '影響', '今年無塵室機電工程廠聖暉召開股東會'], ['今年無塵室機電工程廠聖暉', '召開', '股東會'], ['聖暉', '認爲', '看好投資力道'], ['聖暉', '指出', '看待營運'], ['短期營運', '受', '影響'], ['美國', '擴大', '技術輸出'], ['殖利率', '達', '7.16%']]"
0,20200527_1073,投審會通過頂新集團匯回40億元增資台灣之星 將布局5G經濟部投資審議委員會今 (27) 日核准 7 項重大投資案件，其中，頂新集團透過美成集團匯回 40 億元，轉增資台灣之星，以因應未來 5G 建設，並改善公司財務結構，另外日商壽司郎也申請匯入 2.5 億元，在台灣開設新餐廳。經濟部表示，在僑外投資方面，也通過盧森堡商綠島再生能源以 11.93 億元增資寶島陽光再生能源，並轉增資曄恆能源，經營發電業，也通過新加坡商 RAKUTEN ASIA 以 5.2 億元增資台灣樂天，經營其他綜合商品零售業，並轉增資大高熊育樂，經營職業運動業。中資來台投資方面，新加坡商 SUNGROW POWER 將以 6000 萬元投資設立台灣陽光電源，經營能源技術服務業、電池批發業等。另外，經濟部也通過臺南紡織以 6200 萬美元 (約 18.65 億元) 增資新加坡子公司，從事棉紗銷售及投資控股業務；欣興 () 以 5000 萬美元 (約 15.44 億元) 間接增資中國蘇州群策科技，增資後持股比例將達 79.43%，經營載板及高密度互連基層板之設計、研發、生產及加工業務。,"[['頂新集團', '透過', '美成集團'], ['日商壽司郎', '申請', '匯入'], ['經濟部', '表示', '增資陽光再生能源'], ['新加坡商SUNGROW POWER', '設立', '陽光電源'], ['經濟部', '從事', '棉紗銷售業務'], ['欣興)', '增資', '羣策科技'], ['持股比例', '達', '經營載板設計業務']]"
0,20200527_1074,遭爆郭台銘捐款台大癌醫資金未到位 郭辦：已捐近40億元並無條件說鴻海 () 創辦人郭台銘遭周刊報導，「有條件」捐贈台大癌醫後續 50 億元及資金未到位，對此，郭台銘辦公室今 (27) 日發出聲明強調，已依台大癌醫需求捐贈標的合約金額有近 40 億元，不存在任何「條件說」。周刊媒體爆料，郭台銘捐贈成立的台大癌醫面臨營運困境，主要是因為郭台銘去年承諾續捐的 50 億元，因有「自己的捐款時間表」未能到位，導致台大癌醫財務吃緊，向廠商訂購 MRI(核磁共振成像) 等儀器也因沒資金付款無法組裝驗收。對此，郭台銘辦公室下午發表聲明澄清，指出郭台銘有條件式捐贈台大癌醫後續 50 億元及資金未到等，均為不實報導，捐贈台大癌醫不存在任何「條件說」。郭辦進一步表示，截至目前為止，與台大校長管中閔 50 億元捐贈合約履行情況，已依台大癌醫需求，捐贈標的合約金額有近 40 億元，依相關進度及完成行政流程出帳現金近 30 億元。最後郭辦強調，不實報導已對郭台銘名譽造成損害，立即要求下架與修正內容，否則將向法院提告。,"[['郭辦', '遭爆', '臺大癌醫資金到位'], [' 創辦人郭臺銘', '遭', '週刊報導'], ['郭臺銘辦公室', '發出', '聲明'], ['依臺大癌醫', '需求', '捐贈'], ['依臺大癌醫', '需求', '捐贈'], ['合約金額', '有', ' 億元'], ['週刊媒體', '爆料', '郭臺銘捐贈臺大癌醫面臨營運困境是因爲郭臺銘承諾續捐50億元'], ['郭臺銘捐贈臺大癌醫', '面臨', '營運困境'], ['郭臺銘捐贈臺大癌醫面臨營運困境', '是因爲', '郭臺銘承諾續捐50億元'], ['郭臺銘', '承諾', '續捐50億元'], ['儀器', '組裝', '驗收'], ['捐贈臺大癌醫', '不存在', '條件說'], ['郭辦', '表示', '履行情況'], ['合約金額', '有', ' 40億元'], ['郭辦', '強調', '提告'], ['不實報導', '造成', '損害']]"
0,20200527_1075,是方IDC、雲端服務需求強勁 全年營收維持雙位數成長中華電 () 小金雞是方電訊 () 總經理劉耀元今 (27) 日表示，公司四大產品線中，以 IDC、雲端服務應用成長最強勁，其中雲端服務今年首季營收年增 30%，看好 5G、物聯網趨勢，預期雲端成長動能可望維持雙位數。是方電訊有四大產品線，包括 IDC 機房服務、數據網路服務、語音通訊服務及雲端應用服務，劉耀元表示，各產品線環環相扣，其中以 IDC 與雲端應用成長最快速，相比其他電信產業，是方有 9 成是月租型客戶，也讓營收相對穩定。雲端服務已是未來趨勢，在全球公有雲市場中，Google、微軟、Amazon、IBM 等供應商，已控制全球四分之三的雲服務市場，雲服務也成為企業必須擁有的服務項目之一。展望後市，劉耀元指出，今年首季雲端應用服務營收年增 30%，隨著雲服務需求持續擴大，成長動能可望持續至下半年，加上今年下半年台灣電信商將陸續提供 5G 服務，不過預期最快要到明年下半年至 2022 年上半年，才會有大量的 5G 使用者，不過仍可望對攝據服務有正面挹注。針對新冠肺炎疫情，劉耀元表示，疫情對公司營運有正、負面影響，正面為，B2C 的消費者追劇需求增加，網路頻寬、流量同步成長；但另一方面飯店、觀光業者的網路使用量下滑，正反衝擊下，對公司營運影響並未有太大變化。,"[['小金雞', '是', '方電訊'], ['總經理劉耀元', '表示', '最強勁'], ['方電訊', '有', '四大產品線'], ['劉耀元', '表示', '產品線環環相扣'], ['成', '是', '月租型客戶'], ['雲端服務', '是', '未來趨勢'], ['雲服務', '成爲', '服務項目之一'], ['劉耀元', '指出', '年增30%'], ['年', '增', '30%'], ['成長動能可望', '持續至', '下半年'], ['將', '提供', '5G服務'], ['劉耀元', '表示', '對公司營運有正影響'], ['對公司營運', '有', '正影響'], ['正面', '爲', 'B2C消費者追劇需求增加'], ['B2C消費者', '追', '劇'], ['B2C消費者', '追', '劇'], ['對公司營運影響', '有', '大變化']]"
0,20200527_1076,興富發金山凱悅飯店今動工 擬2022年底開幕營建業集團包括興富發 ()、鄉林 ()、皇鼎 ()、亞昕 () 等都在擴大飯店事業版圖，建商興富發在北、中、南打造五星級飯店，其中「金山凱悅飯店」今 (27) 日動土，預計 2022 年年底開幕。興富發總裁鄭欽天今天指出，相較宜蘭礁溪、新北市烏來、台北市北投以及新北市金山等 4 個北台灣溫泉熱區，發現金山地價最便宜，加上擁有新北市最漂亮的海岸線，因此選擇在此投入 15 億元打造溫泉飯店。興富發集團投資的「金山凱悅飯店」基地在新北市金山區環金路上，基地約 3024.02 坪，預計興建地上 11 層、地下 1 層的溫泉飯店，未來將規劃 188 間溫泉套房，每晚房價落在 4500-5500 元。「金山凱悅飯店」還將在飯店旁興建一棟複合式的溫泉會館，為地上 9 層、地下 2 層，將規劃 21 間計時泡湯、大眾湯池、宴會廳，以及會議室、婚禮教堂等。鄭欽天今天在「金山凱悅飯店」動土現場表示，過去旅客到金山多數是「過客」，沒有久待與停留一晚的誘因，在飯店蓋好後，便能增加旅客在金山停留一晚的理由。目前為新冠肺炎疫情全球擴散的同時，在此時投入飯店事業是否會有疑慮，鄭欽天表示，疫情已逐步趨緩，加上興建時間將近 2 年，相信在開幕的時間點，疫情應該得到有效控制，相當看好那個時間點國旅帶來的商機。新北市市長侯友宜指出，金山是新北市海岸線皇冠上最亮眼的一顆珍珠，而且也已經在金山地區推動「城鎮之心」的建設計畫，未來不要重振擁有 300 年歷史的金山觀光。興富發在去年完成高雄悦誠廣場跨入百貨流通業，接下來也將進入北台灣百貨市場，將分別在新北市金山、台南及高雄等地開設飯店營運，跨出營建業大步。,"[['擬開幕營建業集團', '包括', '等興富發'], ['今天', '指出', '選擇投入15億元'], ['加上漂亮海岸線', '擁有', '新北市'], ['興富發集團投資金山凱悅飯店基地', '在', '新北市金山區環金路上'], ['3024.02坪基地', '預計', '興建地上11層'], ['房價', '落在', '4500-5500元'], ['金山凱悅飯店', '興建', '溫泉會館'], ['鄭欽天', '表示', '多數是過客'], ['過去旅客', '到', '金山'], ['多數', '是', '過客'], ['投入飯店事業', '有', '疑慮'], ['鄭欽天', '表示', '疫情趨緩'], ['疫情', '得到', '有效控制'], ['新北市市長侯友宜', '指出', '金山是一顆珍珠'], ['金山', '是', '一顆珍珠'], ['興富發', '完成', '跨入百貨流通業'], ['高雄悅誠廣場', '跨入', '百貨']]"
