,News,All,SVO
0,20130322_3170,國票證券：6日RSI呈現低檔背離小底部型態 為多頭注入希望盤勢分析在FED維持寬鬆貨幣政策的激勵下，美股收紅盤中再創新高，週四台股持續5日線到季線附近的窄幅震盪，尾盤在權值股摜壓之下，收盤僅小漲11點，收在7811點，成交量降為702億元，K線連收8黑。上市櫃類股呈現漲跌互見，其中以橡膠、其他與營建等類股表現最強。籌碼面，三大法人合計賣超49.74億元，其中外資賣超45.56億元，但外資在期貨未平倉淨部位，多單增加193口，餘淨多單2112口。以類股來看，跌深的非金電指數拉回半年線後在陸股反彈與自行車展帶動之下呈現反彈，至於電子與金融指數仍在整理，短期大幅向上的驅動力仍嫌不足。若從盤面結構來看，部分基本面佳的個股面臨到本益比倍數不低的問題，箝制市場的追高意願，電子股受到蘋果庫存調整，壓抑包括概念股在內之高價股的表現空間，故目前盤面多由中小型跌深反彈股或具備想像題材的個股率隊表現，然而在季底年報效應增強下，此類股的撐盤與攻擊力道將不若績優股紮實，預計盤勢將進入區間整理。操作建議台股K線連收7黑後，隨著美股走高而上漲，不過反彈力道不大、成交量縮，不僅連續數日低於5日均量，週四又縮至702億，減低短期反彈動能，目前下彎的5、10日、月線與3/18空方缺口形成台股上檔蓋頭反壓，技術指標9日K值翻落到超賣區以後，與9日D值的負開口擴大，空頭氣氛仍強。不過，下方半年線持續墊高，且目前5日線下彎至7837，週五扣抵到7811點附近後可望走平，且6日RSI呈現低檔背離的小底部型態，為多頭注入希望，預計1/29多方缺口到半年線區應可發揮支撐作用。考量支撐與壓力後，預期後市指數應會在1/29多方缺口至3/18缺口上緣震盪，近日若見到指數彈升但成交量卻未跟上時，反彈逢壓仍應調節，待震盪拉回後可視題材性與業績面短多因應。強勢股部份，2106建大受惠於中國自行車市場需求持續成長，及原料下跌、利差擴大，9939宏全近期接獲康師傅訂單、時序逐步進入旺季及新產線投產效應下，營運業績均可望有所表現，逢低可多作留意。,"[['RSI', '呈現', '低檔'], ['FED', '維持', '寬鬆貨幣政策'], ['FED', '維持', '寬鬆貨幣政策'], ['K線', '收', '8黑'], ['上市櫃類股', '呈現', '漲跌見'], ['賣', '超', '49.74億元'], ['外資賣', '超', '45.56億元'], ['期貨平倉部位', '增加', '193口'], ['深非金電指數', '呈現', '反彈'], ['短期向上驅動力', '嫌', '不足'], ['電子股', '受到', '蘋果庫存調整'], ['盤面', '包括', '表現空間'], ['或', '具備', '想像題材'], ['盤勢', '進入', '區間整理'], ['缺口', '形成', '反壓'], ['5日線下', '彎至', '7837'], ['6日RSI', '呈現', '小底部型態'], ['/29多方缺口', '到', '線區'], ['1/29多方缺口', '至', '18'], ['1/29多方缺口', '至', '18'], ['大', '受惠於', '中國自行車市場'], ['營運業績', '有所', '表現']]"
0,20130322_3171,統一證券：台股指數欠缺上攻動能，不易突破上檔壓力【昨日盤勢】:受到美股收紅激勵，昨日台股開盤上漲30點，以7828點開出，但隨即陷入狹幅震盪，由於成交量持續萎縮，買盤保守，尾盤時賣壓出籠，漲幅回吐。觀察盤面，傳產類股表現搶眼，其中營建類股受惠329檔期，整體上漲1.29%；橡膠類股則在建大攻上漲停帶動之下，整體大漲2.54%；汽車類股亦有1%以上的漲幅。金融類股維持高檔盤堅，類股指數小跌0.1%。反觀電子股走勢較弱，高價股宏達電、可成、聯發科、F-TPK跌幅均在1%以上，台積電亦在尾盤由紅翻黑，成為盤面壓力。終場上漲13點，以7811點作收，成交量萎縮為682億元。【資金動向】:三大法人合計賣超49.5億元。其中外資賣超45.5億元，投信賣超1.5億元，自營商賣超2.5億元。外資買超前五大為群創、群創、富邦金、中壽、仁寶、寶滬深；賣超前五大為台積電、兆豐金、聯電、中鋼、日月光。投信買超前五大為台表科、勝華、中壽、光寶科、長榮航；賣超前五大為永豐金、群創、開發金、兆豐金、奇美材。資券變化方面，融資增加3.39億元，融資餘額為1822億元，融券增加0.8萬張，融券餘額為54.9萬張。【今日盤勢分析】:在國際股市方面，美股持續利多加持，聯準會主席柏南克強調維持寬鬆政策；參、眾兩院皆通過臨時預算案，政治風險再度降低；3月費城製造業指數從前月的-12.5上上升至2.0，大幅優於預期，因此美股四大指數昨日雖然漲多修正，但整體仍維持高檔盤堅格局。陸股則是受惠3月匯豐中國製造業PMI初值為51.7，較2月終值50.4明顯走揚，顯示中國經濟仍保持溫和擴張格局，激勵陸股站穩2300點關卡並突破季線反壓，並可望帶動中概內需股的走勢。美股盤堅，陸股反彈向上，當有利台股走勢，但受制於成交量能萎縮，指數空間較為受限。從技術面觀察，3/8跳空跌破頸線7850點之後，上檔M頭成型，且日K連4黑，而本周以來日均量降至709.5億元，量能低迷、人氣渙散，使指數欠缺上攻動能，不易突破上檔壓力。其次近5個交易日以來，法人大力賣超權值股，產業龍頭台積電、元大金、中鋼、台泥、台塑、南亞均在三大法人合計賣超前十名之內，其中又以台積電遭外資大砍12萬張為最；反觀櫃買成交量近三日持續升溫，亦持續墊高，顯示資金有由權值股流向中小型類股之跡象，對於指數表現較為不利。【投資規則】:近期成交量能持續萎縮，且法人大力賣超權值股，指數空間將會受壓。不過，部份資金已轉向中小型類股及具題材類股，投資上則可留意受惠329檔期之營建類股，以及4/1金銀三會的金融股，以及近期資金流入較為明顯的橡膠、紡織、觀光、網通類股。,"[['臺股指數', '欠缺', '上攻動能'], ['美股', '收', '激勵'], ['臺股開盤', '上漲', '30點'], ['營建類股', '受惠', '329檔期'], ['橡膠類股', '大漲', '2.54%'], ['汽車類股', '有', '1%以上漲幅'], ['金融類股', '維持', '高檔盤堅'], ['類股指數', '小跌', '0.1%'], ['高價股宏達電跌幅', '在', '1%以上'], ['外資', '買', '超前五大'], ['賣超前五大', '爲', '臺積電'], ['超前五大', '爲', '臺表科'], ['賣', '爲', '永豐金'], ['融資', '增加', '3.39億元'], ['融資餘額', '爲', '1822億元'], ['融券', '增加', '0.8萬張'], ['融券餘額', '爲', '54.9萬張'], ['聯準會主席柏南克', '強調', '維持寬鬆政策'], ['參兩院', '通過', '臨時預算案'], ['大幅', '優於', '預期'], ['製造業PMI初值', '爲', '51.7'], ['中國經濟', '保持', '格局'], ['陸股', '站穩', '2300點關卡'], ['3/8跳空', '跌破', '頸線7850點'], ['日均量', '降至', '709.5億元'], ['法人', '賣', '超權值股'], ['電遭外資砍', '爲', '最'], ['資金', '有', '流向跡象'], ['由權值股', '流向', '中小型類股'], ['由權值股', '流向', '中小型類股'], ['法人', '賣', '超權值股'], ['部份資金', '轉向', '中小型類股類股']]"
0,20130322_3172,華南期貨台股期指盤前分析◆盤勢分析美股在聯準會宣布繼續量化寬鬆政策不變後，美股上漲收紅，亞股週四普遍開高回應，不過僅提供開高動能，盤中依舊不見買盤拉抬，終日於狹幅區間內震盪，終場小漲13.81點，收在7811.84。以技術面觀察，在昨日季線失守後，週四指數開盤雖站回季線，形成多頭抵抗，不過成交量萎縮至682.05億，加上短期均線在上檔交叉向下，對大盤的技術性壓力仍然存在，短線上空方格局不變，操作上建議可以適度搭配選擇權賣方做策略性布局。籌碼面的部份，外資現貨賣超45.56億，淨部位為淨多2112口。4月合約買權OI大量分佈在8000以上，目前買權OI最大量在8100，約3.5萬口左右，賣權OI大量分佈在7700以下，賣權最大量目前在7500，約2.6萬口。,"[['華南期貨臺股期', '分析', '盤勢分析'], ['美股', '宣佈', '政策不變'], ['收', '在', '7811.84'], ['成交量', '萎縮至', '682.05億'], ['淨部位', '爲', '多2112口'], ['買權OI', '分佈在', '8000以上'], ['賣權OI', '分佈在', '7700以下']]"
0,20130322_3173,統一期貨台指選擇權盤前分析◆盤勢分析多空就選擇權籌碼觀察，賣權/買權未平倉比由0.9上升至0.93，為盤整偏空的格局。在最大未平倉量序列部份，買權維持在8100點，賣權由7600點下移至7500點。而外資在選擇權為買進雙邊策略，買權未平倉量大於賣權，對行情看法偏向多方。,"[['平倉比', '上升至', '0.93'], ['爲', '盤整', '偏空'], ['買權', '維持在', '8100點'], ['賣權', '下移至', '7500點'], ['外資', '爲', '買進雙邊策略'], ['買權未平倉量', '大於', '賣權']]"
0,20130322_3174,"統一期貨台股期指盤前－無量反彈，台股無力站回季線◆盤勢分析周三歐美股市上漲，日、韓開高之下，台股開高震盪收最低；電子類股部分，權值股漲跌互見，台積電反彈無力持續下跌，宏達電與聯發科利空影響紛紛下跌超過2%；金融類股小漲小跌，並無太大表現；傳產類股，橡膠、汽車與營建上漲超過1%，中概股跌深反彈；收盤上漲13點，收在7811點，成交值為739億元。在期指部分，上漲21點，逆價差為14.84點；電子期下跌0.25點，逆價差為0.71點，金融期下跌1.2點，正價差則為0.07點，逆價差縮小，氣氛依然偏向空方。就未平倉部位分析，自營商淨空單增加803口，淨空單部位4,686口；投信淨多單減少10口，淨多單部位132口；外資淨多單增加189口，淨多單部位2,112口；在籌碼面部份，外資賣超現股45億元，期貨淨多單部位增加，看法偏向空方。就技術面觀察，開高震盪收最低，尾盤受到摜壓無力站上季線，外資現貨持續呈現賣超，期貨多單部位增加不大，顯示短線心態不再偏多，但賣壓已有所減輕，未來仍需等待外資重返買超行列，才有利於台股止跌，短線行情不利於多方。","[['臺股', '開', '高'], ['橡膠上漲', '超過', '1%'], ['成交值', '爲', '739億元'], ['逆價差', '爲', '14.84點'], ['逆價差', '爲', '0.71點'], ['正價差', '爲', '0.07點'], ['氣氛', '偏向', '空方'], ['自營商淨空單', '增加', '803口'], ['多單', '減少', '10口'], ['看法', '偏向', '空方'], ['尾盤', '受到', '摜壓無力站上季線'], ['外資現貨', '呈現', '賣超'], ['外資', '買', '超行列'], ['臺股', '止', '跌'], ['短線行情', '不利於', '多方']]"
0,20130322_3175,輝瑞報到！F-康聯營運高飛 利多護體 今年EPS估逾6元中國跨領域的醫療控股平台F-康聯()公告去年財報，稅後淨利3.03億元，每股盈餘4.32元，並宣布簽下國際大藥廠輝瑞兩個新產品的代理，第2季開始貢獻，加上醫院陸續恢復進藥及同澤醫藥挹注，法人估計，今年營收將成長2成以上，上看20億元，每股盈餘賺上6元，營運將重新創下新高。F-康聯去年營收17.22億元，年增15%，獲利部分受到彼多益、銀丁等新產品的推廣和收購同澤醫藥的費用增加，帶動營業費用攀高，加上稅負支出增加，拖累稅後淨利下滑僅3.03億元，每股盈餘4.32元。F-康聯表示，每年維持攜手1家國際大廠的計畫不變，今年敲定國際大廠輝瑞合作，代理兩項新產品，分別為降三酸甘油脂的樂脂平及泌尿科用藥，其中泌尿科用藥第2季將開始銷售，樂脂平也將上線。F-康聯指出，除了輝瑞報到後，隨著中國政權順利移轉，所有醫院將開始進行醫藥採購，招標將重新啟動，包括彼多益、銀丁、GSK等進藥等將開始成長，另外今年將會完整認列同澤醫藥的營收，估計將有3億元，倍數成長，加上新加入上海仁度生技，發展高階體外檢驗試劑，及入股鴻君科技，跨入牙材領域等挹注，法人估計，康聯今年營收將成長2成以上，上看20億元，每股盈餘賺上6元，營運將重新創下新高。,"[['醫療控股平臺F-康聯', '公告', '去年財報'], ['第2季', '開始', '貢獻'], ['醫院', '恢復', '進藥'], ['營運', '創下', '新高'], ['F康聯', '營收', '17.22億元'], ['F康聯', '表示', '維持攜手國際大廠計劃不變'], ['F康聯', '指出', '所有醫院開始進行醫藥採購'], ['所有醫院', '開始', '進行醫藥採購'], ['等藥', '開始', '成長'], ['每股盈餘', '賺', '6元'], ['營運', '創下', '新高']]"
0,20130322_3176,券商分析摘要◆券商推薦個股排行： ◆ 大慶證：昨日大盤在歐美股市走穩下開高反彈，指數早盤高點一度來到5日線以及型態頸線附近的7843點，但可惜在量能無法擴增以及金融股拉回的影響下，指數再度開高走低，終場以小漲13點作收。 ◆ 國泰金：週四台股在國際股市表現不錯下，指數呈現反彈走勢，但大盤依舊面臨追價買盤不積極下，5日線反壓無法有效突破，尾盤甚至出現殺盤走勢，終場指數僅上漲13點，成交量持續降至702億元。 ◆ 新光金：由於美聯準會宣佈持續量化寬鬆政策，令美股穩健上漲，加上匯豐中國3月製造業指數上升至51.7，大幅優於預期，帶動中概股走高，推升週四台股開高，站回7800點，但尾盤重量級權值股走跌下，漲幅縮小，終場收7811 .84點，上漲13.81點或0.18%，成交量702.69億元。 ◆ 大昌證券：大盤在前日跌破季線之後，昨日早盤在歐美股市走揚的激勵之下，又站回了季線，不過由於量能不到700億，因此多方仍無力將盤勢上推，昨日高低點差僅32點，在量能無法跟上的情形下近期仍僅是震盪格局，而若多方後續無力反攻，也須提防空方再度打壓盤勢，昨日尾盤盤勢又壓回以最低點作收，再度跌破季線。 ◆ 福邦證券：賽普勒斯紓困案仍籠罩不確定性，歐洲央行(ECB)周四對賽國下最後通牒，要求其在下周一前提出解決方案，否則面臨可能宣告破產或被逐出區。信評機構標準普爾也表示，將賽普勒斯的債券等級降至垃圾等級，再加上美國甲骨文公司周三盤後公布，年度第三季營收僅89.6億美元，明顯低於市場預期的93.7億美元。,"[['券商', '分析', '摘要'], ['券商', '推薦', '個股'], ['大盤', '開', '高反彈'], ['指數早盤高點', '來到', '型態頸線附近7843點'], ['指數', '開', '高'], ['指數', '呈現', '反彈走勢'], ['大盤', '面臨', '積極下'], ['5日線', '反', '壓'], ['尾盤', '出現', '殺盤走勢'], ['成交量', '降至', '702億元'], ['大幅', '優於', '預期'], ['週四臺股', '開', '高'], ['量能', '不到', '700億'], ['賽普勒斯紓困案', '籠罩', '不確定性'], ['信評機構標準普爾', '表示', '公佈89.6億美元']]"
0,20130322_3177,"富士康2012年虧逾3億美元；擬更名為「富智康」精實新聞 2013-03-22記者 余美慧 報導富士康(2038.HK)公布，2012年全年收益為52.4億美元，年減17.5%；全年為虧損3.16億美元(2011年為獲利7300萬美元)。富士康指出，去年營運下滑主要受歐洲國家推行緊縮措施及全球經濟衰退，加上新服務╱應用程式為主導的業務模式興起以及手機市場的整合，為導致用戶市場動盪的主要原因，繼而觸發手機生態體系出現重大變動。個別從業者的市佔率出現重大變動，令市場競爭更趨激烈，導致集團部份主要客戶的需求下降。富士康表示，全球OEM品牌與新從業者之間的激烈市場佔有率爭奪戰令全球手機EMS市場經營困難，致集團產品出現定價壓力，高昂製造費用和來自勞工成本及原料價格上升引致的成本壓力影響毛利率。展望2013年，富士康指出，由於全球經濟環境持續不明朗，而較預期疲弱的宏觀情況可能拖累手機的全球需求，並持續影響手機生態體系及業務；然而，一般預期智慧手機需求於2013年將持續其增長趨勢，集團規則旨在繼續於研發能力方面投注資源，專注現有及新客戶以及智慧手機行業的潛在客戶，憑藉於研發及增值服務的優勢及能力，進一步擴闊客戶基礎。截至2012年12月31日，富士康集團僱員總數為7萬0,051名，與2011年的9萬8,868名相比，減少約29%；員工總成本4.62億美元，與2011年的5.33億美元相比，減少約13%。富士康昨日並公告，擬更名為「富智康集團有限公司」，英文名稱由「Foxconn International Holdings Limited」更改為「FIH Mobile Limited」。公告中指出，計畫更名主要有鑑於若干政府及╱或監管機構以及世界各地之媒體及財務分析師於提述「Foxconn」或「富士康」時誤以為公司為富士康科技集團或集團其他成員公司，導致不時引起混淆及查問。","[['更名', '爲', '報導富士康2038.HK公佈'], ['全年收益', '爲', '52.4億美元'], ['2011年', '爲', '獲利7300萬美元'], ['富士康', '指出', '觸發出現重大變動'], ['營運下滑', '受', '歐洲國家推行緊縮措施'], ['歐洲國家', '推行', '緊縮措施'], ['爲', '導致', '動盪'], ['市佔率', '出現', '重大變動'], ['富士康', '表示', '困難'], ['集團產品', '出現', '定價壓力'], ['富士康', '指出', '拖累全球需求'], ['智慧手機需求', '持續', '增長趨勢'], ['集團規則', '旨在', '投注'], ['富士康集團僱員總數', '爲', '7萬0'], ['計劃更名', '鑑於', '於提述Foxconn誤以爲公司爲富士康科技集團'], ['於提述Foxconn', '誤以爲', '公司爲富士康科技集團'], ['公司', '爲', '富士康科技集團']]"
0,20130322_3178,福邦證券盤前－國際股市落井下石◆盤勢分析賽普勒斯紓困案仍籠罩不確定性，歐洲央行(ECB)周四對賽國下最後通牒，要求其在下周一前提出解決方案，否則面臨可能宣告破產或被逐出區。信評機構標準普爾也表示，將賽普勒斯的債券等級降至垃圾等級，再加上美國甲骨文公司周三盤後公布，年度第三季營收僅89.6億美元，明顯低於市場預期的93.7億美元，使得昨日的歐美同步下挫，其中美國股市四大指數之中，又以跌幅最重，下挫1.56%，Nasdaq 其次，跌幅0.97%，換言之，科技股的壓力恐怕是越來越大。台北股市昨日出現止跌反彈，但力道仍嫌不足，五日線無法站上；尤其是尾盤的摜壓，形成量縮下跌的情形，顯示市場選擇退場觀望的心態相當濃厚。今日再遭國際股市落井下石，指數恐怕再朝7700關卡前進，大型權值股要慎防外資的提款套現。本週以來，外資賣超最多的個股前五名分別是：台積電、聯電、兆豐金、元大金、中鋼，其中又以台積電賣超張數最多，高達110833張，形成外資最愛的提款機。而本週以來投信賣超前五名分別是：友達、新日光、中美晶、兆豐金、潤泰全，友達反而是投信翻臉跟翻書一樣的第一選擇。所以，延續我們先前看法，趨勢一但確立，不會輕易改變，做多朋友再等等。,"[['盤勢分析賽普勒斯紓困案', '籠罩', '不確定性'], ['信評機構標準普爾', '表示', '降至垃圾等級'], ['臺北股市', '出現', '止跌'], ['尾盤摜壓', '形成', '縮情形'], ['市場', '選擇', '退場'], ['市場', '選擇', '退場'], ['大型權值股', '防', '提款套現'], ['友達', '是', '第一選擇']]"
0,20130322_3179,大昌投顧盤前分析◆盤勢分析大盤在前日跌破季線之後，昨日早盤在歐美股市走揚的激勵之下，又站回了季線，不過由於量能不到700億，因此多方仍無力將盤勢上推，昨日高低點差僅32點，在量能無法跟上的情形下近期仍僅是震盪格局，而若多方後續無力反攻，也須提防空方再度打壓盤勢，昨日尾盤盤勢又壓回以最低點作收，再度跌破季線，日K線也出現連8黑，空方仍是較佔優勢，展望後市，除了季線必須儘速站回之外，成交量和指標股也要有較佳的表現，盤面才可止跌回穩，而上方壓力區先看3/18的跳空缺口區7888~7924點。在量能不大的情形下，中小型股是較佳的選擇，但盤中急漲仍不宜追高。今日預期區間：7750-7850點。在各類股題材部分，電子類股昨日指標股台積電早盤雖有止跌，但仍不敵賣壓留下了長上影線，另外如聯發科、宏達電等走勢也都不佳，無法帶動盤勢，目前盤面主要仍是個別股題材表現，且類股輪動快速，如前幾日走勢不錯的記憶體模組、LED等族群，昨日就走勢不佳，因此操作上仍不宜追高，另外昨日太陽能產業傳出大陸太陽能公司無錫尚德確定破產重整，也顯示目前太陽能市況仍不佳的情形，在操作上不宜因為一時利多而進場追高，太陽能產業仍須注意風險，電子類股近期仍可留意者，如LCD驅動IC、觸控、網通、手機零組件、面板等族群，都可留意，而較穩健之投資人，則可留意封測、工業電腦、電源供應器等族群。在傳產類股部分，昨日權值股如塑化、水泥、鋼鐵等族群仍未能有較佳表現，拖累指數，少數表現走勢較佳者為輪胎、營建、飲料包材等族群，不過輪胎族群今年展望雖然不錯，但在近期大漲過後，需注意走勢進入整理的情形，昨日營建族群也有不錯走勢，不過需注意在近期房市推案熱潮之後，後續熱度可能稍減，因此不宜積極追高；而飲料包材族群如宏全、大華、統一實等，第二季展望仍佳，是後續仍可留意的標的，傳產類股另外如食品、紡織成衣、中概內需等族群，也是近期可留意的標的。在金融類股部分，昨日走勢又停頓，近期市場焦點仍在兩岸金銀三會的部份，而在金銀三會之後，4月底將舉辦兩岸經合會，因此預期金融類股後續仍有一波行情，操作上以獲利較佳者，以及較能受惠金銀會兩岸開放題材者為主。,"[['量能', '不到', '700億'], ['日K線', '出現', '8黑'], ['空方', '佔', '優勢'], ['儘速', '站', '季線'], ['中小型股', '是', '佳選擇'], ['積電早盤', '有', '跌'], ['仍敵賣壓', '留下', '長上影線'], ['盤面', '仍是', '個別股題材表現'], ['大陸太陽能公司無錫尚德', '確定', '重整'], ['等塑化族羣', '有', '佳表現'], ['表現走勢', '爲', '等輪胎族羣'], ['走勢', '進入', '整理'], ['營建族羣', '也有', '不錯走勢'], ['等食品族羣', '也是', '留意標的'], ['市場焦點', '在', '金銀三會部份'], ['金融類股後續', '有', '一波行情']]"
0,20130322_3180,新光證券盤前分析◆盤勢分析收7811.84點，上漲13.81點或0.18%，成交量702.69億元。OTC指數收112.28點，上漲0.37點或0.33%，成交量154.68億元。由於美聯準會宣佈持續量化寬鬆政策，令美股穩健上漲，加上匯豐中國3月製造業指數上升至51.7，大幅優於預期，帶動中概股走高，推升週四台股開高，站回7800點，但尾盤重量級權值股走跌下，漲幅縮小，終場收7811.84點，上漲13.81點或0.18%，成交量702.69億元。綜觀週四盤面，宏達電因新機ONE全球供貨延至四月，首季營收不如預期，拖累電信股走低，加上光電及半導體股亦疲弱，使得電子股下跌0.03%，成交比重61.95%。傳產股方面，受惠台北國際自行車展熱鬧登場，自行車及橡膠股走勢亮眼，汽車、營建、其他股亦有超過1%的漲幅，金融股方面，因金控股拉回整理，指數小跌0.1%。受經濟成長速度減緩，加上季節性因素影響，2月外銷訂單終止連五升，月減21.8%及年減14.5%的成績，表現不如預期，加上塞普勒斯國會未通過存款稅，銀行防擠兌，到下週26日持續暫停營業，雖該國正與俄國求援，但能否籌到金額免除公債危機，仍需數日才能開?，在風暴未除前，未爆彈憂心仍在，因此台股出現連八黑，外資亦是連八賣，不過外資於貨出現連二天的淨多單，顯示市場傾向觀望，故預期台股將於季線附近整理，選股則建議較穩健的高殖利率概念股。,"[['盤勢分析', '收', '7811.84點'], ['OTC指數', '收', '112.28點'], ['大幅', '優於', '預期'], ['週四臺股', '開', '高'], ['新機ONE全球供貨', '延至', '四月'], ['首季營收', '不如', '預期'], ['汽車', '超過', '1%漲幅'], ['月', '減', '年減14.5%成績'], ['及', '年減', '14.5%'], ['表現', '不如', '預期'], ['銀行', '防', '擠兌'], ['金額', '免除', '公債危機'], ['臺股', '出現', '連'], ['選股', '建議', '穩健高殖利率概念股']]"
