,News,All,SVO
0,20130829_1718,乾景投顧盤後分析－初步打底完成 短多買點浮現◆盤勢分析基於美國是否對敘利亞發動攻擊仍存在變數，亞股先前因擔憂戰事開打而重挫的格局，於周四(29日)出現反彈行情，至於台股則繼周三逆勢收紅之後，周四再接再厲展開大幅度的上漲，終場台股以大漲93點坐收，指數重返7900點之上收在7919點，成交量則放大至715億元。周四台股強勢指標出現在太陽能族群及網通族群，前者因石油上漲而產生的節能聯想題材，而網通則關注在戰事引爆的衛星通訊器材的需材，不過基本上而言，這二個族群皆與中東的動盪有關。不過在太陽能族群中，可以發現上游的矽晶圓廠上漲的強度大於中游的太陽能電池廠，主因在於國際矽晶圓報價的上揚有利於上游廠商的獲利，但是卻會增加下游電池廠的成本，因此短線太陽能族群應會呈現上肥下瘦的情況，投資人布局時應留意此一趨勢。至於網通族群方面， 4G建設的產業利基更甚於衛星通訊的需求，尤其是在戰事不一定發生的情況下，4G相關概念股的表現更值得期待，無論是在4G通訊基地台的設備廠商，或是儲存資訊及影音的雲端軟體廠商，都將受惠於頻寬需求所帶動的商機。最後，回到大盤本身的位置，台股在8月份即將結束之前終於成功站回10日均線之上，多方可利用本月最後一個交易日試圖反攻月線反壓，若搭配成交量能放大至800億元之上，則空方格局就有機會反轉為多方格局，對於進入9月份的台股行情就更加令人值得期待。簡福杉分析師,"[['攻擊', '存在', '變數'], ['終場臺股', '展開', '大幅度上漲'], ['指數', '重返', '7900點之上'], ['成交量', '放大至', '715億元'], ['強勢指標', '出現在', '太陽能族羣'], ['網通', '關注', '需材'], ['矽晶圓廠上漲強度', '大於', '太陽能電池廠'], ['主因', '在於', '晶圓報價上揚有利於上游廠商獲利'], ['晶圓報價上揚', '有利於', '上游廠商獲利'], ['太陽能族羣', '呈現', '瘦情況'], ['產業利基', '甚於', '衛星通訊需求'], ['相關概念股表現', '值得', '期待'], ['或是', '儲存', '資訊'], ['空方格局', '利用', '有機會'], ['搭配成交量', '放大至', '800億元之上']]"
0,20130829_1719,碩禾攜手日本坪井建17MW福島電站 總投資16億元碩禾董事長陳繼仁率團今與日本坪井簽約擬明年建置完成福島縣電站總投資額50億。(圖：碩禾提供)碩禾電材()今(29)日下午由子公司禾迅投資日本控股公司「永和電力株式會社」與日本「坪井工業株式會社」簽訂正式的購地及EPC合約，跨入總投資案約50億(16.54億元)日本福島電站建置。該案估計將於2014年底完成。碩禾表示，若以17MW規模，每年約可發電2000萬度，可供應近5000戶家戶用電堪稱台灣太陽能業界國內外最大電廠投資。據了解，該案設置地點在日本福島縣，距離核電廠尚有70公里，該地原為一高爾夫球場，其土地面積廣大、佔地遼闊，電站規模將近17MW，係台灣及日本史上雙方攜手合作之最大規模的地面型太陽能發電站。承作太陽能系統工程之坪井工業株式會社創立於1932年，總部位於東京，主要承攬商業大樓、鐵路、再生能源發電系統等工程，自2012年7月日本開始FIT制度後，建造大規模太陽能電站已成為該公司核心業務。碩禾表示，除部分碩禾自有資金出資外，大部分資金規劃由聯貸銀行團支應，目前已經開始進行籌組，以碩禾過去幾年每年約6-10億元穩定獲利能力，目前帳上現金餘額10餘億元，以及非常低負債比的財務結構，國內幾家大型行庫都有高度興趣參與此聯貸案。碩禾子公司禾迅投資在國內已有4-5MW電站投資的經驗，此次首度挑戰超設置大規模的太陽能發電站，將依過去模式使用碩禾三種漿料及國碩()高效矽晶片製作的電池，加上自製導電焊帶製成模組。此合作案自去年第四季開始進行評估申請，並順利在三月底前取得經產省設備認定通知，取得適用日本政府的收購電價為每度42，並於7月底取得太陽光電系統併聯承諾書，該太陽能發電站的建造，估計將於2014年底完成。若以17MW規模，每年約可發電2000萬度，可供應近五千戶家戶用電，也供給日本當地穩定及安全用電，紓解日本電力不足問題；估計每年貢獻碩禾公司售電收入約8億(約2.65億元)，若以碩禾股本估算約貢獻每股盈餘在5.23元。另，該案由日本政府保障補貼的躉售電價合約長達20年之久，將對該公司整體挹注穩定的營收及獲利。另透過此成功經驗，禾迅投資將會持續在海外有潛力的地區進行再生能源電站投資業務。目前禾迅投資仍有數案子進行中，未來不排除達到規經濟模後規劃將售電收入證券化，或在國內外資本市場申請上市。,"[['日本坪井', '建', '16億元碩禾董事長陳繼仁率團'], ['碩禾', '提供', '碩禾電材'], ['碩禾', '表示', '發電'], ['設置地點', '在', '日本福島縣'], ['該地', '原爲', '高爾夫球場'], ['承作太陽能系統工程之坪井工業株式會社', '創立於', '1932年'], ['總部', '位於', '東京'], ['日本', '開始', 'FIT制度'], ['建造太陽能電站', '成爲', '核心業務'], ['碩禾', '表示', '應'], ['高度興趣', '參與', '此聯貸案'], ['碩禾子公司禾迅投資', '已有', '4-5MW電站投資經驗'], ['超', '設置', '大規模'], ['此合作案', '開始', '進行評估'], ['，', '取得', '日本政府'], ['收購電價', '爲', '42'], ['貢獻碩禾公司', '售', '電'], ['每股盈餘', '在', '5.23元'], ['日本政府', '保障', '補貼'], ['該案', '長達', '20年久'], ['海外', '有', '潛力'], ['禾迅投資', '進行', '再生能源電站投資業務'], ['禾迅投資', '有', '數案子進行中']]"
0,20130829_1720,國泰期貨台指選擇權盤後分析◆盤勢分析昨日美股稍微從周一的敘利亞恐慌中回溫，目前市場仍被充滿不確定性的氣氛籠罩，近期以來避險資產、美債等紛紛走高，今日亞股則是漲跌互見。大盤今日多方買盤力道強勁，一舉攻破7900點關卡，重新站回5日、10日線，呈現價漲量增的格局。今日開高走高，上漲119點，在7896點作收，成功收復月線，若量能有所放大，則此波反彈還會有一番作為。今日電子族群重振雄風，由電子權值股領頭，金融股跟進，股市稍微回溫，但目前還並沒有突破近日的盤整區間，建議投資人保守操作，逢低進場。台指籌碼面部分，外資今日空單減碼4740口，大台未平倉部位為多單986口；三大法人整體未平倉為多單4366，顯示目前三大法人對於台指看法為偏多。選擇權CALL及PUT成交量最大的序列分別是8000CALL及7700PUT，其序列為目前上檔及下檔的指數區間位置，PUT/CALL值目前來到1.09，顯示指數應以偏多格局視之。,"[['被', '充滿', '不確定性'], ['亞股', '是', '漲跌'], ['大盤', '買', '盤'], ['一舉', '攻破', '7900點關卡'], ['此波反彈', '有', '一番作爲'], ['電子族羣', '重振', '雄風'], ['未平倉部位', '爲', '多單986口'], ['整體平倉', '爲', '多單4366'], ['對於看法', '爲', '多'], ['最大序列', '是', '8000CALL'], ['其序列', '爲', '指數區間位置'], ['PUT/CALL值', '來到', '1.09'], ['指數', '視', '之']]"
0,20130829_1721,鉅亨晚報 2013年8月29日■中國已是全球最大智慧型手機市場，宏達電 () 在中國的銷售一直無法達到預期，宏達電最近積極宣傳造勢，繼鋼鐵人代言後，又將推出凱蒂貓限量版手機，現又傳出宏達電正開發大陸手機作業系統。■台經院今 (29) 日公布 7月製造業景氣信號估計值較 6 月 11.26 分下降0.33分至 10.93 分，景氣燈號連4月亮出「黃藍燈」，台經院表示，儘管製造業生產指數和外銷訂單分別較去 (2012) 年同期增加 2.0%及 0.5%，但因7月出口年成長僅有 1.91%，大幅低於 6 月的 8.72%、且進口衰退 7.37%，使製造業景氣燈號仍無法脫離代表低迷的黃藍燈。■行政院今 (29) 日舉行院會；行政院長江宜樺於院會裁示，經濟部等機關應加強對外說明此次電價漲幅對於物價 (CPI) 影響已經全盤評估與控制影響低於 0.06%，一年物價仍可穩定在 2%之內。另由副院長毛治國督導穩定物價小組提前加強監控民間預期心理產生的炒作。■儘管今天有颱風豪雨來襲，不過台股多頭卻有「風雨生信心」的表現！隨美股反彈、亞股回神，台股一早就以小跳空17點開盤，電子權值股台積電、鴻海穩盤，戰爭概念股節能、網通族群強彈，傳產龍頭包括裕隆、台塑四寶、亞泥等也趁機衝鋒，墊高指數，大盤一路震盪走高。■華爾街日報報導，宏達電正由董事長王雪紅親自監督進度，開發大陸市場專屬的智慧型手機作業系統，整合微博等大陸特有的應用程式，預計在今年底前推出。對此，宏達電不予評論。■科技網站《BGR》引述報導指出，蘋果 () 的 iPhone 5S 即將搭配指紋辨識功能風光亮相，但這次它恐怕無法再獨領風騷，宏達電 (HTC)() 的 HTC One Max 新流出間諜照顯示，這款新機皇亦將具備指紋掃描感應技術。■聯發科（2454）、F-晨星（3697）合併案 27 日正式通過大陸商務部附條件核准，雙M合併案拍板定案，巴克萊資本證券亞太區半導體首席分析師陸行之預估，基於套利考量，F-晨星補漲效應可期，未來股價上漲空間相當大。■巴西央行周三 (28 日) 再度升息 2 碼至 16 個月新高 9%，為連續第 3 度升息。因巴西里耳走貶，影響到央行對抗通貨膨脹的努力，同時也為了提振投資人對於全球第二大新興市場國家巴西的信心。■美國科技媒體《AllThingsD》周三（28日）報導，經常在 Google（GOOG-US）開發者大會上現身的 Android 產品行銷副總 Hugo Barra 已於近日離職，轉而投入中國智慧手機製造商小米的陣營。■日媒報導，日本夏普 (Sharp)(6753-JP) 已經取消和韓國三星 (Samsung)(005930-KR) 共組聯合影印機公司的討論。(接下頁)■臺灣 7 月製造業景氣信號，連四月亮出低迷黃藍燈■澳洲第二季企業投資意外上升 4%，兌美元匯率聞訊走高。■南韓7月經常帳盈餘連 2 月走滑 然出口增加。■日本零售額意外陷衰退 7 月下滑 0.3%。■台灣今 (29) 日收漲 93.12 或 1.19%，收盤報 7917.66 點，成交金額 715.82 億元。■台股今 (29) 集中市場三大法人合計買超 74.99 億元。■澳洲 S&P/ASX 200 指數 29 日收盤漲 5.237 點或 0.1%報 5092.400 點，盤中最高觸及 5098.800 點，最低觸及 5064.100 點。■日經 225 指數 29 日收盤漲 121.25 點或 0.91%報 13459.71 點，開盤報 13382.95 點，盤中最高觸及 13463.41 點，最低為 13364.82 點。■南韓 Kospi 指數 29 日收盤報 1907.54 點，漲 1.22%或 23.02 點，開盤報 1892.03 點，盤中最高觸及 1914.40 點，最低報 1891.59 點。■香港今收於 21704.78 點，上漲 180.13 點或 0.84%。■周四 (29日) 滬深股市午後探低，上證指收盤下跌 4.07 點或 0.19%，報 2097.23 點，全日高見 2110.89 點，低見 2088.24 點，成交量 1052.59 億。深成指下跌 44.89 點或 0.54%，報 8214.49 點，全日高見 8306.32 點，低見 8177.29 點，成交量 1065.84 億。■兌美元收報 30.012 元兌 1 美元，升值 3.8 分，成交量 5.99 億美元，全日高見 29.931 元，低至 30.040 元，開盤報 30.040 元。,"[['中國', '是', '手機市場'], ['在銷售', '達到', '預期'], ['宏達電', '宣傳', '造勢'], ['景氣燈號', '月亮', '黃藍燈'], ['於', '裁示', '等經濟部機關加強說明全盤評估影響低於'], ['等經濟部機關', '加強', '說明全盤評估影響低於'], ['一年物價', '穩定在', '2%之內'], ['宏達電', '監督', '進度'], ['宏達電', '不予', '評論'], [' )iPhone5S', '搭配', '它獨領風騷'], [' )HTC的 HTC One Max 流出間諜照', '顯示', '新機皇亦具備指紋掃描感應技術'], ['新機皇亦', '具備', '指紋掃描感應技術'], ['央行', '對抗', '通貨膨脹'], ['日媒', '報導', '日本夏普Sharp'], ['1907.54點', '漲', '開盤報1892.03點'], ['香港', '收於', '21704.78點'], ['低', '見', '2088.24點']]"
0,20130829_1722,永豐期貨台指選擇權盤後－台股強勢逆襲 指數重回7900點◆期貨走勢週四上漲119點收在7896點。價差方面，四大期指皆為逆價差，其中逆價差縮至21.66點，電子期逆價差縮至1.41點，金融期逆價差縮至0.36點，摩台期逆價差縮至0.08點。從期指大額交易人部位變化來分析，全月份十大交易人於期貨市場空單減碼3495口，淨部位轉為多單1504口，特定法人空單減碼4121口，淨部位轉為多單946口。三大法人於期貨市場多單加碼3691口，淨多單升至4366口，外資期貨空單減碼4740口，淨部位轉為多單986口，法人部位由空翻多，反應對後勢看法轉趨中性中帶點樂觀的預期。期貨走勢方面，昨晚美股淡化了美國出兵敘利亞的影響而收紅，亞洲股市普遍以開出紅盤因應，台股隨著亞股的上漲，同步展開反彈上攻，盤面上以台積電、鴻海等電子權值股帶頭衝鋒，支撐多頭信心，而金融與傳產類股同步表態上漲，推升大盤持續走揚，終場就以實體長紅K作收，漲幅1.5%。技術面，開高走高，一舉突破5日與10日線，強勢逆襲重回7900點，惟量能仍稍顯不足，尾盤未能站上月線，短線能否突破月線下彎的反壓，仍得看攻擊量能能否升溫而定，短線若拉回5日線可嘗試以短多單因應。◆選擇全分析選擇權從成交量來觀察，9月份買權集中在8000 點，賣權集中在7700點。未平倉量部份，買權未平倉量大量區在8100 點，而賣權大量區則落在7500 點。全月份未平倉量put/call ratio由1.03升至1.08，買權平均隱含波動率由13.07降至12.44%，賣權平均隱含波動率由16.09降至15.90%，買賣權同降，操作上建議先行離場空手觀望。,"[['永豐期貨臺', '指', '期貨走勢上漲119點'], ['指數', '重回', '7900點'], ['指數', '重回', '7900點'], ['期貨走勢', '上漲', '119點'], ['四大期指', '爲', '逆價差'], ['淨部位', '轉爲', '多單1504口'], ['特定法人空單', '減', '4121口'], ['淨部位', '轉爲', '單946口'], ['淨部位', '轉爲', '多單986口'], ['反應', '轉趨', '帶點樂觀預期'], ['美股', '淡化', '美國出兵敘利亞影響'], ['以', '開出', '紅盤'], ['臺股', '展開', '反彈攻'], ['一舉', '突破', '5日線'], ['強勢逆襲', '重回', '7900點'], ['短線', '突破', '反壓'], ['9月份買權', '在', '8000點'], ['大量區', '在', '8100點'], ['大量區', '落在', ' 點'], ['賣權平均隱含波動率', '降至', '15.90%']]"
0,20130829_1723,群益期貨台股期權盤後－利空夾雜卻不跌 台股有機會打底◆盤勢分析近期國外是美國何時縮減QE跟出兵敘利亞的消息，而國內則是10要調漲電價跟基本工資的消息，但是台股卻是利空不跌，甚至在突破短線的下降壓力線，現貨成交量稍擴增，仍有機會在這個做打底，尤其是在分鐘線來看，高不過高、低破低的趨勢已經被扭轉。外資的淨多單部位並不多，但不再看空後市。以9月份選擇權合約來看，買權OI小於賣權OI的口數擴增為一萬八千多口左右，選擇權籌碼面屬偏多的狀態。本月份總賣權OI與上個月差距僅七萬多口，以目前每天約兩萬口的增加速度很快就可以趕上，9月合約會表現得比8月合約來得好。總結來說，目前台股有著利空不跌的現象，且今天明顯突破偏空格局，只是上方有著下彎的月線跟季線，仍有機會震盪往上走，且外資在美國充滿不確定的現在並沒有空單部位，仍有機會好轉。,"[['臺股', '盤勢', '有機會'], ['盤勢', '是', '消息'], ['美國', '縮減', 'QE'], ['臺股', '是', '10調漲電價消息'], ['10', '調漲', '電價'], ['要', '調漲', '電價'], ['在', '突破', '短線'], ['有機會', '做', '打底'], ['買權OI', '小於', '賣權OI口數擴增'], ['選擇權籌碼面', '屬', '多狀態'], ['臺股', '有著', '利空跌現象'], ['上方', '有著', '下月線'], ['外資', '充滿', '確定'], ['美國', '充滿', '確定']]"
0,20130829_1724,亞洲投顧盤後－剎羽而歸 急起直追◆盤勢分析美國股市由於投資人對於軍事是否採取行動的疑慮，而由能源股領軍，終場美股上漲48.38收14824點，讓台股也喘一口氣，今日台股一開盤上漲43點，來到7873點，並由於中東情勢緊張造成國際油價飆漲到109.48元，使得類股中又出現所謂「戰爭概念股」進而帶動太陽能、塑化及生技醫療，三大族群。綠能，中美晶，合晶等股價亮燈漲停，嘉晶、達能、碩禾、茂迪、昇陽科、益通、、昱晶、新日光等表現不錯。，生技醫療智擎漲停，塑化股則有油價上漲利多，臺塑帶頭上漲 ，南亞、國喬與台聚等股價也適度表態，8大類股幾乎全面走紅，其中4G，蘋果概念股，3D列印，第3方支付，生技股是否能續漲?值得拭目以待，終場一路走高收7917點上漲93點，成交量 715億。另外消息面而言除了美國軍事干預敘利亞外，國內衝擊台股的議題包括明年增加七月的基本工資月薪從現行1萬9047元增加226元，於明年7月1日起調至1萬9273元，時薪則從109元調漲至115元，以及第二輪的電價調漲，是否會抑制台股往後走勢？以目前而言，美國三大指數今年已屢創新高，其中台股又與NASDAQ指數息息相關，所以未來台灣股票將是正面的。若從技術分析中價量原理，量增價增，今天上漲93點且成交量來到715億，5日平均量627億，10日平均量729億，而且發生在末跌段到初升段，對後市而言是正面，另外5日移動平均線與10日移動平均線也形成交叉，月均線7927，季均線8004又將扣抵低值，KD值中9K值55.37，9D值42.78，從底部交叉持續向上。◆看盤策略：明天美國公佈：上周首次與連續申請失業救濟人數以及第2季國內生產毛額/修正值(季成長)，且決定是否軍事干預敘利亞等國際訊息，另台灣於8/23到8/31「觸控暨平面顯示器展」這些皆是需要留意對台股後勢的影響。黃順振 分析師,"[['美國股市', '上漲', '48.38'], ['塑化股', '有', '利多'], ['美國軍事', '干預', '敘利亞'], ['美國軍事', '干預', '敘利亞'], ['衝擊臺股議題', '包括', '月薪增加226元'], ['明年', '增加', '七月'], ['月薪', '增加', '226元'], ['月薪', '增加調至', '1萬9273元'], ['時薪', '調漲至', '115元'], ['臺灣股票', '是', '正面的'], ['成交量', '來到', '715億'], ['另外5日移動平均線', '發生到', '初升段'], ['連續', '申請', '失業'], ['這些', '皆是', '需要留意對影響']]"
0,20130829_1725,日盛投顧盤後－長紅突破 低檔支撐轉強◆盤勢分析1.週四美股小幅反彈，亞洲盤隨即止穩，台股更是在週三抗跌之後，週四直接大漲逼近百點，呈現長紅的強勢表現，盤面中各大類股普遍均有佳作，電子、傳產、金融百花齊放，一掃近期走弱陰霾，終場大漲93.12點，站回10日線之上，並已達到月線，走勢強勁，來到7917.66點，成交量718.87億元。2.台股睽違16個交易日後，終於站回10日線，並扣抵月線，創下近六日新高，日KD指標翻揚，K值突破50，有利低檔支撐轉強，因此暫不說台股從此一帆風順，但7800點的支撐力道將可確認，若以壓力來看，季線8000點就是頸線位置，這邊應是壓力。但只要台股支撐出現，操作上指數就可暫時忽略，個股空間就可以拉大。3.三大法人今日買超74.99億元，外資與陸資買超69.17億元，投信賣超1.09億元，自營商買超6.91億元。◇電子站上月線走勢最強，傳產回檔止穩，也有表現，金九銀十、蘋果、小米、網通與電子零組件等為當前主軸週四類股表現以電子K線結構最好，雖跌破年線，但五天前就已經落底，且指數站上月線，底部型態較為扎實，金融股低檔晨星，週五若能再走高更好，非金電強度僅次於電子，中小型空間較大，則較弱。電子股2330台積電走穩有利於市場信心，2311日月光創波段新高，8078華寶半年線有守，2308台達電長紅站上季線，2301光寶科低檔均線集結，太陽能股受到國際油價上揚以及國內電價調漲加上上游報價走高等利多刺激，股價表現強勢，網通則受惠於戰爭概念與政府推動5G計畫等牽動衛星通訊股2485兆赫、6285啟碁等走強，蘋果股週四表現持穩，5264F-鎧勝除息後轉強，6269台郡高檔震盪、2474可成除息跳空上漲，2317鴻海連續兩日紅K，隨著營收公佈，此族群仍有表現機會，小米機概念股的2454聯發科雖走弱，但中多不變，6257矽格買盤再度進場，其餘像是2312金寶、2356英業達、5349先豐等各擁題材，多方企圖強勢。傳產股週四在塑化汽車營建轉強之下， 2201裕隆出現買單拉抬，8255朋程回測季線走揚，而指標型個股1476儒鴻、1312國喬、9914美利達、9907統一實、9921巨大、2501國建、8406F-金可等帶動走高。生技股仍是市場最強勢族群，4162智擎再拉漲停，4168醣聯、4152台微體、4114健喬、4105東洋、4130健亞、1701中化、4728雙美等價量俱揚，目前生技籌碼仍未鬆動，雖基本面評斷見仁見智，但操作面仍是偏多。金融股近日表現較為平穩，2881富邦金、2882國泰金止穩，2891中信金、2887台新金、2884玉山金多頭格局。金融股量能近日較為欠缺，個股表現機會較大，靜待服貿協議進一步的消息。MSCI調整將在週五生效，這次台股權重增加為多的個股依序為1476儒鴻、9945潤泰新、9933中鼎、1504東元、2890永豐金、2451創見、2301光寶科、2395研華、2347聯強、2379瑞昱；個股權重減少最多依序為2006東鋼、2330台積電、2303聯電、2885元大、2317鴻海、2454聯發科、2412中華電、1301台塑、2882國泰金及1303南亞。※本資料由日盛投顧提供，其內容僅供參考，本公司恕不負任何法律責任，亦不作任何保證,"[['長紅突破', '支撐', '轉'], ['週三', '抗', '跌'], ['週四', '逼近', '百點'], ['電子', '均有', '佳作'], ['K值', '突破', '50'], ['季線8000點', '就是', '頸線位置'], ['這邊', '應是', '壓力'], ['外資買', '超', '69.17億元'], ['自營商買', '超', '6.91億元'], ['等金九銀十', '爲', '週四類股表現'], ['金電強度', '僅次於', '電子'], ['積電走穩', '有利於', '市場信心'], ['半年線', '有', '守'], ['太陽能股', '受到', '國際油價上揚'], ['太陽能股', '受到', '國際油價上揚'], ['網通', '受惠於', '等2485兆赫'], ['等', '牽動', '衛星'], ['此族羣', '有', '表現機會'], ['像', '是', '擁題材'], ['2201裕隆', '出現', '買單拉抬'], ['金可等儒鴻', '帶動', '走'], ['生技股', '仍是', '勢族羣'], ['重增加', '爲', '多'], ['個股依序', '爲', '1476儒鴻'], ['最多依序', '爲', '2006東鋼'], ['本公司', '恕', '不負任何法律責任']]"
