,News,All,SVO
0,20130329_2318,統一企業去年每股稅後盈餘2.55元 將準備售出群創股權台灣食品業龍頭統一企業()2012年財報出爐，全年營收468.52億元，稅後盈餘124.07億元，獲利較2011年大幅成長31.33%，其每股稅後盈餘並達到2.55元。同時，統一在去年也依持股比例認列轄下轉投資公司對群創光電()等股權資產減損達27.1億元。統一企業總經理羅智先在先前就此指出，提列此一股權的資產減損，也是準備將釋出這批股權。統一企業對於手握群創持股的由來，主要是原投資面板廠統寶光電，而後統寶光電併入奇美電，奇美電又與鴻海()集團的群創合併，統一就成了群創的股東。統一企業指出，2012年營收468.52億元較2011年518.3億元減少49.78億元，衰退9.60%，主要在於聚焦經營、簡單操作。統一於2011年底刪除毛利率偏低的黃豆加工產品如黃豆粉，大包裝黃豆油等產品，及黃豆大宗物資買賣業務，2012年續刪除玉米大宗物資買賣業務，是2012年整體營收較去年同期衰退9.6%的主要因素。統一企業強調，統一刪除毛利率偏低產品及業務對整體營業利益並無重大影響，反是更能集中資源於發展高附加價值產品。2012年整體營業利益19.94億元較2011年同期18.66億元成長6.86%。同時，統一的乳品、茶飲料、速食麵是為公司3大營收主力產品，2012年這3大主力產品營收合佔總體營收約60%，業績表現都呈現成長趨勢。乳品、茶飲料穩定發展，居市場領導品牌，2012年乳品營收成長5%，茶飲料成長8%。統一速食麵穩居市場領先地位，2012年度營收也較2011年同期成長6%。統一企業2012年營業毛利131.27億元，營業毛利率28.02%，較2011年同期23.17%增加4.85個百分點，統一企業指出，最主要因素仍是力行產品結構優化、刪切低毛利率產品及業務、提高產品附加價值等公司政策的落實執行。統一企業2012年稅前盈餘125.81億元較2011年98.12億元增加27.69億元，成長28.22%，獲利增加主要原因係認列轉投資收入增加27.4億元。主要是來自統一超商、台灣神隆及統一證券等轉投資公司獲利貢獻顯著成長，統一依持股比例認列轉投資收入增加8.8億元。而統一認列開曼統一控股投資收益增加約47.81億元。,"[['稅後盈餘', '達到', '2.55元'], ['股權資產減損', '達', '27.1億元'], ['，', '提列', '一股權'], ['統一企業', '指出', '2011年518.3億元減少49.78億元'], ['2011年518.3億元', '減少', '49.78億元'], ['刪除物資買賣業務', '是', '主要因素'], ['整體營收', '較', '衰退'], ['整體營收', '較', '衰退'], ['統一企業', '強調', '集中資源'], ['刪除偏低產品', '並無', '重大影響'], ['統一乳品', '爲', '主力產品'], ['業績表現', '呈現', '成長趨勢'], ['主要因素', '仍是', '公司政策落實'], ['主要因素仍是公司政策落實', '力行', '產品結構優化'], ['稅前盈餘125.81億元', '增加', '27.69億元'], ['獲利', '增加', '主要原因'], ['轉投資收入', '增加', '27.4億元']]"
0,20130329_2319,永豐期貨台指選擇權盤後－指數收盤站上月線 週線連二黑後翻紅◆期貨走勢週五上漲80點收在7923點。價差方面，、電子期、金融期與摩台期皆轉為正價差，其中正價差4.39點，電子期正價差0.35點，金融期正價差3.17點，摩台期正價差0.12點。三大期指以電子期表現最為強勢。從期指大額交易人部位變化來分析，全月份十大交易人多單加碼3388口，淨多單升至4773口，特定法人多單加碼3100口，淨多單升至8513口。三大法人於現貨市場轉為買超37.27億元，於期貨市場多單加碼7273口，淨多單升至8501口，外資期貨多單加碼4324口，淨多單升至10147口，反應法人心態轉趨中性偏多。期貨走勢方面，受到美股創新高的激勵下，週五以小紅跳空開出，早盤指數回補跳空缺口後，僅在26點區間內狹幅震盪；午盤過後，在電子權值股領軍拉抬下，指數一路走高，終場上漲80點以7923點作收，週線在連2黑後翻紅，月線則連5紅。由籌碼面來觀察，法人於現貨市場轉為買超，期貨多單部位大幅加碼，顯示法人對後勢已由中性保守轉為中性偏多。技術面，週五指數以小紅回補空方缺口，收盤站上月線，惟成交量不足六百億留下影憂，操作上建議以五日線偏多操作為宜並請嚴設停損。◆選擇權分析選擇權從成交量來觀察，4月份買權集中在8000點；賣權集中在7800點。未平倉量部份，買權OI升至381452口，最大序列8100點，水位50158口；而賣權的OI則是升至448830口，最大序列7700點，水位38459口。全月份未平倉量put/call ratio由1.07升至1.18(+9.73%)。4月買權平均隱含波動率由10.94降至9.87%(-10.27%)， 賣權平均隱含波動率則由13.91降至13.41(-3.63%)，買賣權同步下降，在短線空方力道減弱下，操作上建議於7600-7900點建立賣權多頭價差因應。,"[['期貨走勢', '翻', '紅'], ['電子期', '轉爲', '正價差'], ['三大', '期指', '強勢'], ['特定法人', '加碼', '3100口'], ['三大法人', '轉爲', '買'], ['多單', '升至', '8501口'], ['月線', '連', '5紅'], ['法人', '轉爲', '買超'], ['法人', '轉爲', '多'], ['收盤站', '上', '月線'], ['惟成交量', '不足', '六百億'], ['4月份買權', '集中在', '8000點'], ['賣權', '集中在', '7800點'], ['賣權OI', '升至', '448830口'], ['平均隱含波動率', '降至', '-10.27%)'], ['平均隱含波動率', '降至', '(3.63%)'], ['-7900點', '建立', '因']]"
0,20130329_2320,日盛投顧盤後－季線為中長期支撐不變，8000至8100點為短線壓力◆盤勢分析1.週五台股隨歐美股市上漲開高，開盤一度收復7900點大關，之後震盪，PCB、面板、光學、記憶體模組、橡膠、營建為盤面焦點族群，適逢季底，午盤後指數急拉，重又站回7900點之上，終場指數上漲51.73點，漲幅0.66%，收在7918.61點，成交金額為571.62億元，量能仍低於5日及20日均量。三大法人合計買超37.27億元：外資買超35.04億元、投信賣超3.39億元、自營商買超5.62億元。2.由以下三個面向檢驗台股方向及強弱：(1)、量能：5日均量仍持續下彎，後續上攻量須大於800億元較有機會站回8千點。(2)、均線：季線仍向上，形成中長期支撐不變；月線下彎，8000至8100點為短線壓力。(3)、技術指標：KD指標開口向上，9日K值已近60；10日RSI若過70方轉為回升。◇【強勢】PCB、面板、光學、記憶體模組、橡膠、營建【弱勢】8299群聯PCB：8213志超第二季業績佳，5349先豐配息1.93元， 6153嘉聯益、4958F-臻鼎低檔續強。面板：大陸下半年將推出新一波平面電視節能補貼方案，3481群創、2409友達可望受惠。光學：3504揚明光擠身3D列印概念股，3019亞光入列Kincet鏡頭供應鏈。記憶體模組：記憶體價格上揚帶動模組廠獲利成長，二線廠8271宇瞻、8277商丞齊賀。橡膠：大陸進入換胎潮，天然膠及合成膠價軟，2106建大、2105正新營收毛利率同步提升。營建：5529志嘉2012EPS約15元，配息1.5元；2520冠德擬配息1元，殖利率近4％。【弱勢】8299群聯：記憶體相關利多訊息未帶動股價，主因為法人預估2013年獲利僅持平。※本資料由日盛投顧提供，其內容僅供參考，本公司恕不負任何法律責任，亦不作任何保證,"[['季線', '爲', '中長期'], ['季線', '爲', '中長期'], ['至8100點', '爲', '1'], ['一度', '收復', '7900點大關'], ['站', '回', '7900點之上'], ['成交金額', '爲', '571.62億元'], ['能', '低於', '5日20日均量'], ['5日均量', '下', '彎'], ['攻量', '大於', '有機會'], ['80008100點', '爲', '短線壓力'], ['K值', '近', '60'], ['RSI', '轉爲', '回升'], ['3481羣創', '可望', '受惠'], ['大陸', '進入', '換胎潮'], ['2520冠德', '擬', '1元'], ['利多訊息', '帶動', '股價'], ['本公司', '恕', '不負任何法律責任']]"
0,20130329_2321,中韓夾擊！友達原地踏步，群創能闖關？精實新聞 2013-03-29  記者 許曉嘉 報導全球TFT-LCD液晶面板產業景氣脫離循環谷底、漸露曙光。不過，這波面板業復甦，並非全面性，而較類似單點式復甦。依廠商2012年度營運表現，友達（2409）依然大虧，群創（3481）則有改善。主要係因為面板產業的競爭態勢，其實比過去更激烈，對於台灣面板廠來說，不僅持續面臨韓廠挑戰，又新增了來自中國政府與競爭者的威脅。接下來友達仍將原地踏步、亦或逆勢突圍？群創能否闖關成功、再創新紀錄？值得關注。回顧這幾年台灣及韓國面板廠的競爭，在部份高階技術方面，以日本、韓國技術較為領先，例如氧化物製程、OLED有機發光顯示器等等，但若就產品開發及業務彈性來看，其實台廠群創近年來連續繳出數張醒目的成績單。首先是對於中國出貨模式從原本的模組形式、配合大陸電視廠商營運特色率先改Open Cell出貨。然後最早推出低成本直下式LED背光面板，原本稱為胖胖機、胖娃娃，後來同業數個月後跟進也推出貴妃機。接著領先同業推出新尺寸電視面板，特別是39吋、50吋、58吋產品。最近則是全力將低成本4K2K超高解析度技術導入全系列電視面板，加速4K2K普及化可能性提高。儘管群創甚少強調該公司在技術層次上突破，但就玻璃切割而言，要把玻璃基板利用率拉升到95%以上甚至更高，也有其技術難度和門檻存在。更何況新產品導入後、良率提升和學習曲線也需要一定時間。產品開發速度與業務接單彈性日趨靈活，讓群創近幾個季度以來、營運逐步好轉。然而，隨著群創新產品陸續獲得電視品牌大廠採用，韓廠、中國面板廠的目標不約而同又瞄向台灣面板廠。原本在新尺寸市場相對沉默的韓廠，近期有了新動作。因為稍早韓廠的40吋面板遭受39吋面板排擠，這次韓國三星準備大推新款低成本40吋面板、力求搶回市場，同時三星也計劃將於2013年下半年推出48吋新尺寸面板，目標瞄準46/47吋與50吋市場而來。今年下半年電視面板尺寸分佈將有何變化，成為追蹤焦點之一。不僅如此，過去韓廠對中國大陸市場電視面板業務不甚積極，但眼看全球液晶電視市場成長力道趨緩，韓廠也開始看重中國市場，除了在中國興建的高世代面板產線正規劃投產，早期不願以Open Cell形式銷貨到中國的LG Display，去年開始在中國大賣Open Cell，使得2012年第四季中國供貨市佔率提高到22.5%、已經與群創（23.5%）相當。如果中國市場依然重要，這確實是個警訊。除了韓國的挑戰一直存在，來自中國政策扶植、中國面板廠的威脅，亦日漸加重。早期中國大陸本地缺乏大尺寸液晶面板產能，因此一直以來都對台廠維持穩定的電視面板採購量，2009年起更以面板採購團形式，使大陸對台廠面板採購的數量與金額公開化。由於歐美市場需求趨緩，中國市場的五一、十一、元春檔期，確實也成為影響台灣面板業出貨淡旺季的重要因素。但是，這個局面可能正在改變。因為近年來中國開始發展本土高世代液晶面板產線後，尤其在2012年大陸面板廠已大量供應32吋等電視面板，大陸彩電廠商對台廠電視面板的採購需求，呈現趨緩跡象。[NT:PAGE=$]2013年1月初，中國大陸發改委又針對三星、LGD、群創、友達、華映(2475)、彩晶(6116)等6大面板廠開出壟斷價格罰款，其中，群創、友達、華映、彩晶遭罰3.53億。據報導，大陸方面還要求上述6大面板廠不能再延後釋放研發技術，而要加緊與中國大陸面板廠合作。而曾經被媒體稱為面板女王的中國電子視像行業協會秘書長兼副會長白為民日前指出，開罰給大家一個公平競爭的機會，未來誰願意與大陸合作，誰就發展得好。同時官方還釋出2013年可能是其最後一次率團來台採購面板（今年預計採購3000萬片、數量保守）、自2014年起台灣面板廠就得自求多福等訊息。外界解讀，台廠在中國電視面板市場的供貨優勢正在消退，這也意味著，中國市場對於台灣面板廠的業績支撐動能，日後可能漸漸轉淡。即便台灣面板廠此刻與中國業者全面緊密結合，能否確保日後江山不沒，完全無法預測。畢竟商場上沒有永遠的敵人，但也沒有永遠的朋友。未來台灣面板廠在中國面板廠、韓國面板廠雙向夾擊（維持某種程度的面板供需關係、但彼此之間存在著更劇烈的面板銷售競爭關係）下，營運發展將會走下坡、亦或停滯不前？還是能夠闖關成功、再造佳績？台廠並非真的沒有機會，但得視個別廠商的產品創新、技術層次、經營管理、業務拓展、生產效率等等各方面的能力與效益而定。,"[[' 2013-03-29\xa0 記者 許曉嘉 ', '報導', '液晶面板產業'], ['景氣', '脫離', '循環谷底'], ['羣創3481', '有', '改善'], ['主要系', '因爲', '競爭態勢'], ['了', '來自', '中國政府'], ['臺廠羣創', '繳', '數張成績單'], ['全力', '導入', '電視面板'], ['，', '加速', '普及化'], ['羣創', '強調', '該公司突破'], ['良率提升', '需要', '一定時間'], ['創新產品', '獲得', '品牌大廠採用'], ['沉默韓廠', '有', '新動作'], ['40吋面板', '遭受', '39吋面板排擠'], ['韓國三星', '準備', '推新款低成本'], ['三星', '計劃', '推出新尺寸面板'], ['目標', '瞄準', '46/47吋'], ['尺寸分佈', '有', '何變化'], ['韓廠', '開始', '看重中國市場'], ['這', '是', '個警訊'], ['中國市場五一', '成爲', '重要因素'], ['中國市場五一成爲重要因素', '影響', '出貨淡旺季'], ['中國', '開始', '發展液晶面板產線'], ['面板廠', '供應', '電視面板'], ['採購需求', '呈現', '趨緩跡象'], ['中國大陸發改委', '開出', '壟斷價格罰款'], ['羣創', '遭罰', '3.53億'], ['誰', '願意', '合作'], ['官方', '釋出', '2013年可能是等面板訊息'], ['2013年可能', '是', '等面板訊息'], ['率團', '來', '臺'], ['率團', '來', '臺'], ['今年', '預計', '採購3000萬片'], ['面板廠', '求', '多福'], ['自', '求', '多福'], ['這', '意味著', '對於業績支撐動能轉淡'], ['對於業績支撐動能', '轉', '淡'], ['商場上', '沒有', '永遠敵人'], ['彼此之間', '存在', '競爭關係'], ['臺廠', '沒有', '機會']]"
0,20130329_2322,"F-科納去年EPS 0.4元，但配息1.5元精實新聞 2013-03-29  記者 陳祈儒 報導F-科納光通（4984）公布2012年年報，全年稅後純益1,792萬元、年減94%，其中第四季單季虧損1,925萬元，主要是營收規模低迷，在產能利用率不高下造成虧損。不過，科納光通董事會為顧及股東權益，仍以前幾年的累積盈餘配息1.5元。以本周五收盤價37.1元計算，股息殖利率4%。科納表示，該公司成立公司在美國，只要是非美國藉（除了與美國政府有租稅協定的國家例如中國大陸除外）股東獲得現金股利依美國法規要繳稅約30%。在考量繳完重稅後，台灣股東已經沒有任何股利，所以，大股東決定，以近幾年的盈餘配發現金股利1.5元；科納預計發放的總額約6,700萬元，不影響公司營運。在2012年第四季單季財報，營收1.53億元、季減30%，毛利率36.2%，較前一季的37.7%要低。單季營業淨損1,204萬元，營益率-7.8%。單季稅前淨損755萬元，稅後淨損1,925萬元，較前一季的稅後純益1,733萬元轉虧，稅後EPS-0.43元。科納表示，去年第四季業績未如預期，並較第三季下滑，主要是營收沒有起色。","[[' 2013-03-29\xa0 記者 陳祈儒 報導F-科納光通4984', '公佈', '2012年年報'], ['科納光通董事會', '爲', '股東權益'], ['科納', '表示', '成立公司繳稅'], ['股東', '獲得', '美國法規'], ['臺灣股東', '沒有', '任何股利'], ['大股東', '決定', '發現1.5元金股利'], ['科納', '預計', '影響公司營運'], ['季', '減', '30%'], ['稅後淨', '損', '1'], ['科納', '表示', '是營收沒有起色'], ['去年第四季業績', '如', '預期'], ['營收', '沒有', '起色']]"
0,20130329_2323,《PCB》8檔去年EPS逾5元，台郡9.24元登獲利王精實新聞 2013-03-29  記者 萬惠雯 報導印刷電路板族群去年財報揭曉。除了軟板廠商去年獲利亮眼，也有部分硬板廠因其高市占或切入利基市場的差異化佈局，有不錯的獲利表現，其中8檔個股EPS逾5元以上，依次為台郡(6269)、銘旺科(2429)、景碩(3189)、志超(8213)、F-泰鼎(4927)、F-臻鼎(4958)、健鼎(3044)、旭軟(3390)，相對而言，這些個股中志超、F-泰鼎股價似有相對被低估現象。台郡去年以每股獲利9.24元登PCB獲利王，同是蘋果概念股的F-臻鼎去年EPS則為5.88元，隨蘋果概念股近期齊回檔後，股價都已回檔至百元以下的價位，產業也於第一季落入傳統淡季，再加上蘋果新機目前處於空窗期，故營運在第一季處谷底，市場評估，若蘋果新機在Q3推出，相關零組件廠要在Q2中旬以後才會感受到營運升溫力道，故法人預期，台郡最快要待5月營運見回升，但整體仍要待下半年反彈力道才會較大。除了較具話題性的蘋果概念股外，部分硬板股雖然整體市場成長動能較不足，但個別公司因具有特殊利基或規則，也有不錯獲利表現，如全球最大光電板廠志超則在穩固光電板市占再加上搶NB板市場下，去年每股獲利6.26元表現佳，今年3月起四川遂寧新廠啟用，產能進一步提升，故可有較大的營收貢獻。F-泰鼎為少數主要生產基地在東協的PCB廠，今年Q3同樣有新廠加入生產行列，F-泰鼎因業務拓展和營運成本控制績效佳，雖然市場定位在中低階板，但去年每股獲利仍達6.13元，擬配發3元現金股利，且因F股不涉及健保補充保費的問題，股東拿到配息相較更有利。法人預估，F-泰鼎Q1營收可望持平或小幅成長，全年則成長約5-15%的水準。健鼎去年EPS 5.58元，今年Q1在汽車板以及伺服器板訂單表現較佳，湖北仙桃新廠己於3月大量出貨，法人估其Q1營收約百億元，Q2則應有小幅成長。旭軟去年EPS 5.15元獲利創高，因公司將過去SMT的外包生產線收回，再加上Nexus 7等新機種導入增加，推升毛利率大幅增加，今年其仍是最看好觸控面板產品線，估占其營收比重可望倍增。至於去年每股獲利高達6.7元的銘旺科，主要是因為出售中壢廠房、土地以及減資84%推升獲利表現，去年本業則仍為虧損。,"[['EPS', '逾', '5元'], ['硬板廠', '有', '獲利表現'], ['EPS', '逾', '5元以上'], ['去年EPS', '爲', '5.88元'], ['營運', '落入', '升溫力道'], ['蘋果新機', '處於', '空窗期'], ['除了', '較具', '話題性'], ['個別公司', '也有', '獲利表現'], ['再加上', '搶', 'NB板'], ['每股', '獲利', '表現佳'], ['F泰鼎', '爲', 'PCB廠'], ['Q3同樣', '有', '新廠加入生產行列'], ['新廠', '加入', '生產行列'], ['-泰鼎', '控制', '績效佳'], ['每股獲利', '達', '6.13元'], ['F股', '涉及', '健保補充保費'], ['不', '涉及', '健保補充保費'], ['股東', '拿到', '配息'], ['法人', '預估', '持平'], [' 5.15元', '獲利', '創高'], ['每股獲利', '高達', '6.7元'], ['每股獲利', '高達', '6.7元']]"
0,20130329_2324,揚智：產業能見度不佳 營運看法保守 今年衝刺付費電視與IP機上盒機上盒晶片揚智()今(29)日召開線上法說會，展望營運後市，揚智表示，整體市況情形仍不明朗，因此無法給出下一季的預估值，但第 1 季確實相對是淡季，而今年將衝刺付費電視晶片以及IP機上盒(OTT，上網機上盒)晶片，預期全年營運可逐季成長。揚智指出，目前第 1 季與第 2 季的預估值皆難給出詳細展望，整體產業能見度不是太清楚，就產品而言，今年零售機上盒市場確實不會有太大成長空間，因許多地區數位訊號轉換周期已經完成，今年沒有大量轉換需求推升零售市場成長。董事長林申彬強調，今年揚智將維持零售市場的高市佔率，並加快衝刺運營商與IP機上盒(OTT)市場，期望今年這 2 項產品可有較明顯的成長動能。其中，在付費電視晶片產品上，林申彬表示，目前與NAGRA技術認證合作順利，預估下半年就可通過認證，之後會導入產品，營收貢獻時間點估落在明年，預期今年付費電視的比重會達 1 成以上，較去年5-10%上揚。另外，揚智第 4 季高清產品比重下滑，壓抑毛利率表現，林申彬表示，高清市場需求不如預期，導致這樣的結果，也使得第 4 季毛利率低空飛過，但揚智將持續改善製程，加快降低成本進度，期望能維持產品利潤。揚智強調，目前產業能見度不明，因此上半年難給出產業預估值，但保守期望，第 1 季是淡季，之後可望逐季上揚。,"[['付費電視', '召開', '法'], ['第 1', '是', '淡季'], ['揚智', '指出', '給出詳細展望'], ['整體產業能見度', '不是', '清楚'], ['上盒市場', '有', '太大成長空間'], ['董事長林申彬', '強調', '揚智維持高市佔率'], ['揚智', '維持', '高市佔率'], ['項產品', '有', '成長動能'], ['在', '付費', '電視晶片'], ['林申彬', '表示', '順利'], ['營收時間點', '估落在', '明年'], ['比重會', '達', '1成以上'], ['林申彬', '表示', '這樣結果使得'], ['高清市場需求', '不如', '預期'], ['揚智', '改善', '製程'], ['揚智', '強調', '期望'], [' 季', '是', '淡季']]"
0,20130329_2325,"本週上市公司市值達22.13兆元，以玻璃陶瓷類股漲幅4.79%為最大。根據臺灣證券交易所統計，民國102年3月29日全體上市公司市場總值為22兆1,285.17億元，較上週(102年3月22日)市值21兆7,772.42億元增加3,512.75億元，增幅約為1.61﹪。各產業類股市值變動，本週玻璃陶瓷類股市值為780.99億元，較上週(102年3月22日) 745.31億元增加35.68億元，漲幅4.79%為最大；另食品類股本週市值為4,614.31億元，較上週(102年3月22日) 4,713.23億元減少98.92億元，跌幅2.1%最大。","[['上市公司市值', '達', '22.13兆元'], ['上市公司市場總值', '爲', '22兆1'], ['增幅', '爲', '1.61﹪'], ['玻璃陶瓷類股市值', '爲', '35.68億元'], ['4.79%', '爲', '最大'], ['股本週市值', '爲', '4'], ['713.23億元', '減少', '98.92億元']]"
