,News,All,SVO
0,20130917_2823,國泰證券盤前－量能不繼，往上空間不大◆盤勢分析：週一(16日)台股受到美股電子盤(因Fed主席鷹派候選人意外退出競選)大漲激勵帶動下，指數開高走高大漲逾百點，終場以上漲112點作收再創反彈波段新高，而指數離前波高點8265僅餘10點不到，成交量能也順勢放大至769億元，量價同步增溫。由於昨日台股受到美股意外利多消息刺激拉出一根量增長紅K棒，除了指數順利再站上短期5、10日均線之外，5日均線也同步轉為翻揚向上，顯示發球權已有重回多方掌控味道，且就技術面日KD、RSI指標來看，日KD僅從高檔向下修正兩天即再度轉折向上，有機會醞釀高檔強勢鈍化走勢，而5日RSI也於多空分界中軸順利抵抗成功，也有利多方發展，此外，就籌碼面來看，融資餘額表現冷靜，而外資也已連續買超超過10天以上，因此，預期指數仍有高點可期。不過，由於中秋長假在即，且國內政爭亦尚未順利落幕，而美國FOMC也將於秋節前夕召開(美時間17與18日)，變數仍是不少，而觀察技術面指標日KD、5日RSI來看，也出現本波反彈以來首次明顯背離，急待進一步轉強化解，此外，成交量能雖有出現擴增，但相較數日之前高檔小作頭量能約在850~900億元來說仍嫌不足，因此，操作上仍需步步為營，不過度躁進，並以逢回佈局為主。◆類股分析：週一(16日)類股多數呈現開高走高格局，終場全面以上漲作收，其中水泥、塑膠類股在旺季與政策利多加持下表現最為強勢，而光電、半導體族群也有利空出盡跡象，強彈超過2%以上。而目前水泥、塑膠、汽車、半導體以及觀光類同步再創波段新高，表現強勢，操作上可留意相關族群。,"[['臺股', '受到', '美股電子盤'], ['指數', '開高走', '逾百點'], ['漲112點作收', '再創', '波段新高'], ['指數', '離', '前波高點8265'], ['成交量能', '放大至', '769億元'], ['臺股', '受到', '美股'], ['5日均線', '轉爲', '向上'], ['發球權', '已有', '重回'], ['外資', '買', '10天以上'], ['預期指數', '有', '高點可期'], ['美國FOMC', '召開', '時間17'], ['類股多數', '呈現', '開高格局'], ['光電', '強勢', '有利跡象'], ['強彈', '超過', '2%以上']]"
0,20130917_2824,"日盛投顧盤前分析◆盤勢分析桑默斯前日宣布退出競選下屆美國聯準會 (Fed) 主席，引發全球投資人對於美國貨幣刺激經濟政策的樂觀期待，金融市場反應呈現美股上漲、美債殖利率下滑、美元走貶，在股市部份，勁揚118.72 點或0.77%，收15494.78；Nasdaq下跌 4.34點或0.12%，收3717.85；上揚9.61點或0.57%，收1697.60；SOX上揚2.12點或0.43%，收490.35。在債市部份，美債10年期公債殖利率降至2.87%。在匯市部份，美元兌與等主要貨幣皆走貶。在個股部份，由於分析師對上週發表的新手機iPhone 5S與iPhone 5C感到失望，使得蘋果 (Apple)()股價重挫超過3%，拖累Nasdaq指數走跌。桑默斯確定放棄聯準會主席競爭，使得市場預期聯準會量化寬鬆時間將延長，國際股市應聲大漲，台股沒有置身事外，週一在金融、台塑集團與部份電子權值股上漲激勵下，指數呈現開高走高，終場大漲112.86點，漲幅1.39%，收在8255.34，成交金額放大至766.23億元。觀察台股技術面，經過兩天量縮整理後，週一量能隨即放大上攻，日KD指標有機會呈現高檔鈍化格局，惟量能必須持續放大，成交金額必須回到20日均量之上，才有條件讓日KD指標維持高檔強勢鈍化格局，指數也才有機會在短線立即挑戰8439高點，否則指數在正乖離拉大情況下，震盪恐將難免，然而技術面均線、型態已經有利於多頭，即便進入震盪，推測拉回空間有限，操作上有量則積極操作權值或波段主流股，沒量時將回到個別族群表現。觀察台股籌碼面，外資+133.54億元、投信-0.61億元、自營商+2.97億元，三大法人合計買超135.91億元。立法院新會期週二（17）日開議，將由行政院長江宜樺提出施政報告，惟江曾說「做好準備面對沒有王金平的立法院」，被批評不尊重國會，在野黨揚言杯葛，使得週二院會充滿變數。立法院開議預料將引爆馬王政爭另一波攻防，代表馬總統分身的閣揆江宜樺，與王金平之間互動備受關注，短期政治面恐將再陷入馬王政爭疑慮。觀察台股盤面結構，電子+1.59%、金融+1.16%、非金電+1.20%，週一台股主攻金融、台塑集團與佔權值電子股，拉抬指數意圖明顯，盤面在健康輪動情況下，持續有墊高機會，操作上電子股留意波段主流地位不變，或者底部型態明確的族群，例如汽車電子、工業電腦、記憶體相關、Apple概念與聯發科體系；金融股週一果然成為盤勢上攻要角，金融股中長多格局不變，重要個股回到中長期均線仍可留意；非金電水泥、塑膠、生技、中概內需、汽車相關是盤面焦點，中概內需、汽車相關、航運具操作空間。在電子股部份，隨著指數蘊釀衝關，權值電子股3008大立光、2330台積電、2317鴻海、2382廣達皆有表現，波段主流地位不變，或者底部型態明確的族群，例如汽車電子、工業電腦、記憶體相關、Apple概念、網通與聯發科體系皆有表現，汽車電子指標股2497怡利電、3552同致、6279胡連、2231為升再創新高，操作上留意2355敬鵬、2233宇隆、8255朋程；工業電腦指標股2395研華，操作上可留意6166凌華、6245立端、3088艾訊；記憶體相關指標股3260威剛，操作留意2451創見、8299群聯；Apple概念股經過短暫利空衝擊後，近兩個交易日股價已經回神，6176瑞儀、6121新普是強勢指標，操作留意6269台郡、4958F-臻鼎、5264F-鎧勝、4966譜瑞、5371中光電；網通指標股2485兆赫、6285?碁，操作上留意2314台揚、6152百一、3062建漢；再者，2454聯發科體系相關者，3152璟德短線剛剛回檔，還有待適時修正後才有機會，惟2449京元電、6257矽格、3189景碩則屬經過適度整理的個股，操作上或可留意。在金融股部份，週一成為盤勢攻堅的要角，幾檔回到中長天期均線支撐的指標股2881富邦金、2882國泰金、2886兆豐金，週一皆有亮眼表現，先前強勢的官股銀行與中小銀行，例如2801彰銀、2880華南金、2892第一金、5880合庫、2845遠東銀、2891中信金、2884玉山金、2887台新金仍然能夠維持強勢，整體金融股普遍中長多格局不變，金融股持續是台股能否再上層樓的重要關鍵。至於非金電，週一水泥、塑膠、生技、中概內需、汽車相關較有表現，惟生技股仍有立法院開議的不確定因素，操作上必須暫時避開，待立院開議情況再擇機留意；水泥、塑膠或有權值股性質考量，操作難度較大，操作上亦避開；中概內需股在2915潤泰全、9945潤泰新、1507永大、9904寶成、9910豐泰在近期再創新高後，股價仍然維持強勢，族群性再度獲得市場青睞，1201味全、1216統一、1504東元、1702南僑、2105正新、2106建大、9914美利達、9921巨大操作上或可留意；汽車相關2227裕日車、4528江興、9951皇田、1522堤維西、1533車王電是指標，操作上留意1319東陽、1536和大、1521大億、6605帝寶。由於中國PE庫存減少與冬季需求即將啟動，加上中東地緣政治的因素干擾下，國際原油走高，推升塑化產品報價，目前油價仍面臨高檔震盪，買方現階段大舉備料機會仍低，下游廠商於10至12月進行下波庫存回補狀況不變，台塑集團8月營收，合計集團營收達1,730.35億元，月增率達9.67%，年增率達19.86%，相關個股1301台塑、1303南亞、1326台化、1304台聚、1308亞聚等後勢發展可期。","[['盤勢分析分析桑默斯', '宣佈', '退出下屆美國聯準會Fed主席'], ['美國貨幣', '刺激', '經濟'], ['金融市場反應', '呈現', '上漲'], ['2.12點', '收', '490.35'], ['10年期公債殖利率', '降至', '2.87%'], ['分析師', '感到', '失望'], ['桑默斯', '確定', '放棄主席競爭'], ['臺股', '沒有', '置身事外'], ['指數', '呈現', '走高'], ['成交金額', '放大至', '766.23億元'], ['有機會', '呈現', '鈍化格局'], ['成交金額', '回到', '20日均量之上'], ['技術面均線', '操作', '權值'], ['惟江', '說', '做好準備'], ['開議預料', '引爆', '另一波攻防'], ['政治面恐', '陷入', '馬王政爭疑慮'], ['盤面', '持續有', '高機會'], ['週一', '成爲', '攻要角'], ['重要個股', '回到', '中長期'], ['非金電水泥', '是', '盤面焦點'], ['汽車電子指標股2497怡利電', '有', '表現'], ['6176瑞儀', '是', '強勢指標'], ['2449京元電', '屬', '操作上'], ['週一', '成爲', '盤勢攻堅要角'], ['週一', '有', '亮眼表現'], ['金融股', '是', '重要關鍵'], ['惟生技股', '有', '不確定因素'], ['立院', '開議', '情況'], ['股價', '維持', '強勢'], ['族羣性', '獲得', '市場青睞'], ['相關2227裕日車', '是', '指標'], ['月增率', '達', '9.67%'], ['年增率', '達', '19.86%']]"
0,20130917_2825,大慶證券盤前－QE有望溫和退場，權值股帶頭衝◆盤勢分析本周雖有聯準會將討論QE退場時程，而紛擾政治的餘波持續衝擊股民信心，然隨鷹派的桑默斯不角逐下任Fed主席的消息宣佈後，美股期指電子盤大漲，在亞股一片歡聲雷動下，台股也一甩政治烏雲的陰霾，指數跳空開高，由權值股點火下，指數勁揚逾百點，並收在昨日最高點，量能則明顯增溫至764億元。從籌碼面來觀察，外資於現貨再度買超133億元；而期貨淨多單增至6506口。整體而言，外資看多台股的態度並未因中秋連假而受到影響，在內有外資積極買超，外有QE可望溫和退場的激勵下，向上變盤的行情可望於連假前夕提前啟動。桑默斯前日宣布退出下屆美國聯準會主席的競選，引發投資人對美國寬鬆貨幣政策將以較溫和方式退場的樂觀期待。除與標普500連袂大漲，逼近歷史高點外，美國十年前公債殖利率降至2.86%，美元跌至一個月低點皆為市場對於儘早結束寬鬆貨幣政策的預期消退所致。從美國昨日公布的經濟數據來看，僅8月工業生產上升0.4%符合預估，而紐約州9月製造業指數下降至6.3，8月份的零售業銷售額也只小幅成長0.2%，遠低於原先預估的0.4%。綜合來看，美國經濟數據雖有增長不如預期的情況，但至少維持在擴張或小幅成長，故無需過度解讀。近期觀察重點仍在9/18的聯準會政策會議上，然在Fed可望由鴿派主導下，即便QE縮減，對市場的衝擊將大幅縮小，在不確定因素逐漸排除下，研判美股近期有望挑戰歷史高點。昨日盤面以電子股權值股為上攻主軸，拉抬指數意圖明顯，在蘋果新手機預購情況優於預期的帶動下，蘋果供應鏈表現強勢，大立光更漲停鎖死，然蘋果今早重挫逾3%，相關供應鏈短期股價恐陷入震盪，然在中線基本面持續看好下，逢回仍可留意。以次族群來看，DRAM、網通族群重獲法人青睞，在資金輪動情形健康下，電子股有機會持續墊高。至於非金電，昨日塑膠、水泥、中概內需、汽車相關與生技較有表現，在中國將步入旺季和重啟基礎建設下，水泥、塑膠、鋼鐵與航運中長線看好，皆可逢低布局；另外，隨十一長假將至，中概內需、食品皆可留意。惟生技股操作上得視立院開議情況再行介入。盤面上留意的重點仍在進入旺季的手機、平板、NB；全球景氣復甦啟動之原物料、中概。操作上亦可搭配族群龍頭、九月營收向上、與集團作帳作為布局方向。,"[['權值股', '帶頭衝', '盤勢'], ['本週', '有', '討論退場時程'], ['而', '紛擾', '政治'], ['紛擾餘波', '衝擊', '股民信心'], ['鷹派桑默斯', '下任', '主席Fed消息宣佈'], ['美股期', '指', '電子盤大漲'], ['臺股', '甩', '烏雲陰霾'], ['指數勁', '揚逾', '百點'], ['量能', '增溫至', '764億元'], ['外資', '看', '多臺股態度受到影響'], ['外資', '看望於', '啓動'], ['多臺股態度', '受到', '影響'], ['外', '有', '可望'], ['向上', '變', '盤'], ['桑默斯', '宣佈', '退出下屆美國聯準會主席競選'], ['十年前公債殖利率', '降至', '2.86%'], ['儘早', '結束', '寬鬆貨幣政策'], ['工業生產', '上升', '0.4%'], ['工業生產上升0.4%', '符合', '預估'], ['9月製造業指數', '下降至', '6.3'], ['零售業銷售額', '成長', '0.2%'], ['美國經濟數據', '有', '不如預期情況'], ['增長', '不如', '預期'], ['研判美股', '挑戰', '歷史高點'], ['盤面', '爲', '攻主軸'], ['預購情況', '優於', '預期'], ['預購情況', '優於', '預期'], ['短期股價恐', '陷入', '震盪'], ['DRAM網通族羣', '重獲', '法人青睞'], ['昨日塑膠', '有', '表現'], ['留意重點', '進入', '旺季手機']]"
0,20130917_2826,永豐期貨台指選擇權盤前－獨門開市外資放假 成交量縮四年低點◆期貨走勢週六上漲1547點收在8162點。價差方面，正價差至19.52點，電子期正價差至0.54點，金融期正價差至0.06點，摩台期轉為逆價差1.14點。從期指大額交易人部位變化來分析，全月份十大交易人於期貨市場空單減碼144口，淨空單降至1268口，特定法人空單回補2740口，淨空單降至267口。三大法人於期貨市場多單加碼69口，淨多單升至6477口，外資期貨多單加碼1503口，淨多單升至3598口，法人多單部位加碼，現貨持續買超，但買超幅度不若以往，反應法人對短線盤勢有轉趨保守的意味。期貨走勢方面，台股由於秋節補班獨家開市，但因外資休假內資也無追價力道下，雖美股前日收紅，現貨小紅開出不久後，便在平盤之下震盪，則是全日在盤上小紅震盪，成交量能急縮387億為四年來的新低，盤中僅和碩因市場傳iphone5C預受缺貨上漲下盤中無主流，終場指數在平盤上下作收。技術面，週六台股震盪走低，連兩日跌破5日線，失守8200點，買盤力道明顯不如前幾天強勁，多頭攻勢有暫歇意味，盤勢轉入震盪整理態勢，操作上建議於季線之上，站上5日線前不作多，並請嚴設停損。◆選擇權分析選擇權從成交量來觀察，9月份買權集中在8200 點，賣權集中在8100點。未平倉量部份，買權未平倉大量區在8300 點，而賣權大量區在8000 點。全月份未平倉量put/call ratio由1.395降至1.39，買權平均隱含波動率由5.93降至5.20%，賣權平均隱含波動率由7.94降至7.06，買賣權同降，在短線格局震盪走低下，操作上建議於8000-8200點間建立賣權空頭價差因應。,"[['永豐期貨臺', '指', '收開市1547點'], ['淨空單', '降至', '1268口'], ['多單', '升至', '3598口'], ['買幅度', '若', '以往'], ['反應法人', '有', '轉趨意味'], ['因市場傳iphone5C', '預受', '缺貨上漲'], ['因市場傳iphone5C', '預受', '缺貨上漲'], ['預受盤中', '無', '主流'], ['多頭攻勢', '有', '暫歇意味'], ['盤勢', '轉入', '震盪整理態勢'], ['9月份買權', '集中在', '8200點'], ['賣權', '集中在', '8100點'], ['大量區', '在', ' 點'], ['大量區', '在', ' 點'], ['1.395由', 'put/call降至', '1.39'], ['平均隱含波動率', '降至', '7.06'], ['平均隱含波動率', '降至降至', '5.20%'], ['間', '建立', '空頭價差']]"
0,20130917_2827,"元大期貨台股期指盤前－現貨急縮窒息量 期指手腳難動彈◆行情分析評論：週五美股收漲，激勵週六補行交易的台股開高，但F-TPK卻傳出基本面的利空消息，高價股向下比價效應進而使大盤表現受壓抑，隨即陷入狹幅震盪走勢。開高回測下方支撐，雖然買盤低接力道仍不弱，但追價意願卻不高，然而在最後一盤現貨下殺，期貨卻上拉的影響下，終場期現貨轉正價差20點，選擇權波動率變化也不大，突顯期貨市場相對現貨市場樂觀的一面。觀察法人籌碼變化，三大法人土洋對作，其中外資買超15.3億元，自營商則賣超2.1億元，投信賣超4.8億元，三大法人合計買超8.4億元；在淨部位方面，外資加碼淨多單1,503口至 3,598口，自營商則減碼淨多單1,407口至417口，三大法人共小增淨多單69口至6,477口；另外，前十大交易人則維持4,271口淨多單，整體來看，大額交易人對後市看法並無太大改變。週六台股成交量為387億元，在外資買盤縮手下，市場量能急凍；由於中秋連假即將到來，九月合約也將於下週三結算，又適逢美國 FOMC利率會議即將展開，這段期間買盤不願持股過節的心態其實是可以想見的，導致逢高賣壓有加重跡象，連日來指數遲滯不前;而也持續陷入5日均線保衛戰，只是連日來壓回時量能都呈現萎縮，且歐美股市表現依然不弱，下檔空間恐怕不大，震盪整理後多頭仍有可為。","[['現貨急縮窒息量', '期指', '難動彈'], ['美股', '收', '漲'], ['F-TPK', '傳出', '利空消息'], ['期貨市場相對現貨市場樂觀的一面', '開', '高回測'], ['但', '追', '價'], ['三大法人', '小增', '多單69口'], ['三大法人', '小增至', '6'], ['交易人', '維持', '淨'], ['對看法', '並無', '大改變'], ['臺股成交量', '爲', '387億元'], ['買盤', '不願', '持股'], ['買盤', '不願', '持股'], ['買盤不願持股心態', '是', '想見的'], ['賣壓', '有', '加重跡象'], ['量', '呈現', '萎縮'], ['多頭', '有', '可爲']]"
0,20130917_2828,乾景投顧盤前分析◆控盤心法：1.昨日說明大盤接下來到中秋前會量縮盤跌不會急跌，今日又再印證!會員問說大盤盤在這裡到底有何好處?就國內而言，至少安定股市不要讓九月政爭影響市場投資信心。另外讓大盤盤在這，最簡單地在下週三國內指數結算，國內衍生商品期權多空單遇到盤整，上下各幾十萬口單都會被莊家通吃。控盤手不是只有漲跌才能賺，盤整吃期權的時間價值吃完後，大方向會更明確地表態。2.中長期結構看看大盤週線位置。今年以來七次600點上下震盪，大結構是呈現收斂型態。上端8330到下端7930左右是上下的突破點位。現在市場都害怕美國收QE後會大跌拉回，外資之前在新興市場收資金確實也造成不少賣壓。關鍵在於台股本身，現在證所稅8500點枷鎖已經拿掉，明年經濟成長率上看4%，國內M1B資金高達12.8兆非常多，歐美股市今年創歷史新高，台股壓抑都未表現。我若是控盤手，中秋前盤整最後壓縮，中秋後突破8330展開台股的主升段!馬明河分析師,"[['大盤盤', '有', '何好處'], ['盤整', '喫', '期權'], ['大結構', '呈現', '收斂型態'], ['到', '是', '突破點位'], ['市場', '害怕', '拉回'], ['美國', '收', 'QE'], ['收資金', '造成', '不少賣壓'], ['關鍵', '在於', '臺股本身'], ['歐美股市', '創', '歷史新高'], ['我', '若是', '控盤手']]"
0,20130917_2829,克萊斯勒計劃本周提交IPO檔案新浪財經訊 北京時間9月17日凌晨消息，美國汽車製造商克萊斯勒計劃在本周提交上市申請，以使少數股東可以公開出售股份。對希望完全控制克萊斯勒的多數股東菲亞特來，這意味股東之間矛盾的進一步尖。路透社的報導稱，義大利汽車製造商菲亞特希望收購少數股東VEBA所持有的克萊斯勒41.5%股份，獲取自己與對手競爭所需的克萊斯勒的現金流和技術。VEBA是與美國汽車工人聯合會(UAW)存在關聯的一隻醫保信托基金。但是，迄今VEBA對菲亞特提出的購股價格並不滿意。盡管上市將推延VEBA出售股份的時日，但VEBA希望此舉能幫助自己從投資者處獲得更好的價格，或迫使菲亞特提高現有的出價。與此同時，對已經持有克萊斯勒58.5%股份的菲亞特來，它希望上市后市場的估值能表明目前給予VEBA的報價是后者所面臨的最佳選擇。ICBPI的分析師阿瑞納(Luca Arena)表示：“在克萊斯勒真正IPO之前達成一項協議符合雙方利益，對菲亞特尤其如此。”周一菲亞特在米蘭上市的股票下跌0.3%，至6.13，延續上周五以來的勢。上周五稍早時菲亞特CEO馬爾基翁(Sergio Marchionne)表示，他並不願意推進菲亞特與VEBA達成交易。今天英國《金融時報》的一篇報導稱，兼任克萊斯勒CEO的馬爾基翁曾指出，克萊斯勒計劃在本周向證管機構提交上市檔案，這一時點將早於預期。(立悟/編譯),"[['克萊斯勒', '計劃', '北京時間9月17日凌晨消息'], ['汽車製造商克萊斯勒', '計劃', '提交上市申請'], ['汽車製造商克萊斯勒', '計劃以', '使'], ['這', '意味', '矛盾'], ['路透社報導', '稱', '義大利汽車製造商菲亞特希望收購自己所需克萊斯勒現金流'], ['義大利汽車製造商菲亞特', '希望', '收購自己所需克萊斯勒現金流'], ['VEBA', '存在', '一隻醫保信託基金'], ['上市', '推延', 'VEBA出售股份時日'], ['VEBA', '出售', '股份'], ['VEBA', '出售', '股份'], ['VEBA', '希望', '此舉幫助'], ['已經', '持有', '58.5%股份'], ['它', '希望', '市場估值表'], ['前', '給予', 'VEBA'], ['給予VEBA報價', '是', '最佳選擇'], ['MarchionneSergio', '表示', '他願意推進'], ['他', '願意', '推進'], ['一篇報導', '稱', '兼任克萊斯勒CEO馬爾基翁指出克萊斯勒計劃提交上市檔案'], ['，', '兼任', '克萊斯勒CEO'], ['兼任克萊斯勒CEO馬爾基翁', '指出', '克萊斯勒計劃提交上市檔案'], ['克萊斯勒', '計劃', '提交上市檔案']]"
0,20130917_2830,快閃記憶體公司Violin擬IPO融資最多1.8億美元新浪科技訊 北京時間9月16日晚間消息，快閃記憶體提供商Violin Memory預計將在IPO(首次公開招股)中銷售1800萬股股份，融資1.8億美元。Violin從2011年開始籌備IPO。該公司目前表示，IPO價格預計將為8至10美元，而該公司的市值將超過8億美元。東芝目前是Violin的大股東之一。在Violin進行IPO之后，東芝的持股比例將從14%下降至11%。由於智能手機和平板電腦的熱銷，市場對快閃記憶體品的需求正越來越大。相對於傳統硬碟，快閃記憶體的數據存取速度更快。目前，快閃記憶體行業已成為許多投資公司關注的熱門行業。快閃記憶體設備公司Pure Storage上月表示，已經在一輪融資中獲得1.5億美元，而估值則超過10億美元。Violin位於加州聖克拉拉。該公司在一份檔案中表示，IPO收益將被用於工作資本以及償還債務。摩根大通、德意志銀行證券及美銀美林將是Violin IPO的主承銷商。在截至1月31日的這一財年中，Violin的凈虧損擴大至1.091億美元，高於上年同期的4480萬美元。而營收同期增長至7380萬美元。(張帆),"[['Violin Memory預計', '銷售', '1800萬股股份'], ['Violin', '開始', '籌備IPO'], ['該公司', '表示', 'IPO價格爲810美元'], ['IPO價格', '爲', '810美元'], ['該公司市值', '超過', '8億美元'], ['東芝', '是', '大股東之一'], ['Violin', '進行', 'IPO'], ['持股比例', '下降至', '11%'], ['快', '閃', '記憶體'], ['記憶體行業', '成爲', '熱門行業'], ['估值', '超過', '10億美元'], ['Violin', '位於', '加州聖克拉拉'], ['該公司', '表示', 'IPO收益用於工作資本'], ['IPO收益', '用於', '工作資本'], ['摩根大通德意志銀行證券', '是', 'Violin主承銷商'], ['Violin淨虧損', '擴大至', '1.091億美元'], ['營收', '增長至', '7380萬美元']]"
