,News,All,SVO
0,20130916_2871,台股外資持續站買方 上周大買444億元 買超兆豐金、中信金台股上周高檔震盪，外資持續站在買方，根據證交所統計，上周外資在集中市場買超443.82億元，累計今年至上周五為止，買超金額為997億元，買超前兩名全是金融股，分別是兆豐金()、中信金()與台積電()；賣超前三名則以蘋果概念股為主，賣超第一名是和碩()，賣超1.5萬張，賣超第三則是鴻海()。證交所統計，外資上周買超台股443.8億元，總計今年累計至上周五為止買超金額為997億元，總持有股票市值為7.72兆元，占大盤市值約34.24%，較9/6當周7.71兆元略增90.75億元。在個股部分，外資上周買超前三名主要集中在金融股上，買超兆豐金與中信金分別達6.84萬張與6.16萬張，買超台積電5.8萬張；賣超前三名則以電子股為主，其中蘋概股成為賣超主要標的，分別為和碩、華寶(8078-TW)與鴻海，賣超1.53萬張、1.3萬張與1.1萬張。,"[['外資', '站在', '買方'], ['買超金額', '爲', '997億元'], ['，', '賣', '()'], ['，', '賣', '第三'], ['買超金額', '爲', '997億元'], ['股票市值', '爲', '7.72兆元'], ['7.71兆元', '略增', '90.75億元'], ['超前三名', '集中在', '金融股上'], ['買超兆豐金', '達', '6.84萬張'], ['蘋概股', '成爲', '1.53萬張爲和碩']]"
0,20130916_2872,乾景投顧盤後－利多連發  台股備戰8265點◆盤勢分析台股上周六(14日)無論在成交量及指數方面皆無交出好表現，不過事隔一天的時間，台股周一價量齊揚，以大漲112點坐收，其中主要的原因為美國前財政部長桑默斯宣布放棄角逐聯準會主席大位，因此在現任美國聯準會副主席葉倫接棒的可能性提高下，美股以大漲來回應聯準會政策可望在未來維持穩定的利多，而美股的大漲也帶動台股在內的亞股周一全面大漲。台股終場收在8255點，成交量為762億元，本周隨時有機會向上挑戰前高8265點。由於本周適逢中秋節連續假期，在僅剩的二個交易日，不免會遭遇節前調節賣壓，因此現階段選股建議以第4季產業透明度較高的族群為首選，例如將進入傳統旺季的水泥，售價已確定將會調漲，有利水泥股營收及獲利表現；至於近期各別產業指標報價面臨上漲利多的族群也可留意，例如DRAM報價受惠海力士火災上漲，台灣DRAM相關半導體公司可望受惠，而BDI運價指數因鐵礦砂需求上揚而隨之飆升，也讓散裝航運股受到市場關注。此外，中國大陸即將進入十一長假的消費旺季，中概內需股短線也有發揮的機會；最後提醒，在蘋果新機不叫好但卻叫座的情況下，蘋概股在面臨前波修正後，現在也是投資人可以留意的族群。,"[['盤勢臺股', '無', '交出好表現'], ['主要原因', '爲', '財政部長桑默斯宣佈放棄角逐聯準會主席大位'], ['財政部長桑默斯', '宣佈', '放棄角逐聯準會主席大位'], ['在', '現任', '美國聯準會副主席葉倫接棒'], ['政策', '維持', '穩定利多'], ['終場收', '在', '8255點'], ['成交量', '爲', '有機會'], ['本週', '適逢', '中秋節連續假期'], ['選股', '建議', '爲首選'], ['售價', '確定', '調漲'], ['產業指標報價', '面臨', '上漲利多族羣'], ['中國大陸', '進入', '消費旺季'], ['中概內需股短線', '也有', '發揮機會'], ['蘋概股', '也是', '投資人留意族羣']]"
0,20130916_2873,"氣回溫 企業購併再起 中小股彈跳力十足今年以來美國企業的併購活動，截至9月底的交易金額已達到7550億美元，不僅相較去年同期增加47.2%，也創下2004年以來的高峰(資料來源：路透社、EconoMonitor，2013/9)。包含華倫巴菲特(Warren Buffett)，在採訪時更是表示：其領導的波克夏海瑟威(Berkshire Hathaway)未來將增加小型購併案的數量(資料來源：Bloomberg，2013/9)。保德信全球中小基金經理人江宜虔表示，今年企業併購活動熱絡的理由有二，一來目前全球企業握有高達6.7兆美元現金水位，利率低檔加上豐沛的銀彈，讓企業有能力採取購併策略(路透社、Bloomberg，EconoMonitor，2013/9)；二來環顧總體環境，企業逐漸嗅到了經濟回春，因此從2012年開始，大型企業對中小企業購併的意願即開始明顯增加。江宜虔指出，由於景氣復甦、企業購併活動再起，財報體質佳或者具有轉機的中小型股，往往首先成為被收購標的，除了美國之外，日本和中國的海外購併活動也開始活絡起來，主因企業多具有全球佈局的戰略考量。而根據統計，今年上半年美國20樁併購交易案，在購併消息宣布後一個月，被購併目標公司的股價平均上漲幅度達11% (資料來源：Bloomberg，保德信投信整理，2013/9/16)。由此看來，只要全球景氣復甦態勢不變，預料中小型表現可望比大型股具有相對的彈升優勢。江宜虔也提醒，短期內隨著市場資金的持續流入，中小型股的平均投資評價已慢慢攀升至長期平均水準，同時短線QE退場及地緣政治風險等不確定因素，預期中小型股的股價波動仍偏高，建議一般投資人不妨藉由定時定額來介入，積極型投資者則可趁市場拉回時再酌量單筆加碼。**********************************************************************本基金經金管會核准或同意生效，惟不表示絕無風險。本公司以往之經理績效不保證基金之最低投資收益；本公司除盡善良管理人之注意義務外，不負責本基金之盈虧，亦不保證最低之收益，投資人申購前應詳閱基金公開說明書。有關基金應負擔之費用已揭露於基金之公開說明書，投資人可至保德信投信理財網（）或公開資訊觀測站(newmops.twse.com.tw)查詢。本文提及之經濟走勢預測不必然代表本基金之績效，本基金投資風險請詳閱基金公開說明書。本資料之全部構成一完整之訊息傳達，僅部分引用可能影響讀者對該訊息之正確瞭解。建議本資料之收受者於未經與本公司討論前，不公開發布經增刪後之本資料內容。身為金融業領導品牌的保德信金融集團(Prudential Financial)，在亞洲、美國、歐洲、拉丁美洲皆有營運據點，總受託管理資產約7500億(截至2010/9/30)，藉由運用長久以來在資產管理和人壽保險所累積的專業經驗，保德信專注於服務將近5,000萬個法人及個人客戶，增長並保護他們的財富。在美國，公司讓人熟知能詳的「岩石」象徵，代表了穩健、專業、實力堅強、以及創新的特質，並已通過時間的考驗。保德信提供多樣化金融產品及服務，包括共同基金、人壽保險、年金、投資管理、退休相關服務、不動產服務..等。需要更多資訊，可上網站 .保德信投信獨立經營管理。保德信及其岩石商標為專有服務標誌，未經本公司事先同意前，不得使用。","[['企業購', '再起', '併購活動'], ['截至交易金額', '達到', '7550億美元'], ['領導波克夏海瑟威Berkshire Hathaway', '增加', '小型購併案數量'], ['今年', '企業併購', '活動熱絡'], ['企業併購理由', '有', '二'], ['企業', '嗅到', '經濟回春'], ['對意願', '開始', '增加'], ['江宜虔', '指出', '活動再起'], ['中小型股', '成爲', '收購標的'], ['海外購', '開始', '戰略考量'], ['美國', '併購', '交易案'], ['在', '購', '消息'], ['上漲幅度', '達', '資料來源'], ['中小型表現', '具有', '彈升優勢'], ['江宜虔', '提醒', '平均投資評價攀升'], ['平均投資評價', '攀升至', '平均水準'], ['一般投資人', '藉由', '定時定額'], ['本公司', '保證', '投資收益'], ['除', '盡', '善良管理人注意義務'], ['本公司', '不負', '本基金盈虧'], ['應', '負擔', '有關基金'], ['負擔有關基金費用', '揭露於', '公開說明書'], ['投資人', '至', '公開觀測站保德信投信理財網查詢'], ['或', '公開', '觀測站'], ['經濟走勢預測', '代表', '本基金績效'], ['部分引用', '影響', '讀者瞭解'], ['本資料收受者', '發佈', '本資料內容'], ['他們財富', '身爲', '金融業領導品牌'], ['身爲金融業領導品牌保德信金融集團Prudential Financial', '有', '7500億資產'], ['保德信', '專注於', ',5000萬個法人'], ['保德信', '提供', '金融產品'], ['保德信', '爲', '服務標誌']]"
0,20130916_2874,聯發科任命王碩仁為市場研究部門總經理IC設計聯發科聯發科今(16)日宣布，任命王碩仁為市場研究部門總經理(General Manager of Corporate Marketing)，負責聯發科市場研究，及企業品牌與傳播相關業務，並直接報告給聯發科副總經理暨首席行銷長Johan Lodenius。聯發科副總經理暨首席行銷長Johan Lodenius表示，王碩仁具備半導體市場研究及策略行銷多年經驗，仰仗其對於產業的洞悉與市場的策略行銷能力，加入聯發科，將能協助聯發科建立世界一流的市場研究團隊，建置完整行銷策略佈局。王碩仁在普林斯頓大學(Princeton University)取得博士學位，其工作職涯始於AT&T貝爾實驗室及德州儀器，之後加入台積電，服務超過17年，不僅領導台積電市場研究部門的創立建置，並多次擔任台積電技術行銷方面的重要職位，包含台積電日本子公司副社長。王碩仁在加入聯發科前，也擔任法國Soitec公司行銷暨策略資深副總經理。,"[['聯發科副總經理Johan Lodenius', '表示', '王碩仁具備多年經驗'], ['王碩仁', '具備', '多年經驗'], ['王碩仁', '取得', '博士學位'], ['工作職涯', '始於', 'AT&T貝爾實驗室'], ['服務', '超過', '17年'], ['王碩仁', '擔任', '法國Soitec公司行銷副總經理']]"
0,20130916_2875,"遊戲準股王報到！F-通訊145元登興櫃 今年賺逾1股本專注於手機應用軟體推廣渠道的中國通訊多媒體(F-通訊)()明(17)日登錄興櫃交易，登錄價145元。公司今年前8月稅後淨利1.15億元，每股盈餘6.45元，隨著中國市場持續成長帶動下，法人估計今年每股盈餘將賺超過1個股本，未來掛牌後有機會擠下傳奇()，登上遊戲股新股王。F-通訊成立於2011年，主要從事手機應用軟體及手機遊戲推廣、手機遊戲運營及提供其他增值服務，為手機應用軟體推廣商及手機遊戲運營商，營運模式係結合電信產業上游的電信運營商、服務提供商(Service Provider，SP)、其他支付商(如支付寶)與下游內容提供商(Content Provider，CP，於該行業中泛指遊戲或軟體開發商)以及手機渠道商(如：方案商、集成商及手機製造廠商等)，將手機應用軟體及手機遊戲透過手機渠道商預裝於手機內，然後推送至手機用戶使用或下載。F-通訊自2011年起即致力於手機渠道業務之發展，尤其著重於手機遊戲的推廣，目前已擁有累積達1.5億個手機用戶，約佔中國手機用戶11.2億戶中的13.4%，其中活躍用戶超過5000萬戶，能快速推送軟體給手機使用者，並在產業內具有相當的競爭優勢與市場地位。F-通訊未來將切入三大新事業，包含引進中文遊戲進攻大陸智慧型手機市場、智慧手機彩票投注業務、智慧手機便利生活化APP，其中引進中文遊戲部分，未來將尋找更多台灣優質廠商，透過CCMG的通路，持續搶食中國手機遊戲市場。而從中國市場來看，手機上網的收入規模快速增長，市場潛力不容忽視。F-通訊2012年營業收入7.17億元，年增137%，由於毛利率改善及公司規模經濟影響，使得稅後淨利1.57億元,399仟元，年增暴衝911%，每股盈餘超過10元；今年前8月營收達4.47億元，稅後淨利1.15億元，每股盈餘6.45元，營收獲利均創下新高。","[['逾1股本', '專注於', '推廣渠道'], ['F多媒體通訊', '登錄', '興櫃'], ['法人', '估計', '每股盈餘超過1個股本'], ['每股盈餘', '超過', '1個股本'], ['F通訊', '成立於', '2011年'], ['營運模式系', '結合', '電信產業'], ['CP', '泛指', '遊戲'], ['活躍用戶', '超過', '5000萬戶'], ['F通訊', '切入', '新事業'], ['彩票', '投注', '業務'], ['市場潛力', '不容', '忽視'], ['年', '增', '137%'], ['每股盈餘', '超過', '10元'], ['營收', '達', '4.47億元'], ['營收穫利', '創下', '新高']]"
0,20130916_2876,台開開發金門BOT案建免稅店 與Dufry簽約合資經營台開()集團今(16)日宣布正式與世界大型旅遊零售集團Dufry (杜福瑞)正式簽署合資協議，合資共同經營台開集團「金門風獅爺批發免稅商店街」，這也是杜福瑞公司在跨足全球45個國家經營後的首度切入台灣地區市場，並選擇以金門第一落腳處。此一由台開集團與杜福瑞公司在金門合資經營的免稅店，其第一期免稅經營面積在3.6萬平方米，預計將於2014年上半年開業營運。台開集團表示，風獅爺批發免稅商店街3C生活百貨及金獅豪華影城將可於今年底正式營運。旅遊零售集團Dufry成立已有150年的歷史，目前在機場行業的銷售額和利潤是全球第一，其承擔的多元角色是品牌代理商包括CHANEL、 HERMES、 CARTIER等精品都超過百年合作經驗，在全球45個國家的經營面積超過19萬平方米，銷售品類達5000多種，全球銷售額超過50億美元。台灣、斯里蘭卡和最近得標的巴厘島以及哈薩克斯坦是Dufry在亞洲最新斬獲，使得其在遠東，中東及中亞的經營版圖擴大到9個國家和地區，更使得DUFRY集團在全球的經營版圖達到48個國家和地區之多。台開集團董事長邱復生與Dufry集團歐亞非總裁Mr.Xavier Rossinyol共同主持簽約儀式，邱復生會中宣布，3C產品、生活百貨及金獅豪華影城是在金門風獅爺批發免稅商店街西棟，將於年底開幕，樓地板面積達3716坪，擁有4D Cinemax的金獅豪華影城規畫可容納500人座的大廳、100人座的小廳及一個VIP廳，進駐企業包括，日本吉本興業、統一超商()，Apple經銷通路德誼數位與Samsung商品通路商鴻邁科技。台開集團營運邁入50周年，集團董事長邱復生表示，台開集團一直以來都為台灣這片熱愛的土地奮鬥，開發最大潛力，這次很高興全球最大旅遊零售集團Dufry在金門與台開集團合作，共同投資引進世界精品，菸酒，食品，香水化妝品，提供給廣大的台灣與中國民眾最佳的消費體驗。旅遊零售集團Dufry全球CEO Julian Diaz 表示，進入台灣市場是在亞洲發展的一個關鍵性的里程碑，因為這是在大中華區第一個免稅項目。該公司將充分發揮作為目前在中國大陸經營面積最大的國際旅遊零售商的經驗，以及在亞洲的快速增長的優勢來為金門帶來最前沿的零售方式。台開集團做出與其共同投資這個作為該公司最大的發展項目中的旗艦商店的決定令其感到特別的榮幸。金門距離中國大陸廈門市約10公里，從金門乘坐渡輪至廈門五通碼頭僅需30分鐘即可到達。 金門於2008年被臺灣政府授與離島免稅的政策，每年來金門的臺灣遊客可以購買2.4萬美元的免稅商品。,"[['經營臺', '開', '獅爺批發免稅商店街'], ['這', '也是', '杜福瑞公司在切入臺灣地區市場'], ['杜福瑞公司', '切入', '臺灣地區市場'], ['免稅經營面積', '在', '3.6萬平方米'], ['臺開集團', '表示', '3C生活百貨營運'], ['旅遊零售集團Dufry', '成立', '已有150年曆史'], ['在銷售額', '是', '第一'], ['多元角色', '是', '包括等CHANEL'], ['精品', '超過', '合作經驗'], ['銷售品類', '達', '5000多種'], ['全球銷售額', '超過', '50億美元'], ['臺灣斯里蘭卡', '是', 'Dufry斬獲'], ['經營版圖', '擴大到', '9個國家'], ['Dufry集團歐亞非總裁Mr.Xavier Rossinyol', '主持', '簽約儀式'], ['3C產品', '批發', '西棟'], ['樓地板面積', '達', '3716坪'], ['豪華影城規畫', '可容納', '500人座大廳'], ['集團董事長邱復生', '表示', '奮鬥'], ['CEOJulianDiaz', '表示', '進入臺灣市場是關鍵性里程碑'], ['進入臺灣市場', '是', '關鍵性里程碑'], ['這', '是', '免稅項目'], ['金門', '帶來', '最前沿'], ['臺開集團', '做出', '旗艦商店決定'], ['金門', '距離', '中國大陸廈門市'], ['臺灣遊客', '購買', '2.4萬美元免稅商品']]"
0,20130916_2877,"永豐期貨台指選擇權盤後－ FED鴿派掌權美電子期大漲  台指站穩8200「期貨走勢」：週一上漲87點收在8249點。價差方面，逆價差至6.34點，電子期逆價差至0.21點，金融期逆價差至3.09點，摩台期逆價差0.09點。從期指大額交易人部位變化來永豐金證券提供分析，全月份十大交易人於期貨市場多單減碼3361口，轉為淨空單至177口，特定法人空單回補2291口，轉為淨多單至2024口。三大法人於期貨市場多單減碼336口，淨多單降至6141口，外資期貨多單加碼2908口，淨多單升至6506口，法人多單部位加碼，現貨持續買超，反應法人對短線盤勢持續偏多的意味。期貨走勢方面，周一盤前在市場代表""鷹派""的桑德斯退出聯準會主席選舉下市場解讀為維持低利看法，美電子盤盤中一度大漲250點下也帶動了週一紅盤開出，台積電漲幅超過2%，大立光則是受到iphone5C預購缺貨下漲停站回千元大關，指數一路的開高走高終場站穩8200。技術面，週一台股震盪走高，站回五日線之上，守穩8200點，買盤力道強勁，多頭攻勢有續攻意味，操作上建議延5日線偏多操作，並請嚴設停損。「選擇權走勢」：選擇權從成交量來觀察，9月份買權集中在8200 點，賣權集中在8200點。未平倉量部份，買權未平倉大量區在8300 點，而賣權大量區在8000 點。全月份未平倉量put/call ratio由1.39升至1.45，買權平均隱含波動率由5.20降至3.76%，賣權平均隱含波動率由7.055升至7.06，買權升賣權降，在短線格局震盪走低下，操作上建議於8000-8200點間建立買權多頭價差因應。","[['永豐期貨臺', '指', '期貨走勢'], ['掌權美電子期', '指', '站穩8200'], ['  臺', '指', '站穩8200'], ['永豐金證券', '提供', '分析'], ['多單', '減', '3361口'], ['市場', '代表', '鷹派'], ['代表鷹派桑德斯', '退出', '主席選舉下市場'], ['臺積電漲幅', '超過', '2%'], ['多頭攻勢', '有', '續攻意味'], ['9月份買權', '在', '8200點'], ['賣權', '在', '8200點'], ['大量區', '在', ' 點'], ['大量區', '在', ' 點'], ['買權升賣權', '降升至', '7.06'], ['間', '建立', '因']]"
0,20130916_2878,遊戲準股王報到！F-通訊145元登興櫃 今年賺逾1股本專注於手機應用軟體推廣渠道的中國通訊多媒體(F-通訊)()明(17)日登錄興櫃交易，登錄價145元。公司今年前8月稅後淨利1.15億元，每股盈餘6.45元，隨著中國市場持續成長帶動下，法人估計今年每股盈餘將賺超過1個股本，未來掛牌後有機會擠下傳奇()，登上遊戲股新股王。F-通訊成立於2011年，主要從事手機應用軟體及手機遊戲推廣、手機遊戲運營及提供其他增值服務，為手機應用軟體推廣商及手機遊戲運營商，營運模式係結合電信產業上游的電信運營商、服務提供商(Service Provider，SP)、其他支付商(如支付寶)與下游內容提供商(Content Provider，CP，於該行業中泛指遊戲或軟體開發商)以及手機渠道商(如：方案商、集成商及手機製造廠商等)，將手機應用軟體及手機遊戲透過手機渠道商預裝於手機內，然後推送至手機用戶使用或下載。F-通訊自2011年起即致力於手機渠道業務之發展，尤其著重於手機遊戲的推廣，目前已擁有累積達1.5億個手機用戶，約佔中國手機用戶11.2億戶中的13.4%，其中活躍用戶超過5000萬戶，能快速推送軟體給手機使用者，並在產業內具有相當的競爭優勢與市場地位。F-通訊未來將切入三大新事業，包含引進中文遊戲進攻大陸智慧型手機市場、智慧手機彩票投注業務、智慧手機便利生活化APP，其中引進中文遊戲部分，未來將尋找更多台灣優質廠商，透過CCMG的通路，持續搶食中國手機遊戲市場。而從中國市場來看，手機上網的收入規模快速增長，市場潛力不容忽視。F-通訊2012年營業收入7.17億元，年增137%，由於毛利率改善及公司規模經濟影響，使得稅後淨利1.57億元，年增暴衝911%，每股盈餘超過10元；今年前8月營收達4.47億元，稅後淨利1.15億元，每股盈餘6.45元，營收獲利均創下新高。,"[['逾1股本', '專注於', '推廣渠道'], ['F多媒體通訊', '登錄', '興櫃'], ['法人', '估計', '每股盈餘超過1個股本'], ['每股盈餘', '超過', '1個股本'], ['F通訊', '成立於', '2011年'], ['營運模式系', '結合', '電信產業'], ['CP', '泛指', '遊戲'], ['活躍用戶', '超過', '5000萬戶'], ['F通訊', '切入', '新事業'], ['彩票', '投注', '業務'], ['市場潛力', '不容', '忽視'], ['年', '增', '137%'], ['每股盈餘', '超過', '10元'], ['營收', '達', '4.47億元'], ['營收穫利', '創下', '新高']]"
0,20130916_2879,中國太陽能業者向內看 靠內需撐營收2014年上演爭奪戰全球市場研究機構TrendForce旗下綠能事業處EnergyTrend今(16)日表示，上半年各太陽能廠出貨及營收調查顯示，中國大廠明顯降低歐洲出貨占比，將重心轉向中國內需市場以及日本等其他亞洲市場；在此趨勢，中國大廠2014年將上演爭奪戰。受到中歐貿易紛爭以及亞洲市場崛起的影響，太陽能廠商在今年上半年紛紛重新啟動企業策略布局。EnergyTrend指出，如Trina今年對歐洲出貨占比預計將由去年的48%降至27%，其中大多轉移至中國及日本，中國的出貨占比將由13%提升到3成左右。去年對歐洲出貨也在五成左右的Jinko亦大幅調降輸歐比重，預計下半年出貨中國比例會占總出貨的4到5成，並另外增加對日本及美國的出貨量。中國龐大的內需市場使Trina及Jinko第2季模組出貨增幅達60%以上；另外，JA Solar對亞洲的出貨占比高達七成、Canadian Solar對日本的出貨占比提升到3成以上；SunPower及REC雖為歐美廠商，仍降低歐洲比重加強對日本出貨，不僅顯示日本市場需求火熱，更凸顯歐洲市場的衰退，使得不受雙反影響的歐美廠商也開始調整布局策略。從第2季各廠營收表現來看，Jinko及Trina持續提高對中國出貨占比，帶動營收季增率達到5成以上，Jinko更是成為第一間轉虧為盈的中國一線廠商；出貨量蟬聯第一的Yingli大減輸歐比重，將目標市場分別轉移至亞洲及美洲，營收穩居中國廠商第一；Canadian Solar及ReneSola歐洲市場營收比重下降幅度雖不如前述廠商，但將對歐洲的出貨大部份轉至美洲，支撐第二季營收表現。反觀JA Solar雖然對亞洲出貨比重高、對日本的出貨也維持一定水平，但在同業都大幅提升模組出貨時，其電池片出貨比重仍高，使得營收未能有亮眼表現。另一方面，EnergyTrend指出，美國廠商營收呈衰退的態勢，First Solar失去穩居一年的營收冠軍寶座，SunPower則因為高效模組能符合日本市場需求，對日本出貨優於預期，故營收跌幅不若First Solar大。顯示以歐美電站業務為營運主體的廠商並未在此波亞洲市場崛起占有優勢，未來布局還待後續觀察。,"[['太陽能廠出貨', '顯示', '轉向內需市場'], ['中國大廠', '降低', '佔比'], ['太陽能廠商', '重新啓動', '企業策略佈局'], ['EnergyTrend', '指出', 'Trina預計降至27%'], ['Trina', '預計', '降至27%'], ['也', '在', '左右五成'], ['在Jinko', '調降', '輸歐比重'], ['中國比例', '佔', '4出貨到5成'], ['4', '到', '5成'], ['亞洲出貨佔比', '高達', '七成'], ['SunPower', '爲', '歐美廠商'], ['使得', '不受', '雙反影響'], ['營收季增率', '達到', '5成以上'], ['Jinko', '成爲', '中國一線廠商'], ['出貨量', '蟬聯', '第一Yingli減歐比重'], ['第一Yingli', '減', '歐比重'], ['下降幅度', '不如', '前述廠商'], ['同業', '提升', '模組出貨'], ['大幅', '提升', '模組出貨'], ['EnergyTrend', '指出', '營收跌幅若First'], ['美國廠商營收', '呈', '衰退態勢'], ['First Solar', '失去', '冠軍寶座'], ['高效模組', '符合', '市場需求'], ['營收跌幅', '若', 'First'], ['電站業務', '爲', '營運主體'], ['爲營運主體廠商', '佔有', '優勢'], ['佈局', '待', '觀察']]"
