,News,All,SVO
0,20130606_875,大摩、花旗保守看宏達電後市 ONE扭轉乾坤還要拚宏達電()5月營收回溫，但高層人事又有異動，近1年來已有6位副總級以上主管離職，外資除關注營運團隊後市，對基本面也有疑慮，摩根士丹利證券坦言，宏達電在中國知名度和美國市占還不足驅動營運走揚，加上供應鏈疑慮似乎成常態，維持減碼評等。花旗環球證券說明，新ONE還不足以讓營運反轉向上，蘋果迷需求延遲，是在等待蘋果的大尺寸手機。宏達電5月營收月增近48%，德意志證券及野村證券同步調高宏達電目標價及上修獲利預估，其中德意志證券將目標價由原先的250元上修至260元；野村證券則將目標價由原先的281元上修至318元但摩根士丹利證券指出，宏達電5月營收回溫主要是經銷通路消化延遲的訂單，第3季實際銷售動能能否持續仍要待觀察，大摩不像市場樂觀看待美電信商Verizone供貨，主要考量是5吋機款在Verizon規模量其實沒有想像中的大，而中階款M4也會將面臨競爭對手強勁挑戰，以現在股價估值來看，宏達電股價已偏貴。摩根士丹利證券指出，HTC ONE雖有好評，不過仍有產業結構的疑慮，包括：宏達電從開發市場轉移新興市場佈局並沒有很順暢，相較三星在中國品牌知名度仍偏弱，美國市占也還不足以驅動整體營運走揚，主要是成長速度偏緩、預付費用組合因素。摩根士丹利證券也說明，宏達電零組件供應策略讓產品上市時間錯失機會之窗，零組件供應疑慮似乎已成為經常性的問題。在下半年智慧機OEM領導廠商積極的定價策略下，預估對2線品牌廠經有壓力。宏達電雖以新ONE在近期智慧機市場中贏得短期戰役，不過整體智慧機戰場輸贏仍沒有定論，維持減碼評等，和目標價199元。花旗環球證券在先前的報告也指出，新ONE月產能已超過百萬支，不過還不足以讓宏達電營運反轉向上，由於其他機款在中國銷售仍待加強，ONE量能無法完全趨動營益率表現，在行銷費用提升和低獲利下，雖然預估宏達電第3季呈現微溫，但出貨量仍可達780萬支，營益率應可回升到4%。 花旗環球證券認為，宏達電的困境仍在三星強大行銷資源，和全球電信商力挺，就算蘋果錯失大螢幕趨勢，但根據蘋果迷的反應來看，他們寧願延遲購買需求，等待蘋果大尺寸手機推出，而非轉進其他品牌。,"[['高層人事', '有', '異動'], ['外資', '也有', '疑慮'], ['在知名度', '不足', '驅動營運走揚'], ['花旗環球證券', '說明', '等待大尺寸手機'], ['德意志證券', '調', '宏達電目標價'], ['野村證券', '修至', '318元'], ['摩根士丹利證券', '指出', '收回溫是延遲訂單'], ['收回溫', '是', '延遲訂單'], ['銷售動能', '待', '觀察'], ['大摩', '像', '樂觀'], ['主要考量', '是', '想像中大'], ['機款', '在', 'Verizon'], ['機款', '在', 'Verizon'], ['中階款M4', '面臨', '競爭對手'], ['摩根士丹利證券', '指出', '有產業結構疑慮'], ['HTC', '有', '好評'], ['宏達電', '轉移', '新興市場'], ['開發市場', '轉移', '新興市場'], ['摩根士丹利證券', '說明', '讓錯失機會窗'], ['零組件供應', '成爲', '經常性問題'], ['宏達電', '贏得', '短期戰役'], ['戰場輸贏', '沒有', '定論'], ['新ONE月產能', '超過', '百萬支'], ['宏達電第3季', '呈現', '微溫'], ['出貨量', '達', '780萬支'], ['\xa0花旗環球證券', '認爲', '他們延遲購買需求'], ['宏達電困境', '在', '行銷資源'], ['蘋果', '錯失', '螢幕趨勢'], ['他們', '延遲', '購買需求']]"
0,20130606_876,3D列印火紅擋不住！實威、大塚攜手又漲停3D列印實在「火紅擋不住」！國內代理3D軟硬體實威()及大塚()，在市場持續追捧下，今(6)日攜手再飆漲停！其中實威已站上180元，來到188.5元，大塚也不遑多讓，股價來到118.5元，直逼120元大關，2家公司6月以來，短短4個營業日，漲幅都超過2成。實威今年前4月每股盈餘達1.38元，總經理許泰源日前表示，今年將全力衝刺3D列印市場，在3D Systems幫助下，今年在中國市場營收占比將會倍數成長，有機會拉高至15%，未來3年內中國據點將成長到15個，透過3D Systems協助，成為兩岸最大的3D列印代理商。大塚前4月每股盈餘達1.23元，由於大塚並未代理任何3D列印機器，僅代理3D繪圖等軟體，激發市場想像空間，隨著3D列印機器需求，可望帶起軟體成長空間。不過，目前3D軟體相關產品占營收比約僅3成，3D相關產品也非近期營運成長主力，公司目前營運穩定成長，中國營收已開始有成長。大塚4月自結營收為5400萬元，年增35%，稅後淨利600多萬元，年增200%，單月每股0.34元，累計前4月每股盈餘為1.23元，優於去年。,"[['持續', '追捧', '市場'], ['股價', '來到', '118.5元'], ['4個營業日漲幅', '超過', '2成'], ['總經理許泰源', '表示', '衝刺印市場'], ['大冢', '代理', '列印機器'], ['相關產品', '營運', '成長主力'], ['中國營收', '開始', '有成長'], ['結營收', '爲', '5400萬元'], ['年', '增', '200%'], ['每股盈餘', '爲', '1.23元']]"
0,20130606_877,單軋廠7月外銷價估續跌，Q3恐須謹慎以待精實新聞 2013-06-06記者 鄭盈芷 報導中鋼（2002）上周開出7~8月內銷盤價後，單軋廠燁輝（2023）、盛餘（2029）本周也開始積極與客戶報價、接單，不過受到鋼市仍趨於低迷影響，推估單軋廠7月外銷盤價恐仍較6月續跌20~30美元/公噸，再加上貶幅不足，單軋廠Q3營運還是面臨重重挑戰，而業者除希望匯率能回到至少30.5元的水準，也期望中鋼9月內銷盤價再適度調降價格。受到國際鋼價行情走跌影響，燁輝、盛餘5月外銷報價紛紛轉跌，而6月外銷報價則已較首季底少了65~70美元/公噸，跌幅相當可觀，業者並表示，從目前接單狀況與客戶態度來看，7月外銷報價恐怕還是需要再跌20~30美元/公噸，情況並不容樂觀。不堪鋼價持續滑落，前一陣子美國大型鋼廠如AK Steel等也紛紛喊漲50美元/公噸，不過據了解，最終僅成功拉漲5~10美元/公噸；而在大陸鋼市部分，經歷了前一波急跌後，近期鋼價也出現小幅拉回的跡象，國際鐵礦石價格也從109美元/公噸回升到116美元/公噸，不過單軋廠業者則認為僅是試探性拉漲，後市仍須謹慎以待。單軋廠業者分析，大陸鋼廠由於目前生產鋼品還具有邊際效益，秉持著「不做虧更多」的想法，大多數鋼廠都還未進入減產階段，且日均粗鋼產量也高掛200萬公噸以上，業者認為，在大陸產能過剩的隱憂未得到適當紓解前，鋼價缺乏合理支撐，就算有漲勢也很難延續。單軋廠對於Q3看法趨於保守，不過受惠於中鋼7~8月內銷盤價調降，法人推估，單軋廠6月本業仍可保有獲利，上半年獲利無虞，惟Q3獲利表現，則還需觀察中鋼9月內銷盤價開盤狀況。有單軋廠業者直言，受到貶值幅度不足與中鋼盤價跌幅不夠影響，營運仍舊相當艱辛，除了期望匯率能至少回到30.5元之外，也呼籲中鋼9月盤價適度調降。,"[['Q3', '以待', '06-062013記者'], ['2023單軋廠燁輝', '開始', '報價'], ['鋼市', '趨於', '2030美元公噸'], ['業者', '回到', '30.5元水準'], ['適度', '調', '銷盤價'], ['外銷報價', '少', '6570美元公噸'], ['業者', '表示', '外銷報價需要跌2030美元公噸'], ['外銷報價', '需要', '跌2030美元公噸'], ['情況', '並不容', '樂觀'], ['等AK Steel', '喊漲', '公噸50美元'], ['鋼價', '出現', '小幅拉回跡象'], ['單軋廠業者', '認爲', '後市以待'], ['試探性', '拉', '漲'], ['單軋廠業者', '分析', '大陸鋼廠具有邊際效益'], ['大陸鋼廠', '具有', '邊際效益'], ['不', '做', '虧'], ['大多數鋼廠', '進入', '減產階段'], ['日均粗鋼產量', '掛', '200萬公噸以上'], ['業者', '認爲', '延續'], ['大陸產能過剩隱憂', '得到', '適當紓解'], ['鋼價', '有', '漲勢'], ['單軋廠', '趨於', '保守'], ['法人', '推估', '本業保有獲利'], ['本業', '保有', '獲利'], ['廠業者', '直言', '艱辛'], ['期望匯率', '回到', '30.5元'], ['至少', '回到', '30.5元']]"
0,20130606_878,復航新機商務艙配備萬元耳機MONSTER  搶高端客層！復航(6702-TW)宣布與席捲全球的耳機之王MONSTER魔聲耳機代理商逢緯國際合作，在最新A330商務艙中配備萬元頂級抗噪耳機MONSTER Inspiration，創下航空業配備最頂級耳機的創舉，盼以創新服務獲得高端旅客青睞。復航表示，「MONSTER魔聲專機」為千萬級跨界合作，可讓旅行享樂直達雲端，創全球航空業的創舉，也可望更為鞏固商務客層。復興航空董事長林明昇指出，為提供乘客更舒適的機上服務，復航已於去(2012)年起全面啟動服務升級並積極與異業合作、整合資源，並推出各項領先同業的創新服務，包括首創悠遊卡購票、機場貴賓室引進氧氣吧、在候機室提供品牌水等，去年在商務艙推出的尊榮服務流程也獲得不少商務人士好評。MONSTER Inspiration搭載主動式抗噪技術，能杜絕飛機飛行時的轟隆聲響，完美呈現清晰原音，讓旅客盡情享受毫無干擾的音質與空間。逢緯國際執行長蔣雅琪也表示，全球創舉「MONSTER魔聲專機」提供旅客「旅行時尚」的生活態度，「在飛機上聽音樂看電影時，就像國際巨星陪你一起搭機般身歷其境」。,"[['復航新機商務艙', '配備', '萬元耳機MONSTER  '], ['6702TW', '宣佈', '合作'], ['代理商', '逢', '緯國際'], ['航空業', '配備', '頂級耳機創舉'], ['復航', '表示', '魔聲專機爲跨界合作'], ['魔聲專機', '爲', '跨界合作'], ['復興航空董事長林明升', '指出', '復航啓動服務'], ['於', '去', '2012'], ['復航', '啓動', '服務'], ['貴賓室', '引進', '氧氣'], ['服務流程', '獲得', '商務人士好評'], ['緯國際執行長蔣雅琪', '表示', '魔聲專機提供旅行時尚生活態度'], ['魔聲專機', '提供', '旅行時尚生活態度']]"
0,20130606_879,奕力5月營收月增2成，Q2季增估達2成精實新聞 2013-06-06 記者 羅毓嘉 報導LCD驅動IC廠奕力(3598)公佈5月營收為10.29億元，隨著手機面板缺貨狀況趨緩、加以觸控晶片出貨動能轉佳，月增幅度達20.3%、較去年同期則成長26.2%，是去年9月以來營收首度重返10億元關卡。法人預期，奕力Q2營收可望較Q1季增20%，Q3起驅動IC需求更將持續增溫，奕力上下半年營收將挑戰4比6的格局。累計今年前5月，奕力營收為40.69億元，較去年同期成長10.8%。奕力主要產品為小尺寸的LCD驅動IC，在中國手機市場的市佔率達到6、7成，同時也切入觸控IC，主打平板電腦與中大尺寸裝置應用。今年5月，奕力在Samsung擴大手機驅動IC委外貢獻、再加上觸控IC出貨量增長，5月營收交出去年9月以來首破10億元關卡成績。法人指出，奕力的觸控IC開始轉換市場、主攻白牌平板與一體成形(AIO)電腦等應用，已經打入部分國際品牌廠供應鏈，可望成為奕力下半年業績助攻主動能，同時毛利率亦將同步增長。就產品組合來看，奕力目前驅動IC主要產品線為解析度HVGA以下的功能型、平價智慧型手機解決方案，WVGA產品則已導入量產，惟面對市場先進者聯詠(3034)、旭曜(3545)卡位，對奕力業績貢獻度尚待放大。據了解，奕力已著手開發HD720解析度產品，規劃近期送樣，有助於提昇產品線的完整性。法人預期，奕力上、下半年的業績比重可呈現4比6的格局，全年營收將較去年的105.49億元更上層樓，並再度更新奕力全年營收新高。,"[['營收', '爲', '10.29億元'], ['營收首度', '重返', '10億元關卡'], ['法人', '預期', '營收可望增20%'], ['營收可望', '增', '20%'], ['奕力營收', '爲', '40.69億元'], ['主要產品', '爲', '小尺寸LCD驅動IC'], ['市佔率', '達到', '6'], ['法人', '指出', '觸控IC開始轉換市場'], ['觸控IC', '開始', '轉換市場'], ['主要產品線', '爲', '手機解決方案'], ['WVGA產品', '導入', '量產'], ['奕力', '著手', '開發解析度產品'], ['規劃送樣', '有助於', '提升產品線完整性'], ['法人', '預期', '奕力上業績呈現4比6格局'], ['奕力上業績', '呈現', '4比6格局'], ['4', '比', '6'], ['4', '比', '6']]"
0,20130606_880,永豐香港分行主辦首筆中資企業聯貸 中裕燃氣籌組7200萬美元永豐金()旗下永豐銀行香港分行主辦首筆中資企業－中裕燃氣的聯貸案，聯貸總金額7200萬美元，利率採LIBOR（倫敦銀行間拆放利率）加碼3.0%，較一般同類型台資企業聯貸多出約1%，不僅為台資銀行開拓新市場，同時也為企業打通資金新渠道。永豐銀行表示，本次參貸對象以台資銀行為主，除永豐銀行外，台灣中小企銀則擔任共同主辦行，其餘參加銀行有土地銀行、彰化銀行、華南銀行、兆豐銀行、上海儲蓄商業銀行及中信銀行（國際）等8家，共同組成聯貸銀行團。聯貸企業中裕燃氣主要則於中國大陸河南及山東經營天燃氣業務，最大單一股東為中國燃氣；中裕燃氣於2012年在香港由創業版轉主板掛牌上市()，近年以購併方式積極擴張事業版圖，由於所屬產業具有特殊性，擁有獨家特許經營權，營運獲利相對穩定，因此也獲得台資銀行團的認同。永豐銀行指出，集團以新市場、新貨幣、新通路為三大行動主軸，專注及大陸等新市場，以領先的腳步擴張版圖，永豐香港分行以十多年累積之客戶群，未來搭配即將成立的南京子行，以雙引擎密切結合、發揮綜效，持續朝「兩岸三地最靈活便利的金融品牌」邁進。,"[['利率', '採', 'LIBOR'], ['永豐銀行', '表示', '參貸對象爲主'], ['中小企銀', '擔任', '共同主辦行'], ['參加銀行', '有', '8家'], ['中裕燃氣', '於', '天燃氣業務'], ['單一股東', '爲', '中國燃氣'], ['中裕燃氣', '轉', '()'], ['購', '擴張', '事業版圖'], ['所屬產業', '具有', '特殊性'], ['永豐銀行', '指出', '集團爲行動主軸'], ['集團', '爲', '行動主軸'], ['集團', '爲以', '腳步擴張版圖']]"
0,20130606_881,端午變盤前 台股下殺取量摸索C波滿足點 台積電再測大量區端午變盤前，台股今(6)日9點半過後快速下殺取量一度跌破8100點，先失守頸線、低見8061點；同時量能有望將溫和增至800億元以上，分析師、法人分別指出，在美國量化寬鬆(QE)雜音不退下，與新版證所稅遞延戰線至6月下旬，注意大型權值股台積電()()與聯電()()等指標股的走勢。亞股早盤，日股漲逾0.48%，恆指跌深0.84%，台股跌深逾0.8%；深證B股下殺逾63點跌逾1.06%。台股今天下殺取量，一度先失守頸線8089點；台積電今天再度回測認錯大量區間，跌逾1.3%；同期聯電修正幅度也約相當並測試5日線、世界()則跌逾1.8%失守月線、太陽能族群連續兩天展開結帳、鴻海()今天破底。先行指標匯率方面，美元兌見到29.71元水準；電子成交比重降至6成，台積電、聯電今天成交量明顯同步降低，聯電低接買盤集中在月線附近；而台積電內盤量約為外盤倍數，同時低接買盤集中在認錯行情啟動的下檔區間；同時上檔賣壓集中在平盤附近。另外，NHK製作台積電的紀錄片也預定今天晚間播出。部分分析師就伴隨美股重挫的台股C波滿足點的修正整理而言，日KD低檔回測8046-8065缺口，滿足點約在頸線之下8077-8078點附近，同時整理時間則約將是在端午變盤重合。分析師余世欽指出，上周MSCI權重生效扣除後，量能早已是呈現退潮了，台股已領先國際盤修正，且漲勢本遜國際盤，就本周他認為仍是注意急漲急跌的偏多式操作，在趨勢表現，破底下殺毋須過度恐慌。,"[['臺積電', '測', '端午變盤'], ['分析師', '指出', '注意指標股走勢'], ['跌深', '逾', '0.8%'], ['跌', '逾', '1.3%'], ['接買盤', '集中在', '月線附近'], ['內盤量', '爲', '外盤倍數'], ['在', '認錯', '行情啓動'], ['上檔賣壓', '集中在', '平盤附近'], ['製作臺', '積', '電'], ['積電紀錄片', '預定', '播出'], ['部分分析師', '滿足', '在80778078點附近'], ['整理時間', '是', '變盤'], ['分析師餘世欽', '指出', '量能呈現退潮'], ['量能', '呈現', '退潮'], ['他', '認爲', '注意偏多式操作']]"
0,20130606_882,台股盤中─急殺取量匯集人氣 中小股穩多方軍心 先守8100點在歐美股同步走跌的衝擊下，亞股今(6)日殺聲隆隆，台股早盤以小跌34.64點開出後，盤中大跌逾80點，跌破8100點關卡，空方重手摜壓大型權值股，8200點上檔壓力區越來越重、並有下移趨勢，在急殺取量下，預估成交值放大至800億元左右，法人分析，下殺取量不是壞事，大盤守穩在季線8047點上僅待多方聚集人氣，盤中先以3D列印、資產營建股各自表現。熱錢持續湧入亞洲市場，昨爆量勁揚1.1角並站回2字頭，早盤也再度升逾1角，激勵資產概念股發威，國產、新建以及國揚漲幅在2%上下，日勝生、太子、冠德以及台開也守在紅盤上。3D列印產業最近話題超夯，實威邀請全球知名3D列印大廠3D Systems公司副總裁Michele Marchesan來台暢談產業趨勢，預期「3D列印將改變人們學習、溝通、創造的方式」，看好今年全球相關需求將大量成長，激勵相關概念股漲勢猛烈，實威、大塚再度攻上漲停板鎖死。股王爭霸戰今向下比價，大立光、漢微科跌幅在1.5%上下，且多檔權值股遭到空方摜壓，包括和泰車、裕日車跌幅接近3%，廣達跌逾半根停板，統一超跌逾2%，群創、日月光、聯電以及中信金、國泰金也跌了1.5%上下，導致大盤跌幅一度擴大，不過宏達電、可成、聯發科以及富邦金穩站紅盤上，其他電子股也各自表現，包括順達科漲幅3%、神達漲逾2%、光燿科漲幅逼近5%等，皆是大盤力拚守在8100點之上的功臣之一。相對昨日作為穩盤主流，金融股今表現不如市場預期，中信金、國泰金跌幅均超過1%，新光金、永豐金、第一金、開發金以及元大金、華南金和兆豐金等皆在盤下震盪，與高價電子股同流為壓抑盤面的主軸。法人指出，殺盤取量有利提升市場動能，不過美股連續回檔干擾，短線籌碼仍以區間操作為主，在下殺取量之際，法人持股較多的權值股面臨壓力較大，但可留意有生技月題材帶動的生醫族群，以及下半年展望佳的觸控相關產業後市表現。,"[['─', '急殺', '彙集人氣'], ['壓力區', '逾', '摜壓大型權值股'], ['成交值', '放大至', '800億元左右'], ['大盤', '待', '多方聚集人氣'], ['多方', '聚集', '人氣'], ['熱錢', '湧入', '亞洲市場'], ['日勝生', '守在', '紅盤上'], ['實威', '邀請', '暢談產業趨勢'], ['3D列印', '改變', '人們學習方式'], ['大立光跌幅', '在', '1.5%上下'], ['多檔權值股', '遭到', '摜壓'], ['跌幅', '接近', '3%'], ['大盤力', '守在', '8100點之上'], ['今表現', '不如', '市場預期'], ['中信金跌幅', '超過', '1%'], ['法人', '指出', '留意月題材帶動生醫族羣'], ['殺', '取', '量'], ['殺', '取', '量']]"
0,20130606_883,Canon概念股佳凌5月營收1.78億元 創7個月來新高Canon在台的光學零組件協力廠商佳凌科技()自結2013年5月營收為1.78億元，月增率7.98%，也創下近7個月來新高；並較去年同月成長46.15%。佳凌科技2013年累計1-5月營收為7.7億元，也較去年同期成長16.43%。佳凌科技今年第1季的營收4.28億元，較去年同期的4.1億元成長4.38%，而由佳凌科技所獲客戶端的訂單預估資料顯示，今年的第2季的訂單能見度非常高，生產、出貨順利，4月營收營收將高於3月的1.46億元，今天公布的5月的營收又較4月成長，而6月則因客戶端盤點的因素，營收會呈現較和緩的走勢。佳凌科技總經理劉佳彬認為，2013年佳凌科技營收走勢在客戶所給的訂單明確之下，今年第2季的營收走勢不會像去年一樣的第2季較第1季下滑；反而是像今年4月新機種、新產品量產開始，生產線量產的良率有待提升，佳凌科技也是積極以加班等方式尋求補救，以因應客戶的訂單需求。佳凌科技配合台灣Canon在嘉義大埔美工業區設立的新生產線，佳凌科技主管說，佳凌科技嘉義廠建廠並已完工，人員也招募齊全，目前正進行人員的培訓中。佳凌科技已在5月28日取得信用的資格。,"[['Canon概念股佳凌', '營收', '1.78億元'], ['2013年5月營收', '爲', '1.78億元'], ['-累計5月營收', '爲', '7.7億元'], ['佳凌科技', '所獲', '客戶端'], ['預估資料', '顯示', '高'], ['營收將', '高於', '3月1.46億元'], ['營收會', '呈現', '和緩走勢'], ['佳凌科技總經理劉佳彬', '認爲', '營收走勢下滑'], ['生產線量產良率', '有待', '提升'], ['佳凌科技', '尋求', '補救'], ['佳凌科技', '尋求以', '應訂單需求'], ['佳凌科技', '配合', '新生產線'], ['佳凌科技', '取得', '信用'], ['5月28日', '取得', '信用']]"
0,20130606_884,勝德攻無線充電達陣！結合USB、快速充電新品Q3大搶市Nokia、三星接棒推出無線充電功能智慧手機，讓無線充電功能爆紅，業界傳出宏達電()、蘋果也都有意在新品中納入。電源廠勝德()在無線充電領域，原本就符合WPC聯盟Qi標準，勝德看好無線充電在3C產品應用，默默「鴨子滑水」，此次台北國際電腦展中，不僅發表無線充電新品，且一舉結合USB充電、快速充電功能，並為保護手機，也納入防突波雷擊，拉高無線充電規格！勝德透露，相關產品已獲得國際大廠認證，第3季將可開始交貨。勝德以電源保護器起家，原本在電源領域就具有技術領先優勢，在無線充電領域，勝德原本就是符合WPC聯盟Qi標準，而目前無線充電產品，所需充電時間較長，且也未納入防突波雷擊等保護功能，由於目前採用無線充電的智慧手機等產品，都屬高價品，因此勝德也將相關技術整合在其中，推出新一代無線充電產品。據了解，勝德無線充電新一代產品，已獲得國際大廠高度興趣，並陸續獲得認證，而勝德未來除可直接供貨3C大廠外，也可透過一般通路，提供消費者換購，將無線充電產品升級。勝德此次在Computex展中，也推出支援APP的重量級智能能源管理插座，名為APPSPOWER，讓插座可透過藍芽傳輸與智慧型手機配對連線，將可依使用者設定自動啟動或關閉設備，另有多組時間設定功能。除了開關插座產品外，該系列產品也推出具有光功能的插座及自動感光控制開關插座，產品線可謂相當完整。勝德近年來積極發展智能控制產品，現已有具體發展成果，如RF、ZigBee、Wi-Fi 智能插座均已開發完成，並開始針對主要市場如：美國、日本、中國等進行推廣，應用範圍遍及居家智能化、企業節能效益及工業能源管理，成果顯著。,"[['業界', '傳出', ')('], ['(勝德', '符合', 'WPC聯盟Qi標準'], ['勝德', '看好', '充電'], ['一舉', '結合', 'USB'], ['納入拉高無線充電規格', '防', '突波雷擊'], ['勝德', '透露', '相關產品獲得國際大廠認證'], ['相關產品', '獲得', '國際大廠認證'], ['勝德', '就是', '符合WPC聯盟Qi標準'], ['，', '所需', '充電'], ['勝德', '整合在', '其中'], ['新一代產品', '獲得', '高度興趣'], ['勝德', '推出', '智能能源管理插座'], ['名', '爲', 'APPSPOWER'], ['該系列產品', '推出', '具有光功能插座'], ['勝德', '發展', '智能控制產品'], ['等美國', '進行', '推廣'], ['應用範圍', '遍及', '居家智能化']]"
