,News,All,SVO
0,20130625_2000,新光證券盤前分析◆盤勢分析收7758.03點， 下跌35.28點或0.45%，成交量835.23億元。OTC指數收116.64點，下跌0.25點或0.21%，成交量117.91億元。等待證所稅週二表決，週一台股量能萎縮且開低走低，在美QE恐縮減、證所稅未定下，電子及部份傳產股慘遭修理，不過因大立光及台塑四寶發輝穩盤作用，午後一度逆轉勝，惟因尾盤法人倒貨，大盤連四日收跌，終場收7758.03點，下跌35.28點或0.45%，成交量835.23億元。綜觀週一盤面，面板、IC設計、手機製造、3C代工等類股走勢疲弱，令電子股下跌 1.21%，成交比重61.32%。傳產股方面，塑膠、百貨及油電股漲幅逾1%，玻璃及造紙則表現較差，金融股受惠21日兩岸簽定服務貿易協定，跌幅較輕，小跌0.02%。雖然QE條件式縮水影響減輕，投資人對證所稅過關仍存希望，但亞股疲弱加上陸股大幅跳水，再度打擊市場信心，週一三大法人賣超186.37億，其中外資170.16億，投信7.11億，9. 11億。累計今年以來外資賣超111.39億，之前買超已全數吐回，顯示法人態度悲觀。考量大陸錢荒問題嚴重，製造業呈現萎縮，QE預期縮減，使得新興市場股市大跌效應擴大，且法人操作保守，大盤恐續向年線整理，選股方面，可考慮具業績型高殖利率概念股逢低買進。,"[['OTC指數', '收', '116.64點'], ['證', '未定', '所稅'], ['電子', '慘遭', '修理'], ['大盤', '收', '835.23億元'], ['塑膠漲幅', '逾', '1%'], ['金融股', '受惠', '21日兩岸'], ['投資人', '存', '希望'], ['亞股疲弱', '加上', '陸股跳水'], ['買進具業績型高殖利率概念股', '考量', '大陸錢荒'], ['製造業', '呈現', '萎縮']]"
0,20130625_2001,台股6月25日訊息盤點(二) 個股訊息(1) 筆電品牌大廠惠普宣布結盟中國大陸卡通喜洋洋合作，將合作推出產品，搶吃兒童教育商機，而台灣相關供應鏈可望同步受惠，同時惠普也看好未來PC搭載觸控的趨勢，相關供應鏈營運可望同步受惠。(2) 筆電代工廣達()昨日召開股東會，對下半年看法仍正面，預期上下半年出貨比可達4比6，預估值為業界最樂觀，預期第 3 季將有明顯成長力道，第 4 季目前能見度仍有限。(3) PCB廠燿華()看好下半年營運與獲利表現，今年在新客戶與新產品出貨帶動下，總座喊話今年燿華成長幅度將優於產業平均，另外也決議再擴充產能，以因應未來市場商機。(4) 鴻海董座郭台銘接受媒體專訪，談到今年景氣難樂觀，不過就鴻海而言，下半年仍是傳統旺季，此外他也證實鴻海將分拆事業群，以提高競爭力。,"[['惠普', '看好', 'PC搭載趨勢'], ['筆電代工廣達', '召開', '股東會'], ['上下半年出貨', '可達', '6比'], ['預估值', '爲', '業界樂觀'], ['PCB廠燿華', '看好', '下半年營運表現'], ['燿華成長幅度', '優於因', '商機'], ['鴻海董座郭臺銘', '接受', '媒體專訪'], ['下半年', '仍是', '傳統旺季'], ['他', '證實', '鴻海分拆事業羣'], ['他', '證實以', '提高競爭力'], ['鴻海', '分拆', '事業羣']]"
0,20130625_2002,"統一期貨台期指暨選擇權盤前─亞股重挫，台股持續下跌◆期指分析：亞股重挫，台股持續下跌 週五美股漲跌互見，日本開高、韓國開低，台股開低震盪；電子股方面，權值股下跌居多，面板雙虎持續重挫，TPK跌停鎖死，和碩捕蝶下挫，聯發科與晨星同步下跌超過6%；金融股方面，漲跌互見；傳產類股方面，漲跌互見，塑膠上漲超過1%，不過玻璃下挫約1%；終場收盤下跌35點，收在7758點，成交值825億元。在期指部分，下跌28點，逆價差128.03點；電子期下跌3.05點，逆價差6.37點，金融期下跌1.8點，逆價差7.61點；下跌逆價差收斂，下跌顯見支撐買盤。就未平倉部位分析，自營商淨多單增加1,958口，淨多單部位3,339口；投信淨多單減少33口，淨多單部位304口；外資淨空單增加1,760口，淨空單部位16,069口；在籌碼面部份，外資賣超現股170億元，期貨淨空單部位增加，看法偏向空方。就技術面觀察，開低震盪，外資現貨持續賣超，期貨空單增加，選擇權部位偏空，週二證所稅如能順利闖關，則有利於扭轉空方氣氛，否則近期籌碼偏空的狀態下，仍不能過度樂觀。◆選擇權分析 多空就選擇權籌碼觀察，賣權/買權未平倉比由0.94下降至0.91，為盤整偏空格局。在最大未平倉量序列部份，買權由8200點下移至8000點，賣權由7500點下移至7400點。外資部位賣權未平倉量大於買權，對行情看法偏向保守。2013/06/25","[['亞股', '重挫', '臺股下跌'], ['聯發科下跌', '超過', '6%'], ['塑膠上漲', '超過', '1%'], ['自營商', '增加', '3部位'], ['多單', '減少', '33口'], ['外資淨空單', '增加', '1'], ['看法', '偏向', '空方'], ['賣權買權平倉比', '下降至', '0.91'], ['外資部位賣權未平倉量', '大於', '買權']]"
0,20130625_2003,日盛投顧盤前分析◆盤勢分析美股聯準會縮減QE的壓力以及陸股稍早重挫影響。下跌 139.84 點或 0.94% 至 14659.56 點。Nasdaq 指數下跌 36.49 點或 1.09% 至 3320.76 點。 指數下滑 19.34 點或 1.21% 至 1573.09 點。指數下滑 9.30 點或 2.02% 至 451.55 點。週一亞洲盤仍然走弱，澳洲、南韓紛紛破底，上証在中國控管資金流動性以及高盛降中國成長率之下，指數重挫達5.3%，恆生破底，台股在亞洲盤中表現相對強勢，一度為亞洲盤面中獨紅的市場，可惜終場在陸股重挫之下，反向殺低，以下跌35.28點作收，來到7758.03點，收盤量為825.16億元。從技術面來看，台股5日線、10日線、月線空方排列且開口放大，走勢已經偏弱，而月線與季線也即將死亡交叉，代表中期趨勢轉弱已經不可避免，低檔支撐僅剩下年線，而亞洲盤持續弱勢，台股算是獨強，但在國際資金持續撤離之下，最好狀況就是在7600-7800之間整理，但短線上與五日均、月線乖離拉大之下，已經有反彈機會，但趨勢轉弱之下，反彈應站在賣方。三大法人賣186.37億元，其中外資賣超170.15億元，投信賣超7.1億元，自營商賣超9.1億元，同步賣超。週一盤面中，強勢個股逐一倒地，與大盤走勢迥異，1476儒鴻、9914美利達、3673F-TPK、3481群創、2454聯發科、2458義隆電、4938和碩、5871F-中租等有的持續重挫有的尤強轉弱，2330台積電領先大盤破低，3658漢微科跌破月線，但回饋到指數上似乎感受不到，主因在於台塑集團股以及電信三雄與國泰金等穩盤，但實際進入盤面結構中看，整體狀況並不理想，操作上宜短不宜長。電子股2409友達、3481群創、2458義隆電、2454聯發科、3673F-TPK、2498宏達電、2448晶電、6176瑞儀、4966F-譜瑞等股紛紛重挫，顯見資金仍在撤出當中，而盤中較強勢者仍以記憶體族群為主，3474華亞科、8299群聯、6239力成等，而弱勢股2317鴻海止穩，但2330台積電破低，下游2324仁寶、2382廣達、3231緯創、2356英業達等買盤較強，暑假旺季來臨，遊戲股5478智冠、3687歐買尬等走強，3D列印則以4722國精化與4974亞泰為指標而車用電子由於有業績支撐8255朋程、2355敬鵬等走強。傳產股整體強度仍比電子抗跌，2106建大、1477聚陽、1319東陽、2912統一超、1312國喬、1305華夏、1227佳格等法人持股仍穩定，而台塑四寶則為目前護盤指標，觀光股受惠於暑期旺季，2719燦星旅、2701劍湖山等表現亮眼，生技族群在盤勢不穩當中，市場資金轉進，而世界製藥原料中國展在6月25日27日兩日舉行，7月18~21台灣國際生物科技展，題材面對生技股有利，4152台微體、4107邦特、4162智擎、1707葡萄王、1720生達等可留意。金融股週一守穩半年線表現優於電子類股，但由於上証金融股重挫，有可能拖累台灣金融股表現，短期內波動難免，但中長線仍有利於股價表現，指標股2886兆豐金、2882國泰金、2881富邦金、2823中壽等。6月26日鴻海股東會，市場聚焦在鴻海集團事業體分拆佈局。鴻海股價在外資賣超近期持續走低，而融資持續增加，短線上股價有出現止穩跡象，但週三股東會將是股價能否轉強的關鍵。藍版證所稅今日闖關，市場預期將會過關。證所稅案今日若闖關成功，反映在盤面上將有可能出現短線利多出盡的先上後下走勢，但中期來看，證所稅修正案通過對台股為正面解讀。,"[['Nasdaq指數', '下跌', '36.49點'], ['2.02% ', '至', '451.55點'], ['高盛', '降', '中國'], ['指數', '重挫達', '5.3%'], ['收盤量', '爲', '825.16億元'], ['中期趨勢', '轉', '弱'], ['低檔支撐', '剩下', '年線'], ['臺股', '算是', '強'], ['最好狀況', '就是', '整理'], ['趨勢', '轉', '弱'], ['趨勢', '轉', '弱'], ['反彈', '站在', '賣方'], ['三大法人', '賣', '186.37億元'], ['投信', '賣', '超'], ['自營商賣', '超', '9.1億元'], ['微科', '跌破', '月線'], ['主因', '在於', '等三雄穩盤'], ['資金', '在', '撤出當中'], ['車用電子', '支撐', '等程'], ['中國展', '抗', '跌'], ['臺塑四寶', '爲', '護盤指標'], ['觀光股', '受惠於', '暑期旺季'], ['線表現', '優於', '電子類股'], ['中長線', '有利於', '股價表現'], ['市場聚焦', '在', '鴻海集團事業體分拆佈局'], ['短線上股價', '出現', '止穩跡象'], ['週三股東會', '是', '股價轉強關鍵'], ['股價', '轉', '強'], ['能否', '轉', '強'], ['證所稅修正案', '爲', '正面']]"
0,20130625_2004,台股6月25日訊息盤點(一) 部會消息(1) 證所稅修正案立院闖關前，在野立委分別對服貿協議簽署表達強烈反彈，面對藍營希望服貿與臨時會脫勾策略，在野不買單更要求要逐條實質審查非是備查、杯葛翻案、重啟談判。(2) 主計總處昨(24)日公布5月失業率為4.06%，較上月下降0.01個百分點，也較去(2012)年同期下降0.06個百分點，創2008年7月以來新低，失業人數46.3萬人，較上月減少1000人；今(2013)年前5月平均失業率為4.14%，較去年同期下降0.03個百分點。(3) 主計總處昨(24)日公布今(2013)年前4月平均薪資為51674元，年減1.09%，主因為年初廠商減少發放年終及績效獎金影響所致，若扣除同期間消費者物價指數上升1.62%，以100年價格衡量的實質平均薪資僅50562元，不僅較上年同期減少2.67%，也創近4年來最低，其中，實質經常性薪資36739元，也是近4年來最低，年減0.93%。(4) 為振興台股，金管會、證交所等除了研議T股上市外，也將規劃大陸A股來台掛TDR上市，鎖定複委託熱門A股。(5) 台灣央行昨(24)日公布5月5大行庫新承作購屋放款金額427.25億元，較4月小幅增加13.48億元，呈連3月增加的態勢，顯示房市持續回溫，特別的是，5月新承做房貸利率大幅升至1.986%，較上月增加0.04個百分點，由跌轉升，並創2009年2月以來新高，央行表示，利率有往上趨勢，且五大銀行對特定地區包括台北市和新北市十三區，新承做房貸利率超過2%，非特定地區不動產放款也採取自律審慎措施，導致購屋貸款加權平均利率上揚。,"[['野立委', '表達', '強烈反彈'], ['藍營', '希望', '會脫勾'], ['藍營', '希望', '會脫勾'], ['會', '脫', '勾'], ['5月失業率', '爲', '4.06%'], ['平均失業率', '爲', '4.14%'], ['平均薪資', '爲', '51674元'], ['廠商', '減少', '發放年終'], ['臺灣央行', '公佈', '427.25億元'], ['新', '做', '房貸利率'], ['央行', '表示', '利率有往上趨勢'], ['利率', '有', '往上趨勢'], ['新承做房貸利率', '超過', '2%'], ['五大銀行', '採取', '審慎措施']]"
0,20130625_2005,大慶證券盤前－系統性風險持續，反彈調節持股◆盤勢分析亞股昨日依然為殺盤重心，尤其以陸股惟甚，在銀行、地產、證券類股領跌下，中國滬深兩市分別重挫達5%、6%以上。而台股昨日盤中相對亞股抗跌，雖然電子權值股仍承受外資賣壓，但在金融、塑化等大型權值股相對有撐下，指數一度由黑翻紅跌勢收斂，終場以下跌35點作收，成交量則較前一日萎縮為825億元。由於外資昨日現貨仍賣超達170億元，加上期貨部位繼續加碼空單1760口，留倉淨空單來到1.6萬口以上，而融資更是增加10億元以上，因此，台股短線於籌碼面的劣勢未變，就技術面來看，除非今日向上開高走高站上7815點，否則短線空方型態未變，在國際股市系統性風險未解除前，投資人仍宜謹慎面對盤勢。昨日國際股市重挫原因主要在於反應中國銀行業的錢荒問題，由於上週四中國上海銀行間同業拆款利率一度?升超過578.4個基點以上，引發市場開始恐慌。從目前問題來看，中國銀行間資金吃緊的主因在於政府打擊非法債券交易以及虛假貿易導致熱錢流入放緩甚至撤離，加上監管理財業務讓市場資金需求放大，另外繳稅與銀行年中考核也是原因之一，不過，因為目前中國銀行沒有擠兌現象，而流動性緊縮問題仍侷限於中小企業，主要還是為了控制房產泡沫，壓低通膨才會出現此一現象，所以研判短期陸股在賣壓宣洩後將開始止穩。台股昨日盤面賣壓仍集中於電子類股，其中高價股的聯發科、F-TPK、華碩跌勢相對沉重，而權值股台積電、和碩、友達、群創等也較為弱勢。由於今日立法院會中將可能表決拚證所稅修正案過關，但在國民黨擬祭出黨紀完成三讀下，將有望替近期跌跌不休的台股注入強心針，不過因為外資近期已經將今年買超幅度全數吐回轉為賣超108億元，所以在外資態度未轉變下，研判台股將僅是先處在低檔震盪盤底走勢。以指標股來說，中小型股依然是盤面重心，不過在郭董說出3D列印只是噱頭下，部分沒本質較具投機性個股，短線須留意拉回風險，族群可觀察IC設計、手機、網通、半導體、生技、中概、食品等，操作策略上，建議先短進短出即可。,"[['亞股', '抗', '跌'], ['電子權值股', '承受', '外資賣壓'], ['外資', '賣', '壓'], ['大型權值股', '有', '撐'], ['相對', '有', '撐'], ['留倉淨空單', '來到', '1.6萬口以上'], ['於劣勢', '增加', '10億元以上'], ['向上', '開', '高'], ['投資人', '面對', '盤勢'], ['重挫原因', '在於', '反應錢問題'], ['喫緊主因', '在於', '政府打擊非法債券交易導致熱錢流入放緩'], ['政府', '打擊', '非法債券交易'], ['政府打擊非法債券交易', '導致', '熱錢流入放緩'], ['繳稅', '也是', '原因之一'], ['中國銀行', '沒有', '擠兌現象'], ['緊縮問題', '侷限於', '中小企業'], ['研判短期陸股', '開始', '止'], ['盤面賣壓', '集中於', '電子類股'], ['國民黨', '擬', '祭出黨紀'], ['國民黨', '擬', '祭出黨紀'], ['將', '處在', '低檔'], ['郭董', '說出', '噱頭下'], ['部分', '沒', '個股'], ['族羣', '觀察', '等IC設計']]"
0,20130625_2006,"統一證盤前─下探年線尋求支撐，保守為宜◆盤勢分析：下探年線尋求支撐，保守為宜 【昨日盤勢】受到日韓股市下挫拖累，昨日台股開盤小跌5點，以7788點開出。盤中賣壓湧現，壓迫指數走低，尾盤更受到陸、港股跌幅擴大拖累，指數跌破前低，下探年線支撐。電子股中台積電、聯發科領跌，拖累半導體類股整體下跌2.17%；光電類股受友達、群創持續下挫，以及F-TPK跌停拖累，類股下跌2.84%，整體電子股下跌1.21%。傳產族群中則漲跌互見，油電、塑膠、觀光漲幅逾1%表現較佳，玻璃、化學、造紙則表現較差，跌幅逾0.7%。金融類股則在國泰金撐盤下，僅下跌0.02%，相對抗跌。終場下跌35點，收在7758點，成交量為821億元。【資金動向】三大法人合計賣超185.37億元。其中外資賣超170.16億元，投信賣超6.76億元，自營商賣超8.46億元。外資買超前五大為國泰金、歐聖、英業達、矽品、統一實；賣超前五大為友達、台積電、兆豐金、台灣50、中信金。投信買超前五大為聯電、國泰金、中壽、敬鵬、國喬；賣超前五大為友達、群創、F-TPK、新日光、義隆。資券變化方面，融資增10.8億元，融資餘額為1925億元，融?減0.23萬張，融券餘額為30.6萬張。【今日盤勢分析】受到QE退場疑慮、景氣復甦降溫、希臘聯合政府生變雜音影響，歐、美各國股指仍延續上周修正格局；而美國公債殖利率上揚，帶動美國市場利率攀升，亦引發槓桿資金持續自新興市場撤出，深滬指昨日分別重挫5、6%，恆生、南韓指數亦續創上周新低，恐拖累台股本周表現。而自台股觀察，亦有內在不利因素如下：1)、外資自6月以來累計賣超台股1,133億，將今年買超全部回吐，期貨亦留倉淨空單16,069口、借券餘額創今年以來新高，外資避險動作加劇；反觀6月以來融資持續增加，整體籌碼凌亂，不利多方。2)、台股技術面相繼失守季線、半年線支撐，且無任何反彈，季線已開始下彎，加以週KD、RSI皆高檔背離後死亡交叉向下，亦成指數上檔反壓。3)、權值電子族群如半導體、面板、PC及週邊，分別受到終端庫存調整雜音、十一長假前面板拉貨空窗期、品牌廠下修出貨量及觸控NB下游需求不如預期等諸多旺季不旺利空傳出，即便股價下跌亦難刺激中線買盤進駐。整體技術、籌碼、基本面皆不利台股中期趨勢。雖然考量指數下檔仍有上揚年限支撐，短線跌深或引發技術性反彈，預期指數將於7700-8000點區間震盪，惟指數震盪之際應謹記中期趨勢仍向下行，宜逢高降低持股。【投資策略】全球股指持續受到QE退場、美債殖利率飆升，所衍生資金離開新興市場等資產重新配置效應，連帶拖累台股。台股本身亦面臨1)外資期、現貨、借券皆偏空操作，且融資於指數修正過程中大增，籌碼凌亂、2)指數上檔面臨下彎季線反壓，週KD、RSI高檔背離後死亡交叉、3)半導體、光電、PC族群第三季度旺季不旺雜音頻傳，等三點不利台股中期趨勢因素。預期指數將下探年線支撐，保守操作。2013/6/25","[['保守', '爲', '宜'], ['下探年線', '尋求', '支撐'], ['尾盤', '受到', '陸港股跌幅擴大拖累'], ['光電類股', '受', '友達'], ['整體電子股', '下跌', '1.21%'], ['油電', '逾', '佳'], ['跌幅', '逾', '0.7%'], ['金融類股', '下跌', '0.02%'], ['成交量', '爲', '821億元'], ['投信', '賣', '6.76億元超'], ['買外資', '爲', '國泰金'], ['賣超前五大', '爲', '友達'], ['超前五大', '爲', '聯電'], ['賣超前五大', '爲', '友達'], ['融資', '增', '10.8億元'], ['融資餘額', '爲', '融'], ['融券餘額', '爲', '30.6萬張'], ['盤勢分析', '受到', '希臘聯合政府生變雜音影響'], ['各國股指', '延續', '修正格局'], ['069口', '借券餘額創', '今年以來新高'], ['季線', '開始', '下彎'], ['面板', '拉', '貨'], ['下游需求', '不如', '等預期'], ['整體技術', '不利', '中期趨勢'], ['考量指數下檔', '有', '上揚年限支撐'], ['惟指數', '謹記', '中期趨勢行'], ['全球股指', '受到', 'QE退場'], ['衍生資金', '離開', '等新興市場'], ['衍生資金', '離開', '等新興市場'], ['臺股本身', '面臨', ')外資期'], ['借券', '偏', '空'], ['指數上檔', '面臨', '反壓']]"
0,20130625_2007,國泰證期顧問處盤前－不建議在此殺低，等待指數反彈減碼即可◆盤勢分析：週一台股呈現量縮整理的走勢，早盤指數再回測上週五低點未跌破後，指數出現反彈的走勢，盤中指數一度由黑翻紅，但尾盤仍在觀望氣氛濃厚下，終場指數下跌35點，指數收在7758點，成交量為835億元。若從近期盤面的氣氛來看，近期外資持續賣超台股趨勢仍未趨緩，且觀察最近外資持續調節的標的，短線股價均維持相對弱勢的走勢，且從融資餘額來看，此波大盤從8439點回檔的過程中，整體融資增加接近100億元，顯示近期從籌碼面來看，短線籌碼相對較亂，不利指數的反彈。不過短線而言，近期指數已經從高檔回檔700點，短線跌幅不小，周一指數收盤雖續創近期新低，但從最低點並未跌破上週五低點，也顯示逢低承接買盤有進場跡象，從乖離的角度來看，目前股價與季線的負乖離為今年以來最大，相較於7050點當時的負乖離也相差無幾，加上年線目前仍維持上揚的走勢，且觀察指數目前已經出現三個往下的跳空缺口(5月23日、6月13日、6月21日)，再從上升趨勢線來看，1月17日的7603點連接4月16日的7688點所形成的上升趨勢線目前約落在7750點；技術指標面雖然顯示日線技術指標仍偏弱勢，但從日KD指標並未持續破底，短線與指數有背離跡象，因此，不建議在此殺低，等待指數跌深反彈再減碼即可。◆類股分析：週一(24日)類股呈現漲跌互見的走勢，其中資訊服務、油電燃氣、百貨、塑膠等類股表現較好，漲幅逾1%，至於電子族群中的半導體、光電等類股跌於較重，類股中目前僅剩下橡膠、資訊服務、觀光、百貨等類股仍維持在季線之上，屬盤面強勢族群，有機會領先表態，可偏多為之。,"[['臺股', '呈現', '量縮整理走勢'], ['指數', '出現', '反彈走勢'], ['終場指數', '下跌', '35點'], ['成交量', '爲', '835億元'], ['短線股價', '維持', '相對弱勢走勢'], ['整體融資增加', '接近', '100億元'], ['負乖離', '顯示', '承接買盤有進場跡象'], ['買盤', '有', '進場跡象'], ['加上年線', '維持', '上揚走勢'], ['7603點', '連接', '4月16日'], ['上升趨勢線', '落在', '7750點'], ['技術指標面', '顯示', '弱勢'], ['從日KD指標', '破', '底'], ['短線', '有', '背離跡象'], ['類股', '呈現', '漲跌走勢'], ['漲幅', '逾', '1%'], ['僅', '剩下', '類股跌'], ['等橡膠類股', '維持在', '季線之上']]"
