,News,All,SVO
0,20130329_2351,揚智去年淨利7.7億元 年增16% EPS 2.63元IC設計揚智()今(9)日召開法說會，並公布去年財報，去年第 4 季淨利為11.01億元，季減46%，毛利率低空飛過，EPS 0.35元，全年稅後淨利為7.7億元，年增16%，EPS為2.63元。揚智去年第 4 季營收為11.8億元，季減 3 %，毛利率為45%，較第 3 季減少 2 個百分點，營業淨利為1.7億元，季減19%，營業淨利率為14%，季減 3 個百分點，稅後淨利為1.01億元，季減46%，每股稅後盈餘為0.35元。揚智指出，由於全球經濟情勢保守，加上歐美市場需求減緩，壓抑機上盒市場表現，但中國大陸付費電視與IP STB市場需求持穩，推升營收表現符合原先預期。揚智去年全年合併營收為51.2億元，年增39%，毛利率為47%，年增 2 個百分點，營業淨利為9.33億元，年增76%，營益率為18%，年增 4 個百分點，稅後淨利為7.7億元，年增16%，每股稅後盈餘為2.63元。去年第 4 季揚智零售高清晶片產品營收比重達45-50%，零售標清衛星晶片營收比重約25-30%，零售地面廣播標清晶片約15-20%，IP機上盒(OTT)約3-5%，付費電視(電信運營商)比重約5-10%。去年全年來看，揚智零售高清晶片比重約55-60%，零售標清衛星營收比重約20-25%，零售標清地面廣播比重約10-15%，IP機上盒(OTT)約1-5%，付費電視(電信運營商)比重約5-10%。,"[['年', '增', 'EPS'], ['季淨利', '爲', '11.01億元'], ['稅後淨利', '爲', '7.7億元'], ['年', '增', '16%'], ['EPS', '爲', '2.63元'], ['去年第 4季營收', '爲', '11.8億元'], ['季', '減', '3%'], ['毛利率', '爲', '45%'], ['季', '減', '19%'], ['營業淨利率', '爲', '14%'], ['季', '減', '46%'], ['稅後盈餘', '爲', '0.35元'], ['揚智', '指出', '穩'], ['全年合併營收', '爲', '51.2億元'], ['年', '增', '39%'], ['毛利率', '爲', '47%'], ['年', '增', '76%'], ['年', '爲', '18%'], ['稅後淨利', '爲', '7.7億元'], ['年', '增', '16%'], ['稅後盈餘', '爲', '2.63元'], ['晶片產品營收比重', '達', '4550%']]"
0,20130329_2352,兩岸三地500指數最新報價 13:15精實新聞 2013-03-29 記者 新聞編譯 報導,[]
0,20130329_2353,晶電：陸政府補助縮手，LED產業不會DRAM化精實新聞 2013-03-29 記者 楊舒晴 報導「兩岸光電照明產業技術標準發展論壇」座談會，除邀請學術及研究單位出席外，也邀請國內LED產業。周銘俊舉先前晶電參加瑞信論壇法說會經驗，市場投資人當時就非常關切LED是否會步入太陽能及DRAM後塵。周銘俊說，最大問題就是在於中國政府補助政策造成的市場供過於求，但從日前看到太陽能廠無錫尚德宣告破產來看，代表中國政府的補助支援不再是無限上綱，這對於LED產業而言，這是一個好的訊號，再加上LED產業需求量是長期持續擴大，因此LED產業不會走向DRAM化。對於政府可以給予的支援，周銘俊指出，對於產業發展而言，政府的支援是必要條件，但錯誤的政策比沒有政策更糟糕，近期看到中國政府開始轉向積極建立CQC、CCC等LED照明標準，就像美國設立Energy Star(能源之星)標準，深感欣慰看到中國政府已經往對的方向邁進。針對兩岸未來可以合作的方向，周銘俊說，「大中華」LED照明品牌是可行的事情，而從長遠來看，我們的確要放眼全世界市場，但短中期來看，兩岸市場才是目前支援我們成長的重要因素，因此應先求讓彼此於中國大陸廣大市場站穩腳步，再來想怎麼去進軍全世界市場。,"[['陸政府', '補助', '縮手'], [' 2013-03-29記者楊舒晴', '報導', '發展論壇座談會'], ['除', '邀請', '學術'], ['市場投資人', '關切', 'LED步入太陽能'], ['LED', '步入', '太陽能'], ['周銘俊', '說', '最大問題就是在於市場供過於求'], ['最大問題', '就是', '在於市場供過於求'], ['太陽能廠無錫尚德', '宣告', '破產'], ['補助', '是', '上綱'], ['這', '是', '好的訊號'], ['LED產業需求量', '是', '擴大'], ['LED產業', '走向', 'DRAM化'], ['周銘俊', '指出', '更糟糕'], ['政府支援', '是', '必要條件'], ['中國政府', '開始', '轉向'], ['美國', '設立', '標準'], ['周銘俊', '說', '求讓'], ['照明品牌', '是', '可行事情'], ['我們', '放眼', '全世界市場'], ['兩岸市場', '纔是', '重要因素'], ['目前', '支援', '我們成長']]"
0,20130329_2354,台指期29日收盤上漲80點或1.02%   報7923點今(29)日收盤上漲 80  點或 1.02%，報 7923 點。,[]
0,20130329_2355,《股市》13:45台期指04 報7923.00點，漲80.00點或1.02%《股市》13:45台期指04 報7923.00點，漲80.00點或1.02%。免責聲明：本文所載資料僅供參考，並不構成投資建議，鉅亨網對該資料或使用該資料所導致的結果概不承擔任何責任。該資訊若與事實不符，應以商品原交易所之公佈為主。,"[['45臺', '期指', '報7923.00點04'], ['45臺', '期指', '報7923.00點04'], ['導致結果', '承擔', '任何責任']]"
0,20130329_2356,台灣加權指數29日收盤上漲51.73點或0.66% 報7918.61點台北股市今(29)日收盤上漲 51.73 點或 0.66%，報 7918.61  點，成交金額 569.42 億元。,[]
0,20130329_2357,兩岸三地500指數最新報價 12:15精實新聞 2013-03-29  記者 新聞編譯 報導,[]
0,20130329_2358,宏達電臉書手機將現身？最新邀請函標題暗藏玄機精實新聞 2013-03-29 記者 賴宏昌 報導跟上一次的「Come and see what we`re building」謎語比起來，臉書(Facebook Inc.)這次下的邀請函標題「來看我們在Android上的新家(Come See Our New Home on Android)」更像是傳聞已久的宏達電(2498)操刀臉書智慧型手機。cnet.com 28日報導，臉書邀請媒體在美西時間下週四(4月4日)上午10點整參加在加州Menlo Park所舉辦的Android相關產品發表會。techcrunch.com 28日報導，訊息人士透露，臉書屆時將發表一款與宏達電合作的Android智慧型手機。這款產品特色在於首頁將內鍵臉書打造的應用程式。臉書執行長札克柏格(Mark Zuckerberg)去年7月曾公開否認公司將自行製造手機。彭博社去年7月25日引述知情人士談話報導，臉書正與宏達電攜手打造自有品牌智慧型手機，預計最快將在2013年年中問世。AllThingsD網站2011年11月報導，臉書在經過評估後決定與宏達電合作開發代號「Buffy」的智慧型手機。報導指出，Buffy預計將在12-18個月後問世，採用改良版Android作業系統，支援HTML5。宏達電曾在2011年推出配備專屬臉書按鍵的智慧型手機「Salsa」、「ChaCha」(見附圖)。臉書28日下跌1.95%，收25.58美元；本月下跌6.13%、為連續第2個月收低；今年第1季收低3.91%。＊編者按：本文僅供參考之用，並不構成要約、招攬或邀請、誘使、任何不論種類或形式之申述或訂立任何建議及推薦，讀者務請運用個人獨立思考能力，自行作出投資決定，如因相關建議招致損失，概與《精實財經媒體》、編者及作者無涉。,"[[' 2013-03-29記者賴宏昌報導', '比', '「Come and see what we`re building謎語'], ['訊息人士', '透露', '臉發表智慧型手機'], ['臉', '發表', '智慧型手機'], ['這款產品特色', '在於', '應用程式'], ['公司', '製造', '手機'], ['彭博社', '引述', '知情人士談話'], ['臉書', '打造', '智慧型手機'], ['臉書', '決定', '合作'], ['報導', '指出', 'Buffy預計問世'], ['宏達電', '推出', '智慧型手機Salsa見附圖'], ['宏達電推出智慧型手機Salsa見附圖', '配備', '臉書'], ['智慧型手機Salsa', '見', '附圖'], ['臉書', '下跌', '1.95%']]"
0,20130329_2359,搭上汽車電子高熱度敬鵬大漲 健鼎也能分一杯羹在鴻海()計畫切入汽車電子系統龐大的產業鏈同時，汽車板廠敬鵬()今獲大量買盤推升股價到36.95元的波段新高價，而就國內PCB廠切入汽車板市場而言，除了敬鵬之外，包括健鼎科技()等，也將是在汽車電子熱的受惠者。敬鵬在去年對於汽車板的出貨金額達114億元的營收，占全年營收比重並高達66%，較2011年的59%占比大大提高，並確定躍居台商PCB廠最大汽車板廠；而敬鵬主管也表示，2013年敬鵬對於汽車板占營收的比重也將維持在60%以上。敬鵬去年財報稅後盈餘15.51億元，每股稅後盈餘達3.9元，董事會決議將配發2.2元現金股息。而健鼎科技董事長王景春也透露出健鼎科技在汽車板的市場已獲明確的進展，在此一情況下，在電子業龍頭鴻海登高一呼大舉切入汽車電子系統產業，也使健鼎將成為受惠者。去年汽車板占健鼎科技的營收比重約在10%，在汽車廠陸續認證完成之後，預計未來還有大幅成長的空間。,"[['健鼎', '分', '一杯羹'], ['計劃', '切入', '產業鏈'], ['買盤', '推', '買盤'], ['出貨金額', '達', '114億元營收'], ['敬鵬主管', '表示', '敬鵬維持'], ['敬鵬', '維持在', '60%以上'], ['董事會決議', '配', '現金股息'], ['健鼎科技董事長王景春', '透露', '獲明確進展'], ['出', '健鼎', '科技'], ['營收比重', '在', '10%']]"
0,20130329_2360,《股市》13:00台期指04 報7922.00點，漲79.00點或1.01%《股市》13:00台期指04 報7922.00點，漲79.00點或1.01%。免責聲明：本文所載資料僅供參考，並不構成投資建議，鉅亨網對該資料或使用該資料所導致的結果概不承擔任何責任。該資訊若與事實不符，應以商品原交易所之公佈為主。,"[['00臺', '期指', '7922.00點'], ['00臺', '期指', '7922.00點'], ['導致結果', '承擔', '任何責任']]"
0,20130329_2361,《股市》13:00台股店頭 報114.22點，漲0.60點或0.53%《股市》13:00台股店頭 報114.22點，漲0.60點或0.53%。免責聲明：本文所載資料僅供參考，並不構成投資建議，鉅亨網對該資料或使用該資料所導致的結果概不承擔任何責任。該資訊若與事實不符，應以商品原交易所之公佈為主。,"[['00臺股店頭', '報', '114.22點'], ['導致結果', '承擔', '任何責任']]"
0,20130329_2362,《股市》12:59台股加權 報7930.57點，漲63.69點或0.81%《股市》12:59台股加權 報7930.57點，漲63.69點或0.81%。免責聲明：本文所載資料僅供參考，並不構成投資建議，鉅亨網對該資料或使用該資料所導致的結果概不承擔任何責任。該資訊若與事實不符，應以商品原交易所之公佈為主。,"[['導致結果', '承擔', '任何責任']]"
0,20130329_2363,佳總4月接單能見度佳 今以14.05元創波段新高上櫃PCB廠佳總()去年財報出爐，稅後盈餘1.49億元，每股稅後盈餘達0.96元，同時，目前在LED TV背光散熱鋁基板訂單穩定成長，而LED照明用途市場也出現熱度升溫之際，今天股價以14.05跳空高盤開出並創波段新高價，成交量並已擴大到3600張以上。而就佳總目前的接單狀況分析，第1季因春節因素造成營收下滑，獲利將明顯較去年第4季的稅後盈餘9253萬元衰退，但第1季獲利將超越2011年上半年的獲利總和的1679萬元；而進入第2季，其4月訂單能見度高。佳總近年主力主攻LED散熱鋁基板，目前有台灣桃園60萬呎及廣東江門廠20萬呎產能生產線；佳總董事長曾繼立指出，佳總在兩岸的生產線的稼勳目前都在快速提升之中，為協助佳總廣東江門廠去除生除生產瓶頸，佳總並決議對江門廠增資300萬美元購置設備，設備也正陸續進駐之中，將有助於江門廠的營運效能提升。依市場調研機構的報告顯示，LED背光模組在2013年TV的市場滲透率將大幅提升並且突破90%；對於產品對於鋁散熱板的需求也將因此進一步攀升；而在LED照明市場也因產品價格的下滑，市場加速去化。而佳總在2月1日正式簽約以7000萬元的好價格出售其在桃園興邦路的閒置廠房及土地，此一交易預計在上半年完全入帳，也有勝於挹注2013年上半年的獲利。目前佳總在台灣的生產集中1廠及3廠而有集中管理的效益，而隔著馬路的2廠則已閒置3年，佳總並簽約出售2廠的土地及廠房資產，這筆閒置資產土地面積約328坪，並設有4層的廠房，並與買方簽約以7000萬元的價格出售土地及廠房。,"[['用途市場', '出現', '熱度升溫際'], ['接單狀況', '分析', '第1季獲利超越獲利總和1679萬元'], ['春節因素', '造成', '下滑'], ['第1季獲利', '超越', '獲利總和1679萬元'], ['佳總', '主攻', 'LED散熱鋁基板'], ['董事長佳總', '指出', '在'], ['佳總', '決議', '增資購置設備'], ['一交易', '預計', '入帳'], ['佳總', '有', '管理效益']]"
0,20130329_2364,明輝環球買島遭詐騙！先行提列6700多萬損失新加坡海事工程服務商明輝環球()驚傳遭詐騙！旗下子公司PTBH購買印尼峇淡島30公頃土地使用權遭到詐欺，目前公司已向新加坡和印尼峇淡島有關當局報案，並提列新幣280萬元(約合6700多萬元)的足額評價損失。明輝表示，董事會對子公司PTBH購買印尼峇淡島30公頃土地使用權進行調查，調查結果顯示，董事會直接從峇淡島有關當局收到書面確認，明確指出土地已經配售給他人方，而且有關當局從未收到明輝子公司PTBH購買上述土地使用權的申請資料。顯示該筆土地交易的某些有關文件資料係出自偽造，由於有足夠的理由證明公司遭受詐欺，因此董事會已向新加坡和印尼峇淡島有關當局報案。明輝強調，董事會已於今年3月2日公告中確認，截至去年底2012第4季的財務報表已預先為該筆交易提列總計新幣280萬元的足額評價損失。,"[['30公頃土地使用權', '遭到', '詐欺'], ['明輝', '表示', '董事會進行調查'], ['董事會', '進行', '調查'], ['調查結果', '顯示', '董事會收到書面確認'], ['董事會', '收到', '書面確認'], ['出土地', '配售給', '他人方'], ['有關當局', '收到', '申請資料'], ['PTBH', '購買', '土地使用權'], ['文件資料系', '出自', '僞造'], ['公司', '遭受', '詐欺'], ['明輝', '強調', '董事會確認財務報表提列足額評價損失'], ['董事會', '確認', '財務報表提列足額評價損失'], ['財務報表', '提列', '足額評價損失']]"
0,20130329_2365,MPO訂單回籠，上詮3、4月營收陸續回溫精實新聞 2013-03-29 記者 陳祈儒 報導光纖元件廠上詮（3363）今年2月營收僅5千餘萬元，主要是大陸上海廠農曆過年後勞動力不足，不過在3月份員工編制滿員後，再加上海外的MPO高密度跳線訂單已確定回籠，預計3月份營收先回到8千萬元以上，而4月份營收可望再走揚。上詮表示，今年電信光纖標案的進度稍慢了一些，目前仍在驗規格階段，而海外的MPO光纖跳線訂單將開始發酵，可配合AOC（主動式光纖纜線）一起應用在Data Center數據中心建置案，是高速且大量資料傳輸的光纖產品。另外，上詮已公布2012年財報，全年合併營收14.98億元、年增16%，合併毛利率22.45%與前年相當；營益率9%，較前年約增加1.7個百分點。上詮去年稅前淨利1.48億元、年增15%，惟稅率升高，稅後純益1.14億元、年增1.5%，稅後EPS 1.95元。上詮2012年第四季單季合併營收3.21億元、季減23.7%。單季合併毛利率24.79%，單季營益率10.67%，皆較前一季減少3個百分點。該季稅前淨利4205萬元、季減28%；單季稅後純益3052萬元，季減36%，單季稅後EPS 0.52元。,"[['訂單', '確定', '回籠'], ['營收', '回到', '8千萬元以上'], ['上詮', '表示', '慢'], ['MPO光纖跳線訂單', '開始', '發酵'], ['上詮', '公佈', '2012年財報'], ['年', '增', '16%'], ['年', '增', '1.5%'], ['季', '減', '36%']]"
0,20130329_2366,HTC One「超難拆」內部零件規格、供應商大公開！被外媒形容是「最美 Android 智慧手機」的宏達電（2498）旗艦新機 One，卻遭電子產品拆解專家 iFixit 下手，卸除美麗外殼，一探內部供應零件的秘密。iFixit 揭露這段拆解全紀錄，首先，面對這台「一體成型」鋁合金外殼的手機，專家先將螢幕透過強力吸盤取下，然後再取下主機板，專家指拆解過程困難，幾乎無法在不破壞機身的情況下進行拆解，因此也被 iFixit 評為拆解維修最不易的手機（滿分十分，10 代表最容易拆解，1 代表最難，One 拿下後者這個分數），但往好處想就是一體成型機身堅固耐用。One 超難拆背後，也代表零件若故障就很難維修替換。iFixit 最末評語第二點就指電池置於主機板下方，拆解人員費盡一番功夫才能將緊緊連接於主機板的電池取下來。第三點，導電銅箔膠帶覆蓋在許多零件上，讓更換動作變困難。：2GB RAM 來自爾必達；處理器來自高通 Snapdragon 600 1.7GHz 四核心處理器；32GB 快閃記憶體來自三星；電源管理 IC 與 4G 通訊晶片來自高通；觸控面板控制 IC 來自 Synaptics 等等。再來看到外界最關心，也就是採用「超畫素」（Ultrapixel）感光元件的相機鏡頭，這也是傳言供應短缺拖累 One 出貨的主要原因。拆解報告顯示後置相機鏡頭規格讚，擁有 f/2.0 大光圈、28mm 廣角鏡頭、配置宏達電自家的 ImageChip™ 2 影像處理晶片。至於後置相機 400 萬畫素鏡頭的 Ultrapixel 感光元件，則是由意法半導體（ST Microelectronics）生產。另外，前置相機 210 萬畫素鏡頭上頭則是印有「OmniVision」（豪威科技公司）的標誌。更多 iFixit 拆解 HTC One 詳細報導。,"[['內部', '供應', '零件'], ['內部', '供應', '零件'], ['iFixit', '揭露', '全紀錄'], ['專家', '透過', '強力吸盤'], ['專家', '指', '困難'], ['在', '不破壞', '機身'], ['One', '拿下', '這個分數'], ['最末評語第二點', '指', '電池置於主機板下方'], ['電池', '置於', '主機板下方'], ['拆解人員', '費盡', '一番功夫'], ['才能', '連接於', '主機板電池'], ['導電銅箔膠帶', '覆蓋在', '許多零件上'], ['2GBRAM', '來自', '爾必達'], ['處理器', '來自', '6001.7GHz四核心處理器'], ['閃記憶體', '來自', '三星'], ['通訊晶片', '來自', '高通'], ['觸控面板控制IC', '來自', '等等Synaptics'], ['這', '也是', '主要原因'], ['拆解報告', '顯示', '鏡頭規格贊'], ['、', '配置', '宏達電自家'], ['感光元件', '是', '生產法半導體ST Microelectronics'], ['萬畫素鏡頭上頭', '是', '印有OmniVision標誌']]"
0,20130329_2367,兩岸三地500指數最新報價 11:15精實新聞 2013-03-29 記者 新聞編譯 報導,[]
0,20130329_2368,2月製造業景氣燈號「綠轉藍」產業別藍燈比重高達7成台灣經濟研究院今(29)日公布2月製造業景氣由上月的綠燈轉為代表衰退的「藍燈」，台經院解釋，受春節長假因素影響，國內製造業生產指數在工作天數減少的情況下，月減19.96%、年減12.1%，也使製造業景氣信號分數估計值較1月修正後的14.16分下滑4.8分至9.36分。就各主要組成項目觀察，僅1個項目分數增加、3項下降以及1項持平，其中以原物料投入面減少2.73分最多，其次需求面減少2.22分、經營環境面減少1.0分，僅售價面上升1.15分，燈號分數再度回落至藍燈區間。從不同產業燈號消長來看，藍燈比重由3.21個百分點大幅上升至71.5個百分點，黃藍燈由35.48個百分點下降至23.48個百分點，綠燈由33.42個百分點下降至5.02個百分點，且無代表揚升的黃紅燈及繁榮的紅燈。台經院也指出，在春節工作天數減少的衝擊下，多數產業因需求及原物料投入減少，燈號轉為黃藍燈和藍燈，僅「成衣及服飾品」及「汽車及其零件」業因售價上升，抵消部分因需求及原物料投入減少的不利因素。,"[['高達7成臺灣經濟研究院公佈製造業景氣', '轉爲', '藍燈'], ['高達7成臺灣經濟研究院公佈製造業景氣轉爲藍燈', '代表', '衰退'], ['月', '減', '19.96%'], ['製造業景氣信號分數估計值', '下滑至', '9.36分'], ['經營環境面', '減少', '1.0分'], ['藍燈比重', '由', '大幅百分點'], ['由', '上升至', '71.5個百分點'], ['臺經院', '指出', '減少'], ['燈號', '轉爲', '黃藍燈']]"
0,20130329_2369,兩岸旅行業聯誼會發表自律公約 抵制低價競爭第16屆海峽兩岸旅行業聯誼會今(29)日於苗栗西湖渡假村舉行，會中發表「海峽兩岸雙向旅遊品質提升自律公約」，與會業者一致同意促進旅遊品質，抵制低價競爭行為、提升處理旅遊糾紛與事故的機制水準，並期擴大觀光市場規模和總量。此次兩岸旅行業聯誼會共吸引業界近600人參加，其中來自大陸觀光產業界代表約有300人，除延續去(2012)年海南宣言「品質旅遊，合作發展」的主題，會中也發表「海峽兩岸雙向旅遊品質提升自律公約」。據統計，去年大陸來台旅客共258萬6428人次，年增率達44.96%，其中團體旅客突破200萬人次達201萬9757人次，自由行旅客也達19萬1148人次，而台灣赴大陸旅客534萬人次，同樣持續成長。台旅會與海旅會(小兩會)已磋商達成共識，於4月1日起調整大陸旅客來台團體旅遊配額從平均每日4000人調高至5000人，自由行旅遊配額從平均每日1000人調高至2000人，並將建立「海峽兩岸旅遊安全突發事件合作處理共識」，強化小兩會的通報、協調與聯繫。觀光局也指出，台灣自4月1日起將試辦優質行程審查制度，針對大陸觀光團膳食、住宿、交通、購物點及行程安排等設定優質標準，凡達標準團體可優先核發入台證，期更有效獎勵旅行業者提升產品品質。,"[['兩岸旅行業聯誼會', '發表', '西湖渡假村舉行'], ['與會業者', '同意', '促進旅遊品質'], ['提升機制水準', '處理', '旅遊糾紛'], ['兩岸旅行業聯誼會', '吸引', '業界'], ['其中', '來自', '觀光產業界'], ['來自觀光產業界代表', '有', '300人'], ['大陸', '來', '臺'], ['年增率', '達', '201萬9757人次'], ['自由行旅客', '達', '19萬1148人次'], ['磋商', '達成', '共識'], ['旅遊配額', '高至', '2000人'], ['觀光局', '指出', '臺灣試辦優質行程審查制度'], ['臺灣', '試辦', '優質行程審查制度'], ['達標準團體', '核發', '臺證']]"
0,20130329_2370,傳致伸元月每股賺0.5元？漲幅逾3% 股價衝今年新高致伸()積極採取分散客戶策略，在照相鏡頭模組以及無線充電領域，都大有斬獲，已接獲亞馬遜平板電腦照相鏡頭模組訂單，法人推估接單金額上看1億美元，而無線充電部分，更是在台廠供應鏈中，首家正式量產交貨，已供貨給Nokia，今年還有機會再添2家客戶。法人圈也盛傳致伸元月獲利可達0.5元，致伸早盤股價曾衝上27.3元，漲幅逾3%，創今年新高。致伸今年首季接單即淡季不淡，元月合併營收衝上43.41億元，創下近14個月來新高，法人圈也盛傳致伸單月每股盈餘可達0.5元水準。致伸2月雖因工作天數減少，營收滑落至27.61億元，但法人預估3月業績，將有機會回升至與元月相近水準，首季合併營收將可衝上百億元，首季獲利表現看俏！致伸不僅是蘋果iPhone、iPad mini供應鏈，在家庭劇院部分，也打進三星供應鏈，為了避免客戶過於集中，致伸採取客戶、產品多角化策略，在照相鏡頭、無線充電領域，接單都有斬獲。致伸對於今年全年的業績成長，評估為「上半年淡季不淡」，「下半年成長動能較顯著」，由於致伸在行動裝置方面，搶下的無線充電、亞馬遜平板鏡頭模組，都是目前當紅產品與題材，且新產品也有助於拉高整體毛利表現。致伸去年10月以23元掛牌上市，今年以來股價多在25元到26.5元間盤整，去年每股稅後盈餘3.07元，董事會也通過擬配發1.5元現金股息，加上今年成長動能無虞，外資買盤昨日已見回補，買超達500多張。,"[['每股', '賺', '0.5元'], ['漲幅', '逾', '採取大有斬獲'], [' 股價', '衝', '今年新高致伸'], ['採取大有斬獲', '分散', '客戶'], ['盛傳致伸元月獲利', '可達', '0.5元'], ['，', '致伸', '早盤'], ['致伸早盤股價', '上', '27.3元'], ['漲幅', '逾', '3%'], ['法人圈', '盛傳', '致伸單月'], ['每股盈餘', '可達', '0.5元水準'], ['營收', '滑落至', '27.61億元'], ['法人', '預估', '回'], ['有機會', '回升至', '相近水準'], ['營收', '衝', '上百億元'], ['致伸', '是', '蘋果iPhone'], ['接單', '有', '斬獲'], ['對於評估', '爲', '淡'], ['無線充電', '都是', '當紅產品'], ['新產品', '有助於', '拉高毛利表現'], ['股價', '在', '盤整']]"
