,News,All,SVO
0,20130902_1514,台灣主要報紙頭條要聞台灣報紙今日頭版基隆連日豪雨，市區到處積水，山坡地地層滑動，巨石從天而降並砸毀車輛、民宅倒塌，行政院長江宜樺1日前往視察，對眼前景象以「驚悚」來形容。基隆市府破天荒宣布，為安全考量，籲請民眾先別到基隆觀光。行政院長江宜樺上周五（30日）拋出「不排除加稅治水」的說法後，財政部已著手研議加稅可行性。據指出，除擴大對不動產課徵奢侈稅、調降兩稅合一股利抵稅額外，提高營業稅率也是未來加稅的優先選項。水漫基隆 屏東走山雨勢趨緩 今起放晴第3輪躍榜首 重現妮來瘋4G競標明登場 熱門頻譜 標金估翻倍宏達電雙利空 今股價堪憂美攻敘急煞車 市場難回穩還1巨石在山上 驚恐八斗子牆崩地裂 彰化28透天厝撤離治水 中央不再全埋單台積固樁 祭出特別手段加稅治水 財部擬三招陸PMI強彈 經濟穩了一吐悶氣 光芒再起 雅妮LPGA奪冠有望民宅整排塌 裂縫「可吞童」菜價續飆 甜玉米貴2.6倍北濱驚魂 落石砸車 駕駛命危油電瓦斯都漲又淹水 網友諷「真幸福」交長︰50億改善南迴邊坡 挨轟緩不濟急陸打虎 查國資委主任王在希炮轟馬 推遲政治談判亞太50強企業 兩岸22家上榜,"[['行政院長江宜樺', '往', '視察'], ['行政院長江宜樺上週五30日', '拋出', '不排除加稅說法'], ['「', '不排除', '加稅'], ['除', '擴大', '對兩稅合一股利抵稅額'], ['提高營業稅率', '也是', '優先選項'], ['熱門頻譜標金', '估', '50億改善打虎宏達電雙利空'], ['巨石', '彰化', '28透天厝撤離治水'], ['28透天厝', '撤離', '治水'], ['財部', '擬', '陸PMI強彈'], ['裂縫', '吞', '童'], ['可', '吞', '童'], ['50億', '改善', '打虎']]"
0,20130901_1515,李長榮集團發百萬獎學金鼓勵創新 環保藝術船愛河下水李長榮集團今天頒發第4屆優秀學生獎學金。(鉅亨網記者尹慧中攝)李長榮集團(1704-TW)今(1)日在高雄市國際會議中心舉辦「科學教育與環保理念推廣活動」 暨傑出教授與優秀學生獎學金頒獎典禮，並發放總額達約百萬獎學金；今天獎學金頒獎典禮也舉辦綠色船隻愛河下水儀式，展現Eco+Prosperity與社會共榮的精神。基金會理事長暨李長榮集團董事長李謀偉表示，獎學金舉辦以來規模持續擴大，第一屆有1名優秀得主加入該公司團隊；且第2、3屆也各有3名獎學金得主加入該公司，該集團長期致力於發展綠色化學，視環境共榮為己任，在發展經濟的同時，運用科學創新，與環境、社會共存、共榮，永續發展並招募優秀人才。他說，該集團每年以不同創新主題舉辦獎學金徵選，此次Eco+Prosperity 正為此理念下了最好的註解，希望透過科學創意推廣活動，將這創新環保的概念進一步推廣至國家更年輕的一代，讓環保精神的種子在小朋友們的心裡萌芽成長，散播到台灣的每一個角落。今年度獎學金競賽總額發放逾百萬，台大、清華、成功、中興、中原大學等共有29位化學工程相關科系的優秀學生脫穎而出，獲基金會4萬至6萬元獎學金，以及基金會為優秀學生特別打造的腳踏車。而為鼓勵雖未能獲選卻自願南下協助科學推廣活動的熱心學生們，基金會亦頒發量身訂做的車牌獎狀，肯定同學們無私且熱誠的參與。此外，獎學金計畫針對國內35至45歲於化工領域具傑出研究成果的相關科系教授，設立「傑出教授獎」，本屆共有三位教授獲獎，獲得基金會15萬元獎金，分別為清華大學化學工程學系劉英麟教授、中興大學化學工程學系林慶炫教授以及成功大學化學工程學系吳季珍教授，肯定與感謝其卓越的研究成果，以及長期對產業的投入與貢獻。李長榮集團今天在高雄市國際會議中心舉辦「科學教育與環保理念推廣活動」 暨傑出教授與優秀學生獎學金頒獎典禮。高雄市經濟發展局曾文生局長、高雄市教育局王進焱副局長、屏東縣教育處龔麗貞督學等均蒞臨參觀指導。,"[['李長榮集團', '發', '李長榮集團頒發優秀學生獎學金'], ['百萬獎學金', '鼓勵', '創新'], ['百萬獎學金', '鼓勵', '創新'], ['李長榮集團', '頒發', '優秀學生獎學金'], ['TW1704集團', '舉辦', '傑出教授活動'], ['李長榮集團董事長李謀偉', '表示', '規模擴大'], ['第一屆', '有', '得主加入該公司團隊'], ['得主', '加入', '該公司團隊'], ['3名獎學金得主', '加入', '該公司'], ['該集團', '致力於', '發展綠色化學'], ['環境', '爲', '己任'], ['在', '發展', '經濟'], ['他', '說', '該集團舉辦獎學金徵選'], ['該集團', '舉辦', '獎學金徵選'], ['爲此理念', '下', '最好的註解'], ['等', '共有', '相關科系'], ['基金會', '頒發', '車牌獎狀'], ['化工領域', '具', '傑出研究成果'], ['獎學金計劃', '設立', '教授獎'], ['李長榮集團', '舉辦', '科學教育理念推廣活動'], ['等局長', '蒞臨', '參觀']]"
0,20130901_1516,李謀偉：頁岩氣已經非常成熟 長遠價格將趨低廉李長榮集團董事長李謀偉(右)今天出席活動並對市場提出看法。(鉅亨網記者尹慧中攝)李長榮集團總裁、榮化 (1704-TW) 董事長李謀偉今(1)日表示，就市場趨勢而言，頁岩氣技術的發展已經非常成熟，雖然會有一段價格轉變的不平衡，但長遠而言價格將趨於低廉。李謀偉是在出席高雄2013年李長榮集團主辦傑出教授暨優秀學生獎學金頒獎典禮作上述表示。他說，如果是3年前還有不確定性，但現在可以確定是頁岩氣已經非常成熟，主要是美國政策明顯轉變了，美國的頁岩氣早先原基於國家安全無法出口，但這半年來已批準了可出口的法規。他說，這類出口會越來越多，現在雖會有一段價格轉變的不平衡，但長遠而言價格將趨於平衡與低廉。他補充，就頁岩氣可使為每百萬英熱單位(BTU)降至3美元而言，相對當初中油與卡達敲定BTU是10美元的契約價格對照，已有具吸引力的價差；且據他了解，因為美國僅跟「盟友」分享，韓國跟日本的公司都非常積極在這一塊布局，台灣也應有參與購買談判的機會。,"[['長遠價格', '出席', '活動'], ['李長榮集團總裁', '表示', '成熟'], ['價格', '趨於', '低廉'], ['李謀偉', '是', '上述表示'], ['他', '說', '批准出口法規'], ['美國頁岩氣', '原基於', '國家安全'], ['他', '說', '越來越多'], ['價格', '趨於', '平衡'], ['他', '補充', '爲'], ['BTU', '是', '契約價格對照'], ['已有', '具', '吸引力'], ['韓國公司', '積極在', '一塊佈局'], ['臺灣', '應有', '參與購買談判機會']]"
0,20130901_1517,李長榮集團今年太陽能發電估30MW 養水種電總量超預期李長榮集團董事長李偉謀今天提及該集團太陽光電布局進度。(鉅亨網記者尹慧中攝)李長榮集團總裁、榮化 (1704-TW) 董事長李謀偉今(1)日表示，養水種電20MW已達成並超前原先進度，就集團而言，今年集團太陽能發電估將是接近30MW，且妥善率方面可以說是業界最好。李謀偉是在出席高雄2013年財團法人李謀偉福聚教育基金會主辦傑出教授暨優秀學生獎學金頒獎典禮會後接受媒體訪問作上述表示。他回應提問說，養水種電20MW已達成並超前原先進度，去年底發電量已達18-20MW，今年集團太陽能發電接近30MW，且妥善率方面可以說是業界最好。他也指出，台灣政府很怕某大企業成為大的太陽能發電而成為小規模標案，反而使得妥善率非常低，不利綠色能源發展，但隨著經濟規模的效益明顯這個現象開始改變，政府也應公開妥善率資訊做為標案標準。李長榮集團早先已與中國大陸中材天華國際簽署「建置太陽能電廠合作意向書」，集團並在2012年5月已正式宣布其建置於屏東林邊鄉及佳冬鄉等地的「養水種電」計畫，「養水種電」太陽能電廠於去年11月通電而後總發電量穩定增6-10MW，去年底約達20MW，此後預定並以一年7MW的步調增加並著眼於南臺灣布局。,"[['李長榮集團董事長李偉謀', '提及', '光電佈局進度'], ['李長榮集團總裁', '表示', '養水種電20MW達成原先進度'], ['養水', '種', '電'], ['養水種電20MW', '達成', '原先進度'], ['妥善率方面', '是', '最好'], ['李謀偉', '作', '上述表示'], ['電20MW', '達成', '原先進度'], ['發電量', '達', '18-20MW'], ['集團太陽能發電', '接近', '30MW'], ['臺灣政府', '很怕', '大企業成爲太陽能發電'], ['大企業', '成爲', '太陽能發電'], ['這個現象', '開始', '改變'], ['李長榮集團', '簽署', '合作意向書'], ['集團', '宣佈', '其建置'], ['其', '建置於', '種電計劃'], ['總髮電量', '增', '-10MW']]"
0,20130901_1518,李謀偉：10月電價上漲變相加稅500億元 不該以台電角度思考榮化董事長李謀偉今天對電價政策提出建言。(鉅亨網記者尹慧中攝)榮化(1704-TW)董事長李謀偉今(1)日出席活動接受媒體訪問簡短表示，馬總統不該以「當台電董事長」的角度思考，今年電價上漲等同是變相加稅500億元。他反問，這個時機「加稅」合宜嗎？李謀偉是在出席高雄2013年李長榮集團主辦傑出教授暨優秀學生獎學金頒獎典禮作上述表示。經濟部數據顯示，台電今年10月電漲不漲，預計今年全年虧損500億元。對於此數據，李謀偉今天提出不同看法。他說，政府計算台電帳務方式有問題，台電非私部門，除非它民營，但目前仍屬公部門，因此公部門宣布調漲價格，從私部門拿錢就是變相加稅，這等同就是加稅500億元，對台灣企業負擔無疑非常沉重。而在國內外經濟復甦仍緩慢與敘利亞引動中東戰雲密布，他反問，這個時機，「加稅」合宜嗎？他補充，觀察台灣鄰近競爭對手韓國，近年工業用電價格也未有大幅上漲，且工業用電是是高壓輸送，因此工業用電是民間6成在國際之間本是趨勢，但台灣近年工業用電漲幅已是韓國5成以上。他呼籲，工業用電彈性本低於民間用電，企業本就持續加強節能，但馬總統不該以「當台電董事長」的角度思考，而是國家總體財務健全與債務結構思考！,"[['榮化董事長李謀偉', '提出', '建言'], ['日出席活動', '接受', '媒體訪問'], ['日出席活動', '接受', '媒體訪問'], ['日出席活動接受媒體訪問簡短', '表示', '馬總統思考'], ['等同', '是', '變相500億元加稅'], ['他', '反問', '這個時機加稅合宜'], ['李謀偉', '是', '上述表示'], ['經濟部數據', '顯示', '電漲漲'], ['李謀偉', '提出', '不同看法'], ['他', '說', '就是變相加稅'], ['公部門', '宣佈', '調漲價格'], ['這等同', '加稅', '500億元'], ['他', '反問', '加稅合宜'], ['他', '補充', '觀察鄰近競爭對手韓國'], ['工業用電', '是', '輸送'], ['工業用電', '是', '民間6成是趨勢'], ['民間6成', '是', '趨勢'], ['工業用電漲幅', '是', '韓國5成以上'], ['他', '呼籲', '馬總統思考'], ['工業用電彈性本', '低於', '民間用電'], ['本', '加強', '節能']]"
0,20130901_1519,"自由經濟示範區招商！管中閔9月初率團赴日與日企交流為吸引外國企業投資自由經濟示範區，經建會主委管中閔將於9月1日率團赴日本東京、大阪等地進行宣導及招商說明，同時，交通部、衛生福利部、行政院全球招商中心均派員參與。經建會表示，除將於兩地各辦理一場大規模的招商說明會外，也將與當地有意來台灣投資的大型企業進行交流，可望加速日商對台投資。為強化國際大型企業投資，經建會首站鎖定與我國交流密切的日本企業，將拜訪7家具投資潛力的日商，包括日本最大的物流業者日本通運(Nippon Express)、日本最大電子購物商城樂天株式會社、協助日本醫療服務與醫材設備輸出的社團法人Medical Excellence Japan(MEJ)，以及日立(Hitachi)、Tokyo Electron等重要廠商。經建會指出，9月3日在東京經團連會館辦理「台灣自由經濟示範區招商說明會」已吸引近80家日本中大型企業報名，人數逾百人，參與情形相當熱烈。經建會除了將向日商企業說明投資台灣的利基和優勢外，也將針對自由經濟示範區的規劃進行詳細的說明，並提出日本企業如何靈活運用示範區的策略建議，希望能開創更多台日合作的可能機會；9月5日將在大阪舉行另一場招商說明會。另一方面，管中閔將參訪AHQ特區(Tokyo""s Special Zone for Asian Headquarters)，此一特區很可能成為日本首相安倍晉三第3支箭「國家戰略特區」中的一部分。據了解，日本國家戰略特區的規劃與自由經濟示範區有許多相同點，例如兩者都是由國家主導、都希望能夠刺激民間的投資、不限於特定的區域、可依不同產業規劃虛擬的特區、都設有單一服務窗口、都訂有放寬投資限制、租稅優惠等，也將做為未來我國示範區發展的重要參考。經建會強調，日本不但是台灣第2大貿易夥伴，也是外資和技術的主要來源，雙方合作具有很高的產業互補性，製造及服務都將是推動合作的重點。除了日本外，經建會也規畫未來將陸續赴新加坡等亞鄰國家和歐美等地，進行自由經濟示範區的宣導招商活動。","[['管中閔率團', '赴', '日'], ['經建會', '表示', '進行交流'], ['各', '辦理', '招商說明會'], ['建會首站', '鎖定', '交流'], ['物流業者', '日本通運', 'Nippon Express'], ['、', '協助', '醫療服務'], ['經建會', '指出', '辦理招商說明會吸引'], ['人數', '逾', '百人'], ['日商企業', '說明', '投資臺灣利基'], ['經建會', '進行', '詳細說明'], ['日本企業', '運用', '策略建議'], ['管中閔', '參訪', 's Special Zone for Asian Headquarters'], ['一特區', '成爲', '戰略特區中一部分'], ['兩者', '都是', '有許多相同點'], ['經建會', '強調', '也是主要來源'], ['日本', '但是', '貿易伙伴'], ['雙方合作', '具有', '產業互補性'], ['製造', '是', '推動重點'], ['會', '規畫', '赴亞鄰國家']]"
0,20130901_1520,安國拓新領域商機 行車紀錄器晶片佈局中階市場 已小量出貨FLASH控制IC安國()第 3 季營運走勢趨穩，隨著FLASH缺貨問題舒緩，相關IC出貨力道也回升，不過與PC相關之晶片(讀卡機、PC CAM晶片)需求仍偏弱，法人估營收約與第 2 季持平或向下滑落，不過安國持續開拓新產品商機，將PC CAM產品線往外延伸至行車紀錄器的攝影機控制晶片，瞄準中階市場，營運長蔡玲君表示，8 月已開始小量出貨，明年出貨動可望緩步升溫。安國指出，行車紀錄器是從既有的PC CAM產品線延伸出來，自去年下半年開始布局與推廣，主打中階市場，8 月已小量出貨，目前以中國大陸市場為主。蔡玲君指出，今年FLASH市況雜音多，有些廠商也退出經營，正好給安國一個營運檢討的機會，今年正逐步調整，也針對新產品陸續布局，期望明年營運能轉佳。安國近年也持續招募人員，蔡玲君表示，近年安國每年皆以增加10%相關研發人員的方式拓展人力，搶攻新市場商機；根據安國財報顯示，2011年安國員工約370人，2012年底約419人，今年人數持續增加。就近期營運而言，蔡玲君指出，由於今年FLASH市況雜音多，導致前 7 月營收仍較去年下滑，也使得今年產業營運挑戰增加， 8 月的表現可望回到去年同期水準，較 7 月明顯回溫，而 9 月能見度則仍相對有限，不過會努力維持在 2 億元以上，法人則預期，由於PC相關需求力道仍弱勢，因此預期安國第 3 季營收約與第 2 季持平或微幅下滑。除行車紀錄器外，安國指出，EMMC與USB 3.0皆有新產品持續開發當中；其中EMMC進度較為緩慢，但USB 3.0晶片已轉用旗下子公司安格科技開發之實體層(PHY)，產品成本結構將會更為有利。,"[['階市場', '小量', '出貨'], ['已', '小量', '出貨'], ['安國', '開拓', '新產品商機'], ['伸攝影機', '控制', '晶片'], ['營運長蔡玲君', '表示', '開始出貨'], ['安國', '指出', '行車紀錄器延伸'], ['蔡玲君', '指出', '多'], ['有些廠商', '退出', '經營'], ['營運', '轉', '佳'], ['安國', '招募', '人員'], ['蔡玲君', '表示', '安國拓展人力'], ['安國', '拓展', '人力'], ['蔡玲君', '指出', '使得'], ['8月表現', '回到', '同期水準'], ['法人', '預期', '預期安國第 3季營收約持平'], ['安國', '指出', 'EMMC有新產品開發當中'], ['EMMC', '有', '新產品開發當中'], ['3.0晶片', '轉用', '實體層PHY']]"
0,20130901_1521,台灣主要報紙頭條要聞暴雨狂灌全台，台鐵南迴線發生23年來最嚴重的火車撞上土石流出軌意外，搭載250名乘客從台東前往高雄的自強號列車，在屏東枋山二號隧道口撞上土石流出軌，造成17名乘客受傷。基隆市也發生土石流硬生生沖倒民宅，還有5噸巨石從天而降，險些砸爛路過汽車的驚悚場面。宏達電創新設計團隊高層出現內鬼洩密，涉案者若將此洩漏出去，不排除設計得整套砍掉重來，是否對宏達電明年上半年新品與上市時程造成影響，仍有待觀察。自強號撞土石流 南迴斷鋒面強碰康芮 暴雨落未停 15檔逆勢量增股 長紅宏達電 明年新品恐砍掉重練暴雨轟基隆 巨石砸路、鐵公路泡水鋒面和西南風較勁 豪雨轟炸南北15檔「軋空手」 外資、公股雙挺四大節慶帶旺 13檔消費概念股樂到明年暴雨泥流襲全台 自強號出軌 巨石崩落砸車 17傷首席設計師收押 竊密「恐害hTC倒閉」,"[['主要報紙頭條', '聞', '暴雨'], ['臺鐵南', '回', '發生'], ['嚴重火車', '撞上', '土石流出軌'], ['基隆市', '發生', '土石流硬生生衝民宅'], ['土石流硬生生', '衝', '民宅'], ['砸爛', '路過', '驚悚場面'], ['設計團隊高層', '出現', '內鬼泄密'], ['新品恐', '砍掉', '巨石砸路基隆'], ['首席設計師巨石砸車收押', '流襲', '全臺']]"
0,20130901_1522,證交所、櫃買衝業績！9月啟動IPO掛牌熱潮證交所及櫃買中心衝IPO業績！證交所董事會27日一口氣通過9家上市案，櫃買董事會同樣通過4家，包含之前以拿到核備函的公司，上市12家，上櫃7家，合計19家，9月開始將陸續啟動上市櫃熱潮。目前雄獅旅遊()敲定9月24日掛牌上市外，其他如科妍()、拓凱()、清惠()、大量科技()、凱撒衛浴()、劍麟()、群光電能()、F-乙盛()、F-眾達()、F-敦泰(5280-TW)等，都會在第四季掛牌上市交易。至於上櫃公司，大江生醫()9月12日及世德工業()9月24日陸續上櫃外，另外F-立凱()、長園科()、創傑(5261-TW)、久裕()及商之器()也都取得櫃買中心上櫃核准函，也都會在第4季掛牌交易。在證交所及櫃買中心衝刺業績下，第四季將引爆IPO掛牌熱潮，其中今年新上市本國公司家數可望達20家以上，加上已送件的公司，不排除有機會挑戰25家。,"[['證交所董事會', '通過', '9家上市案'], ['櫃買董事', '通過', '4家'], ['以', '拿到', '核備函'], ['雄獅旅遊', '敲定', '外'], ['第四季', '引爆', 'IPO掛牌熱潮'], ['本國公司家數', '達', '20家以上']]"
0,20131001_1523,美政府關門 投資人心驚驚 協商僵局最好速決面臨美國因兩黨因財政協商在大限之前未獲解決，決定於今(1)日台北時間中午12點執行17年來未見的關閉動作，消息傳出後，亞股仍照上午的反彈格局持續小幅上揚，美國期貨也呈小漲，與金融市場彷彿各走各的路，究竟是利空鈍化？還是這起政治事件本來與金融市場分道揚鑣？投資人又該如何因應？法國巴黎投資高收益債券團隊首席分析師暨經理人Jim Kourkoulakos認為，這是兩造的協商過程不會拖太久，如果有立即性的市場利空，反而是進場時機。大多會反映在股市，債市方面波動較小，投資人可以不用過度擔心。惠理康和投資長唐雲益認為，美國政府停擺，最直接受衝擊的是美國國內的產業，因為部分公營旅遊景點也跟著關門，像是國家博物館、動物園等，因此旅遊相關產業包括航空業、觀光景點首當其衝；再者就是房地產，因為公部門的作業流程停滯，和政府申請貸款的速度也跟著變慢；至於金融業則因為對此協商僵局早在預期中，因此影響不大。由於航空業受衝擊，連帶台灣與美國航線也可能被波及，受到些微影響。德盛安聯投信產品首席陳柏基指出，就歷史經驗來看，協商破局或美國政府關門都已不是第一次，這次很可能是2011年舉債上限談判破裂的翻版，但預期對金融市場的衝擊不至於像上次嚴重，畢竟市場已有過經驗，且2011年市場還有歐債危機干擾，目前全球經濟持續復甦，估計雖有變數但衝擊不至於太高。唐雲益表示，除非美國財政協商紛爭必須在一個月內解決，如果不超過一個月，都算是新聞事件，不會影響太大，但如果超過一個月，就會衍伸許多政府支出相關問題和民生問題，像是聯邦政府預算、報關稅、甚至連倒垃圾都成了難以處理問題。他強調對於台股操作，會以8300點作為壓力，近期將保守操作。陳柏基建議在市場不確定變數下帶來的波動可適度尋找具成長利基的產業、區域逢低布局。陳柏基認為，從技術面來看，美股之前有過熱的疑慮，協商破局議題只是順勢讓美股進行一波修正，但在修正期間，部分已經在多頭格局上的產業仍可從中長線角度布局，比如併購熱延續的生技、頁岩油氣革命的油礦金等，當大環境波動出現修正時，反而是逢低進場的時機。唐雲益提醒接下來主要觀察兩個面向：中國十一長假結束後，是否會有驚喜數據？像是家電和智慧手機銷售量等；再者就是美國在10月17-18日債務上限是否提高？這兩個數據和議題將會是未來投資人關注重點。,"[['協商僵局', '面臨', '美國未獲解決'], ['財政', '協商在', '大限之前'], ['美國', '未獲', '解決'], ['美國期貨', '呈', '小漲'], ['暨經理人Jim Kourkoulakos', '認爲', '這是協商過程拖'], ['這', '是', '協商過程拖'], ['惠理康唐雲益', '認爲', '美國政府停擺的是美國國內產業'], ['美國政府停擺的', '是', '美國國內產業'], ['相關產業', '包括', '航空業首當其衝'], ['政府', '申請', '貸款'], ['政府', '申請', '貸款'], ['航空業', '受', '衝擊'], ['，', '連帶', '臺灣'], ['投信產品首席陳柏基', '指出', '嚴重'], ['協商破局', '不是', '第一次'], ['市場', '已有', '干擾'], ['唐雲益', '表示', '衍伸'], ['倒垃圾', '成', '處理問題'], ['他', '強調', '作爲壓力'], ['帶來波動', '尋找', '具成長利基產業'], ['陳柏基', '認爲', '美股有過熱疑慮'], ['美股', '有', '過熱疑慮'], ['大環境波動', '出現', '修正'], ['大環境波動', '出現', '修正'], ['兩個數據', '是', '未來投資人關注重點']]"
0,20131001_1524,經濟部調查 九月底物價平穩第二階段電價調漲方案今天（1號）起實施，經濟部開會了解民生物資和原物料的價格監理情況，包括黃豆、小麥和糖等國際大宗物資的價格比去年同期下跌，傳統市場和夜市小吃攤的價格到九月底都還算平穩，經濟部也將每週持續監測物價。（戎華儀報導）經濟部十月一號召開「重要商品及原物料市況監理小組會議」，了解市面上民生物價的漲跌幅情況。根據經濟部統計，今年八月的黃豆、小麥和糖等國際大宗物資的期貨價格分別比去年同期下跌百分之十九、二十六和百分之十七，顯示國際上的物價壓力不大。至於超市、超商和大賣場最近一周的民生必需品價格，像衛生紙、醬油和米，最近以來漲漲跌跌，沒有劇烈波動。經濟部也觀察了七種夜市小吃價格，九月底前大多沒有漲價。經濟部研究發展委員會副執行秘書魏士綱：『針對北中南的一些傳統市場跟夜市，大概挑了六、七種日常小吃，比如說滷肉飯、肉羹、肉圓、蚵仔煎...類似這種的民生小吃，我們這期看到的幾乎都沒有漲，所以目前看起來是還算平穩。』魏士綱表示，經濟部將持續鎖定兩百項民生產品和餐飲零售、美髮、洗衣、物流、製造業和傳統市場公協會與指標性業者，每週監測市場物價。,"[['傳統市場價格', '還算', '平穩'], ['經濟部', '監測', '物價'], ['經濟部', '召開', '商品市況監理小組會議'], ['經濟部', '觀察', '夜市小喫價格'], ['魏士綱', '表示', '經濟部鎖定民生產品'], ['經濟部', '鎖定', '民生產品']]"
