,News,All,SVO
0,20140905_771,郭台銘造電動車只是構想楊海艷綜合台灣媒體報導，在9月3日召開的“第二屆晉商大會”上，台灣鴻海集團董事長郭台銘表示，鴻海集團將在山西進行投資，充分利用豐富的自然資源，發展電動車業。消息一出，立馬引起業界廣泛關注。在業界人士看來，郭台銘所在的鴻海集團在客觀上已經具備做電動車的技術實力和政策土壤。如果真的涉足電動車領域，郭台銘將成為第二個王傳福，而富士康或也將成為第二個“比亞迪”。不過，即便如此，在汽車分析師張志勇看來，郭台銘做電動車的法更多的是對未來集團發展戰略的一種展望，也是在特定環境下的一種表態。按照台灣《聯合報》的報導，郭台銘認為山西一直都是中國大陸最重要的能源輸出省。而單一的能源輸出對經濟發展不利，能源要做更有效的運用，應該在山西打造循環經濟，“當地未來的煤層氣不要出口”，有效利用山西能源轉換成科技品，甚至可以直接做垂直整合，打造電動車。而50億元的投資也並不是只指電動車，而是鴻海集團今年將在山西的投資額度。進軍電動車領域確實是富士康發展的一個可能方向。一方面，在各項政策的助推下，國內新能源汽車市場已經開始出現大幅增長，與此同時，國家政策在電動車準入上也有適度“鬆口”，客觀上有助於非汽車行業的企業進入。另一方面，涉足電動車業，似乎也一直是郭台銘所願。早在2009年，就有台灣媒體報導，郭台銘旗下正崴集團將和美國知名電池製造商Boston-Power合作，涉足電動車核心部件的製造。2010年，郭台銘在接受大陸媒體採訪時又表示，他本人已經和吉利集團董事長李書福洽談雙方在新能源以及汽車電子方面的合作。而在2011年，富士康又表示將斥資超過10億美元分別在遼寧瀋陽和營口設立新工廠，涉及精密數控機床、納米銅鎂合金汽車零部件項目等。不過，在張志勇看來，一方面，在目前的市場環境下，郭台銘並沒有立即上馬純電動車的“原動力”，另一方面，從技術上看，可能王傳福所在的比亞迪在技術上要略勝一籌，因為王傳福本身就是研究電池技術的。在江淮汽車股份有限公司副總經理嚴剛看來，純電動車的架構雖然簡單，但不意味只要突破電池、電機和電控三大核心技術，就能做成功。在他看來，純電動車上的空調、轉向、制動、能量回收系統以及遠程監控系統，每一個都非常重要，缺一不可。而要把握和吃透上述技術，必須回到對車本身的理解之上。從這一層面上看，或許能解釋為什麼郭台銘做電動車的話題永遠都停留在“只聞樓梯響，不見人下來”的狀態了。,"[['郭臺銘', '造', '電動車'], ['郭臺銘造電動車', '只是', '構想臺灣媒體報導'], ['臺灣鴻海集團董事長郭臺銘', '表示', '鴻海集團進行投資'], ['鴻海集團', '進行', '投資'], ['郭臺銘所在鴻海集團', '具備', '技術實力'], ['郭臺銘所在鴻海集團具備技術實力', '做', '電動車'], ['郭臺銘', '成爲', '第二個王傳福'], ['富士康', '成爲', '第二個比亞迪'], ['郭臺銘', '做', '電動車'], ['郭臺銘', '做', '電動車'], ['更多的', '是', '一種展望'], ['郭臺銘', '認爲', '山西都是能源輸出省'], ['山西', '都是', '能源輸出省'], ['能源', '做', '更有效運用'], ['50億元投資', '不是', '指電動車'], ['進軍電動車領域', '是', '可能方向'], ['新能源汽車市場', '開始', '出現大幅增長'], ['國家政策', '也有', '適度鬆口'], ['涉足電動車業', '是', '郭臺銘願'], ['臺灣媒體', '報導', '郭臺銘旗下正崴集團合作'], ['在', '接受', '大陸媒體採訪'], ['郭臺銘', '表示', '他本人洽談在合作'], ['他本人', '洽談', '在合作'], ['富士康', '表示', '等斥資'], ['郭臺銘', '上馬', '純電動車原動力'], ['王傳福本身', '就是', '研究電池技術的'], ['郭臺銘', '做', '電動車'], ['郭臺銘', '做', '電動車'], ['郭臺銘做電動車的話題', '停留在', '聞樓梯狀態'], ['只', '聞', '樓梯']]"
0,20140905_772,券商分析摘要◆券商推薦個股排行：◆ 大慶證：受到歐洲央行宣布進一步降息，以及推出收購資產計畫對抗通縮壓力的刺激下，昨日區股市普遍收高，而美股早盤亦受到激勵，與標普盤中更一度再創歷史新高。經濟數據方面，美國上周初次申請失業金人數增加4000人、7月貿易赤字下降至405億美元、8月私人企業新增就業2 0.4萬人，大體上符合預期，但因非農就業數據與8月份失業率公佈在即，使市場買盤縮手，除收紅外，其餘三大指數均以小跌作收。◆ 新光金：雖俄烏達成停火協議，不過美股卻是漲跌互見，尤其蘋果股價創高後出現重挫，暗示蘋概股短多出盡，因此拖累週四台股走勢，盤中指數一度失守9400點，所幸面板雙虎勉強維繫人氣，配合金融指數力守平盤之上，帶動尾盤跌幅略為收斂，終場收9428.89點，下跌21.46點或0. 23%，成交額748.45億元。◆ 大昌證券：大盤昨日走勢出現反彈，早盤雖一度壓回至盤下，不過買盤隨即開始進場撐盤，指數也開始震盪向上，終場雖未能站回5日線，不過前日的長黑K棒已收復了一半，10日線也站上，整體走勢還算不錯，後續若能儘速站回5日線，則盤勢仍有向上的機會。後續盤面的觀察指標，仍在成交量能以及外資動向的部份，昨日收盤量能仍不及900億元，後續須補量至日均量至少千億元之上，才有較大的動能向上，而外資雖於現貨再度呈現買超，但期貨部位仍是較為偏空後續仍須持續注意外資於期貨部位的方向。◆ 統一證：在財政部長出現喊話下，台股跌深反彈，開盤上漲35點，開在9434點。但在週二大跌百點影響，市場操作格外謹慎，盤中都在平盤之上狹幅震盪，尾盤靠台積電、矽品、台泥及金融等權值股拉抬，收在相對高點。三大產業中，金融類股上漲1.16%最為強勁。類股中水泥、汽車、百貨、半導體類股分別上漲1.13%、1.76%、1.32%、0.76%相對強勢，個股則主要反應營收因素，嘉聯益、聯鈞、南電重挫，太陽能族群及PCB軟板則分別下跌1%、0.96%，終場指數上漲50.63點，以9450點作收，再度站回9400點關卡，量能為 886億元。,"[['券商', '分析', '摘要'], ['券商', '推薦', '個股'], ['歐洲央行', '宣佈', '降息'], ['收購資產計劃', '對抗', '通縮'], ['美股早盤', '受到', '激勵'], ['盤中指數', '失守', '9400點'], ['面板雙虎', '維繫', '人氣'], ['昨日走勢', '出現', '反彈'], ['指數', '開始', '震盪'], ['盤勢', '有', '向上機會'], ['後續補量', '不及', '900億元'], ['現貨', '呈現', '買超'], ['財政部長', '出現', '喊話'], ['財政部長', '出現', '喊話'], ['金融類股', '上漲', '1.16%'], ['水泥類股', '上漲', '1.13%'], ['個股', '反應', '營收因素'], ['量', '能爲', '886億元']]"
0,20140905_773,乾景投顧盤前分析◆盤勢分析1.昨天在電視上說明大盤近期好像在混沌之中，我只重覆二句話「台股沒有理由不好」、「台股穩健樂觀」。今天的看法一樣，重點不是在指數，個股的差異到下週會更大，原因不是中秋變盤而是8月業績公佈，個股好壞差異擴大。今日量縮拉回過程是要讓投資人買好股，下週由業績股個股表態強攻。2.電動車TESLA今晨再創歷史新高價288美元。TESLA連創新高的最大主因還是在業績第四季開始季增六成的大幅拉升，明後年持續大成長。連鴻海郭董事都宣佈擴大投資250億要進軍電動車。可預見未來二年電動車產業大成長，不只是TESLA，包括雙B、豐田、福斯等大汽車廠都會大舉擴產投入。當百萬元以下一般房車的平價車款開始推出，需求更會三級跳增，不用說鴻海郭董喊出50萬的目標價格，市場需求更大!受惠的電動車族群如F-貿聯、和大等股價會再創新天價，會隨著未來幾個月業績新高推升股價衝新天價！3.8、9月開始，進入很多公司的旺季來臨。我看好接下來業績會成長的F-貿聯、和大、辛耘、F-聯德、奇力新等，這些業績成長利多如第二頁個股說明，不受指數震盪影響，下週利多公佈將會領軍個股做多頭先鋒。馬明河分析師,"[['1分析', '說明', '在'], ['我', '重複', '二句話不好'], ['重點', '在', '指數'], ['原因', '不是', '業績公佈'], ['電動車', '再創', '歷史新高價288美元'], ['最大主因', '還是', '季增大幅拉昇'], ['鴻海郭董事', '宣佈', '擴大'], ['平價車款', '開始', '推出'], ['鴻海郭董', '喊', '目標價格'], ['F-貿聯', '再創新', '天價'], ['股價', '衝', '新天價'], ['，', '進入', '很多公司'], ['我', '看好', '等F-貿聯'], ['成長利', '如', '個股說明'], ['多公佈', '領', '個股']]"
0,20140905_774,"元大寶來期貨台股期指盤前－電子熄火金融平淡 空頭主導盤下震盪◆盤勢分析週三美股三大指數漲跌互見，歐台指也僅以小漲作收，週四亞股多空紛陳，台股中電子族群表現相對疲弱，加上金融族群無力領揚，難以提振台股短多軍心，雖然大盤尾盤出現明顯拉抬，但買盤承接意願卻顯得意興闌珊，在一波波賣壓攻勢下，指數無力站回平盤之上；終場扣除掉除息影響點數後，期現貨實質逆價差擴大至5點，透露出期貨市場對後市的看法已經轉趨謹慎。觀察法人籌碼變化，外資買超金額大幅縮減至3.8億元，自營商則賣超4.9億元，呈現連三賣，三大法人合計買超6.2億元；在淨部位方面，外資加碼淨空單1,208口至11,401口，自營商減碼淨多單901口至7,366口，三大法人合計偏空操作2,769口，淨部位翻空至淨空單1,962口，整體而言，三大法人在期貨部位同步偏空操作，突顯其避險意識有所增溫，只是土洋雙方仍各持有約萬口淨部位，在對作情況轉變前，洗盤風險仍存。週四台股成交金額減少至735億元，量縮價跌略有助大盤止跌；各類股期指方面，盤面上唯一收漲的非金電期留有明顯的下影線，但漲勢並不積極，電子期則承受均線反壓，回測下方季線，金融期陷入平盤附近整理的僵局，但在上方5日均線壓力的干擾之下，指數向下尋求支撐，並失守10日均線，且高低點呈現下移，種種跡象顯示上檔仍有賣壓待消化，短線指數恐有陷入盤整的疑慮。","[['大盤尾盤', '出現', '拉抬'], ['買盤', '承接', '意願'], ['現貨實質逆價差', '擴大至', '5點'], ['，', '透露', '期貨市場'], ['外資買超金額', '縮減至', '3.8億元'], ['自營商', '減', '901口'], ['三大法人', '操作', '2'], ['土洋雙方', '偏', '操作'], ['成交金額', '減少至', '735億元'], ['跌略', '有助', '大盤止跌'], ['收非金電期留', '有', '明顯下影線'], ['電子期', '承受', '均線反壓'], ['金融期', '陷入', '整理僵局'], ['指數', '尋求', '10日均線'], ['種種跡象', '顯示', '上檔有賣壓'], ['上檔', '有', '賣壓'], ['恐', '陷入', '疑慮']]"
0,20140905_775,台股盤前─中秋長假前買盤觀望 蘋果魔咒恐再現 短線盤整守9400點台股連續兩個交易日留下長下影線，昨日成交量更降至下半年新低，IFA展三星、索尼等大廠發表旗艦新機，企圖搶占蘋果iPhone 6發表前的市場，蘋果股價連2日下跌，恐怕拖累相關概念股的表現，美股周四紅翻黑，台股今(5)日雖有政策將開放第三方支付業務的利多，但在中秋長假前，買氣如果無法回升，恐怕仍將陷入整理，值得觀察的是，歐洲央行宣布降息，可望帶來新一波的資金活水，有助台股力抗賣壓，加大反彈機率。台股周四力守9400點的企圖明顯，尾盤強拉金融股墊高指數，留下長下影線作收，成交量則是降至下半年新低，中秋節長假前觀望氣氛濃厚，無量之下，多頭也難展身手，短線來看9400點成為多空角力關鍵。歐洲中央銀行宣布降息，且推出收購資產計畫對抗通貨緊縮壓力，激勵歐美股市表現，但美股周四卻是出現由紅翻黑的表現，主要是今日將公布最新非農就業數據及8月美國失業率，投資人保守因應。美股周四下跌8.7點，或0.05%，收在17069.58點；NASDAQ指數收跌10.28點，或0.22%，收在4562.29點；指數收跌3.07點，或0.15%，收在1997.65點；則是收紅1.63點，漲幅0.25%，收在645.72點。美股漲跌不大，倒是歐洲央行宣布降息，國內法人認為，可望刺激台股資金面，有助台股今日的表現。蘋果iPhone 6外傳預計在9月9日發表，將有兩款不同尺吋的手機同時上市，但是股價卻在近兩個交易日出現下跌，蘋果概念股恐將受到拖累，市場上向來流傳蘋果魔咒的說法，短線恐怕對蘋果相關概念造成衝擊，今日仍要留意包括股王大立光、鴻海、可成等股的表現。政策面部分，行政院會通過第三方支付專法(電子支付機構管理條例)草案，將開放第三方支付業務，開放線上儲值服務、辦理離線實質支付、電子支付帳戶間的匯款移轉等3種電子商務。金管會主委曾銘宗則是強調，希望下會期列入優先法案，一旦立法院通過，年底前就可推行，目前預估約有5-10家業者將會提出申請。據了解，包括台灣大等電信業、網家、智冠等業者都在積極準備進軍第三方支付領域。值得注意的是，國內再爆出食安問題，不法業者用餿水油製造黑心油，目前已知國內食品大廠味全使用到問題油品，台北市衛生局表示，味全主動通報有味小寶純豬肉酥等12項產品使用「全統香豬油」問題油，已主動回收涉案產品及封存；食安問題再起是否造成衝擊值得觀察。法人指出，整體來看，台股中多趨勢持續，惟需留意未來美股反應QE結束及首次升息，及觀察10月滬港通之後對台股資金流動的影響；另外，蘋概股短線漲多震盪仍守住支撐，iPhone 6發表後預期將會熱賣，配合營收成長利多有利台股盤堅；政策上兩岸金融會議、政策偏多，加上中國十一假期題材，有利台股類股輪動。,"[['臺股盤前─中秋', '觀望', '魔咒恐再現守9400點臺股'], ['等展大廠', '發表', '旗艦新機'], ['開放第三方', '支付', '業務'], ['，', '值得', '觀察'], ['歐洲央行', '宣佈', '降息'], ['臺股', '力守', '9400點'], ['週四', '力守', '9400點'], ['尾盤', '拉', '高指數'], ['成交量', '留下', '長下影線'], ['9400點', '成爲', '多空角力關鍵'], ['歐洲中央銀行', '宣佈', '降息'], ['美股週四', '出現', '翻黑表現'], ['美股', '下跌', '8.7點'], ['收', '在', '17069.58點'], ['收', '在', '4562.29點'], ['收', '在', '645.72點'], ['歐洲央行', '宣佈', '降息'], ['股價', '出現', '下跌'], ['恐', '受到', '流傳蘋果魔咒說法'], ['向來', '流傳', '蘋果魔咒'], ['短線', '造成', '衝擊'], ['預估', '有', '5-10家業者提出申請'], ['5-10家業者', '提出', '申請'], ['等電信業業者', '準備', '進軍支付領域'], ['值得注意的', '是', '國內爆出食安問題'], ['國內', '爆出', '食安問題'], ['不法業者', '製造', '黑心油'], ['國內食品大廠味', '使用', '問題油品'], ['臺北市衛生局', '表示', '回收涉案產品'], ['12項產品', '使用', '問題油'], ['食安問題再起', '造成', '衝擊值得觀察'], ['衝擊', '值得', '觀察'], ['法人', '指出', '多趨勢持續'], ['6iPhone', '預期', '將會熱賣']]"
0,20140905_776,華南期貨台股期指盤前分析◆盤勢分析蘋果股價因為資安問題以及iphone6的訂價價格偏貴，造成那資達克指數收黑，也造成今天貨的開平走低，今日開盤價為9447點，在蘋果概念股開低下，指數一早就先行修正至今日低點9380點，不過在權值股低檔有撐下，拉抬指數來到今日高點9448點，直至收盤都在此區間震盪，今日收了一根下引黑k線，下跌24點，屬於量縮小跌的格局。在現貨方面今日收於9428.89點，成交量為735億元，在技術面的部份日線呈現三角突破後上揚的走勢，若跌破9400點，多方建議採取較保守的策略，建議在持有現股的同時，買進價外1~2檔的賣權選擇權避險，以保護現股的部位。至於籌碼面的部份，外資現貨今日買超3.8億，前五個交易日共買超198.62億，期貨未平倉量部份外資期貨未平倉量增加淨空單1208口，總共為淨空單11401口。在選擇權的部份，8月合約買權OI大量分佈在 9300以上，目前買權OI最大量在9700，約6.5萬口左右，賣權OI大量分佈在9500以下，賣權OI最大量目前在9000，約4.7萬口。,"[['華南期貨臺股期', '分析', '盤勢'], ['蘋果股價', '造成', '資達克指數收黑'], ['資達克指數', '收', '黑'], ['今日開盤價', '爲', '9447點'], ['指數', '修正至', '今日低點9380點'], ['低檔', '有', '下'], ['屬於量格局', '量', '縮小跌'], ['今日', '收於', '9428.89點'], ['成交量', '爲', '735億元'], ['上揚走勢', '跌破', '9400點'], ['在', '持有', '現股'], ['前五個交易日買', '超', '198.62億'], ['買權OI', '分佈在', '9300以上'], ['賣權OI', '分佈在', '9500以下']]"
0,20140905_777,南亞科9/9起取消分盤集合競價 仍維持全額交割股證交所指出，南亞科()依規定申報之第2季財報，每股淨值已回到3元以上，且將在9月9日完成減資換發有價證券作業程序，因此取消分盤集合競價交易方式，不過仍有變更交易方法之情形，因此維持全額交割股。證交所表示，南亞科第2季財報每股淨值已達3元以上，且預計在9月9日完成減資換發有價證券作業程序，其股票採分盤集合競價交易之原因已消滅。不過，證交所強調，南亞科仍有變更交易方法之情形，因此自9月9日起，取消南亞科分盤交易方式，但仍維持全額交割股。,"[['每股淨值', '回到', '3元以上'], ['有變更情形', '變更', '交易方法'], ['證交所', '表示', '每股淨值達3元以上'], ['每股淨值', '達', '3元以上'], ['證交所', '強調', '南亞科有變更情形'], ['南亞科', '有', '變更情形'], ['南亞科有變更情形', '變更', '交易方法']]"
0,20140905_778,"F-立凱8月營收暴衝逾9成 業績一路旺到年底電動巴士系統與磷酸鐵鋰電池正極材料龍頭F-立凱()公告8月業績，在滿手訂單推升下，單月合併營收為9700萬元，較去年同期暴衝92.4%，月增16.4%，繼7月營收增長64.7%，8月營收續創歷史新高，立凱電表示，根據過去經驗，下半年的需求往往是上半年的2倍以上, 立凱電在材料及電動巴士雙事業部接單順暢，因此下半年營收可望一路走揚到年底。F-立凱表示，下半年客戶需求強勁，產能滿載，看好未來車用電池與儲能電池及4G基地台終端應用成長，目前歷年累積銷量已達4700噸，居同業之冠；另外，磷酸鐵鋰電池四串後電壓與一般汽車鉛酸電瓶的電壓相同，再加上具安全、長效及高穩定性等特徵，將有機會成為安全及環保兼具的車用替換電瓶首選；而在智慧電網儲能系統的應用上，磷酸鐵鋰電池亦已普徧使用於智能電網及風能、太陽能等替代能源的儲存電池使用，減少對石油依賴、推動節能減碳，提升整體產業技術，擴大產業經濟規模。F-立凱指出，近日在經濟部及產業界共同促成下，攜手日本電池技術領導者SONY(索尼)簽署電動車鋰電池合作備忘錄，由立凱電主導在台灣建立鋰電池芯與電池模組廠，並由日方提供部份製程及必要的技術服務，打造全球最先進的電動車鋰電池生產基地，加速電池技術開發，大搶全球電動巴士市場逾兆元商機。F-立凱進一步指出，繼獲德國西門子在台獨家合作電動巴士後，加上日本電池大廠索尼營運添翼，聯手打造世界最高品質的電動巴士；並落戶大陸余姚，正式進軍大陸電動公交車市場，根據產業過往特性，下半年的需求往往是上半年的兩倍以上，立凱電在材料及電動巴士雙事業滿手訂單，營收可望一路走揚到年底。","[['巴士系統', 'F-立凱', '8月業績'], ['營收', '爲', '9700萬元'], ['月', '衝', '92.4%'], ['F-立凱', '表示', '強勁'], ['累積銷量', '達', '4700噸'], ['後電壓', '相同', '等安全特徵'], ['磷酸鐵鋰電池', '使用於', '儲存電池使用'], ['-立凱', '指出', '攜手SONY索尼'], ['由立凱電主導', '建立', '鋰電池芯'], ['F-立凱', '指出', '加上營運添翼'], ['德國西門子', '合作', '電動巴士'], ['下半年需求', '是', '上半年兩倍以上']]"
0,20140905_779,新光證券盤前分析◆盤勢分析收9428.89點，下跌21.46點或0.23%，成交量748.45億元。OTC指數收140.53點，下跌0.14點或0.10%，成交量214.04億元。雖俄烏達成停火協議，不過美股卻是漲跌互見，尤其蘋果股價創高後出現重挫，暗示蘋概股短多出盡，因此拖累週四台股走勢，盤中指數一度失守9400點，所幸面板雙虎勉強維繫人氣，配合金融指數力守平盤之上，帶動尾盤跌幅略為收斂，終場收9428.89點，下跌21.46點或0.23%，成交額748.45億元。台股現階段遭遇9500點前波套牢壓力，加上中秋變盤心理效應，導致盤勢多空看法分歧，同時間外資也大玩現、期貨兩手策略，預估量能無法有效放大前，指數呈現反覆波動機率較大，建議近期操作以觀望為主，逢低可留意業績能見度高族群，包括蘋概、光纖、工業電腦及汽車電子等。,"[['盤勢分析', '收', '9428.89點'], ['盤中指數', '失守', '9400點'], ['面板雙虎', '維繫', '人氣'], ['臺股', '遭遇', '套牢壓力'], ['指數', '呈現', '反覆波動']]"
