,News,All,SVO
0,20151126_2066,保險業投資不動產鬆綁 民陣抗議「打房打假的」！保險業投資不動產最低收益率限制從2.805%調降1碼至2.555%，今(26)日引發人民民主陣線抗議，並痛批金管會主委曾銘宗對稍微降溫的房市「提油救火」，政府打房根本是「打假的」；對此，金管會保險局主秘王麗惠表示，很多國家目前都沒對保險業資金投資不動產設定最低收益率門檻，且推動房市健全措施已見成效，才適時檢討法令。民陣表示，金管會放寬保險業投資不動產最低收益率，固然為保險業豐沛的資金找到了出路，但是也是對微降溫的房市「提油救火」，「這證明政府打房，是打假的！」尤其在總統與立委大選前夕，調降保險業投資不動產最低收益率，甚至未來還會讓保險業者自訂收益率，這根本就不利國內房市降溫。對此，王麗惠表示，這是反映市場狀況的適度微幅調整，況且，很多國家目前都沒對保險業資金投資不動產設定最低收益率門檻，且推動房市健全措施已見成效，才適時檢討法令，並沒有炒房的疑慮。依規定，壽險業投資不動產金額必須低於「可運用資金」的30%，金管會表示，目前壽險業投資不動產僅佔6%，與上限門檻還有很大的距離，一切都在控管當中。,"[['保險業', '投資', '不動產'], ['最低收益率', '限制', '調降1碼'], ['「', '提', '油'], ['政府打房', '是', '打假的'], ['金管會保險局主祕王麗惠', '表示', '檢討法令'], ['很多國家', '設定', '收益率門檻'], ['民陣', '表示', '也是提油救火'], ['最低收益率', '找到', '出路'], ['「', '提', '油'], ['這證明政府打房', '是', '打假的'], ['這', '不利', '降溫'], ['王麗惠', '表示', '這是反映適度微幅調整'], ['這', '是', '反映適度微幅調整'], ['壽險業投資金額', '低於', '運用資金30%'], ['金管會', '表示', '還有很大距離'], ['壽險業投資不動產', '佔', '6%'], ['一切', '在', '控管當中']]"
0,20151126_2067,證交所攜麥格理辦星港法說會 40家上市櫃公司與會證交所、櫃買中心與港商麥格理證券合作，自11/24起至11/27止在新加坡及香港舉辦台灣投資說明會，證交所董事長李述德率隊參加香港場次，總經理林火燈則帶領參加新加坡場次，邀集國內近40家優質上市櫃公司同行，此次說明會並安排星港投資機構代表與上市櫃公司進行一對一對談，共計近500場次，出席機構人次200名，藉此讓上市櫃公司介紹公司競爭力，讓更多國外資金投資台灣。證交所指出，至今年10月止，外資持股占集中市場市值比重已達38.67%，是台股市場重要投資者。由於新加坡與香港是亞太金融中心，也是各基金經理人匯集之地，即便總部在歐美之基金公司，其亞洲地區之投資決策中心也以星港為主，參與此次星港投資說明會的上市櫃公司涵蓋各產業，包括金融、電子、醫療、紡織等。證交所表示，說明會安排星港專業投資機構代表與上市櫃公司代表進行一對一會談，共計近500場次，出席機構投資人超過200名，藉上市櫃公司介紹台灣產業前景與優勢及個別公司的競爭力，讓更多國外資金投資台灣。說明會期間，麥格理證券除安排隨行之上市櫃公司與星港機構投資人面談，也邀請多家星港地區大型機構投資人參與證交所與櫃買中心的午餐演講，共約有110人出席。證交所介紹台灣資本市場近期表現，說明近2年政策推動及市場發展現況，提升國際投資人對臺灣資本市場之瞭解，許多機構法人於會後並持續與證交所人員就相關議題進行討論，交流對投資臺灣資本市場之意見與看法。,"[['此次說明', '帶領', '參加新加坡場次'], ['證交所', '指出', '外資持股佔集中市場市值達38.67%'], ['外資持股', '佔', '集中市場'], ['外資持股', '佔', '集中市場'], ['外資持股佔集中市場市值', '達', '38.67%'], ['新加坡', '是', '亞太金融中心'], ['，', '參與', '投資說明會'], ['上市櫃公司', '涵蓋', '各產業'], ['機構投資人', '超過', '200名'], ['上市櫃公司', '介紹', '臺灣產業前景'], ['大型機構投資人', '參與', '證交所'], ['大型機構投資人', '參與', '證交所'], ['證交所', '介紹', '近期表現']]"
0,20151126_2068,旭源敲定6000萬元現增案每股11元溢價發行旭源1-3季財報EPS為0.58元，其6000萬元現增案敲定12月3日除權交易，每股溢價11元發行，圖為旭源董事長黃南源。(鉅亨網記者張欽發攝)食品級印刷包材熱收縮膜印刷與機台設備廠旭源包裝科技()2015年來營運逐季轉佳並轉虧為盈，其2015年1-3季每股稅後盈餘為0.58元；同時，旭源也決議辦理市場籌資，將辦理6000萬元的現金增資案，今天並敲定現增溢價為每股11元溢價發行，在12月3日除權交易。旭源包裝科技的此一現增資金募集將用於償還銀行借款。旭源包裝的2015年1-3季財報出爐，今年的3個季度都呈現盈餘的營運，且第3季淨利1526萬元，超過上半年的盈餘總和，且第4季在有大量的食品包裝積層袋訂單挹注，補足飲料市場業績走淡的缺口，法人預估其第4季營運仍可獲利。旭源包裝的2015年1-3季財報內容，其稅後盈餘2236萬元，每股稅後盈餘0.58元，優於2014年同期財報每股稅後虧損1.61元。而旭源10月營收8799萬元，年增率11.25%，2015年1-10月營收8.86億元，年增率8.34%。旭源在嘉義大埔美工業區佈建的印刷廠歷經3年多的努力，效益已顯著發揮，預計在食品、醫療產品包裝積層袋包裝客戶大舉下單的成長狀況之下，其營收將直追飲料標籤的營收。目前旭源包裝科技的業務包括彩色收縮膜標籤印刷、食品包裝積層袋印刷、自行開發的套用及貼用標籤設備、膠膜上游材料，從業務結構來看，標籤印刷佔旭源營收比重約75-70%，套用、貼用標機械設備佔比重約25%，其他則佔約5%。而目前旭源的食品業包裝積層袋客戶群包括了宏亞()、統一()、味全()、華元食品等，其應用品類包括了餅乾、速食麵、休閒食品等。旭源科技今天收盤價13.35元，上漲0.45元或3.49%，成交量107張。,"[['EPS', '爲', '0.58元'], ['圖', '爲', '旭源董事長黃南源'], ['巨亨網記者張欽', '發攝', '食品級印刷包材熱收縮膜印刷爲盈'], ['營運', '轉', '轉虧'], ['每股稅後盈餘', '爲', '0.58元'], ['旭源', '決議', '辦理市場籌資'], ['現增資金募集', '用於', '償還銀行借款'], ['3個季度', '呈現', '盈餘營運'], ['，', '超過', '上半年'], ['法人', '預估', '第4季營運獲利'], ['旭源10月', '營收', '8799萬元'], ['嘉義大埔美工業區布建的印刷廠', '歷經', '多3年努力'], ['其營收', '將', '直追飲料標籤營收'], ['將', '直追', '飲料標籤'], ['標籤印刷', '佔', '70%75'], ['其他', '佔', '5%'], ['包裝積層袋客戶羣', '包括', '等)'], ['其應用品類', '包括', '等餅乾']]"
0,20151126_2069,威強電Q4營收持平 明年既有客戶新專案支撐成長工業電腦威強電()今(26)日召開法說會，展望第4季，威強電指出，預期營收表現將與第3季持平，獲利則可望因貶值幅度趨緩而改善，至於明年，威強電仍看好營運表現，主要動能來自既有客戶新增的專案訂單，新客戶部分貢獻度則較少，趨於別以美國市場需求最好，歐洲平平，中國雖然經濟成長趨緩，但基礎建設持續進行，台灣則看大客戶G-Tech專案訂單，目前博弈市場仍穩健，可望支撐明年營運。威強電第3季營收為15.85億元，季減2成多，毛利率37%，較第2季上揚也較去年同期還好，營益率則達18%，與第2季持平，但業外受到貶值因素影響，而威強電比重較高，業外虧損8600萬元，稅後淨利2.88億元，季減1成多，每股稅後盈餘為0.88元。威強電指出，第3季由於專案出貨量較少，因此營收表現下滑，由於專案多集中在上半年出貨，因此預期營收高峰就是第2季，下半年表現平平；展望第4季，威強電預期，營收約與第3季持平，毛利率估降到34%，獲利部分因貶值幅度趨緩，預期獲利可望較第3季改善。展望明年，威強電認為，動能將來自既有客戶新增的專案訂單，另外新客戶訂單也會貢獻一部分；而以地區來看，明年美國需求穩定，已有新專案進行，歐洲部分景氣仍平平，成長動能較為趨緩。台灣部分則要看G-Tech的專案訂單，威強電看好目前博弈市場穩健，可望持續支撐營收；中國市場則因景氣趨緩，但基礎建設持續進行，需求也穩定，中國威強電營收持續成長2成以上。另外轉投資威聯通的部分，威強電強調，因採用計價，因此今年因貶值，導致營收成長幅度受到壓抑，持續朝百億元目標邁進。,"[['Q4營收持平', '既有', '說會'], ['主要動能', '來自', '專案訂單'], ['主要動能來自專案訂單', '既有', '客戶新增'], ['臺灣', '看', 'Tech專案訂單'], ['第3季營收', '爲', '15.85億元'], ['營益率', '達', '18%'], ['業外', '受到', '貶值因素影響'], ['季', '減', '1成'], ['稅後盈餘', '爲', '0.88元'], ['營收高峯', '就是', '第2季'], ['威強電', '認爲', '自'], ['動能', '自', '專案訂單'], ['自', '既有', '客戶新增'], ['客戶訂單', '貢獻', '一部分'], ['威強電', '看好', '穩健'], ['另外', '轉投', '資威聯通'], ['成長幅度', '受到', '壓抑']]"
0,20151126_2070,"遠雄人壽：公告本公司向關係人取得不動產第三十四條　第17款1.標的物之名稱及性質（如坐落台中市北區ＸＸ段ＸＸ小段土地）:台北市南港區忠孝東路六段21號B2及17個車位2.事實發生日:104/11/26~104/11/263.交易單位數量（如ＸＸ平方公尺，折合ＸＸ坪）、每單位價格及交易總金額:建物面積6375.34平方公尺，折合1928.54坪，車位17個；建物每坪單價：約26.36萬元，車位每個單價：約200萬元；總價款：490,000,000元整4.交易相對人及其與公司之關係（交易相對人如屬自然人，且非公司之關係人者，得免揭露其姓名）:交易相對人：遠雄建設事業股份有限公司與公司之關係：該公司董事長為本公司董事之二親等親屬5.交易相對人為關係人者，並應公告選定關係人為交易對象之原因及前次移轉之所有人、前次移轉之所有人與公司及交易相對人間相互之關係、前次移轉日期及移轉金額:選定關係人為交易對象之原因：本案地點佳，符合公司作為教育訓練中心之需求前次移轉之所有人：國揚實業股份有限公司前次移轉之所有人與公司之關係：無前次移轉之所有人與交易相對人之關係：無前次移轉日期：88年12月04日前次移轉金額：3.18億元6.交易標的最近五年內所有權人曾為公司之關係人者，尚應公告關係人之取得及處分日期、價格及交易當時與公司之關係:不適用7.預計處分利益（或損失）（取得資產者不適用）（遞延者應清單說明認列情形）:不適用8.交付或付款條件（含付款期間及金額）、契約限制條款及其他重要約定事項:交付或付款條件：第一期98,000,000元整、第二期147,000,000元整、尾款245,000,000元整契約限制條款及其他重要約定事項：無9.本次交易之決定方式（如招標、比價或議價）、價格決定之參考依據及決策單位:交易之決定方式：參考市場行情與不動估價師之估價價格決定之參考依據：不動估價師估價報告書決策單位：董事會10.專業估價者事務所或公司名稱及其估價金額:宏邦不動產估價師聯合事務所：509,694,039元整誠正海峽兩岸不動產估價師事務所：518,343,078元整11.專業估價師姓名:宏邦不動產估價師聯合事務所：蔡明航誠正海峽兩岸不動產估價師事務所：林金生12.專業估價師開業證書字號:蔡明航：(94)北市估字第000076號林金生：(94)北市估字第000060號13.估價報告是否為限定價格、特定價格或特殊價格:否14.是否尚未取得估價報告:否15.尚未取得估價報告之原因:不適用16.與交易金額比較有重大差異原因及會計師意見:不適用17.經紀人及經紀費用:無18.取得或處分之具體目的或用途:作為本公司自用不動產供教育訓練中心及提供員工停車之用19.本次交易表示異議之董事之意見:無20.本次交易為關係人交易:是21.董事會通過日期:民國104年11月26日22.監察人承認或審計委員會同意日期:民國104年11月26日23.本次交易係向關係人取得不動產:是24.依「公開發行公司取得或處分資產處理準則」第十五條規定評估之價格:514,018,559元25.依前項評估之價格較交易價格為低者，依同準則第十六條規定評估之價格:不適用26.其他敘明事項:無","[['公告本公司', '取得', '1第17款標的物名稱'], ['相對人', '屬', '自然人'], ['如', '屬', '自然人'], ['相對人屬自然人關係', '免', '揭露其姓名'], ['該公司董事長', '人爲', '關係人者'], ['佳', '符合', '次移所有人'], ['移轉所有人', '相對', '人關係'], ['（', '含', '期間'], ['參考依據', '參考', '市場行情'], ['估價報告', '爲', '限定價格'], ['尚未', '取得', '估價報告'], ['自用不動產', '供', '教育訓練'], ['本次交易', '表示', '異議董事意見'], ['董事會', '通過', '日期'], ['監察人', '承認', '審計委員會同意日期'], ['審計委員會', '同意', '日期'], ['交易系', '取得', '不動產'], ['.', '依', '公司取得資產處理準則'], ['24依第十五條', '規定', '評估價格'], ['25', '爲', '低者'], ['敘明事項', '不適用', '26']]"
0,20151126_2071,證券市場博覽會12/19登場！曾銘宗臉書親自打廣告金管會主委曾銘宗於臉書上親自打廣告「2015證券市場博覽會」12/19即將登場！(翻攝自臉書)臺灣證券交易所訂於今(2015)年12月19、20日(星期六、日)上午10:00-下午17：00，於台北世貿三館舉辦「2015證券市場博覽會」，金管會主委曾銘宗今(26)日晚間親自於臉書上發文打廣告，廣邀民眾共襄盛舉。「2015證券市場博覽會」邀請參展公司有上市公司、指數股票型基金(ETF)發行人、權證發行人、臺灣存託憑證發行公司(TDR)、第一上市外國公司(F股)、資訊廠商、會計師事務所、綜合證券商、證券期貨周邊單位及國際交易所等共同參與此盛會。臺灣證券交易所辦理本次博覽會的主要目的，是為增進上市公司、證券商、資訊廠商等市場參與者與投資人之間有更多的互動機會，讓投資人更加了解各項證券商品及證券期貨周邊單位所提供的各種服務，並透過參與上市公司的各項說明，讓一般投資人更能充分了解上市公司的相關資訊及資本市場的整體運作。本次博覽會還有一個非常大的特色，邀請外國的交易所，諸如：日本交易所、新加坡交易所、上海證交所、香港交易所、深圳證交所、德意志交易所集團、胡志明證交所、河內證交所及華沙證交所等來台參展，期以強化我國證券市場國際化的程度。曾銘宗表示，活動現場還將展出證交所50多年來的歷史照片、證券刊物及文宣品，還設有「本國上市公司」、「資訊專區」、「周邊單位區」、「國際區」等專區，除了各項說明會及投資理財講座之外，還有多項抽獎活動，增加熱鬧氣氛。,"[['曾銘宗臉書', '打', '廣告'], ['金管會主委', '曾銘宗於', '臉書上'], ['臺灣證券交易所', '訂於', '2015年12月19'], ['」', '邀請', '參展'], ['邀請參展公司', '有', '等上市公司'], ['臺灣證券交易所', '辦理', '本次博覽會'], ['臺灣證券交易所', '辦理', '本次博覽會'], ['主要目的', '是', '等上市公司市場參與者之間有互動機會'], ['等上市公司市場參與者之間', '有', '互動機會'], ['本次博覽會', '還有', '大特色'], ['等日本交易所', '來', '臺'], ['等日本交易所', '來以', '強化我國證券市場國際化程度'], ['曾銘宗', '表示', '活動現場展出歷史照片'], ['活動現場', '展出', '歷史照片']]"
0,20151126_2072,"展達：公告本公司資金貸與子公司展達通訊(蘇州)有限公司事宜第七條　第9款1.事實發生日:104/11/262.發生緣由:本公司董事會擬同意貸與子公司展達通訊(蘇州)有限公司900萬元整,作為營運週轉,為期一年,借款利率為年利率1.5%.3.因應措施:無4.其他應敘明事項:無","[['本公司董事會', '擬', '整'], ['借款利率', '爲', '因措施'], ['.', '因', '應']]"
0,20151126_2073,"展達：公告本公司董事會重大決議事項第七條　第9款1.事實發生日:104/11/262.發生緣由:本公司董事會重大決議事項 本公司擬透過DIRECTMAX INTERNATIONAL LIMITED,投資 XAVI OVERSEAS LTD,再轉增資展達通訊(蘇州)有限公司 500萬元整。3.因應措施:無4.其他應敘明事項:無","[['本公司', '擬', '投資XAVI OVERSEASLTD']]"
0,20151126_2074,展達：公告本公司內部稽核主管異動第七條　第9款1.事實發生日:104/11/262.發生緣由:公告本公司內部稽核主管異動3.因應措施:(1)人員變動別:內部稽核主管(2)發生變動日期:104/11/26(3)舊任者姓名及簡歷:黃文成，展達通訊稽核室資深處長(4)新任者姓名及簡歷:李秀英，展達通訊財會部經理(5)異動原因:職務調整(6)生效日期:105/01/014.其他應敘明事項:無,[]
0,20151126_2075,"燁聯鋼鐵：公告本公司董事會決議擬以私募方式辦理普通股現金增資案第三十四條　第9款1.董事會決議日期:104/11/262.私募有價證券種類:普通股3.私募對象及其與公司間關係:擬洽之應募人名單:偉喬投資開發股份有限公司、聯碩投資開發股份有限公司，燁輝企業股份有限公司、燁茂實業股份有限公司，與本公司間為內部人或關係人。惟最終擬參與認購私募普通股之應募人尚未洽定。4.私募股數或張數:不超過300,000,000股普通股為限5.得私募額度:擬於總發行股數不超過300,000,000股限額內(視發行價格暨實際發行股數而定)辦理私募，自股東會決議通過本私募案之日起一年內得分次辦理。6.私募價格訂定之依據及合理性:一.本次私募普通股之對象以有助於本公司長期經營之投資人為限。本次私募普通  股價格之訂定，以本公司定價日前下列二基準計算價格，以兩者計算價格孰高  者為私募參考價格，並以不低於參考價格之八成訂定之。  (1)定價日前三十個營業日興櫃股票電腦議價點選系統內本公司股票普通股之每     一營業日成交金額之總和除以每一營業日成交股數之總和計算，並扣除無償     配股除權及配息，暨加回減資反除權後之股價。  (2)定價日前最近期經會計師查核簽證或核閱之財務報告顯示之每股淨值。二.實際私募價格提請股東會授權董事會視日後洽特定人情形及市場狀況於參考價格八成以上訂定之。私募價格之定價乃依主管機關公布之法令定之，同時考量證券交易法對私募有價證券有三年轉讓限制、公司經營績效、未來展望及近期普通股市　價而定，應屬合理。三.由於本公司帳面仍有累積虧損，另參考本公司股票在交易市場之每股市價，故本次辦理私募普通股之每股價格可能低於股票面額；是以如依前述之定價方法致私募價格低於股票面額者，其原因應屬合理；對股東權益影響為實際私募價格與面額之差額發生之虧損，因本公司私募普通股所籌資金用途為改善公司財務結構，故對股東權益應不致產生重大影響。如因前述事由致公司發生累積虧損時，未來將視公司營運及市場狀況，以減資、盈餘、資本公積彌補虧損或其他法定方式處理。前開方式係自公司穩健經營及財務結構安全性考量，未採其他負債性質之籌資方式，應屬合理。7.本次私募資金用途:私募資金將用於改善財務結構及充實營運資金，預計將降低公司營運風險及提升市場競爭力並可強化整體財務結構及償債能力，減少費用支出。8.不採用公開募集之理由:本公司考量目前資本市場狀況及為掌握募集資本之時效性及可行性等因素，以便於最短期限內取得所需之資金，故擬透過私募方式辦理增資。9.獨立董事反對或保留意見:無10.實際定價日:俟股東會決議通過後授權董事會決定之。11.參考價格:俟股東會決議通過後授權董事會決定之。12.實際私募價格、轉換或認購價格:俟股東會決議通過後授權董事會決定之。13.本次私募新股之權利義務:本次私募普通股，其權利義務原則上與本公司已發行之普通股相同，惟本次發行之普通股及其嗣後所配發新股，依證券交易法規定，於交付日起3 年內，除依證券交易法第43條之8規定之轉讓對象外，不得再行賣出，自交付日起滿 3 年後依相關規定，應先取具主管機關符合上興櫃標準之同意函，並向金融監督管理委員會申報補辦公開發行程式後申請上興櫃交易。14.附有轉換、交換或認股者，其換股基準日:不適用15.附有轉換、交換或認股者，對股權可能稀釋情形:不適用16.其他應敘明事項:一.有關本次實際私募股數、私募價格、基準日、資金運用計劃、資金用途及進度、預計   產生效益及其他相關事項，擬請股東會授權董事會斟酌實際情勢並依照法令及主管機   關規定、參酌專家意見及因應市場客觀環境變化作必要之變更，並配合辦理一切私募   相關事宜。二.本公司將於104年12月25日召開之股東臨時會提案討論本案。","[['本公司董事會決議', '擬', '辦理董事會決議日期'], ['應募名單', '擬洽', '之'], ['之', '應募', '人'], ['偉喬投資開發股份有限公司', '爲', '內部人'], ['擬', '參與', '認購普通股'], ['不', '超過', ','], ['超過,000股普通股', '爲限', '5'], ['總髮行股數', '超過', ','], ['不', '超過', ','], ['自股東會', '決議', '辦理'], ['私募普通股對象', '有助於', '投資人爲限'], ['本公司', '定價', '日前下列'], ['高  者', '爲', '參考價格'], ['私募價格定價', '定', '之'], ['考量證券交易法', '有', '轉讓限制'], ['本公司帳面', '有', '累積虧損'], ['本次', '辦理', '私募普通股'], ['每股價格', '低於', '股票面額'], ['私募價格', '低於', '股票面額者'], ['其原因', '屬', '合理'], ['對影響', '爲', '私募價格發生虧損'], ['本公司', '私募', '普通股'], ['籌資金用途', '爲', '改善財務結構'], ['致公司', '發生', '累積虧損'], ['開方式', '系', '籌資方式'], ['私募資金', '用於', '改善財務結構'], ['本公司', '考量', '資本市場狀況'], ['本公司', '考量以', '取得所需資金'], ['其', '換', '股'], ['其', '換', '股'], ['私募股數', '擬', '請'], ['本公司', '召開', '臨時會']]"
0,20151126_2076,億豐：公告本公司將於104年12月03日舉辦上市前業績發表會第三十四條　第30款符合條款第XX款：30事實發生日：104/12/031.召開法人說明會之日期：104/12/032.召開法人說明會之時間：15 時 00 分 3.召開法人說明會之地點：台北君悅酒店-3F凱悅廳I區4.法人說明會擇要訊息：本次業績發表會將由公司經營團隊說明產業發展、財務業務狀況、未來風險暨台灣證券交易所股份有限公司要求本公司於公開說明書補充揭露事項。5.法人說明會簡報內容：內容檔案於當日會後公告於公開資訊觀測站6.公司網站是否有提供法人說明會內容：無7.其他應敘明事項：內容檔案於當日會後公告於公開資訊觀測站,"[['本公司', '舉辦', '符合條款第XX款'], ['104/12/031', '召開', '法人說明會日期'], ['法人', '說明', '會'], ['法人', '說明', '會'], ['法人', '說明', '擇要訊息'], ['本次業績發表會', '說明', '產業發展'], ['法人', '說明', '簡報內容'], ['內容檔案', '公告於', '.公司網站'], ['敘明事項', '無', '7'], ['內容檔案', '公告於', '公開資訊觀測站']]"
0,20151126_2077,展達：公告本公司財務暨會計主管異動第七條　第9款1.事實發生日:104/11/262.發生緣由:公告本公司財務暨會計主管異動3.因應措施:(1)人員變動別:財務暨會計主管(2)發生變動日期:104/11/26(3)舊任者姓名及簡歷:李秀英，展達通訊財會部經理(4)新任者姓名及簡歷:林欣泰，群光電子會計經理(5)異動原因:職務調整(6)生效日期:105/01/014.其他應敘明事項:無,"[['2主管', '發生', '變動日期']]"
