,News,All,SVO
0,20151127_2042,過了！勤業眾信：台日租稅協定 擁抱三大利多台日經濟貿易會議正式簽訂「避免雙重課稅協定」，勤業眾信國際租稅負責人張豐淦表示，租稅協定可避免重複課稅、提高赴日本投資意願及降低基金業者營運成本等三大利多，對台日雙方營利事業都有利，但因兩地扣抵規定不同，初期看來對日本投資台灣企業有利。台日經濟貿易會議正式簽訂「避免雙重課稅協定」，就所得來源地的課稅限制、稅賦問題做出規範，尤其具體將台日間支付所得來源地稅率調整為10%，張豐淦指出，日方若從海外匯回股利所得，在日本可95%免稅，股利所得所隱含的扣繳稅款一樣不得扣抵，若海外扣繳稅款從20%降到10%，不可扣抵減少，可享有更多稅務優惠，其中台商可避免3%重複課稅；但日商扣繳稅大減 稅負優惠較高。台商部分，張豐淦進一步指出，台商從日本匯回台灣的股利所得在日本需先扣繳20%，回台灣雖可扣抵17%的營利事業所得稅，但等於有3%抵不掉；未來稅率降為10%，就不會有抵不掉的重複課稅問題，因此，雖然對雙方營利事業都有稅務優惠，但兩相比較下，初期日本企業可享受的優惠比台商高一些。張豐淦說，租稅協定的租稅優惠可促進台商赴日本投資意願，例如取得日本專業技術，增加台商研發生產競爭力，建議在協定生效前，有投資日本的台商可儘速檢視投資架構是否有重新調整的需要，以俾利用台日租稅協定上路後的租稅優惠。張豐淦強調，協定上路後，企業可與雙邊稅局簽署制定雙邊預先訂價協議，雙邊稅局可通過協議的磋商機制，雙邊相對應調整費用所得，避免重複課稅，可增加企業在稅負的安定性。針對有投資日本股票債市的基金業者，由於基金業者投資也需在日本繳稅，未來協定生效後，可降低基金業者營運成本。,"[['衆信國際租稅負責人張豐淦', '表示', '租稅協定可避免重複課稅'], ['租稅協定', '可避免', '重複課稅'], ['臺日經濟貿易會議', '簽訂', '避免雙重課稅協定'], ['張豐淦', '指出', '扣抵'], ['日方', '匯', '所得'], ['臺商', '避免', '重複'], ['3%', '重複', '課稅'], ['張豐淦', '指出', '日本匯股利所得扣繳20%'], ['日本匯股利所得', '扣繳', '20%'], ['回臺灣', '扣抵', '營利事業所得稅'], ['張豐淦', '說', '租稅優惠促進臺商赴日本意願'], ['租稅優惠', '促進', '臺商赴日本意願'], ['臺商', '赴', '日本'], ['臺商', '赴', '日本'], ['投資架構', '有', '調整需要'], ['張豐淦', '強調', '企業簽署訂價協議'], ['企業', '簽署', '訂價協議'], ['雙邊', '相對應', '調整費用所得'], ['針對', '有', '日本股票債市']]"
0,20151127_2043,永豐期貨台指選擇權盤前－法人回防期現貨同步買超站回8500◆盤勢分析期貨走勢週四上漲118點收在8502點。價差方面，正價差擴至17.1點，電子期轉為正價差至0.16點，金融期正價差縮至0.32點，摩台期指正價差擴至0.93點。由籌碼面來觀察，三大法人於現貨市場買超104.98億；而在淨部位方面，三大法人多單加碼5153口，淨多單升至15018口，其中外資多單加碼4400口，淨多單升至24133口；另外十大交易人中的特定法人，全月份多單加碼2792口，淨多單升至21987口，顯示目前法人與大額交易人對台股短線仍維持中性偏多預期。期貨行情走勢方面，歐美股市周三呈現不同調，帶動週四早盤以小漲28點開在季線上下，而現貨開盤開高後預估量能連三日不足800億元，整體亞股也因歐美感恩節假期效應交投清淡，但在前日跌破季線但收盤帶出一長下影線走勢現明顯出現多方回防走勢，在法人期現貨同步多單加碼下，指數一路開高走高終場站上8500點。技術面觀察，週四大盤開平走高以帶長紅K站上8500點整數大關，而成交量能微增至近800億水準，短線量價結構在多方築底情況下出現了第一日的反攻。而均線近期仍呈現糾結但近期有翻揚的走勢下，趨勢轉為震盪整偏多格局。短線維持高檔震盪整理操作上建議可在月線與半年線間來回操作並請嚴設停損。選擇權分析選擇權從成交量來觀察，12月份買權集中在8600點，賣權集中在8200點。未平倉量部份，買權大量區至8800點，而賣權大量區至8000點。全月份未平倉量put/call ratio由0.92升至1.04，反應選擇權結構再度轉朝中性偏多格局發展。12月買權平均隱含波動率由15.30%降至15.24%，賣權平均隱含波動率由18.76%降至17.94%，買賣權同步降，週四指數震盪走高以紅站回季線，但目前短線型態仍為區間震盪整理格局，操作上建議逢反彈仍以買權空頭價差策略因應。,"[['永豐期貨臺', '指', '期貨走勢上漲118點'], ['期貨走勢', '上漲', '118點'], ['電子期', '轉爲', '正價差0.16點'], ['正價差', '縮擴至', '0.93點'], ['三大法人', '加碼', '5153口'], ['三大法人', '加碼升至', '15018口'], ['法人', '維持', '多預期'], ['預估量', '不足', '800億元'], ['收盤', '帶', '下影線走勢'], ['指數一路', '開高走', '高終場站'], ['開平', '走', '高'], ['成交量', '增至', '800億水準'], ['量價結構', '出現', '第一日反攻'], ['均線', '呈現', '糾結'], ['趨勢', '轉爲', '多格局'], ['12月份買權', '集中在', '8600點'], ['大量區', '至', '8000點'], ['0.92升', '至', '1.04'], ['短線型態', '爲', '震盪格局']]"
0,20151127_2044,"元大期貨台股期指盤前－多方收復昨失土 期指挑戰八千五◆盤勢分析週四多方大舉反攻，在早盤便開高28點，直接站上8400點，而且在買盤持續追價下，期指一度攻上8500點，隨後在月均線壓力和多方獲利了結賣壓出籠下，約9:32左右受到約6,200口大單下殺，漲幅略有收斂，不過期指仍位於高檔震盪，終場收漲118點，結算價為8499點，多方已重掌盤勢，後續有機會突破8500點；期現貨價差由逆轉正至14點，舊制選擇權波動率指數由17.08下降至16.11，都顯示市場風險意識降溫。觀察法人籌碼變化，三大法人合計買超現貨105億元，來到15個交易日來的新高，其中外資買超96.2億元，自營商買超10.1億元；由留倉淨部位來看，三大法人同步向多方傾斜，外資大舉加碼淨多單4,400口至24,133口，自營商也小幅減碼淨空單439口至874口，整體三大法人合計淨多單增加5,153口至15,018口，顯示三大法人對後市看法偏向正面。在技術面上，台股成交金額為793億元，量能沒有明顯增加；由各類期指來看，電子期延續週三的反彈力道，加上聯發科等權值股助漲，終場來到所有均線之上，非金電期也大漲1.85%，僅金融期於盤中漲幅收斂，日線留有長上影線，表現相對較弱；收盤價改寫11/11日以來高點，終止連3黑K並回收前2個交易日的跌幅，短期均線和季線也都遭到突破，顯示反彈的動能仍強。","[['收復昨失土', '期指', '挑戰八千五盤勢'], ['左右32', '受到', '6'], ['漲幅', '略有', '收斂'], ['期指', '位於', '震盪'], ['結算價', '爲', '8499點'], ['後續', '有', '機會'], ['現貨價差', '逆轉正至', '14點'], ['舊制選擇權波動率指數', '下降至', '16.11'], ['，', '來到', '15個交易日'], ['由', '留', '倉淨'], ['自營商', '減', '淨空單'], ['自營商', '減至', '874口'], ['三大法人', '偏向', '正面'], ['成交金額', '爲', '793億元'], ['非金電期', '大漲', '1.85%'], ['短期均線', '遭到', '突破']]"
0,20151127_2045,◆外資連續5日買超個股外資連續5日買超個股1.外資連續買超5日的股票(2317)鴻海  、 (2377)微星  、 (2330)台積電、 (3231)緯創  、 (4938)和碩2.外資連續買超4日的股票(2317)鴻海  、 (2377)微星  、 (2330)台積電、 (4938)和碩  、 (3231)緯創3.外資連續買超3日的股票(2377)微星  、 (2330)台積電、 (3231)緯創  、 (2317)鴻海  、 (2881)富邦金4.外資連續買超2日的股票(2377)微星  、 (2330)台積電、 (2317)鴻海  、 (3231)緯創  、 (2406)國碩5.外資當日(26)買超的股票(2330)台積電、 (2317)鴻海  、 (3481)群創  、 (3231)緯創  、 (2303)聯電,[]
0,20151127_2046,◆投信連續3日買超個股投信連續3日買超個股1.投信連續買超3日的股票(1704)榮化  、 (2345)智邦  、 (2485)兆赫  、 (6505)台塑化、 (2303)聯電2.投信連續買超2日的股票(2485)兆赫  、 (1704)榮化  、 (2345)智邦  、 (6505)台塑化、 (2303)聯電3.投信當日(26)買超的股票(2485)兆赫  、 (1704)榮化  、 (2303)聯電  、 (1215)卜蜂  、 (8105)凌巨,[]
0,20151127_2047,◆外資連續5日賣超個股外資連續5日賣超個股1.外資連續賣超5日的股票(2615)萬海  、 (3474)華亞科、 (2890)永豐金、 (2887)台新金、 (2354)鴻準2.外資連續賣超4日的股票(2615)萬海  、 (3474)華亞科、 (2002)中鋼  、 (2887)台新金、 (2890)永豐金3.外資連續賣超3日的股票(3474)華亞科、 (2615)萬海  、 (2887)台新金、 (2890)永豐金、 (2002)中鋼4.外資連續賣超2日的股票(2615)萬海  、 (2887)台新金、 (2002)中鋼  、 (2890)永豐金、 (3045)台灣大5.外資當日(26)賣超的股票(2002)中鋼  、 (2890)永豐金、 (3045)台灣大、 (2615)萬海  、 (9933)中鼎,"[['外資', '賣', '個股外資']]"
0,20151127_2048,【鉅亨-盤前掃瞄】基本面1.26日交易日以32.701元兌1美元作收，收盤貶 5.40分， 成交值為 8.38億美元。2.集中市場26日外資買超 96.1億元，投信賣超  1.2億元，自營商買超 10.0億元。3.集中市場26日融資餘額較前1日減少 4.92億元，成為1460.77億元，融券餘額較前1日減少  227張，成為559988張。,"[['成交值', '爲', '8.38億美元'], ['26日外資', '買', '96.1億元'], ['自營商', '買超', ' 10.0億元'], ['26日融資餘額', '減少', '4.92億元']]"
0,20151127_2049,◆投信連續3日賣超個股投信連續3日賣超個股1.投信連續賣超3日的股票(2311)日月光、 (2883)開發金、 (2377)微星  、 (2313)華通  、 (2002)中鋼2.投信連續賣超2日的股票(2377)微星  、 (2311)日月光、 (2883)開發金、 (2002)中鋼  、 (2313)華通3.投信當日(26)賣超的股票(2883)開發金、 (2002)中鋼  、 (2377)微星  、 (2313)華通  、 (2618)長榮航,[]
0,20151127_2050,【鉅亨-盤前掃瞄】技術面1.5日均線 8447.47點，10日均線 8408.44點，20日均線 8519.50點。2.6日RSI為 69.67，12日RSI為46.90。3.9日K值為 68.77，9日D值為55.25。4.20日乖離率為 -0.41。,"[['2.6日RSI', '爲', '69.67'], ['RSI', '爲', '46.90'], ['K值', '爲', '68.77'], ['D值', '爲', '55.25'], ['日乖離率', '爲', '0.41']]"
0,20151127_2051,明基醫：明基醫已於104年11月26日舉行上櫃前業績發表會。第三十四條　第42款1.事實發生日:104/11/272.公司名稱:明基三豐醫療器材股份有限公司3.與公司關係(請輸入本公司或聯屬公司):本公司4.相互持股比例(若前項為本公司，請填不適用):不適用5.發生緣由:明基醫已於104年11月26日舉行上櫃前業績發表會。 1.業績發表會簡報檔已於104/11/25上傳至公開資訊觀測站。 2.業績發表會影音檔敬請各位投資先進點閱本公司之網站   http://www.BenQMedicalTech.com   或https://www.youtube.com/channel/UCBrNp2N0lxrjNqmUwIr4ORQ6.因應措施:無。7.其他應敘明事項:無。,"[['明基醫', '舉行', '業績發表會'], ['前項', '爲', '本公司'], ['明基醫', '舉行', '業績發表會'], ['業績發表會簡報檔', '上傳至', '公開資訊觀測站']]"
0,20151126_2052,連營：本公司董事會通過背書保證達公開發行公司資金貸與及背書保證處理準則第二十五條第一項第二款之公告第三十四條　第19款1.事實發生日:104/11/262.被背書保證之:(1)公司名稱:佛山市南海加倫電機有限公司(2)與提供背書保證公司之關係:100%持有之孫公司(3)背書保證之限額(仟元):9696(4)原背書保證之餘額(仟元):0(5)本次新增背書保證之金額(仟元):8750(6)迄事實發生日止背書保證餘額(仟元):8750(7)被背書保證公司實際動支金額(仟元):8750(8)本次新增背書保證之原因:擔保南海加倫與原股東間股東借款之還款保證3.被背書保證公司提供擔保品之:(1)內容:無(2)價值(仟元):04.被背書保證公司最近期財務報表之:(1)資本(仟元):57915(2)累積盈虧金額(仟元):-491465.解除背書保證責任之:(1)條件:清償借款之50%退還保證金至保證金全部消除止(2)日期:清償借款之50%退還保證金至保證金全部消除止6.背書保證之總限額(仟元):161607.迄事實發生日為止，背書保證餘額(仟元):87508.迄事實發生日為止，A提供背書保證餘額占公開發行公司最近期財務報表淨值之比率:27.079.迄事實發生日為止，背書保證、長期投資及資金貸與餘額合計數達該公開發行公司最近期財務報表淨值之比率:34.6010.其他應敘明事項:無,"[['本公司董事會', '通過', '資金貸第二十五條'], ['與', '提供', '背書保證公司'], ['.保證', '保證', '公司提供之'], ['公司', '提供', '之'], ['保證金至保證金', '消除', '止6'], ['A', '提供', '財務報表淨值比率'], ['背書保證', '達', '發行財務報表淨值比率']]"
0,20151126_2053,上市櫃公司前3季稅前賺1.4兆 3公司無法出具財報金管會今(26)日公布上市櫃公司第3季財報，整體累計稅前淨利為1兆4227億元，較去年同期增加1023億元，成長幅度7.75%，然而，有3家上櫃公司因無法出具財務報告，已禁止股票交易，這3家公司分別是揚華科技(4703-TW)、佳營電子(6135-TW)及宇加科技(6250-TW)。金管會表示，上市櫃公司未如期出具財報，會遭罰24萬元並於30天內補正；若仍未保正再罰24萬元，並可視情況加重罰金，超過6個月不出具，則強制下市櫃。3家未出具財報的公司中，揚華科技與佳營電子已經連續2季未提出財報，若2016年2月19日前仍未出具財報，依規定就得下櫃。,"[['上市櫃公司', '賺', '3'], ['稅前', '賺', '3'], ['稅前淨利', '爲', '1兆4227億元'], ['會', '表示', '遭24萬元'], ['上市櫃公司', '出具', '財報'], ['未', '出具', '財報'], ['揚華科技', '提出', '財報']]"
0,20151126_2054,連營：公告本公司董事會通過聘任新任執行副總第三十四條　第11款1.人員變動別（請輸入發言人、代理發言人、重要營運主管、財務主管、會計主管、研發主管或內部稽核主管）:執行副總2.發生變動日期:104/11/263.舊任者姓名、級職及簡歷:無4.新任者姓名、級職及簡歷:蔡鴻傑、執行副總、云辰電子業務副總5.異動情形（請輸入「辭職」、「職務調整」、「資遣」、「退休」、「死亡」或「新任」）:新任6.異動原因:新任7.生效日期:104/11/268.新任者聯絡電話:02-2999-75559.其他應敘明事項:無,[]
0,20151126_2055,連營：公告本公司董事會推選副董事長第三十四條　第11款1.人員變動別（請輸入發言人、代理發言人、重要營運主管、財務主管、會計主管、研發主管或內部稽核主管）:副董事長2.發生變動日期:104/11/263.舊任者姓名、級職及簡歷:不適用4.新任者姓名、級職及簡歷:陳銘銓、副董事長、本公司董事5.異動情形（請輸入「辭職」、「職務調整」、「資遣」、「退休」、「死亡」或「新任」）:新任6.異動原因:新任7.生效日期:104/11/268.新任者聯絡電話:02-2999-75559.其他應敘明事項:無,"[['2副董事長', '發生', '變動日期']]"
0,20151126_2056,投信投顧募集基金 金管會擬鬆綁為利投信投顧事業發展，即時因應市場需求募集或追加募集基金，金管會今(26)日預告，擬鬆綁基金募集條件，包含投信募集或追加募集基金不用逐案經董事會通過，且投顧經營全權委託業務無需設立滿2年。金管會預告修正「證券投資信託事業募集證券投資信託基金處理準則」，及「證券投資信託事業證券投資顧問事業經營全權委託投資業務管理辦法」部分條文草案。目前投信募集或追加募集基金都需要逐案報董事會通過，　證期局主秘周惠美表示，未來放寬後，經理部門可就當年度或一定期間內預計募集的基金計劃，提報董事會通過，無需再逐案送董事會。同時，金管會也將放寬新投信首檔基金募集門檻，從30億元下調為20億元，閉鎖期也從6個月縮短為3個月，募集期間從不可展延，開放可展延。,"[['金管會', '擬', '爲'], ['金管會', '擬', '爲'], ['金管會擬爲發展', '募集', '募集基金'], ['經營委託業務', '無需', '設立'], ['投信募集基金', '需要', '通過'], ['證期局主祕周惠美', '表示', '經理部門預計基金計劃'], ['經理部門', '預計', '基金計劃'], ['金管會', '放寬', '基金募集門檻']]"
