,News,All,SVO
0,20151019_3343,上市建商國揚計畫發行12億元CB進行市場籌資上市建商國揚實業()今天由董事會決議將發行可轉換公司債(CB)籌資12億元，主要是因應工程需要財務規劃，擬籌措中長期資金，這是今年以來繼國建()、興富發()、達麗()等上市建商發債籌資之後，計畫以發行CB籌資的上市建商。國揚實業2015年1-9月營收22.91億元，年增率達58.73%。國揚在2015年第4季將有總銷27.8億元的台南別墅型產品「翡翠山林第一期」完工交屋，目前銷售率已達4成多，此一建案國揚占60%，其潛在掌握營收約6億多元，若今年內可以全數交屋，營收將再度回升。而2016年國實業可售成屋案量超過40億元，其中包括台南的「翡翠山林第一期」、高雄的「國硯」等案；另外，台南「翡翠山林第二期」將會在年底完工，明年可以加入成屋銷售。國揚明年下半年總銷超過20億元汐止商辦產品「雲端」將完工交屋，目前銷售率已達75%。,"[['建商國揚', '計劃', '發行12億元CB'], ['建商國揚', '計劃', '發行12億元CB'], ['籌資', '是', '工程需要財務規劃'], ['工程', '需要', '財務規劃'], ['這', '是', '上市建商'], ['年增率', '達', '58.73%'], ['國揚', '有', '完工'], ['銷售率', '達', '4成多'], ['此一建案國揚', '佔', '60%'], ['屋案量', '超過', '40億元'], ['總銷', '超過', '20億元'], ['總銷', '超過', '20億元'], ['商辦產品雲端', '完工', '交屋'], ['銷售率', '達', '75%']]"
0,20151019_3344,華信投顧－維持強勢格局◆盤勢分析今天中國大陸公佈的第三季GDP成長率為6.9%，低於中國政府7%的目標，但高於法人預估的6.8%。數字之巧妙，令大多數市場人士都認為，此數字有作假之嫌疑。但無論是真是假，今天中國大陸股市，雖然僅收小黑十字線，但以上海綜合指數而言，今天跳空突破13週線(季線)，雖然盤中一度回探，但收盤指數仍能站上13週線，似乎顯示陸股似弱實強。就技術面而言，上海綜合指數若能繼續站穩13週線兩天，就極有可能繼續展開波段反彈走勢。如同我們之前所說，只要陸股維持強勢，台灣股市就有機會再創新高。本週三平倉，外資的態度，還是決定以及台股走勢的最主要因素。到今天為止，外資持有的多單部位，仍高達近2.1萬口；而今天、和也都繼續維持強勢，顯示外資仍然持續流入亞洲股匯市。既然外資持續流入，已流入的外資又沒有外流的跡象，因此我們認為，短期內台股應該還是可以維持強勢格局。如果明天陸股能夠再度轉強，台股將可望維持驚驚漲走勢，至少到本週三，甚至不排除持續到下週二、三的可能。不過，選股則應該特別小心。對於部分波段漲幅已大的個股，暫時以觀望為原則，反倒是位階較低、具有補漲空間的個股，還是值得注意。李永年 分析師★ 此研究報告著作權屬華信證券投資顧問(股)公司，切勿盜用或翻印，否則追究責任，決不寬貸 ★ 所有資料僅供參考，本公司不負盈虧責任,"[['華信', '投顧', '維持強勢格局盤勢'], ['－', '維持', '強勢格局'], ['第三季GDP成長率', '爲', '低於中國政府目標'], ['，', '低於', '中國政府'], ['此數字', '有', '作假嫌疑'], ['中國大陸股市', '收', '十字線'], ['上海綜合指數', '站穩', '13周線'], ['臺灣股市', '維持', '有機會'], ['本週三平倉', '還是', '主要因素'], ['多單部位', '高達', '近2.1萬口'], ['和', '維持', '強勢'], ['外資', '流入', '亞洲股匯市'], ['流入外資', '沒有', '外流跡象'], ['我們', '認爲', '臺股維持強勢格局'], ['臺股', '維持', '強勢格局'], ['臺股', '維持', '漲走勢'], ['此研究報告著作', '權屬', '股顧問公司'], ['所有資料', '僅供參考', '不負盈虧責任']]"
0,20151019_3345,倫元投顧－洞悉法人8600大換股◆盤勢分析美股持續反彈收高，台股今天主要靠拉抬金融和台塑集團來撐指數，抵消因蘋概股相對弱勢而令電子指數收黑，終場指數以上漲26點收在8631點，成交量為802億。不論從上週台積電下修今年半導體至零成長，近日市場傳言iphone 6s銷售低預期、並針對相關零組件先砍單15%，都很清楚告訴我們兩件事，第四季許多電子股將是旺季不旺，故對政府官員聲稱第四季外銷出口將改善轉為正成長，就勿抱以過度樂觀態度。其次以台積電為主的半導體股和蘋概股，大多數不是權值股就是中高價股，所佔權值也較重，若它們短期高點不多且還有下修疑慮的話，則還能期望來到8670的台股(半年線將慢慢下滑至8800上下)，短期上面還能有多少空間可期。王信傑 分析師★ 此研究報告著作權屬倫元證券投資顧問(股)公司，切勿盜用或翻印，否則追究責任，決不寬貸 ★ 所有資料僅供參考，本公司不負盈虧責任,"[['倫元', '投顧', '洞悉法人8600大換股盤勢'], ['－', '洞悉', '法人8600大換股'], ['臺股', '靠', '撐指數'], ['靠', '拉抬', '金融'], ['終場指數以上', '漲', '26點'], ['成交量', '爲', '802億'], ['爲主半導體股', '不是', '權值股'], ['短期上面', '有', '多少空間可期'], ['所有資料', '僅供參考', '不負盈虧責任']]"
0,20151019_3346,外資上周買超263億元 買聯電、最多 大賣金融股台股上周雖震盪整理居多，但周五仍挺進8600點，證交所統計，外資上周對台股仍站買方，買超台股263億元，買超最多個股集中電子股，最多是聯電()，買超9.2萬張，其次是群創()與鴻海()，買超張數分別是8.4萬張與5.7萬張，賣超則以金融股居多，調節開發金()、兆豐金()與中信金()最多，分別調節3.4萬張、2.0萬張與1.65萬張。證交所統計，外資上周買超台股263億元，買超個股前三名分別是聯電、群創與鴻海，買超張數分別是9.2萬張、8.5萬張與5.7萬張。賣超個股最多則是開發金，賣超3.4萬張，其次是兆豐金與中信金，賣超2.9萬張與1.65萬張。累計今年初至上周五止，外資累計買超台股金額為857.2億元，持有股票總市值為9.6兆元，占全體上市股票市值38.65%，較10月8日增加2249億元。,"[['賣超', '調節', '8.4萬張'], ['前三名', '是', '聯'], ['買超張數', '是', '9.2萬張'], ['賣個股', '是', '開發金'], ['外資買超臺股金額', '爲', '857.2億元'], ['持有股票總市值', '爲', '9.6兆元']]"
0,20151019_3347,"諾貝爾經濟學家如何看世界？瑞銀「諾貝爾視角」解惑瑞銀今(19)日宣布推出「諾貝爾視角」(Nobel Perspectives)數位平台，將播出約40位諾貝爾經濟學奬得奬者的訪問，這些訪問將會在未來2年內陸續播放。「諾貝爾視角」系列中介紹的諾貝爾經濟科學奬得奬者包括有Kenneth J. Arrow、James M. Buchanan Jr.、Gerard Debreu, Lawrence R. Klein、Finn Kydland、Wassily Leontief、Sir Arthur Lewis、James E. Meade、Merton H. Miller、Christoper Pissarides、Alvin E. Roth、Paul A. Samuelson、Theodore W. Schultz、William F. Sharpe、Herbert A. Simon 及 Robert M. Solow。瑞銀指出，今日首播探討博弈論學者阿爾文·羅思(Alvin E. Roth)的學說，在未來數周和數月內還會在網站新增更多訪問和材料，以及《臥底經濟學人》("" Undercover Economist"")  Tim Harford 和瑞銀環球經濟師唐納文 (Paul Donovan) 的評論和分析。瑞銀集團傳訊暨品牌部主管Hubertus Kuelps表示，這些思想領袖的學說解答了經濟學許多大問題，商業和文化主要都是通過這些研究形成，能夠設立平台介紹諾貝爾得奬者及他們的成就，實感振奮。","[['瑞銀諾貝爾視角', '解惑', '宣佈推出諾貝爾視角數位平臺'], ['諾貝爾經濟科學獎得獎者', '包括', '有Kenneth J. ArrowJames M. Buchanan Jr'], ['瑞銀', '指出', 'Alvin學說新增更多訪問'], ['阿爾文·羅思', 'Alvin', 'E. Roth'], ['(', 'Alvin', 'E. Roth'], ['Alvin學說', '新增', '更多訪問'], ['Kuelps', '表示', '思想領袖學說解答大問題'], ['思想領袖學說', '解答', '大問題'], ['平臺', '介紹', '諾貝爾得獎者'], ['平臺', '介紹', '諾貝爾得獎者']]"
0,20151019_3348,永豐期貨台指選擇權盤後－金融續強帶動指數攀高收紅 短線震盪趨堅◆盤勢分析期貨走勢週一上漲17點收在8624點。價差方面，轉為逆價差7.5點，電子期逆價差擴至1.72點，金融期轉為正價差2.15點，摩台期轉違逆價差0.25點。由籌碼面來觀察，三大法人於現貨市場持續買超57.01億；而在淨部位方面，三大法人多單加碼2062口，淨多單升至16466口，其中外資多單加碼20口，淨多單升至20965口；另外十大交易人中的特定法人，全月份多單加碼880口，淨多單升至13017口，反應法人與大額交易人對台股短線續彈預期仍持續未變。期貨行情走勢方面，周一歐美股市持續反彈走高，帶動週一早盤以上漲20點開出，而現貨開高後期貨在陸股開盤前劇烈上沖下洗，短短20分鐘成交25397口佔全日成交量1/4，且震盪幅度高達80點以上，但台股仍在金融股轉強撐盤下尾盤拉高，最終期貨以小漲17點作收。技術面觀察，週一大盤開高走高以帶上下影線十字紅K守穩5日線支撐，但成交量能縮小至804億水準，短線量價結構轉向不利多方續航。而以日線型態來看，目前指數日K仍力守5日線不破並持續創下波段新高，但目前指數波段反彈以來再現竭盡缺口，而多項技術指標出現背離格局，趨勢仍為高檔整理格局。操作上建議可在月線與8700點間來回操作並請嚴設停損。選擇權分析選擇權從成交量來觀察，10月份買權集中在8600點，賣權亦集中在8600點。未平倉量部份，買權大量區上移至8800點，而賣權大量區至8400點。全月份未平倉量put/call ratio由1.39降至1.38，反應選擇權結構仍呈現中性偏多格局。10月買權平均隱含波動率由11.5%升至11.71%，賣權平均隱含波動率由14.39%升至17.78%，買賣權同步上升，週一指數震盪收紅仍站於所有短中天期均線之上，在短線偏多格局不變下操作上建議逢拉回於8400-8700點以買權多頭價差策略因應。,"[['永豐期貨臺', '指', '震盪趨堅盤勢'], ['震盪', '趨', '堅'], ['震盪', '趨', '堅'], ['期貨走勢', '收在', '8624點'], ['金融期', '轉爲', '正價差2.15點'], ['三大法人', '加碼', '2062口'], ['震盪幅度', '高達', '80點以上'], ['十字紅K', '守', '5日線'], ['十字紅K', '守', '5日線'], ['成交量', '縮小至', '804億水準'], ['量價結構', '轉向', '多方續航'], ['指數日K', '力守', '5日線'], ['技術指標', '出現', '背離'], ['趨勢', '爲', '整理格局'], ['10月份買權', '集中在', '8600點'], ['賣權', '集中在', '8600點'], ['1.39由', '降至', '1.38'], ['反應選擇權結構', '呈現', '偏格局'], ['中性', '偏', '多'], ['收紅', '站於', '中天期均線之上'], ['拉回', '於', '多頭價差']]"
0,20151019_3349,群益期貨台股期權盤後－大立光跌逾5% 電子期相對疲軟◆盤勢分析中國大陸今天公布Q3GDP年增率6.9%，略為高於預期，陸股的走勢目前為止挺在頸線之上，也就是說回測頸線之後並沒有跌破，看起來仍持穩，大陸持穩則全球股市暫時不會有股災，而台股也呈現上下洗刷的局面，成交量還萎縮至八百億，在類股表現上電子期反而率先走弱，轉變成金融期走強。外資期貨淨多單在10月合約快要結束的時候仍持有兩萬多口，估計在高檔結算的機率較大。在10月份選擇權籌碼中，整體賣權OI大於買權OI的口數擴增至十八萬七千多口，屬偏多的結構。本月份賣權OI總口數已經快要接近上個月合約，盤勢不易跌。綜合以上，雖然台股近期的走勢並不強，但目前國際股市的氛圍因為陸股走穩而有比較穩定的走勢，台股也不會有不好的表現，況且本月份賣權OI不僅遠大於買權OI，甚至已經快要逼近上個月賣權OI，盤勢不易有大跌的走勢，溫吞盤堅。,"[['大立光跌', '逾', '疲軟盤勢'], ['中國大陸', '公佈', '6.9%'], ['臺股', '有', '股災'], ['多單', '持有', '兩萬多口'], ['買權OI口數', '擴增至', '十八萬七千多口'], ['總口數', '接近', '合約'], ['臺股', '有', '不好表現'], ['本月份賣權OI', '大於', '買權OI'], ['盤勢', '有', '大跌走勢']]"
0,20151019_3350,鉅亨晚報2015年10月19日◇重要新聞內容■■建商減量保價 北市新屋供給腰斬■主計總處擬編制 財富分配統計◇財經新聞■漢微科Q4營運彈升 明年展望樂觀■A9蓄勢待發 宏達電股價衝高突破80元■陸廠併超微封測廠擴張版圖 日月光、矽品股價雙雙走跌■全球崩跌趨緩 華爾街資金大幅度回流■雅虎高層又出走 開發長赴電子支付公司Square任職■習今訪英 共啟中英時代[NT:PAGE=$]◇重要指標■◇亞洲股市■■■■■■■◇台北匯市■兌美元匯價收盤升8.7分，達32.418元，成交金額5.9億美元。開盤價為32.535元，盤中最高32.270元、最低32.540元。,"[['主計總處', '擬', '編制'], ['華爾街資金', '迴流', '走跌版圖'], ['習今', '訪', '英'], ['開盤價', '爲', '32.535元']]"
0,20151019_3351,元大證捐贈台中統領大樓13樓辦公空間有感於台灣正邁向高齡化社會，元大證券為善盡企業社會責任，捐贈旗下資產「台中統領大樓」13樓270坪的辦公空間，予弘道老人福利基金會做為中部辦公室和展場使用，期望藉此拋磚引玉喚起大眾一同重視熟齡照護。據行政院統計，2025年我國65歲以上的高齡人口比率將超過20%，屆時台灣將進入超高齡社會，因此，弘道老人福利基金會自1995年以來，即結合政府、民間單位和各地社區志工，推動「在地老化」的服務觀念，希望每位長者都能在自己熟悉的地方，安享銀髮生活，近來更陸續推出「微孝行動」、「社區照護」、「不老夢想」等服務，實現長者們照護和圓夢需求。元大證券表示，弘道老人福利基金會於北、中、南分別設立總會及5個服務處，共承租12間辦公室，為該基金會不小的費用負擔，此次捐贈台中市中清路「統領大樓」13樓約270坪的寬廣辦公空間，希望讓弘道老人福利基金會未來發展無後顧之憂，並能順利完成一系列辦公、展場規畫，也期待藉此激發社會正面能量。,"[['辦公空間', '有感於', '臺灣邁向高齡化社會'], ['臺灣', '邁向', '高齡化社會'], ['元大證券', '捐贈', '辦公空間'], ['予弘道老人福利基金會', '做爲', '中部辦公室'], ['拋磚引玉', '喚起', '大衆'], ['高齡人口比率', '超過', '20%'], ['臺灣', '進入', '超高齡社會'], ['弘道老人福利基金會', '結合', '政府'], ['每位長者', '安享', '銀髮生活'], ['元大證券', '表示', '弘道老人福利基金會設立總會'], ['弘道老人福利基金會', '設立', '總會']]"
0,20151019_3352,"亞洲投顧 富貴福臨 籌碼動能 盤後分析◆盤勢分析還是震盪盤，對於指數短線上沒什麼好分析的，因為到目前為止並沒有決定轉折的關鍵性K線出現，雖然有些政治性的雜音，及中國第三季GDP的保7失敗，量能有點不出，但似乎並沒有對全球的股市造成太大的影響，先維持原看法，指數不是現階段的重點，個股表現為主。多數的資金追逐著少數強勢的個股，以近期的操作而言，多空強弱股相當明顯，今天最弱的就屬蘋果供應鍊族群，當然市場上有蘋果的偏空消息，但操作上一定要等到今天有消息才知道不對嗎？月線月線月線，相信在先前的分析裏多次提及，月線破了就是要準備閃人，以大立光而言，月線下彎多久了？股價被月線壓著打多久了，現在就是投機行情，宏達電還能漲停，再生也繼續大漲，這種基本面不優的股可以不買，但擺明有人在玩的情況下，別去放空。強股多數續強，今日又有新股接棒創短波新高，如果你是主力，請問現在你想作什麼？宏達電、倫飛，完全沒聽到主管機關說句話，這是什麼情形？7203點資餘1325億，現在8631點資餘1354億，老話一句，股票是時機財，時機來了，別想太多，設好停損停利即可。作者：亞洲投顧 謝宗霖 分析師以上資料僅供參考,投資時應審慎評估","[['盤勢分析', '還是', '震盪盤'], ['指數', '不是', '現階段重點'], ['多數資金', '追逐', '少數強勢個股'], ['弱的', '屬', '蘋果供應煉族羣'], ['市場上', '有', '空消息'], ['新股接棒', '創', '短波新高'], ['你', '想作', '什麼'], ['主管機關', '說', '句話'], ['股票', '是', '時機財']]"
0,20151019_3353,"亞洲投顧 龍王盤後分析◆盤勢分析必須補量，否則轉弱今天大盤收量縮紅K棒，小漲26點，基本上還是多方控盤，不過明天開始上漲必須補量，否則將會引發空方壓力，造成回測，近期多方都利用盤中回測洗盤，維持類股輪動，算是相當強勢的走法，所以不能轉弱，只要一轉弱就會馬上引來空方壓力打壓，最好不要帶量跌破今天低點8603點。觀察法人籌碼，今天外資多單減少125口，自營商空單減少2315口，選擇權外資中性布局，暫定為避險單，自營商偏空布局，所以今天短線上整體操作屬於中性布局，整體未平倉籌碼還是偏多布局，外資今天多單小幅度減少，自營商選擇權偏空布局，可能要震盪維持指數結算，尚須觀察是否有連續出場跡象，如果沒有而且價量配合得宜，先攻擊8700點。看一下目前的大盤指數，大盤要消化的套牢賣壓，指數區間8500點~8750點，10/12帶量過8500點區間低點，非常有機會挑戰8750點，所以這波回測從9/30帶量止跌，10/1多方轉強以來，就是多方控盤，只要不再出現量縮上漲或是爆量黑K下跌的空方訊號，就是偏多思考，帶量過8500點可以加碼多方部位，操作這樣看就好了，不用看其他技術指標，那下方支撐呢？10/14低點8515點可以做為近期的關鍵支撐，只要沒有帶量跌破此點位，基本上就是多方控盤，等待大盤挑戰8750點的情況，不用預設高點。至於8750點以上有將近兩個月的套牢賣壓，因此現階段多方要挑戰比較困難，至少要等大盤站穩8500點以上再洗盤整理，量價配合得宜才有機會來挑戰8750點以上，所以現階段先以8750點為多方最大目標點最為適合，那邊可以先設為目前多方的最大停利點。目前操作策略……詳細操作策略都在會員傳真稿……不用心急，順著盤勢走，進退有據，判斷盤勢就是這麼簡單，操作也跟著規劃走，看到什麼訊號就做什麼動作就好，不用摸頭猜底，往勝率大的方向操作，設定好停損，長期就會大賺小賠，穩定獲利。因此目前要操作股票的話還是以短線強勢轉強股為主，個股輪漲，短進短出，例如10/14盤前公開分享給大家的4725信昌化再度漲停，短短四天報酬率26%，就是一個轉強股很好的例子，公開分享3260威剛、3596智易也可以續抱，等待輪漲機會，或是可以注意LED和遊戲類股轉強，也可以當做短進短出的標的。 龍哥與投資朋友分享簡單判斷大盤趨勢的方式，投資朋友看龍哥解盤絕對不會分析技術指標，為什麼呢？因為技術指標都是落後指標，看越多技術指標，行情判斷越複雜，多空判斷越矛盾，反而會影響操作，因此投資朋友只需要先從最簡單的量價關係去著墨，搭配用時間整理出來的型態以及用金錢累積出來的籌碼，這些才有參考價值，只要能夠活用量價、型態、籌碼就能夠精準掌握大盤趨勢。有許多投資朋友問龍哥簡單操盤的情況，龍哥還是簡單說明一下，龍哥簡單操盤分為高勝率短波段當沖以及龍王波段程式指標兩大部分；高勝率短波段當沖，需要盯盤，需要熟練觸價下單，設定好之後就讓電腦去執行，避免人性干擾，比較適合喜愛短線沖銷的團員，但是相對上操作難度會比龍王程式指標還高，不過這套當沖操作技巧已經是當沖能夠穩定獲利方式中最簡單的方式了，如果還是無法熟練，建議直接操作不需要任何技巧的龍王指標，追求長期穩定獲利，簡單操盤簡單獲利。至於龍王指標是龍哥的一套程式交易策略，龍哥花費千萬以上以及三年以上的時間打造這套系統，一般投資朋友能夠這樣花費以及研究嗎？龍哥就是希望帶會員追求長期穩定獲利，成為市場上的贏家，而不是市場主力的提款機。龍王指標結合多項技術分析以及籌碼狀況，這套程式策略從2007年開始回測，每年都是獲利的狀況，每個月平均只會下單6~7次，回測每年平均獲利49萬元，而且還搭配一套加碼策略，穩定績效降低風險，加碼策略也是每年都是獲利的狀況，回測每年平均獲利34.8萬元，合計一組龍王指標回測平均年獲利83.8萬元。投資不用憑感覺，投資不用看趨勢，投資不用聽消息，只需要跟緊程式訊息走，機械化操作就好了，只要注意資金控管即可，不過要提醒有大額資金的投資朋友，一定要請龍哥幫你資金配置，操作更加簡單，去除人性，簡單操盤簡單獲利！這一波龍王指標9/21開始偏空操作，9/25全部出場觀望，9/30開始偏多操作，甚至還包含了加碼操作，不用算之前空方部位的獲利，目前獲利+900點以上，龍王指標不可能買最低賣最高，但是就是能夠穩定獲利，重點是操作非常簡單，不需要任何操作技巧，不用管任何人的說法，只需要跟著訊息走就好了，追求長期穩定獲利，投資朋友不要再當市場主力的提款機了。龍哥有在FACEBOOK成立一個免費的盤中分享社團，盤中會分享進出狀況和績效以及正確的操作概念與心法，盤後會有盤後分析以及盤後影音分析教學，有興趣學習的投資朋友歡迎去搜尋""台股來就發分享團(88988)""。作者：亞洲投顧 股期龍哥 分析師以上資料僅供參考,投資時應審慎評估","[['外資', '減少', '125口'], ['自營商空單', '減少', '中性佈局'], ['自營商', '偏', '空'], ['自營商選擇權', '屬於', '中性佈局'], ['大盤', '賣', '8750點8500點'], ['10/12帶', '量', '非常有機會挑戰8750點'], ['帶', '出現', '思考'], ['10/14低點8515點', '做爲', '關鍵支撐'], ['大盤', '挑戰', '8750點'], ['8750點以上', '有', '套牢兩個月賣壓'], ['套牢', '賣', '壓'], ['大盤', '站穩', '8500點以上'], ['短線強勢', '轉', '強股'], ['一個', '轉', '股'], ['\xa0龍哥', '分享', '判斷大盤趨勢方式'], ['簡單', '判斷', '大盤趨勢'], ['朋友', '看', '分析技術指標'], ['技術指標', '都是', '落後指標'], ['投資', '需要', '著'], ['這些', '有', '參考價值'], ['龍哥', '說明', '龍哥操盤分爲兩大部分'], ['龍哥操盤', '分爲', '兩大部分'], ['當衝', '需要', '盯盤'], ['操作技巧', '是', '簡單方式'], ['操作龍王指標', '不需要', '任何技巧'], ['龍王指標', '是', '交易策略'], ['龍哥', '花費', '千萬以上'], ['龍哥', '希望', '帶成爲市場上贏家'], ['帶', '成爲', '市場上贏家'], ['龍王指標', '結合', '多項技術分析'], ['程式策略', '開始', '回測'], ['績效', '降低', '風險'], ['加碼策略', '也是', '獲利狀況'], ['投資', '不用', '憑感覺'], ['投資', '看', '趨勢'], ['提醒投資朋友', '有', '大額資金'], ['9/30', '開始', '操作'], ['龍王指標', '買', '最高'], ['重點', '是', '簡單'], ['投資朋友', '當', '市場主力提款機'], ['龍哥', '有', '分享社團'], ['投資朋友', '歡迎', '搜尋']]"
