,News,All,SVO
0,20160929_1246,永豐期貨台指選擇權盤前－台指選擇權－量能急凍 台指跌破五日線◆盤勢分析期貨走勢        週一下跌 82 點至 9154 點。價差方面，逆價差縮至 - 40.52 點，電子期轉為逆價差 - 2.81 點，金融期逆價差擴至 - 8.33 點。現貨部分，三大法人賣超 39.59 億元；而在淨部位方面，三大法人多單減碼 4648 口，淨多單降至 23790 口，其中外資多單減碼 1872 口，淨多單降至 78059 口；另外十大交易人中的特定法人，全月份多單減碼 1304 口，淨多單降至 14338 口。台指籌碼面顯示目前法人對指數持中性偏多預期。期貨行情走勢方面，油價大跌與蘋果走弱，帶動以下跌 14 點開出，而現貨開盤跳空開低後便持續震盪走低，雖早盤預估量能不足 600 億元，但蘋概股受到蘋果銷量恐下修影響走弱，加上週一貶值幅度高達一角，權值股無力反彈導致台股疲弱，加上陸股資金緊俏導致股市跌破 3000 點大關，期貨尾盤也震盪走低續弱，終場開低走低以下跌 82 點作收。技術面觀察，週一大盤開低走低以帶下影線小黑 K 失守 9200 點，但成交量能急凍至 542 億水準，短線量價結構仍為區間震盪。以日線型態來看，目前指數跳空跌破 5 日線支撐，所幸所有均線仍為上彎， 多項技術指標低檔交叉，但本波創高再見量價指標雙背離，短線仍不宜積極追高。操作上建議可待指數回測月線不破後偏多操作，並請嚴設停損。     選擇權分析選擇權從成交量來觀察，買權集中在 9300 點，賣權集中在 9000 點。選擇權未平倉量部分，買權未平倉最大量集中在 9500 點，賣權未平倉最大量集中在 8800 點。全月份未平倉量 put/call ratio 值由 1.34 降至 1.25，大於中性值 1，反應籌碼面為偏多架構。買權平均隱含波動率由 11.58% 升至 12.21%，賣權平均隱含波動率由 15.22% 升至 16.21%，買賣權皆升。選擇權部位顯示偏多。本投資研究報告由永豐期貨股份有限公司版權所有，未經授權，禁止轉載節錄。本資料內容僅供參考，客戶應審慎考量本身之需求與投資風險，本公司恕不負任何法律責任，亦不作任何保證。,"[['永豐期貨臺', '指', '期貨盤勢'], ['臺指', '跌破', '五日線'], ['電子期', '轉爲', '逆價差2.81點'], ['三大法人', '減', '4648口'], ['特定法人', '減', '口'], ['臺指籌碼面', '顯示', '偏預期'], ['法人', '持', '中性'], ['指數', '持', '中性'], ['中性', '偏', '多'], ['量能', '不足', '600億元'], ['蘋概股', '受到', '走弱'], ['蘋果銷量', '恐', '下修'], ['期貨尾盤', '導致', '疲弱'], ['以下', '跌', '82點'], ['週一大盤', '走低以', '帶'], ['成交量', '急凍至', '億水準'], ['所有均線', '爲', '上彎'], ['短線', '不宜', '追高'], ['買權', '集中在', '9300點'], ['賣權', '在', '9000點'], ['最大量', '集中在', '9500點'], ['全月份未平倉量', '降至', '1.25'], ['反應籌碼面', '爲', '偏多架構'], ['選擇權部位', '顯示', '多'], ['客戶', '考量', '本身需求'], ['本公司', '恕', '不負任何法律責任']]"
0,20160929_1247,"鉅亨早報─Fed理事談話、台灣央行理監事會《今日前瞻》德國 CPI 初值美國 GDP 終值聯準會 Loretta Mester、Esther George、Jerome Powell 等人談話台灣央行理監事會議《重要新聞》■3 個暗示 台灣央行周四利率不變機率高 ■永慶：66% 民眾看跌 Q4 房市 全年移轉量恐創 26 年新低 ■台灣不易升息？彭總裁說了.. 明年經濟明顯復甦難！■樂陞歹戲拖棚！自救會成員奔走投保中心要中信履約交割 ■賴正鎰：取消打房措施 勿讓地產業繼觀光業後走上街頭 ■2 大議題夾擊新舊房屋 房市恐持續陷不確定泥淖..■樂陞案 中信銀再喊冤 籲速修公開收購制度 ■WEF 全球競爭力台灣排名 14 亞太地區第 4 領先韓國、中國 ■兆豐金將全面建置 KYC 資料庫 且不排除裁撤海外高風險分行 ■兩周前中風入院的以色列政壇元老、前總統佩雷斯（Shimon Peres）周三病逝，終年九十三歲。佩雷斯是以巴和平推手，曾獲頒諾貝爾和平獎。■正式納入 SDR 在即，高盛私人財富管理中國區副主席暨首席投資策略師哈繼銘相信，中央會先求匯率穩定，國際化的步伐暫時不會顯著加快，原因是大陸正面對樓市及債市泡沫，要先處理好這兩大內部風險，否則一旦泡沫爆破，大跌，國際化只會淪為空談。■中國首富、且與現屆政府關係相當密切的萬達董事長王健林警告，中國樓市已失去控制，目前房地產泡沫是「史上最大」，限購、限貸政策仍無法真正見效。■美國總統候選人首場電視辯論的收視率，達到破紀錄的八千四百萬人次，打破了一九八○年民主黨總統候選人卡特與共和黨對手列根電視辯論時的紀錄，當年有八千零六十萬觀眾收看。■美國聯儲局主席耶倫昨在眾議院就金融業監管作證，其間她稱就業情况令人鼓舞，認為按目前經濟的發展趨勢，「大概沒有太多」寬鬆措施需要取消，不過今年可能會採取行動，意味她仍想在今年內加息一次。耶倫在本月議息會議亦預示今年底前可能加息，與多數聯儲局委員預期一致。 芝加哥商品交易所的利率期貨數據顯示，11 月加息的機率只有 8%，但 12 月加息的機率超過五成。■面對美國司法部索取 140 億美元的巨額罰款，德銀資本狀况令市場憂慮。德銀昨宣布同意作價 10.9 億，把英國壽險業務 Abbey Life Assurance 售予英國壽險基金 Phoenix Group，令資本水平微升。德銀股價昨止跌回升，升幅最多達 3.2%，見 10.97 。■前國務委員、中日友好協會會長唐家璇前日在東京會見日本最大在野黨民進黨黨魁蓮舫，並稱為她感到驕傲。唐同日亦會見了日本自民黨總幹事二階俊博。專家指，唐家璇以民間身分訪日，是為中日關係改善摸底，但兩國關係已全面倒退，試圖以民間交流促進關係改善收效甚微。■蘋果公司在中國首家直接投資的研發中心日前在北京中關村朝陽園成立，未來將致力於計算機軟硬件、通訊、音頻和影片設備、消費電子產品技術及信息技術等先進技術的研發，註冊資本 1 億元，投資總額 3 億元，共有員工約 500 人。■軍事專家表示，殲 20 可能在明年年初正式服役，首批列裝部隊的數量可能達到兩位數。■菲律賓駐華大使館近日指出，菲總統特使、88 歲的前總統拉莫斯的訪華之旅已經取消。菲駐華使館並未告知取消的原因，消息人士稱，取消訪華或因為拉莫斯的行程與菲總統杜特爾特的計劃衝突。■世界經濟論壇（World Economic Forum）發表 2016 至 2017 年度全球競爭力報告，連續 3 年排名第 7 的香港今年下跌兩級至第 9 位，主要受到創新科技評分較低拖累。有學者分析香港創科評分與去年相若，但其他國家表現更好，故香港「不進則退」，若不急起直追，未來隨時跌出十大。■近年多番易手大陸財團的香港老牌建築股新昌（404）昨日遭沽空機構匿名分析（Anonymous Analytics）狙擊，指公司現任非執行主席林卓延將有問題及無收入的發展項目注入新昌，令新昌成為主席的「私人垃圾場」，建議強烈沽售，目標價為 0.12 港元。新昌昨日曾急跌 10%，於中午停牌。■中國恒大（3333），昨日突然公布，以總代價 27 億元出售糧油、乳製品及礦泉水三項非核心業務，專注房地產業務。有內房股分析員認為，有買家願意高價購入蝕錢業務「極不合理」，估計交易並非純粹出於投資考慮。■大陸 2016 年國慶假期即將到來，交通部新聞發言人徐成光昨日表示，預計在今年的「十一」周期間，道路、水路的客運量總量將會超過 6.6 億人次。他預計，10 月 1 日、6 日、7 日將出現車流和客流高峰。■2016 中國房地產開發企業品牌價值 50 強榜單，中海地產、恒大和萬科分別以 519.06 億元、392.62 億元和 382.53 億元品牌價值，蟬聯前三強。■全球知名會計師事務所安永昨日發佈《中國海外投資報告》預測，在「一帶一路」等戰略的強力推進下，今年中國對外直接投資料超過 1,700 億美元，再創歷史新高。■美國又再發生警員射殺黑人案，加州一名 30 多歲黑人男子前日在聖迭戈市郊一個商業區附近，從口袋取出一件物件，指向警員，並擺出準備開槍的姿勢，被警方先發制人射殺。警方事後證實死者所持「物件」並非武器，事件觸發大批黑人上街抗議，質疑警方濫殺無辜。■印尼龍目島的林賈尼火山前日傍晚開始爆發，火山灰柱高達 2 公里，導致半空滿佈火山灰。當局截至昨日已疏散超過 1,100 名民眾，暫未收到傷亡報告，又派救援人員撤離現場附近 389 名遊客，當中 333 人為外籍人士。當局已確認約 120 人的位置，並得悉他們正在下山，但仍有逾 250 人未能聯絡上，擔心他們被困山上。■電召汽車服務公司 Uber 正矢志擴展餐飲速遞服務 UberEats，表示將於月內將服務推展至香港、台北等最少 22 個城市，並開始聘請不同崗位人員。■針對近日台灣方面未獲第 39 屆國際民航組織大會（ICAO）邀請函，國台辦新聞發言人馬曉光昨日表示，在這個問題上，台灣方面應該深切地反省，而不是對大陸橫加指責，甚至用所謂的飛航安全作為藉口來誤導台灣民眾。有評論稱，堅持不承認「九二共識」會影響台灣在參與國際事務方面的空間。■南韓決定部署美國的「薩德」防導系統進一步影響到兩國文化交流。南韓媒體透露，南韓女星李英愛主演的電視劇《師任堂：光之日記》，原定下月在中韓兩國的電視台同時播出，但中國至今沒有完成審查，電視台不得不將播出時間延期到明年一月，但很有可能最後不能在中國播出。■美國太空探索科技公司 SpaceX 行政總裁穆斯克 (Elon Musk)，周二公布一項野心勃勃的火星之旅大計，表示要建立一千艘設有客艙的大型太空船，運送人類到火星殖民，最快可於二○二四年實現，每人收費可低至十萬美元。《重要指標》◇ 美洲■美國 9 月消費者信心指數上升至 104.1 預估為 99.3■美國 7 月 S&P/CS20 座大城市房價指數年率 5.02%，預期值 5.10%◇ 歐洲■意大利 7 月零售銷售意外轉跌 0.3%■德國 9 月 Ifo 商業景氣與預期指數意外止跌急彈 109.5■德國 8 月進口物價指數年率 - 2.60%，預期值 - 2.50%，前值 - 3.80%■韓國 9 月消費者信心指數 101.70，前值 102◇亞洲■日本 7 月領先指數終值維持 100 符預期■紐西蘭 8 月貿赤按月增逾兩倍至 12.65 億 ■新加坡 8 月工業生產按年轉升 0.1% 不及預期■中央大學台灣經濟發展研究中心公布 9 月消費者信心指數 (CCI) 調查總數為 78.66 點，較上月下降 0.90 點，連 2 月下滑■中國 1-8 月規模以上工業企業利潤 40600 億元, 前值 35235.9 億元■中國 8 月規模以上工業企業利潤 5348 億元, 前值 5230.1 億元■中國 1-8 月規模以上工業企業利潤年率 8.4% , 前值 6.9%■香港 8 月貿易帳 - 321 億港元，預期值 - 300 億港元，前值 - 333 億港元■台灣 8 月工業產出年率 7.74%，預期值 4%，前值 - 0.31%■中國 9 月 MNI 消費者信心指數 115.2 , 前值 111.5《金融市場》◇美股■工業平均指數收高 110.94 點或 0.61% 至 18339.24 點■Nasdaq 指數收高 12.84 點或 0.24% 至 5318.55 點■ 指數收高 11.44 點或 0.53% 至 2171.37 點■指數收高 1.63 點或 0.20% 至 812.47 點◇歐股■德國 DAX-30 指數收高 76.86 點或 0.74% 至 10438.34 點■英國 FTSE 100 指數收高 41.71 點或 0.61% 至 6849.38 點■法國 CAC 40 指數收高 33.77 點或 0.77% 至 4432.45 點◇亞股■台灣 26 日收收盤跌 90.1 點，跌幅 0.97%，為 9194.52 點，成交金額 539.77 億元。■三大法人 26 日合計買超 39.6 億元。外資及陸資賣超 31.89 億元，投信賣超 1.87 億元，自營商賣超 5.83 億元。■日經 225 指數收高 129.08 點或 0.78% 至 16594.48 點 (周四早盤)■韓國 Kospi 指數收高 14.79 點或 0.72% 至 2067.85 點 (周四早盤)■澳洲 ASX 普通股指數收高 6.50 點或 0.12% 至 5500.20 點 (周四早盤)■上海綜合指數收低 10.04 點或 0.33% 至 2988.13 點■香港收高 47.75 點或 0.20% 至 23619.65 點◇■COMEX 收跌 6.70 美元，收於每盎司 1323.70 美元◇原油■NYMEX 原油期貨收漲 2.38 美元，至每桶 47.05 美元■ICE 倫敦 布倫特原油期貨收漲 2.72 美元，至每桶 48.69 美元◇穀物■CBOT 玉米期貨下跌 2.50 美分，報每英斗 3.2925 美元■CBOT 小麥期貨下跌 0.75 美分，報每英斗 4.0325 美元■CBOT 黃豆期貨下跌 7.00 美分，報每英斗 9.4550 美元◇匯市■兌美元 26 日收盤 31.432 元，貶 1.02 角，成交金額 7.4 億美元。開盤價為 31.375 元，最高 31.375 元、最低 31.446 元。■美元 / 報 6.6730，貶 0.0000 或 0.00%■報 95.3800，貶 0.0510 或 0.05%■美元 / 報 100.9630，升 0.2470 或 0.25%■ / 美元報 1.1221，升 0.0005 或 0.04%■ / 美元報 1.3038，升 0.0020 或 0.16%■美元 / 報 0.9708，貶 0.0005 或 0.05%■美元 / 報 1.3065，貶 0.0027 或 0.21%■ / 美元報 0.7691，升 0.0003 或 0.04%","[['彭總裁', '說', '難'], ['會成員', '奔走', '投保中心'], ['財富管理中國區副主席', '相信', '穩定'], ['原因', '是', '對'], ['大陸', '對', '樓市泡沫'], ['國際化', '淪爲', '空談'], ['萬達董事長王健林', '警告', '中國樓市失去控制'], ['中國樓市', '失去', '控制'], ['房地產泡沫', '是', '最大'], ['電視辯論收視率', '達到', '破紀錄八千四百萬人次'], ['她', '稱', '令人'], ['寬鬆措施', '需要', '取消'], ['她', '想', '加息'], ['利率期貨數據', '顯示', '加息機率超過五成'], ['加息機率', '超過', '五成'], ['德銀昨', '宣佈', '同意10.9億'], ['國務委員唐家璇', '會見', '黨魁蓮舫'], ['唐同日', '見', '二階俊博'], ['專家', '指', '兩國關係倒退'], ['民間身分訪日', '是', '改善'], ['軍事專家', '表示', '殲 20服役'], ['列裝部隊數量', '達到', '兩位數'], ['菲律賓駐華大使館', '指出', '總統特使'], ['駐華使館', '告知', '取消原因'], ['消息人士', '稱', '取消訪華'], ['World EconomicForum', '發表', '全球競爭力報告'], ['學者', '分析', '更好'], ['非執行主席林卓延', '注入', '新昌'], ['目標價', '爲', '0.12港元'], ['新昌', '跌', '10%'], ['內房股分析員', '認爲', '有合理'], ['買家', '願意', '購入蝕錢業務'], ['交易', '出於', '投資考慮'], ['新聞發言人徐成光', '表示', '預計客運量總量超過6.6億人次'], ['客運量總量', '超過', '6.6億人次'], ['他', '預計', '出現車流'], ['強榜單', '蟬聯', '前三強'], ['會計師事務所安永', '發佈', '預測直接投資料超過700 億美元'], ['直接投資料', '超過', '700 億美元'], ['美國', '發生', '警員射殺黑人案'], ['黑人男子', '取出', '一件物件'], ['死者持物件', '並非', '武器'], ['事件', '觸發', '大批黑人上街'], ['警方', '濫殺', '無辜'], ['林賈尼火山', '開始', '爆發'], ['火山灰柱', '高達', '2公里'], ['當局疏散', '超過', '1'], ['100名民衆', '收到', '傷亡報告'], ['當中333', '人爲', '外籍人士'], ['當局', '確認', '120人位置'], ['他們', '困', '山'], ['正矢志', '擴展', '餐飲速遞'], ['國臺辦新聞發言人馬曉光', '表示', '臺灣方面反省'], ['評論', '稱', '堅持承認九二共識影響在空間'], ['堅持承認九二共識', '影響', '在空間'], ['在', '參與', '國際事務'], ['南韓', '決定', '防導系統影響兩國文化交流'], ['防導系統', '影響', '兩國文化交流'], ['南韓媒體', '透露', '南韓女星李英愛主演電視劇師任堂'], ['中國', '完成', '審查'], ['播出時間', '延期到', '明年一月'], ['ElonMusk穆斯克', '公佈', '野心勃勃火星旅大計'], ['一千艘', '設有', '客艙'], ['100FTSE指數', '收', ' 點◇亞股■臺灣\xa026\xa0日收收盤跌 90.1 點'], ['自營商賣', '超', '5.83億元'], ['開盤價', '爲', '31.375元'], ['0.0005', '升', '0.0003']]"
0,20160929_1248,大昌投顧－梅姬來勢洶洶，投資人觀望心態濃厚◆盤勢分析1. 台股週一在美股拉回的影響下，胖颱梅姬撲台來勢洶洶，投資人觀望心態濃厚及上檔追價力道不如預期，指數跌破 5 日線關卡，終場大盤下跌 90 點收在 9194 點，成交量再度萎縮為 539 億元。而今日台股適逢月底摩台指結算，預期在年底資金行情延續及法人持續加碼電、金權值股的情況下，大盤可望維持多頭不變，指標股將為台積電、第一金及國泰金等。2. 在產業方面，NBI 生技指數睽違 4 年多來再現多頭交叉，根據統計，近 10 年來第 4 季是生技相關產業旺季，加上全球重大醫學年會即將開跑，生技產業後勢極具想像空間。至於鴻海成立逾 42 年，期間不斷進行策略性併購壯大實力，近年聚焦科技服務，發力併購關鍵零組件廠商，建立完整供應鏈，其中針對生技產業則以醫療器材或健康產業為主軸，未來將藉策略性併購，創造新的服務及解決方案。在醫療儀器和服務方面，特別和台大合作，聚焦癌症醫學和生醫工程，藉由基因研究和大數據結合，協助國內醫療快速發展，在生技領域方面，則以醫療儀器為主軸，可藉該平台，打造由生產到製造及服務的產業鏈。而中央銀行周四將舉行第 3 季理監事會，央行去年第 3 季理監事會啟動降息循環後，至今年 6/30，已連續 4 季調降政策利率各半碼（0.125％），重貼現率從 1.875％降至 1.375％。金融業者表示，觀察國際最新情勢，日本央行及美國聯準會（Fed）利率會議結果均無意外，加上國內經濟成長及出口表現轉正，預料本次央行將結束這波降息循環。但在國際變數尚未確定前，如果這次央行如市場預期沒有再降息，也不代表今年底前央行貨幣政策不會再作調整。3. 台股本週時序接近 9 月底，隨著季底作帳行情升溫，集團股在人氣加持下股價表現可望相對強勢。今日預估區間：9150 點～9250 點。,"[['大昌', '投顧', '來勢洶洶'], ['上檔', '追', '價'], ['指數', '跌破', '日線關卡'], ['90點', '收在', '9194點'], ['成交量萎縮', '爲', '億元539'], ['臺股', '適逢', '月底摩臺指結算'], ['大盤', '維持', '多頭不變'], ['指標股', '爲', '等電'], [' 10 年來第 4季', '是', '相關產業旺季'], ['生技產業後勢', '極具', '想像空間'], ['中央銀行', '舉行', '第 3季理監事會'], ['監事會', '啓動', '降息循環'], ['金融業者', '表示', '無意外'], ['本次央行', '結束', '降息循環'], ['央行貨幣政策', '作', '調整'], ['季底', '作', '帳'], ['股價表現', '可望', '相對強勢']]"
0,20160929_1249,統一期貨台期指暨選擇權盤前分析◆國際股市回跌，台股量縮下跌上週五美股回跌，週一亞洲主要股市收黑，台股也回檔整理，跌破 9200 點。終場下跌 - 82 點 (-0.89%)，逆價差 40.52 點，電子期下跌 - 4.65 點 (-1.22%)，逆價差 1.3 點，金融期下跌 - 8 點 (-0.79%)，逆價差 1.86 點，非金電期下跌 - 45 點 (-0.41%)，逆價差 83.48 點。下跌，逆價差減少，期貨空方力道減弱。未平倉部位分析，自營商淨空單增加 1729 口，淨空單部位 5794 口；投信淨空單增加 1047 口，淨空單部位 48475 口；外資淨多單減少 1872 口，淨多單部位 78059 口，外資期貨部位偏多。技術面觀察，自波段高點拉回，成交量縮小到 500 多億，收黑 K 棒，主要中長期均線維持多頭排列，籌碼面部分，外資上市現貨賣超金額 31.89 億元，期貨未平倉淨多單 78059 口，外資偏多保守操作。◆選擇權分析多空就選擇權籌碼觀察，賣權 / 買權未平倉由 1.34 下降到 1.25，仍為偏多格局。在最大未平倉量序列部份，買權維持在 9500 點，賣權下移到 8800 點，外資選擇權淨多單部位 6343 口。,"[['自營商淨空單', '增加', '1729口'], ['投信淨空單', '增加', '1047口'], ['外資上市現貨賣超金額', '維持', '多頭排列'], ['賣權買權', '下降到', '1.25']]"
0,20160929_1250,統一證券盤前分析－偏多格局持續，聚焦業績成長股◆盤勢分析台股上周資金行情發酵，台股再創今年新高 9290 點，且外資持續加碼買超，周一受到美股拉回影響，而以相對低點做收。後市行情觀察分析如下：第一、國際股市部份。九月美國不升息，資金行情再起，全球股市再向上攻下一城，其中最亮眼的是美股的 NASDAQ 與指數，前者在 9/22 再創歷史新高 5342 點；而指數，也在同日同創新高 818 點；而台股也在上周五收盤再創今年新高，達 9284 點，可見此波資金行情之威力。第二、展望本周要公佈的經濟數據與事件。除了好壞參半的美國八月耐久財訂單及第二季 GDP 終值外，最重要的乃是周一的美國大選電視辯論。此次辯論焦點在於希拉蕊的電郵、健康問題與川普的稅務及移民政策等，在辯論結束後的最新一期 CNN 民調顯示，希拉蕊 62% 領先川普 27%，幅度擴大至 35%，造就美股連續二日大漲。第三、技術面觀察。雖然台股周一回檔且滑落五日均線之下，但以均線分析，目前各期均線均呈多頭排列，下檔月線 9117 點支撐強勁。周一的回檔除了受上周五美股回檔影響外，上周短線漲幅過大，以高點 9290 點與季線 9016 點的 274 點乖離而言，適時回檔也可化解短線過熱，有利中長線走勢。而且在 KD 指標持續上揚，預計在指數化解過熱壓力後，將有助攻之效。第四、Apple 股為盤面重心。美股上周五回檔，有一部份因素是德國的研究機構 Gfk 對歐洲、亞洲的通路調查，iPhone7 第一週末銷售量與去年 Apple 的 iPhone6s 銷售量少了 25%。事實上，由於 apple 並無發佈數字，加上三星新的 note7 電池依舊有過熱問題，所以 iphone7 銷售衰退問題仍應再查證才是。目前即將進入 9 月營收公佈期，研究部調查營收成長者主要仍以 apple 族群及其他電子股為主，如臻鼎、台郡、建準、頎邦、岳豐、美律、大立光、可成及友達等。其他 4Q 產業前景較佳者也可留意，如汽車零組件及壽險股，如皇田、胡連、堤維西、同致、國泰金及富邦金等。,"[['臺股', '再創', '9290新高點'], ['全球股市', '攻下', '一城'], ['亮眼的', '是', '美股NASDAQ'], ['前者', '再創', '5342新高點'], ['指數', '新高', '點'], ['重要的', '乃是', '電視辯論'], ['辯論焦點', '在於', '等問題'], ['各期均線', '呈', '多頭排列'], ['除了', '受', '回檔影響'], ['指數', '化解', '過熱壓力'], ['Apple股', '爲', '重心'], ['週五回檔', '有', '一部份因素是通路調查'], ['一部份因素', '是', '通路調查'], ['apple', '發佈', '數字'], ['note7電池', '有', '過熱問題'], ['研究部', '調查', '營收成長者爲主']]"
