,News,All,SVO
0,20160215_165,台股躲過外資提款潮 韓股遭領5億美元 日圓2月來急升7%受到歐美股市大幅波動和油價重挫雙重衝擊，在台灣上周春節連假期間，亞洲各股市多成為外資提款機，摩根投信統計，上周日股與11日開紅盤的韓股、港股首當其衝，韓股上周2個交易日即遭提款近5.5億美元，日經225指數更是單周重挫逾10%，而則因避險情緒遽升，一度急升至112元價位，幾乎來到近2年的高點，累計2月以來升幅逾7%。摩根投信指出，上周亞股市場中，僅有印尼獲得外資青睞，逆勢吸金近1億美元，也是今年來唯一資金淨流入的亞洲市場。 上周因油價崩跌、美國非農就業數據欠佳、歐洲銀行類股重挫等利空接踵而來，導致反應市場恐慌氣氛的VIX波動指數一度大幅攀升至28，並使美國跌至1.66%，日本更跌至負利率水位，而則受避險資金大舉湧入之下，單周大幅升值逾3%。摩根亞太入息基金經理人羅傑瑞(Jeffrey Roskell)分析，全球市場大幅動盪主要是受4大因素影響，包括(1)美國利率上升，全球經濟成長卻仍疲弱，甚至可能有衰退壓力；(2)中國經濟硬著陸；(3)憂心跌跌不休的油價反映全球經濟不振；(4)看不到企業獲利有明顯回升動能。羅傑瑞認為，事實上對照以上4大因素與全球大跌走勢，市場已過度悲觀，投資者此時不宜輕舉妄動大幅調整，但因市場對於這些疑慮仍需時間消化與釐清，波動可能延續一段時間，建議投資人可透過結合股債與衍生性金融商品、多空靈活操作、且追求絕對報酬的投資策略，在市場下跌期間，逆勢提高正報酬機率，同時降低波動風險。摩根東協基金經理人黃寶麗(Pauline Ng)進一步指出，印尼上周成為亞股中的亮點，主要是經濟基本面最有撐，隨新經濟內閣上周再度推出刺激政策，且未來還有政策寬鬆空間，市場預估，印尼今年GDP將逐季增長回溫，再加上印尼股市今年獲利成長預期高達9.9%，在東協五國中僅次於菲律賓和泰國，讓印尼股市受到國際資金期待。不過，黃寶麗提醒，東協國家今年普遍都有企業獲利成長率看升的優勢，但因市場波動加劇，建議投資人分批進場，並設定停利點，避免重押單一市場。,"[['臺股', '躲過', '韓股遭領5億美元潮'], ['韓股', '遭領', '5億美元'], ['韓股', '遭領', '5億美元'], ['日圓', '急升', '7%'], ['各股市', '成爲', '外資提款機'], ['日經225指數', '更是', '重挫'], ['升至價位', '來到', '近2年高點'], ['升幅', '逾', '7%'], ['摩根投信', '指出', '僅有青睞'], ['吸金', '也是', '亞洲市場'], ['，', '導致', '反應'], ['一度', '攀升至', '28'], ['升值', '逾', '3%'], ['摩根亞太入息基金經理人羅傑瑞Jeffrey Roskell', '分析', '動盪是受大因素影響'], ['動盪', '是', '受大因素影響'], ['憂心跌油價', '反映', '全球經濟不振'], ['企業獲利', '有', '回升動能'], ['羅傑瑞', '認爲', '建議投資人提高正機率'], ['市場', '需', '時間消化'], ['波動', '延續', '一段時間'], ['透過投資策略', '結合', '股債'], ['投資人', '提高', '正機率'], ['投資人提高正機率', '正', '報酬'], ['Pauline Ng黃寶麗', '指出', '印尼上週成爲亞股中亮點'], ['印尼上週', '成爲', '亞股中亮點'], ['經濟基本面', '有', '撐'], ['東協國家', '有', '企業獲利成長率看升優勢'], ['企業獲利成長率', '看', '升'], ['企業獲利成長率', '看', '升']]"
0,20160215_166,神通電腦1月營收0.38億元年增217.84% 1— 1月達0.38億元神通電腦(8122-TW)2016年 1月營收資料(單位:千元),"[['神通電腦', '營收', '增']]"
0,20160215_167,正基1月營收2.49億元年增41.07% 1— 1月達2.49億元正基()2016年 1月營收資料(單位:千元),"[['正基', '營收', '2.49億元年增單位']]"
0,20160215_168,安集1月營收0.58億元年減5.93% 1— 1月達0.58億元安集()2016年 1月營收資料(單位:千元),[]
0,20160215_169,永豐銀行1月營收22.32億元年增3.55% 1— 1月達22.32億元永豐銀行(5849-TW)2016年 1月營收資料(單位:千元),"[['永豐銀行', '營收', '22.32億元年增']]"
0,20160215_170,開發1月營收1.49億元年減0.48% 1— 1月達1.49億元開發(5839-TW)2016年 1月營收資料(單位:千元),[]
0,20160215_171,遠航1月營收2.43億元年增7.42% 1— 1月達2.43億元遠航(5605-TW)2016年 1月營收資料(單位:千元),"[['2.43億元年營收', '增', ' 1月']]"
0,20160215_172,樂美館1月營收0.49億元年增6.74% 1— 1月達0.49億元樂美館(4802-TW)2016年 1月營收資料(單位:千元),"[['樂美館', '營收', '0.49億元年']]"
0,20160215_173,新應材1月營收0.88億元年減5.62% 1— 1月達0.88億元新應材()2016年 1月營收資料(單位:千元),[]
0,20160215_174,正揚1月營收0.05億元年減2.35% 1— 1月達0.05億元正揚(4734-TW)2016年 1月營收資料(單位:千元),[]
0,20160215_175,尖端醫1月營收0.09億元年減16.62% 1— 1月達0.09億元尖端醫()2016年 1月營收資料(單位:千元),[]
0,20160215_176,F-太和1月營收0.54億元年增26.22% 1— 1月達0.54億元F-太和()2016年 1月營收資料(單位:千元),[]
0,20160215_177,臺慶科1月營收2.53億元年減7.67% 1— 1月達2.53億元臺慶科()2016年 1月營收資料(單位:千元),[]
0,20160215_178,岱宇國際1月營收4.24億元年減23.31% 1— 1月達4.24億元岱宇國際()2016年 1月營收資料(單位:千元),[]
0,20160215_179,台灣麗偉1月營收1.55億元年減12.07% 1— 1月達1.55億元台灣麗偉(1547-TW)2016年 1月營收資料(單位:千元),[]
0,20160215_180,環華證金1月營收0.17億元年減24.11% 1— 1月達0.17億元環華證金(010002-TW)2016年 1月營收資料(單位:千元),[]
0,20160215_181,台股盤後－紅盤日新春拚見紅 開低走高小漲3點儘管全球股市上週呈現震盪，市場原本預期台股猴年新春開盤將受衝擊，不過在政府宣示護盤信心，日本、韓國股市也回穩，國際油價也止跌，指數開低大跌109.01點，跌破8000點大關，低接買盤隨即湧現，買進營收成長股，推升跌幅持續收斂，終場在車用、太陽能、遊戲、網通等類股走揚帶動下，指數順利收紅小漲3.51點，以8066.51點作收，成交值879.82億元。櫃檯指數則是強於集中市場，在觀光、航運、電腦設備等類股推升下，指數僅下跌5分鐘隨即回到平盤之上，盤中一度來到124.46點，收復5日線，終場上漲0.39點，以124.11點作收，成交值173.21億元。台股各大類股漲跌互見，以鋼鐵表現最為強勁，漲幅逾2%，食品、電子零組件、水泥也漲逾1%，塑膠、電機機械、通信網路、航運、電子通路、紡纖、造紙、油電燃氣、橡膠、電腦設備等均收紅；生醫、金融下跌逾1%，玻陶、化學生醫、觀光、化學、貿易百貨、汽車、資訊服務、半導體，則均收黑。電子金融權值股是今天弱勢指標，包括台積電、鴻海收黑，儘管有大立光逆勢抗跌，但是依然無法有效支撐台股大漲；另外金融股指標富邦金、國泰金也同步下跌。至於強勢指標則是鋼鐵股，主要是因為龍頭廠中鋼看好產業景氣，加上繼3月鋼品盤價調漲後，市場預期4、5月鋼品報價可望持續維持漲勢，推升中鋼構、東鋼、中鴻、聚亨、允強、中鋼等逆勢抗跌。另外中小型營收成長股也是今天的強勢族群，包括被動元件廠國巨、奇力新、F-君耀；網通廠智易、F-科納、啟碁、光聖；太陽能廠台勝科、崇越、茂迪、台虹等。運達投顧分析師顏逸民表示，台股今天呈現開低走股，儘管電子權值股仍多以下跌作收，不過盤勢主力改由營收成長股領軍，包括太陽能、鋼鐵、車用電子、遊戲、網通等多見到買盤湧進，整體來看，台股仍是以整理為主，主要是因為金融股仍偏弱，如果金融股能表態翻揚，台股才有機會出現較明顯的反彈。,"[['拚', '見', '紅'], ['全球股市', '呈現', '震盪'], ['預期臺股猴年新春開盤', '受', '衝擊'], ['日本股市', '宣示', '護盤信心'], ['升跌幅', '收', '成長股'], ['櫃檯指數', '強於', '集中市場'], ['漲幅', '逾', '2%'], ['食品', '逾', '1%'], ['等塑膠', '收', '紅'], ['電子金融權值股', '是', '弱勢指標'], ['大立光', '抗', '跌'], ['強勢指標', '是', '鋼鐵股'], ['中鋼', '看好', '產業景氣'], ['鋼品報價', '維持', '漲勢'], ['中小型營收', '也是', '強勢族羣'], ['投顧分析師顏逸民', '表示', '臺股呈現走股'], ['臺股', '呈現', '走股'], ['盤勢主力', '改由', '領軍'], ['臺股', '出現', '明顯反彈']]"
0,20160215_182,"研華、日本IBM，攜手合作智能製造IoT解決方案MoneyDJ新聞 2016-02-15 13:06:23 記者 陳祈儒 報導研華科技（2395）和日本IBM株式會社（日本IBM）共同宣布，將在以智慧製造為主的IoT解決方案上進行合作。此合作將整合研華「WISE-PaaS」、IBM雲端基礎服務「SoftLayer」，以及「IBM  Bluemix」，讓使用者能在此平台上，擁有更完整的IoT應用開發環境。研華表示，在既有IoT解決方案的建構上，已能透過通信介面，Ethernet，類比I/O，數位I/O，無線節點等各式感應器及機器來進行數據收集。而研華「WISE-PaaS」則可進一步經由各式RESTful API，來進行包含數據收集管理及遠端設備監控管理等雲端服務功能。研華與日本IBM，將透過研華「WISE-PaaS」、IBM「SoftLayer」及「IBM  Bluemix」結合，聚焦智慧製造產業。未來經由研華sensor nodes所收集到的端點資料、研華sensor gateway連網傳遞至雲端的資訊，所有工廠內的機台狀態，都可於雲端平台上即時監控一目了然，並於第一時間進行維修。此一解決方案，也可至位於日本東京的IBM客戶體驗中心內的物聯網體驗車庫（IoT Experience Garage, IBM Client Experience Center, Tokyo Japan）進行實際體驗。研華表示，該公司一直以來以「智慧地球的推手」作為企業願景，並以「驅動智慧城市創新 共創物聯產業典範」為目標，相信透過研華在各產業上既有的硬體及中介軟體平台發展，以及日本IBM在IT系統市場和經驗技術，不僅能在智慧製造市場上創造綜效，更能在IoT產業中擴大彼此合作，為世界人類帶來福祉。","[['此合作', '整合', 'WISEPaaS'], ['研華', '表示', '各式感應器進行數據收集'], ['在', '既有', 'IoT解決方案'], ['各式感應器', '進行', '數據收集'], ['WISEPaaS', '進行', '服務功能'], ['WISEPaaS進行服務功能', '包含', '等管理'], ['至', '位於', '日本東京'], ['IBM客戶', '體驗', 'IBMClientExperience Center進行實際體驗'], ['IBMClientExperience Center', '進行', '實際體驗'], ['研華', '表示', '該公司作爲企業願景'], ['該公司', '作爲', '企業願景']]"
0,20160215_183,富喬獲節前備貨潮推升 1月營收史上第3高PCB上游玻纖紗及瓊織布廠富喬工業()今天盤後公布2016年1月營收4.37億元，為富喬工業成立以來單月的第3高營收，較去年同月的4.1億元增加6.59%，較2015年12月的3.23億元成長35.12%。其主要的推升營收動力仍來自於客戶端的春節前備貨潮。歷年第1季為玻纖布客戶需求的旺季，依其營收資料顯示，富喬2016年1月營收4.37億元，較上月成長35.12%。營收成長之主要原因在於行動裝置、雲端伺服器、遊戲機等產品之PCB需求穩定成長，使得電子級玻纖布銷售情況良好。同時，由於面臨2月春節長假，富喬部分下游客戶端廠商於1月提前備料及下單所致，而且富喬今年1月營收也優於去年同期。富喬工業目前續深耕工業級玻纖紗，及加速高階電子級超細紗、超薄布之應用與認證，以避開或減少｢紅色供應鏈｣的衝擊。同時，富喬積極研發及開拓應用於汽車電子、物聯網及大數據之雲端處理伺服器所需的高階玻纖超薄布，有利以提高2016年的業績。富喬工業今天收盤價報9.95元，較前一交易日上漲0.15元或1.53%，成交量497張。,"[['富喬', '獲', '升'], ['主要推動力', '來自於', '備貨潮'], ['歷年第1季', '爲', '需求'], ['歷年第1季', '爲', '需求'], ['富喬', '營收', '4.37億元'], ['主要原因', '在於', '穩定'], ['今年1月營收', '優於', '去年同期'], ['富喬', '研發', '高階玻纖超薄布'], ['開拓', '應用於', '汽車電子']]"
0,20160215_184,"台積電1月營收增21.4% 地震皮肉傷無礙Q1目標台積電董事長張忠謀。(資料照片，鉅亨網記者趙曉慧攝)台積電() ()今(15)日公佈1月份業績，在智慧型手機市場回溫的帶動下，1月合併營收月增率一口氣達21.4%，金額為708.55億元，是近3個月新高水準。儘管高雄大地震讓台積電南科廠受了一些皮肉傷，但無礙今年首季的業績目標達標。今天是猴年開工首日，台積電公佈1月營收報告，合併營收約為708億5,500萬元，較上月增加了21.4%，較去年同期減少了18.7%。小年夜發生高雄大地震，導致台積電南科晶圓14A廠受損，估計對第1季晶圓出貨影響程度約達1%，但由於晶圓廠受影響的程度略高於原先預估，儘管如此，台積電今年首季合併營收目標為1980至2010億元，約季減1.3%至2.7%。","[['1月', '合併', '月增率'], ['合併月增率一口氣', '達', '21.4%'], ['金額', '爲', '708.55億元'], ['今天', '是', '開工首日'], ['臺積電', '公佈', '1月營收報告'], ['合併營收', '爲', '708億5'], ['發生高雄大地震', '導致', '臺積電南科晶圓14A廠受損'], ['對影響程度', '達', '1%'], ['晶圓廠', '受', '影響'], ['晶圓廠', '受', '影響'], ['晶圓廠受影響程度', '高於', '預估'], ['約季', '減', '1.3%']]"
0,20160215_185,奇力新1月營收創新高 日幣升值轉單將浮現電感廠奇力新()自結1月合併營收4.73億元，不僅首度突破4.5億元大關，也創下歷年單月新高，較2015年12月的3.77億元大幅成長25.3%，也較2015年同期4.24億元成長11.5%。受惠於營收創高，奇力新股價也重新站回70元大關，盤中最高來到71.3元，直逼漲停板71.5元，創1月11日以來新高。奇力新表示，1月營收突破歷史新高，主要是受惠於佈局的海外巿場穩定增長，以及應用於車用電子之出貨逐漸發酵；另外微型一體成型電感(Mini Molding Power Choke)因2015年第4季新產能佈建完成，擴大出貨能量，有效推升1月營收成長表現，預估未來出貨動能仍將有不錯表現。隨著手機品牌廠也持續釋單給第二供應鏈，由於近期大漲，也讓日本被動元件廠出口競爭力受到影響，法人預估，奇力新可望成為升值轉單受惠股 。,"[['日幣升值轉單', '浮現', '結奇力'], ['奇力新', '表示', '新高受惠'], ['新高', '受惠於', '海外巿場增長'], ['出貨動能', '有', '不錯表現'], ['品牌廠', '持續釋單給', '第二供應鏈'], ['法人', '預估', '奇力成爲受惠股'], ['奇力', '成爲', '受惠股']]"
0,20160215_186,MSCI台灣指數成分股權重調整  台達電升、台積電降MoneyDJ新聞 2016-02-15 11:09:10 記者 新聞中心 報導MSCI指數編纂公司明晟(MSCI)於春節台股休市期間公布最新季度調整，其中在MSCI台灣指數成份股方面，權重調升最多的成分股為台達電(2308)增加0.02%，調降最多的成分股為台積電(2330)減少0.02%。MSCI最新季度調整出爐，在MSCI台灣指數成份股方面，本次無新增刪除成分股，指數成分股維持於88檔，其中20檔成分股調整流通在外股數及2檔調整公眾流通量係數。本次權重調升最多的成分股為台達電(2308)增加0.02%，調降最多的成分股為台積電(2330)減少0.02%。而整體台股在本次MSCI調整權重中，在「MSCI全球新興市場指數」權重由12.37%下調至12.36%、亞洲除日本指數權重由13.96%下調至13.89%、全球市場指數則由1.16%上調至1.17%。以「MSCI全球新興市場指數」來看，本次為台股第十度遭調降權重，最新權重將自3月1日開盤生效。對於本次季度調整對台股的影響，元大摩臺基金經理人陳思蓓表示，觀察外資本月於現貨部位買超91.41億元，期貨未平倉淨多單近2.4萬口，整體部位並未偏空，且本次MSCI為季度調整，台灣在權重變化不大的情形下應不致有被動式資金影響後續行情；惟因台股封關期間國際股市表現不佳，台股在開盤首日仍面臨修正壓力，目前全球股市波動增加及Fed主席對經濟復甦發出示警，造成投資人投資信心薄弱亦會連帶影響台股後續走勢，未來台股能否走穩仍需視國際市場狀況而定。陳思蓓也表示，本次MSCI季度調整，以「MSCI全球新興市場指數」觀察，此次權重調升最多之國家為南非及印度分別增加了0.11%及0.08%，南韓權重亦調升了0.04%;而本次權重調降最高之國家為中國，權重下調了0.16%。本次南非及印度會成為權重調升最多的國家，主要是因為本次MSCI全球新興市場指數的2檔新增成分股分別來自南非及印度的緣故，而中國則因有2檔成分股遭到剔除，故成為本次成分股調降最多之國家。,"[['臺積電', '降', 'MoneyDJ'], ['2330', '減少', '0.02%'], ['指數成分股', '維持於', '88檔'], ['20檔成分股調整流通', '調整', '公衆流通量係數'], ['本次權重', '調', '最多成分股'], ['本次權重調最多成分股', '爲', '增加'], ['2330', '減少', '0.02%'], ['MSCI全球新興市場指數權重', '下調至', '12.36%'], ['元大摩臺基金經理人陳思蓓', '表示', '觀察外資買'], ['MSCI', '爲', '季度調整'], ['臺灣', '有', '被動式資金影響後續行情'], ['被動式資金', '影響', '後續行情'], ['臺股', '面臨', '壓力'], ['全球股市波動增加', '造成', '連帶'], ['投資信心薄弱', '連帶', '後續走勢'], ['陳思蓓', '表示', 'MSCI季度調整觀察'], ['此次權重', '調', '最多國家'], ['南韓權重', '調升', '0.04%'], ['最高國家', '爲', '中國'], ['權重', '下調', '0.16%'], ['本次南非', '成爲', '調升國家'], ['權重', '調', '升'], ['新增成分股', '來自', '南非緣故'], ['2檔成分股', '遭到', '剔除'], ['中國', '成爲', '調降本次成分股國家'], ['本次成分股', '調降', '本次成分股']]"
0,20160215_187,證交所林火燈：今年重點在提升量能 台股有先蹲後跳機會證券所今(15)日上午舉行新春團拜，總經理林火燈指出，去年台股交易量表現有點惋惜，不過在台股揚升方案帶動下，包含制度面改變以及新商品增加，今年有信心可以提升交易量，也會讓台股今年有先蹲後跳之機會。證券暨期貨業新春團拜今日舉行，由於小年夜南台灣發生大地震，因此團拜開始也對受難者默哀一分鐘，並向參與救災的警消、國軍與全體志工致上最高敬意。林火燈致詞時指出，去年證券周邊與主管機關都非常努力，使得台股資本市場明顯改變，其中包含證券業務範疇放寬，產品更e多樣化，市場機制則是包含現股全面當沖、降低交易成本以及訊息面暫停交易等機制都正式上路。林火燈認為，雖然去年交易制度改變，但台股成交量表現仍相當令人惋惜，去年第4季整體成交量並沒有明顯提升，不過大戶交易量卻明顯增加，對台股交易量仍帶來正面能量，今年重點將在提升交易量，希望可以逐步改善。林火燈強調，儘管今日受到歐美與日股等重挫影響開低，但過去主管機關與周邊單位努力，台股資本市場品質明顯改善，對台股今年長期量能提升將有相當的幫助。,"[['後跳機會證券', '舉行', '新春團拜'], ['總經理林火燈', '指出', '惋惜'], ['新春團拜', '舉行', '暨期貨業'], ['向', '參與', '救災'], ['林火燈', '指出', '市場機制上路'], ['其中', '包含', '證券業務'], ['訊息面', '暫停', '交易'], ['林火燈', '認爲', '令人惋惜'], ['林火燈', '強調', '有相當幫助']]"
0,20160215_188,紅盤日台股劇烈波動 指數跌百點拉至平盤農曆春節台股封關期間，國際股市極為動盪，美股領跌全球股市全盤盡沒，日股這段期間跌幅更達13%相當驚人。所幸油價及時止穩，沒讓國際盤一路破底，但台股新春開紅盤，不免要反應一下封關期間國際股市的修正，大盤跳水開低，指數早盤一度慘跌百點，最低來到7953點。賣壓宣洩完畢後，重量級權值股以及金融股跌勢止穩，大盤終於回升到八千點以上。短線來看，國際盤動向將持續牽動台股新春行情表現。（張佳琪報導）台股封關期間，國際股市不平靜，美股四大指數全面修正，又以指數與指數累計4%跌幅最重。歐股也由德國股市帶頭下修，亞洲股市更是表現不理想，日股在這段期間跌了13%跌勢極為兇猛，港股也有近4%跌幅。而年前發生的大地震，台積電、群創等科技大廠傳出生產線受影響，更讓台股未開盤就籠罩在保守氣氛中。果然紅盤日指數一早跳水，反應國際股市與地震災情，大盤跌勢一路擴大到百點以上，摜破八千大關。在賣壓盡情宣洩以及政策性護持力道浮現後，盤勢才緩步向上拉升回到平盤。過去歷年來，農曆年後都會部分個股出現紅包行情，但今年封關期間台股還歷經MSCI權重調整，一恢復交易之後又有企業營收要發佈，加上國際市場持續動盪，為台股紅包行情憑添變數。（圖：取自雅虎奇摩）,"[['指數', '跌', '平盤'], ['指數', '跌', '平盤'], ['領', '跌', '全球股市'], ['領', '跌', '全球股市'], ['臺股新春', '開', '紅盤'], ['一度', '慘跌', '百點'], ['跌勢', '止', '穩'], ['盤動向', '牽動', '臺股行情表現'], ['港股', '也有', '4%跌幅'], ['科技大廠', '傳出', '生產線'], ['一路', '擴大到', '百點以上'], ['盤勢', '回到', '平盤']]"
0,20160215_189,挑戰營收、獲利雙高 蔡力行期許業績、股價、分紅都好中華電()去年營收寫下歷史新高，每股盈餘5.52元，也是4年來最佳成績，董事長蔡力行今(15)日指出，雖然今年國際經濟情勢仍然不理想，但挑戰超越財測是永遠的目標，今年營收、獲利有會創高，期許中華電延續業績好、股價好、分紅好的成績，持續向上走。中華電2015年第4季歸屬母公司業主淨利94.7億元，成長17.3%，每股盈餘1.22元，累計全年營收2317.9億元，年增2.3%，創歷史新高，歸屬母公司業主淨利428.2億元，成長10.9%，每股盈餘5.52元，年增10.9%，創4年來最佳，去年4G客戶數突破442萬，年增232.6%，市佔率38.2%，居市場領導地位，預計今年將再增加200萬4G客戶。中華電去年全年合併自結營收及每股盈餘都超越財測目標，今年財測目標也已公告，預估全年合併營收2334.9億元，年增0.7%，財測營業成本及費用合計為1855.3億元，較2015年度自結數增加42.3億元，約2.3%，稅前淨利為488.4億元，歸屬於母公司業主淨利為399.8億元，每股盈餘5.15元，較去年減少0.37元。農曆年後第一個上班日，董事長蔡力行表示，去年股價表現不錯，希望今年持續有好表現，超越財測永遠是目標，今年有機會營收及獲利續創高，延續去年動能往上走。他進一步說明，今年持續衝刺4G業務，尤其是去年標下2.6G頻譜，將成為頻譜最多、最寬的業者，目標是拿到最大市占、最好ARPU及營收；另外，新創事業包括物聯網、雲端、IDC、資安等都將繼續努力，蔡力行強調，將持續尋找未來3-5年的成長動能，布局新領域。,"[['好成績走', '挑戰', '營收'], ['去年營收', '寫下', '歷史新高'], ['挑戰超越財測', '是', '永遠目標'], ['營收', '有', '創高'], ['中華電2015年第4季', '歸屬', '94.7億元'], ['年', '增', '2.3%'], ['年', '增', '10.9%'], ['客戶數', '突破', '442萬'], ['年增', '居', '市場領導地位'], ['盈餘', '超越', '測目標'], ['稅前淨利', '爲', '488.4億元'], ['歸屬淨利', '爲', '399.8億元'], ['董事長蔡力行', '表示', '不錯'], ['超越財測', '永遠是', '目標'], ['他', '說明', '2.6G頻譜成爲最多業者'], ['持續', '衝刺', '4G業務'], ['2.6G頻譜', '成爲', '最多業者'], ['目標', '是', '拿到最大市佔'], ['蔡力行', '強調', '尋找成長動能']]"
