,News,All,SVO
0,20160215_129,愛爾達：澄清媒體有關本公司之報導第三十四條　第26款1.傳播媒體名稱:壹週刊2.報導日期:105/02/123.報導內容:「愛爾達年營收逼近六億元，每股盈餘達二點一元。」4.投資人提供訊息概要:無5.公司對該等報導或提供訊息之說明:有關媒體報導之營收及獲利資訊，係為媒體善意臆測推估，本公司並未發佈任何相關預測性數據，特此澄清。有關財務或業務資訊應以公開資訊觀測站公佈之資料為準。6.因應措施:於公開資訊觀測站發佈重大訊息說明，確保投資人權益。7.其他應敘明事項:無,"[['投資人', '提供', '訊息概要'], ['本公司', '發佈', '預測性數據']]"
0,20160215_130,齊瀚光電：公告本公司及本公司負責人接獲台灣台北地方法院刑事裁判書乙事第七條　第2款1.法律事件之當事人、法院名稱、處分機關及相關文書案號:法律事件之當事人：研晶光電股份有限公司(自訴人)被告：齊瀚光電股份有限公司、劉家齊法院名稱:台灣台北地方法院案號：102年度自第64號，樂股2.事實發生日:105/02/153.發生原委（含爭訟標的）:研晶光電股份有限公司於102年10月4日向台灣台北地方法院對本公司及負責人劉家齊提出違反營業秘密法等案件之刑事自訴訴訟。4.處理過程:本案經台灣台北地方法院第一審審理，本公司及本公司負責人於105年2月15日收受判決書正本，判決宣判本公司及本公司負責人劉家齊均無罪。5.對公司財務業務影響及預估影響金額:無。6.因應措施及改善情形:無。7.其他應敘明事項:無。,"[['本公司', '獲', '法律事件當事人'], ['事實', '發生', '日'], ['（', '含', '爭訟標的'], ['研晶光電股份有限公司', '提出', '訴訟'], ['研晶光電股份有限公司提出訴訟', '違反', '案件'], ['本公司負責人', '收受', '判決書正本']]"
0,20160215_131,"宜揚：公告本公司105年1月份自結報表之速動比率、負債比率、未來三個月預計現金收支狀況及銀行可使用融資額度情形第三十四條　第42款1.事實發生日:105/02/152.公司名稱:宜揚科技(股)公司3.與公司關係(請輸入本公司或聯屬公司):本公司4.相互持股比例(若前項為本公司，請填不適用):不適用5.發生緣由:依證券櫃檯買賣中心100年10月3號 證櫃審字第1000027221號函辦理一、105年1月份財務比率速動比率:81.15%負債比率:35.79%二、未來三個月預計現金收支狀況(單位：仟元)項目/月份     105年02月      105年03月      105年04月現金流入合計    51,269         48,345         58,297現金流出合計    60,923         60,626         52,434三、銀行可使用融資額度情形融資額度:220,600仟元已用額度: 32,600仟元額度餘額:188,000仟元6.因應措施:無7.其他應敘明事項:無","[['本公司', '結', '報表速動比率'], ['前項', '爲', '本公司'], ['證櫃', '審', '字'], ['證櫃', '審', '字'], ['敘明事項', '無', '7']]"
0,20160215_132,昶昕1月營收2.22億元年減22.70% 1— 1月達2.22億元昶昕()2016年 1月營收資料(單位:千元),[]
0,20160215_133,助群營造1月營收2.71億元年增122.97% 1— 1月達2.71億元助群營造(6401-TW)2016年 1月營收資料(單位:千元),"[['1月營收', '達', '2.71億元助羣'], ['-', 'TW', ' 1月']]"
0,20160215_134,有成精密1月營收2.09億元年增18.62% 1— 1月達2.09億元有成精密(4949-TW)2016年 1月營收資料(單位:千元),"[['有', '成', '1月'], ['成1月營收', '增', '營收資料單位']]"
0,20160215_135,寶緯1月營收0.89億元年減14.61% 1— 1月達0.89億元寶緯()2016年 1月營收資料(單位:千元),"[['寶緯', '營收', '0.89億元'], ['2016年1月', '營收', '資料']]"
0,20160215_136,群豐科技1月營收1.56億元年減35.82% 1— 1月達1.56億元群豐科技(3690-TW)2016年 1月營收資料(單位:千元),"[['羣豐科技', '營收', '1.56億元']]"
0,20160215_137,宜揚1月營收0.48億元年減32.40% 1— 1月達0.48億元宜揚(3411-TW)2016年 1月營收資料(單位:千元),[]
0,20160215_138,智泰科技1月營收0.25億元年減45.44% 1— 1月達0.25億元智泰科技(3151-TW)2016年 1月營收資料(單位:千元),[]
0,20160215_139,臺灣工銀1月營收6.66億元年減9.10% 1— 1月達6.66億元台灣工銀()2016年 1月營收資料(單位:千元),[]
0,20160215_140,朝陽人壽1月營收5.71億元年增22.60% 1— 1月達5.71億元朝陽人壽(2870-TW)2016年 1月營收資料(單位:千元),[]
0,20160215_141,寒舍餐旅1月營收4.28億元年增7.83% 1— 1月達4.28億元寒舍餐旅()2016年 1月營收資料(單位:千元),[]
0,20160215_142,寶齡富錦1月營收0.71億元年減0.51% 1— 1月達0.71億元寶齡富錦()2016年 1月營收資料(單位:千元),[]
0,20160215_143,日盛投顧盤後－區間震盪走勢不變◆盤勢分析1.歐美股市上週五反彈，加上日股大漲，台股週一開低後拉高，盤面上包括重建概念股、汽車零組件、塑化、IC設計、被動元件族群表現強勢，電子傳產金融大型股也相對大盤強勢，終場指數以小漲3.51點的8066.51點作收，成交量881.15億元。2.雖然中期偏空結構並沒改變，季線及半年線也為上檔壓力，但由扣抵值來對照，短期內下壓力道轉弱，加上指數未再破7627低點，仍在10日均線之上，因此短線狹幅震盪的機率較高，指數區間則以7880-8250點為參考。外資賣超30.55億，投信賣超8.08億，自營商買超2.42億，合計三大法人賣超36.21億。3.元月營收數字相對佳或今年1Q衰退幅度小，優於市場預期的個股，並配合法人買超籌碼穩定標的，為短線選股的參考。重建及大型股指標續彈，汽車零組件強勢，紡纖補漲，生技股壓回蘋概震盪、被動元件、散熱模組、PA、IC設計相對強勢金融指標股短線應再觀察1.重建及傳產大型股續彈，1101台泥、1402遠東新、2002中鋼為相對強勢指標。汽車零組件3552同致轉強，下檔5及10日線不破短多不變；1536和大、1533車王電走高；1319東陽偏強走勢不變。電機股中1589F-永冠股價收高。多數生技壓回。紡纖族群中以1464得力、4426利勤走勢較強。油價低檔震盪，航空股2610華航及2618長榮航在區間相對低檔附近，可考慮搶短。2.IC設計指標2454聯發科收紅，但技術面未站上月線前，仍會壓抑整體族群走勢；3034聯詠、2379瑞昱仍強、2458義隆季線上下整理。3008大立光走強；晶圓代工2330台積電相對大盤強勢，蘋概股指標2474可成開低有止穩；2317鴻海短線雖未破底，但中期均線排列仍偏空。網通指標2419仲琦在高檔震盪，中期走強格局仍在；2485兆赫60日線不破，中線多方不變；6285啟碁繼續在季線附近整理，5388中磊則在季線及半年線間來回。遊戲股中以3293鈊象走勢最強。被動元件2456奇力新元月營收佳，帶量拉出紅K；PA法人買超回籠，3105穩懋早盤走高後壓回；2455全新強勢震盪。散熱模組6230超眾、3324雙鴻多方不變；3017奇鋐走勢落後有補漲機會。另外近期修正的電競2376技嘉回中長期均線後轉強，也是短線可留意的個股。3.金融股中2882國泰金、2881富邦金二大指標股暫時止穩，但中期均線仍空方排列，由於整體族群走勢偏弱，加上法人加碼動作不大，建議再作觀察。,"[['盤面上', '包括', '表現'], ['終場指數', '作', '強勢'], ['季線', '爲', '上檔壓力'], ['加上指數', '破', '7627低點'], ['指數區間', '爲', '參考'], ['合計三大法人', '賣', '超'], ['鴻海短線', '破', '底'], ['營', '收', '佳'], ['PA法人', '買', '超回籠'], ['落後', '有', '補漲機會']]"
0,20160215_144,大詠城：公告本公司內部稽核主管異動第三十四條　第11款1.人員變動別（請輸入發言人、代理發言人、重要營運主管、財務主管、會計主管、研發主管或內部稽核主管）:內部稽核主管2.發生變動日期:105/02/153.舊任者姓名、級職及簡歷:簡安琪、稽核主管4.新任者姓名、級職及簡歷:邱惠貞、大詠城機械人資專員5.異動情形（請輸入「辭職」、「職務調整」、「資遣」、「退休」、「死亡」或「新任」）:職務調整6.異動原因:原稽核主管調任管理部7.生效日期:105/02/158.新任者聯絡電話:04-78130339.其他應敘明事項:新任稽核主管，擬於最近期董事會提案追認。,"[['2主管', '發生', '變動日期']]"
0,20160215_145,聯美林業1月營收1.04億元年減47.39% 1— 1月達1.04億元聯美林業(8399-TW)2016年 1月營收資料(單位:千元),"[['1.04億元營收', '年減', '營收資料單位']]"
0,20160215_146,益張實業1月營收2.08億元年增59.49% 1— 1月達2.08億元益張實業()2016年 1月營收資料(單位:千元),[]
0,20160215_147,大江國際1月營收0.68億元年增11.75% 1— 1月達0.68億元大江國際(8315-TW)2016年 1月營收資料(單位:千元),[]
0,20160215_148,達運光電1月營收0.36億元年減85.68% 1— 1月達0.36億元達運光電()2016年 1月營收資料(單位:千元),[]
0,20160215_149,台股猴年開春震盪　林火燈：看好台股先蹲後跳！記者許家禎／台北報導證交所今（15）日上午舉行證券暨期貨業新春團拜，面對台股猴年開紅盤出師不利跌百點，金管會主委王儷玲表示，台股短期震盪難以避免，本周是關鍵期，但強調資本市場基本面良好。證交所總經理林火燈也說，台股去年交易量令人惋惜，但中長期對台股有信心，看好台股先蹲後跳！證交所今日舉行證券暨期貨業新春團拜，一開始現場嘉賓為2月6日高雄美濃大地震的災民們祈福，也向救災的警消志工們致意。會後面對媒體詢問當前台股前景，金管會新任主委王儷玲表示，短期震盪難免，不過看看企業財務資訊，包括發放的股利與獲利，顯示整個市場仍相當穩健。王儷玲指出，國際股市波動本來就對台股有影響，本周是關鍵期，但整體來看，台灣資本市場基本面良好，金管會也已找來相關單位開會因應，希望投資人不要太過悲觀，並建議投資人要做好理性的風險控管。證交所總經理林火燈表示，台灣證券市場過去一年做出很多努力，像是金融產品多樣化、開放全面當沖、訊息面暫停交易機制、股市揚升方案等，顯示台股體質不錯。林火燈指出，雖然2016年開春國際股市震盪，且台股去年整體交易量令人惋惜，但他強調台灣資本市場品質提升，中長期來看相信會帶來正面能量，對今年台股交易量有信心，看好台股將先蹲後跳！,"[['臺股', '蹲', '後跳'], ['臺股', '開', '紅盤'], ['猴年', '開', '紅盤'], ['金管會主委王儷玲', '表示', '強調良好'], ['本週', '是', '關鍵期'], ['證交所總經理林火燈', '說', '有信心'], ['證交所', '舉行', '新春團拜'], ['會新任主委王儷玲', '表示', '看看財務資訊'], ['王儷玲', '指出', '良好'], ['國際股市波動', '有', '影響'], ['本週', '是', '關鍵期'], ['金管會', '找', '因應'], ['投資人', '做好', '風險控管'], ['證交所總經理林火燈', '表示', '臺灣證券市場做出很多努力'], ['臺灣證券市場', '做出', '很多努力'], ['訊息面', '暫停', '交易機制'], ['林火燈', '指出', '他強調提升'], ['他', '強調', '提升'], ['來看相信會', '帶來', '正面能量'], ['臺股', '蹲', '後跳']]"
0,20160215_150,土地銀行1月營收28.91億元年增31.95% 1— 1月達28.91億元土地銀行(5857-TW)2016年 1月營收資料(單位:千元),[]
0,20160215_151,立宇高新1月營收1.02億元年增15.14% 1— 1月達1.02億元立宇高新(5229-TW)2016年 1月營收資料(單位:千元),[]
0,20160215_152,基米1月營收0.15億元年減0.41% 1— 1月達0.15億元基米()2016年 1月營收資料(單位:千元),[]
0,20160215_153,世正開發1月營收0.79億元年減28.35% 1— 1月達0.79億元世正開發(2568-TW)2016年 1月營收資料(單位:千元),[]
0,20160215_154,展宇科技1月營收1.63億元年減8.38% 1— 1月達1.63億元展宇科技()2016年 1月營收資料(單位:千元),[]
0,20160215_155,開春報喜 華航榮獲德國iF設計獎桃園機場第一航廈貴賓室，成功將古典傳統與現代美學融洽結合。(圖：華航提供) 777餐具設計，將宋代葵口盤、元代高足碗和清代青花瓷藝術與科技感融合成山水碗。中華航空()新世代機隊設計繼德國紅點設計大獎、日本優良設計奬後，再獲德國iF設計獎殊榮，包括新世代計畫的777-300ER客艙、軟體操作介面、餐具設計、Sky Lounge設計包裝和桃園機場第一航廈貴賓室，一舉奪得5項iF設計獎 ( iF Design Award)，讓台灣文創軟實力在國際設計界發熱發光。2016年德國iF設計大獎將於2月26日於慕尼黑頒獎，華航成為台灣第1家拿下德國iF設計獎的航空公司，並同時有5項設計獲獎，包括新世代777客艙，全球首見的柿木紋內飾和夜燈伴讀的文人書齋風格，展現東方美學；777機上影視娛樂系統採用觸控式的操作介面，人性化又方便使用；777餐具設計從宋代葵口盤、元代高足碗，到清代青花瓷融和科技感的山水碗，都讓旅客驚豔；Sky Lounge的台灣精選點心，包裝採用溫暖的金色加上古式紅印章的設計，傳遞時尚文創特色；桃園機場第一航廈新世代貴賓室，以江南庭園山水為發想，成功將古典傳統與現代美學融洽結合。華航表示，全新A350機隊自7月起陸續交機，客艙設計延續新世代精神，增添創意、年輕和時尚元素，將帶給旅客全新的搭乘體驗。成立於1953年的德國iF設計獎，與德國紅點設計大獎、美國IDEA獎，並稱世界三大指標性設計大獎。iF設計獎共有7大參賽項目，今年吸引超過50個國家參加，參選作品共有5295件，獲獎率僅30%；評選標準包括設計品質、作工、材質的選擇、創新程度、環保性、功能性、人體工學、操作方式視覺化、安全性、品牌價值及品牌塑造等。,"[['華航', '榮獲', '德國iF設計獎桃園機場第一航廈貴賓室'], ['華航', '提供', '777餐具設計'], ['新世代機隊設計', '獲', 'iF設計獎殊榮'], ['華航', '成爲', '拿下iF設計獎航空公司'], ['第1家', '拿下', 'iF設計獎'], ['娛樂系統', '採用', '操作介面'], ['貴賓室', '爲', '發想'], ['華航', '表示', '帶給'], ['iF設計獎', '共有', '參賽項目'], ['參選作品', '共有', '5295件'], ['評選標準', '包括', '等品質']]"
0,20160215_156,"開春報喜　華航榮獲德國iF設計獎記者黃靜宜／台北報導中華航空新世代機隊設計，國際設計界讚聲不斷。繼德國紅點設計大獎、日本優良設計奬後，再獲德國iF設計獎殊榮，新世代計畫的777-300ER客艙、軟體操作介面、餐具設計、Sky Lounge設計包裝及桃園機場第一航廈貴賓室，一舉奪得5項iF設計獎 ( iF Design Award)，台灣文創軟實力透過華航在國際設計界發熱發光。  2016年德國iF設計大獎將於2月26日於慕尼黑頒獎，中華航空為台灣第一家拿下德國iF設計獎的航空公司，並同時有5項設計獲獎，包括新世代777客艙，全球首見的柿木紋內飾及夜燈伴讀的文人書齋風格，展現東方美學；777機上影視娛樂系統採用觸控式的操作介面，人性化又方便使用；777餐具設計從宋代葵口盤、元代高足碗，到清代青花瓷融和科技感的山水碗，都讓旅客驚豔；Sky Lounge的台灣精選點心，包裝採用溫暖的金色加上古式紅印章的設計，傳遞時尚文創特色；桃園機場第一航廈新世代貴賓室，以江南庭園山水為發想，成功將古典傳統與現代美學融洽結合。  成立於1953年的德國iF設計獎，與德國紅點設計大獎、美國IDEA獎，並稱世界三大指標性設計大獎。iF設計獎共有7大參賽項目，今年吸引超過50個國家參加，參選作品共有5,295件，獲獎率僅3成。iF設計獎的評選標準包括：設計品質、作工、材質的選擇、創新程度、環保性、功能性、人體工學、操作方式視覺化、安全性、品牌價值及品牌塑造等。  中華航空自2014年10月起推出 777-300ER 新機，以東方美學融合現代科技的客艙設計，帶給旅客嶄新的空中體驗，國內外好評不斷。榮獲國際獎項包括德國紅點最佳設計獎、義大利A Design Award銀獎、日本優良設計獎，還有777親子臥艙設計獲得美國《Global Traveler》休閒旅遊卓越創新獎、豪華經濟艙獲選Skytrax全球第 8 名，以及TheDesignAir 國際設計評鑑全球10大機場貴賓室、全球最佳航空第 2 名、最佳商務艙及最佳經濟艙；在國內亦獲頒經濟部「國家產業創新獎」、全球華人最頂尖的「金點設計大獎」、「臺灣國際創意設計大賽獎」及中華民國室內設計協會頒發的「TID台灣室內設計大獎評審特別獎」等。2016 年華航全新A350機隊將自7月起陸續交機，客艙設計延續新世代精神，增添創意、年輕與時尚元素，帶給旅客全新的搭乘體驗。","[['華航', '榮獲', '設計獎記者黃靜宜'], ['中華航空', '爲', '拿下iF設計獎航空公司'], ['第一家', '拿下', 'iF設計獎'], ['娛樂系統', '採用', '操作介面'], ['貴賓室', '爲', '發想'], ['iF設計獎', '共有', '參賽項目'], ['參選作品', '共有', '5295件'], ['  中華航空', '推出', '777-300ER新機'], ['以東方美學', '融合', '客艙設計'], ['國際獎項', '包括', '最佳設計獎'], ['豪華經濟艙', '獲選', '10大機場名']]"
0,20160215_157,生展生技：公告105/02/06凌晨3:57高雄美濃大地震對本公司財務業務並無重大影響第三十四條　第42款1.事實發生日:105/02/062.公司名稱:生展生物科技股份有限公司3.與公司關係(請輸入本公司或聯屬公司):本公司4.相互持股比例(若前項為本公司，請填不適用):不適用5.發生緣由:105/02/06凌晨3:57高雄美濃大地震對本公司財務業務並無重大影響6.因應措施:無7.其他應敘明事項:無,"[['高雄美濃大地震', '並無', '事實發生日'], ['前項', '爲', '本公司'], ['高雄美濃大地震', '並無', '重大影響'], ['財務業務', '並無', '重大影響'], ['敘明事項', '無', '7']]"
0,20160215_158,弘凱光電：公告105年2月6日美濃地震對本公司財務或業務無重大影響第三十四條　第42款1.事實發生日:105/02/152.公司名稱:弘凱光電股份有限公司3.與公司關係(請輸入本公司或聯屬公司):本公司4.相互持股比例(若前項為本公司，請填不適用):不適用5.發生緣由:105年2月6日美濃地震對本公司財務或業務無重大影響6.因應措施:無7.其他應敘明事項:無,"[['業務', '無', '重大'], ['美濃地震', '影響', '事實發生日'], ['前項', '爲', '本公司'], ['美濃地震', '無', '重大影響'], ['業務', '無', '重大影響'], ['敘明事項', '無', '7']]"
0,20160215_159,大詠城：本公司會計主管、財務主管及發言人異動第三十四條　第11款1.人員變動別（請輸入發言人、代理發言人、重要營運主管、財務主管、會計主管、研發主管或內部稽核主管）:發言人、財務主管、會計主管2.發生變動日期:105/02/153.舊任者姓名、級職及簡歷:謝福生、管理部經理兼財務及會計主管4.新任者姓名、級職及簡歷:簡安琪、管理部課長兼財務及會計主管5.異動情形（請輸入「辭職」、「職務調整」、「資遣」、「退休」、「死亡」或「新任」）:辭職6.異動原因:因個人涯規劃7.生效日期:105/02/158.新任者聯絡電話:04-78130339.其他應敘明事項:新任財務主管及會計主管，擬於最近期董事會提案追認。,"[['2發言人', '發生', '變動日期']]"
0,20160215_160,"F-冠科：公告本公司股票初次興櫃買賣日期一、本公司申請初次興櫃案，業經財團法人中華民國證劵櫃檯買賣中心105年1月26日證櫃審字第1040037389號函及105年1月26日證櫃審字第10501001102號函核准備查。本公司並向財團法人中華民國證劵櫃檯買賣中心洽定股票興櫃買賣開始日為105年2月18日。二、茲將興櫃買賣相關資料公告如後：(一) 公司中文名稱及簡稱:中美冠科生物技術股份有限公司(F-冠科)(二) 公司英文名稱及簡稱:Crown Bioscience International(F-Crown)(三) 公司代碼：6554(四) 上興櫃股份：興櫃總股數：共計131,381,992股，每股面額10元，計1,313,819,920元。(五)權利義務：與原發行普通股權利義務相同。(六)股票簽證機構：採無實體方式發行。(七)股票劃撥及興櫃買賣開始日期：105年2月18日。三、股務代理機構：(一)名稱：元大證券股份有限公司股務代理部(二)地址：台北市承德路三段210號地下一樓(三)電話：02-2586-5859四、特此公告。","[['本公司', '申請', '初次興櫃案'], ['證櫃', '審', '字'], ['證櫃', '審', '字'], ['證櫃', '審', '字'], ['第10501001102號函', '覈准', '備查'], ['財團法人中華民國證劵櫃檯買賣中心', '洽定', '股票興櫃買賣'], ['財團法人中華民國證劵櫃檯買賣中心', '洽定', '股票興櫃買賣'], ['開始日', '爲', '105年2月18日'], ['茲', '買賣', '相關資料'], ['原', '發行', '普通股權利']]"
0,20160215_161,天外天有1月營收0.39億元年減10.55% 1— 1月達0.39億元天外天有(9989-TW)2016年 1月營收資料(單位:千元),"[['天外天', '有', '營收'], ['天外天', '有', '營收資料單位']]"
0,20160215_162,大國鋼1月營收8.54億元年減9.78% 1— 1月達8.54億元大國鋼()2016年 1月營收資料(單位:千元),[]
0,20160215_163,技鼎1月營收0.79億元年減35.57% 1— 1月達0.79億元技鼎(8402-TW)2016年 1月營收資料(單位:千元),"[['-', 'TW', '0.79億元技鼎']]"
0,20160215_164,中華彩色1月營收0.83億元年增1.66% 1— 1月達0.83億元中華彩色(8366-TW)2016年 1月營收資料(單位:千元),[]
