,News,All,SVO
0,20161006_520,日盛投顧盤後－追價人氣不足 未過前高◆盤勢分析1. 美股上漲，週四台股開平震盪，太陽能、車用、IC 設計、醫美相對強勢，終場指數上漲 12.03 點，漲幅 0.13%，收在 9284.31 點，最低點 9242 點一度跌破 5 日線（9249 點）及 10 日線（9246 點），最高點 9284 點未過今年高點 9303 點，高低點區間為 42 點，與週三的高低點區間一樣不到 50 點，持續狹幅整理，成交金額也僅 618.79 億元，小於 5 日均量（630 億元）及 20 日均量（723 億元），顯示追價人氣不足：三大法人合計賣超 19.10 億元，外資賣超 18.49 億元、投信賣超 2.15 億元、自營商買超 1.54 億元。2. 由以下三個面向檢驗台股方向及強弱：(1)、量能：上攻量能能持續大於 20 日均量方能化解震盪盤局。(2)、均線：壓力為 9300-9400 點，支撐看月線（9174 點）至季線（9092 點）。(3)、技術指標：RSI 及 KD 開口轉下，5 日 RSI（62）及 9 日 K 值（84）大於 50，短線偏多震盪。【強勢】太陽能、車用、IC 設計、醫美1. 太陽能：部份產品報價止跌，3514 昱晶、3576 新日光、3519 綠能、2406 國碩、3691 碩禾反彈。2. 車用：3552 同致 9 月營收月增 20％，2115 六暉 - KY 電動自行車與卡車氣門嘴需求優於預期。3.IC 設計：6462 神盾受惠指紋辨識滲透率提升，8081 致新的音圈馬達（VCM）驅動 IC 第 4 季出貨放量，8299 群聯低價記憶體庫存將貢獻獲利。4. 醫美：生技資金週四移轉到醫美，4137 麗豐 - KY、4190 佐登 - KY 為族群亮點。【選股方向】：蘋概、半導體、物聯網、智慧汽車、工業自動化、電競、生技等。,"[['－', '追', '價'], ['點區間', '爲', '42點'], ['三大法人', '合計賣超', ' 億元'], ['攻量', '化解', '震盪盤局'], ['壓力', '爲', '93009400點'], ['62RSI', '大於', ' 50'], ['部份產品報價', '止', '跌'], ['電動自行車需求', '優於', '預期'], ['指紋辨識滲透率', '提升', '出貨放量'], ['週四', '移轉到', '醫美'], [' - KY、4190 佐登 - KY ', '爲', '族羣'], [' - KY、4190 佐登 - KY ', '爲', '族羣']]"
0,20161006_521,〈人物〉97歲「東元阿嬤」傳教養生 做出全球第一本聾人聖經東元 ()60 週年慶，「東元阿嬤」林明穱也開心的到現場參與，會長黃茂雄在致詞時特別介紹創辦人夫人今年 97 歲了，還是非常健康，詢問要不要上台說說話，阿嬤林明穱開心的表示，今天很感動這麼多人到慶祝大會來，非常高興、非常感動，希望以後大家繼續跟東元做朋友；會後媒體詢問如何養生，她的女兒也是黃茂雄夫人黃林和惠馬上說，阿嬤「傳耶穌」養生，阿嬤更是高興的宣布已經做出全球第一本聾人聖經，要讓聽不見的朋友也可以接觸主耶穌福音。會長黃茂雄今日在致詞時特別介紹東元創辦人及第一任董事長林和引的夫人，今年 97 歲了，還是非常健康，「東元阿嬤」林明穱更開心的上台講話，她表示，今天很感動這麼多人、這麼多貴賓到慶祝大會來，非常高興、非常感動，希望以後大家同樣對東元的領導班底給予支持；林明穱指出，今天好高興，東元以前很順利，希望以後大家也繼續跟東元做朋友，繼續支持東元。慶祝大會結束，在台上忙著拍照時，阿嬤坐在台下等候，媒體趨前問候，詢問如何養生，黃林和惠馬上接口說阿嬤「傳耶穌」養生，阿嬤則是說，以前打桌球的朋友打到 80 歲都不能打了，她打到 91 歲，因為有次打球受傷後才沒打，現在就是很關心如何推動讓聽障朋友也可以接觸主耶穌。阿嬤說，有一次朋友到家裡吃飯，說高雄有「耳聾教會」，從那時候開始就在想聽不到要怎麼傳耶穌? 所以開始打電話到南部詢問，一路走過來，現在已經做出全世界第一本聾人聖經，阿嬤還說，除了聖經，還有漫畫傳教可以在手機上看，讓更多的聽障朋友可以接觸到主耶穌福音。在「東元阿嬤」林明穱關心下，催生出台北設立第一個專屬聽損者的恩典以法大教會，希望未來台灣各地教會可以為各地方聽損者建立以法大教會，讓聽損者也可以領受福音。,"[['97歲東元阿嬤傳教養生', '做出', ' 週年慶'], ['東元阿嬤', '到', '現場'], ['，', '會長', '黃茂雄'], ['這麼多人', '到', '來'], ['大家', '做', '朋友'], ['媒體', '詢問', '養生'], ['她女兒', '也是', '黃茂雄夫人黃林'], ['阿嬤', '傳', '耶穌'], ['阿嬤', '宣佈', '做出聾人聖經'], ['會長黃茂雄', '介紹', '林和引夫人'], ['她', '表示', '很感動高興'], ['大家', '給予', '支持'], ['林明穱', '指出', '好高興'], ['大家', '做', '朋友'], ['阿嬤', '坐在', '臺下'], ['阿嬤', '傳', '養生'], ['朋友', '到', '家裏'], ['高雄', '有', '耳聾教會'], ['阿嬤', '說', '還有看漫畫傳教'], ['臺北', '設立', '專屬聽損者'], ['各地教會', '建立', '大教會']]"
0,20161006_522,台銀雞年生肖銀幣限量6萬枚 首度推出早鳥優惠價時序進入第 4 季，明年就是雞年了，台灣銀行今 (6) 日宣布推出兩款「限量」發行的雞年生肖銀幣和雞年金鑽條塊，其中，雞年生肖銀幣不但只限量 6 萬枚，還首度推出「早鳥優惠價」，讓喜愛收藏套幣和的民眾可以搶購。台銀董長呂桔誠表示，「丁酉雞年精鑄生肖銀幣（鍍金版）」及「台銀金鑽條塊（生肖版）」今天起正式開賣，「雞」與台語「家」同音，寓意「起家」，興家立業、和樂融融，正好迎接美好吉祥的雞年。丁酉雞年精鑄生肖銀幣為鍍金版生肖系列銀幣之第 10 枚，每枚成色含銀千 分之 999、重 1 英兩 (1 oz.)、直徑 3.8 公分，限量發行 6 萬枚，由中華郵政、華南銀行、土地銀行、中小企業銀行、玉山銀行、瑞興銀行、台灣銀行及其網站於 105 年 10 月 6 日同步發售。生肖銀幣 1980 元，但 11 月 30 日前預購，可享早鳥價 1888 元優惠。呂桔誠說，銀幣主題圖案為「闔家歡樂」，圖案中公雞、母雞帶領小雞覓食，表達出全家福歡樂氣氛，幣面右上角為隱藏圖案設計，向左右輕轉，即可分別顯現「玉山」及「臺灣」之圖形。幣面並刻鑄有「丁酉年」、含銀成色「Ag999」、重量「1 oz.」、「台灣銀行委製」及「 中央造幣廠承製」等字樣。至於雞年金鑽條塊，正面標示台灣銀行及中央造幣廠的標章及中英文名稱、重量 (壹台兩 37.5g)、含金成色 (Fine Gold 999.9) 及條號。圖案面也是公雞、母雞帶領小雞覓食，並具幻彩等防偽設計，可回售該行，流通性佳。條塊的買賣價則要參考台灣銀行網站新臺幣計價牌價 (http://rate.bot.com.tw/Pages/Static/UIP005.zh-TW.htm)。受到國際金價今年都在高檔影響，雞年金鑽條塊上市首日售價 4.93 萬元，較去年猴年上市首日價格高出 3000 元。,"[['首度', '推出', '早鳥優惠價'], ['推出早鳥優惠價時序', '進入', ' 季'], ['明年', '就是', '雞年'], ['臺灣銀行', '宣佈', '生肖銀幣'], ['讓', '喜愛', '和套幣'], ['臺銀董長呂桔誠', '表示', '鍍金版丁酉雞年精鑄生肖銀幣開賣'], ['每枚成色', '含', '分999銀千'], ['呂桔誠', '說', '銀幣主題圖案爲歡樂'], ['銀幣主題圖案', '爲', '歡樂'], ['右上角', '爲', '隱藏圖案設計'], ['幣面', '鑄有', '等丁酉年字樣'], ['圖案面', '也是', '公雞帶領'], ['//rate.bot.com.tw/Pages', 'Static/UIP005.zh', '-TW.htm']]"
0,20161006_523,台股盤後－油價漲節能股歡顏 台積電鴻海尾盤反攻 小漲12點台股早盤延續前幾天的弱勢整理，僅由個股表現，其中太陽能股因為國際油價將上看 70 美元，表現一枝獨秀，午盤過後電金權值股，台積電、鴻海、宏達電、第一金、中信金均見到資金湧入，推升股價及指數翻紅，終場上漲 12.03 點，以 9284.31 點作收，成交值微增到 617.24 億元。櫃買市場走勢則強於集中市場，全場均在平盤之上，終場上漲 0.37 點，以 131.72 點作收，成交值 208.09 億元。台股今天類股漲跌相當，其中以油電燃氣漲幅最高，達 1.58%，生醫、半導體、造紙、化學生醫、塑膠、鋼鐵、資訊服務、電子通路、其他電子、汽車、通信網路、航運、電器電纜也均收紅。至於下跌的類股則以食品跌幅最重，達 1%，橡膠、光電、觀光、貿易百貨、紡纖、電腦設備、建材營造、電子零組件、光電、金融、玻陶、化學、電機機械等則均收黑。太陽能在國際油價反彈下，整體族群氣勢強盛，包括嘉晶、益通、昱晶、綠能、昇陽光電、新日光、達能、碩禾、中美晶、茂迪等均走揚。台積電則是重新回神，順利站上前波高點 187.5 元；鴻海也在蘋果拉貨效應推升下，股價再度見到 80 元大關。宏達電更是演出甩尾走勢，午盤過後急速拉高，終場上漲 2.7 元，直逼 90 元大關。樂陞則是繼續下殺，中場過後隨即遭摜壓到跌停。運達投顧分析師顏逸民表示，台股目前仍屬於多方控盤的態勢，在熱錢並未消賽之前，如果明天能夠補量，則周線仍有相當高的機會收紅，現在台股的多方族群是太陽能，一方面是因為國際油價走揚，另一方面也是受惠於太陽能電池報價回升，只要權值股能夠守穩，台股挑戰前波高點 9303 點的機率仍不低。,"[['臺積電鴻海尾盤', '反攻', '節能股歡顏'], ['小漲臺股早盤', '延續', '前幾天弱勢整理'], ['其中太陽能股', '看', '70美元'], ['股價', '翻', '紅'], ['全場', '在', '平盤之上'], ['生醫', '收', '紅'], ['等橡膠', '收', '黑'], ['股價', '見到', '80元大關'], ['宏達電', '是', '甩尾走勢'], ['樂升', '是', '下殺'], ['投顧分析師顏逸民', '表示', '臺股屬於多方控盤態勢'], ['臺股', '屬於', '多方控盤態勢'], ['周線', '有', '高機會收紅'], ['高機會', '收', '紅'], ['多方族羣', '是', '太陽能']]"
0,20161006_524,"已故辜濂松掏空3億美元？中信金喊冤：盼司法盡速澄清真相特偵組查中信金案查出，原來掏空中信金 3 億美元一案，早在 2004 年中信金創辦人辜濂松還在世的時候就開始，且辜濂松也是被告，只是因為辜濂松已經過世，因此特偵組將他不起訴。針對最高法院檢察署特別偵查組昨 (5) 日發佈新聞稿指稱，中信金控 () 創辦人辜濓松亦為侵占中信金控資產的共犯，中信金今天發表嚴正聲明，辜濓松創辦人處事一向公私分明，時常自己貼錢為國家拓展民間經貿關係，中信金控衷心期盼司法機關能儘速澄清真相，還辜濓松創辦人一個公道。過去近半個世紀以來，已故的中信金控創辦人辜濓松先生不但是中國信託的靈魂人物，也在國內工商社團活動上與政府兩岸事務上扮演要角，是臺灣最具聲望的企業領袖之一，更是國內第一位擔任「無任所大使」的企業家，在經貿外交方面成就非凡。對於辜濓松創辦人遭受特偵組如此指控，中信金控全體同仁同感震驚、備感遺憾！與辜濓松創辦人共事長達 30 年的中國信託商業銀行副董事長陳國世聽聞此事後直言：「真的不可能！太不可思議了！」陳國世說，「他（辜濓松創辦人）花自己的錢為國家做事，勉勵公司同仁要以國家為重，推展相關金融業務，也要跟著國家的政策走，他也時常教導大家要『誠信』、『正直』，這樣的人，怎麼可能會拿公司的錢去做他私人的事情？」況且，依辜仲諒的律師團聲明顯示，辜濓松創辦人先前於 2006 年 7 月間即曾以自己的資產籌措 1.2 億美元，填補中國信託資產管理公司海外投資的虧損。另於「紅火案」發生後，辜濓松創辦人又再次於 2006 年 9 月間自行籌資先還清所謂「紅火案損失」3,000 萬美元。以如此行事作風之人，焉有可能會掏空、侵占自己公司的資產？據辜仲諒的律師團表示，整本起訴書中根本看不到有所謂「辜氏父子聯手掏空公司」的具體證據，完全是憑推論與臆測就予以起訴，確實令人感到遺憾！辜濓松創辦人處事一向公私分明，時常自己貼錢為國家拓展民間經貿關係。早年接受媒體訪問時，辜濓松創辦人說道，「作為中華民國的國民，這個國家、土地，是我們自己的子孫要生活、要發展的地方，我們為什麼不花一點自己的時間、拿一點自己的金錢，幫政府爭取國際上應該有的合理地位。」中信金控強調，辜濓松創辦人生前在臺灣外交陷入困頓之際，透過各國際經貿組織推動民間實質經貿外交，近半世紀來以愛國熱忱及豐沛國際人脈，造訪的國家與政經官員不計其數，致力維護臺灣的國際地位，其貢獻為歷任政府官員及社會各界有目共睹，更被譽為「永遠的無任所大使」、「企業外交家」。中信金控衷心期盼司法機關能儘速澄清真相，還辜濓松創辦人一個公道。","[['已故辜濂松', '掏空', '3億美元'], ['盼司法', '澄清', '中信金案查出開始'], ['中信金案', '查出', '開始'], ['辜濂松', '也是', '被告'], ['昨', '發佈', '新聞稿'], ['亦', '爲', '侵佔金控資產共犯'], ['爲', '侵佔', '金控資產'], ['中信金', '發表', '嚴正聲明'], ['國家', '拓展', '民間經貿關係'], ['中信金控', '期盼', '司法機關澄清真相'], ['司法機關', '澄清', '真相'], ['先生辜濓松', '但是', '靈魂人物'], ['臺灣', '最具', '聲望'], ['第一位', '擔任', '無任大使'], ['辜濓松創辦人', '遭受', '特偵組'], ['辜濓松創辦人', '遭受', '特偵組'], ['全體同仁', '同感', '震驚'], ['陳國世', '說', '他做事'], ['這樣的人', '做', '私人事情'], ['辜仲諒律師團聲明', '顯示', '籌措'], ['辜濓松創辦人', '籌措', '1.2 億美元'], ['作風人', '掏空', '自己公司資產'], ['辜仲諒律師團', '表示', '看不到具體證據'], ['自己', '貼', '錢'], ['自己', '貼爲', '國家'], ['早年', '接受', '媒體訪問'], ['辜濓松創辦人', '說道', '這個國家是我們自己子孫生活地方'], ['這個國家', '是', '我們自己子孫生活地方'], ['我們', '花', '自己時間'], ['中信金控', '強調', '透過經貿組織'], ['人生', '陷入', '困頓'], ['外交', '陷入', '困頓'], ['其貢獻', '爲', '歷任有目共睹'], ['中信金控', '期盼', '司法機關澄清真相'], ['司法機關', '澄清', '真相']]"
0,20161006_525,辜濓松被控侵占資產 中信金聲明駁斥 盼司法釐清還公道記者顏真真／台北報導 針對最高法院檢察署特別偵查組指稱，中信金控創辦人辜濓松為侵占中信金控資產的共犯，中信金 6 日發表嚴正聲明，除表達震驚、遺憾之外，並強調辜濓松處事一向公私分明，時常自己貼錢為國家拓展民間經貿關係，中信金衷心期盼司法機關能盡速澄清真相，還辜濓松創辦人一個公道。中信金指出，過去近半個世紀以來，已故的中信金創辦人辜濓松不但是中國信託的靈魂人物，也在國內工商社團活動上與政府兩岸事務上扮演要角，是台灣最具聲望的企業領袖之一，更是國內第一位擔任「無任所大使」的企業家，在經貿外交方面成就非凡。對於辜濓松遭受特偵組如此指控，中信金全體同仁同感震驚、備感遺憾。與辜濓松創辦人共事長達 30 年的中信銀行副董事長陳國世聽聞此事後，他更直言：「真的不可能！太不可思議了！」陳國世說，辜濓松創辦人花自己的錢為國家做事，勉勵公司同仁要以國家為重，推展相關金融業務，也要跟著國家的政策走，他也時常教導大家要「誠信」、「正直」，這樣的人，怎麼可能會拿公司的錢去做他私人的事情？不僅如此，中信金也說，依照中信慈善基金會董事長辜仲諒的律師團聲明顯示，辜濓松先前在 2006 年 7 月間即曾以自己的資產籌措 1.2 億美元，填補中國信託資產管理公司海外投資的虧損。另在「紅火案」發生後，辜濓松又再次在 2006 年 9 月間自行籌資先還清所謂「紅火案損失」3000 萬美元，以如此行事作風之人，焉有可能會掏空、侵占自己公司的資產？根據辜仲諒的律師團表示，起訴書中根本看不到有所謂「辜氏父子聯手掏空公司」的具體證據，完全是憑推論與臆測就予以起訴，確實令人感到遺憾。中信金強調，辜濓松創辦人處事一向公私分明，時常自己貼錢為國家拓展民間經貿關係，早年接受媒體訪問時，辜濓松曾說，「作為中華民國的國民，這個國家、土地，是我們自己的子孫要生活、要發展的地方，我們為什麼不花一點自己的時間、拿一點自己的金錢，幫政府爭取國際上應該有的合理地位。」中信金還說，，辜濓松創辦人生前在台灣外交陷入困頓之際，透過各國際經貿組織推動民間實質經貿外交，近半世紀來以愛國熱忱及豐沛國際人脈，造訪的國家與政經官員不計其數，致力維護台灣的國際地位，其貢獻為歷任政府官員及社會各界有目共睹，更被譽為「永遠的無任所大使」、「企業外交家」，中信金衷心期盼司法機關能盡速澄清真相，還辜濓松創辦人一個公道。 『新聞來源／NOWnews 』,"[['辜濓松', '被控', '中信金聲明駁斥還公道記者'], ['辜濓松', '被控', '中信金聲明駁斥還公道記者'], ['中信金聲明', '駁斥', '還公道記者'], ['辜濓松被控中信金聲明駁斥還公道記者顏真真／臺北報導\xa0', '指稱', '聲明'], ['中信金控創辦人辜濓松', '爲', '共犯'], ['中信金控創辦人辜濓松', '爲', '共犯'], ['國家', '拓展', '民間經貿'], ['國家', '拓展', '民間經貿'], ['能', '澄清', '真相'], ['中信金', '指出', '但是'], ['創辦人辜濓松', '但是', '靈魂人物'], ['臺灣', '最具', '聲望'], ['第一位', '擔任', '無任大使'], ['辜濓松', '遭受', '特偵組'], ['全體同仁', '同感', '震驚'], ['陳國世', '說', '創辦人花自己錢'], ['創辦人', '花', '自己錢'], ['這樣的人', '做', '私人事情'], ['中信金', '說', '籌措'], ['中信金', '強調', '分明'], ['自己', '貼', '錢'], ['自己', '貼爲', '國家'], ['這個國家', '是', '我們自己子孫生活地方'], ['我們', '花', '自己時間'], ['」中信金', '說', '透過經貿組織'], ['外交', '陷入', '困頓'], ['外交', '陷入', '困頓'], ['其貢獻', '爲', '歷任政府官員有目共睹'], ['能', '澄清', '真相']]"
0,20161006_526,強化法遵一起來！台銀呂桔誠10月赴美視察 12月領航國銀紐約研討會兆豐銀行紐約分行被重罰案殷鑑不遠，龍頭台灣金控董事長呂桔誠上任後首要任務就是強化法遵，10 月下旬將親自赴美國視察紐約、洛杉磯兩家分行。不只重視台銀的內稽內控，呂桔誠同時身任銀行公會理事長，也將領航全體國銀動起來，12 月將召集全體國銀進行海外分行法遵研討會，首場研會討就選在紐約。台銀已在 9 月收到了紐約、洛杉磯分行的年度金檢報告，均以第二級的「滿意」過關，但呂桔誠 10 月下旬仍將親赴美國視察紐約和洛杉磯分行，呂桔誠今 (6) 日出席臺灣銀行貴金屬新品上市發表會會後接受採訪時表示，希望透過親赴當地拜會，讓對方了解台銀重視在美國分行法遵、風管的誠意。呂桔誠強調，台灣銀行一直以來對於法遵、內稽內控都很重視，10 幾年前，紐約、東京等分行就已經設專職法遵主管，現在更進一步把一些海外分行的兼任法遵主管轉為專任，以更加強海外分行的法遵，包括：倫敦和新加坡分行 2 家分行，當地法遵主管原本容許兼任，但台銀自己把標準提高，現已轉為專任，目前台灣銀行所有的海外分行只剩下福州分行不是專任法遵主管。呂桔誠表示，今年整體獲利受法遵成本影響有限，整體來說，雖然法遵和內稽內控是個成本，但相信長期而言會是正確的投資。成本雖然增加，但是仍不改台銀的海外布局策略，呂桔誠說，台灣銀行正規劃在澳洲雪梨再設新分行，相關負責人員正好就在今天飛往雪梨，籌備需要半年，所以預計明年第 2 季開設雪梨分行。不只台銀本身強化法遵，呂桔誠也將透過銀行公會領軍全體國銀動起來，呂桔誠表示，銀行公會將於 12 月初在紐約舉辦第一場海外分行法遵研討會，現在正積極籌辦中，接下來還會有倫敦和香港 2 場研討會。據了解，首場的紐約法遵研討會，不僅邀所有國銀在紐約、洛杉磯等分行的經理人、內稽內控及法遵人員參與，也會力邀美國當地各州監理機關官員列席指導，而當地監理機關的參與指導，正是呂桔誠所以規劃直接在紐約當地舉行，而非僅在台灣舉辦法遵座談會的最大考量。,"[['臺銀呂桔誠', '赴', '美'], ['首要任務', '就是', '強化法遵'], ['呂桔誠', '身任', '銀行公會理事長'], ['臺銀', '收到', '年度金檢報告'], ['呂桔誠', '親赴', '美國'], ['呂桔誠', '日出席', '發表會會'], ['呂桔誠', '強調', '臺灣銀行重視'], ['等紐約分行', '設', '遵主管'], ['當地法遵主管', '容許', '兼任'], ['海外分行', '剩下', '福州分行'], ['呂桔誠', '表示', '整體獲利遵成本影響'], ['整體獲利', '遵', '成本影響'], ['內稽內控', '是', '個成本'], ['而言長期', '是', '正確投資'], ['呂桔誠', '說', '臺灣銀行劃設新分行'], ['臺灣銀行劃', '設', '新分行'], ['負責人員', '飛往', '雪梨'], ['呂桔誠', '透過', '全體國銀'], ['呂桔誠', '表示', '銀行公會舉辦海外分行法'], ['銀行公會', '舉辦', '海外分行法'], ['監理機關參與指導', '正是', '最大考量'], ['舉辦法', '遵', '座談會'], ['舉辦法', '遵', '座談會']]"
0,20161006_527,大前研一與黃茂雄40年情誼深 祝賀東元60歲生日東元 ()60 歲了，今 (6) 日盛大舉辦週年慶祝大會，高齡 97 歲的「東元阿嬤」林明穱、會長黃茂雄，等都到場同慶，會中還有一位神秘佳賓，國際知名趨勢大師大前研一特別錄致詞祝賀，強調未來所有產業都將面臨數位革命的考驗，東元也無法置身事外，特別是未來的 10 年，將是最重要的關鍵時期。東元 60 週年慶祝大會，展現集團人情味，同時邀請了東元創辦家族後代及退休員工出席，東元指出，近年來因應科技與物聯網的發展趨勢，未來將鎖定系統整合，成為系統解決方案提供者，自動化、智能化管理者，跨入工業 4.0 域，從供應產品轉進系統整合。東元表示，已積極布局產線自動化，其中，在台灣中壢廠已完成將電工線產區導入自動化管理，預估未來將提升產品品質及交期；另外，中國大陸無錫新成立的沖壓中心，投入 6700 萬美元採用高規格級綠建築，及智慧工廠概念設計，搭配最頂級設備，打造未來重要零件值應中心。除了與會貴賓的致詞，大前研一也特別錄影致詞祝賀東元 60 歲生日，他表示，與會長黃茂雄有 40 年的情誼，他同時強調，未來所有產業都將面臨數位革命的考驗，包括 FinTech(金融科技)、IOT(物聯網)、GPS(全球定位系統)、Smartphone Centric Ecosystem(智慧生態系統) 等，東元集團也無法置身事外，特別是未來的 10 年將是最重要的關鍵期。,"[['所有產業', '面臨', '數位革命考驗'], [' 10 年', '是', '關鍵時期'], ['東元', '指出', '整合'], ['東元', '表示', '佈局自動化'], ['臺灣中壢廠', '完成', '導入'], ['衝壓中心', '投入', '6700萬美元'], ['他', '表示', '所有產業面臨數位革命考驗'], ['與會長黃茂雄', '有', '40 年情誼'], ['所有產業', '面臨', '數位革命考驗'], ['10年', '是', '重要關鍵期']]"
