,News,All,SVO
0,20160929_1200,劉德音：台積電先進製程5奈米如火如荼進行、3奈米研發中台積電 () 共同執行長劉德音今 (29) 日出席半導體協會年會，會中針對半導體趨勢發表演說，演講開頭就強調，未來半導體發展還是非常光明，四大動能將驅動台積電營運持續成長，而在先進製程進度上，目前 5 奈米進度如火如荼進行中，10 奈米製程預計年底至明年第 1 季量產，7 奈米良率也在發展進度內，而 3 奈米也有 300-400 名研發團隊研發發展中。劉德音今日赴半導體協會年會發表演講，演講前頭就說半導體發展仍是非常光明，台灣也是全球最堅強的堡壘。他表示，未來半導體將在四個大應用面向帶動下持續發展，台積電也同樣受到帶動，包含智慧型手機、高效運算，車用與物聯網相關，其中智慧型手機仍將是技術創新的主要平台，目前全球有 15-20 億台的規模，可見到最新的技術都在手機上發展出來。另外則是高效運算，尤其是深度學習與人工智慧，以及車用與物聯網，都可望趨動半導體業持續成長。劉德音說，現在 30 歲的年輕人活在大時代中，許多創新發明持續發生中，而基礎都來自半導體，未來 GOOGLE、臉書與微軟等會持續布局更多新創新服務，提高附加價值，其基礎也都是半導體技術。他表示，台灣全球半導體市佔率 21%，晶圓代工、封測代工都是全球第一，IC 設計全球第二，記憶體全球第四，系統廠來台灣就可一次購足，只要來台灣花一天就可完成相關硬體採購。劉德音強調，技術還是台積電最重要的生命線，今年年底 10 奈米將會進入量產，更先進製程包含 5 奈米已如火如荼進行中，3 奈米也有 300-400 名研發團隊研發中，甚至還有研究人員研究 2 奈米技術，顯示台積電未來將持續投資與研究。另外，台灣半導體業佔全體上市櫃公司獲利達 26%，帶動周邊更多其他電子、電子零組件、電子通路相關產業，未來創新、應用會更廣泛，台灣不只是跟隨著，也要持續發展創新技術。在投資金額部分，劉德音強調，半導體投資金佔全體上市櫃製造公司比重為 21.4%，RD 佔了 11.2%，去年投資金額雖然下滑，但今年與未來幾年，投資金額都會持續成長，未來 5 年投資金額也沒有理由下滑。劉德音認為，半導體正處在大時代當中，可以改變世界，台灣在產業鏈上有優勢，但不可以流失優勢，台積電包含台灣廠商在內，都會持續投資，讓台灣持續在產業上具有影響力。,"[['長劉德音', '執行', '日出席半導體協會年會'], ['演講開頭', '強調', '光明'], ['奈米良率', '在', '發展進度內'], ['3奈米', '也有', '研發團隊研發中'], ['劉德音', '赴', '半導體協會年會'], ['臺灣', '也是', '堅強堡壘'], ['他', '表示', '半導體發展'], ['臺積電', '受到', '帶動'], ['智慧型手機', '是', '主要平臺'], ['全球', '有', '15-20億臺規模'], ['深度學習', '可望', '趨動半導體業成長'], ['劉德音', '說', '30年輕人活'], ['30年輕人', '活在', '大時代中'], ['許多創新', '發明', '發生中'], ['基礎', '來自', '半導體'], ['等GOOGLE', '佈局', '新創新服務'], ['其基礎', '都是', '半導體技術'], ['他', '表示', '晶圓代工都是第一'], ['晶圓代工', '都是', '第一'], ['IC', '設計', '第二'], ['系統廠', '來', '臺灣'], ['劉德音', '強調', '還是'], ['技術', '還是', '重要生命線'], ['今年年底10奈米', '進入', '量產'], ['先進製程', '包含', '5奈米進行中'], ['奈米', '也有', '研發團隊研發中'], ['積電', '持續', '投資'], ['臺灣', '只是', '跟隨著'], ['劉德音', '強調', '全體上市櫃製造公司比重爲21.4%'], ['全體上市櫃製造公司比重', '爲', '21.4%'], [' RD', '佔', '11.2%'], ['劉德音', '認爲', '流失優勢'], ['半導體', '處在', '大時代當中'], ['臺灣', '有', '優勢'], ['臺積電', '包含', '臺灣廠商']]"
0,20160929_1201,政策利率不變 央行終止四連降中央銀行理事會今天 (二十九日) 決議，政策利率維持不變，央行重貼現率仍維持在 1.375％。由於全球景氣復甦力道遲緩，國內出口持續衰退，中央銀行自去年第三季理事會起連續四季調降政策利率半碼（0.125 個百分點），希望拉抬經濟，今天央行召開理事會決議政策利率按兵不動。國內金融界人士普遍認為，由於今年出口減幅縮小，並在七月終止連十七黑，基本面未再惡化，加上近期外資匯入力道也不像前一波來得大，大升壓力減輕，央行本季沒有必要再降息。目前央行的重貼現率、擔保放款融通利率及短期融通利率分別為 1.375%、1.75% 及 3.625%。（資料照片）,"[['央行', '終止', '今天二十九日'], ['中央銀行', '調降', '個百分點'], ['央行', '召開', '理事會決議利率'], ['金融界人士', '認爲', '央行降息'], ['前一波', '匯入', '力道']]"
0,20160929_1202,終止連四降！央行決議維持利率不變MoneyDJ 新聞 2016-09-29   記者 陳怡潔 報導中央銀行今 (29) 日下午召開第三季理監事會議，會後宣布維持政策利率不變，終止了先前連四季的降息循環。央行指出，鑒於國際經濟成長和緩，國內景氣回穩，加上明年通膨展望溫和，央行理事會認為維持利率不變，有助物價與金融穩定，且維持貨幣寬鬆，可協助經濟成長。因此，央行宣布維持重貼現率在 1.375%。,"[['央行', '決議', '維持召開第三季理監事會議'], ['央行理事會', '認爲', '維持利率不變'], ['央行宣佈', '維持', '重貼']]"
0,20160929_1203,華冠投顧 量價顯天機 藍慶賜 盤後分析◆盤勢解析外資拉高摩台期結算價，但最後一盤現貨殺跌 28 點，這些小動作說明外資在 9300 的位階也居高思危。9/19 介紹的大同 (2371) 從 6.76 漲至今日高點 8.74 漲幅 30%，今日暴量收小黑短線恐陷入修正不宜追高。10 月的操作策略，放棄作多高基期電子股，高基期獲利有限風險高；相反的佈局低基期生技醫療股，低基期爆發力強風險低。生技醫療股基期較低的個股。例如神隆 (1789)、健亞(4130)、聯合(4129)、中裕(4147)、太景(4157)、浩鼎(4147)、百研(3205)、美時(1795)、安成藥(4180) 等。◆類股與個股表現聯合 (4129) 多 73.7濱川 (1569)，券賣 20.6-20.7。 投資有風險應嚴格遵守操作紀律，停損被視為最重要的操作紀律，無論是何原由若達到停損價位應立即執行，請確實執行。作者: 華冠投顧 藍慶賜 (天機老師) 分析師以上內容資料僅供參考，不作買賣推薦之用，投資本有風險，請自負盈虧。,"[['盤勢解析外資', '分析', '拉高摩臺期結算價'], ['這些小動作', '說明', '居高思危'], ['外資', '在', '9300'], ['外資', '在', '9300'], ['2371', '漲', '30%漲幅'], ['券', '賣', '20.6-20.7'], ['\xa0投資', '有', '風險'], ['停損', '視爲', '操作紀律'], ['何原由', '達到', '停損價位'], ['本', '有', '風險']]"
0,20160929_1204,丞唐講股：大盤補攻 好股輪漲台灣颱風假期間，OPEC 石油輸出國達成協議減產，原油大漲，帶動國際股市上攻，美股挑戰季線，指數也再次挑戰新高。台股今日 (29) 開盤補攻，開高後，(2330)台積電、(2317)鴻海、股王 (3008) 大立光等領軍電子股強攻，盤中一度大漲 108 點，終場收漲 76 點，以 9270 點作收，成交量 878 億元。類股當中，權值股包括 (2330) 台積電、(2317)鴻海、(2002)中鋼、(2881)富邦金等均收紅。高價股當中，股王 (3008) 大立光收漲 2.12％，為 3845 元；股后 (3658) 漢微科收跌 1.46％，為 1350 元；近三個月以來，一路推薦的 (6510) 精測，高價股當中相關晶圓檢測業務龍頭，在 (3658) 漢微科被收購之後資金的唯一選項，股價果然從 685 元波段大漲至 1200 元，今日仍收漲 1160 元，上漲 3.58%；過去一個月，夾帶虹膜辨識 IR LED 題材的 (4956) 光鋐兩階段狂漲累積 120% 的完美操作後股價整理，今日以 22 元作收，上漲 1.39%。新上櫃股方面，過去兩週，中秋節連假前夕的 9 月 14 日，建議著墨結合德國股神跟蘋果題材的 LED 導線架大廠 (6548) 長華科，今日盤中再創高價 236.5 元，股價狂漲至今累積達 66%，並在週一建議投資朋友獲利調節；此外，為國內醱酵專業生產製造商的 (8279) 生展，以冬蟲夏草人工養殖技術為關鍵性產品利器，且為國際上唯一成功開發商，可望主導賣方市場，占有極高戰略地位，週一上櫃股價自 73 元狂飆至最高 139 元，今日盤中最低來到 97 元，終場仍收漲 109.5 元。在 10 月歐洲原料藥展及中國藥材價格持續攀升之下，股價可期。以上資料由 華冠投顧 何丞唐 整理提供※以上內容僅供參考，投資人於投資前請審慎評估。,"[['丞唐', '講', '股'], ['石油輸出國', '達成', '協議'], ['大漲', '帶動', '國際股市攻'], ['指數', '挑戰', '新高'], ['權值股', '包括', '收紅'], ['推薦6510精', '測', '股價大漲'], ['股價', '大漲至', '1200 元'], ['，', '夾帶', 'IR LED題材'], ['墨', '結合', '德國股神'], ['墨', '結合', '德國股神'], ['投資人', '請', '審慎']]"
0,20160929_1205,央行維持利率不變 終止連續四季降息步伐中央銀行理監事會會議今 (29) 日決定維持利率不變，代表政策利率的重貼現率維持 1.375% 不動，終止連續四季的降息步伐。央行自去年第三季起已連續四季降息半碼，重貼現率來到 1.375% 的史上次低水準，距離金融海嘯期間的歷史新低的 1.25% 僅差半碼。,"[['政策利率重貼現率', '維持', '不動'], ['，', '距離', '金融海嘯']]"
0,20160929_1206,台灣加權指數今(29)日收盤上漲0.83% 報9270.90點台灣今 (29) 日收盤上漲 76.38 點或 0.83%，報 9270.90 點，成交金額 878.81 億元。,"[['日收盤', '上漲', '76.38點']]"
0,20160929_1207,群益期貨台股期權盤後－外資摩台拉高  台股量衝價揚◆盤勢分析在颱風干擾買盤因素消除，美股亦表現上揚回穩，以及摩台外資拉高結算下，激勵台股今日呈現量價齊揚格局，盤中一度攻克 9300 整數大關，成交量放大至 878 億。台股雖然最後一盤拉回留上影線，但在今日升值熱錢略有湧進台股下，目前待量能持續放大，短線上台股仍有機會向上突破走高。外資現貨再由賣轉買超 133 億，期貨淨多單大增至 85479 口。自營商選擇權淨部位，今日呈現買買權與賣賣權佈局動作。十月選擇權籌碼為偏多，賣權 OI 大於買權 OI 差距擴大至六萬九千餘口，賣權最大量 OI 上移至 8900 履約價，並集中向上履約價作增量布局。新開周選方面，賣權 OI 總量依舊呈現大於買權，短線上仍為多方態勢。綜合以上，整體籌碼面為偏多格局，外資期現同步作多，自營選擇權仍以偏多操作。雖然目前上檔賣壓仍屬沉重，讓今日台股收上影線，短線上或再回檔修正，但在量能放大，以及均線依舊多頭排列下，未來仍以震盪偏多看待台股。另外，今日下午公布 8 月景氣燈號呈現綠燈，短線上亦有利台股緩步走揚。,"[['颱風', '干擾', '買盤'], ['颱風', '干擾', '買盤'], ['激勵臺股', '表現', '呈現齊揚格局'], ['成交量', '放大至', '億878'], ['升值熱錢', '湧進', '下'], ['外資現貨', '賣轉買超', '133億'], ['十月選擇權籌碼', '爲', '多'], ['賣權最大量OI', '移至', '8900履約價'], ['賣權OI總量', '呈現大於', '買權'], ['整體籌碼面', '爲', '多格局'], ['上檔賣壓', '屬', '沉重'], ['景氣燈號', '呈現', '綠燈'], ['短線上', '有利', '臺股走揚']]"
0,20160929_1208,鉅亨晚報9月29日◇重要新聞內容■OPEC 達成減產約定 油價狂飆近 6%◇財經新聞■NCC 重審中嘉案 已要求補件、釐清遠傳與中嘉關係 ■8 年來首見！OPEC 達成減產約定 油價狂飆近 6%■沒牛肉光扒糞 川希首場辯論 8400 萬人收看 ■誰說賣不好？傳 iPhone 7 追加 Q4 訂單！出貨上看 8400 萬支 ■施崇棠領軍 華碩三新品挺進日本 衝刺市占率 ◇重要指標■新加坡 8 月進口價格按年跌幅收窄至 5.1%■新加坡 8 月製造產品價格按年跌幅收窄至 7.5%■德國 8 月經季調 ILO 失業率維持 4.2% 紀錄低◇亞洲股市■台灣今 (29) 日收盤漲 76.38 點，漲幅 0.83%，為 9270.90 點，成交金額 878.81 億元。■三大法人合計買超 119.37 億元。外資及陸資買超 133.41 億元，投信賣超 0.24 億元，自營商賣超 13.8 億元。■日經 225 指數上揚 1.39% 或 228.31 點收 16465.40 點。■澳洲 ASX 200 指數上漲 1.09% 或 58.908 點收 5412.350 點。■韓國 Kospi 指數上漲 0.76% 或 15.66 點收 2053.06 點。■截止收盤，上證指報 2998.48 點，漲幅 0.36%。■截至收盤，漲 0.49%，報 23619.65 點。◇台北匯市■兌美元收盤收 31.356 元，升 7.6 分，成交金額 9.05 億美元。開盤價為 31.400 元，最高 31.260 元、最低 31.400 元。,"[['重要新聞內容OPEC', '達成', '減產'], ['財經新聞', '要求', '補件'], ['OPEC', '達成', '減產'], ['■', '沒', '牛肉光扒糞'], ['牛肉光', '扒', '糞'], ['萬人', '收看', '8400辯論'], ['誰', '說', '賣'], ['7iPhone', '追加', 'Q4訂單'], ['三新品', '挺進', '佔率日本'], ['三新品', '挺進', '佔率日本'], ['漲幅', '維持', '點'], ['三大法人合計買', '超', ' 億元'], ['外資買', '超', '133.41億元'], ['自營商賣', '超', '13.8億元'], ['開盤價', '爲', ' 元']]"
0,20160929_1209,台化排放仍不符  彰縣要求下班前補正彰化縣政府表示，台化廠排放仍然不符標準，今天下班前必須補件，否則將勒令停工。爭議多時的台化公司彰化廠，三座氣電共生燃煤鍋爐許可證，原本在九月二十八號就到期，因梅姬颱風來襲，彰化縣政府停班停課順延到今天，經由縣府環保局會同專家學者歷經一個多月來嚴加審查，共駁回三十一次後，終於初步完成審查，縣府環保局長江培根表示，其中 M16、M17 與 M22 鍋爐汽電共生設備，因「生煤含硫分、固定蒸氣水分與揮發物還是沒有符合當初的環評陳諾，違反相關法令，勒令台化公司在今天下班前、也就是午後五點半之前補件再審，否則就會勒令停止運轉，三座鍋爐頂多可持續運轉到今晚 (29 日) 深夜十二點，如果違法運轉將會依法開罰、每座為十萬元，可以連續處罰。,"[['臺化排放', '不符', '  彰縣要求'], ['彰化縣政府', '表示', '臺化廠排放不符標準'], ['臺化廠排放', '不符', '標準'], ['縣府環保局長江培根', '表示', '處罰'], ['勒令臺化公司', '違反', '相關法令'], ['每座', '爲', '十萬元']]"
0,20160929_1210,永豐期貨台指選擇權盤後－颱風假醞釀上攻 台指攻上9300創波段新高◆盤勢分析期貨走勢        週四上漲 101 點至 9253 點。價差方面，逆價差縮至 - 17.9 點，電子期轉為正價差 0.46 點，金融期轉為正價差 2.32 點。現貨部分，三大法人買超 119.38 億元；而在淨部位方面，三大法人多單加碼 5543 口，淨多單增至 29333 口，其中外資多單加碼 7420 口，淨多單增至 85479 口；另外十大交易人中的特定法人，全月份多單加碼 7133 口，淨多單增至 21471 口。台指籌碼面顯示目前法人對指數持中性偏多預期。期貨行情走勢方面，油價強勢反彈帶動美股上漲，國際股市也在台灣颱風假兩天普遍上漲居多，帶動以大漲 74 點開出。隨著現貨開盤後，電子族群表現仍舊亮眼，台積電再次衝高到 187 元，隨後金融跟上漲幅，台指攻上 9300 創波段新高。尾盤有拉回，但仍舊維持多頭格局，終場以大漲 101 點作收。技術面觀察，週四大盤開高走低高帶跳空缺口及上影線中紅 K 站穩 9200 點，但成交量能放大至 880 億元水準，短線量價結構轉為震盪偏多格局。以日線型態來看，目前指數跳空站穩 5 日線支撐，所有均線仍為上彎， 多項技術指標低檔交叉，但量能仍舊略顯不足，短線仍不宜積極追高。操作上建議可待指數回測月線不破後偏多操作，並請嚴設停損。  選擇權分析選擇權從成交量來觀察，買權集中在 9400 點，賣權集中在 9000 點。選擇權未平倉量部分，買權未平倉最大量集中在 9500 點，賣權未平倉最大量集中在 8900 點。全月份未平倉量 put/call ratio 值由 1.25 升至 1.41，大於中性值 1，反應籌碼面為偏多架構。買權平均隱含波動率由 12.21% 降至 11.47%，賣權平均隱含波動率由 16.21% 升至 16.34%，買權降賣權升。選擇權部位顯示偏多。本投資研究報告由永豐期貨股份有限公司版權所有，未經授權，禁止轉載節錄。本資料內容僅供參考，客戶應審慎考量本身之需求與投資風險，本公司恕不負任何法律責任，亦不作任何保證。,"[['颱風', '醞釀', '攻'], ['假', '醞釀', '攻'], ['颱風醞釀攻臺', '指', '攻盤勢期貨走勢\xa0\xa0\xa0\xa0\xa0\xa0 \xa0'], ['電子期', '轉爲', '0.46點'], ['金融期', '轉爲', '正價差點'], ['正', '價差', '2.32'], ['三大法人', '加碼', '5543口'], ['特定法人', '增至', '21471口'], ['臺指籌碼面', '顯示', '偏預期'], ['法人', '持', '中性'], ['指數', '持', '中性'], ['中性', '偏', '多'], ['強勢反彈', '帶動', '上漲'], ['臺', '指', '新高'], ['臺指新高', '攻', '9300'], ['尾盤', '有', '拉回'], ['以', '大漲', '101'], ['大盤', '開', '高'], ['大盤', '開', '高'], ['高帶跳空缺口', '穩', '9200點'], ['成交量', '放大至', '880億元水準'], ['短線量價結構', '轉爲', '震盪格局'], ['所有均線', '爲', '上彎'], ['短線', '不宜', '追高'], ['買權集中', '在', '9400點'], ['賣權', '在', '點'], ['最大量', '集中在', '9500點'], ['最大量', '集中在', '8900點'], ['反應籌碼面', '爲', '偏多架構'], ['選擇權部位', '顯示', '多'], ['客戶', '考量', '本身需求'], ['本公司', '恕', '不負任何法律責任']]"
0,20160929_1211,(飆股第一名)林驛銘【台股攻上9300後之操作為何？】台股因颱風假，今天出現補漲行情，各類股均有漲勢，另外，重建概念股鋼鐵、水泥股也受惠風災重建題材，股價上漲。再加上今日摩台指拉高結算，台股開高走高，最高衝上 9303 點，終場上漲 76 點，以 9270 作收，成交量放大至 878 億元! 行情接下來須注意中央銀行舉行第 3 季理監事會，已連續 4 季調降政策利率各半碼 (0.125 個百分點)，重貼現率從 1.875% 降至 1.375%，此次貼放利率是否調降，須關注將影響台股後市發展。不過我們認為由於年底美聯準會才會升息，因此台灣央行對機率按兵不動的機會很大，可望支撐台股指數走勢。今日盤面上，各類股均有漲勢，除領頭羊台積電 (2330) 強勢上攻至 187..5 元，股價台股「股王」大立光也受到激勵，大漲逾 2%，帶動蘋果供應鏈今日也漲勢強勁，穩懋 (3105) 飆漲逾 9%，緯創 (3231)漲 3.3%，鴻準 (2354) 漲 3.16%。另外，第 3 季營運表現最為悲慘的太陽能族群，今日也出現反彈走勢，包括綠能 (3519) 和茂迪 (6244) 漲幅逾 3%，昱晶 (3514) 和達能 (3686) 亦上漲約 2%。其它重建概念股鋼鐵、水泥股也受惠風災重建題材，股價上漲。接下來操作建議: 可留意產業步入第四季傳統旺季，股價低基期，大戶進貨，正準備發動個股!＊網家 (8044)1. 第三方支付將於第四季正式上線，名稱將為「InterPay」，順利的話，最快 10 月底就可以起跑，網家目前三大網路平台擁有千萬會員數，開業後將一舉成為台灣最大第三方支付業者。2. 梅姬颱風直撲台灣，標榜快速送到家的電子商務業者又打「防颱」商機。今年夏天酷熱、9 月接連有強颱侵台，帶動季節性商品增加不少業績。3. 7、8 月都已創下歷史同期新高，第 3 季營收有望登歷年同期新高，時序進入第 4 季旺季，單季營收有望登全年高峰。林老師祝大家，操作順利！以上資料由 華冠投顧 林驛銘 整理提供※以上內容僅供參考，投資人於投資前請審慎評估。,"[['第一名林驛銘臺股', '攻', '第一名林驛銘臺股'], ['攻第一名林驛銘臺股', '上', '9300'], ['臺股因颱風假', '出現', '補漲行情'], ['各類股', '均有', '漲勢'], ['成交量', '放大至', '億元'], ['行情', '注意', '中央銀行舉行 季理監事會'], ['中央銀行', '舉行', ' 季理監事會'], ['我們', '認爲', '很大'], ['各類股', '均有', '漲勢'], ['2330強勢', '攻至', '187..5元'], ['股價臺股股王大立光', '受到', '激勵'], ['太陽能族羣', '出現', '反彈走勢'], ['其它', '重建', '概念股'], ['產業', '步入', '傳統旺季'], ['名稱', '爲', 'InterPay'], ['三大網路平臺', '擁有', '千萬會員數'], ['梅姬颱風', '撲', '臺灣'], ['電子商務業者', '打', '防颱商機'], ['季節性商品', '增加', '不少業績'], ['第 3季營收', '有望', '登歷年同期新高'], ['時序', '進入', '季旺季'], ['林老師', '祝', '大家'], ['投資人', '請', '審慎']]"
0,20160929_1212,華冠投顧－摩台結算再收高、法人作帳有機可趁二天的颱風假後，台北股市在摩台指的結算下，作帳買盤再起。開高走高，在 2330 台積電、3008 大立光的帶動下，台股收漲 + 76 點，收在 9270 點，成交量 880 億。星期一的重挫，再到今天的創新高；這樣戲劇性的變化，都還是在『外資自救』的範圍。只是因為『摩台指結算』和『第三季季底』，外資自救的『延伸』可望持續下去。不過今天的『延伸』，指數盤中一度創下今年新高，確實比起其它亞洲股市更加強勁；這顯示出外資對台股的掌握力道，恐怕比市場預期更加強勁。明天的台股變數多，我就先不預測盤勢；但是明天的 K 棒，會是外資表現『企圖心』的關鍵，投資人務必留意盤勢變化。作者：華冠投顧 陳武傑 分析師※以上內容僅供參考，投資人於投資前請審慎評估,"[['華冠投顧－摩臺', '結算趁', '颱風假'], ['法人', '作', '帳'], ['臺北股市', '作', '帳'], ['臺股', '收', '漲 + 76 點'], ['戲劇性變化', '還是', '在'], ['這', '顯示', '加強勁'], ['我', '預測', '盤勢'], ['棒', '是', '外資表現企圖心關鍵'], ['外資', '表現', '企圖心'], ['外資', '表現', '企圖心'], ['投資人', '留意', '盤勢變化'], ['投資人', '請', '審慎']]"
0,20160929_1213,日盛投顧盤後－量價俱揚  短多可期◆盤勢分析1. 台股兩天颱風假休假期間，國際股市呈現上漲，激勵週四台股開高走高，各類股除紡織股、造紙股外皆有表現，終場指數上漲 76.38 點，漲幅 0.83%，以 9270.90 做收，成交金額 880.10 億元。2. 觀察台股技術面，經過週一的簡單量縮拉回整理後，下個交易日週四隨即擴量上攻、再創波段新高，目前指數各天期均線全面走多、呈現多頭排列狀態，日 KD 指標交叉向上後持續走揚，指數價格部份多頭格局沒有敗筆，週四成交金額達 880.10 億元，已經回到 20 日均量之上，近期成交量若能持續維持於 20 日均量之上，將有利於指數續攻，在量價俱揚下，權值個股將是操作主軸；相反地，量能若無力擴增，指數將是區間整理，屆時盤面結構將以強勢個別族群為主軸。觀察台股籌碼面，外資 + 133.42 億元、投信 - 0.24 億元、自營商 - 13.80 億元，三大法人合計買超 119.38 億元。權值視外資  個別族群聚焦強勢股觀察台股盤面結構，電子 + 0.94%、金融 + 0.96%、非金電 + 0.59%、櫃檯市場 - 0.08%，由於台股有價有量，權值電子、金融股、傳產龍頭皆有表現，台股成交金額若能維持於 20 日均量之上，估計權值股持續有表現機會。除權值股外，個別強勢族群鴻海集團、IC 設計、工業電腦、PCB、Type C、散熱、被動元件；非金電則是著墨汽車相關、機電、保健醫材、美國房市概念、製鞋、高端中概。,"[['國際股市', '呈現', '上漲'], ['多頭格局', '沒有', '敗筆'], ['成交量', '維持於', ' 20日均量之上'], ['權值', '是', '操作主軸'], ['指數', '是', '區間整理'], ['成交金額', '維持於', ' 20日均量之上'], ['權值股', '有', '表現機會'], ['非金電', '是', '著墨汽車相關']]"
