,News,All,SVO
0,20161118_1753,川普上任製造業搬回美國？郭台銘：應開放自由經濟財經中心／綜合報導 針對美國總統大選川普勝出，他考慮要將製造業搬回美國，製造美國人就業機會。為此，鴻海集團董事長郭台銘認為，製造業回流美國，美國人不一定願意做也不做會，況且供應鏈也不在美國，認為應該充分開放自由經濟。至於中國大陸未來經濟如何看，他說 2017 年不要期待有多大的成長，但透過大陸政府在產業、人口結構上的調整與政策引導，他認為 2020 年一定復甦。中國大陸世界互聯網大會昨（17）日登場，郭台銘出席盛會也接受了央視財經與鳳凰衛視採訪。介紹了具自動化、聯網化、智能化的關燈工廠，他說過去大部分都是用少數人的腦，多數人的體力，現在要用大多數人的腦並用網連接起來，並用少數人的體力。郭台銘指出，關燈工廠裏頭有很多技術創新，驅動了整個思維，而新思維再應用在實體製造上，可以把人的體力釋放出來，改做更有附加價值的工作或創新，可以讓生產成本更低，減少庫存、增加質量。記者詢問中國未來經濟的走勢，他表示 2020 年的經濟一定會復甦，到那個時候，中國大陸的經濟結構不僅調整得更好，再加上互聯網的加持、中產階級人口結構的調整，以及官方領導決策十分快速，還有政府對製造、工業、出口、科技的引領，相信未來會迎向成功復甦。因此，他說明年 2017 年不要期待會有多大的成長，應該要以常態來看，尤其經濟不是看短期，要看就要看未來 2018 年、2019 年、2020 年的成功，現在做的就是埋下成功的種子。另外，針對川普當選，怎麼看製造業要回流美國？郭台銘說可以理解川普想要為美國藍領階級找到工作機會的想法，尤其在整體經濟大環境還沒有回穩的時候，但保護主義就像中國人常講的，兩方交戰，傷人一千自傷八百，認為保護主義在現階段不該盛行。因此郭台銘認為，川普上任後，競選時候說的話與實際要做的應該有段距離。至於製造業回流美國，他表示把中國大陸的製造業工作搬回去，第一是美國很多人不願意做，第二是不會做，第三是供應鏈並不在美國，認為川普應該充分開放自由經濟。 『新聞來源／NOWnews 』,"[['川普', '上任', '製造業'], ['自由經濟財經中心／綜合報導\xa0', '大選', '川普勝出'], ['他', '考慮', '搬'], ['鴻海集團董事長郭臺銘', '認爲', '製造業迴流美國'], ['製造業', '迴流', '美國'], ['美國人', '願意', '做'], ['供應鏈', '不在', '美國'], ['他', '說', '期待有多大成長'], ['他', '認爲', '復甦'], ['郭臺銘', '出席', '盛會'], ['郭臺銘出席盛會', '接受', '央視財經採訪'], ['了', '具', '自動化'], ['大部分', '都是', '用'], ['郭臺銘', '指出', '有很多技術創新驅動整個思維'], ['有很多技術創新', '驅動', '整個思維'], ['做', '更有', '附加價值'], ['記者', '詢問', '未來經濟走勢'], ['他', '表示', '2020年經濟復甦'], ['迎', '向', '復甦'], ['他', '說明', '期待有多大成長'], ['經濟', '不是', '看短期'], ['做的', '就是', '成功種子'], ['郭臺銘', '說', '理解川普找到工作機會想法'], ['川普', '找到', '工作機會'], ['藍領階級', '找到', '工作機會'], ['保護', '就像', '中國人講的'], ['郭臺銘', '認爲', '說的話有段距離'], ['說的話', '有', '段距離'], ['製造業', '迴流', '美國'], ['他', '表示', '搬'], ['第一', '是', '美國很多人願意做'], ['美國很多人', '願意', '做'], ['第二', '是', '做'], ['第三', '是', '供應鏈不在美國'], ['供應鏈', '不在', '美國'], ['川普', '開放', '自由經濟']]"
0,20161118_1754,櫃買中心再罰樂陞違約金3萬元上櫃遊戲股樂陞因為第三季財報沒能在規定期限內公佈，櫃買中心依規定對樂陞進行處份，昨天起股票暫停交易。今天櫃買中心再祭出罰款，由於樂陞沒有在第三季終了後 45 天內，公告申報資產負債表、綜合損益表、現金流量表、會計師核閱報告、簽證會計師名稱等相關事項，已屬違規，對樂陞處以違約金 3 萬元的處份。樂陞在停止交易前仍有買盤進場，顯示部分投資人看好樂陞應可如先前所言在年底或明年初，完成財報編製繳交第三季財報，恢復正常交易。樂陞暫停交易前，股價最後的收盤價格是 13.2 元（照片：中廣資料照片）,"[['櫃買中心', '進行', '處份'], ['相關事項', '屬', '違規'], ['樂升', '有', '買盤進場'], ['部分投資人', '看好', '樂升'], ['樂升', '暫停', '交易'], ['最後收盤價格', '是', '13.2元照片']]"
0,20161118_1755,華冠投顧 量價顯天機 藍慶賜 盤後分析◆盤勢解析K 線組合型態 早晨之星，翻多起漲凌晨葉倫的說話已表態美國升息的腳步近了，華爾街分析師預期在 12 月就會升息，明年將加速升息，亞洲新興市場國家的股市將面臨資金回流美國，當然台股也包含在內。台指目前在半年線處橫盤整理已一個星期，外資現在不大願意加碼台股推升指數，中小型股就成了外資操作的重心，而權值股會受到資金的排擠，所以在 FED 升息時間公佈前，可積極操作低價中小型股。EG 近一個月來已上漲 18%，連帶加工絲價格也要調漲 3% 左右，低價紡纖族群股價也開始反彈。我使用 K 線組合型態的技巧，挑選出一檔標的做為說明範例。力麗 (1444) 11/14 股價下跌收中黑 K 線，次日上漲收十字線，兩日 K 線組合形成母子懷抱，第三天出現中紅 K 線並突破兩天前黑 K 線的高點，三日 K 線組合形成母子晨星，是為底部空翻多的轉折訊號。日後出現上漲的紅 K 收盤價突破母子晨星形態紅 K 的高點時即為確認訊號，多頭走勢確立，股價將會反轉向上。華冠證券投資顧問股份有限公司 (104) 證管投顧新字第 009 號本資料僅供參考投資時應審慎評估。作者: 華冠投顧 藍慶賜 (天機老師) 分析師,"[['盤勢', '解析', 'K線'], ['葉倫說話', '表態', '近'], ['亞洲新興市場國家股市', '面臨', '資金迴流美國'], ['資金', '迴流', '美國'], ['外資', '願意', '加碼臺股推升指數'], ['中小型股', '成', '外資操作重心'], ['權值股', '受到', '資金排擠'], ['連帶加工絲價格', '調漲', ' 左右'], ['紡纖族羣股價', '開始', '反彈'], ['我', '使用', '組合型態技巧'], ['中紅K線', '突破', 'K線高點'], ['K收盤價', '突破', '高點'], ['K收盤價', '突破', '高點']]"
0,20161118_1756,味全My Yogurt優酪乳新上市 獨特無花果及柑橘風味優酪乳又有新口味上市，味全 () 全新上市的歐式優酪乳品牌 My Yogurt「優活時刻」產品上市，並有全新「原味低脂」、「無花果葡萄」及「柑橘綜合」三風味上市。全新上市的歐式優酪乳品牌 My Yogurt 優活時刻，取經於最懂優酪乳的歐洲，堅持健康、自然，不添加膠體、香料及色素，並以獨特的乳酸菌發酵技術，透過全程嚴格掌控，確保發酵的乳酸菌在最適當的溫度及時間內生長，讓口感散發自然濃郁的 creamy，酸味也顯得圓潤高雅，帶出歐洲風味的多層次迷人風采。My Yogurt 優活時刻首波上市的三款地中海優酪乳，更選用地中海地區常食用的水果，推出市面上獨一無二的「無花果葡萄」及「柑橘綜合」 新口味，以雙重水果混搭，添加果汁或果泥，帶出高雅風韻的自然果香，帶給消費者全新的味覺享受。My Yogurt 以歐洲大廠的專業菌種打造，嚴選六種優質好菌，讓每 100 毫升含有有高達 300 億個活性乳酸菌，是市面上擁有最多好菌的優酪乳，並且含膳食纖維，幫助促進腸道蠕動，提供消費者自然健康新選擇。味全指出，歐洲人向來對美食有著高規格的要求，從食材的挑選、比例的搭配，到最後口感細緻度的呈現，都有著難以匹敵的水準。歐洲優酪文化早在 4500 年前開始，從歐式早餐的穀物優酪、優酪入菜的希臘料理，到東歐女性愛用優酪敷臉，甚至法國女性的纖細身材也都與熱愛優酪飲食有關。在歐洲，「優酪」已是飲食文化中不可或缺的要角，也正因為天天食用，所以更要求絕對的自然健康與美味。,"[['無花果優酪乳', '有', '新口味上市'], ['歐式優酪乳品牌My Yogurt', '取經於', '懂優酪乳歐洲'], ['最', '懂', '優酪乳'], ['地中海優酪乳', '更選', '食用水果'], ['市面上', '擁有', '好菌'], ['全', '指出', '歐洲人有著高規格要求有著匹敵水準'], ['歐洲人', '有著', '高規格'], ['美食', '有著', '高規格'], ['歐洲人有著高規格要求', '有著', '匹敵水準'], ['優酪', '入', '菜'], ['優酪', '是', '不可或缺要角']]"
0,20161118_1757,三大蘋果供應鏈搶占今13.5%成交值 大立光最兇悍台股集中市場今天尾盤爆發出 46.22 億元成交值，也推升大盤指數站穩 9000 點大關以 9008.79 點作收，而台積電 ()、鴻海 () 及大立光 ()3 檔蘋果供應鏈搶占今 13.5% 成交值，其中大立光最兇悍，大漲 4.32% 作收。而以今天台股成交值在 684.34 億元，略較昨日的 644.81 億元增加 6.13%，市場分析師認為此一成交值在周五面臨假期前屬於相對大量，而尾盤的大量也有助撐起大盤延續維持收紅走勢，收盤上漲 13.53 點或 0.15%。而在台北股市今天成交值前 3 名分別為台積電的 41.7 億元、鴻海 26.29 億元及大立光的 24.41 億元，合計 3 檔蘋果供應鏈個股 92.4 億元搶占今天大盤 13.5% 成交值。證券、期貨分析師及會計師張陳浩指出，包括台積電及鴻海都是連日來官股行庫用以維持盤面動態穩定的重要權值個股，今天大立光則在早盤的走貶格局之下，成為另一熱門標的，收盤報 3500 元，較昨日上漲 145 元或 4.32%，成交量放大到 663 張，成交值 24.41 億元。而由下半年以來的匯率走勢來看，兌美元匯率由 6 月 30 日的 1 美元兌 32.2 元一直升值到 9 月 30 日的 1 美元兌 31.3 元，導致多數外銷科技類股提到匯兌損失，大立光在第 3 季認列高達 4.3 億元的匯兌損失；的走貶中，將有助於匯兌損失的回沖。此外，在美國總統大選結果由川普當選，其主張的「美國製造」一度造成美商蘋果股價的受挫，但張陳浩指出，在目前蘋果股價已經走穩，主要在於川普目前已在對於其選前的言論進行局部的修正，也使蘋果概念股鬆了一口氣；同時，也使包括大立光、台積電及鴻海成為今天盤面的重心。但今天台積電股價以下跌 0.28 或 0.5 元作收，收盤價 181 元，成交量 22747 張，其成交值 41.7 億元，則為今天全場成交值的龍頭。,"[['蘋果供應鏈', '搶佔', '成交值'], ['成交值', '在', '684.34億元'], ['市場分析師', '認爲', '一成交值屬於相對大量'], ['一成交值', '屬於', '相對大量'], ['3名', '爲', '41.7億元'], ['期貨分析師張陳浩', '指出', '包括臺積電都是重要權值個股'], ['包括臺積電', '都是', '重要權值個股'], ['大立光', '成爲', '一熱門'], ['兌美元匯率', '美元兌', '32.2元'], ['外銷科技類股', '提到', '匯兌損失'], ['美國製造', '造成', '蘋果股價受挫'], ['張陳浩', '指出', '蘋果股價走穩'], ['川普', '進行', '局部修正'], ['臺積電股價', '跌', '0.28']]"
0,20161118_1758,台股收盤漲13點 玉晶光毛利率大增又衝漲停記者許家禎／台北報導 受到昨日蘋果股價、台積電 ADR 下跌，台股今（18）日開平走低，所幸盤中翻紅，終場漲 13.53 點，收在 9008.79 點，漲幅 0.15%，成交金額 684.34 億元。玉晶光毛利率衝高，今日再度漲停，大立光也漲逾 4%。其他，聯發科漲逾 2.48%、宏達電漲 5.93%，來到 84 元。台北股市今天開盤跌 3.76 點，加權股價指數以 8991.5 點開出，盤中由黑翻紅，終場漲 13.53 點，收在 9008.79 點，漲幅 0.15%，成交金額 684.34 億元。個股部分，電子漲 0.55%、金融跌 0.5%。其他，電設、運輸與生醫漲逾 1%、光電股漲 2.48%。各類股部分，玉晶光第 3 季鏡頭良率毛利率從上季的 14.6% 拉升到 29.65%，終於轉虧為盈，單季 EPS 為 1.15 元，創 10 年新高，也激勵股價連 2 天飆漲，今日收漲，來到 65 元。玉晶光衝漲停也拉抬了其他光電股，大立光漲幅超過 4%，收 3500 元，亞光與今國光漲幅也有 2% 與 3%。其他，聯發科漲逾 2.48%、宏達電漲 5.93%，來到 84 元。南亞科與和碩漲幅也超過 2%。國泰投信表示，昨日美國聯準會主席葉倫在國會作證，表示美國經濟很快就會變得適合升息，美國經濟已經越來越靠近就業及物價穩定目標，且薪資增長速度最近加快，市場預期 12 月 FED 升息機率已達 96%。國泰投信指出，FED 升息刺激上漲至 101，來到 13 年來新高。由於美元強勢上漲、離岸貶破 6.9，拖累貶值，在弱勢表現下，外資恐將持續賣超台股，台股將繼續整理走勢，建議投資人可運用反向 ETF，規避台股修正風險。 『新聞來源／NOWnews 』,"[['臺股收盤', '漲', '13點'], ['臺北報導', '受到', '蘋果股價下跌'], ['收', '漲', '13.53點'], ['收', '在', '9008.79點'], ['單季EPS', '爲', '1.15元'], ['大立光漲幅', '超過', ' 元'], ['亞光漲幅', '也有', '2%'], ['國泰投信', '表示', '美國聯準會主席葉倫作證表示美國經濟變得適合升息'], ['美國聯準會主席葉倫作證', '表示', '美國經濟變得適合升息'], ['美國經濟', '變得', '適合升息'], ['美國經濟', '靠近', '目標'], ['國泰投信', '指出', ' 升息上漲'], ['外資恐', '賣', '超臺股'], ['臺股', '整理', '走勢'], ['投資人', '運用', '反向']]"
0,20161118_1759,台股盤後－資金重回電子股 周線中止連3黑站上9000美國聯準會主席葉倫釋出明確的升息態度，儘管亞幣全部走弱，壓抑台股早盤開低震盪，不過中場在不確定因素消除後，資金開始回流到電子股，包括大立光及鴻海領軍穩盤，傳產類股也由航運及紡纖輪動，終場指數小漲 13.53 點，以 9008.79 點作收，重新站上 9000 點大關，成交值 684.35 億元。周線上漲 51.03 點，終止連 3 黑。更是強勁，在太陽能及生技齊漲帶動下，指數開盤就重新站上 120 點，並持續走高，終場上漲 1.04 點，以 120.84 點作收，順利收復 5 日線及 10 日線，以 120.84 點作收，成交值 161.03 億元。周線上漲 0.1 點，終止連 3 黑。台股今天類股漲略多於跌，其中以光電類股漲幅最高，達 2.48%，生醫、航運、電腦設備漲幅也超過 1%，化學生醫、電子零組件、其他電子、玻陶、電器電纜、化學、電機機械、建材營造、通信網路、橡膠、紡纖、半導體、電子通路等均收紅。下跌類股則以汽車跌幅最重，達 0.97%，塑膠、食品、鋼鐵、金融、油電燃氣、水泥、資訊服務、觀光、貿易百貨、造紙等則均下跌。電子股今天終於展現台股主流族群的氣勢，在大立光大漲的帶動下，玉晶光強攻漲停，稍稍化解了台積電緩跌的影響，加上鴻海也緩步走揚，激勵蘋概股強彈，鎧勝 - KY、光寶科、順德、可成、欣興、康舒、新日興、和碩、晶技、致伸、達方、南電、TPK-KY、廣達等漲幅也都超過 1%。生技股也見到買盤加持，基亞、懷特、優盛強攻漲停，高價股的精華、康友 - KY、金可 - KY、浩鼎、智擎、藥華藥、中裕等均收紅。紡纖股也受惠於報價可望調漲的激勵，加工絲廠宏益、宏和、集盛、宜進、力鵬、力麗等漲幅均超過 2%。航運股的漲勢持續，中櫃大漲逾 7%，中航、遠雄港、台船、四維航、新興、台航、裕民、萬海等漲幅也在 1.5% 以上。運達投顧分析師顏逸民表示，近期美元續強，儘管貶值，但是周線已有見到指跌訊號，有利多方，且電子成交值比重重新回到 60% 以上，重要權值股包括大立光、光寶科、可成、聯發科也開始反彈，表示指數反彈已有機會，接下來就看指數能否站上 11 月 11 日的 9067 點。,"[['9000美國聯準會主席葉倫', '釋出', '升息態度'], ['資金', '開始', '迴流'], ['傳產類股', '包括', '大立光'], ['指數開盤', '站', '120點'], ['生醫漲幅', '超過', '1%'], ['等化學生醫', '收', '紅'], ['電子股', '展現', '主流族羣氣勢'], ['等KY漲幅', '超過', '1%'], ['生技股', '見到', '買盤加持'], ['等精華', '收', '紅'], ['紡纖股', '受惠於', '可望調漲激勵'], ['等宏益漲幅', '超過', '2%'], ['中櫃', '大漲逾', '7%'], ['等中航漲幅', '在', '1.5% 以上'], ['運達投顧分析師顏逸民', '表示', '周線見到指跌訊號'], ['周線', '見到', '指跌訊號'], ['電子成交值比', '回到', '60% 以上'], ['重要權值股', '包括', '大立光'], ['指數', '站', '9067點']]"
0,20161118_1760,台灣加權指數今(18)日收盤上漲0.15% 報9008.79點台灣今 (18) 日收盤上漲 13.53 點或 0.15%，報 9008.79 點，成交金額 684.34 億元。,[]
0,20161118_1761,宏達電衝刺VR有突破股價強漲手機大廠宏達電近年來不斷衝刺 VR 虛擬實境業務，最新的利多消息傳來，與深圳市政府攜手創建「VR 中國研究院」，雙方聯合發起高達 100 億元的「深圳 VR 產業基金」；同時，宏達電也宣佈虛擬實境已正式進軍南韓市場，與釜山市政府簽署合作備忘錄，共同打造南韓的虛擬實境生態系。利多消息激勵宏達電股價今天一路墊高，漲幅一度突破 6%，盤中最高來到 85.2 元，也成為今天台股電子股的多頭指標。（圖：取自雅虎奇摩）,"[['VR', '有', '突破股價強漲手機大廠宏達電'], ['雙方', '發起', '產業基金'], ['雙方發起產業基金', '高達', '100億元'], ['宏達電', '宣佈', '虛擬實境進軍南韓市場'], ['虛擬實境', '進軍', '南韓市場'], ['盤中', '來到', '85.2元']]"
0,20161118_1762,矽統減資後重掛牌 大盤強勢帶動下股價一度漲停IC 設計矽統 () 昨日減資後掛牌重新交易，由於營運前景仍有疑慮，昨日股價重挫大跌，不過今 (18) 日在大盤動能回升帶動下，股價也同步強攻，盤中攻上漲停鎖住，衝上 7.11 元創 4 個月高點。矽統為健全財務結構，因此決議減資 5.34 億元，減資比率 8.7%，減資後股本降到 56 億元。矽統 11/3 至 11/16 停止交易，減資後新股昨日重新上市，由於停止交易期間台股頻頻走弱，矽統重新掛牌後股價也展開補跌行情，昨日盤中大跌，跌幅一度達 7% 以上。不過矽統今日在大盤動能回神帶動下，股價也同步上攻，盤中一度衝上漲停價位，表現相當強勢。矽統前 3 季營運仍平平，營收為 1.27 億元，年減 23%，稅後淨損 0.3 億元，每股稅後虧 0.06 元，法人認為，在營運前景未見起色前，股價仍有下跌壓力。,"[['大盤', '帶動', '重新交易'], ['營運前景', '有', '疑慮'], ['股價', '展開', '補跌行情'], ['跌幅', '達', ' 以上'], ['營收', '爲', '1.27億元'], ['每股', '稅後虧', '0.06元'], ['法人', '認爲', '股價有下跌壓力'], ['前景', '未見', '起色'], ['股價', '有', '下跌壓力']]"
0,20161118_1763,矽創Q4營運穩 全年營收有機會衝破百億元驅動 IC 第 4 季營運多淡季不淡，矽創 () 第 4 季也可望有同樣表現，法人預期營收雖會下滑，但仍可維持在第 3 季附近水位，全年營收有機會衝破 100 億元關卡，創歷史新高紀錄。矽創下半年進入營運旺季，第 3 季受惠功能型手機需求帶動，營收衝高到 28.75 億元，創單季新高紀錄。矽創 10 月營收受到大陸十一長假影響，較 9 月下滑，達 9.81 億元，不過仍維持高檔水位，創歷史次高紀錄，前 10 月營收為 85.5 億元，較去年同期成長 13.87%。由於面板價格持續上揚，客戶需求也轉趨觀望，11 月營收預期將持續向下修正，不過季底時客戶因應農曆年備貨需求，法人估營收可望較 11 月回升。整體第 4 季來看，矽創營收法人估約較第 3 季下滑修正，但有機會維持在接近第 3 季水準，全年營收有機會突破 100 億元。而矽創前 3 季稅後淨利已達 7.56 億元，年增 28.4%，每股稅後盈餘為 6.37 元；法人估第 4 季營運持穩情形下，全年稅後淨利有機會挑戰 10 億元。,"[['全年營收有機會', '衝破', '100億元關卡'], ['營收衝高', '到', '28.75億元'], ['10月營', '收受', '十一長假影響'], ['客戶需求', '轉趨', '觀望'], ['營收有機會', '突破', '100億元'], ['稅後淨利', '達', '7.56億元'], ['稅後盈餘', '爲', '6.37 元']]"
0,20161118_1764,樂陞前代理董座李柏衡3百萬交保至今仍籌不到錢社會中心／台北報導 台北地檢署今 (18) 日凌晨二度約談樂陞前代理董事長李柏衡、樂美館財務長彭于璇以被告身分到案說明，訊後認為李柏衡涉嫌重大，以 300 萬元諭令交保，但李柏衡直到今上午 11 時仍籌不到交保金，檢方則降為 250 萬元，目前正等候交保。據了解，今年 8 月日商「百尺竿頭」併購「樂陞」宣告破局，害許多人投資人血本無歸，檢警介入調查，樂陞董事長許金龍遭收押禁見，許金龍咬出曾涉及「國票案」遭判 13 年刑期的楊博智 (原名楊瑞仁) 也涉案，上月 18 日發動第 2 波搜索。檢調專案小組今凌晨再約談 2 名證人及樂陞前代理董事長李柏衡、樂美館財務長彭于璇等 2 名被告到案說明，證人訊後已請回；李柏衡及彭于璇則由調查官帶回北檢訊問，李柏衡因涉嫌重大，檢方凌晨 3 時 35 分依違反《證券交易法》諭令 300 萬元交保及限制出境出海。李柏衡直到今天上午仍籌不出交保金，檢方則降保為 250 萬元，目前正等候交保；而彭于璇已是第二次被傳喚，上一次則以 100 萬元交保。 『新聞來源／NOWnews 』,"[['李柏衡', '籌', '交保金'], ['併購', '宣告', '局'], ['樂升董事長許金龍', '介入', '調查'], ['李柏衡', '帶回', '北檢'], ['李柏衡', '違反', '證券交易法'], ['李柏衡', '籌', '保金']]"
0,20161118_1765,台灣真的要開放核災食品嗎？行政院一張圖幫你解惑！行政院長林全重申，不會有任何核災食品會輸入到台灣，因為核災食品本身被認為是有污染的食品，但是有些非核災的食品、不是受到污染的，會參照其他國家的作法，採取所有國家 (日、美、歐) 更嚴格的標準來處理。此外，政府除了做包括「邊境管制及逐批檢驗」，以確保國人的健康權益為目標，並參酌歐美等先進國家的專業規範，以科學證據為基礎，加強管制，嚴格把關，也將堅持 4 個禁止原則：(1) 日本福島縣食品禁止輸入。(2) 茨城縣、櫪木縣、群馬縣、千葉縣 4 縣的飲用水、嬰幼兒奶粉、茶類產品及野生水產品等高風險的產品，仍舊維持禁止輸入之管制。(3) 上述 4 縣市未檢附官方產地證明、輻射檢測證明雙證件的食品禁止進口。(4) 美國、日本不能上市的食品，臺灣禁止進口。行政院長林全進一步說明，會考量開放非核災地區的食品在進口的原因在於，日本認為台灣目前的限制範圍過廣，很多非核災、沒有受汙染的食品受到禁止進入，認為不公平，目前台灣作法確實和對岸中國大陸是一致的。林全指出，台灣顯然是過嚴，因此願意檢討，但是在檢討過程中，若各界有懷疑與疑慮，也樂意溝通，各界任何反對、質疑、不放心的意見，都很歡迎大家理性提出探討，但是希望不要當成政治問題處理，這樣會造成社會的撕裂，不會解決公共政策的問題。,"[['臺灣', '開放', '核災食品'], ['本身', '認爲', '是有污染食品'], ['核災食品', '不是', '受到污染的'], ['健康權益', '爲', '目標'], ['政府', '加強', '管制'], ['日本福島縣食品', '禁止', '輸入'], ['高風險產品', '維持', '禁止輸入管制'], ['行政院長林全', '說明', '在原因在於'], ['會考量', '開放', '災地區'], ['日本', '認爲', '廣'], ['災食品', '受到', '禁止'], ['臺灣作法', '是', '一致的'], ['各界', '有', '懷疑']]"
