,News,All,SVO
0,20160215_190,千附鞋機業績大成長突破億元 大力挹注1月營收千附()在製鞋設備產品銷售明顯成長同時，鞋機出貨在2016年1月突破1億元，也挹注千附單月營收衝高到2.97億元的3個月來新高，較上月營收2.4億元增加24.06%。同時，千附2016年1月營收2.97億元，較去年同月成長22.41%。千附實業主管指出，2016年1月鞋機事業營收突破1億元並較去年同月出貨量大增40%，主要係品牌運動鞋廠的旺盛需求，持續帶動製鞋機械的成長動能；同時，千附的精密科技營收也因航太類產品需求挹注，較上月增加51.57%。就千附實業2016年1月的營收結構來看，其朝高毛利產品調整，穩定性高的精密科技占營收比重46%，而長期耕耘具知名度的鞋機事業占1月營收比重的34% ，千附主管認為，此一營收比重呈現轉型後的持續成長，對千附公司長期的整體獲利及穩定性產生正面助益。千附股價今天早盤爆發1300張以上大量，較前一交易日大增100%，股價最高達到45.9元，漲幅並達到5.27%。,"[['千附鞋機業績大成長', '突破', '億元'], ['製鞋設備產品銷售', '明顯', '成長'], ['出貨', '突破', '1億元'], ['千附實業主管', '指出', '旺盛需求帶動成長動能'], ['事業營收', '突破', '1億元'], ['同月出貨量', '大增', '40%'], ['旺盛需求', '帶動', '成長動能'], ['高毛利產品', '調整', '高毛利產品'], ['精密科技', '佔', '營收'], ['長期', '耕耘具', '知名度'], ['耕耘具鞋機事業', '佔', '營收比重34% '], ['千附主管', '認爲', '營收比重呈現持續成長'], ['營收比重', '呈現', '持續成長'], ['股價', '達到', '45.9元'], ['漲幅', '達到', '5.27%']]"
0,20160215_191,陳俊聖：宏碁今年電競與新品為主軸 營運持續發力宏碁榮譽董事長施振榮(左二)率領董事長黃少華(左三)與執行長陳俊聖(左一)新春團拜。(鉅亨網記者蔡宗憲攝)宏碁()今(15)日舉行新春團拜，執行長陳俊聖難得露面，針對今年景氣，他強調全球經濟狀況仍不穩定，產業仍高度警戒，而宏碁在可控制的範圍內會努力做到最好，包含創新與客戶關係，而受油價影響的國家則會維持穩定獲利的策略，產品面則仍以電競為主要動能，另外還有新產品如VR也會是今年重點，對今年宏碁營運仍是可以持續發力。陳俊聖表示，今年幾個經濟穩定地區，包含西歐如德國、奧地利、瑞士等地區，景氣需求穩健，相對之下產油國或是新興國家如巴西、俄羅斯等需求則相對疲軟，受到油價暴跌影響，景氣也受衝擊。陳俊聖強調，新興國家宏碁策略是維持穩定獲利，產品盡可能做到不賠錢，要賠也不會賠太多，目的是要維持在當地的能見度。今年來看，陳俊聖表示，宏碁持續轉型，產品業務要做更深更廣，如Chromebook與Cloudbook等產品表現不錯，宏碁會維持領先地位，而電競產品如Predator產品線，更是獲得市場大大認同，也會維持領先地位。陳俊聖表示，大環境確實要令廠商高度警戒，全球經濟不確定性仍存在，而宏碁在可以控制的範圍內，則會維持穩定，包含創新能力以及與客戶的關係深化。就產品面而言，他看好今年電競產品線的表現，包含桌上型電腦、筆記型電腦、平板以及投影機都持續在全球交貨，並獲得各地區的獎項，都是代表對宏碁產品的肯定，此外宏碁也會布局新產品，增加成長動能。陳俊聖重申，宏碁今年仍有會持續發力，包含營運面也會更為穩定，對於去年第4季即今年獲利表現，仍維持樂觀看法，但對於是否恢復發放股利，由於牽涉法令問題，因此仍沒有確切的看法。,"[['巨亨網記者蔡宗憲攝宏碁', '舉行', '新春團拜'], ['他', '強調', '穩定'], ['產品面', '做到', '爲主要動能'], ['新產品', '是', '今年重點'], ['陳俊聖', '表示', '穩定地區包含等德國地區'], ['穩定地區', '包含', '等德國地區'], ['景氣', '受', '衝擊'], ['陳俊聖', '強調', '宏碁策略是維持穩定獲利'], ['宏碁策略', '是', '維持穩定獲利'], ['產品', '做到', '賠錢'], ['目的', '是', '維持在能見度'], ['陳俊聖', '表示', '宏碁轉型'], ['宏碁', '維持', '領先地位'], ['電競產品', '獲得', '大大認同'], ['陳俊聖', '表示', '宏碁維持穩定'], ['宏碁', '維持', '穩定'], ['他', '看好', '電競產品線表現'], ['宏碁', '佈局', '新產品'], ['陳俊聖', '重申', '沒有確切看法']]"
0,20160215_192,《股市》13:45台期指02 報8049.00點，漲13.00點或0.16%《股市》13:45台期指02 報8049.00點，漲13.00點或0.16%。免責聲明：本文所載資料僅供參考，並不構成投資建議，鉅亨網對該資料或使用該資料所導致的結果概不承擔任何責任。該資訊若與事實不符，應以商品原交易所之公佈為主。,"[['45臺', '期指', '漲1313.00點'], ['45臺', '期指', '報8049.00點漲13.00點'], ['報8049.00點', '漲', '13.00點'], ['導致結果', '承擔', '任何責任']]"
0,20160215_193,台灣加權指數收盤漲3.51點或0.04%報8066.51點台灣收盤漲3.51點或0.04%，報8066.51點，成交金額879.82億元。,[]
0,20160215_194,仲博科技1月營收2.15億元年減22.54% 1— 1月達2.15億元仲博科技(3683-TW)2016年 1月營收資料(單位:千元),[]
0,20160215_195,《股市》13:01台股店頭 報123.95點，漲0.23點或0.19%《股市》13:01台股店頭 報123.95點，漲0.23點或0.19%。免責聲明：本文所載資料僅供參考，並不構成投資建議，鉅亨網對該資料或使用該資料所導致的結果概不承擔任何責任。該資訊若與事實不符，應以商品原交易所之公佈為主。,"[['01臺股店頭', '報', '123.95點'], ['01臺股店頭', '報', '123.95點'], ['導致結果', '承擔', '任何責任']]"
0,20160215_196,《股市》13:00台股加權 報8043.64點，跌-19.36點或-0.24%《股市》13:00台股加權 報8043.64點，跌-19.36點或-0.24%。免責聲明：本文所載資料僅供參考，並不構成投資建議，鉅亨網對該資料或使用該資料所導致的結果概不承擔任何責任。該資訊若與事實不符，應以商品原交易所之公佈為主。,"[['導致結果', '承擔', '任何責任']]"
0,20160215_197,《股市》13:00台期指02 報8044.00點，漲8.00點或0.10%《股市》13:00台期指02 報8044.00點，漲8.00點或0.10%。免責聲明：本文所載資料僅供參考，並不構成投資建議，鉅亨網對該資料或使用該資料所導致的結果概不承擔任何責任。該資訊若與事實不符，應以商品原交易所之公佈為主。,"[['導致結果', '承擔', '任何責任']]"
0,20160215_198,明達醫1月營收0.70億元年增125.07% 1— 1月達0.70億元明達醫()2016年 1月營收資料(單位:千元),"[['明達醫', '營收', '營收資料單位']]"
0,20160215_199,和昇休閒1月營收0.07億元年增69.47% 1— 1月達0.07億元和昇休閒(2720-TW)2016年 1月營收資料(單位:千元),"[['和', '升', '休閒'], ['2016年1月', '營收', '資料']]"
