,News,All,SVO
0,20161006_538,太陽能電池需求回溫 綠能及中美晶9月營收回穩包括綠能 (3519-TW)、中美矽晶 () 等太陽能上游廠商在 2016 年 9 月的業績走出陰影，也透露出太陽電池產品在 10 月價格止跌的可能性大增，其中中美矽晶 9 月營收收達 22.66 億元，月減率 0.7%，年減率 8.4%。其中，太陽能產品營收為 8.38 億元，月減率 2.4 %，年減率 30 %。而法人則是看好昱晶 (3514-TW) 的業績回溫速度表現，其個股成交量近 3 日明顯增加。中美矽晶今年 1-3 季累計營收達 218.24 億元，較去年同期增長 2.6%。其中，太陽能產品 1-3 季累計的營收達 100.08 億元，與去年同期相較成長 5.58%。而綠能科技為持續降低價格變動對獲利的影響性，全面選擇性策略接單，同時，其營收在 9 月也出現緩步回升，綠能 2016 年 9 月營收 7.15 億元，較 8 月增加 10.8%，較去年同月減少 46%。2016 年累計 1-9 月合併營收達 126 億元，較去年同期成長 12%。綠能科技表示，目前綠能科技延續訂單過濾原則，盡量減少對獲利衝擊，營運銷售以服務長期策略合作客戶為主。中美矽晶主管表示，受中國大陸上半年搶裝潮結束以及客戶去化庫存的影響，2016 年第 3 季太陽能市場需求呈現非常弱，價格呈現非理性跳水式下跌。10 月開始，太陽能產品的需求增強，矽晶圓及電池的報價也由谷底回溫反彈。尤其是中美矽晶高效電池與高效晶片的需求與價格都有強力反彈的趨勢。中美矽晶已決定與國泰金 () 旗下國泰人壽攜手合資 35 億元成立新公司，擴大投資國內的太陽能電廠，積極切入太陽能電站的投資、興建及營運，以因應全球低碳綠能之潮流趨勢並響應政府鼓勵民間企業投入再生能源開發政策。中美矽晶指出，新合資公司的資本額暫定為 35 億元，將分兩階段的方式出資。第一階段預計投入 15 億元，其中由中美矽晶將出資 4.5 億元。第 2 階段的投資，雙方將視相關計畫的執行結果再決定投入時程。中美矽晶與國泰人壽結合雙方的資金及技術，以合資公司方式共同從事國內太陽能發電站案場開發、興建、投資，是成立此合資公司的目的。中美矽晶指出，太陽能發電可確保 20 年以上長期穩定的投資報酬，所以投資太陽能電廠相對於金融商品投資，可提供更高且穩定的固定收益。中美矽晶著眼於全球區域投資平衡及產品品質風險管控，全力配合政府新南向政策並響應菲律賓政府的再生能源政策，繼菲律賓 50MW 的太陽能電廠完成之後，下一期的大型太陽能電廠投資案也正規劃中。在美國、日本、菲律賓、越南、印尼、義大利、加拿大地區也都有開發案的評估正在進行中。中美矽晶在太陽能系統的佈局已越來越成熟，將有效提昇整體營運績效。,"[[' 月業績', '包括', '3519TW綠能'], ['價格', '止', '跌'], ['價格', '止', '跌'], ['太陽能產品營收', '爲', '8.38億元'], ['法人', '是', '表現'], ['業績回溫速度', '表現', '其個股成交量增加'], ['中美矽晶', '季累計營收達', '218.24億元'], ['綠能科技', '降低', '選擇性策略接單'], ['其營收', '出現', '緩步回升'], ['綠能科技', '表示', '綠能科技延續訂單過濾原則'], ['綠能科技', '延續', '訂單過濾原則'], ['中美矽晶主管', '表示', '受搶裝潮中國大陸上半年結束影響'], ['價格', '呈現', '非理性跳水式下跌'], ['高效電池需求', '有', '反彈趨勢'], ['矽晶中美', '決定', '成立新公司'], ['中美矽晶', '指出', '合資公司資本額暫定'], ['雙方', '視', '執行結果'], ['矽晶', '結合', '雙方資金'], ['中美矽晶', '指出', '投資太陽能電廠提供固定收益'], ['所以', '投資', '太陽能'], ['投資太陽能電廠', '提供', '固定收益'], ['矽晶中美', '著眼於', '全球區域投資平衡']]"
0,20161006_539,網通、手機市場熱，矽品Q3營收創歷史新高MoneyDJ 新聞 2016-10-06  記者 陳祈儒 報導矽品（2325）公布今（2016）年第 3 季營收自結數，單季營收 219.55 億元，超過 2014 年第 2 季的歷史高峰，創下歷史新高，主要是受惠於美系電源管理與繪圖晶片廠及大陸網通晶片、台系手機晶片客戶的訂單增加。法人指出，矽品主力客戶聯發科（2454）、海思（HiSilion）、輝達（Nvidia）、博通（Broadcom）在第 3 季晶片組銷售皆傳捷報。除聯發科已向台積電（2330）增加投片量外，中國網通晶片組廠海思在手機、基地台的訂單也見增溫，另外，蘋果主要電源管理晶片供應商戴樂格（Dialog）也進入出貨高峰，因此，激勵矽品第 3 季營收寫單季歷史新高。矽品 9 月合併營收 72.07 億元，跟上（8）月相比月衰退 3.0%，與去年同月相比，則成長 3.5%。第三季合併營收 219.55 億元、季成長 1.3%，與去年同季相比年成長 9.6%。,"[['，', '超過', '歷史高峯'], ['法人', '指出', '捷報'], ['聯發科', '增加', '投片量'], ['）', '增加', '投片量'], ['電源管理晶片供應商戴樂格Dialog', '進入', '出貨高峯'], ['9矽品', '合併', '億元']]"
0,20161006_540,IC設計Q3旺季營收亮眼 信驊創新高 創意季增逾2成IC 設計多家公布 9 月營收，第 3 季營收結果也出爐，其中部分廠商表現穩健，伺服器控制晶片信驊 () 受惠需求帶動，第 3 季營收達 3.82 億元，創歷史新高，而 IC 設計服務創意 () 與力旺 () 等 IP 廠商，同樣在旺季效應帶動下，營收也向上走揚，創意第 3 季營收達 23.88 億元，季增逾 2 成，力旺更創單季次高紀錄，季增逾 1 成。伺服器晶片信驊第 3 季受惠伺服器產品需求帶動，儘管雖然未在第 3 季季底前順利併入博通遠端伺服器管理部門，但整體營收在客戶需求帶動下表現仍亮眼，9 月營收達 1.37 億元，連 3 月創歷史新高，推升第 3 季營收衝上 3.82 億元，季增 26.8%，同創單季新高。IC 設計服務創意第 3 季營收表現也亮眼，受惠客戶產品出貨遞延，第 3 季表現穩健，8 月營收衝上 9.2 億元，逼近 10 億元關卡，9 月雖緩步下滑，但仍有 8.89 億元水準，守住 8 億元關卡，較 8 月下滑 3.36%，較去年同期成長 28.78%，第 3 季營收達 23.88 億元，季增 24.5%，創 2013 年以來單季新高，季增率也比預期還好。矽智財 (IP) 設計力旺第 3 季營運動能主力來自於電源管理、驅動 IC 與指紋辨識等晶片出貨成長，另外美國智慧型手機晶片客戶調整完畢，投片數量緩步增加，帶動季營收達 3.09 億元，較第 2 季成長 10.1%，創歷史次高紀錄；累計前 9 月營收已達 9.09 億元，年增 14.98%。高速傳輸介面譜瑞 - KY()，受到客戶產品遞延出貨影響，第 3 季預估營收會較第 2 季衰退 8% 以內，9 月營收達 8.14 億元，月增 6.7%，年減 0.11%，第 3 季營收為 6586 萬美元，較第 2 季下滑 4.2%，如法說預期。,"[['IC', '設計', ')創意'], ['第 3季營收達', '力旺更創', '高紀錄'], ['季營運動能主力', '來自於', '等管理晶片出貨成長'], ['營收', '達', '9.09億元'], ['營', '收達', '8.14億元'], ['第 3季營收', '爲', '6586萬美元']]"
0,20161006_541,台灣加權指數今(6)日開盤下跌0.09% 報9263.40點台灣今 (6) 日開盤下跌 8.78 點或 0.09%，報 9263.40 點。,"[['9263.40點臺灣', '報', '9263.40點']]"
0,20161006_542,台灣虎航緊急止血 明年停飛新加坡沙巴記者陳致宇／台北報導 虧損已經超過半個資本額的台灣虎航，存廢問題一直備受關注，剛傳出與新航簽下「喪權辱國」合約，預計要到年底才會有與新航的協商結果，5 日台灣虎航宣佈基於航機運能調整，於 2017 年 1 月 3 日起將暫停桃園 - 新加坡及桃園 - 沙巴亞庇航線，已經購票的旅客將無條件全額退款。台灣虎航表示，配合 2017 年 1 月底即將引進第 10 架新機之計劃，考量航網效益調整，於 2017 年 1 月 3 日起將暫停桃園 - 新加坡及桃園 - 沙巴亞庇航線。另外規劃澳門、沖繩那霸及東京成田等現有旅遊市場需求暢旺的航線上增班，以提供旅客更多選擇。已購買 2017 年 1 月 3 日之後桃園 - 新加坡及桃園 - 沙巴亞庇航線機票的旅客，台灣虎航預計將一個月內無條件全額退款至旅客購票時所使用的信用卡帳戶內，實際收到退款的時間，將依各發卡銀行的作業為準，另外提供每人每航段效期六個月 500 元的代金券，供旅客下次購買使用。 『新聞來源／NOWnews 』,"[['已經', '超過', '半個資本額'], ['存廢問題', '備受', '關注'], ['臺灣虎航', '表示', '引進架新機計劃'], ['臺灣虎航', '預計', '爲準'], ['每航段', '效期', '500元']]"
0,20161006_543,蘋果iPhone 7推一把 可成9月營收創10個月新高金屬機殼廠可成 () 公布 9 月營收，受惠於蘋果 iPhone 7 拉貨進入旺季，可成單月營收回升到 77.22 億元，創下去年 11 月以來的單月新高；累計可成第 3 季營收也重新站回 200 億元以上，達 207.31 億元，也是近 3 季新高，隨著蘋果 Macbook Pro 將推出，可望成為可成後續動能。對於近期的營運狀況，可成表示，各項新產品的客戶拉貨及導入均在公司預期內，預期第 4 季營運可望維持強勁成長，整體營運走勢也是樂觀看待。可成 9 月營收達 77.22 億元，月增率 10.3%，但與去年同期相比則是小幅下滑 3.2%，第 3 季營收達 207.31 億元，較第 2 季大幅成長 18.3%，年增率亦達 6.3％，累計可成今年前 3 季營收為 550.98 億元，仍較去年同期下滑 6.51%。可成的智慧型手機機殼布局，除了蘋果 iPhone 外，也積極搶攻非蘋陣營，包括甫亮相的谷歌 () 高階智慧機 Pixel 系列，也是由可成供應，通吃蘋果及非蘋兩大陣營。至於蘋果筆記型電腦 Macbook Pro 則是可成另一塊成長來源，法人預估，蘋果新款 Macbook Pro 即將推出 13 吋及 15 吋 2 款，其中可成約拿下 60% 的機殼訂單，遠遠高於鎧勝 - KY() 的 30% 以及鴻準 () 的 10% 訂單量。,"[[' )', '公佈', ' 月營收'], ['拉貨', '進入', '旺季'], ['第 3季營收', '站回', '200億元以上'], ['可成', '表示', '在'], ['客戶拉', '在', '公司預期內'], ['第 4季營運', '維持', '強勁成長'], ['營運走勢', '也是', '看待'], ['累計成今年前3季營收', '爲', '550.98億元'], ['法人', '預估', '蘋果新款Macbook Pro推出13吋'], ['蘋果新款Macbook Pro', '推出', '13吋'], ['60%機殼訂單', '高於', '訂單量']]"
0,20161006_544,台灣主要報紙頭條要聞 2016年10月6日今年前三季中國智慧型手機需求暢旺，聯發科第三季營收可望達成目標，但第四季因有季節性庫存調整，營收、毛利率恐面臨雙降壓力。聯發科副董謝清江昨（5）日表示，今年第四季毛利率下滑壓力還是很大，營收也面臨季節性衰退。今年亞太經濟合作會議（APEC）經濟領袖會議十一月將在秘魯舉行，蔡英文總統決定敦請親民黨主席宋楚瑜擔任我方領袖代表。今年以來國內車市表現均優於去年同期，車市龍頭和泰汽車總經理蘇純興昨（5）日樂觀表示，今年車市掛牌數可望挑戰 43 萬輛，有機會刷新過去十年新高紀錄。蔡總統指派宋楚瑜出席 APEC 陸不接觸、不交談蔡總統：維持現狀承諾不變 善意不變蔡政府清戰場 與公民團體關係丕變車市衝 43 萬輛 拚十年新高總統談兩岸 力抗中國打壓強化公司治理 擬限縮獨董兼任家數藍綠混戰中 「一例一休」一分鐘初審過關談兩岸 蔡：不會屈服壓力 不走對抗老路在野黨喊異議 陳瑩裝瞎沒聽見聯發科示警 Q4 毛利、營收雙降宋楚瑜 任 APEC 特使ECB 寬鬆傳退場 全球公債大跌一例一休 初審硬過7 版本協商 各黨特休都加碼掏空中信百億 前女婿咬辜濓松父子 辜仲諒遭起訴宋楚瑜赴 APEC 陸打槍：須符諒解備忘錄蔡 8 月就邀請 宋今開記者會說明蔡向北京喊話：不對抗也不屈服蔡總統：不會屈服中國壓力遠距證詞重傷害 前妹婿咬出辜家父子,"[['營收可望', '達成', '目標'], ['營收', '面臨', '雙降壓力'], ['營收', '面臨', '季節性衰退'], ['蔡英文總統', '決定', '敦請親民黨主席宋楚瑜擔任領袖代表'], ['敦請親民黨主席宋楚瑜', '擔任', '領袖代表'], ['國內車市表現', '優於', '去年同期'], ['有機會', '刷新', '十年新高紀錄'], ['現狀', '承諾', '善意'], ['新高總統', '談', '兩岸'], ['陳瑩裝', '聽見', 'Q4毛利'], ['降宋楚瑜', '任', 'APEC'], ['咬辜濓松父子辜仲諒', '遭', '宋楚瑜赴APEC陸'], ['宋楚瑜', '赴', 'APEC陸'], ['前妹婿', '咬', '辜家父子']]"
0,20161006_545,新光證券盤前分析◆盤勢分析IMF 調降台灣及美國 GDP 預估、美股走弱、金價傳因 ECB 計畫減碼 QE 重挫 3%、辜仲諒遭起訴、蔡友才被聲押，5 日台股在黑天鵝滿天飛下開低，股王及市值王亦熄火，所幸 DRAM 報價走揚，美光收購案亦確定，加上 PS4 熱銷，供應鏈走強，使得台股跌勢萎縮，終場收在 9272.28 點，下跌 15.49 點或 0.17%，成交額 609.37 億元。 OTC 指數收在 131.35 點，下跌 0.38 點或 0.29%，成交額 210.19 億元。雖然壞消息接二連三，5 日台股仍在外資及自營商連續買超下，連三天收紅，比較令人擔心的是缺乏追價買盤，成交量低於月均量，不過在技術及籌碼皆穩定下，台股仍有機會在 9200 點附近整理，建議選股可留意 9 月營收創新高、前 9 月營收正成長、股價遭低估個股逢低操作。,"[['股王', '市值', '王'], ['指數收', '在', '131.35點'], ['臺股', '是', '缺乏追價買盤'], ['成交量', '低於', '月均量'], ['股價', '遭', '個股']]"
