,News,All,SVO
0,20161121_1700,美股一周狂吸314億美元 謝金河：川普吸星大法十分了得！財經專家謝金河表示，據統計，11 月 10-16 日全球流入美股的資金淨流入達 314.2 億美元，創了歷史紀錄，新興市場股市淨流出卻達 43.26 億美元，是過去一年來淨流入的 40%，顯示川普吸星大法十分了得！謝金河分析，一周之內，全球從美國債市流出的部位是 81.9 億美元，新興市場債淨流出 66.35 億美元，但是流入美股的資金淨流入達 314.2 億美元；另外，新興市場淨流出 43.26 億美元，其中亞太地區淨流出 41.6 億美元，中資股淨流出部位也有 13.83 億美元，連都出現 24.47 億美元的淨流出。資金乾坤大挪移，從債市轉股市，，避險需求轉弱，形成美元獨強局面，謝金河表示，債轉股出來的資金進入美股，分別是金融、生技、工業股及 IT 股，造成金融股大漲，推高直逼 19000 點，NBI 生技指數也大漲。謝金河說，川普從當選到現在，什麼事都還沒有做，全球金融市場卻連續大風吹，吹了兩週，很明顯看出全世界的錢湧向美股，造成美股、大漲，這是標準的吸星大法！,"[['財經專家謝金河', '表示', '資金淨流入達'], ['全球', '流入', '美股'], ['全球', '流入', '美股'], ['卻', '達', ' 43.26 億美元'], ['謝金河', '分析', '全球流出部位是81.9 億美元'], ['全球流出部位', '是', '81.9 億美元'], ['新興市場債', '流出', '66.35 億美元'], ['但是', '流入', '美股'], ['新興市場', '流出', '43.26 億美元'], ['淨流出部位', '也有', '13.83 億美元'], ['避險需求', '轉', '弱'], ['謝金河', '表示', '金融造成NBI'], ['債轉股資金', '進入', '美股'], ['金融', '造成', 'NBI'], ['謝金河', '說', '全球金融市場大風吹'], ['全世界錢', '湧向', '美股'], ['這', '是', '吸星大法']]"
0,20161121_1701,"台灣主要報紙頭條要聞 2016年11月21日加速都更進度，行政立法協調會今（21）日將研商都更條例修法策略，行政院傾向下會期提出一次性修法，不採分段進行；另祭出容積獎勵及降低房屋持有稅負擔等誘因，加速老舊住宅都更改建。其中租稅優惠除前 4 年減半徵收外，第 5 年起擬採逐年遞減方式再延長至 8 年。鴻海集團非蘋手機布局報喜，獨家為南韓 SK 電信代工新款 Luna 手機（又稱月亮機）在南韓、印尼等市場熱賣，因應市場需求，Luna 今年出貨量將大增至 3,000 萬支，較原預期低標翻倍成長，成為挹注鴻海集團手機事業的新動能。我國亞太經合會（APEC）經濟領袖代表宋楚瑜於秘魯利馬時間 19 日參加領袖會議開幕活動，雖然在領袖與企業諮詢委員會（ABAC）對話大會的公開場合上，宋與大陸國家主席習近平並未互動，但據宋幕僚轉述，宋、習兩人在進入大會前短暫會晤至少 10 分鐘，談話觸及希望大陸對台灣的經貿方向不變，未談「九二共識」、「一中原則」，雙方僅發布文字，未提供照片。■中國時報■ 工商時報■ 聯合報■ 經濟日報■ 蘋果日報■ 自由時報■ 旺報","[['獨家', '爲', 'Luna手機'], [' 今年出貨量', '大增至', ',000萬支'], ['成爲新動能', '挹注', '手機事業'], ['諮詢委員會ABAC', '對話', '大會'], ['）', '對話', '大會'], ['雙方', '發佈', '文字']]"
0,20161121_1702,"鉅亨早報－日本商品貿易帳、OPEC協商凍產細節《今日前瞻》■日本商品貿易帳■OPEC 協商凍產細節《重要新聞》■Q3 全球智慧手機銷量年增 5.4% 三星下滑 14.2% 創歷來最大跌幅 ■台達電再啟併購 吃下羽冠電腦 100% 股權跨足智慧製造 ■日矽併公平會准了 雙方聲明 看好有助產業發展 ■郭台銘：經濟復甦最快 2018 年 最晚 2020 年 中國將是關鍵 ■災情不斷！蘋果宣布 iPhone 6 Plus 螢幕維修計畫 ■兌美元已連跌 9 天！花旗：上次連跌 9 天後 雷曼兄弟倒閉 ■美債暴跌效應：美 30 年期房貸利率飆 10 個月新高！ ■貶破 110！德銀多轉空：明年恐跌到 115 ■郭台銘：富士康正轉型工業互聯網企業 製造業迎機遇 ■貶破 32 元 分析師：還是先擔心外資出走利空吧！ ■阿里巴巴主席馬雲指，川普當美國總統不是偶然事件，是必然事件，只是美國的傳統精英階層認為這是個黑天鵝事件。馬雲更表示，川普肯定很難說是美國歷史上最好的總統，但肯定不是最差的總統。■美股本周只有 4 個交易日，市場料聚焦聯儲局上次議息會議記錄、英國預算案以及感恩節翌日的購物情況等。另外，鑒於周四是感恩節美股休市，周五交易時間縮短，美股交投料會減少，股市走勢，可能受候任總統川普公布財長等內閣人事的消息所左右。■英國再發生公司客戶資料遭入侵事件，這次涉及長和（001）旗下 3 英國電訊，英國警方已接報拘捕 3 名疑犯，公司稱今次遭入侵的不涉客戶的財務資料。■南韓檢方周日正式起訴「閨密門」三名核心人物包括朴槿惠的閨密崔順實，並認定朴槿惠很大程度上「共謀作案」，將她視為「犯罪嫌疑人」立案調查，暗示朴槿惠泄露機密文件、默許崔順實向企業逼捐。檢方的共謀指控可能讓反對派有理由推動彈劾朴槿惠。■印度一列快速火車周日在北方邦布克拉揚地區出軌，造成至少一百二十人喪生，是印度鐵路系統近年最嚴重的災難。■德國執政基民盟消息人士透露，總理梅克爾對黨內領袖表示，她準備領導基民盟參加明年大選，並尋求第四個任期。大選料於九月或十月舉行。■法國極右「國民陣線」黨魁勒龐，被視為下一位有可能在大選中勝出的民粹主義政客。雖然多項民調顯示，即使勒龐成功突破明年大選的首輪投票，亦會在次輪投票敗給中間偏右共和黨的前總理朱佩，但法國哲學家利維坦言，當今選民只相信政客個人魅力，不再關注他們是否說真話，斷言勒龐可能入主愛麗舍宮。■英國財相夏文達後日在國會發表上任後首份財政預算案，亦是脫歐公投後首次。財政部昨日透露預算案主調將是增加基建投資，又暗示會取消前財相歐思邦實行的僵化緊縮政策。■正在秘魯出席亞太經合組織（APEC）峰會的國家主席習近平，昨天在會議期間與台灣親民黨主席宋楚瑜坐下寒暄超過十分鐘。由於宋楚瑜是代表民進黨政府參加會議，兩人的互動程度超出預期。大陸學者劉國深認為，習宋「偶遇」既顯示私交發揮重要作用，也說明兩岸仍希望理智處理分歧，關係「沒壞到那種程度」。■習近平昨天在秘魯 APEC 工商領袖峰會上發表主題演講，認為建設亞太自由貿易區是事關亞太長遠繁榮的戰略選擇，呼籲相關國家共同參與，對抗保護主義。他又用原產於南美的番薯做比喻，稱中國將扎根亞太，並帶動亞太經濟增長。■緬甸北部昨天爆發武裝衝突。央視新媒體報道，武裝衝突中有流彈落入雲南境內，邊境小鎮畹町有人被流彈擊傷手臂。據悉，當日上午有八十餘名緬甸難民進入畹町，進入中國境內的難民人數還在增加。 ■加拿大保守黨國會議員倫佩爾（Michelle Rempel) 上周四在國會發言時，指摘政府對待艾伯塔省（Alberta）「就像對房中的一個臭屁」般不聞不問，結果惹來敵對政黨質疑用字粗鄙，有違「議會操守」。加拿大網民則對這宗「臭屁門」甚為無奈，加以揶揄。■日本首相安倍晉三出席秘魯亞太經合組織 (APEC) 會議後，今日會轉抵阿根廷進行國事訪問，希望促進日本在拉丁美洲的投資。今次是繼安倍外祖父岸信介後，相隔 57 年後再有日揆訪問阿根廷。■大陸房價漸見回穩之際，新華社再發評論文章，批評開發商高價投地，及有巨額資金湧入樓市，是導致樓價上升的元兇。■大陸農地不斷縮減，環境問題卻不斷突顯，重金屬、化學品污染嚴重，其中每年有 1200 萬噸糧食因土壤受重金屬污染，損失達 200 億元。■香港「傳真社」調查發現，三款「來電攔截」手機應用程式「CM Security」、「Truecaller」及「Sync.ME」涉嫌收集用戶通訊錄並整合成公開資料庫，讓用戶利用「號碼反查」功能追溯號碼持有者身份，甚至社交網絡賬戶等，估計全球約 30 億電話號碼用戶身份遭洩露，特首梁振英、政務司司長林鄭月娥等均「中招」。《重要指標》◇ 美洲■美國 10 月諮商會領先指標月增 0.1%，預期值為 0.1%，前值為 0.2%。■加拿大 10 月 CPI 月增 0.2%，年增 1.5%，皆與預期相符。◇歐洲■德國 10 月 PPI 月率 0.70%，預期值 0.20%，前值 - 0.20%■德國 10 月 PPI 年率 - 0.40%，預期值 - 0.90%，前值 - 1.40%◇亞洲■韓國 10 月 PPI 年率 - 0.20%，前值 - 1.10%■韓國 10 月 PPI 月率 0.20%，前值 0.20%《金融市場》◇美股■工業平均指數收低 35.89 點或 0.19% 至 18867.93 點■Nasdaq 指數收低 12.46 點或 0.23% 至 5321.51 點■ 指數收低 5.22 點或 0.24% 至 2181.90 點■指數收高 5.79 點或 0.67% 至 872.63 點◇歐股■德國 DAX-30 指數收低 20.98 點或 0.20% 至 10664.56 點■英國 FTSE 100 指數收低 18.94 點或 0.28% 至 6775.77 點■法國 CAC 40 指數收低 23.42 點或 0.52% 至 4504.35 點◇亞股■台股收盤上漲 13.53 點, 報 9008.79 點■日經 225 指數收高 104.78 點或 0.59% 至 17967.41 點■韓國 Kospi 指數收低 5.97 點或 0.30% 至 1974.58 點■澳洲 ASX 普通股指數收高 18.60 點或 0.34% 至 5427.50 點■上海綜合指數收低 15.59 點或 0.49% 至 3192.86 點■香港收高 81.33 點或 0.37% 至 22344.21 點◇■COMEX 收跌 8.20 美元，收於每盎司 1208.70 美元◇原油■NYMEX 原油期貨收漲 0.27 美元，至每桶 45.69 美元■ICE 倫敦 布倫特原油期貨收漲 0.37 美元，至每桶 46.86 美元◇穀物■CBOT 玉米期貨上漲 3.75 美分，報每英斗 3.5350 美元■CBOT 小麥期貨上漲 5.25 美分，報每英斗 4.2525 美元■CBOT 黃豆期貨上漲 4.25 美分，報每英斗 9.9375 美元◇匯市■兌美元收盤貶 1.42 角，收 32.010 美元■美元 / 報 32.0100，升 0.1420 或 0.45%■美元 / 報 6.8873，貶 0.0000 或 0.00%■報 101.4300，升 0.2200 或 0.22%■美元 / 報 111.0100，升 0.1350 或 0.12%■ / 美元報 1.0580，貶 0.0007 或 0.06%■ / 美元報 1.2323，貶 0.0021 或 0.17%■美元 / 報 1.0112，升 0.0013 或 0.13%■美元 / 報 1.3511，升 0.0009 或 0.07%■ / 美元報 0.7320，貶 0.0014 或 0.19%","[['日矽', '準', '股權跨足智慧製造\xa0'], ['會', '準', '股權跨足智慧製造\xa0'], ['中國', '是', '關鍵'], ['恐跌', '到', '115\xa0郭臺銘'], ['阿里巴巴主席', '馬雲指', '美國總統不是偶然事件'], ['美國總統', '不是', '偶然事件'], ['精英階層', '認爲', '這是個黑天鵝事件'], ['這', '是', '個黑天鵝事件'], ['馬雲', '表示', '不是最差總統'], ['肯定', '是', '最好的總統'], ['美股本週', '只有', '個交易日'], ['股市走勢', '受候', '所左右'], ['股市走勢受候所左右', '任', '內閣人事'], ['公司客戶資料', '遭', '入侵事件'], ['英國警方', '報', '3名疑犯'], ['公司', '稱', '遭入侵涉財務資料'], ['今次', '遭', '入侵'], ['核心人物', '包括', '朴槿惠閨密崔順實'], ['朴槿惠', '泄露', '機密文件'], ['消息人士', '透露', '總理梅克爾表示她準備'], ['總理梅克爾', '表示', '她準備'], ['多項民調', '顯示', '次輪投票敗給前總理朱佩'], ['勒龐成功', '突破', '首輪投票'], ['次輪投票', '敗給', '前總理朱佩'], ['偏', '右', '共和黨'], ['法國哲學家利維', '坦言', '關注他們說真話'], ['選民', '相信', '個人魅力'], ['勒龐', '入主', '愛麗捨宮'], ['財政預算案', '是', '首次'], ['財政部', '透露', '預算案主調'], ['財政部透露預算案主調', '是', '增加基建投資'], ['祕魯', '出席', 'APEC峯會'], ['寒暄', '超過', '十分鐘'], ['宋楚瑜', '代表', '民進黨政府'], ['互動程度', '超出', '預期'], ['大陸學者劉國深', '認爲', '宋偶遇顯示私交發揮重要作用說明兩岸希望分歧'], ['宋偶遇', '顯示', '私交發揮重要作用'], ['私交', '發揮', '重要作用'], ['宋偶遇顯示私交發揮重要作用', '說明', '兩岸希望分歧'], ['兩岸', '希望', '分歧'], ['習近平', '發表', '主題演講'], ['建設亞太自由貿易區', '是', '戰略選擇'], ['建設亞太自由貿易區是戰略選擇', '事關', '長遠'], ['他', '做', '比喻'], ['中國將', '紮根', '亞太'], ['緬甸北部', '爆發', '武裝衝突'], ['央視新媒體', '報道', '武裝衝突中有流彈落入雲南境內'], ['武裝衝突中', '有', '流彈落入雲南境內'], ['流彈', '落入', '雲南境內'], ['有人', '擊傷', '手臂'], ['緬甸難民', '進入', '畹町'], ['，', '進入', '中國境內'], ['日本首相安倍晉三', '出席', 'APEC會議'], ['阿根廷', '進行', '國事訪問'], ['今次', '是', '安倍外祖父岸信介'], ['有日揆', '訪問', '阿根廷'], ['大陸房價', '見', '回穩'], ['漸', '見', '回穩'], ['新華社', '再發', '評論文章'], ['開發商', '投', '地'], ['鉅額資金', '湧入', '樓市'], ['每年', '有', '土壤受重金屬污染'], ['土壤', '受', '重金屬污染'], ['手機應用程式CM Security', '涉嫌', '收集用戶通訊錄'], ['億電話號碼用戶身份', '遭', '泄露'], ['月', '增', '0.1%'], ['預期值', '爲', '0.1%'], ['10 月CPI月', '增', '0.2%'], ['至 872.63 點◇歐股■德國 DAX-30 指數', '收低', '20.98點']]"
0,20161121_1703,大慶證券投顧盤前－多頭醞釀反攻  台幣動向是關鍵◆盤勢分析歐美股市上週五依然震盪，主要是市場持續消化聯準會 12 月要升息的議題，此外，近期國際資金流動很明顯轉向美元，在上周五持續創下波段新高來到 101.35，美國 也來到 2.348%，從美元持續走高以及債市殖利率上揚可以發現，目前趨勢轉向美元以及資金從債市撤退，由於川普當選後要讓美國為重心的政策風向發酵，因此導致目前的趨勢變化，尤其新興市場在短線上受到的衝擊最大，包括拉丁美洲、東南亞等地區的股匯市都出現雙殺的狀況，短線來看，在美元沒有轉弱前，研判本週資金將持續回流美元以及美股不變，指標觀察美元、、油價等。  亞股上週股呈現漲跌互見的狀況，而前幾日大幅貶值的亞幣，在上周五短線上有開始止穩的跡象，因此也讓股市得以開始有回穩跡象，不過由於美元持續創高，本周亞股仍要面臨外資撤退的狀況。在陸股部分由於黑色系原物料價格近日熄火，導致已經 3 日陷入橫向盤整，所幸指數都還可維持於 5 日線之上整理，技術面多頭仍相對強勢，由於深港通即將在年底前開通，雖然先前市場已經以一波的漲勢來反應，不過在目前中國經濟狀況開始好轉，加上川普的國際政策有利中國在亞洲坐大來看，陸股波段多頭走勢未變，相關陸股 ETF 仍可持續偏多操作。   台股上週週線在連三黑後收紅，尤其上週外資在現貨賣超 458 億元，但是台股技術面能守住前低 8885 點位置，在外資賣壓有打不下指數的現象來看，本週多頭有醞釀反撲機會，而從金管會的數據來看，在 11 月前半月，外資已淨匯出 17.99 億美元，約 570 多億元，配合短線兌美元貶值突破 32 元來看，外資撤出的趨勢需要減緩，台股的賣壓才能對減輕，短線觀察能否由貶轉升。以盤面來看，電子股在上週五扮演主流角色穩住盤勢，先前漲多的金融、傳產則是陷入盤整，而 OTC 中小型股在同致、祥碩、精華等高價股回穩下也展開反彈，由於前波殺盤重心都在中小型股，因此短線上若中小型股開始回穩，則大盤反攻力道將更為強勁，多頭焦點以半導體、IC 設計、汽車電子等為主，至於原物料以及金融股，在目前多方趨勢未變下，研判整理後仍有高，也為另一選股方向。,"[['多頭醞釀臺幣動向', '是', '上週五震盪'], ['國際資金流動', '轉向', '美元'], ['新高', '來到', '101.35'], ['美元', '走', '高'], ['趨勢', '轉向', '美元'], ['指標', '觀察', '等美元'], ['\xa0亞股上週股', '呈現', '漲跌狀況'], ['貶值亞幣', '有', '開始止穩跡象'], ['本週亞股', '面臨', '撤退外資狀況'], ['外資', '撤退', '外資'], ['所幸指數', '維持於', '整理'], ['經濟狀況', '開始', '好轉'], ['上週周線', '收', '紅'], ['臺股技術面', '守住', '8885點位置'], ['賣壓', '有', '打指數現象'], ['本週多頭', '有', ' 17.99 億美元'], ['外資撤出趨勢', '對', '減輕'], ['主流角色', '穩住', '盤勢'], ['漲金融', '陷入', '盤整'], ['OTC中小型股', '展開', '反彈'], ['前波殺盤重心', '在', '中小型股'], ['中小型股', '開始', '回穩']]"
0,20161121_1704,華冠投顧－黃睿緯顧問－半年線支撐穩了嗎?類股誰弱誰強?《盤前分析》大盤上週一盤中殺破半年線，之後連 4 天出現量縮紅 K，雖然上週五開低走高上漲 13 點，重新站上 9000 點整數關卡，但 9000 點並不具技術性意義，反到是連四日的量縮紅 K 僅能視為弱勢反彈。均線型態來觀察，雖然目前大盤站回 5 日線且 5 日線翻揚向上，但 10 日線已下壓到 9029，月線與季線上週五收盤已形成死亡交叉，月季線位處 9140-9150，將是目前上檔沉重反壓，筆者綜合研判目前大盤在半年線雖見跌深後的弱勢反彈但並未見到強力止跌訊號，格局上仍是弱勢大盤，上週五美股四大指數收盤漲跌互見，近期半年支撐仍有待測試。類股結構來觀察，雖然電子股上周五進行跌深反彈，但整體電子股仍屬相對弱勢的族群，其高低位階與大盤相仿，換句話說目前台股大盤幾乎等同於電子，成也電子敗也電子，除了整體電子業於每年 10 月後開始步入傳統產業淡季，營收衰退，股價開始領先反應，顯然外力部分，目前川普當選美國總統後，希望電子製造業能回流美國，以增加美國人的就業率，不管到時川普就任後，政策是否大力推行，光是目前的喊話，也帶來多數電子股不小的壓力，尤其如減少對於太陽能的稅率減低與補貼用戶的宣示，業已造成國內太陽能個股的破底，成為電子股中的重災區，所以對於上周五的電子股的反彈，都僅能以跌深小反彈視之。而強勢的族群仍以川普當選後政經大趨勢將改變下，政策受惠最大的鋼鐵類股為首的傳產原物料族群，以及間接受惠的散裝輪為主，而金融股方面的型態也算是維持多頭排列，主要是反應美國 12 月升息機率越來越高的預期。投資朋友不妨朝這幾個大方向去尋寶。而多數弱勢電子股目前恐仍為向下修正的重心，這方面仍建議避開搶短，而手中若有弱勢電子股更宜趕緊汰弱換強或收回資金，相對地趨勢受惠下的產業個股，如鋼鐵股中的指標股 2014 中鴻，目前進行短線漲多後的修正，可留意第二波攻擊再起時機，另散裝航運較鋼鐵股較晚起漲，上周五仍持續強勢上漲，這部分在短線漲多正乖離擴大下，本周不建議再進行追高，但若見適度拉回量縮都可留意布局點，電子股中維持波段強勢的個股，現階度已如鳳毛麟角，筆者之前分享過的 3625 西勝與 3149 正達卻反向於上周創下今年波段新高價 (預知操作詳情可加入 Line 群組 ID:@yaya17168)，其背後故事耐人尋味，時間的關係我先點到為止。而後續無論個股強弱多空走勢，遵守操作紀律，善設停利停損，方能取得贏家之鑰。以上和投資好朋友作分享，最後祝大家今天操作順利賺大錢!!!以上內容由華冠投顧 黃睿緯顧問撰寫，僅提供參考!華冠證券投資顧問股份有限公司 (104) 金管投顧新字第 009 號本資料僅供參考投資時應審慎評估,"[['上週一盤中', '殺破', '半年線'], ['9000點', '不具', '技術性意義'], ['量縮紅', '視爲', '弱勢反彈'], ['收盤', '形成', '9140-9150交叉'], ['大盤', '見', '跌後弱勢反彈'], ['支撐', '有待', '測試'], ['整體電子股', '屬', '相對弱勢族羣'], ['臺股大盤', '等同以', '增加美國人就業率'], ['整體電子業', '步入', '淡季'], ['股價', '開始', '川普當選美國總統'], ['電子製造業', '迴流', '美國'], ['強勢族羣', '當選', '後政經大趨勢改變下'], ['的', '傳產', '原物料'], ['金融股方面型態', '算是', '維持多頭排列'], ['恐', '爲', '修正重心'], ['手中', '有', '弱勢'], ['電子股中', '維持', '波段強勢'], ['現階度', '如', '鳳毛麟角'], ['預知操作詳情', '加入', 'Line羣組ID'], ['我', '點到', '時間關係'], ['以上內容', '投顧', '黃睿緯顧問撰寫']]"
0,20161121_1705,"為了夏普？傳鴻海擬入股Devialet、或研發TV喇叭MoneyDJ 新聞 2016-11-21  記者 蔡承啟 報導日經新聞 19 日報導，全球最大代工廠鴻海 (2317) 正考慮入股法國高級音響商 Devialet。據悉，Devialet 考慮進行增資，而鴻海計劃參與，預估 Devialet 可能將在數週內敲定出資者、金額等細節。(附圖為鴻海董事長郭台銘)Devialet 是一家於 2007 年設立的新興音響商，其產品的設計性和高音質獲得蘋果 (Apple) 認可，歐美 Apple Store 有在販售 Devialet 產品。報導指出，鴻海正積極藉由併購 (M&A) 擴大事業領域，而若真入股 Devialet，也可能攜手 Devialet 研發子公司夏普 (Sharp) 電視產品所需的喇叭。因主要客戶蘋果 (Apple) 銷售減速，故鴻海急於轉換事業模式，今年 9 月鴻海對中國叫車服務商滴滴出行母公司出資約 1 億美元。夏普數位情報家電事業本部副部長喜多村和洋於 9 月 20 日在東京都舉行的產品發表會上表示，將在今年內開始委託母公司鴻海代工生產液晶電視。喜多村和洋指出，計畫於 2018 年度將液晶電視全球銷售量提高至 1,000 萬台、將達 2016 年度的約 2 倍水準。＊編者按：本文僅供參考之用，並不構成要約、招攬或邀請、誘使、任何不論種類或形式之申述或訂立任何建議及推薦，讀者務請運用個人獨立思考能力，自行作出投資決定，如因相關建議招致損失，概與《精實財經媒體》、編者及作者無涉。","[['鴻海', '擬', '入股'], ['Devialet', '進行', '增資'], ['Devialet', '敲定', '等出資者細節'], ['附圖', '爲', 'Devialet是新興音響商'], ['Devialet', '是', '新興音響商'], ['其產品設計性', '獲得', 'Apple蘋果'], ['歐美', '有', '販售'], ['報導', '指出', '鴻海借M&A'], ['鴻海', '借', 'M&A'], ['本部副部長喜多村', '表示', '開始委託']]"
