,News,All,SVO
0,20160108_800,健格12月營收0.31億元年增20.11% 1— 12月達2.48億元健格()2015年 12月營收資料(單位:千元),[]
0,20160108_801,眾福科技12月營收1.92億元年增34.65% 1— 12月達18.59億元眾福科技()2015年 12月營收資料(單位:千元),[]
0,20160108_802,嘉實資訊12月營收0.56億元年增19.90% 1— 12月達5.17億元嘉實資訊()2015年 12月營收資料(單位:千元),"[['嘉實資訊', '營收', '0.56億元年']]"
0,20160108_803,台灣之星12月營收7.61億元年減17.20% 1— 12月達90.15億元台灣之星(3157-TW)2015年 12月營收資料(單位:千元),"[[' 12月', '達', '臺灣']]"
0,20160108_804,臺灣工銀12月營收6.28億元年減3.42% 1— 12月達76.16億元台灣工銀()2015年 12月營收資料(單位:千元),[]
0,20160108_805,國泰產險12月營收16.70億元年增20.20% 1— 12月達187.26億元國泰產險(2877-TW)2015年 12月營收資料(單位:千元),[]
0,20160108_806,山富旅遊12月營收2.71億元年減19.69% 1— 12月達57.13億元山富旅遊()2015年 12月營收資料(單位:千元),[]
0,20160108_807,和昇休閒12月營收0.10億元年增16.66% 1— 12月達1.01億元和昇休閒(2720-TW)2015年 12月營收資料(單位:千元),"[['和', '升', '休閒']]"
0,20160108_808,運錩12月營收5.87億元年減10.40% 1— 12月達76.46億元運錩()2015年 12月營收資料(單位:千元),[]
0,20160108_809,出口連11黑 工總：不改善台灣產業恐空洞化財政部公布去年整年出口統計，年衰退超過一成，且是連續11個月負成長。工總表示，台灣正面臨五缺六失的問題，外國人不敢來台投資，但經濟成長需要有新投資帶動，現在國際上區域經濟整合持續進行中，企業一定會轉往具有關稅優惠的地方生產，若政府再不改善，未來台灣產業將空洞化。（馮建棨報導）財政部公布去年全年度出口統計，除一月份正成長之外，其餘月份都是負成長，年衰退10.6%。全國工業總會秘書長蔡練生表示，連續衰退凸顯台灣產業發展遇到瓶頸，產業結構需要調整，近幾年都集中在部分ICT產品上，尤其都壓在「蘋果概念股」，現在在全球景氣疲軟下，只靠單一產品就容易受影響，今年產業生產過剩、庫存還在去化當中。蔡練生也指出，工總持續拋出台灣「五缺、六失」的現況，整體環境持續惡化，再加上國內政黨惡鬥，讓很多人對未來充滿不確定感，所以沒有新的投資沒有。且經濟成長需要有新的投資，外國人看到台灣的狀況不敢投資，國內產業要顧及全球布局，讓大多數的投資都轉往國外。蔡練生說:『企業的投資並沒有停止，它都配合全球布局，都到海外布局去』蔡練生認為，現在台灣另一個問題是海外生產比持續升高，呈現「台灣接單、海外生產」的現象。海外生產比從去年初的52%，下半年提升至59%。國際上韓國因美韓FTA出口持續成長，台灣卻逆向減少，代表產品替代的情況正在發生，且TPP、中韓FTA即將生效，相關效果也會逐漸浮現，這迫使企業外移到享有免稅的國家生產製造，進一步造成台灣產業空洞化。,"[['年衰退', '超過', '一成'], ['工總', '表示', '經濟成長需要有投資'], ['臺灣', '正面臨', '五缺六失問題'], ['外國人', '來', '臺'], ['經濟成長', '需要', '有投資'], ['持續', '進行', '上區域經濟整合'], ['往', '具', '有關稅優惠'], ['財政部', '公佈', '出口統計'], ['其餘月份', '都是', '負成長'], ['全國工業總會祕書長蔡練生', '表示', '遇到瓶頸'], ['衰退', '凸顯', '臺灣產業發展'], ['庫存', '還在', '去化當中'], ['還在', '去', '化'], ['蔡練生', '指出', '沒有新投資'], ['工總', '拋出', '五缺現況'], ['經濟成長', '需要', '有新投資'], ['外國人', '看到', '臺灣狀況'], ['國內產業', '顧及', '全球佈局'], ['它', '配合', '全球佈局'], ['蔡練生', '認爲', '另一個問題是現象'], ['另一個問題', '是', '現象'], ['，', '代表', '替代']]"
0,20160108_810,羅尤美：全球動盪 美國就業穩健 配置以美股為核心富蘭克林證券投顧副總經理羅尤美表示，2016年以來僅有幾個交易日全球股市表現卻相當震盪，而讓市場氣氛如此悲觀的原因主要在於對中國乃至全球經濟前景的擔憂，以及中東地區、朝鮮半島等地地緣政治風險增溫的影響。以過去經驗觀察，地緣政治衝突若沒有導致真正的戰爭爆發，則其對於金融市場的影響通常是較為短暫的，屬於頭條新聞風險。就投資策略而言，由於目前市場不確定因素還是不少而且股市波動程度加大，但美國就業市場狀況仍然相當穩健，所以建議配置上首重的核心部位應以美國股市為主。羅尤美表示，隨著匯率貶值加以經濟數據不佳，投資人真正關注的焦點仍在中國經濟前景，不過，全球市場在去年已耗費大部分時間擔憂中國經濟放緩，是已知的利空，經濟放緩乃中國經濟轉型的必要之惡，且投資人也將焦點過度聚焦於製造業數據上而忽略其他數據的變化，例如中國官方公布的12月服務業採購經理人指數，即由11月的53.6大幅攀升至54.4，持平於2014年8月份高點，顯現出中國經濟在製造業部門雖有所放緩，但服務業的熱絡發展也為中國經濟轉型提供一定程度的緩衝。羅尤美表示，2015年12月中央經濟工作會議後，中國官方明訂「供給側」管理細節，以「去產能、去庫存、去槓桿、降成本、補短缺」做為五大主要任務，並積極強調「穩增長」的施政方向，多數券商皆預估中國2016年仍可維持6.5%~6.8%的經濟成長水準，因此對整體總經環境不需過度悲觀。羅尤美表示，就投資策略而言，由於目前市場不確定因素還是不少而且股市波動程度加大，所以建議投資人應重新審視自己的風險承受程度，適度減少高波動度的投資標的，並採取多元佈局的方式，以減緩市場大幅波動對於資產價值的衝擊。在中長期的佈局方向上，隨著市場波動放大，建議投資人應多留意投資標的的基本面，優先選擇成長性以及穩定性較好的區域，例如美股、亞洲新興市場的小型股，以及科技與醫療產業，除了可以降低短期風險，也不會錯失長期的投資機會。羅尤美建議，配置上首重的核心部位應以美國股市為主，最新公佈的ADP 12月美國就業人數增加25.7萬人，明顯超出預期，顯示美國就業市場狀況仍然相當穩健，有利於穩固美國經濟成長最大動力來源的內需消費動能，整體而言，2016年美國經濟可望以2.5%的速度穩定成長，搭配企業獲利預估有7.5%的年增率，預期將驅動2016年美股具溫和上漲空間。,"[['就業穩健配置', '爲', '羅尤美表示'], ['讓原因', '在於', '對擔憂'], ['政治衝突', '導致', '真正戰爭爆發'], ['對於影響', '是', '短暫的'], ['羅尤美', '表示', '投資人關注焦點在經濟前景'], ['投資人關注焦點', '在', '經濟前景'], ['投資人', '是', '其他數據變化'], ['服務業熱絡發展', '提供', '一定程度緩衝'], ['羅尤美', '表示', '供給側管理細節做爲主要任務'], ['供給側管理細節', '做爲', '主要任務'], ['「', '穩', '增長'], ['多數券商', '預估', '中國維持經濟成長水準'], ['中國', '維持', '經濟成長水準'], ['羅尤美', '表示', '建議投資人審視風險承受程度'], ['投資人', '審視', '風險承受程度'], ['投資人', '審視以', '減緩對於衝擊'], ['投資人', '留意', '投資標的基本面'], ['小型股', '錯失', '投資機會'], ['羅尤美', '建議', '爲主'], ['就業人數', '增加', '25.7萬人'], ['獲利預估', '有', '7.5%年增率']]"
0,20160108_811,聯發科12月營收月減11.6% 全年營收微增再創新高IC設計聯發科()今(8)日公布12月營收，達185.2億元，月減11.6%，年增8.47%，第4季在高階手機晶片市佔率提高推升下，達617億元，優於法說高標，去年全年營收也達2132.55億元，年增0.09%，也比原來法說預期的小幅衰退還好，全年營收同時也再創歷史新高。聯發科今日公布12月營收，達185.2億元，月減11.6%，年增8.47%，第4季營收為617億元，優於原先預期的570-604億元區間，季增8.34%。聯發科去年下半年由於美元強勢走強，新興市場景氣需求下滑，聯發科因此調降全年手機晶片出貨目標，降到僅4億套，同時也調整全年營收展望，從原先預估成長，調降到衰退5-10%，引起市場擔憂。不過，聯發科高階手機晶片市占率持續提升，其中包含4G晶片出貨成長，帶動第4季營收達617億元，優於原先法說預估的604億元高標，季增8%。在第4季超標帶動下，聯發科去年全年營收為2132.55億元，年增0.09%，比原先預估的衰退情況好，也再創歷史新高紀錄。展望第1季，聯發科表示，由於工作天數不足因素影響，預期營收會較第4季修正，不過全年手機晶片、營收與市佔率，預期都會較去年成長，對今年展望仍是正面看待。,"[['12月營', '收', '月'], ['年', '增', '8.47%'], ['第4季', '達', '617億元'], ['全年營收', '達', '2132.55億元'], ['年', '增', '0.09%'], ['全年營收', '再創', '歷史新高'], ['聯發科', '公佈', '12月營收'], ['年', '增', '8.47%'], ['優於預期的', '爲', '570-604億元區間'], ['，', '優於', '預期'], ['聯發科', '調降', '出貨目標'], ['預估', '引起', '市場擔憂'], ['季', '增', '8%'], ['全年營收', '爲', '2132.55億元'], ['聯發科', '表示', '營收會修正']]"
0,20160108_812,鴻海2015全年營收4.48兆元　再創新高紀錄！記者許家禎／台北報導鴻海今（8）日公布2015年12月營收為4096.54億元，月減20.84%、年減20.54%。第4季合併營收則為1.43兆，季增34.16%，為歷年次高紀錄。累計鴻海2015年全年營收為4兆4830.96億元，較2014年全年的4兆2124.73億元成長6.42%，再度創下新高紀錄！鴻海2015年12月營收為4096.54億元，較11月的5175.19億元減少20.84%，也較2014年同期的5155.69億元減少20.54%。2015年第4季合併營收則為1.43兆，較第3季的1.06兆成長34.16%，為歷年次高紀錄，僅次於前年第4季，不過表現較前年同期減少4.62%。累計鴻海2015年全年營收為4兆4830.96億元，較2014年全年的4兆2124.73億元成長6.42%，創下新高紀錄！鴻海表示，去年12月三大產品線中，電腦運算產品(computing)和通訊產品(communication)表現較佳，消費性電子(consumer electronics)產品則表現弱一些，不過整體表現符合預期。法人表示，鴻海去年月營收高峰落在11月，12月營收減少20.84%，為出貨時間點不同所導致，但若以去年第4季與第3季來看，由於大客戶iPhone機型是小改版，以及受全球景氣不佳所影響，季與季相比，營收季減4.6%其實表現差不了多少。展望今年鴻海表現，法人預估第1季因前年第1季基期較高，經營上可能會有些壓力，但會回歸正常季節性淡季水準，而隨著下半年大客戶iPhone產品有機會做大改版，相信表現將會逐季好轉、漸入佳境！,"[['鴻海', '營收', '4.48兆元'], ['營收', '爲', '4096.54億元'], ['合併營收', '爲', '1.43兆'], ['全年營收', '爲', '4兆4830.96億元'], ['2014年全年4兆2124.73億元', '成長', '6.42%'], ['2015年12月營收', '爲', '4096.54億元'], ['合併營收', '爲', '1.43兆'], ['全年營收', '爲', '4兆4830.96億元'], ['較4兆2124.73億元', '成長', '6.42%'], ['鴻海', '表示', '整體表現符合預期'], ['整體表現', '符合', '預期'], ['法人', '表示', '差'], ['12月營收', '減少', '20.84%'], ['iPhone機型', '是', '小改版'], ['營收季', '減', '4.6%'], ['表現', '差', '多少'], ['法人', '預估', '迴歸淡季水準'], ['經營上', '有些', '壓力']]"
0,20160108_813,"一路慘到年底　12月出口220億美元　5年多來新低記者曹逸雯／台北報導財政部8日發布去（2015）年12月出口220.6億美元，排除春節因素，是2010年5月、近5年多以來的單月新低，年減13.9%，不僅是連續第11個月負成長，也已經連續7個月呈現兩位數負成長，從2月起，就一路負成長到年底。累計2015年出口2,804.8 億美元，年增率也呈現兩位數的負成長，年減10.6%，是金融海嘯以來的最差表現。財政部統計處處長葉滿足表示，12月出口表現續呈頹勢，主要是受到全球景氣成長動能微弱，農工原料價格低檔盤跌影響，廠商備貨意願仍顯觀望，進口因出口引申需求疲弱，12月進口178.9億美元，年減15.6%，累計2015年進口2,289.2 億美元，年減 16.5%。 葉滿足指出，12月主要貨品出口均較上年同月衰退，其中電子產品因庫存去化持續，光學器材則因產業競爭激烈市況不穩，礦產品、塑化產品與基本金屬及其製品也因油價、鋼價低盪，減幅仍然可觀，僅交通運輸設備小幅成長。對主要出口市場也都呈現衰退，去年對亞洲出口衰退11.4%，其中對東協六國衰退14.6%、對中國大陸衰退13.3%、對日本也衰退3.1%；另外，對歐洲衰退11.0%、對美國也衰退1.7%，主要出口市場需求均顯疲弱。葉滿足也表示，今年雖然有物聯網、大數據等新興應用持續拓展，半導體庫存水位漸趨正常，且半導體設備進口自去年6月以來已有明顯擴增，可望逐漸改善電子產品外銷動能，不過，全球景氣展望放緩、國際產業競爭加劇、農工原料價格下滑，加以中國大陸產能過剩與供應鏈自主化排擠效應等，都干擾我國出口前景。","[['新低記者曹逸雯', '出口', '220.6億美元'], ['年減', '呈現', '負成長'], ['年增率', '呈現', '負成長'], ['財政部統計處處長葉滿足', '表示', '出口表現呈頹勢'], ['出口表現', '呈', '頹勢'], ['備貨意願', '顯', '觀望'], ['進口', '年減', '15.6%'], [' 葉滿足', '指出', '主要貨品出口衰退'], ['庫存', '去', '化'], ['葉滿足', '表示', '全球景氣展望放緩干擾出口前景'], ['半導體設備進口', '已有', '明顯擴增'], ['全球景氣展望放緩', '干擾', '出口前景']]"
0,20160108_814,華碩2015年營收934億元 同比下降1.07%新浪科技訊 1月8日下午消息，據台媒報導，華碩於今日發布2015年財務數據。2015年，華碩營收4722.8億元(約為933.7億元)，同比下降1.07%。2015年第4季度，華碩營收1239.32億元(約為245億元)，環比增長11.7%。2015年12月，華碩自結合併營收411.11億元(約為81.3億元)，同比下滑3.14%。(張淇),"[['華碩', '發佈', '財務數據'], ['華碩', '營收', '4722.8億元爲933.7億元'], ['4722.8億元', '爲', '933.7億元'], ['環比', '增長', '11.7%'], ['華碩', '結合', '並'], ['約', '爲', '81.3億元']]"
0,20160108_815,聯發科2015年營收422億元 同比增長0.1%新浪科技訊 1月8日下午消息，據台媒報導聯發科於今日發布2015年財務數據。2015年，聯發科營收2132.55億元(約為421.61億元)，同比增長近0.1%，符合預期。2015年第4季度，聯發科營收617.13億元(約為122億元)，環比增長8.3%。2015年12月，聯發科營收185.2億元(約為36.61億元)，環比下滑11.6%。(張淇),"[['聯發科', '營收', '新浪科技訊'], ['聯發科營收617.13億元', '爲', '122億元'], ['環比', '增長', '8.3%'], ['聯發科', '營收', '爲36.61億元185.2億元'], ['約', '爲', '36.61億元']]"
0,20160108_816,遠傳去年EPS 3.52元 4G用戶311萬超越目標遠傳()今(8)日公佈2015年12月自結營利概況，全年度營收972.93億元，符合財測並寫下年度營收新高紀錄，全年每股稅後盈餘3.52元，財測達成率103.6%，截至2015年底，4G用戶總數為311萬戶達成並超越原訂目標。遠傳2015年12月合併總營收為84.26億元，合併EBITDA與稅後淨利分別為20.73億元與7.03億元，年增率各為12.1%與3.5%，單月每股盈餘 (EPS)為0.22元。 累計2015年全年合併總營收為972.93億元，累計合併EBITDA與稅後淨利為268.13億元與114.86億元，自結之稅後每股盈餘 (EPS)為3.52元，全年EPS財測達成率為103.6%。遠傳發言人郎亞玲表示，遠傳品牌計畫邁入第三部曲『用鼓勵讓台灣聽見愛』希望能號召大眾一起正面思考鼓舞台灣，成為新社會運動，且率先推出愛‧喜嗲鹿3D貼圖做為傳愛前導，好友人數攀增近200萬人，目前貼圖下載量已逼近400萬次，以『讚』圖最受青睞一路熱傳，傳送次數衝向850萬次。,"[['遠', '傳', '結營利概況'], ['4G用戶總數', '爲', '311萬戶'], ['合併總營收', '爲', '84.26億元'], ['EBITDA', '爲', '20.73億元'], ['年增率', '爲', '3.5%'], ['每股盈餘', '爲', '0.22元'], ['全年合併總營收', '爲', '972.93億元'], ['每股盈餘', '爲', '3.52元'], ['EPS財測達成率', '爲', '103.6%'], ['遠傳發言人郎亞玲', '表示', '希望號召大衆'], ['傳品牌計劃', '邁入', '第三部曲'], ['3D貼圖', '做爲', '傳愛前導'], ['好友人數', '攀增', '200萬人'], ['下載量', '逼近', '400萬次']]"
0,20160108_817,各尺寸面板出貨增加 群創12月營收月增3.8%群創()今(8)日公佈2015年12月合併營收264億元，較11月合併營收增加3.8%，但較2014年同期減少30.8%；累計全年合併營收為3641億元，較2014年全年營收4287億減少15.1%，群創將在2月2日召開法人說明會，公布去年獲利及對今年的展望。群創指出，在出貨量方面，2015年12月大尺寸合併出貨量1021萬片，與2015年11月相比增加5.8%；中小尺寸合併出貨量共計2401萬片，較11月增加3.2%。 群創表示，2015年第4季合併營收為815億元，較2014年同期減少29.1%，與2015年第3季合併營收888億相比減少8.2%。大尺寸合併出貨量共計3009萬片，與2015年第3季出貨量3028萬片相比減少0.6%；中小尺寸合併出貨量共計6893萬片，與2015年第3季出貨量6504萬片相比增加6%。 群創統計，2015年全年合併營收為3641億元，與2014年全年營收4287億元相比減少15.1%。大尺寸全年合併出貨量共計1億2300萬片，與2014年全年出貨量1億4140萬片相比減少13%；中小尺寸方面，全年合併出貨量共計2億5197萬片，與2014年全年出貨量3億2022萬片相比減少21.3%。,"[['營收', '增加', '3.8%'], ['合併營收', '爲', '3641億元'], ['營收4287億', '減少', '15.1%'], ['將', '召開', '法人說明會'], ['合併出貨量', '共計', '2401萬片'], ['\xa0羣創', '表示', '合併營收爲815億元'], ['合併營收', '爲', '815億元'], ['大尺寸', '合併', '出貨量'], ['大尺寸合併出貨量', '共計', '3009萬片'], ['合併出貨量', '共計', '6893萬片'], ['合併營收', '爲', '3641億元'], ['大尺寸合併出貨量', '共計', '1億2300萬片'], ['合併出貨量', '共計', '2億5197萬片']]"
0,20160108_818,千附去年營收30.85億元創新高 年增率3.98%水資源及航太概念股千附實業()最新揭露的營收資訊顯示，其2015年全年營收30.85億元創新高，較2014年29.67億元成長3.98%，也為千附的年度營收首次突破30億元關卡。千附主管指出，2015年營收創歷史新高，主要焦點在減少低毛利率專案工程承攬，營收結構朝高毛利產品比重提高調整下，呈現穩健轉型成長。千附實業2015年12月營收2.4億元，較其2014年同月2.55億元減少6.18%，較上月2.99億元，減少19.82%，但2015年第季單季營收8.57億元仍為歷年最佳營收紀錄。    千附指出，2015年各事業單位營運與2014年比較顯示，鞋機及精科在2014年高基期下持續成長，鞋機成長18.09%、精密科技成長10.93%，其中光電半導體及國防類航太產品分別超越2014年全年業績約15.86%、10.47%；廠務工程成長41.26%、水資源成長11.22%。對於2016年，千附指出，在美商Nike樂觀表示未來5年複合成長率將達10%，以及波音對未來航太產業前景看好下，公司因應此波需求，已於中科二期擴廠，在正式投產後，將有機會突破產能瓶頸，啟動新的成長動能。,"[['營收資訊', '顯示', '創新高'], ['千附年度營收', '突破', '30億元關卡'], ['主要焦點', '減少', '低毛利率專案工程承攬'], ['第季單季營收8.57億元', '爲', '營收紀錄'], ['\xa0\xa0\xa0 千附', '指出', '各事業單位營運顯示'], ['光電半導體', '超越', '15.86%'], ['千附', '指出', '複合成長率達10%'], ['美商Nike樂觀', '表示', '未來5年'], ['複合成長率', '達', '10%']]"
0,20160108_819,霹靂12月營收報喜 兩岸線上付費啟動 今年營收2位數成長文創股霹靂()公布12月營收達5946萬元，月增11.51%，年增3.18%，累計去年營收為6.43億元，年減1.64%，今年起布袋戲劇集將跨足線上付費收視，台灣以正式收費，大陸則在上半年啟動收費，法人估計在新增線上付費新增帶動下，今年營收將會有雙位數成長。霹靂表示，今年累計營收略減主要由於去年舉辦「霹靂奇幻武俠世界－布袋戲藝術大展」；若排除展覽活動收入影響，去年各項營收反而逆勢成長約8%，且營收組成項目中，獲利最佳的授權收入更大幅成長達8成以上。霹靂進一步表示，在台灣造成轟動的手機遊戲「霹靂江湖」，下載人數達250萬人次，已上市逾1年仍持續熱賣，加上預計元月底前推出的全新手機遊戲「霹靂傳奇」，今年霹靂授權收入將持續成長。另外霹靂於今年起布袋戲劇集將跨足線上付費收視，台灣部分透過YouTube頻道「霹靂院線台」已正式啟動付費訂閱，大陸部分也預計於上半年啟動線上付費收視機制，透過線上付費收視平台，未來在劇集收入部分也將持續成長，法人估計在新增線上付費新增帶動下，今年營收將會有雙位數成長。,"[['今年', '營收', '成長文創股霹靂'], ['營收', '有', '雙位數成長'], ['霹靂', '表示', '主要'], ['營收減', '主要', '由於'], ['大幅成長', '達', '8成以上'], ['霹靂', '表示', '造成手機遊戲霹靂江湖'], ['下載人數', '達', '250萬人次'], ['YouTube頻道霹靂院線臺', '啓動', '付費訂閱'], ['營收', '有', '雙位數成長']]"
0,20160108_820,"元大期貨台股期指盤後－空方攻勢遭中斷 上方壓力待突破◆盤勢分析週四美股平均重跌超過1.5%，歐台期也下跌61 點，導致週五早盤開在7800點之下，不過因中國取消了僅實施4日的熔斷機制，同時也對大股東出脫持股作一定程度的限制，讓市場的壓力大幅減輕，令出現技術性反彈，日線迅速由黑翻紅，隨後直到收盤為止，大致都維持在平盤上整理，終場以上漲63點作收，停止連續4日的下跌趨勢；期現貨逆價差由47點收斂至29點，且舊制選擇權波動率指數也從22.26下降至21.8，都顯露出市場的空頭行情略有淡化。觀察法人籌碼變化，三大法人合計賣超31.7 億元，連續8個交易日賣超，其中外資賣超49.4億元，自營商則買超21.6億元；再由留倉淨部位來看，外資減碼淨多單1,263口至16,618口，自營商也減碼淨空單1,232口至60口，三大法人合計淨多單增加777口至8,936口，整體法人賣超現貨，但加碼期貨淨多單，仍預期逆價差會逐漸收斂。各類期指方面，電子權值股的買氣明顯回溫，近期跌幅較重的大立光和聯發科分別收漲 7.92%和3.64%，帶動電子期反彈超過1%；金融類股也因止貶，加上金管會運用調升融券保證金至120%的方式救市，讓連日下挫的國泰金和富邦金回穩，連帶激勵金融期回升；但技術面上，買盤雖然略有回溫，目前仍位於相對低檔的水位，上方也還有層層均線的壓力需突破，短線上不容過度樂觀。","[['空方攻勢', '遭', '中斷'], ['壓力', '待', '突破'], ['週五早盤', '開在', '7800點之下'], ['中國', '取消', '熔斷機制'], ['日線', '翻紅直到', '爲止'], ['現貨逆價差', '收斂至', '29點'], ['舊制選擇權波動率指數', '下降至', '21.8'], ['合計賣', '超', ' 億元'], ['三大法人', '增加', '777口'], ['重大立光', '收', '7.92%'], ['電子期反彈', '超過', '1%'], ['金管', '運用', '方式'], ['調升融券保證金', '至', '120%'], ['買盤', '略有', '回溫'], ['上方', '還有', '層層均線壓力需突破'], ['層層均線壓力', '需', '突破']]"
