,News,All,SVO
0,20160909_421,DR.WU達爾膚8月營收開紅盤 重回1億元大關DR.WU 達爾膚生醫 ()8 月營收開紅盤，自結營收為 1.01 億元，較 7 月成長 31.5%，並較去年同期成長 23.4 %，累計前 8 月營收為 6.8 億元，年增 43%。DR.WU 達爾膚表示，公司目前在台灣市場維持高成長動能，實體、虛擬及海外通路皆大幅成長，主力藥妝通路業績表現更是突出、貢獻度最高。因應市場需求，DR.WU 達爾膚 7 月推出「杏仁酸」、「玻尿酸」系列新品，也帶動全台居家煥膚風潮，而看好噴霧市場潛力與商機，DR.WU 達爾膚也順勢推出「DR.WU 玻尿酸冰河保濕噴霧」。對於即將進入 9 月的醫美檔旺季，同時也是藥妝通路年度最大促銷檔期，DR.WU 達爾膚表示，將主推經典玻尿酸保濕重量版迎戰，另搭配獨家組合包、吸睛優惠和超值滿額贈，滿足消費者不同保養需求和預算。至於中國部分，DR.WU 達爾膚也瞄準一線城市的一級商圈，鎖定中高端消費族群，繼 7 月首度跨足首都北京，於龍湖大興天街、望京凱德兩大熱門購物中心開設旗艦店後，8 月 26 日在進駐北京君太百貨，9 月 1 日也於上海中山公園龍之夢購物中心再添一店，屆時旗艦店數將躍升為 5 家。,"[['結營收', '爲', '1.01億元'], ['31.5%成長', '營收爲', '6.8億元'], ['DR.WU達爾膚', '表示', '公司維持高成長動能'], ['公司', '維持', '高成長動能'], ['，DR.WU 達爾膚', '推出', '保溼噴霧'], ['即將', '進入', '9月'], ['DR.WU達爾膚', '表示', '迎戰'], ['，DR.WU 達爾膚', '瞄準', '一級商圈'], ['首度', '跨', '足首都北京'], ['熱門購物中心', '開設', '旗艦店']]"
0,20160909_422,"樂陞收購案破局一周了...今周刊踢爆百尺竿頭4疑點百尺竿頭悔婚樂陞，樂陞身陷調查風暴，暨樂陞董事長許金龍據悉檢調擬傳喚樂陞 3 獨董陳文茜、尹啟銘、李永萍，來釐清案情，金投會理事長尚潔梅昨 (8) 在三立新台灣加油節目中指出，從公開資訊站的會議資料顯示，3 獨董，竟是這起收購案決定的關鍵人物，整起百尺竿頭收購樂陞案，疑雲重重，就有周刊爆料指出，事主日商「百尺竿頭」數位娛樂，檢調單位也必須查個清楚！以下是今週刊點出的四大疑點：《今周刊》爆料指出，發現, 真正的事主, 日商「百尺竿頭」數位娛樂，疑點重重: 本刊調查,「百尺竿頭」這家外界眼中神祕的公司, 看似普通僑外資, 但經歷過 3 次變更登記, 從內湖、汐止在到板橋, 而這一路轉換地址的過程, 竟與樂陞另一位前 10 大股東──動游有限公司 (以下簡稱動游), 有著驚人的相似之處。動游是樂陞第三大股東, 目前地址設在新北市汐止區新台五路 1 段 116 號 20 樓, 這個地址竟與百尺竿頭在今年 3 月遷入的地址完全相同! 另外去年 12 月, 百尺竿頭位於台北市內湖區的地址, 也與動游幾乎一模一樣。換言之, 動游與百尺竿頭不僅事業內容高度重疊, 連選擇辦公地點, 都一再「心有靈犀」。動游的背景也值得玩味。該公司的代表人名叫謝啟耀, 謝啟耀何許人也? 他在中國以智慧電視遊戲平台發跡, 他所製造內建遊戲的電視機上盒, 在中國電視系統與遊戲兩大產業均吃得開。因此, 有人不免質疑動游具有中資色彩。疑點二: 收購前夕, 突換董事長百尺竿頭會被外界認為是日商, 是因為該公司負責人樫埜由昭是日本人。但從陳文茜等三位獨立董事的聲明, 並查詢公開資料發現, 百尺竿頭創辦人其實是「黃文鴻」, 此位黃文鴻在百尺竿頭經營過程中, 一直擔任董事長, 直到今年 5 月 30 日、也就是宣告公開收購樂陞前一日, 才改由樫埜由昭擔任代表人。如此重大的事件, 黃文鴻為何在消息曝光前的最後關頭, 才交棒給日籍人士? 新董事長又為何「有充分準備」, 一上任就發動 48 億元收購案? 這是黃文鴻始料未及, 或只是讓日籍人士擔任人頭、提高跨國偵緝的難度, 阻礙檢調查明違約交割的來龍去脈?疑點三: 跟子公司調頭寸, 負債標高近年樂陞營運體質也有相當轉變。以負債為例, 雖然 08 年迄今, 樂陞的負債比率並未偏高, 但總負債從 14 年第 3 季約 17.3 億元, 在今年上半年大幅增加到 46.2 億元, 2 年間增幅 167%!而樂陞向子公司「調頭寸」的動作, 也值得注意, 其中, 一之鄉光今年上半年就貸款 2.53 億元給母公司樂陞, 而這個金額, 正好就是樂陞旗下, 由一之鄉、怡客咖啡組成的餐飲事業子公司去年的全部營收, 規模不能算小。投資人或許要問, 母公司為何要向新購併的子公司調度如此多的資金? 款項運用到何處? 這些現今, 是否才是樂陞購併一之鄉與怡客的真正理由? 這幾個問題, 可能要由董事長許金龍講清楚、說明白。疑點四: 可轉債, 遭質疑讓金主套現關於資金調度, 樂陞今年密集發行可轉債, 也相當引人注意, 今天 3 月初, 樂陞為籌措剩餘資金、併購廈門同步網絡, 一口氣發行 3 次可轉債 (樂陞四、樂陞五、樂陞六) 額度共計 20 億元, 並且在發行 1 個月後可轉換為普通股。這些可轉債, 如今被外界質疑, 是樂陞讓金主套現的籌碼! 以發行 10 億元、總計 1 萬張 (可轉債每張票面金額為 10 萬元) 的樂陞六為例, 6 月間, 即公開收購案宣布後, 就一口氣被轉換了 7909 張、占全部籌碼近 8 成。以轉換價 77.7 元計算, 這批近 8 千張可轉債, 約轉換為 1 萬張普通股, 當時樂陞股價約在 100 至 110 元間, 意即這批可轉債約可變現 10.5 億元。發行時認購可轉債的投資人, 背後資金流向為何? 為什麼這批可轉債「不偏不倚」, 剛好在百尺竿頭宣布公開收購後, 就被大量轉換? 這些問題, 有待檢調查明真相。","[['暨樂升董事長許金龍', '擬', '傳喚獨董陳文茜'], ['昨', '釐清', '案情'], ['來', '釐清', '案情'], ['獨董', '竟是', '關鍵人物'], ['檢單位', '查', '個清楚'], ['以下', '是', '今週刊點四大疑點'], ['這一路', '轉換', '地址'], ['轉換過程', '簡稱', '動遊'], ['動遊', '是', '第三大股東'], ['目前地址', '設在', '20樓'], ['百尺竿頭', '位於', '內湖區地址'], ['動遊背景', '值得', '玩味'], ['該公司代表人', '名叫', '謝啓耀'], ['他', '製造', '建遊戲'], ['所', '製造', '建遊戲'], ['有人', '質疑', '動遊具有中資色彩'], ['動遊', '具有', '中資色彩'], ['該公司負責人', '是', '日本人'], ['百尺竿頭創辦人', '是', '黃文鴻'], ['此位黃文鴻', '擔任', '董事長'], ['新董事長', '有', '充分準備'], ['這', '是', '黃文鴻始料未及'], ['檢調查明', '違約', '交割'], ['營運體質', '也有', '轉變'], ['2年間增幅', '增加到', '46.2億元'], ['向動作', '值得', '注意'], ['這個金額', '就是', '全部營收'], ['規模', '算', '小'], ['投資人', '問', '母公司調度多資金'], ['母公司', '調度', '多資金'], ['樂升', '可轉債', '樂升四'], ['一口氣', '轉換', '7909張'], ['樂升股價', '在', '元間'], ['約', '可變現', '10.5億元'], ['發行時', '認購', '可轉債']]"
0,20160909_423,台股盤中─突破後的真拉回 大盤跳水大跌百點示警台北股市 9 月 9 日集中市場出現盤中加權股價指數大跌超過 100 點的走勢，大盤跌幅超過 1.1%，盤中最低點指數為 9 點 50 分出現的 9142.13 點，證券、期貨分析師及會計師的張陳浩指出，在目前台北股市出現多重已由如選擇權、指數期貨等衍生性金融高品顯示出不利的因素之下，投資人現階段仍宜謹慎應對此一大盤格局。張陳浩指出，就台北股市的走勢上來看，投資人持股比重不宜超過 60%。台北股市集中市場加權股價指數 9 日上午開盤以 9217.37 點開出，這也是今天盤中的最高點，最低點為 9142.13 點，盤中台北股市的走勢極為弱勢，大盤跌幅並已超過 1%；國泰證阿顧問處協理簡伯儀指出，今天台北股市跳空下跌的走勢，已回補了 9 月 7 日跳空上漲的缺口，但實則大盤已跌破 5 日均線，透露出台股在突破高點並衝高到 9278.88 點之後的修正。目前大盤在觀察短期均線的支撐力道。張陳浩指出，目前台北的股、匯市相偕走弱，且亞洲區域股市走弱，使台北股市陷入對於世界資金瘋狗浪可能撤出的疑慮中，且技術線型上來看，台股也呈現乖離過大的不利點，但預料台股在修正後仍有上攻的可能，唯投資人現階段的持股比重不宜超過 60%。台北股市今天 8 大類股全數走弱，預計全場成交值為 706 億元，股王大立光 () 走低，台積電 () 股價下跌，也使電子股指數下跌 1.05%，更甚於大盤跌幅。,"[['集中市場', '出現', '大跌超過100點走勢'], ['大跌', '超過', '100點'], ['大跌', '超過', '100點'], ['大盤跌幅', '超過', '1.1%'], ['證券', '爲', '9142.13點'], ['金融高品', '顯示', '不利'], ['金融高品', '顯示', '不利'], ['投資人', '應對', '一大盤格局'], ['張陳浩', '指出', '持股比重超過'], ['這', '也是', '今天盤中最高點'], ['最低點', '爲', '9142.13點'], ['阿顧問處協理簡伯儀', '指出', '大盤跌破5日均線'], ['下跌走勢', '補', '跳空上漲缺口'], ['大盤', '跌破', '5日均線'], ['在', '突破', '高點'], ['大盤', '觀察', '短期均線'], ['在', '觀察', '短期均線'], ['張陳浩', '指出', '預料臺股有上可能'], ['預料臺股', '有', '上可能'], ['預料臺股有上可能', '上', '攻'], ['成交值', '爲', '706億元']]"
0,20160909_424,台股跌百點摔破9200點 反向ETF爆量上漲受昨天歐洲央行會議政策出乎市場意外未延長實施 QE 時間，市場擔心全球央行 QE 政策執行的空間有限，流動性的挹注將縮減，台股今日跳空開低，盤中跌超過百點，摔破 9200 點。重挫之際，卻有一個族群強強滾，今天台股反向 ETF 皆出現爆量上漲，其中，元大台灣 50 反 1、國泰台灣加權反 1 皆漲逾 1%。國泰投信 ETF 團隊經理人蘇鼎宇指出，昨天歐洲央行會議政策除了未調降利率之外，亦出乎市場意料未延長實施 QE 時間，主因是紓解主權債券源不足問題，從 6/8 開始買進企業債以來，今年歐洲央行 8 月僅購買約 605 億，主權債購買量近期出現逐漸縮減的情況，顯示 ECB 的 QE 政策出現了券源不足的問題。蘇鼎宇進一步表示，加上今年 G20 會議，各國央行皆表示應提升財政振興經濟政策，不再進行貨幣競貶競爭，顯示全球央行貨幣政策幾乎不太有空間可運作，全球的流動性也快見頂，從今年來獲得外資大量買超的台股、韓股今天開盤皆出現明顯下跌可得到驗證，未來台股恐將進行一波修正走勢。 今日台股反向 ETF 皆出現爆量上漲，國泰臺灣加權反 1(00664R) 開盤後即突破 2 萬張，交投熱絡，量能創歷史新高。蘇鼎宇表示，根據過去經驗來看，2012 年 3 月至 2015 年 9 月，發生四次貶值，台股出現資金退潮時，台灣跌幅均高於連結權值股的台灣 50 跌幅，顯示整體台股相對較弱，權值股則相對抗跌。換句話說，對於投資反向型 ETF 的投資人來說，選擇連結臺灣的反向 ETF，報酬率將相對較高。,"[['臺股跌百點', '摔破', '9200點'], ['政策', '受', '歐洲央行會議'], ['市場', '擔心', '有限'], ['ETF', '出現', '爆量上漲'], ['團隊經理人蘇鼎宇', '指出', '歐洲央行會議政策出乎市場意料延長實施'], ['未', '調降', '利率'], ['歐洲央行會議政策', '出乎', '市場意料延長實施'], ['市場意料', '延長', '實施'], ['主因', '是', '紓解不足問題'], ['主權債購買量', '出現', '縮減情況'], ['QE政策', '出現', '不足問題'], ['蘇鼎宇', '表示', '各國央行表示提升經濟政策'], ['各國央行', '表示', '提升經濟政策'], ['全球央行貨幣政策', '有', '空間運作'], ['大量', '買', '外資'], ['開盤', '出現', '下跌'], ['臺股', '進行', '修正走勢'], ['ETF', '出現', '上漲'], ['量', '創', '歷史新高'], ['蘇鼎宇', '表示', '發生四次貶值'], ['臺股', '出現', '資金退潮'], ['臺股', '出現', '資金退潮'], ['臺灣跌幅', '高於', '50跌幅'], ['臺灣跌幅高於50跌幅', '連結', '權值股'], ['權值股', '抗', '跌'], ['，', '選擇', '連結臺灣反向']]"
0,20160909_425,中光電8月營收月增5% 9月影像產品出貨量及單價齊揚中光電 ()8 月合併營收 49.84 億元，較 7 月 47.63 億元成長 5%，累計前 8 月合併營收 372.16 億元，較去年同期下滑約 16%；展望 9 月，影像產品在新產品持續量產及季底效應帶動下，出貨量將大幅增加，平均出貨單價也將持續上升。中光電指出，影像產品 8 月因新產品量產效應，整體出貨量約 10.5 萬多台，合併營收約 15.25 億元，分別較 7 月成長 10% 及 16%，月平均出貨單價上升 5%。累計前 8 月影像產品出貨量達 75.7 萬台，合併營收約 103 億元，分別較去年同期增加 4% 及 6%。展望 9 月，中光電影像產品事業群總經理陳士元預估，在新產品持續量產及季底效應帶動下，出貨量將大幅增加，平均出貨單價也將持續上升，陳士元同時表示，新一代 1080P 全高清高亮度超短焦激光投影方案，已在 8 月正式量產，且獲大陸影音娛樂領導者 - 火樂科技採用於其首款激光電視『堅果 S1』產品中。陳士元指出，『堅果 S1』內建雙聲道立體環繞音響、高亮度、超短焦、全新的工業設計和海量的電影、電視劇和綜藝娛樂等內容，將突破傳統投影機家庭劇院與大尺吋平面電視的競爭態勢。陳士元強調，中光電將與事業夥伴們各擅所長，擴大合作綜效，共同推廣智能家庭劇院走入一般家戶，並持續引領新的智能家庭影院生態圈成長茁壯。中光電 8 月節能產品合併營收 29.03 億元，與 7 月相當，其中背光模組營收約 12.53 億元，月增 1%；ODM 及系統解決方案產品等營收則持平約 16.50 億元；整體節能產品出貨量約 531 萬片 / 台，較 7 月成長 5%，累計前 8 月節能產品營收約 228.49 億元，出貨量達 3756 萬片 / 台，分別較去年同期衰退 20% 及 24%。中光電節能產品事業群總經理林惠姿預估，9 月節能產品合併出貨量持平，今年第 3 季則將維持先前法說會預期，在 ODM 及系統解決方案帶動下，整體營運呈現成長走勢。中光電積極跳脫只是背光板廠的傳統經營模式，轉型朝創新顯示系統整合方案的提供者方向努力，8 月底首度攜手集團子公司揚昇照明參展 Touch Taiwan 2016，首度呈現以自主技術研發先進的顯示元件及創新服務思維，特別在「商業顯示專區」展出 55 吋超窄邊框電視牆顯示器、27 吋廣視角的高階系統顯示器、10.1 吋可切換式防窺顯示器及一系列超薄、高動態、高亮度、醫療級與工業用等高端顯示應用產品解決方案。中光電指出，完整的平面顯示解決方案，將可廣泛應用在零售、博弈、娛樂、教育、電子媒體看板、自動櫃員機、醫療等市場領域，搶攻不同領域、不同使用需求環境客戶。林惠姿表示，因應品牌廠商、系統整合廠及面板客戶多元需求，將提供客戶從零組件至半系統 / 系統化的產品設計開發、一條龍服務方案、及全球售後服務。未來，將持續投入商用、教育、博弈、運輸、醫療等應用市場，針對客戶對於各種領域或環境的需求，提供多元的解決方案，創造高附加價值的商機。,"[['像產品出貨量', '達', '75.7萬臺'], ['中光電影像產品事業羣總經理陳士元', '預估', '出貨量增加'], ['火樂科技', '採用於', '堅果S1產品中'], ['陳士元', '指出', '堅果S1建等環繞內容突破競爭態勢'], ['堅果S1', '建', '等環繞內容'], ['雙聲道', '環繞', '音響'], ['立體', '環繞', '音響'], ['堅果S1建等環繞內容', '突破', '競爭態勢'], ['陳士元', '強調', '中光電擅所長'], ['中光電', '擅', '所長'], ['智能家庭劇院', '走入', '一般家戶'], ['產品事業羣總經理林惠姿', '預估', '節能產品合併出貨量持平'], ['整體營運', '呈現', '成長走勢'], ['中光電', '跳', '脫'], ['中光電跳脫', '只是', '經營模式'], ['林惠姿', '表示', '提供產品設計開發']]"
0,20160909_426,益得生技取得高科技核准函 將依相關程序申請股票上櫃益得生技 () 表示，獲櫃買中心函文通知，已取得經濟部工業局高科技事業核准，將依相關程序申請股票上櫃。而慢性肺阻塞新劑型新藥 SYN007，預計 2017 年申請臨床一期試驗。益得生技表示，公司持續加速各項產品開發計畫，除主攻輕重度氣喘的系列產品 SYN006、SYN010、Duasma、Synvent、Synflutide 外，並鎖定治療慢性肺阻塞 (COPD) 所開發的新劑型新藥 SYN007，已完成安定性試驗及處方開發，並計劃近期進行試驗藥物生產，預計 2017 年申請臨床一期試驗，為 MDI 新劑型新藥。益得生技指出，慢性肺阻塞乃是因慢性發炎所引起的呼吸道阻塞疾病，若未妥善控制，會造成呼吸道阻塞、肺功能惡化，嚴重者甚至呼吸衰竭而致死，影響病患的工作能力與生活品質甚鉅。根據 WHO 資料指出，全球至少有 6500 萬名 COPD 病患，為前五大致死病因，預計 2030 年前將攀升成為前三大致死病因。益得生技開發之 SYN007 屬於長效抗膽鹼藥物 (成分為 tiotropium)，擴張支氣管之效果良好，為治療 COPD 的主流藥物，全球每年銷售量約達 8000 萬支，銷售金額約 50 億美元，益得生技掌握 iLEF 技術平台，能有效控制粒徑大小且利於傳輸吸收，此產品提供患者不喜使用乾粉劑型的選擇，並可同時改善心血管副作用的優勢，未來規劃循美國 505(b)(2) 規定申請藥證。,"[['益得生技', '取得', '覈准函'], ['相關程序', '申請', '股票'], ['申請股票上櫃益得生技)', '表示', '獲櫃買中心函文通知'], ['新劑型新藥SYN007', '預計', '申請一期試驗'], ['益得生技', '表示', '公司加速各項產品開發計劃'], ['公司', '加速', '各項產品開發計劃'], ['益得生技', '指出', '慢性肺阻塞乃是阻塞疾病'], ['慢性肺阻塞', '乃是', '阻塞疾病'], ['全球', '有', '6500萬名COPD病患'], ['益得生技開發SYN007', '屬於', '長效抗膽鹼藥物'], ['成分', '爲', 'tiotropium'], ['每年銷售量', '達', '8000萬支'], ['益得生技', '控制', '粒徑大小']]"
0,20160909_427,樂陞除權息啟動庫藏股早盤大漲逼近漲停記者許家禎／台北報導 百尺竿頭收購樂陞破局，樂陞股價腰斬，昨日雖連續開出第 7 根跌停板，但隨後買盤進場，跌停打開拉上漲停板。而今（9）日樂陞進行除權息，並正式啟動庫藏股，預定買回 6250 張，買回區間為 45 到 130 元，使今日以 41 元開出，9 點 50 分左右，漲近 3.9 元，來到 44.5 元左右，逼近漲停。樂陞昨（8）日在臨時董事會後召開記者會，還原百尺竿頭收購過程，澄清公司與獨董們審議其公開收購案，不僅依法履踐法令要求之程序，且確實告知股東要參考應賣可能發生的風險，自行決定是否參與應賣。而原擬告發中信銀及百尺竿頭一事，樂陞表示因董事及獨董們考量由公司對其提起告訴，訴訟時間可能更漫長，由於金管會已經主動向北檢告發，為能盡快讓投資人爭取到該有的權益及賠償，因此公司方面將不另發起告訴動作，會協助及配合檢調之調查，釐清案情，為投資人爭取時效，向日商進行求償的各項動作，公司也願意全力配合投資人提供必要之協助。至於針對董座許金龍轉列被告，樂陞表示許金龍與數千名股東均為受害者，相信法律會還給他清白，並展現司法公平正義，釐清案情，為股東們爭取該有的權益及賠償。樂陞也說，集團各公司的營運，並沒有受到此次案件風波影響。與客戶開發的新產品將於今年 11 月 29 日發行，下周登場的東京電玩展也會秀出 PlayStation VR 產品。 『新聞來源／NOWnews 』,"[['買回區間', '爲', '45'], ['樂升昨', '召開', '記者會'], ['澄清公司', '審議', '公開收購案'], ['公司方面', '發起', '動作'], ['公司', '願意', '配合投資人'], ['樂升表示許金龍', '均爲', '受害者'], ['樂升', '說', '各公司營運受到此次案件風波影響'], ['各公司營運', '受到', '此次案件風波影響'], ['登場東京電玩展', '秀', 'PlayStation VR產品']]"
