,News,All,SVO
0,20161118_1724,培植新生代影視創作人才 中華電微電影創作大賽百萬首獎出爐中華電 ()、台北市電影委員會、愛爾達電視攜手，培植新生代影視創作人才，MOD 微電影暨金片子創作大賽吸引 344 個劇組報名角逐，今 (18) 日公布百萬首獎得主，由 15 分鐘長度的社會組《冥王星圖》摘下，另外，「中華電信合作獎」的百萬大獎由 3 分鐘長度的金片子組的《咖啡蛋》獲得。中華電指出， 2016「MOD 微電影暨金片子創作大賽」以發掘更多的傑出影視創作人才為主要目的，今年共吸引 344 個劇組報名角逐，可說是國內規模最大、總獎金最多的微電影競賽。中華電執行副總謝繼茂表示，隨著數位科技及新媒體載具的普及，數位內容的開創需要更多影視製作人才的投入，中華電信擔任培植新生代影視創作者的領頭羊，除支持在地原創影視外，將以完善的平台資源，提供影視創作者優質的創作舞台，藉以提升整體影視產業競爭力。中華電指出，經過兩個多月的評選，從 344 部參賽作品中，選拔出 39 件入圍作品，其中包含百萬首獎、中華電信合作獎、各組優選、佳作，最佳男、女演員、最佳劇本等 3 項個人獎，及為 18 歲以下與高中職學生特設的最佳潛力獎。獲得百萬首獎的短片為社會組的《冥王星圖》；中華電信合作獎由金片子組的《咖啡蛋》獲得；愛爾達劇本合作獎由《電梯上樓》拿下，因作品本身留有劇情想像空間與延展性，因此獲得愛爾達青睞，將與得獎團隊簽訂 60 萬的合約，將《電梯上樓》延伸成 5 集的短篇電視劇。,"[['中華電信合作獎百萬獲得', '培植', '創作人才'], ['MOD微電影大賽', '吸引', '個劇組報名角逐'], ['2016MOD', '吸引', '爲主要目的'], ['中華電執行副總謝繼茂', '表示', '數位內容開創需要製作人才投入'], ['數位內容開創', '需要', '製作人才投入'], ['中華電信', '擔任', '培植影視創作者領頭羊'], ['地', '原創', '影視'], ['》', '獲得', '百萬首獎'], ['獲得百萬首獎短片', '爲', '社會組冥王星圖']]"
0,20161118_1725,"元大期貨台股期指盤後－蘋概股領軍上漲 台期指延續反彈◆盤勢分析週四美國 NASDAQ 與指數分別上漲 0.7% 與 1.1%，川普入主白宮後科技股的跌勢似乎已經止穩，週五以小漲 19 點開出後，市場信心仍然不足，於 9:15 左右跌落至 8926 點的低點，不過電子股連續 2 日扮演中流砥柱的角色，引領指數震盪向上，終場上漲 27 點，以 8987 點作收。各大期指中，蘋概股延續反彈氣勢，股王大立光大漲 4.32%，可成、和碩的漲幅亦超過 2%，帶動電子期上漲 0.61%，表現最為強勢；金融股則延續前一天的回檔，富邦金下跌逾 1%，金融期收跌 0.41%；傳產族群仍是漲跌互見，塑膠、鋼鐵等原物料類股呈現下跌，運輸類股則表現較為強勢，非金電期震盪收平。另外，觀察現貨逆價差由 35 點下降至 22 點，舊制選擇權波動率指數則由 14.40 降至 13.71，顯示市場避險情緒有所緩和。從籌碼面觀察，三大法人合計賣超現貨 49.4 億元，其中外資賣超 61.3 億元，自營商則是買超 7.6 億元；而由留倉淨部位來看，外資加碼淨多單 2,849 口至 65,880 口，自營商則減碼淨多單 712 口至 227 口，三大法人合計淨多單增加 3,037 口至 21,482 口；外資現貨部位仍持續賣超。週五以十字形的小紅 K 棒作收，一度攻上 9000 點關卡，由於先前領跌的電子股已有利空出盡的跡象，盤勢已初步止穩。","[['領軍上漲', '臺期指', '反彈'], ['市場信心', '不足於', '9'], ['電子股', '扮演', '中流砥柱角色'], ['蘋概股', '延續', '反彈氣勢'], ['股王', '大立光大漲', '4.32%'], ['金融股', '富邦金下跌逾', '1%'], ['舊制選擇權波動率指數', '降至', '13.71'], ['其中外資賣', '超', ' 億元'], ['由', '留', '倉淨'], ['3口', '至', '21'], ['現貨部位', '賣', '超']]"
0,20161118_1726,台灣大認購140萬度綠電 11家品牌廠響應捐綠能基金氣候變遷議題持續升溫，台灣大 () 去年首開國內電信業者先例，推出「你買手機我捐一元，一塊推動綠能源」活動，認購 100 萬度綠色電力，興建 8 座綠能基站；今年加碼認購 140 萬度綠電，同時擴大號召 11 家品牌手機供應商參與，消費者在台灣大買手機或平板，廠商就捐 2 元綠能基金。台灣大擴大推動綠能倡議活動，總經理鄭俊卿今 (18) 日正式發表今年的計劃主軸「台灣大綠能、永續大未來」，同時進行 30 秒形象影片全球首播；他表示，今年 11 月 4 日是《巴黎協定》生效的第一天，這是人類應對氣候變遷所邁出最關鍵的一步。鄭俊卿指出，資通訊產業隨 4G 佈建和雲端服務需求增加，電力需求也不斷攀升，面對全球暖化對環境與營運的衝擊，台灣大除落實節能減碳策略，要求朝絕對減量目標邁進之外，更負起推動綠能的責任。他強調，今年除向經濟部認購 140 萬度綠色電力，是台灣前十大綠電認購企業之外，更擴大增建風能及太陽能發電的綠能基地台，建置綠電容量為去年兩倍達 52KW，滿載發電時可百分百供應基地台，預計 2020 年達成總建置綠電容量 200KW 的目標。台灣大表示，推動綠色能源和綠色採購，除以身作則外，也力邀供應商加入綠能倡議行列，獲得 ACER、Asus、Benton、HTC、Huawei、Hugiga(鴻基國際)、LG、OPPO、Samsung、Sony、ZTE(台灣大自有品牌 Amazing 供應商) 等 11 家品牌手機廠商響應，較去年的 8 家廠商獲得更大的迴響，即日起消費者透過台灣大通路，凡購買合作品牌任一款手機 / 平板，廠商就捐出 2 元購買綠色能源。台灣大指出，「台灣大綠能永續大未來」宣傳計劃投資數百萬，攝製團隊上山下海收錄台灣各地的美景，邀請大家一起珍愛大地， 今日的綠能計劃發表會，台灣網壇女雙詹詠然、詹皓晴姊妹再度擔任綠能倡議大使。,"[['臺灣', '首開', '電信業者先例'], ['你', '買', '手機'], ['我', '捐', '一元'], ['我', '捐', '一元'], ['消費者', '大買', '手機'], ['廠商', '捐', '2元綠能基金'], ['臺灣', '擴大', '推動綠能倡議活動'], ['他', '表示', '11月4日是巴黎協定生效第一天'], ['11月4日', '是', '巴黎協定生效第一天'], ['這', '是', '關鍵一步'], ['鄭俊卿', '指出', '資通訊產業增加'], ['臺灣', '負', '推動綠能責任'], ['起', '推動', '綠能'], ['他', '強調', '是認購企業之外'], ['去年兩倍', '達', '52KW'], ['總', '建置', '200KW電容量'], ['臺灣', '大表示', '力邀'], ['日起消費者', '透過', '臺灣大通路'], ['廠商', '捐出', '2元'], ['臺灣', '大指出', '宣傳計劃投資'], ['雙詹詠然', '擔任', '倡議大使']]"
0,20161118_1727,外資回頭！大立光今獲三大法人同步買超 收盤狂漲4.32%台北股市集中市場加權股價 18 日指數站穩 9000 點以 9008.79 點作收，而股王大立光 () 在蘋果供應鏈表現最兇悍，並以大漲 4.32% 作收，而盤後資料顯示，大立光獲三大法人的同步買超，而外資也是至少 1 個月以來首度買超。而以今天三大法人買超大立光合計達 126 張，外資買超 96 張、投信買超 25 張，而自營商買超 5 張，外資最主要的進出券商為美林、瑞士信貸及香港上海匯豐，為至少近 1 個月來外資的買超，而以三大法人合計，也屬近 15 個交易日以來首度出現買超。近期以來包括台積電 () 及大型 EMS 廠鴻海 () 都是連日來官股行庫用以維持盤面動態穩定的重要權值個股，今天大立光則在早盤的走貶格局之下，成為另一熱門標的，收盤報 3500 元，較昨日上漲 145 元或 4.32%，成交量放大到 663 張，成交值 24.41 億元，居台股成交作第 3 位。證券、期貨分析師及會計師張陳浩對此表示，在美國總統大選結果由川普當選，其主張的「美國製造」一度造成美商蘋果股價的受挫，目前蘋果股價已經走穩，主要在於川普目前已在對於其選前的言論進行局部的修正，也使蘋果概念股鬆了一口氣；同時，也使包括大立光、台積電及鴻海成為今天盤面的重心。由 2016 年下半年以來的匯率走勢來看，兌美元匯率由 6 月 30 日的 1 美元兌 32.2 元一直升值到 9 月 30 日的 1 美元兌 31.3 元，導致多數外銷科技類股提到匯兌損失，大立光在第 3 季認列高達 4.3 億元的匯兌損失；的走貶中，將有助於匯兌損失的回沖。在外資連續對於台積電等大型權值近期持續出現賣超匯出資金同時，連動造成匯率等走貶，目前看來有助於外銷廠商在第 3 季認列高額匯兌損失的回沖，但國泰證期顧問處協理簡伯儀說，目前仍屬於第 4 季的期中，實際的回沖狀況仍必須待季底的匯率及評價而定。而就大立光的基本面來看，大立光 2016 年第 3 季雖受匯率走勢不利，第 3 季認列的匯兌損失高達 4.3 億元，但毛利率仍以 67.96% 改寫新高，累計 1-3 季淨利為 142.73 億元，每股稅後盈餘為 106.41 元。股王大立光在 2016 年第 3 季的毛利率 67.96%，也較 2015 年第 3 季毛利率 55.1% 大幅提高達 12.86 個百分點。同時，在手機產業的下半年旺季效應及雙鏡頭機種需求量大幅提高之下，大立光 10 月的營收 50.73 億元創下 11 個月來新高，大立光目前訂單在高階產品需求仍然極高，11 月營收將維持 10 月水準。,"[['大立光', '獲', '三大法人買超'], ['三大法人', '買', '超'], ['盤後資料', '顯示', '大立光獲超'], ['大立光', '獲', '超'], ['外資', '買', '超'], ['外資', '三大法人買超大立光合計達', '126張'], ['自營商', '買超', '5張'], ['進出券商', '爲', '美林瑞士信貸'], ['個月', '來', '外資'], ['大立光', '成爲', '收盤報3500'], ['會計師張陳浩', '表示', '美國製造造成蘋果股價受挫'], ['美國製造', '造成', '蘋果股價受挫'], ['川普', '進行', '局部修正'], ['兌美元匯率', '美元兌', '32.2元'], ['外銷科技類股', '提到', '匯兌損失'], ['大型權值', '出現', '賣超匯出資金'], ['持續', '出現', '賣超匯出資金'], ['連動', '造成', '等匯率走'], ['連動造成等匯率走', '有助於', '回沖'], ['國泰證期顧問處協理簡伯儀', '說', '定'], ['實際回沖狀況', '待', '季底匯率'], ['年第3季', '受', '不利'], ['季認列匯兌損失', '高達', '4.3億元'], ['1-3季淨利', '爲', '142.73億元'], ['稅後盈餘', '爲', '106.41 元'], ['營收', '維持', '10月水準']]"
0,20161118_1728,立院通過樂陞條款 收購股票須備財力證明日商百尺竿頭收購樂陞科技股票，付不出錢導致違約交割，樂陞投資人損失慘重。立法院院會今天三讀通過修正證券交易法第四十三條之一，規定公開收購公開發行公司股票，必須提出具收購對價能力的財力證明。這項修法也被外界視為是「樂陞條款」。提案修法的立委賴士葆表示，金管會雖然已經修正公開收購管理辦法，但法律條文比行政命令更具約束力，以確保股份交易能確實執行。,"[['付出錢', '導致', '違約交割'], ['必須', '提出具', '對價能力'], ['這項修法', '視爲', '是樂升條款'], ['提案修法立委賴士葆', '表示', '法律條文更具約束力'], ['法律條文', '更具', '約束力'], ['法律條文', '更具以', '確保股份交易執行']]"
0,20161118_1729,中信金賠償金樂陞登記求償者每人約得1.3萬投資人保護中心受理樂陞受害投資人登記求償作業，目前是第二波登記期，也開放撤回求償委託。這幾天下來投保中心已收了兩百多件委託求償登記，但也有零星幾個投資人撤回。投保中心受理樂陞案登記求償的投資人占全案受害者的 95%，以中信金賠償的 5 億元來估算，平均每個投資人應可獲 1 萬 3 千元左右的賠償金。（張佳琪報導）投資人保護中心先前受理樂陞案受害投資人登記求償，並與中信金達成協議，中信金先賠 5 億元。樂陞自救會對於這筆賠償金不是太滿意，投保中心為了儘速把金額發放下去，開放第二波登記求償作業，也同步讓不滿意的投資人可以撤回委託。這幾天每天約有 80 多件的新登記案申請，也有零星幾件要求退出委託。投保中心副總趙生表示，向投保中心登記求償的投資人約占全案受害投資人的九成五，目前登記人數還在增加，估算中信金 5 億的賠償金，每個求償的投資人可以領到 1 萬 3 千元左右。趙順生說：「初估一個人至少可得 1.31 萬，這是指全部人來分，但不可能全部的人分，因為有加入也有退出委託的」。樂陞案司法審理當中，如果最後又判決須賠償，屆時投資人還是可以再獲得賠償金。投保中心針對樂陞案第二波登記與撤回受理時間，原則上到十一月二十四號為止。（照片：中廣資料照片）,"[['每人', '得', '受害投資人登記作業'], ['投保中心', '收', '兩百多件委託求償登記'], ['中心', '受理', '樂升案登記求償'], ['受理樂升案登記求償中心投資人', '佔', '全案受害者'], ['每個投資人', '估算', '左右獲 1 萬 3 千元賠償金'], ['張佳琪報導投資人保護中心', '受理', '樂升案投資人登記求償'], ['中信金', '賠', '億元5'], ['投保中心', '開放', '第二波'], ['零星幾件要求', '退出', '委託'], ['副總趙生', '表示', '佔受害投資人九成五'], ['求償投資人', '領到', '左右萬'], ['這', '指', '全部人分'], ['投資人', '獲得', '賠償金']]"
0,20161118_1730,電子重新主導盤勢 周線中止連3黑 三大法人賣超49億元美國升息態勢底定，儘管亞幣全部走弱，壓抑台股開低震盪，不過資金開始回流到電子股，傳產類股也健康輪動，終場指數小漲 13.53 點，以 9008.79 點作收。三大法人則是土洋對作，外資續砍 61.28 億元，投信買超 4.35 億元，自營商買超 7.55 億元，合計賣超 49.37 億元。期貨部分，三大法人則是偏多操作，外資加碼多單 2754 口，淨部位多單回升到 65880 口；投信回補空單 900 口，淨部位空單來到 44625 口；自營商減碼多單 776 口，淨部位多單降到 227 口，合計三大法人加碼多單 2878 口，淨部位多單為 21482 口。外資今天延續昨天的買超策略，持續加碼具題材或是漲價效應個股，不過值得注意的是，外資似乎有趁著台股反彈之際，偷偷出脫電子權值股的動作，包括昨天才轉為買超的鴻海，今天又再度轉為賣超，另外外資對於台積電賣超張數也又有擴大跡象，同時金融股也持續遭到外資賣超，僅有玉山金、國票金、國泰金等獲外資買超。ETF 部分，外資今天連續 8 天賣超台灣 50；至於槓桿幅度較大的台灣 50 正 2，外資則是連續 3 天買超。台灣 50 反 1 部分，外資則是又再度轉為賣超。外資集中市場買超第 1 名為中壽，買超張數 6855 張，第 2 名彩晶，買超 6442 張，第 3 名光寶科，買超 6094 張，第 4 名佳世達，買超 4783 張，第 5 名佳世達，買超 4072 張。6 到 10 名依序為，國泰金，買超 3681 張；FB 上証正 2，買超 3221 張；大同，買超 3181 張；國喬，買超 2880 張；兆豐新光 R1，買超 2480 張。外資集中市場賣超第 1 名聯電，賣超張數 12544 張，第 2 名永豐金，賣超張數 12518 張，第 3 名開發金，賣超 11217 張，第 4 名台積電，賣超 9801 張，第 5 名統一，賣超 9202 張。6 到 10 名依序為，友達，賣超 9023 張；群創，賣超 8823 張；中信金，賣超 7785 張；元大金，賣超 6988 張；台新金，賣超 6775 張。法人指出，台股連續 2 天都留下約 50-60 點的下影線，儘管成交值萎縮到 700 億元以下，但是 5 日線已開始有支撐力道出現，基本上，如果指數能夠沿著 5 日線緩步回升，搭配電子股的成交比重能穩定維持在 60-70%，只要能夠先行攻上 11 月 11 日的 9067 點，才有機會繼續朝向收復 9 號的長黑 K 棒挺進。,"[['資金', '開始', '迴流'], ['13.53點', '作', '收'], ['三大法人', '是', '土洋對作'], ['外資', '砍', '投信買超4.35億元'], ['三大法人', '是', '操作'], ['淨部位空單', '來到', '44625口'], ['淨部位', '爲', '21482口'], ['外資', '延續', '昨天買超策略'], ['外資', '脫', '動作'], ['金融股', '遭到', '外資賣超'], ['外資', '賣', '超臺灣'], ['外資', '是', '買超'], ['外資', '轉爲', '賣超'], ['集中市場買', '爲', '中壽'], ['，', '買', '超'], ['名依序', '爲', '國泰金'], ['市場賣', '超', '名聯電'], ['名依序', '爲', '友達'], ['中信金', '賣超', '7785張'], ['臺新金', '賣', '6775張'], ['法人', '指出', '臺股留下50-60點下影線'], ['臺股', '留下', '50-60點下影線'], ['成交值', '萎縮到', '700以下'], ['5日線', '開始', '有支撐力道出現']]"
0,20161118_1731,台達電再啟併購 吃下羽冠電腦100%股權跨足智慧製造台達電 () 併購動作再起，宣布以 3.51 億元吃下電腦整合製造 (CIM) 軟體廠羽冠電腦科技 100% 股權，補足相關核心系統整合能力，加速從零組件向智慧製造整體解決方案方向發展。台達電執行長鄭平表示，物聯網時代來臨，製造業必須邁向智慧化生產以因應市場需求的轉變，而發展智慧製造核心技術和系統，需透過跨領域合作來加速研發腳步，掌握市場先機。鄭平指出，台達電憑藉在電力電子領域累積的自動化、硬體設計製造和軟體開發能力，結合羽冠自動化軟體開發能力、客戶資源，以及在電器電子、光電面板、汽車及零組件、食品及飲料等領域累積的豐富行業知識，不僅將可大幅減少台達電自行開發智慧製造解決方案的時間和成本，更能快速發展工業自動化重要的核心技能、提供完整的智慧自動化產品服務，滿足未來製造的需求。鄭平說，台達電與羽冠整合後，將可進一步拓展工業自動化軟硬體業務，並進入智慧製造市場，羽冠亦能運用台達品牌及在地銷售管道強化在地業務，達到互補綜效。這也是台達電今年以來第 4 起併購案，1 月台達電由子公司 Delta Electronics International(Singapore) Pte.Ltd 取得新加坡工業自動化零組件廠 PBA International Pte.Ltd 股權 19%，預計交易金額為 1276.8 萬元新加坡幣 (約 2.96 億元)。4 月，台達電與 LOYTEC 共同宣布，台達電持股百分之百子公司 Delta Electronics International (Singapore) Pte. Ltd. 以 7200 萬元 (約 26 億元)，取得 Loy Tec electronics GmbH 及 Innocontrol electronics GmbH 兩間公司股權；另外台達電持股百分之百子公司 Delta Electronics (Netherlands) B.V. 也與 Delta Controls Inc. 完成購買契約簽署程序，簽署購買該公司樓宇自動化事業營運資產之合約，總交易金額約為 2.2 億元 (約 55 億元)。,"[['臺達電執行長鄭平', '表示', '製造業邁向智慧化生產'], ['製造業', '邁向', '智慧化生產'], ['製造業', '邁向因', '應市場需求轉變'], ['鄭平', '指出', '臺達電結合軟體開發能力'], ['臺達電', '結合', '軟體開發能力'], ['臺達電', '開發', '智慧'], ['自行', '開發', '智慧'], ['鄭平', '說', '臺達電拓展軟硬體業務'], ['臺達電', '拓展', '軟硬體業務'], ['臺達品牌', '強化在', '業務'], ['這', '也是', '達電取得股權PBA International Pte.Ltd併購案'], ['達電', '取得', '股權PBA International Pte.Ltd'], ['交易金額', '爲', '1276.8 萬元新加坡幣'], ['臺達電', '宣佈', '取得Innocontrol electronics GmbH兩間公司股權'], ['完成簽署程序', '購買', '契約'], ['交易金額', '爲', '2.2億元']]"
0,20161118_1732,談長照2.0財源  林全：起步必須做得好並往前推動關心「長照十年計畫 2.0－社區整體照顧模式 ABC」推動情況，行政院長林全今 (18) 日表示，政府務實推動長照社區整體照顧模式，因此在今年編列兩百億預算先行試辦，希望將基礎慢慢打穩，再進一步推廣到全國。政府也希望讓社會大眾瞭解長照服務的目的、長照對社會安定是有幫助的。只要長照服務的工作在一開始就做對，就能進一步往前推動。行政院長林全前往南投縣參訪當地「社區整合型服務中心 (A 級)」、「複合型日間服務中心 (B 級)」、「巷弄長照站 (C 級)」時表示，長照推動過程最大的挑戰是財源問題，行政院會於今 (105) 年 10 月 6 日通過「長期照顧服務法」部分條文修正草案，將調增遺產及贈與稅、菸酒稅菸品應徵稅額，作為長照特種基金的財源。行政院長林全進一步指出，在遺產稅及贈與稅部分，稅率由現行 10％以累進方式增加至 15% 及 20% 兩個級距；遺產稅及贈與稅通常是高所得者過世之後，就其所遺留財產進行課稅，用以做為長照財源，也是一種社會貢獻。行政院長林全指出，菸稅雖有爭議，但世界各國都將菸稅訂的相當高，我國還有一些差距。這 2 項財源錢雖有限，但在起步若做得好，政府會再尋找其他的稅源進一步推廣，至於未來是否推動長照保險制，也可再進行檢討。   行政院長林全強調，任何制度都沒有百分之百完美，台灣的健保制度被認為以最少的錢提供最好的服務，已做到全世界名列前茅。希望我國的長照制度與全世界相比，儘量做到最好，以最少的經費提供最大的服務，衛福部需要負擔健保與長照制度，目標是 2 項制度一起成功往前走。行政院長林全說明，「長照十年計畫 2.0」是蔡總統的主要政見，台灣過去並未系統性推動長照，尤其在非都市地區，許多老年人在家裡缺乏照顧，已成為嚴重社會問題。過去長照無法全面推動的主因，包括經費不足或相關服務體系與產業無法完整化。為了突破這些問題，政府在第一階段選定 6 個縣市共 9 個據點先行試辦，希望把各種服務項目標準化及規格化，並訂出給付標準，未來公告後就可讓民間一起參與。,"[['政府', '推動', '照顧模式'], ['政府', '希望', '讓是有幫助的'], ['讓', '是', '有幫助的'], ['最大挑戰', '是', '財源問題'], ['行政院長林全', '指出', '稅率增加'], ['稅率', '增加至', '兩個級距'], ['遺產稅', '是', '進行課稅'], ['遺產稅是進行課稅', '也是', '社會貢獻'], ['行政院長林全', '指出', '我國還有一些差距'], ['煙稅', '有', '爭議'], ['我國', '還有', '一些差距'], ['政府', '尋找', '其他稅源'], ['行政院長林全', '強調', '任何制度沒有完美'], ['任何制度', '沒有', '完美'], ['健保制度', '認爲', '提供最好服務'], ['目標', '是', '往前走'], ['行政院長林全', '說明', '十年計劃2.0是主要政見'], ['十年計劃2.0', '是', '主要政見'], ['許多老年人', '缺乏', '照顧'], ['許多老年人缺乏照顧', '成爲', '嚴重社會問題'], ['長照推動主因', '包括', '不足']]"
