,News,All,SVO
0,20170424_1076,〈台積股東報告書〉2020年前IC製造成長優半導體平均 今年通訊應用維持成長晶圓代工龍頭台積電 () 致股東會致股東報告書出爐，預估今年半導體產業產值將較去年成長 4%，電子產品採用的半導體元件比率持續提升，IC 設計公司也會增加市占率，整合元件製造廠委外比例也成長，預估至 2020 年前，IC 製造業成長率將比整體半導體業 3% 高；應用來看，台積電仍看好通訊市場，預期可較去年有中個位數的成長幅度。台積電訂 6 月 8 日舉行股東常會，每年股東會致股東報告書，是股東們除了法說會之外，一窺台積電今年發展計畫的重要方向球，今年照例由董事長張忠謀署名；逢台積電建立 30 周年，今年的股東會年報上，台積電也特別將過去 30 年的重要大事紀錄在股東會年報中，與股東們一起分享 30 年來的成長歷程。張忠謀提到，去年預估全球半導體市場產值約達 3570 億美元，年成長 1%，其中，半導體製造產值約 470 億美元，年成長率為 8%，表現明顯比整體產業平均值好，主要是受全球景氣回升與庫存回補的帶動。在應用部分，張忠謀表示，通訊產業智慧型手機去年出貨量成長 6%，雖然成長力道趨緩，但智慧型手機持續演進至 4G/LTE 及 LTE-Advanced，將推動今年市場仍可持續有中個位數成長幅度，更高效能、更長電池壽命及更多智慧型應用的智慧型手機，將持續吸引消費者興趣；同時，低階智慧型手機在新興市場國家的普及，也會推動市場的成長。電腦產品部分，去年電腦出貨衰退幅度達 6%，預期今年個人電腦市場將呈現中個位數百分比衰退幅度，不過多樣化電腦型態，如變形筆電、超輕薄筆電及低價筆電 Chromebook、以其企業採用 Windows 10 商用換機潮等，預期將有助電腦產品出貨成長需求。消費性電子部分，今年需求將持續減少，延續去年表現，不過電視遊樂器、4K 超高解析度電視及連網數位機上盒 (OTT STB) 將仍有高成長幅度。至於物聯網，受惠愈來愈多裝置可以連網，物聯網正成形成為一個大趨勢，預期至 2025 年時，物聯網裝置數量將比智慧型手機多上 10 倍，受惠物聯網相關技術，包含智慧穿戴、家用機器人、智慧電錶、智慧製造、自動駕駛車等新應用及產品，對電池使用壽命、各種感測器，以及低功耗無線連結上的需求將持續挑戰新技術發展方向。,"[['IC', '製造', ' 電'], ['股東會', '致', '股東'], ['IC 設計公司', '增加', '市佔率'], ['臺積電', '看好', '通訊市場'], ['股東', '致', '報告書'], ['股東們', '一窺臺', '發展計劃'], ['，', '一窺臺', '發展計劃'], ['臺積電', '紀錄在', '股東會年報中'], ['張忠謀', '提到', '預估市場產值達3570 億美元'], ['張忠謀', '表示', '去年出貨量成長'], ['市場', '有', '成長幅度'], ['仍可持續', '有', '成長幅度'], ['在普及', '推動', '市場成長'], ['電腦市場', '呈現', '百分比衰退幅度'], ['以其企業', '採用', 'Windows商用換機潮'], ['(', 'OTT', 'STB'], ['電視遊樂器', '有', '高成長幅度'], ['物聯網成形', '成爲', '一個大趨勢']]"
0,20170424_1077,嘉泥宣布支持台泥國際私有化 預計換股取得20.52萬張台泥股票嘉泥 () 今 (24) 日下午召開重大訊息宣布，與子公司 Chia Hsin Pacific Limited(CHPL)董事會通過台泥國際私有化要約案，考量股東利益最大化，將選擇以 0.42 的換股比例，將所持有的台泥國際股票轉換為台泥 () 新發行股票，合計將可取得 20.52 萬張台泥普通股；嘉泥原本持有約 5.6 萬張台泥，在換股之後將增至 26 萬多張。嘉泥指出，有關台泥與子公司 TCC International Limited(TCCI) 共同以協議計畫 (Scheme of Arrangement) 方式私有化台泥國際的要約案，經董事會決議支持，且支持選擇交換台泥新發行的普通股，換股比例為每 1 股台泥國際普通股可交換 0.42 股台泥新發行普通股。嘉泥指出，嘉泥持有台泥國際 882 萬 9262 股，子公司 CHPL 持有台泥國際 4 億 7984 萬 9250 股，換股後將分別持有台泥股票 37 萬 8290 股及 2 億 153 萬 6685 股，合計為 2 億 524 萬 4975 股 (約 20.52 萬張)；合計現有持股及換股後新增持股，將持有台泥 2 億 6000 多萬股 (約 26 萬張)。嘉泥表示，董事會考量仍看好整體中國水泥產業未來的穩定成長，對台泥國際策略性投資方向不變，這次決議支持台泥國際私有化計畫，除透過換股台泥方式持續參與台泥在中國市場的布局，也可參與未來其他市場及產業的投資，分散對單一市場的投資風險，且改善整體策略性持股的流動性及現金股息的收益率。嘉泥強調，從台泥公告台泥國際私有化計畫以來，3 家公司的股價起伏很大，因此很積極找來財務顧問公司及會計師一起評估這起要約案，且召開臨時董事會儘快做出決定，讓市場也可以穩定下來。嘉泥今日股價開高走高，盤中一度衝達 11.75 元，終場收 11.2 元，漲幅 4.18%；台泥則以 36.25 元作收，漲幅 1.82%。,"[['嘉泥', '宣佈', '支持'], ['股票嘉泥', '召開', '重大訊息'], ['萬張臺泥', '增至', '26萬多張'], ['嘉泥', '指出', '私有化臺泥國際要約案'], ['，', '有關', '臺泥'], ['方式', '私有化', '臺泥'], ['，', '換', '股'], ['換股比例', '發行', '普通股'], ['嘉泥', '指出', '嘉泥持有臺泥'], ['嘉泥', '表示', '看好穩定成長'], ['這次決議', '支持', '臺泥國際私有化計劃'], ['透過', '換', '臺泥'], ['嘉泥', '強調', '找評估這起要約案'], ['一度', '衝達', '11.75元'], ['臺泥', '元作', '收']]"
0,20170424_1078,台積電市占連7年成長 鎖定商機4市場「都準備好了」▲針對今年第 1 季財測，台積電預期第 1 季合併營收將介於 2360 億元到 2390 億元，季減約 8.86% 至 10%，較市場預估的 5% 還要高。（圖／記者許家禎攝，2017.1.12）台積電在年報最新致股東報告書中表示，2016 年在全球半導體產業相對平緩的環境中，台積電營收依然雙位數成長，毛利率及營業利益率也是 20 年來新高紀錄，主要就是台積電致力全面提升生產與營運效率和降低成本的成果，另外技術的領先，對研發投資的資本支出則是台積電市占率持續擴大的主因，台積電 2016 年市占率達 56%，已連續 7 年成長！台積電表示 2016 年全球半導體產值約 3570 億美元，年增 1%，晶圓代工業受惠景氣回升與庫存回補，產值攀升至 470 億美元，年增 8%，預估晶圓代工至 2018 年都可望較整體半導體產業更強。展望今年各應用產品，電腦與消費電子產業將同步衰退，其中電腦產品今年估將衰退中個位數百分點，消費電子估今年出貨衰退 5%。至於通訊產業預估表現最佳，主要原因是持續演進至 4G，將推動市場成長中個位數百分點。不過，台積電看好行動裝置、高效能運算、汽車電子及物聯網 4 個市場將快速成長，客戶需求從以製程技術為中心，變成以產品應用為中心。為掌握未來成長契機，已建構 4 個不同的技術平台，提供客戶最完備且最具競爭優勢的邏輯製程技術、特殊製程技術、矽智財及封裝測試技術，協助客戶加速產品上市速度。 『新聞來源／NOWnews 』,"[['營收將', '介於', '2360億元'], ['致股東報告書中', '表示', '雙位數成長'], ['毛利率', '也是', '20年來新高紀錄'], ['臺積電致力', '提升', '生產'], ['對資本支出', '是', '臺積電市佔率擴大主因'], ['市', '佔率達', '56%'], ['主要原因', '是', '演進'], ['客戶需求', '爲', '中心']]"
0,20170424_1079,綠悅董座完成轉讓7544張持股 市場緊張 股價收跌停BOPA 薄膜廠綠悅 - KY() 董事長王哲夫大舉申讓 7544 張持股引發市場疑慮，儘管該公司是續三年賺逾一個股本的績優生，今 (24) 日仍遭賣盤摜殺至跌停收市。綠悅今天盤後發表聲明指出，此為王哲夫個人財務操作，在今天完成轉讓後，王哲夫仍持有綠悅 36% 股權，是公司第一大股東。綠悅指出，此次股票申讓人「國泰世華商業銀行受託保管啟豐國際有限公司投資專戶」，是王哲夫的個人投資公司，此次申報轉讓 7544 張，約占 5%，屬於個人財務操作，採鉅額逐筆交易，並已於今天全數轉讓完畢，受讓人為長線投資交易對象，不影響股東權益。綠悅指出，該公司目前財務及營運狀況均良好，且中國 BOPA(雙向拉伸尼龍) 薄膜整體市場仍供不應求，公司未來持續提高客製化產品比重與擴增產能的計畫不變，預計今年全年客製化產品 EHA 出貨量可超過 3000 噸，並將於今年第 4 季安裝第三條磁懸浮生產線 (第九線)。法人指出，綠悅此次轉讓持股動向，主要為轉讓 5% 股權給香港的三個投資法人，同時，就綠悅 4 月營收動向來看，將較去年同月的 5.61 億元成長，但該公司目前不對是否能較上月創新高的 7.88 億元成長置評。綠悅 3 月合併營收 7.88 億元，創歷史新高，月成長 2.96%，年成長 42.37%；第 1 季營收 21.52 億元，年成長 43.06%。綠悅去年毛利率達 38.11%，創新高；稅後純益 18.25 億元，也是歷來最佳，年增 16.98%，每股純益 12.95 元，連續三年賺逾一個股本。,"[['董座', '完成', '轉讓'], ['董座', '完成', '轉讓'], ['薄膜廠綠悅董事長王哲夫', '申讓', '7544張持股'], ['該公司', '賺', '績優生'], ['綠悅', '發表', '聲明指出此爲財務操作'], ['聲明', '指出', '此爲財務操作'], ['此', '爲', '財務操作'], ['王哲夫', '持有', '綠悅\xa0股權'], ['綠悅', '指出', '投資專戶'], ['7544張', '佔', '5%'], ['公司', '提高', '客製化產品比重'], ['持續', '提高', '客製化產品比重'], ['EHA出貨量', '超過', '3000噸'], ['法人', '指出', '轉讓持股動向爲轉讓'], ['轉讓持股動向', '爲', '轉讓']]"
0,20170424_1080,倫元投顧-空間時間修正近尾聲，主要在個股調整◆盤勢分析在法國總統初選結果符合市場預期，美股盤前大漲 160 點左右，激勵台股早盤開高來到 9772 點，但因逼近月線 9800 反壓區，加上先前漲多的矽晶圓相關個股重挫，指數今天開高走低以小漲 0.54 點收在 9717 點，成交量為 614 億。短線而言，今天逼近月線反壓稍做震盪很正常，若美股今晚能夠撐住唯持盤前大漲百點的話，則台股明天應有再開高挑戰月線的能力。不過短期仍要在 9500~9700 整理到 5 月中前後、第一季財報利空出盡時，之後在 i8 開始拉貨蘋概股帶動下準備展開主升段千點行情。而未來這 2~3 個星期，就是個股位階的調整，財報很爛或先前超漲股，股價就還有下修空間。王信傑分析師★ 此研究報告著作權屬倫元證券投資顧問 (股) 公司，切勿盜用或翻印，否則追究責任，決不寬貸★ 所有資料僅供參考，本公司不負盈虧責任，洽 02-2321-9933 理財專員,"[['倫元', '投顧', '近尾聲'], ['結果', '符合', '市場預期'], ['臺股早盤', '大漲', '左右點'], ['指數', '收在', '9717點'], ['成交量', '爲', '614'], ['美股', '撐住', '大漲的話'], ['臺股', '開', '挑戰能力'], ['高', '挑戰', '月線'], ['展開主升段行情', '主升段', '千點'], ['個星期', '就是', '個股位階調整'], ['股價', '還有', '下修空間']]"
0,20170424_1081,國巨漲價市場按讚 股價重回百元大關 睽違3年市值衝上500億被動元件春天真的來了，龍頭廠國巨 () 今 (24) 日展現強勁氣勢，午盤過後攻上 100 元大關，盤中最高來到 102 元，也推升市值在 2014 年之後，再度站上 500 億元、來到 521 億元。由於 MLCC 供不應求，加上第 1 季狂升，國巨針對旗下客戶正式發出漲價通知函，第一波調漲先鎖定 MLCC、Chip-R 約 30% 規格的產品品項進行調漲，平均漲幅約 8-10%，遠高於市場預期，法人預估，此次漲價效益，國巨 4 月營收就將開始陸續反應，第 2 季毛利率也可望再走高。就連下游系統廠也在第 1 季就感受到被動元件吃緊的壓力，廠商表示，往年都是系統廠將客戶的降價壓力轉嫁給零組件廠，讓自己的毛利率表現不會因為客戶砍價而受到影響，但是今年供應鏈比較吃緊，只要供需有一點點狀況，價格就可能漲價，變成系統廠要承受零組件廠的漲價壓力。法人指出，由於日系被動元件廠紛紛將產能移往車用市場，使得智慧手機用的被動元件供應陷入吃緊，台系被動元件廠因而有漲價空間。除了本次調漲外，不排除會進行第 2 波調漲。國巨日 K 線圖,"[['巨漲價市場', '按贊', '股價重回百元大關'], ['股價', '重回', '百元大關'], ['衝', '上', '500億被動元件'], ['廠國', '展現', '強勁氣勢'], ['國巨', '發出', '通知函'], ['先鎖定', '進行', '調漲'], ['平均漲幅', '高於', '市場預期'], ['法人', '預估', '國巨月營收開始反應'], ['國巨月營收', '開始', '反應'], ['下游系統廠', '感受到', '喫緊壓力'], ['廠商', '表示', '往年都是系統廠轉嫁'], ['往年', '都是', '系統廠轉嫁'], ['系統廠', '轉嫁給', '零組件廠'], ['系統廠', '承受', '漲價壓力'], ['法人', '指出', '使得'], ['元件廠', '移往', '車用市場']]"
0,20170424_1082,資誠：台灣產業競爭優勢靠創新、科技、人才3大動能資誠今 (24) 日發布 2017 台灣企業領袖調查報告，今年主題為「台灣 2.0：從效率趨動到創新驅動 CEO 的新成長地圖」，面對未來更趨激烈的產業競爭，CEO 們皆認同「創新、科技與人才」3 大動能將是最關鍵的競爭優勢。科技部長陳良基認為，「人工智慧將是台灣產業核心的能力」，產業面對未來發展應盡快導入人工智慧應用，成功率更高，他提醒，若無法善用數位資訊，產業面對全球化挑戰會比較辛苦。創王光電執行長朱克泰在報告中指出，以台灣發展 AMOLED 為例，有 2 個選擇，一個是發展規模經濟，例如投入 1000 億元建廠，追求大量生產與不斷壓低成本，但對岸有 6 個跟你一樣大的規模，資金又可源源不斷挹注，你有什麼機會贏？朱克泰說，他從事顯示器產業近 20 年，現在大家已經在討論如何讓未來手機顯示屏占比達到百分之百，也就是要讓感測器徹底消失，相較於前不久大家才一窩蜂追逐感測器的藍海，但沒想到藍海很快變紅海。因此，他認為台灣產業是時候從「效率驅動」轉向「創新驅動」。他進一步指出，如果今日持續工作 12 小時、明日做 14 小時，希望效率更高，總有一天會碰到一天只有 24 小時的極限 。我們每個人都活在不停創新的時代，因此必須學習如何在創新上不輸人，更要走出單打獨鬥的局勢，換腦思考，不再以自我為中心，而是以打群架的概念，換腦思考，好讓產業在面對共同挑戰下，能夠走出新局。資誠聯合會計師事務所副所長吳德豐表示，當台灣代工業製造優勢逐漸被新興地區取代，或者在供應鏈中面臨強勁競爭者，產業要如何從轉型跨界中找到出路，知識經濟是思考的契機。吳德豐說明，知識經濟發展思維跟製造業不同，打破過去企業各自單打獨鬥的競爭，而是集結國內前端研發不同領域進行創新，如此一來可避免製造業成本競爭惡果，也替台灣企業帶來產業創新的機會。,"[['臺灣產業競爭優勢', '發佈', '臺灣企業領袖調查報告'], ['今年主題', '爲', '2.0臺灣'], ['CEO們', '認同', '大動能是競爭優勢'], ['大動能', '是', '競爭優勢'], ['科技部長陳良基', '認爲', '人工智慧是臺灣產業核心能力'], ['人工智慧', '是', '臺灣產業核心能力'], ['他', '提醒', '辛苦'], ['產業', '面對', '全球化'], ['創王光電執行長朱克泰', '中指出', '有個選擇'], ['一個', '是', '發展規模經濟'], ['對岸', '有', '大規模'], ['你', '有', '什麼機會'], ['朱克泰', '說', '他從事顯示器產業'], ['他', '從事', '顯示器產業'], ['大家', '討論', '讓'], ['大家', '追逐', '感測器藍海'], ['藍海', '變', '紅海'], ['他', '認爲', '臺灣產業轉向創新驅動'], ['臺灣產業', '轉向', '創新驅動'], ['他', '指出', '希望效率更高'], ['我們每個人', '活在', '不停時代'], ['在', '不停', '創新'], ['以', '打', '羣架'], ['在', '面對', '共同挑戰'], ['資誠聯合會計師事務所副所長吳德豐', '表示', '知識經濟是思考契機'], ['知識經濟', '是', '思考契機'], ['吳德豐', '說明', '不同']]"
0,20170424_1083,環球晶：矽晶圓需求穩定向上 12吋報價年底前逐季漲5-10%環球晶 () 今 (24) 日指出，該公司年底前產能滿載，12 吋半導體矽晶圓預期可逐季漲價漲到年底，每季漲幅約 5-10%，也就是說今年報價漲幅可達 4 成；8 吋矽晶圓此次洽談漲幅則達高個位數。隨著矽晶圓漲價，加上併入的 SunEdison 營運逐步轉好，環球晶今年營運獲利可往穩定向上，法人估有機會逐季成長。環球晶指出，去年底至目前，確實有客戶要求與環球晶簽 2 至 4 年長約，以穩定矽晶圓供應來源，不過環球晶只能答應客戶至年底的產能確保無虞。環球晶強調，目前矽晶圓全球月產能約 510-530 萬片，市場需求目前也穩定在此水準，不過半導體產值穩定向上成長，全球矽晶圓沒有擴產的前提下，需求與報價將會持續上漲。其中，以車用、電源管理、記憶體等相關晶圓需求最好，預期今、明年都會不錯，環球晶也樂見有其他廠商與客戶簽長約，代表需求確實超過供給。環球晶認為，未來半導體矽晶圓將會持續成長，今年研調機構預估半導體產值將成長 12%，明年則可成長 4%，對矽晶圓需求預料將持續成長。尤其前幾大半導體晶圓廠持續開出新產能，光此部分就會新增 5-10% 矽晶圓需求，加上中國開出新的半導體廠產能，以及前幾大晶圓廠需求仍強，預期將新增 10-20% 矽晶圓需求，在矽晶圓產能沒有跟上前提下，對報價將形成支撐。在矽晶圓持續漲價帶動下，環球晶營收動能也將同步成長，環球晶看好今年營收動能，費用部分預期可穩定控制，新併入的 SunEdison 改善效率很快就能看到，預料將比過去併入日本公司的速度還快，法人估今年環球晶獲利有機會逐季成長。目前環球晶 12 吋半導體矽晶圓月產能為 75 萬片，8 吋月產能 100 萬片，6 吋以下月產能約 100-120 萬片。,"[['逐季', '漲', '5'], [' 日', '指出', '12吋報價'], ['矽晶圓', '洽談', '漲幅'], ['至產能', '確保', '無虞'], ['環球晶', '強調', '萬片510-530'], ['環球晶', '樂見', '有其他廠商籤長約'], ['代表需求', '超過', '供給'], ['環球晶', '認爲', '矽晶圓成長'], ['半導體產值', '成長', '12%'], ['大半導體晶圓廠', '開出', '新產能'], ['此部分', '新增', '矽晶圓需求'], ['中國', '開出', '半導體廠'], ['預期', '前提', '1020%矽晶圓需求'], ['環球晶', '看好', '營收動能'], ['過去', '併入', '日本公司'], ['法人', '估', '有機會成長']]"
0,20170424_1084,徐照興 台股龍捲風 盤後分析量縮震盪，你暈了嗎？被動元件持續衝出！【盤勢分析】技術分析永遠領先，台股 21 天轉折後向上發展，在 4 月 20 日時壓根不曉得會有【小】的利多，但行情就這樣發生了！可惜今天並不順利，不是開高走高盤！反而分 3 階段：早盤衝高是【利多實踐】，盤中下殺【葉動、風動、人心動】，尾盤又收在平盤！若看不懂，詳情可參考 YOUTUBE【台股龍捲風】！操作不要猜，根據龍捲風操盤術 (簡單、易懂、功夫深)：【一】勢的操作：今日 KD 交叉，指數小漲 0.54 點！而週 KD 持續死亡交叉 (代表大部分股票，沒有波段多的行情)，升值 (外資買 25.32 億元)【二】利的研判：9:30 到 10:00 觀察漲跌家數是否有利今日的勢，今勢與利不同步，故指數震盪漲不動，而上週進場【鋁價概念股】被動元件，今持續有股噴出，主流地位不變，期待與之前的【矽晶圓】、【航運】、2415 錩新、5469 瀚宇博、3217 優群、4739 康普、4721 美琪瑪及 4979 華星光、4974 亞泰、3317 尼克森、2337 旺宏、4943 康控、3673TPK、6435 大中、6442 光聖、3031 佰鴻、6223 旺矽一樣強漲！【後續作法】指數今小漲，產品調漲的族群有風水輪轉的態勢如：【矽晶圓】6488 環球晶、3532 台勝科、6182 合晶，今消息出來股價修正，可觀察支撐區域是否有守！【光學族群】3008 大立光 (+20，持續創歷史新高，持有的人恭喜囉)，3406 玉晶光(+2) 3441 聯一光(+3.15 元漲停板，收 35.05)，3019 亞光(+2.1 元，今低 51.9 收 54.8，)，3362 先進光今平盤(今低 61 收 62，目前被分盤交易)，4976 佳凌(今低 31.15 收 32.35)6209 今國光(+2.95 元收 32.55 漲停板)3428 光耀科(低 66.3 收 68.8) 每天都有飆股，而連日提醒的【被動元件】，今表現較強如：6127 九豪 2327 國巨、2492 華新科、5317 凱美、8080 奧斯特、2478 大毅、6173 信昌電、2472 立隆電，這類族群產品報價翻揚，衝高不追，壓回可留意；而另一次族群 LED 如：2301 光寶、2448 晶電、5230 雷笛克、4956 光鋐、3698 隆達、3031 佰鴻，可留意指標股發動時機！在對的時間作對的事情，才能達到事半功倍之效，目前指數高檔震盪，高出低進的動作務必要有！全新資訊內容都在 FB【台股龍捲風】，或是可收看 Youtube【台股龍捲風】，金雞年新的開始！很不一樣，盤面的波動比起去年大很多，代表看對看錯會差十萬八千里，祝大家操作順利，賺大錢！,"[['小', '漲', '0.54點'], ['而周 KD 持續死亡交叉 ', '代表', '大部分股票'], ['漲跌家數', '有利', '今日勢'], ['產品調漲族羣', '有', '風水輪轉態勢'], ['區域', '有', '守'], ['3019亞光', '收', '35.05'], ['今低', '收', '光今平盤'], ['2301光寶晶電', '留意', '發動時機指標股'], ['指標股', '發動', '時機'], ['對時間', '作', '對'], ['作對事情', '達到', '事半功倍效'], ['資訊內容', '在', '臺股龍捲風']]"
