,News,All,SVO
0,20191225_1100,◆投信連續3日賣超個股投信連續 3 日賣超個股1. 投信連續賣超 3 日的股票(2352) 百和、(9945) 創見、(2449) 奇力新、(2542) 華邦電、(3037) 英業達2. 投信連續賣超 2 日的股票(2352) 佳世達、(9945) 潤泰新、(3037) 欣興、(2449) 京元電子、(2542) 興富發3. 投信當日 (24) 賣超的股票(2352) 佳世達、(9945) 潤泰新、(3037) 欣興、(2449) 京元電子、(2542) 興富發,"[['投信', '賣', '3連續日賣']]"
0,20191225_1101,◆投信連續3日買超個股投信連續 3 日買超個股1. 投信連續買超 3 日的股票(1605) 華新、(1102) 亞泥、(2027) 大成鋼、(2492) 華新科、(2324) 仁寶2. 投信連續買超 2 日的股票(1605) 華新、(1102) 亞泥、(2027) 大成鋼、(2492) 華新科、(2324) 仁寶3. 投信當日 (24) 買超的股票(1605) 華新、(1102) 亞泥、(2027) 大成鋼、(2492) 華新科、(2324) 仁寶,[]
0,20191225_1102,◆外資連續5日賣超個股外資連續 5 日賣超個股1. 外資連續賣超 5 日的股票(2330) 台積電、(3481) 群創、(1605) 華新、(00637L) 元大滬深 300 正 2、(2337) 旺宏2. 外資連續賣超 4 日的股票(3481) 群創、(2330) 台積電、(1605) 華新、(00637L) 元大滬深 300 正 2、(2337) 旺宏3. 外資連續賣超 3 日的股票(1605) 華新、(00637L) 元大滬深 300 正 2、(1102) 亞泥、(2330) 台積電、(2618) 長榮航4. 外資連續賣超 2 日的股票(1605) 華新、(00637L) 元大滬深 300 正 2、(3481) 群創、(1102) 亞泥、(2027) 大成鋼5. 外資當日 (24) 賣超的股票(00637L) 元大滬深 300 正 2、(1605) 華新、(3481) 群創、(1102) 亞泥、(2027) 大成鋼,"[['外資', '賣', '2股票'], ['5連續日賣', '超', '外資賣超']]"
0,20191225_1103,◆外資連續5日買超個股外資連續 5 日買超個股1. 外資連續買超 5 日的股票(2409) 友達、(2891) 中信金、(2317) 鴻海、(2352) 佳世達、(2888) 新光金2. 外資連續買超 4 日的股票(2409) 友達、(2352) 佳世達、(2891) 中信金、(2344) 華邦電、(9945) 潤泰新3. 外資連續買超 3 日的股票(2409) 友達、(2352) 佳世達、(2891) 中信金、(2885) 元大金、(2884) 玉山金4. 外資連續買超 2 日的股票(2409) 友達、(2352) 佳世達、(2884) 玉山金、(9945) 潤泰新、(2542) 興富發5. 外資當日 (24) 買超的股票(2352) 佳世達、(3037) 欣興、(2409) 友達、(2492) 華新科、(9945) 潤泰新,[]
0,20191225_1104,昆山奇美增資完成改選董事 誠美材喪失控制權偏光板廠誠美材 ()24 日發布重訊表示，因應子公司昆山奇美增資後增加董事席次，重新選任，新任董事長由昆山奇美董事黃源擔任，副董事長則由誠美材董事長何昭陽擔任，也宣告誠美材喪失昆山奇美控制權，另外，為發展偏光板業務，昆山奇美擬投資 4 億元 (約 17.2 億元) 在安徽合肥，設置全資子公司。誠美材公告表示，因應昆山奇美增資，董事席次由 5 席增加至 7 席，故重新選任，新任 2 席董事為亭林 (昆山) 智能製造合夥人顧劍玉、合肥產投資本副總經理李中亞。昆山奇美董事長也由昆山奇美董事黃源新任，原董事長何昭陽則轉任副董事長，總經理則由昆山奇美常務副總經理嚴兵華接任。因應偏光板相關業務擴大，誠美材也代昆山奇美公告，將在安徽合肥設立全資子公司，暫名為安徽合美材，投資金額則為 4 億元 (約 17.2 億元)，並向中國建設銀行、中國銀行申請 13.3 億元 (約 57.19 億元) 銀團貸款，用於置換台灣銀團美元貸款和二號線建設。據了解，昆山奇美增資案完成後，昆山奇美股權結構方面，誠美材仍有 38.4% 持股，雖為最大股東，但已喪失控制權，亭林 (昆山) 智能製造則有 37.2% 股權，浙江任遠、合肥產投則分別有 9.4%、15% 股權。,"[['誠美材', '喪失', '崑山奇美控制權'], ['崑山奇美', '擬', '設置全資子公司'], ['誠美材公告', '表示', '董事增加'], ['董事', '增加至', '7席'], ['席董事', '爲', '製造合夥人顧劍玉'], ['原董事長何昭陽', '轉任', '副董事長'], ['誠美材', '代', '崑山奇美公告'], ['投資金額', '爲', '13.3億元億元'], ['誠美材', '有', ' 持股'], ['智能製造', '有', '37.2%股權'], ['則', '有', '15%股權']]"
0,20191224_1105,金融三業今年增資1621.12億元 銀行業占過半金管會今 (24) 日公布銀行業、保險業、證券期貨業增資情況，今 (2019) 年增資金額已達 1621.12 億元，其中，銀行業就增資達 819 億元，占比超過一半。根據銀行局統計，銀行業今年以來迄今，共有 6 家現金增資，金額達 204 億元，而盈餘轉增資則有 21 家，金額達 615 億元，合計已達 819 億元，已超越去年全年銀行的增資金額、580 億元 (8 家現金增資 239 億元、15 家盈餘轉增資 341 億元)。至於保險業部份，截至今年 12 月 24 日為止，共有 6 家完成現金增資，金額達 605 億元，盈餘轉增資則有 1 家，金額達 1.12 億元，合計已達 606.12 億元；另外，元大人壽擬現金增資 140 億元則尚未完成。去年受全球股災影響，壽險業大舉增資，去年有 6 家壽險公司現金增資 763.95 億元，另有 5 家盈餘轉增資 259 億元，合計 1022.95 億元，今年壽險業增資動作明顯緩和。而證券期貨業部分，至今年 12 月 24 日為止，現增金額只有 2.22 億元，主要是來自投信投顧業，而盈餘轉增資則有 53.78 億元，皆來自證券商，累計增資金額達 56 億元。,"[['增資1621.12億元銀行業', '公佈', '證券期貨業增資情況'], ['增資金額', '達', '1621.12億元'], ['就增資', '達', '億元'], ['佔比', '超過', '一半'], ['銀行業', '共有', '6家現金增資'], ['金額', '達', '204億元'], ['盈餘轉增資則', '有', '21家'], ['6家', '完成', '現金增資'], ['金額', '達', '億元605'], ['盈餘轉增資則', '有', '1家'], ['金額', '達', '1.12億元'], ['元大人', '擬', '現金增資'], ['壽', '擬', '現金增資'], ['去年', '有', '現金增資763.95億元'], ['增金額', '只有', '2.22億元'], ['增資金額', '達', '56億元']]"
0,20191224_1106,金管會抄底金控家族 金控大股東持股透明化 明年7月全都露由於國際洗錢防治機構高度重視「最終實質受益人」，加上國內家族化金控股東不透明，無法看出誰是具控制力股東的「關係人」，因此，金管會主委顧立雄上任後，積極推動金控股權結構透明化，銀行局將於明 (25) 日正式發布申報注意事項，並給予半年緩衝期，訂 2020 年 7 月 1 日正式上路。金管會今年初邀 18 家金控或銀行董總及大股東開會，徵詢對列報實質受益人的意見，獲得理解且表達願意配合後，就開始著手規劃「股東持股透明行動方案」，要求大股東申報持股時，須將實質受益人或最終控制權人一併列入申報內容。金管會表示，經參考「金融機構防制洗錢辦法」有關實質受益人的規定，增訂同一人、同一關係人或第三人為法人時，將相關實質受益人或最終控制權人併列入申報範圍。包括五種持股模式，1、直接間接持股逾 25% 自然人；2、透過委任、契約等各種方式行使控制權的自然人，如透過家臣或經理人去控制金控或銀行；3、表面看不出是前二項，甚至無持股，但透過層層安排可控制具決策權之人；4、透過銀行信託專戶如員工持股信託、員工福委會有效控制該帳戶之最終決策人；5、是透過各式財團法人、信託架構來有效控制。同時，參考「金融機構防制洗錢辦法」有關豁免適用辨識實質受益人的規定，及考量金管會對法人股東背後實質受益人、或最終控制權人的監理需求範圍，若具備一定透明度身份的法人，如我國政府機關、公營事業、外國政府機關、於國外掛牌並依掛牌所在地規定Ｍ揭露其主要股東的股票上市、上櫃公司及其子公司等，增訂申報持股時，免將實質受益人或最終控制權人併列入申報。金管會強調，本次修正目的是為將金融機構的股權管理，納入實質受益人的觀念，落實股權透明化，要求已依本注意事項申報，且生效日同一人或同一關係人單獨、共同或合計持股仍超過 5% 的股東重新申報，並為利申報者充分檢視自身股權情形，故給予緩衝期。簡單來說，依據金控法 16 條或銀行法 25 條規定，同一人或同一關係人共同持有金控公司表決權股份超過 5%，要向金管會申報；累計增減 1 個百分點，也要向金管會申報，以確保股權透明化與股東適格性。至於持股逾 10%，也要事先向金管會申請核准，若未申報或未核准，超過部分無表決權，並命令限期內處份，且將開罰 200~1000 萬元不等罰鍰。據金管會日前資料顯示，金控大股東持股不到 10% 僅中信金、開發金、玉山金和台新金，而台新金大股東吳家已申報握有台新金超過 10%，其餘至今尚未有再超過 10% 者。,"[['持股透明化', '露由於', '防治機構重視實質受益人'], ['防治機構', '重視', '實質受益人'], ['誰', '是', '具股東關係人'], ['銀行局', '發佈', '注意事項'], ['金管會', '邀', '18家金控'], ['金管會', '表示', '並列入申報範圍'], ['金融機構', '防制', '洗錢'], ['金融機構', '防制', '洗錢'], ['同一人', '第三人爲', '法人'], ['各種方式', '行使', '控制權'], ['行使控制權自然人', '控制', '金控'], ['員工持股信託', '控制', '決策人'], ['金融機構', '防制', '洗錢'], ['金融機構', '防制', '洗錢'], ['」', '有關', '實質受益人'], ['有關', '豁免', '適用'], ['，', '增訂', '申報持股'], ['會', '強調', '給予緩衝期'], ['修正目的', '是', '爲'], ['仍', '超過', ' 5%'], ['同一人', '持有', '金控公司表決權'], ['臺新金', '超過', '10%'], ['其餘', '有', '超過10%者'], ['再', '超過', '10%']]"
0,20191224_1107,浩鼎胰臟癌新藥獲孤兒藥資格 未來將具專賣保護等優勢浩鼎 () 今 (24) 日公告，Globo H 抗體小分子藥物複合體 OBI-999，適應症為胰臟癌，獲美國 FDA 審核通過「孤兒藥」資格，OBI-999 預計 2 年內完成一期人體臨床試驗，法人指出，新藥獲得「孤兒藥」資格，在未來展開銷售後，將有專賣保護等優勢。浩鼎指出，Globo H 抗體小分子藥物複合體 OBI-999，用於癌症治療，可阻止腫瘤細胞分裂，且達到去除腫瘤細胞的目的。浩鼎表示，據 IQVIA 研究報告指出，全球整體抗腫瘤用藥市場規模達 1500 億美元，浩鼎研發的 OBI-999 處於臨床試驗階段，適應症的開發也以未被滿足的醫療需求為主要目標。美國 FDA 針對病患數少於 20 萬、具有潛力治療罕見疾病的藥物，給予「孤兒藥」資格，藥物認定後，可獲美國主管機關行政協助、市場專賣保護期等優惠措施。,"[['浩鼎胰臟癌新藥', '獲', '孤兒藥'], ['浩鼎胰臟癌新藥', '獲', '孤兒藥'], ['未來資格', '將具', ' 日公告'], ['適應症', '爲', '胰臟癌'], ['法人', '指出', '有等專賣優勢'], ['新藥', '獲得', '孤兒藥資格'], ['有等專賣優勢', '專賣', '保護'], ['浩鼎', '指出', '小分子藥物複合體OBI-999用於癌症治療'], ['小分子藥物複合體OBI-999', '用於', '癌症治療'], ['浩鼎', '表示', '市場規模達1500億美元'], ['市場規模', '達', '1500億美元'], ['浩鼎研發OBI-999', '處於', '試驗階段'], ['美國', '少於', '藥物']]"
0,20191224_1108,正文斥資3億元強化越南布局 新產能明年Q2到位網通業者正文 () 今 (24) 日宣布，擬增資越南子公司 GEMTEK VIETNAM CORPORATION LIMITED 1000 萬美元 (約 3 億元)，預計明年上半年越南廠將再導入 3 條新產線。正文表示，此次增資，是為因應明年成長及滿足客戶需求，增資資金將用來擴充產線及充實營運資金。正文今年為降低美中貿易戰影響，前進越南設廠，目前在當地已有 6 條生產線，預計明年第 2 季將再新增另外 3 條產線，屆時可望取代過半中國產能，據悉，正文越南新廠規劃最大產能可安裝 12-13 條生產線。且隨產線調整可望在明年第 2 季告段落，加上歐系新客戶加入、Wi-Fi 6、IoT、5G 等相關新產品陸續量產，法人看好，正文明年第 2 季起營運可望顯著回溫，加上產品組合轉佳、產線學習曲線逐漸成熟，也有助改善毛利率表現。,"[['3億元', '強化', '越南佈局'], ['網通業者正文', '宣佈', '3億元萬美元'], ['，', '擬', '增資'], ['越南廠', '導入', '3條新產線'], ['正文', '表示', '此次增資是因'], ['此次增資', '是', '因'], ['增資資金', '用來', '擴充產線'], ['正文', '前進', '越南'], ['最大產能', '安裝', '條生產線']]"
0,20191224_1109,世紀鋼風電業務進入收割期 明年出貨爆發營收估倍增世紀鋼 () 今 (24) 日召開法說會，公司透露，離岸風電今年陸續貢獻營收，預計明年規模將持續放大，且毛利率遠優於傳統鋼構，法人估，世紀鋼明年營收可望倍增，毛利率上看 2 成。世紀鋼目前離岸風場水下基礎訂單，包括沃旭能源、哥本哈根基礎建設基金 (CIP) 及達德能源 (wpd) 等，其中 CIP 訂單金額高達 165 億元，預計明年下半年起陸續出貨，風電業務占比將由今年的 3 成，一舉跳增至 7 成。至於傳統鋼構訂單方面，世紀鋼透露，目前在手訂單能見度到 2021 年，總金額約 30 億元，除公共工程外，近期電子業擴產潮，還有營建工程增加，也帶動鋼構需求、價格逐步走揚。法人則預估，世紀鋼明年在離岸風電水下基礎建設出貨增長下，全年營收將倍增，上看 70 億元，且水下基礎建設毛利遠高於傳統鋼構，世紀鋼明年毛利率也可望達 2 成以上。,"[['公司', '透露', '貢獻營收預計明年規模放大'], ['貢獻營收', '預計', '明年規模放大'], ['毛利率', '優於', '傳統鋼構'], ['基礎訂單', '包括', '等沃旭能源'], ['訂單金額', '高達', '165億元'], ['法人', '預估', '全年營收倍增'], ['基礎建設毛利', '高於', '傳統鋼構'], ['世紀鋼明年毛利率', '望達', '2成以上']]"
0,20191224_1110,新世紀債權債務協商案 獲兆豐商銀等11家債權銀行通過LED 晶粒廠新世紀 () 今(24)日公告，債權債務協商案獲兆豐商銀等 11 家債權銀行，依多數決同意通過，將依協商會議結論，執行相關作業，並感謝銀行團支持，得以快速完成此次協商案。新世紀表示，已接獲兆豐商銀永康分行通知，相關債權債務協商會議結論，在兼顧維繫公司正常營運、確保銀行債權及支持政府產業政策，並於多數銀行認同下，獲得全體債權金融機構三分之二以上同意債權債務協商內容。新世紀表示，感謝銀行團支持，得以快速完成通過此次協商議案，將依據協商會議結論，執行相關作業。新世紀今年前 3 季稅後虧損 2.26 億元，較去年同期擴大，每股虧損 3.23 元。,"[['24日公告', '同意', '通過'], ['新世紀', '表示', '接獲兆豐商銀永康分行通知'], ['新世紀', '表示', '感謝銀行團支持'], ['每股', '虧損', '3.23元']]"
0,20191224_1111,柯拔希：台商回流的國產設備需求 機械業已有感台灣機械工業同業公會理事長柯拔希今 (24) 日表示，美中貿易戰今年雖對機械業造成衝擊，但長期來看，工廠轉移將會帶動剛性需求，機械業將從中受惠，且近來已可感受到，台商回台投資帶動的國產設備需求。經濟部與工研院、資策會、機械公會等，共同打造公版「智慧機械雲」平台，協助機械業智慧轉型。柯拔希指出，今年產業雖受美中貿易戰衝擊，但時間拉長來看，廠商佈局第二生產基地的需求推升下，世界工廠正在轉移，而工廠轉移會帶動剛性需求，機械業將可從中受益。柯拔希認為，雖然這段時間較為辛苦，但明天太陽還是會出來，機械業正在等待千載難逢的機會，且這波台商回台投資，在購買國產設備上，機械業已有感。為達成 2025 年機械業 2 兆產值目標，經濟部與工研院、資策會、機械公會等，攜手打造公版「智慧機械雲」平台，柯拔希表示，機械雲是機械業走向智慧製造的關鍵，可讓台灣機械業再次偉大，也能吸引全球廠商向台廠採購，是千載難逢商機。,"[[' 日', '表示', '機械業受惠'], ['美中貿易戰', '造成', '衝擊'], ['轉移', '帶動', '剛性需求'], ['臺商', '臺', '國產設備需求'], ['經濟部', '打造', '機械雲平臺'], ['柯拔希', '指出', '世界工廠轉移'], ['工廠轉移', '帶動', '剛性需求'], ['柯拔希', '認爲', '太陽出來'], ['機械業', '等待', '千載難逢機會'], ['經濟部', '打造', '智慧機械雲平臺'], ['柯拔希', '表示', '機械雲是機械業走向智慧關鍵'], ['機械雲', '是', '機械業走向智慧關鍵'], ['機械業', '走向', '智慧'], ['機械業', '走向', '智慧']]"
0,20191224_1112,受惠台商回流、外資投入 北市商辦空置率創新低據《CNBC》報導，受到台商回流效應、以及國外科技大廠的投資，刺激台北市商辦市場的需求大增，造成供不應求的現象，不僅空置率降至 3%，租金更是持續攀升。雖然近期中美已達成第一階段協議，但兩國之間的貿易不確定性，預期仍將延續至明年，因此，預估明年北市商辦的租金價格，將會進一步的上漲。仲量聯行總經理趙正義 (Tony Chao) 表示，企業對於台北 A 級商辦的需求大幅增加，但由於新的商辦大樓供給有限，使得空置率由 3 年前的 10%，大幅降至 3%。趙正義預估，2020 年的北市 A 級商辦空置率，將會再下降 1%。過去幾 10 年來，為了取得低廉的勞工成本，使台商紛紛前往大陸設廠，但是，近年來由於中國的人工成本上升、以及美國對中國出口商品的關稅加徵，使得廠商的獲利能力萎縮，再加上台灣政府所提供的各項誘因，促使台商回流效應湧現，並造成商辦供不應求的現象。台北 A 級商辦的租金價格，在 2018 年增長了 3% 達每坪 2728 元，而 2019 年第 3 季的租金價格，則是進一步上漲了 1.8%。除了台商回流效應之外，外資的投入，亦為刺激北市商辦租金價格攀漲的原因之一，許多國外科技大廠，由於看好台灣的科技實力、以及在產業供應鏈中的重要性，紛紛將資金投入台灣。今年截至 11 月為止，台灣吸引了 102 億美元的外資投入，較 2018 年增長了 20%。除此之外，今年 10 月時，投審會核准了 Google 匯入 8.5 億美元至台灣，用於擴大資料中心。另外，於 4 月時，Facebook 亦設立了台灣辦公室。由於台商回流效應持續蔓延，以及外資投入的增加，預期將進一步推升北市商辦的需求及租金價格。,"[['創新低據CNBC報導', '受到', '迴流效應'], ['近期中美', '達成', '第一階段協議'], ['預期', '延續至', '明年'], [' Tony Chao', '表示', '使得'], ['趙正義', '預估', '級商辦空置率下降'], ['租金價格', '增長', '每坪2728元'], ['租金價格', '是', '上漲'], ['爲', '刺激', '租金價格攀漲原因'], ['科技大廠', '投入', '臺灣'], ['臺灣', '吸引', '外資投入'], ['投審會', '覈准', 'Google匯入至臺灣'], ['Google', '匯入', '至臺灣'], ['Facebook', '設立', '臺灣辦公室']]"
0,20191224_1113,"手機需求點火 大立光的接班人呼之欲出2019 年鄰近結尾，美中貿易衝突如今已踏出和解的第一步，利率問題也在今年美國聯準會 (Fed) 三度降息後得到化解，市場投資人對於明年普遍抱持較為樂觀的態度，而智慧型手機作為全球最夯的消費品之一，近年來的成長可謂是可圈可點。以蘋果為首的各大手機品牌除了自身股價飆漲之外，其供應鏈也隨著需求的增長雞犬升天。手機多鏡頭趨勢確立，大立光 ()、玉晶光 () 等光學股股價表現轉強，大立光重新站上 5,000 元大關；玉晶光也攻上 500 元，一度刷新歷史新高價。萬寶週刊陳子榕分析師指出，大立光在鏡頭領域具有如同台積電的產業龍頭地位，據悉，隨著多鏡頭趨勢確立，市場需求日增，大立光可能開始挑單，將使部分訂單外溢到玉晶光等光學股，帶旺整體鏡頭廠。一線光學鏡頭廠漲勢凌厲，也帶動二線光學場近期走出補漲行情，車用鏡頭與二線光學鏡頭股題材豐富，包括近期特斯拉股價創高、5G 趨勢確立使多鏡頭高度成長，都讓二線光學鏡頭廠利基應用大幅提升，整體光學族群可望再走出一段行情。二線光學鏡頭廠亞光 () 有望受惠華為潛望式機型出貨爆增，營收顯著成長，亞光股價 23 日一度爆量強拉漲停，創四個月以來新高，帶動新鉅科 ()、先進光 ()、揚明光 () 等二線光學股同步向上走高。亞光獨家供貨的光折射器件包括菱鏡 (Prism) 與鏡子 (Mirror)，是華為 P40 Pro 光學變焦規格大幅升級的關鍵；亞光預計 2020 上半年為華為潛望式長焦鏡頭擴產約 2.5～3.5 倍，預估亞光營收可望顯著增加到 26 ～28 億元。除了在手機鏡頭供應發酵，亞光近期更獨家獲得特斯拉車載鏡頭訂單，並打入德國雙 B 大廠供應鏈，更吸引大陸車用模組龍頭廠尋求合作。目前車載鏡頭分別於台灣廠及大陸廠生產，由於車載鏡頭市場價格競爭較激烈，亞光藉著自有玻璃鏡片產能，一來降低生產成本，二來聚焦高階車用鏡頭應用市場發展，持續推陳出新，提升車載鏡頭業務營收比重。萬寶週刊陳子榕分析師指出，亞光過去布局 G+P 玻璃塑膠鏡頭多年，成果逐步發酵，隨著特斯拉等車廠在車載鏡頭需求穩定下，加上光通訊與掃地機器人等產品出貨維持水準，其毛利率、營益率皆呈現連續三個季度的成長，而潛望鏡中的稜鏡模組、小前鏡頭陸續認證與出貨當中。法人分析，預期未來市場主流將為超高倍變焦，且技術難度相對前鏡頭結構來得高階，未來大量出貨將為利基產品，亞光 2020 年的成長性相當可期。更多萬寶週刊陳子榕分析師觀點 陳子榕 LINE 粉絲團搜尋 ID【@marbo777】本公司與所推介分析之個別有價證券無不當之財務利益關係 以往之績效不保證未來獲利投資人應獨立判斷  審慎評估並自負投資風險","[['手機', '需求', '點火'], ['大立光接班人', '呼之欲出', '鄰近結尾'], ['貿易衝突', '踏出', '和解第一步'], ['利率問題', '得到', '化解'], ['智慧型手機', '作爲', '夯消費品之一'], ['近年來成長', '是', '可圈可點'], ['站', '上', ',000元大關'], ['玉晶光', '攻', '500元'], ['萬寶週刊陳子榕分析師', '指出', '將使'], ['大立光', '具有', '產業龍頭地位'], ['大立光具有產業龍頭地位', '如', '積電'], ['大立光', '開始', '挑單'], ['二線光學場', '走出', '補漲行情'], ['光學族羣', '走出', '一段行情'], [' )', '有望', '華爲潛望式機型出貨爆增'], ['供貨光折射器件', '包括', '菱鏡'], ['亞光', '預計', '增加'], ['亞光', '獲得', '車載鏡頭訂單'], ['車載鏡頭', '於', '臺灣廠生產'], ['萬寶週刊陳子榕分析師', '指出', '成果發酵'], ['其毛利率', '呈現', '三個季度成長'], ['鏡頭結構', '來得', '高階'], ['個別有價證券', '無', '財務利益關係'], ['以往績效', '保證', '獲利投資人']]"
